title,content,rating,username,genres
bit worse than 28 days later,"I hated to see that this is too typical zombie movie. It was more about zombies and war than about science and infection. Movie is unclear, confusing, negative, desperate. No clear end. Neither positive nor negative. Many twists make us question of purpose of this movie. Looks more like documentary describing war and disease outcomes. Makes us very tired and disappointed. Better beginning worse end. Overall, boring typical war zombie movie. Lacks more explanation, science, emotions, positivity. Looks like there will be no sequels. Not good to watch. Not inspirational or motivational.",6.0,Anonymous,Horror
From Skeptic to Fan,"When I first heard about a sequel to 28 Days Later, my first thought was ""Oh boy. Here comes a mess"". Then I heard that Robert Carlyle was in it and he is usually pretty picky when it comes to scripts. So I thought it had a chance. The previews looked pretty good, so I figured I'd take a chance. If you get the chance to see 28 Weeks Later, see it. As far as sequels go, it's surprisingly good. Carlisle is quite good as always, but I was surprised at the quality of acting from those around him. The kids in this movie are great, especially Imogen Poots who eats up the camera. While the attack sequences felt a little choppy, the script, the cinematography, and the story more than made up for it. The possibility for a sequel is there, and if treated like this one was, would be worth a watch as well. But a tip of the cap to everyone involved with this one. Nicely done. You impressed a skeptic.",8.0,Anonymous,Horror
Quality horror zombie movie,"After watching the original film 28 Days Later several years ago and enjoying parts of that, decided in watching the follow up. As a whole this sequel remains similar to the original but they added in a few American characters. This does feel a little more Hollywood, but that doesn't necessarily mean it suffers.The new characters here are quite more intriguing and the plot extends a little more. There are also a few more horror scares. This film does feel more violent where we see more gore. Although the ending was predictable it was enjoyable.Jeremy Renner in one of his earlier roles shines and steals his scenes. His presence makes this film a slight level above the original. Another thing is the tone is more suspenseful.",7.0,Anonymous,Horror
Average Film,"Please understand that I am a fan of horror films, and am often annoyed at how they often appear to be flamed, purely as they are part of the horror genre. However, I think it is highly debatable if 28 weeks later is a horror film at all, or actually an action film. There is much less suspense in 28 days as opposed to 28 weeks, which appears to have been dropped in favour of sporadic moments which make you jump (only one of which actually succeeded with me). Additionally, the characters appear less fulfilled in 28 weeks than in its predecessor, although the concept of following a family, with all of the issues this creates, was a good one. The infected themselves also do the film well, with very good acting and actions, vastly superior to those in other zombie films. The film is however let down by the main cast, which feel under developed, and often not well acted. Additionally, the plot was weak, and although some ideas (around the start of the film) were very good, they were rapidly brushed over in favour of lots of running from the latter half of the film onwards. It is however, a zombie film at heart, and for fans of the genre, is well worth a watch, despite not meeting the bar set by 28 days, it holds its own within the zombie genre, and is as such, worth a look.",6.0,Anonymous,Horror
"On par with the first one, but for different reasons.","Coming off my rewatch of the first one, I had to rewatch the second. First of all, I didn't remember most of it; this lack of lasting impression is already telling. It feels and looks like a more polished movie than the original as they probably had more budget and it shows. Similarly to the first one, it starts strong and just fizzles out along the way. The first one had some original elements in the Direction but poor choices in the scenario which I feel like it is the opposite here. And while the acting overall feels a bit better this time around, it still has issues at times. All in all, as uneven as the first movie in different ways.",6.0,Anonymous,Horror
Best film ever!!!,"This was by one of the best films ever. Now i will admit at first i was like so many of you, didn't like the idea of America saving the day for us and all the rest of it and i may of even said it was going to be crap, but man was i wrong. It was by far one of the most brutal, sick, shocking, scary, and so great you can't even explain it in words all rolled into one giant monster of a movie.People say that the first five minutes of a film set's up the tone for the whole movie and i can honestly say it did, it was awesome.Now I'm not going to give away key pieces of the story but when a film maker has the gut's to not go by Hollywood's rules and not make the film a happy ending and instead make it totally shocking the i take my hat off to them (that's if i was wearing one)All I'm going to say is if you haven't watched the movie already watch it and if you have let me know what you thought!",10.0,Anonymous,Horror
"Good idea, lackluster execution","I like the outline of the plot. Also the movie at least at times gives you back the feeling of the 1st one when the same music is playing.Await new characters and a bigger budget for more special effects and overall better production.Unfortunately there are some plotholes or just not very well written parts, which they could've avoided very easily, but which play a big role, so that's annoying.The movie does have good parts, most of the cast does fine and '28 Weeks Later' is watchable, but it's not as great as it could've been.",6.0,Anonymous,Horror
A Tense Sequel With a Few Bumps Along the Way,"""28 Weeks Later"" brings the intensity of its predecessor back in full force-but with a few twists and turns that, for me, weren't entirely smooth. The film kicks off strong with the chaos of the initial outbreak, which immediately sucks you into its nerve-wracking world. The whole setting of post-apocalypse London is still chillingly effective, and I was hooked by the uncertainty and the sheer brutality of the infected.One character I really liked was Tammy-her tough yet vulnerable nature made her stand out as someone who was trying to hold onto her humanity, despite the madness around her. The relationship between her and her brother Andy had a decent emotional layer that helped ground the chaos. But Andy? Ugh, he irritated me a bit with his decisions-though I get the whole ""desperate situations make people act out of character"" thing, I couldn't help but wonder if he made some pretty dumb choices that just pushed the plot into unnecessarily frustrating directions.The action sequences are top-notch, no complaints there. The sense of dread is maintained beautifully through pacing, and the infected are still terrifying. But where it stumbles a bit is in some of the plot contrivances-there are moments where things feel a little too convenient, or where characters' decisions don't quite make sense in the grand scheme. It's one of those movies where you start questioning characters' motivations a bit too much, which kind of breaks the immersion.What really worked for me, though, was the ending. It had just the right amount of punch to it-definitely left me thinking long after the credits rolled. I think that's what keeps the film from being just another ""zombie flick""-it offers something with a bit more depth when you look at the broader implications. It's not perfect, but it gets points for atmosphere and for keeping things tense enough to make you want to look away but somehow keep watching.",7.0,Anonymous,Horror
Grabbed me by my nostrils and never let go...,"Well, as a mild fan of the first movie, I was quite sure what to expect with this one. I was surprised to find that the movie kept me on the edge of my seat the entire duration. I honestly have nothing bad to say about this movie which is surprising because I always have something bad to say about a movie. The acting was absolutely stellar, the overall intensity of the movie never let up, it was just one gigantic adrenaline rush from start to finish. A few good moral points are brought into question without the stench of cheese being detectable. Whoever wrote this film new what they were doing. A nice change actually. Go and see this movie. You will not be disappointed. I paid full price at a more expensive theater and would gladly pay it again. Thank you Hollywood.",10.0,Anonymous,Horror
PLOT WAS DECENT.,The movie was good. I don't like how the kids were main characters but the action was good and the plot was decent.,7.0,Anonymous,Horror
"a sequel we didn't need, but wasn't terrible.","As far as Horror movies go I usually stay away from sequels etc as they rarely live up to their expectations and this was no exception. I did expect gore and being completely honest I was hoping for a bit of story line that didn't fall into the cliché category, but I was wrong on the second one. If you liked the first movie then I do not see the point in spoiling your love by watching this movie. If you liked the first one, but still want to give it a chance due to the actors in the cast then go ahead, but be prepared to face some very bad acting. My score was given solely on everything summed up together.",6.0,Anonymous,Horror
fast paced thrill ride with a heart,"I loved this movie, it was fast paced and filled with action, but not only that, you really feel for all of the characters. I wasn't a huge fan of the first film but the second film really validated it for me. There's some awesome action that includes not only guns and poisonous gas followed by flame throwers but also an air attack and a helicopter tearing a crowd of infected to shreds.And the best part are those sudden flashes of horror when you aren't expecting it,(I jumped a few times). It may be the fact that I'm an American whose served in the US Air Force, but I really loved how they brought the US troops into Britian to help maintaine order. You are so unaware of any distinction between the two cultures because you're so focused on the human factors, no one wants to die no matter where you're from.I see a lot of movies and I'm usually a skeptic, but I found myself really loving this film. I saw it twice today!",9.0,Anonymous,Horror
Built well upon the first!,"It's quite impressive how the sequel managed to amp up the action with an abundance of guns and explosions, all while staying true to the tone set by the first movie. It was just as gripping and effective as a zombie horror piece.The sound design is absolutely phenomenal, and even though the editing can be a bit chaotic at times, it alleviates the suspense.However, the character development is where I feel it fell short to some extent. Having talented actors like Elba, Renner, and Byrne, only to not capitalise on their potential and deliver well-rounded characters, feels like nothing but a missed opportunity to me.",7.0,Anonymous,Horror
Good sequel with some minor flaws.,"28 Weeks Later follows up on Danny Boyle's classic superbly. More action, Check. More thrills, Check. Eerie atmosphere, Check. Gripping plot, Check. Terror and suspense, Check. Gore a-plenty with blood, Check. Everything you loved about the first film is cranked up a notch, but not too much that it becomes overbearing. The many parallels between this movie and current events are vaguely sprinkled throughout: giving more realism throughout. However, there's not enough character development as the first one had and the dialog is a little flat and forced but still rockin' nonetheless. 28 Weeks Later serves up another delicious dish of post-apocalyptic survivalist mutant mayhem. Check it out!!! I smell a sequel.",9.0,Anonymous,Horror
Good film,"28 days later is at war with Shaun of the dead for my favourite zombie movie (yes I know they aren't zombies, but they may aswell be) and although I don't think that 28 weeks later is as good, it still holds up in its own way
The film is good in different ways from its predecessor, there is a lot more spectacle in this one if that's what you are looking for. But I find the more personal and human approach of 28 days personally, it makes the surroundings and threats a lot more disturbing honestly
That's probably why the opening is the best part of 28 weeks because it is absolutely terrifying. In fact I would consider it one of the best moving openings (at least in a horror) along with others like Jaws. It's also better than the already great opening of 28 daysI can't say which to watch. In my opinion the first is better, but just like alien and aliens, it's apples and oranges. It is a unique franchise that I would still like to see a third entry to.",7.0,Anonymous,Horror
A Fine Follow Up!,"Adrenalized charged follow up to ""28 Days Later, ""28 Weeks Later"" may not have the formers stark eeriness of waking up to a empty London, or at least what is thought as a empty London, but it more than makes up for it in action. It more than makes up for it in terror. It may not have the character development of the former, but it's storyline of a family tore apart from the ""Rage"" virus is definitely heartening & angering at the same time. It's story of the bond of a brother & sister is very moving, well acted & executed.Yes, the two movies are different, but in many ways equal. Danny Boyle is not at the directors helm for this one, but new director Juan Carlos Fresnadillo infuses the film with his own brand of maniacal mayhem. The editing is fasted paced, more so than the first. The storyline of the US Military overseeing the survivors of the virus is a interesting & logical one. The sense of fear & terror are well done, especially the subway scene.All in all this film stands on it's own very well as a major contribution to it's genre. When all it's parts are summed up, it's a great sequel, though not quite as profound as ""28 Days Later,"" nor anywhere as complex in character development, hence just a tad inferior, but in a over-saturated genre of Zombies & Zombie like humans, ""28 Weeks Later"" is a highly recommended terror fest!",8.0,Anonymous,Horror
Could be better,"Undeniable its a very good movie,very good directed and the music also but i dont get it. How the americans came to save london? Isnt supposed i think, and in fact that uk, has bases in giblaltar,malta cyprus etc? Untouchbale? They could have sent reinforcments. Why they should involve the americans? They could have sent forces from that bases,lets say if london was lost,by zombies.But anyway,very nice performances. Good scenario and action scenes.It could be more more better with more time,more action scenes.Jerrmy renner was very good in his performance and this is why bi watched that movie.",7.0,Anonymous,Horror
Weeks and Weeks,"Set six months after the events of '28 Days Later...', the rage virus is thought to be under control until another unexpected outbreak occurs in this sequel to the Danny Boyle horror film. With a plot description like that, '28 Weeks Later' might sound like a shameless copy of its predecessor, but it is actually refreshingly different during its first half with helicopter shots of a deserted London in ruins and lots of bureaucratic issues as various soldiers try to control the re-population of the city. Robert Carlyle is also saddled with a curiously morally ambiguous main character who we see abandon his wife early on in a desperate attempt to survive a zombie attack. The second half of the film is nowhere near as solid its the build-up though as the movie descends into mindless zombie attacks that never really resonate that much since Carlyle's kids here are never quite as interesting or well developed as the main characters of the original movie. The ending certainly leaves a bit to think about in terms of how our humanity may end up only making things worse were a zombie plague ever to come our way, though the way it paves way for a potential third movie to come is very unsubtle.",6.0,Anonymous,Horror
Enjoyable MOVIE,"The first part is in reaction to low rated reviews, after that i'll discus the movie, so if you've never seen it, skip that part.Before I begin I want to say a few things in reaction to some of the very low rates this movie got (like ones and two's). Please remember that it is a MOVIE, so stop comparing a movie to how things would happen in real life ! I mean come on, of course it is not realistic that they are repopulating after 2 months. But ehm, the whole virus is unrealistic as hell, so why bothering giving this movie a 1 for not being realistic?Now the movie.The movie has a constant sit-on-the-edge-of-your-seat-and-jump-up-every-now-and-then rush. Especially in the first half of the movie you will see much creepy things. The empty streets are again very effective to make it even more creepy. At some point in the movie 2 kids do plenty of odd things even a grown up would not accomplish in a life time , but that does not make the film annoying or anything. There is very much gore but it affects the movie perfectly well. It's certainly not overdone even though I'm not a huge fan of gore.The second half of the movie kind of repeats what was happening before, again with pretty odd moves on humans side, and a few clichés (Car won't start... do they have to put that in almost every movie??), but it doesn't ruin the movie.The ending is clearly made for an sequel but I thing everybody expected that even before seeing the movie (at least, I did. 28 months and then of course 28 years, I would bet on that). Anyway, the ending although made for a sequel did satisfy me.I recommend this movie for all thrill movie seekers. It's a pretty good sequel of a pretty good first movie. Oh and before I forget, good acting (for most of it). Most horror movies are all about screaming and running and although that is also added in this movie (doh), other emotions are well placed and not stretched for to long.I'm curious how everything is going to develop in the next sequel.",7.0,Anonymous,Horror
Very scary and visionary follow up,"28 Days Later was a jumpy, clever thrill ride which found a patient who woke up in an abandoned hospital and proceeded to discover a barren wasteland that was once London. It was all abandoned... that is, except for hundreds of infected people with ""Rage"", a virus which spreads through the blood in seconds and turns a person into a savage zombie. It was totally f***ing scary and completely believable.Fast forward ""28 Weeks"" after that incident, and the viewer finds themselves once again in London, only this time American soldiers have moved in and done some reconstruction, sealing off the city except one small part where survivors of the outbreak can repopulate. After a narrow and terrifying attack, a young man is reunited with his children, and with the promise of no more infection from the military, everything seems to be getting back to normal. Wrong.In a clever plot twist which I won't give away, the virus manages to sneak its way back into the hopeful community, and within a matter of minutes the horror is plaguing innocent people in the most brutal way. Gore is splashed on thick and director Juan Carlos Fresnidilla keeps the pace fast and the cinematography slick. Although the editing is choppy and incoherent in some parts, overall ""Weeks"" is captured quite brilliantly, taking on a whole new style from the masterful first. As equally scary as its predecessor and with a very effective ending, ""Weeks"" scores where the first one did on a truly scary level.",9.0,Anonymous,Horror
"WOW , welcome 2008","28 Days Later is probably my bleak out look on the future. After watching the first movie which was great I thought why not check out this one (after I did not get round to watching American Gangster). I was however pleasantly surprised with the sequel which from the trailer really looked like a badly made version of Resident Evil 2. The story picks up ...28 weeks after the first infection of the Rage virus and with the aid of the US (who for once seemed to do the right thing) but as it happens just when you thought it was safe to enter London again ! the Rage Virus returns with a vengeance! 28 Weeks Later is what a apocalyptic genre should be about , it waste no time to deal with silly little sub-plots . The action was clear and precise , with gore probably this time more than the first film . Robert Carlyle was in pure top form for his role along with all the other cast and crew members especially the 2 youngsters who impressed greatly . My only complaint is that the camera work was a little shoddy from time to time and I felt that things moved a little too quickly in some places as I would love to have seen an expansion on a few things but giving the severity of the situation I was willing to let that go. Nobody can say they are fan of Zombie/apocalyptic movies unless they have seen this movie , It easily overtakes the Resident Evil Genre and in one or two ways I liked it more than Land Of The Dead but remember this is by no means a feel good typical Hollywood movie , but having said it is thrilling and entertaining. I have also just heard that Danny Boyle has announced he wants to do a third one so I am truly looking forward to what happens next , HIGHLY RECOMMENDED!28 WEEKS LATER : 8.7 OUT OF 10IT ALL BEGINS AGAIN !",8.0,Anonymous,Horror
We're going to Wembley. Que Sera Sera.,"Sitting at the top of my alphabetical list of the films on Disney Plus, I watched ""28 Weeks Later"" having watched ""28 Days Later"" for the first time in a while, a few months earlier. That film I felt was more interesting and important now, than especially entertaining. This sequel improves visually on the original but is perhaps a more traditional zombie story.With The UK lost to the virus, the infected have control. As they begin to die of starvation, a US led NATO force establishes a strong hold in the Canary Wharf area of London. 28 Weeks later, with a proper safe zone established, UK residents begin to return home. Don (Robert Carlyle) managed to survive the attack, though had to abandon his wife Alice (Catherine McCormack) to do so. His children are among those returned to London, and quickly decide to sneak out of the safe zone and return to their family home.As I say, it's a fairly standard zombie storyline here. It's not ""humans are the worst"" so it must be ""Containment failure"" and it's not unsurprising when, for all their military confidence, the system doesn't have enough flexibility for them to actually save themselves. It's fine, but perhaps a little uninspired.The cast of this is really strong though, aside from Carlyle and McCormack, Imogen Poots is their daughter, Idris Elba, Rose Byrne, Jeremy Renner and Harold Perrineau are the key members of the US Military working in Canary Wharf. Visually the film is stronger than the original, I don't mean in terms of cinematography (nothing beats those scenes of Murphy alone in central London). But that first film was filmed on a standard definition digital camera and this uses high definition ones.Probably superior to the first film in a couple of areas, but ultimately not as important or revolutionary. I'm still waiting on ""28 Months Later"".",7.0,Anonymous,Horror
"Great Sequel, as good as original","This movie was not really a direct sequel of the first in any aspect except it takes place after the evens of the first movie. However, there are no characters from 28 Days Later in this movie, and there seems to be no mention of them either. This movie also has a different plot. In 28 Days Later, the plot was basically survival; run from the infected and find a safe place to hide. Here, it's been 28 weeks since the events of the first movie occurred, and people are now being allowed to move back to London under military supervision in order to start over again. ALso after the epidemic begins, we see a new style of survival techniques that were not in 28 Days Later. The main characters here are 2 kids whose parents were left behind during the evacuation of the country in the first film; Tammy (Imogen Poots) and Andy (Mackintosh Muggleton) come back and find their dad, Don (Robert Carlyle) alive after he abandoned his wife Alice (Catherine McCormack). We also get to meet a few soldiers here, Sgt. Doyle (Jeremy Renner), Major Scarlet (Rose Byrne), and Doyle's friend, a helicopter pilot named Flynn (Harold Perrineau). The cast is very good here, the effects are excellent and the story was very unique. This movie ties with the first on my list, fans of 28 Days Later should see this movie; 9/10.",9.0,Anonymous,Horror
"Weaker than the original, but still good","Less original than the previous film, this is a more typical zombie film, of a besieged area trying to withstand the hordes. It is well enough told, and filmed, but nothing outstanding.",7.0,Anonymous,Horror
Idiotic Kids should've died,I love movies where kids and animals are safe. But not stupid kids n stupid people. Seriously the whole movie happened because those two stupid kids. The father was stupid but everything would've been fine if the kids weren't brainless.,4.0,Anonymous,Horror
