title,content,rating,username,genres
Much better than the original,"Some really bogus reviews on this film. It's not great by any means, but it isn't boring and is thought provoking. Sure there are some leaps of faith needed to accept the plot, but not too outrageous. It certainly is better than the original in every way. The indiscriminate killing of innocents to protect the greater good is really stretched here. I mean they were shooting moving cars that obviously were not being driven by zombies. That is just stone cold murder really. Watch and decide for yourself.",7.0,Anonymous,Horror
Could have been a contender,"I watched the two ""28s"", original and sequel, back to back in one go. I enjoyed them both, but I realized something I hadn't quite figured out when I first watched this movie in cinema theaters: this second one doesn't scare me half as much as the original. There was something unique in the first movie that made it so incredibly compelling even when nothing was happening and zombies were at rest. Here, except for the incredibly well shot beginning sequence, there's an overload of violence that is predominantly graphic but not quite able to hit you viscerally as the first one did. Even Robert Carlyle, usually an excellent actor, is unconvincing where Cillian Murphy was so effective in his portrait of the survivor. Too many special effects, too many unresolved characters on the side we are never quite sure whether we should get attached to or not, like the soldier. In the original, even characters who got terminated halfway like Brendan Gleeson's Frank became full functional to the story and its emotional angles. Overall, it would have been more interesting to follow up on Jim's predicament in the first one than tell the tale of a rather unbelievable repopulating program at such short distance from the outbreak. could have been a contender...",6.0,Anonymous,Horror
The meanings,"The main interesting aspects of the film are social, sociological and psychological. It creates (with a good degree of realism) situation where the whole of British society is divided and how it might behave in such a situation. A set of moral and ethical issues is being raised where the army is dealing with contaminated groups of people. The way in which the film raises those issues is very interesting and differs from other movie. (althoutgth some similarity in that respect can be drawn with the film ""Independance Day"").Psychologically the film also manages to expose dilemmas and ethical survival choices and decisions. It shows that as other animals, humans act on self preservation instincts, but unlike animals humans are also capable of self-sacrifice; heroism for a greater good.Visually the film is valuable as it acted out and staged directly in the environment that we live in and use every day, In fact - London is the main hero of the film. (especially in 28 Days Later) There are many shots of London as we do not normally see it - Panoramic shots, but also details that we all recognise such as tube signs and buses, that majorly helps to recreate the atmosphere of a mysterious catastrophe. As each londoner inevitably ""tries on"" the outlook of the film characters and their impression on seeing our habitat like that.",6.0,Anonymous,Horror
A great sequel,"28 days later is a masterpiece, and this sequel keeps up with the standard previously set.",8.0,Anonymous,Horror
Fun though flawed sequel schlock,"28 Days Later was, passé final block aside a near ace slice of post apocalypse horror and something of a sleeper hit, leading inevitably to a sequel. Fortunately for those of us who value some level of artistic integrity, 28 Weeks Later is pretty solid stuff and nicely ballsy, albeit to flawed to really rock out or make much more than a superficial impression. It differentiates itself from the original tale by being one of destruction rather than aftermath, in this one we have a state of order and its spectacular disruption, the horror unfolding in front of us. Regrettably it also differentiates itself with absurd contrivance, the two events unleashing horror both utterly unbelievable in the realistic context in which the film sets itself. It's all the more galling because the opening sequence gives us a bleakly realistic depiction of human frailty, total contrast to the painfully irksome generic screw ups to come. The final moments fall prey to the same problem, though I kinda give them a pass on amusement value. The biggest problem aside from this is comes in the camera work which is in a few key moments of the shaky variety. This kind of fast camera, fast cutting work only tends to be effective when used by directors with a smart feeling for the kinetic and Juan Carlos Fresnadillo, though undoubtedly talented (watch Intacto kids), doesn't really have this. He is much better at more traditional means of depicting carnage though, giving us lots of nicely shot shootings and a simply magical scene of helicopter violence that had me near cheering. A decent amount of bloodshed here and it gives the film most of its kick. The rest is provided by its mirror of mass carnage to personal trauma, it is a film given to kicking happy go lucky cliché in the teeth and all the better for it, moreover it does so in a fashion that feels organic and not just a cheesy means of the writers showing off some edge. Acting is reasonable throughout, Robert Carlyle is the standout as a devoted dad, but the lovely Rose Byrne does a decent tough but tender job and Jeremy Renner gives a likable show as a good hearted soldier. There are a couple of kids key to the affair though and neither are up to much, they aren't terrible but I can comfortably say that I wanted both to die in gruesome fashion for their role in the whole debacle, but mostly to give the adults more screen mileage. Lets face it, most child actors are horrendously unsympathetic compared to their adult counterparts and almost always less talented and this is the case here. Everything bowls along pretty nicely though, nothing made me want to eat my laptop in irritation so this one gets a OK score for the good stuff, high 6/10.",6.0,Anonymous,Horror
"Frenetic, tragic and terrifying: a near-perfect horror sequel","Horror sequels are almost by definition a cheap excuse to cash in on the originals. There are exceptions, like Wes Craven's meta-horror New Nightmare or George Romero's zombie saga, but they're a rarity. Thankfully, 28 Weeks Later, the follow-up few people expected to be made, retains its predecessor's sense of fear and desperation while adding its own dramatic elements, resulting in a film that fares a lot better next to other horror continuations of 2007 such as Hostel: Part II or Saw IV.Stepping back as a director (he was busy doing Sunshine) but remaining on board as an executive producer with original writer Alex Garland, Danny Boyle found it wise to hand over 28 Weeks Later to Spanish filmmaker Juan Carlos Fresnadillo, whose feature debut Intacto was deemed good enough to trust him to do his own thing and not just another sequel. And that's exactly what he does: whereas 28 Days Later was merely about survival (with a hint of Romero-like satire of the military's excessive power), the new installment has a stronger central theme - family. In fact, the scarily intense prologue (the film's best scene, and one of the most effective opening sequences of all time), set within the time frame of the first movie, shows how the Infected, still as merciless as ever, rip apart entire families, leaving Don (Robert Carlyle), one of the few survivors, desperate over the loss of his wife Alice.28 weeks (seven moths) pass, and with the help of the US Army the Rgae virus has been completely wiped out. Britain is no longer quarantined, so Don can be reunited with his children. While they explore their new home, an American scientist (Rose Byrne) tries to determine whether there's any chance the virus might return, a possibility her military superior (Idris Elba) writes off as unlikely. Then all of a sudden Alice, seemingly immune to the disease, returns to everyone's surprise. An even worse surprise, though, is the fact that her not being infected doesn't mean she can't infect someone else. And so, before anyone can fully realize what's happened, London is once again under attack by the Infected, leaving it to Scarlet (Byrne) and a soldier named Doyle (Jeremy Renner) to save Alice and Don's children, who may have inherited their mother's resistance to the Rage virus.The film is shot almost entirely with hand-held cameras, a stylistic choice that adds to the gritty realism Fresnadillo is seeking (this emerges most clearly in the aforementioned prologue). It's not really that different from what Boyle achieved in 28 Days Later, with the notable exception of the sequel being much more fast-paced, taking full advantage of the fact that the Infected, unlike your average zombie, are quite skilled runners. That, paired with a murky cinematography and most of the movie taking place in dark, closed spaces, instills a relentless sense of dread, meaning 28 Weeks Later manages to do what few others have done before: it's every bit as scary as the original.Cast-wise, Fresnadillo has made choices as smart as those of his predecessor: Carlyle, a familiar face in Boyle's body of work, may not be as good-looking as Cillian Murphy, but what he lacks in physical appearance he makes up for in dramatic talent, giving a heartfelt portrayal that is miles away for his more famous roles (Begbie in Trainspotting above all). Byrne (who, coincidentally, also appears in Sunshine), after a few less fortunate career choices (minor roles in average stuff like Troy or Attack of the Clones), does a c ompetent job, as does Renner, with additional gravitas coming from US TV veterans Elba (The Wire) and Harold Perrineau (Oz and Lost).Overall, in a genre that is usually doomed by crappy follow-ups, 28 Weeks Later stands out as one of the better exceptions to that rule. It's artful, it's moving, and most of all, it never lets go of the fear factor.",9.0,Anonymous,Horror
Good horror film,"The 2003 State-side release of Danny Boyle's ""28 Days Later"" was advertised as being a shockful scare-fest of a movie. I didn't get around to seeing it until a few days ago and I gotta feel like that was somewhat of an embellishment on the promoters' part.When environmental terrorists attack a lab that contains diseased chimps who are infected with a ""Rage"" virus, they unwittingly let loose a plague that lays waste to England and(perhaps)the rest of society. The 28 Days later of the title cuts to a mostly abandoned London where a coma-tized bicycle courier named Jim(Cillian Murphy,effective) wakes from his stasis to find himself alone in a hospital. As he searches London for signs of life,he is rescued from raging zombies by a couple of survivalists(one of them,the lovely Naomie Harris)who he follows from place to place to keep alive. From there,he also meets a man and his daughter(Brendan Gleeson,terrific,and Megan Burns,good)and they try to find a refuge out of London-town. A recorded message of a ""paradise"" where ""salvation"" can be found is tracked by Frank(the man) on his shortwave radio.This sequel feels more like a meditation on what happens to people when they are reduced to their lowest elements. A friend of mine told me that this movie's running zombies was what inspired the zombies in the remake of ""Dawn of the Dead"",but where ""Dawn of..."" was pretty much a full-throttle action/horror hybrid from about start to finish,this film plays more like a ""What if..."" movie,with less emphasis on the creatures themselves and more on the (lucky?) survivors. There are also disturbing lessons on the nature OF survival,too.An very interesting and disturbing flick that probably sold itself wrong.",7.0,Anonymous,Horror
Better than the original,"As a big fan of zombie movies i could not wait to see this film,and after the opening sequence i was really impressed.The sad thing is that is the best part of the movie.The way in which the outbreak reacures is rather silly and most of the infected are killed after about 10 minuets which really annoyed me.The way that Don follows the group around remaining in the background goes against the actual effects of the virus and seems a bit confusing,and the rushed ending leaves you a little disappointed.This is by no means the worst 'zombie' film in the world but i believe the original was better.Hopefully they might make a prequel to explain what happened in the first 28 days rather than watch the Americans mess everything up for 2 hours.Overall it could have been a lot better!",6.0,Anonymous,Horror
28 Weeks Later.....,I thought this sequel was much better than the first and the reason for that was because of the way they Hollywooded it up. I much prefer a Hollywood action film and the way they turned this into one was brill. I think the all action approach was much better than the indie approach in the first one. Some of the scenes in this sequel were better too. For example the underground scene with the night vision was very scary and was acted very well. Actually made you worry someone was lurking in the background. Yeah a lot of plot holes but is an enjoyable film and great for action/horror fans3 1/2 out of 5 ***,7.0,Anonymous,Horror
"Great start, could have been better.","Normally I don't write reviews but having just watched 28 Days, then 28 Weeks back-to-back I thought i'd just comment that 'Weeks' is much weaker than 'Days'.I wont get into any specifics or spoilers but after watching Days and going straight into weeks the first 20 mins were great and I felt right back into the chaos of zombies...Then the kids show up and everything gets ridiculous. Check other reviews for all the major plot holes.There's some good acting, some great action, some interesting scenes... but the substance in storytelling is far far inferior than Days. In Days I actually cared what happened to the main characters. In Weeks I was cheering for a super-zombie to kill his kids by the end, and I don't think that was what was intended.6/10.",6.0,Anonymous,Horror
Really great horror from a fan that isn't into horror,"I've never been a big fan of the zombie and horror movies, but this one really takes the cake. Danny Boyle did an incredible job with his depiction of an abandoned London, fear stricken and virus plagued.This picture goes miles further than Danny Boyle's original 28 Days Later, a rare feat for a sequel. The director, Juan Carlos Fresnadillo did a wonderful job with the tone and consistency of the piece.The sense of empty space is palpable and pervades the film. It was incredible to behold what Fresnadillo did with London, how he shaped and changed it. I know that he isn't a native Londoner, but living here myself I got the feeling that he knew the city well enough to understand how it might decay, and what the dynamics of its abandonment would look like.The father played by Robert Carlyle starts as an incredibly flawed character and something about his mix of heart and error makes you understand and invest in him from the beginning.The zombies are perhaps even more frightening here because unlike the original film, the atmosphere isn't a zombie plagued one but instead a city in renewal, which makes the outbursts of violence and gore that much more shocking and contrary to the general rebuilding that many of the characters are focused on.It's amazing to watch a great genre heavy film that has the tension and depth of an art-house piece.",,Anonymous,Horror
"If you like blood and guts, this horror film is for you","(My Synopsis) 28 Weeks after the rage virus infected everyone in Great Britain, the U.S. Army inspects the city of London and announces that the city is now safe, because the virus has burnt itself out. The army begins to clean up London and brings in British refugees who were not infected. They are all quarantined on an island near the wharf in London. Don (Robert Carlyle) was able to escape the infected zombies, but his wife Alice (Catherine McCormack) became a victim of the rage. Don is reunited with his two children who were abroad on a camping trip during the outbreak. Unfortunately for the new population of London, the virus is not totally dead; it only takes one person to start the process all over again.(My Comment) If you like blood and guts, this horror film is for you. The storyline is foolish, brainless, and a little gross, but what do you expect from a B-grade horror movie. This is one horror film that will make you tired by the end of the movie. What I mean by this is that if you really get involved in the movie, you will run your heart out trying to get away from the infected zombies who sprint everywhere to their next victim. I know that I didn't want to be caught, because I jumped around in my seat, especially, at the beginning. The scene that I liked the best was the helicopter taking out the zombies; if you see the movie, you will know what I mean. The writers have set it up for a third movie, maybe 28 Months Later. (Fox Atomic, Run time 1:39, Rated R) (6/10)",6.0,Anonymous,Horror
"from days to weeks, this series doesn't age well..","this movie was not terrible but it was not great either. there was not as much character development or plot compared to the first one. it was also a little less hopeful than the first one. it was a little more Hollywood and strayed away from the independent/artsy feel (that the first one had). there were also flaws in the story line (even though there was not much of one). i will not give away the flaws, i will let you figure those out yourself. my theory is that watching movies that are bad are better than watching a movie that is just okay... because with movies that are just okay... the viewer can pick out what could be better and what could have changed. i am also a zombie movie fan (even though some consider this series not a zombie series) so i am kind of picky about how the cinematography, cheesy factors, music, plot, char. dev., etc... that are carried out.i guess i was just spoiled with the first of this series.but if you are in the mood for little story line and some blood and gore... and a not-so- practical story ... this would be the movie for you.i believe i could have waited to rent this movie vs seeing in theaters.",6.0,Anonymous,Horror
Decent,"It was OK, a good watch and definitely leaves you feeling the ""fear"". But overall like the thread on the forums says ""100 Things I learned from 28 weeks later..."" there are just some very serious plot flaws. Which helps to take the fear away after watching the film, cause it just wouldn't go down that way in real life.Regardless of the Army doing more to secure the area / last infected person. The two kids would never go out from fear of dieing like their mother and the father KNOWs that the mother MUST be infected so he would never get near her at least not until he seen blood tests etc, which would have told him she was infected anyway.Oh well, fun film tho.",7.0,Anonymous,Horror
A rare sequel that works,"Whether you like the follow-up to cult horror hit, '28 Days Later' will depend on whether you prefer 'Alien' to 'Aliens.' Producer, Danny Boyle, said that '28 Weeks Later' is to '28 Days Later' what 'Aliens' is to 'Alien.' And, I can't think of any way to sum it up better.28 Days Later, as it told the story of a plague sweeping Britain turning the population into zombies (okay, 'infected' if you want the technical term), it was dark, tense and moody. However, 28 Weeks Later goes in the other direction, being loud, brash and exciting.The action picks off when Britain is starting to be repatriated by a UN team. Of course things don't go smoothly and the human population soon finds itself at the mercy of a horde of flesh-eating, rage-infected zombies (infected). If you like your horror explosive and non-stop then you should like this. It has a good cast, good special effects and, thanks to the soundtrack, makes sure it feels like it's set in the same universe as its predecessor at all times.In fact, the only downside I can think of is that it's probably a little too short. The characters - although good - never quite get the chance to be fleshed out as they might have been. Whereas most films go on too long, this one could have done with some extra character-development to go with the excellent action.It may not be Aliens, but it is a worthy sequel in a world of endless, terrible additions to horror franchises.",9.0,Anonymous,Horror
The Tarzan Syndrome,"Juan Carlos Fresnadillo is a hack. He's another one of those mediocre, jerky camera directors who hasn't a clue how to tell a story or create tension. Worst of all he is an over-user of what I call the Tarzan Syndrome (Based on Tarzan, the Ape Man, 198) which means you don't actually see any action, just lots of fast-paced shots adding up to nothing. This boring film was really like a hour-plus Windex commercial. Every other scene had somebody putting their fingers, bloody or not, on glass. I am sure Juan has some kind of explanation for this silly device, but it got boring really fast. So did all the gore scenes, which were, in essence, identical in pace.Films like this are only fun as a game. How many scenes can you predict before they even happen? Despite the praise of some misguided critics, 28 Days was a terrible film and this is an unwatchable sequel. I won't reveal the ending, because I can't. I got through half of this film when I decided it wasn't worth my  or anyone else's  time.",,Anonymous,Horror
"Entertaining, but slightly bland","I really don't have much to say about this film. There were some really great, suspenseful moments, yeah... but it felt really uninspired. Maybe. There just doesn't seem to be a passion from the director.There's some emotion, but just barely. You get a feeling that some kind of character development is coming, but it barely does. There is some character development, but not enough. It's worse that the movie tries to be that kind of film, the kind that focuses on characters, and then just becomes an action-horror movie full of scares, though those scares are pretty great.Nevertheless, the movie, like I said, had great scares, and there's a good, haunting atmosphere to it. It's good, it's just nothing special. Check it out if you like zombie/disease type movies.",7.0,Anonymous,Horror
Brutally good!!!,"Just got back from the cinema, this will be my first post so bare with me..... and what a great film....it doesn't let up from the start with hand held camera work giving the film a hectic nervous feel to the film...... a very very gritty, fear filled film...highly enjoyable.....just beware for some gruesome scenes.... As far as comparing this to any other film, it is different to zombie films as they plod along..these DON'T, its fast and furious from the start...Robert Carlisle is as good as you would expect from a man who's career is littered with great films(and the occasional stinker, Plunkett and Maclaine!)not a usual role for but he definitely pulls it off.DEFIENTELY going to be a classicHighly recommended",7.0,Anonymous,Horror
Could have been great,"OK, I just watched this. This is not a review, just one guys opinion.Its a decent popcorn movie, but it fails to rise to the level of the original. Its a fun night at the movies, but once you watched it once there is really no reason to watch it again. It fails where the original succeeded for three reasons.Actors - the original had some of the best acting ever seen in a horror movie. There was great chemistry between Celina (sp?) and Jim and between the cab driver and his daughter. This movie has four generic bland actors in lead roles as the kids, pilot, and the medical officer. None of them are really developed beyond what I just wrote. We don't care if they die. The parents (cant spell actor names) are actually played by good actors and have chemistry between them, but are killed off early and needlessly. The guy who played the sniper is the only one who shows some character, but he cant carry the film by himself. All the deaths are pointless, seeing one good character die creates a bigger emotional impact than seeing a thousand extras mowed down by snipers/machine guns, helicopter blades, and fire bombings. This movie is like Aliens without Ripley or Newt.Director - More is really less. Hence books are always better than the movies based on them (unless the book was awful to begin with). The first movie left a lot to the imagination, we didn't see how the infection spread through London but everywhere we saw the aftermath. This movie shows everything, leaves nothing to the imagination, and the result is underwhelming despite a lot of creativity on the part of the filmmakers. Same with the shots of empty London. In 28DL we got small glimpses of deserted London that haunted us, here we see a travelogue of every single landmark in the city shot from a helicopter, it stops being cool really quickly and gets annoying.Cinematography - is also out of place, the movie apes its predecessor without understanding the purpose behind the technique, as a result action sequences are hard to discern, and you are always aware that you watching a movie cause every second the camera does some art school shot. The technique was effective in a small horror movie, it is not effective in a big budget action movie which is what this is.Its last sin is actually a result of the other three, its not scary. Between the generic actors, expensive but soulless crowd scenes, and drunken monkey camera work, we stop being concerned for the characters and are taken out of the movie, as a result we are just not scared.There are five good minutes in the movie, and its the intro. The movie would do better just to follow Don.",6.0,Anonymous,Horror
