title,content,rating,username,genres
"Continuing the story afresh,top to bottom apparently","2002's ""28 Days Later..."" was a huge hit on both sides of the Atlantic,so of course they(as in the producers,company and some of the creators)would feel compelled to make a sequel. And why not? When ""...Days..."" left off left just enough of an opening for more to this story.So it is that some seven months after the outbreak,England has been almost thoroughly ravaged by the RAge virus,but order has been restored via the U.S.Military(feeling false swelling of patriotism here),and expatriated English citizens are brought back into the country as the messes left behind are being cleaned up.A brother and sister(IMogen Poots and Mackintosh Muggleton,whose names will catch at least a few eyes strange,methinks)return from abroad and are greeted by their dad(Robert Carlyle,getting what seems to be a rare chance to recreate the easy-going everyman character that once made him famous in stuff like ""The Full Monty""),who appears to be the lone survivor of an attack in the country which counted among the casualties their mother(CAtherine McCormack,a lady I wish I saw more of in movies),but when the duo escape the quarantined,military sanctioned facilities to retrieve their stuff from their downtown London home,they find her alive. She,along with her kids are brought back to the facility,and while under observation,a remarkable(And chilling)secret is discovered by the staff medical captain(Rose Byrne,often confused for other pretty,doe-eyed actresses I bet),and it poses a double-edged sword for what is an actually more delicate situation to the public safety that what appears.I'll stop with the description to avoid any spoilers(though it's possible I might've already given some). I will say that once the show's action begins rolling,it is frenetic and emotionally very effective. Even though there's plenty of activity(And hence people active in it)it is actually somewhat sparse on characters,with the brother and sister as your main focal points and heroes. Solid,emotionally draining performances by Poots,Muggleton and Carlyle are supplemented by physical(if perhaps abbreviated)impact players such as Jeremy Renner(As one of the unit team snipers who decides to aid the kids) and Harold Perrineau(as a nervous chopper pilot on patrol). Director and co-writer Juan CArlos Freinadillo is brought in to replace Danny Boyle(who produces)and probably is fortunate to start with what can be considered a new deck of cards here,since the previous movie is treated entirely as given background effect. THat way,his direction and script(co-written by Rowan Joffe)gets the fresh treatment,neither aided nor hindered by the original. I wish I could honestly say that this show either was an improvement or a step-down from the first movie,but I'm not sure how to compare. I WILL say that this film enlightens the viewer from the first film as to the full nature of the calamity(taking it away,for the most part,from the concept of the carriers as being purely ""zombies""and more toward the concept of ""infectes""),which I think couches this in more grim and powerful reality. I guess I will say to those interested in catching this film,who hasn't seen the first movie to check ""28 Days...""(not to be confused with ""28 Days"" with Sandra Bullock),because this movie,despite being populated from almost top-to-bottom with new names,the storyline is THE most important part of both films. Like the last one,it works on a deeper level than an ordinary horror film,even if it feels like it sometimes falls into the traps(i.e. underdeveloped players,shortening of logistics to speed along action,etc.)that many films of its genre does. Well worth your rental dollars.",8.0,Anonymous,Horror
Zombies that can run.......now that's horror!,"OK OK hardcore horror fans, these are not the exact definition of ""zombies"" but with the rage virus the 'infected' in this film are showing distinct symptoms of zombie-ness. Not those stupid, bumbling ones that try and gnaw on your leg....these are fast, clever and ruthless and pretty bloody scary.I never want to give away spoilers with my comment section as I always think this jeopardises someone elses enjoyment of the film. What I will say is when you combine a helicopter and a field of zombies there is a recipe for a scene of carnage..definitely one of my favourite moments of the film! Robbie Carlyle and the chick from Braveheart put in brilliant performances and it is a gear up from 28 days later (which I feel was a film that faded somewhat near the end).A deserted London portrayed in film is a simple but effective tool to give an audience that 'chill' we expect from 'well written' horrors. There is blood and gore....lots of it but it never feels overused.I feel the Americans come off a wee bit badly here :-) as they didn't exactly pull out all the stops to contain the spread of the virus. Even I may have worked out that putting hundreds of people in a pitch black compound with flimsy walls is not ideal in avoiding panic and keeping those blood thirsty, red eyed monsters out. haha.When my GF asked if this was a sequel to 28 weeks NOTICE I said yes, so we are going this week and I shall have some zombie delight for the second time. I think it will be worth the fact she won't speak to me for a week when she realises Hugh Grant is nowhere in sight. lol.ENJOY",9.0,Anonymous,Horror
Outstanding zombie flick!,"Just as good as 28 days and still fiercely intelligent zombie movie. The imagery again is bleak and grim, the grey only lifted by sudden splatters of red. It's bloodier than it's predecessor - and more jump cuts for more jump scares. Things get bloody and there's no key character to associate with, so no easy answers. Tense, nerve shredding and populated with too believably flawed characters. And we're still working on our two levels - Zombetaphor!",10.0,Anonymous,Horror
Simple Review,"28 Weeks Later Quick & Easy Review:I'm not going to write a ten page review (Even though IMDb makes you) on all the reasons why you should see this film because nothing should spoil it for you.Its not often that a Horror/Thriller movie has a Great story! If you enjoy Zombie Films, this is SO much more...Very well acted and directed. About time an almost perfect Zombie flick was made! Watch it, you won't be sorry!!By the way, 28 Months Later sounds like a great idea!If this film isn't on the TOP 25 on IMDb and Lord Of The Rings is, there really is something wrong with you people...",9.0,Anonymous,Horror
A Beautiful Piece of Art,"I always had the feeling this was just going to be a lame sequel using the name of the classic movie ""28 Days Later"". Mainly because ""28 Days Later"" had a good ending where infected die of starvation and everything was going to be OK. So looking at the trailer, you might feel cheated to have watched ""28 Days Later"", cause things just don't seem to turn out OK after all. But you would be wrong. ""28 Weeks Later"" isn't an ""Elm Street"" type sequel where evil just comes back for no good reason. As in most horror sequels, ""28 Weeks Later"" takes its own horror elements to the next level. I don't wanna give any spoilers, so all I can say is everything is more intense than ""28 Days Later"" The shooting of the film is just beautiful. The use of filters, lighting, fast camera movement, empty city scenes, and music make this movie a true piece of art. You will realize that it actually is a good thing the sequel has a different director, so you will get a chance to see the idea of ""28 Days Later"" from a different point of view. ""28 Days Later"" & ""28 Weeks Later"" is probably one of the best horror couple ever made, since each of them is a whole different movie in itself with only the idea of infected people in common. The only downside of the movie was it felt too short. It was probably the quickest 90 minutes of my life. This actually IS a downside, because it leaves the viewer dissatisfied. Most characters have longer backgrounds than their lives in the movie. And the overall of the movie gives you the feeling that it was cut short due to lack of budget (probably). Nevertheless, ""28 Weeks Later"" is a must see for horror addicts, and it definitely is better than some of the classic movies of modern time.",9.0,Anonymous,Horror
"28 weeks later, 28 times better.","Zombie movies... normally the ones that not many directors can succeed at making bloody and fun, yet artistic and well made. That is, until 28 Weeks Later. The plot isn't perfect, but what zombie movie plot is? The great thing about this movie is the directing done to make all of the suspenseful parts scary, and the jump from your seats parts tremendously scary and affective. The action is terrific including one of the strangest, yet greatest ways to use a helicopter in a zombie movie. :). The acting, especially by the kids is pretty well done, and the story moves smoothly enough to make it an extremely fun, gory, artistic, and well made movie. THE BEST ZOMBIE MOVIE EVER!!!!!!",9.0,Anonymous,Horror
Best Movie,"My favorite movie so far, iv seen it once in the movies (snuck in because I'm not yet 18), rented it out on DVD and watched my friends download of it. Each time it gets better. This movie is a great combination of gore, storyline and great acting. It is a battle of first the infected and uninfected, second against the aerial attacks and lastly the protectors themselves. All of the people featured in this movie should be proud of being a part of this production. I suggest that everyone wanting a great horror and dramatic storyline this is the way to go. If you are not a fan of renting, download this movie. I am not usually a fan of people downloading illegally but it would b a worse crime to not watch this movie",10.0,Anonymous,Horror
I'd rather get the Rage virus than see this again.,"Let me preface this, 28 Weeks Later is just one big allegory. One Big, Dumb allegory.The first movie, ""28 days later"", featured subtle undertones of racial, sexual tension. But alas, ""Weeks"" features nothing less than the blatant, bigoted opinions of a politically charged Spanish director: The U.S. takes control of a territory with the intention of liberating, or ""purifying"" the British Isles only to have matters careen and blow vastly out of proportion. Much like the current state of Iraq, nay?The premise is reminiscent of the first, but the tact is gone, as subtlety is cast aside in favor of the Hollywood-esquire appeal of ultra-violent imagery. Which, again, may be just a metaphor for our American bloodlust, but wow is this poorly executed. There is simply no need for this much political commentary in anything short of a michael moore film. Some of the already sparse audience did leave during a particularly long, bloody scene, illustrating my alleged claim of tasteless violence.But what of the characters? What about them? They feature treacherous dads, an obnoxious kid, his particularly fine sister, an altruistic and morally just soldier, and a military physician out to reveal her higher nature. None of them can anyone develop a particular attachment towards, and the dodgy plot haphazardly follows them through an illogical sequence in London. The movie frusterates, disgusts, frusterates, disgusts, and lastly ends in disgrace. The Kids just complicate and perpetuate problems, but without them, the series would have concluded with ""28 Days Later"".Does this film do anything right? That adrenaline-fueled camera from the first movie is back. It does right in the opening scenes to convey panic and portrays the confusion well in a manner that almost inserts the audience in the movie. But that about does it. The remaining 100 minutes blow and conclude in a manner that.. well.. sucks. Tries too hard is all.This movie is not worthy of a rating of 2 out of 10, but my partiality to zombie movies musters this one more point.",2.0,Anonymous,Horror
We have an outbreak of the infection in medical center. All units - safeties off.,"28 Weeks Later is directed by Juan Carlos Fresnadillo who also co-writes with Rowan Joffe, Jesus Olmo and E. L. Lavigne. It stars Robert Carlyle, Rose Byrne, Jeremy Renner, Harold Perrineau, Catherine McCormack, Mackintosh Muggleton and Imogen Poots. Music is by John Murphy and cinematography by Enrique Chediak.Six months have passed since the Rage Virus decimated the UK, but now people are returning to London's District 1 with the U.S. Military overseeing the project. However, the Rage Virus can be carried in people with no outward symptoms.After the monster success of ""28 Days Later"" it was inevitable that a sequel would follow. With director/writer combo Danny Boyle and Alex Garland off making ""Sunshine"" with Cillian Murphy, the big players from the first film were missing (Boyle and Garland were Executive Producers here). There was reasonable cause for some concern that this would be the latest in a long line of horror sequels that, quite frankly, suck the big one. How great to find that not only is ""Weeks"" an excellent sequel, it also doesn't sit idle and copy Boyle's winning formula.The blood and ick factor is considerably amped up, as is the action (there's running, lots of running, guns, lots of guns, panic, lots of panic), but the writers have put intelligence into the writing by expanding on the Rage Virus victims as not just being an outwardly ferocious beast, and some topical smarts are spliced into the narrative with the presence of the American military ""enforcing"" the reconstruction of London. Also, with the film's central focus being on a splintered family, brilliantly set up by the breathtaking/horrifying opening 10 minutes, there's a mighty heft of humanism flowing in between the blood vomit and body shredding.Cast are mostly terrific, with Carlyle and the impressive young actors, Poots and Muggleton, leading the way. The American lads playing military men have to make do with slender written stock roles, but Byrne provides spunk and McCormack leaves an indelible mark in a small, but key, role. Fresnadillo (Intacto) ensures Boyle isn't missed in the director's chair, with a keen eye for action construction and an awareness of pacing for such a horror movie. While Murphy again scores with that knack for doom mongering beats. There's some missteps, logic at times goes out the window and in the case of Renner's character, outcome is a bit too much of a bitter pill to swallow. While dialogue at times shops at ""Clichés ""R"" Us"". But this is still a mighty fine thrill ride, often scary and stomach turning, and even flecked with emotional worth. On this evidence a part 3 would be most welcome. 8/10",8.0,Anonymous,Horror
An Admirable Sequel,"Very good! This is a top notch zombie film, but it didn't quite live up to its predecessor. It was a little more predictable then ""28 Days Later"", but is still a very frightening and disturbing movie. One area in which this film exceeds ""Days"" is how claustrophobic it is. I don't quite know how to explain it, but certain parts in the movie just made me feel uncomfortably close to what was going on, and the first seemed to take place more out in the open.I thought that most of the actors did an excellent job. Robert Carlyle, Jeremy Renner, and both of the children all gave great performances. Jeremy Renner in some respects reminds me of Nathan Fillion. He is a talented actor who is very underrated. He was definitely one of the better parts of the SWAT movie. It was good to see Michael from Lost in the movie also! Harold Perrineau was a great addition to the cast.The atmosphere is tense, and it will have you sitting on the edge of your seat through its entire length. I loved all the neat camera views the director used, especially the night vision scope in the tunnel, that was great. Juan Carlos Fresnadillo does a good job with taking over the reigns from Danny Boyle. I'll be interested to see what the success of this movie does for his career as a filmmaker.",8.0,Anonymous,Horror
Leaves something to be desired,"As the name suggests, months have passed since the catastrophic events of the first film. But now the infected, the Ragers, have died of starvation and the British Isles are slowly being re-inhabited. But, of course it's not that simple.I thought the first film was okay. Not great, but okay. It had some really good action and the zombies - or the Ragers, because none of these movies dare use the Z-word - were an actual, legitimate threat. It had some social commentary, some good acting and a decent ending.I also like the idea of this film franchise on paper. Examining the same zombie outbreak in its different stages. First some days later, then weeks, and then presumably months or even years. 28 Years Later could be something we've never seen before in this genre.Unfortunately it's unclear whether this sequel is strong enough to warrant a third movie. Because while it keeps some of the strengths of the original - the scary zombies and the social commentary - it just isn't that strong of a movie by itself. The action especially takes a heavy nosedive. The film seems to think that the way to shoot action is to have the whole screen pitch black and then flash the lights every couple of seconds while people grunt and moan in the dark. As you can probably imagine, this makes all the action scenes nigh impossible to follow or appreciate.The whole film also has this cold, clinical look to it. I remember the first film looking much warmer, like a real civilization in ruins. This looks like an IKEA catalog with some zombies added.Not a terrible film by any means, and if you liked the first one, then this might be worth a watch. Here's hoping we get a third one and that it picks up the slack.",4.0,Anonymous,Horror
"Better than first, Best horror/thriller in some time.. Excellent!","it's only been a couple of hours since watching, and i'm sure i'll come up with a few plot holes over time, like why he did this? could that have really happened? etc.. but that's not important because there was only one moment i felt distracted like that during the film, and even then it was explained soon after.. but i haven't been on the edge of my seat for an entire film for a very long time.. 24 being the only thing in recent memory to get my adrenaline pumping.The sense of dread in this film is amazing, the action is perfectly timed and paced, it is just one of those films where the audience literally gasps a sigh of relief when the credits start to roll.If you thought the first film had a good premise, but felt lacking in some way, particularly thrills, then you will love this film.My friend made a good comparison, 28 Weeks Later as a sequel is similar to Aliens.. in Alien it was a small group of people, the enemy was new.. in both sequels, the enemy is known, and the guns are loaded, yet it still manages to make you feel like there is no escape. Alien was an example in tension, Aliens was an example of the emotions felt on a roller-coaster ride. The same applies to the 28 films.Ps. they took full advantage of and made London look amazing, its probably one of the best films to sell the city, even if it is full of crazy zombies!!",9.0,Anonymous,Horror
"""Realism"" is all the more scary","I know that realism is an odd point concerning Zombie films (I know they're officially not ""zombies"" but for the sake of argument I'm going to refer to them as such) but once you accept most of your fellow humans are out to eat/hurt you with no thought for themselves, its the practicality of such a real life situation that gives me the most interest. With this being set in Britain without the mandatory gun shop on every corner, it makes for a far more gritty, ""hands on"" horror film. The panic and squalor of quite literally fighting for your life amongst the normally mundane countryside/urban scenarios are far more upsetting than any cocky American, confidently shooting a corpse with a witty sound bite or overly sentimental reaction (although that does sadly occur a little in this film). I was fearful this film would fall foul of the zombies showing recognition or mercy on loved ones but instead the catastrophic change in victims is shown brutally well (in the medical room for example). The currently very popular ""night vision"" tool is used well in one scene and although the film does fall back on tried and tested structure (kids being naughty/annoying, people and zombies surviving the unsurvivable and then handily coming across each other to tie things up nicely etc) the film gripped me enough and pulled me in sufficiently to not hold them against it. I know my Utopian ideal of a zombie film where the events and horrifically realistic situations form the bulk of the film (what would I do questions raised etc) and overly emotional character plots are spared instead going for a more general overview of human response is unrealistic, my fingers are still crossed.",8.0,Anonymous,Horror
Hmm?,Not as good as the original. But good try!!! Maybe it's just cause I loved 28 days later so much! I have watched it more than once though..... So can't be that bad. Sad sad ending!!,3.0,Anonymous,Horror
Comparing 28 days later and 28 weeks later,"Comparing two zombie films.If I had to compare 28 days later and 28 weeks later, the comparison would be that the former is a good action film based on surviving a threat and while being on the road in order to find a mystical Eden, while the latter is more on an intellectual based film on relationships such as the two children and their father, lies that a father tells as not to bring to the surface his inability to have saved his wife while zombies were attacking the village.In fact, one does not need to see the first to appreciate independently the two films.For my critic of 28 days later, the idea of finding shelter in a mansion protected by soldiers who want to gang rape the women who are now in their custody in a supposedly core idea of repopulating the world, is quite scary as to see how people or survivors would react in an end of the world tragedy. It is a film genre where an obscure place is found only to detect the profound horror governing the find. It would be like Hansel and Gretel who, lost in the woods, come across a gingerbread house which is a form of haven only to discover the truth behind who lives in the house.Without mistake the film does it very well.Now, for 28 weeks later, the ingenuity of the film relies on the postulate that a safe haven has been created for survivors and that life can continue. The evil is now, not inside but outside. One can compare with Anne Frank's diary where the father amid the war raging he believes life can go on even if they are imprisoned in the house attic where they found refuge.Yet, two children are brought in and meet their father who takes them in his loft and life as a family begins. Then, the boy misses his mother and with his sister go seek the home they lived in the country to seek out mementos like pictures. They find the mother, all are brought back to the city, the father reunites with his contaminated wife in the hospital, they kiss then hell breaks out.Finally, the two children are saved and brought to Paris and they are responsible for the contamination of the last French survivors as we see the zombies rush out of the metro at the Trocadero, Paris.The end of the two cities has come from the outside.Some would argue that this film has some analogies to the Iraq war.I would disagree since I see no glimpse such as symbols to the Iraqi war. However, I see some analogy to that of not protecting the borders of countries.With the breakdown of borders by the unification of Europe, probably it sends a negative message as to limit entry to those who may be like the Trojan horse; enter a city with an unclear motive without anyone noticing it and bring havoc.We see that today, some barriers are being installed as to limit unwanted immigration. Think of the barrier being mounted between the USA and Mexico, the wall already built in Jerusalem and now the whole of Europe with the Syrian immigrants, some countries creating barriers to slow their advance.Sad! indeed. And some argue that there are terrorists are among the lot thus build barriers so they can be filtered out.",9.0,Anonymous,Horror
Best Horror Movie of 2007 (and maybe ever!),"There hasn't been a horror movie like this in a very long time! Horror movies today only rely on gore to please the audience (which doesn't work anymore) but this film has a slightly different kind of gore. The gore is only used when it needs to be and sometimes has over the top scenes but it surprising makes the film more watchable!The acting was incredible! Everything they reacted to, you felt like you would do the exact same thing! Similar to the original, the actors aren't famous Hollywood stars that are recognized by everyone. They have the realistic looks of any average person. Which adds a lot more depth to their characters, and you know you can relate to them. The kids in the film were surprisingly good and intelligent unlike Hollywood child stars today.Throughout the film you are always engaged and want to watch more. When the movie ended I didn't want it to end, I kept wanting more and more non-stop action. The opening scene is a truly amazing classic horror film moment. Just from the beginning you can tell this movie will deliver what you were expecting and more!The music is great! The movie score does play the emotions of fear, sorrow, and emptiness very well. I simply can not wait for this film to come out on DVD. I recommend this film to every horror, thriller, action movie fan out there!",10.0,Anonymous,Horror
