title,content,rating,username,genres
"Drugs Are Bad, Mmmkay?","Doug Liman (Swingers, Edge of Tomorrow, Bourne) is one of those directors who's built a career on confident and skilled filmmaking without actually having much in the way of a specific voice. American Made fits that resume perfectly. He takes some familiar themes (love of money is the root of all evil, dishonesty inherent in the war on drugs) and a true American story, then molds into them perfectly. It gives us a Scorsese-like knock-off that isn't terribly original but is still a solid version of an all-too-true corruption story. Cruise stars as Barry Seal, a TWA pilot in the 1980s who is recruited by the CIA to be a courier for their dealings with Central American leaders, before becoming a drug runner. With intentionally rudimentary animation, edits to old news footage, and general 1980s filmmaking tendencies, it's full of great style and appreciated detail. The plane flying is fantastic, the costuming is sweaty and authentic, and the cash and throwing motifs are prevalent and effective. When Seal is slowly covered over by piles of cash, we get the idea pretty quickly that we are watching a guy get suffocated by his own desires. There's a lot packed into the film, and this is one of those rare occurrences in which I think this would be helped by being about an hour longer. While the details of the story are well covered, the characters, their motivations and their personalities get a bit looked over. Instead of being a full engrossing narrative, it comes off more like an information document. Nonetheless, American Made is a funny, cool and intriguing tale about governmental overreach and misappropriated power.",7.0,Anonymous,Biography
"Fun film, entertaining, will leave you breathless, Tom Cruise and Doug Liman are a perfect duo","Following the success of Edge of Tomorrow, Tom Cruise has done it again! Tom Cruise and Doug Liman are a perfect duo, This is a must see film! I can't wait for you guys to see it and I think you're gonna love it!",10.0,Anonymous,Biography
The story itself is the best thing about the movie,"Tom Cruise does an excelent job as the actor for this movie. But really, knowing it is based on a real story, it is the best thing about it. After watching the movie it brings a real perspective about the influence of the US across its frontiers and how far the government goes in order to apply its interests. Also, the motto ""it´s for your country"" takes a total different meaning after watching American Made. Watching the movie was a very good surprise.",8.0,Anonymous,Biography
Don't you get it?,"This a great movie that displays what many Americans don't see. So many people are so proud of our country and they wave that red, white and blue.
But all you need to do is study some recent and some past history to tell .... our leader are not about red whit and blue. They are about green. As in the green of money.They make decisions based not on what is right for the world and the wonderful people of our country... but how it effects their wallet. Read more about the Iran Contra affair if you are interested on how the game is played.",9.0,Anonymous,Biography
Only Cruise could have pulled this off!,"10/23/17. Maybe even 7 1/2 stars! A highly entertaining biopic of Barry Seal, the talented pilot who made billions working for both sides: the CIA and the Medellin drug cartel. Cruise did a fantastic job playing Seal with just the right amount panache to make him a sympathetic character who knew enough to take advantage of his good fortune until his luck ran out. Truly an incredible true story that is worth telling, and Liman told it very well! Worth catching.",,Anonymous,Biography
"Another Tom Cruise fan service, with aspirations for more","""Forrest Gump"" flying high: meet the man who was too dumb to settle for an ordinary life like almost everybody else. Tom Cruise's latest is based on the amazing life of Barry Seal, the daredevil pilot who worked for the CIA, the White House AND a powerful drug cartel at the same time. Also appearing: April Billingsley, Domhnall Gleeson, Caleb Landry Jones, Alejandro Edda. Directed by Doug Lima, known for a number of action movies, including Go"" (1999), The Bourne Identity"", and Mr. and Mrs. Smith"". He's, however, much less known for serious"" movies, which he also likes to do occasionally. Let's hope ""American Made"" will be his game-changer, because most of the personality it has owes thanks to Liman's work as director, mixing so-called period piece (the last half of 1970's and the first half of 80's) with his shaky-cam and cameras-up-close approach plus breathless editing first introduced in The Bourne Identity"". It's not a style everybody likes but it manages to give the result its very own unique vibe – and it's also compatible with the whirlwind kind of life mr Seal seemed to prefer. Everything else here is less inspired. I mean, it works fine but, essentially, we are watching the same ""rags to riches to rags again"" type of American success story that we've served countless times over the last 30 years since Oliver Stone's Wall Street"" made it popular. To be exact, the 114 minute movie is eventful, but story-wise we get only this often-copied blueprint and little else. The actors are certainly competent but there are no interesting characters to root for. Caleb Landry Jones is always cool, of course, but he has such a small role. Cruise is, of course, too much of a big star to really go into his character. He doesn't vanish in his protagonist such as, for example, Matthew McConaughey in ""Gold"" (another this year's movie about great adventurer which has copied ""Wall Street"" formula). His version of this unique man is still the same Cruise persona we've known for ages, only this time less ass-kicking and million- dollar-smile flashing because he plays a common man. Of course, Cruise still has a lot of charisma, but he turns ""American Made"" into just another Cruise project – based on good idea, lots of stuff going down, screenplay and characters are not intriguing. Often, this equation can work out quite well, especially in action- oriented movies. The other times, such as in American Made"", I want to enjoy the result more than I actually did. Still, it's probably a better movie than this long-planned Top Gun"" sequel they're still developing for Cruise.",6.0,Anonymous,Biography
A great rebound move for Cruise,Tom Cruise hits a homer with the depiction of real life Captain Barry Seal who was a hot shot ex TWA pilot recruited into the CIA after getting caught smuggling drugs for the Mexican drug cartels during the 1980s. It was good to see him back in a great role and movie after his disastrous Mummy movie. Watching Barry Seal ascend to the top and subsequent fall reminded me of Ray Liotta's depiction of mobster Henry Hill in the movie Goodfellas. The move was a bit of a comedy wrapped around a serious story with an unfortunate ending. I really liked seeing Sarah Wright in this film playing his wife. I have never seen her in a mainstream film but look forward to seeing her in the future.The plot was fast flowing with very little pauses or breaks. I was quite surprised how quickly the time passed while watching. The aerial film sequences and location was worth the price of admission. The film was bright and the sound was great unlike so many crime films today filmed in low light/night. The 80's props and clothing was very authentic and believable. Although the whole movie surrounds drug smuggling there was almost zero scenes showing drug usage. I probably would not watch again as the plot outcome is the big reveal.,6.0,Anonymous,Biography
Interesting.,"A fun filled fiction based on real life story, most of the story is made up for the creative freedom. This is one of those energetic films, that are good to watch. Tom Cruise fans can watch it for sure.",7.0,Anonymous,Biography
An entertaining take on an unbelievable true story,"If American Made proves one thing it's that truth is stranger than fiction. The story of American aircraft pilot Barry Seal who became a drug smuggler working for the Medellin cartel, casually rubbed shoulders with Pablo Escobar and ran a massive money laundering operation all while being employed by the CIA, would seem a stretch even by Hollywood's standards. Yet it's precisely the ""based on true events"" part of Seal's story that makes American Made such a fascinating film to watch.We are first introduced to Seal as a disillusioned TWA pilot looking for something to put the thrill back in his life. When approached by the CIA to fly reconnaissance of communist factions in South America, he immediately jumps at the opportunity. Flying solo from the US on his own private two- engine plane, it's not long before Seal is intercepted by the Medellin cartel and offered large amounts of cash to smuggle drugs into the US. Ever the opportunist, Seal agrees and soon finds himself playing on both sides of the law and making more money than he knows what to do with. But as the demands from both sides grow increasingly untenable, Seal finds himself stuck between a rock and a hard place, with his luck quickly drying up.Tom Cruise brings his manic charisma to the role of Seal, and he's a good fit for the highflying, larger than life character. It's hard not to look with contempt at a man who transported illegal narcotics into the US en masse, but Cruise does a good job in humanising Seal and portraying him as more than just a criminal. At heart, Seal is a family man looking to provide for his wife and daughter but whose unrelenting pursuit of the American dream finds him working on both sides of the law.The charisma Cruise brings to the role goes a long way in making Seal an endearing protagonist, and he seems to have fun in the role. Following the underwhelming performance of The Mummy earlier this year, American Made represents a return to form for him and a welcome return to the more grounded narratives in which he fares far better with.Director Doug Liman (Edge of Tomorrow, Fair Game) complements Cruise's commanding performance with his highly energised filming style. The camera is rarely steady for more than a beat and its constant zooming, shaking and moving around lends the film an effective faux doco feel. On the flipside, however, the incessant camera movements are distracting during some of the quieter moments in the film. In one simple conversation scene in a diner, near the beginning of the film, the camera haphazardly changes angles and abruptly zooms in towards the characters as they speak. It's awkwardly staged and distracts from the dialogue. Luckily the film moves at such a fast clip that Liman's hyperactive filming works mostly well but some restraint would have gone a long way during the smaller scenes.Overall American Made is a fascinating biopic about a larger than life character. The film benefits greatly from Cruise's committed performance and Liman's lively direction to provide an entertaining take on an unbelievable true story.",8.0,Anonymous,Biography
Nice film! Graet fotography!,"What I liked of this film is the fotography, nice use of colors, nice interpretation of Tom Cruise but, few twists, but in the compless nice film.
Disappointing of the choise of the Escobar's actor, he not seems for nothing the real escobar.",7.0,Anonymous,Biography
Tom Cruise is outstanding in this brilliantly satirical black comedy,"This movie is an absolutely hilarious black comedy, and all the funnier because we know we really shouldn't find the subject matter funny (as it involves the smuggling of tonnes of cocaine from Colombia to the US), but Tom as Barry Seal is so disarmingly roguish as the happy-go-lucky lead that I found it impossible not to forgive his crimes as a pawn in a really huge game with gigantic major players.Barry starts the movie as a airline pilot in a mundane job which he sometimes tries to shake up (literally) to make it a little more entertaining. He is a small-time smuggler of cheap contraband, and the CIA uses knowledge of this fact to recruit him into the big time. They hire him as a CIA contractor to take reconnaissance photos of the ""commies"" in Nicaragua, and to pick up intel from General Noriega in Panama. This leads Pablo Escobar and his two mates to recruit Barry as a cocaine smuggler, as he is always flying between Central America and the USA with the CIA's help and can drop the drugs out of the plane without detection.The CIA agent in charge of Barry, Monty Schafer (Domhnall Gleeson) finds out about Barry's nefarious goings on, and gets him off the hook when he gets gaoled in Colombia on condition that he run guns for the Contras who are fighting the ""commies"" in Nicaragua. Tom agrees, but suffice it to say that the guns don't end up where they are supposed to and the cocaine operation for Escobar and his two Colombian mates ends up getting supersized.To get out of doing 30 years in gaol for drug trafficking, Barry ultimately does a deal with the White House (Oliver North and a senior DEA guy), but these two double-cross him and it all ends badly for Barry, except that he had a great time for eight years and made a huge amount of dough.My only beef with this film is that, unlike in another must-see film about this same subject called ""Kill the Messenger"" (2014 starring Jeremy Renner) this film does not make explicit the connection between the CIAs activities in Central American in the early to mid 80s and the importation of tonnes of cocaine into the USA to finance the war against the ""commies"" in Nicaragua, which Congress refused to back. Rather, in this move the CIA just keeps Barry out of gaol on condition that he fly heaps of guns to the Contras (which he doesn't in fact comply with), and allow Contras to do military training on the extensive property that the CIA has obtained for him in Mena, Louisiana. (Most of these ""soldiers"" just want to get to the USA and couldn't care less about fighting ""commies"", and abscond the first chance they get).Despite the slight bending of historical fact to appease the CIA and company (the CIA admitted in 1998 to using cocaine money to fund the Contras in a 400 page document which went unreported in the US media thanks to the absurd controversy about President Bill Clinton and Monica Lewinski), this film is a very rewarding and hilarious thrill ride into high stakes espionage and drug smuggling by ""the man who always delivers"".",10.0,Anonymous,Biography
interesting story,"This is the first movie Tom Cruise has done in a long time that I acutally liked. He plays a real guy Barry Seal, whom was recruited by the CIA to smuggle guns to South America. Along the way he got mixed up the drug cartels and started smuggling drugs back the USA. Of course, he made a lot of unexplained money and eventually it was all going to catch back up to him. The movie teaches a good lesson to remember: don't screw over the cartel. Barry met the fate that he couldn't out run once he was outed for spying for the US government on the cartels.FINAL VERDICT: Good story, worth a watch.",6.0,Anonymous,Biography
Not good.,"First of all, the cinematography was garbage. I guess some directors think that it looks good to film a movie as if it were filmed by an amateur using a go-pro. Not only were the camera shots always shaky, they weren't even good. Some shots just seemed pointless. As if some high school first-time videographer was trying out shots that they thought would look good, like putting the camera on the floor. How creative. Not. Also, many shots seemed like they were zoomed in too far, cropping focal points out of the scene.I personally don't think such camera techniques look good. They look cheap. The idea of a movie is to sink in to it and ""forget"" you're even watching a movie. Well, this camera person didn't have that concept in mind. Not at all.Some videographers & directors take big risks trying out unique camera shots, and for some films their experiments work out. But it many others, they don't. And in this one, their unique camera style did not work.And now going beyond the awful videography, I felt like the writing wasn't even that great. And ontop of that, I felt that the acting wasn't even that great. A real good movie has every cast member fitting a scene. A lot of the characters felt like actors. It felt cheap.And besides the bad filming, poor-writing & sub-par acting, the movies whole storyline seems to glorify criminal drug-runners & make them look like a bunch of fun cool guys. In reality, that's not the case. The big cocaine dealers are hard criminals.And furthermore, while the movie doesn't officially state that the CIA themselves were smuggling cocaine, it's clear they were. And for someone spin that as a good thing; pumping hard life-ruining narcotics into neighborhoods that otherwise would have been void of drugs, is absurd. Doesn't matter if they are ""funding anti-communist matters"". Not only would such tactics be ultimately irrelevant to US taxpayers interests, it in effect destroys US communities.All around I found this film to be poorly produced & a dismal portrayal of any sort of realism. It's just a big Hollywood cool-guy party where are the characters are hip sunglass wearing party animals having fun swimming in money & enjoy life! There's no realism in the characters; it's absurd.After one painful hour I left the theater.I read one reviewer saying ""this is Tom Cruise's best film!""Wow. Obviously their film criticism has no value.To rate this film alongside Mission Impossible films, Jack Reacher, Edge of Tomorrow, War of Worlds & Oblivion is totally absurd.Sadly I'd put this film in the same basket as ""The Mummy"".",2.0,Anonymous,Biography
Tom Cruise Made,"Based on a true story of an airline pilot in the 1980's who is recruited by the CIA to (at first) take photos over Cuba and then later to smuggle drugs and weapons for the U.S government. Barry Seal slowly gets in over his head when he becomes involved with the Medellin drug Cartel.This story could have benefitted from a different lead, Tom Cruise is just his MI character, the same action guy as always just with a different background and it sucked the movie down for me so that I wasn't watching a true story about Barry Seal but a Tom Cruise action movie.Its entertaining enough and plays out like 'Scarface' or Johnny Depp's 'Blow'. All the money, so much money he doesn't know where to keep it after a while. Interesting unbelievably true, worth a watch.",7.0,Anonymous,Biography
"A few too many montages and some underdeveloped characters, but funny & fast-paced with non-stop laughs and thrills","Biopics can be a tricky genre, their conventions prone to becoming stale and boring. Yet Liman and Cruise together brought us a refreshing and intriguing take on sci-fi/action films in Edge of Tomorrow – can they do the same for biopics? In short, yes and no. Though a simple but exciting story well-told and fun to watch, the biopic conventions and structures are the same we've seen before and become a little monotonous and repetitive.In terms of structure and story it's very reminiscent of lots of crime biopics, particularly Scorsese's Goodfellas and The Wolf of Wall Street; there are so many similarities – fans of these films are bound to enjoy elements of American Made, rife with innumerable montages and voice-overs. The problem is, once you take a step back and really look at it, there are just so many. A couple of scenes, then a montage with a voice-over, then another scene, followed by another montage accompanied by a montage; rinse repeat (and repeat). This is the structure the film follows for the majority of its run-time and it does start to wear a little thin, feeling repetitive.Still, the plot itself is fairly light and simple while also being fun and entertaining, charting the progression of Barry's journey from rags to riches (and inevitably rags again), yet within these montages they cram so much in, it feels like an epic journey with a huge story. So much enjoyable detail is packed into these montages while still keeping the story flowing at an excellent pace that we never really get tired of the constant montages. They're fun, often amusing, and bring so much for us to enjoy. The film just doesn't slow down for you to think, evoking its protagonist's adrenaline- seeking nature – this is where so much of the fun and personality in the story come from.More than this though, the montages are a perfect showcase of the style and personality the director injects into the film. The voice-overs are perfect accompaniments to the fun montages (full credit given to both Tom Cruise for his delivery and Gary Spinelli for his excellent screenplay), but it's the director's style that makes this film a fun affair, constantly laughing and poking fun at the danger Barry frequently finds himself in. It's light and comedic, with animated maps that are like a cross between Indiana Jones and Dad's Army. The music choices too aren't only authentic to the era, plunging us headfirst into the 1970s and 1980s, but really put us in the giddily excitable mood we should be in as we enjoy watching Barry get away with everything. It's a fun, cocky style that suits the main character and drives the film.While Cruise's performance is spot-on, his portrayal of Barry Seal is similar to many other characters he's played; lovable, but cocky guys who always have a smart way out, laughing in the face of danger all the while. In many ways really he carries this film, showing his real talent as an actor since we never get fed up of nearly 2 hours of nigh on constant Tom Cruise. Still this is largely due to the fact that the script rarely gives anyone else a chance. The character we see the next most of would be Domhnall Gleeson's CIA man Schafer, who is wonderfully ambiguous as we never know whether he's good or bad, whether Barry should trust him or not. He keeps this going for the whole film and plays well opposite Cruise; it's just a shame he doesn't get a chance for his character to develop to the extent it could have done. The Medellín cartel too are excellent, a careful balance of welcoming charm with a sinister undercurrent of cruel menace and violence.Sadly many other characters are unfairly marginalised, not having the screen time they really deserve. While Caleb Landry Jones has a nice brief turn as Lucy's annoying, trouble-making brother (a very similar role to his one in Get Out just a few months earlier), it's all too brief. This extends to the four pilots Barry recruits to join his little gang. Each of these characters could have been unique and quirky, befitting of the film's style and really enriching the roster of characters. Instead they're left by the wayside, occasionally appearing for plot-points or small laughs. It felt as if they were only included for the sake of accuracy to real life, whereas they could have been developed into wonderful little characters. Sarah Wright's Lucy however is the biggest missed opportunity. Continuing the comparison to The Wolf of Wall Street, Scorsese really did something excellent with Margot Robbie's character, Naomi, that part alone making the huge star she is today. If only the script had allowed for more to be made of Lucy in American Made. Beautiful, effortlessly sexy and loyal even when the going gets rough, Wright's portrayal is excellent and it's a joy to watch her. However, it feels like with a bit more she could have been more than just eye candy and the 'wife-left-back-home', the family scenes seeming less important that the money-grabbing main plot. Her inclusion improves as the film goes on, yet it still feels as though more could have been done with her.Funny, fast-paced and with tons of enjoyable detail in more montages than you can count, this is a fun, stylish biopic which you can't help but enjoy. Though the structure (particularly the montages) can become repetitive, not much is done to make it stand out or refresh the biopic genre and despite the film focusing too much on Cruise when there were some potentially excellent characters left on the side, this is a crime-comedy-biopic that never slows down, giving you all the thrills and excitement Cruise's character is in constant search of.",7.0,Anonymous,Biography
Lighthearted Look at a Serious Subject,"I watched this movie after having watched Kill the Messenger with Jeremy Renner because it dealt with the same subject matter. I was anxious to see the similarities and differences between the two. One thing I have to say right away is that Kill the Messenger was a lot better.American Made deals with the CIA involvement in allowing drugs to flow into the US in order to surreptitiously arm the Nicaraguan Contras. Barry Seal (Tom Cruise) was a principal player in smuggling drugs into the U.S. as he was a pilot who was given the knowledge and resources to smuggle the drugs. He made millions of dollars in the process and was insanely successful at smuggling.The movie had a light tone and atmosphere. Maybe it was to match the attitude and demeanor of the main character or maybe not, but that was one thing I appreciated about Kill the Messenger. Kill the Messenger gave the issue the proper respect. It was treated seriously and there were even pertinent video clips showing the outrage from those who'd suffered due to drugs. American Made was the iterations of a loosey goosey adventurer type who was making more money than he knew what to do with. It was very lighthearted and humorous even though the topic was anything but.I liked the movie for the historical information it presented but nothing more than that. It's based upon a true story but we can only imagine how closely to the truth it adhered.",6.0,Anonymous,Biography
