title,content,rating,username,genres
Entertaining as an Action Movie,"In 1978, the skilled and ambitious TWA pilot Barry Seal (Tom Cruise) smuggles Cuban cigars to increase his income. Out of the blue, he is contacted by the CIA agent Monty Schafer (Domhnall Gleeson), who asks him to work for the CIA photographing facilities over Central America using a state-of-art small plane. Soon Barry contacts General Noriega as a courier for the CIA and is contacted by the Medellin Cartel that wants him to transport drugs to the USA. Then Schafer asks Barry to carry weapons for the Contras in Nicaragua. Barry invites pilots that are his friends and plots routes to smuggle drugs for the cartel. The CIA closes eyes to the scheme and Barry becomes richer and richer. He uses the Arkansas town Mena to laundry his money. But the DEA and the FBI are tracking him down. When the CIA shuts down the scheme, Barry is left alone and arrested by the agencies. What will happen to his family and him?""American Made"" is an American action movie based on a true story and told like a comedy despite the seriousness of the situation, with the American government interfering this time with the Central America nations. The plot is engaging and entertaining and the despicable Barry Seal is depicted as a family man by Tom Cruise that has good performance. The background of corruption, political interference, trafficking of weapons and drugs are treated like something usual by the story that can not be taken seriously. My vote is seven.Title (Brazil): ""Feito na América"" (""American Made"")",7.0,Anonymous,Biography
An Entertaining & Exciting Stuff! - Here is an actor who always (with some exceptions) delivers.,"Ever wondered what it would be like to see Tom Cruise taking a break from his usual Sci-Fi & Impossible series ""avatar"". Well, here is your answer - It gets even more exciting and entertaining. This is Tom Cruise's real life take on the impossible series where Barry Seal replaces Ethan Hunt and CIA as the agency, which dictates the terms. It's just that Barry loves to go with the flow and without any intention of getting involved with anything that seems out of his league and this is something each one of us can relate to. He is your usual guy who happens to be a pilot and wants to make some extra cash with every extra mile. So what's wrong with it? Well nothing is wrong when you do it for the right guys, and nothing gets more exciting and dangerous when those right guys turn out to be CIA.What is even more amusing and entertaining to watch is the fact that despite having no choice left but to cooperate with CIA, ""Barry Seal never says no"" to any offer (even if it comes from any drug lord) that helps him maintain his cash flow that obviously was becoming unmanageable for him by every passing day. Although, I must admit that it was quite a fun to watch him trying to manage millions of cash that he had no idea how to spend.You will definitely enjoy watching Tom cruise as Barry Seal who uses CIA to get his end of the bargain (and they thought that they were the only smart guys who live in one of the greatest countries of the world).If you want to go on an adventure trip, go watch this movie and you will understand what Tom Cruise really means when he says, ""I am just a gringo who always delivers"".",7.0,Anonymous,Biography
"Entertaining, but quickly fades","American Made was a good watch - the story keeps a good steady momentum, the direction and editing are vibrant and dynamic. It has the vibes of something like Wolf of Wall St or a Guy Ritchie film, where despite the nature of the events you find yourself rooting for a criminal and laughing at the black comedy of how things unfold.But it stays firmly in the mode of fast-paced 'zany' without ever really digging into emotions, desperation, or any human reflection. Barry Seal as a character remains a breezy, zany blur. Its just that kind of film. I think Cruise has a lot to do with that - his vanity as an actor, having to be seen as either confused- smiley or cool-intense in any given moment limits his courage to do anything else (Born on the Fourth of July was a real anomaly for him in terms of range).Its as entertaining as any two episodes of Narcos - but without Narcos' complexity and variance. Good but not great, definitely worthy of a viewing.",6.0,Anonymous,Biography
Top flight,"In director Doug Liman who Tom Cruise has worked with a few times, Cruise has found someone who he could loosen up with a little, make a lower budget colourful flashy film where Cruise can be a little chaotic and free wheeling.American Made is a fast paced film. A wily, naughty mischievous risk taker Barry Seal who goes from being a TWA pilot to a CIA contractor who ends up supplying arms to trafficking drugs for Escobar to training an illegal right wing Nicaraguan army.Seal makes so much money he does not know what to do with it or even hide it. Of course there is a downside, eventually they are all after him and even his cunning cannot evade them all. Pursued by the FBI, Police, DEA, various cartels, Seal really has nowhere to run or hide.Cruise seems to be enjoying himself on screen, Liman keeps the film moving but in a sense it is a familiar story. Once Seal makes it big, has a few bumps along the road, you even get that scene when you know the decline in his fortunes will start.",7.0,Anonymous,Biography
Cruise makes a Comeback,"Tom Cruise is back with a vengeance and after the train wreck that was The Mummy i can safely say that this movie proved that Cruise can act and Liman can direct.While the narrative structure isn't always the best flowing the movie delivers great performances, an atmosphere that sucks you into the time period, and well made shots.A highly underrated movie that i would personally recommend and a definite 8/10.",7.0,Anonymous,Biography
Doug Liam and Tom Cruise make such a great pair,"Very few directors have tapped the clown in Tom Cruise the way Doug Liman has. He had directed Tom in Edge of Tomorrow which was humorous and was set amidst a post-apocalyptic alien invasion. American Made is just as humorous and is also set amidst an invasion of sorts except this movie is a true story. Captain Barry Seal had the adventure of a lifetime before falling prey to a monster of his own doing. But what an adventure it might have been for this man to smuggle contraband into and out of the States.I felt Tom Cruise did a great job portraying the pilot in an extremely light-hearted and funny way. Cruise is known for playing roles that ooze oodles of dare-devilry. But most of those roles are of fictitious characters. For once Tom plays a real man whose daring knew no bounds. Captain Barry Seal was like a real-life Ethan Hunt. Hence I feel casting Cruise as Seal was an extremely appropriate decision and should help in filling Universal Studios Entertainment's coffers.If you were awed after seeing the aerial sequences in Dunkirk, wait until you have seen this film. The planes are subjected to go through some intense acrobatics which will please you. If you were disappointed with Cruise after watching The Mummy, I can assure you that you will heave a sigh of relief after watching this film. The film's story is not only engaging but also witty and hilarious. There are hardly any stagnant moments so the probability of you getting bored is very low.A very ironic thing about American Made is that in 1986 when Barry Seal must have gone through whatever turmoil he did, a young Tom Cruise played a pilot in Top Gun which released that year. Did he know he would pay a real-life pilot who was very relevant during those days almost 31 years later ?Watch American Made . Don't watch it for Tom Cruise's stardom. Watch it because you deserve to watch an entertaining and great film on the big screen that coincidentally has a superstar playing the leading man. I humbly apologize for the length of this post but sometimes I just can't control myself from pouring my thoughts out",9.0,Anonymous,Biography
"' DoubleCrossed"" with dennis hopper  was better",I do love Tom Cruise movies...he is great... but in this instance....this movie is yet another remake....it should be called American Re maid....the original with the late Dennis Hopper was more believable and funnier.......Tom should keep his flying movies to Top Gun and its sequels.....So watch this movie with a grain of salt and than go watch Double Crossed...and tell me what you think... I believe you will be pleasantly surprised!!1,7.0,Anonymous,Biography
Cruise Flying High Again.,"If you ask anyone to list the top 10 film actors, chance is that ""Tom Cruise"" would make many people's lists. He's in everything isn't he?  Well, actually, no. Looking at his IMDb history, he's only averaged just over a movie per year for several years. I guess he's just traditionally made a big impact with the films he's done. This all rather changed in the last year with his offerings of the rather lacklustre ""Jack Reacher: Never Go Back"" (FFF) and the pretty dreadful ""The Mummy"" (Ff) as one of this summer's big blockbuster disappointments. So Thomas Cruise Mapother IV was sorely in need of a upward turn and fortunately ""American Made"" delivers in spades.""Based on a True Story"" this is a biopic on the life of Barry Seal, a hot shot 'maverick' (pun intended) TWA pilot who gets drawn into a bizarre but highly lucrative spiral of gun- and drug-running to and from Central America at the behest of a CIA operative Monty Schafer (Domhnall Gleeson). All this is completely mystifying to Barry's wife Lucy (Sarah Wright) who is, at least not initially, allowed to be 'in' on the covert activities.The film is a roller-coaster ride of unbelievable action from beginning to end. In the same manner as you might have thought ""that SURELY can't be true"" when watching Spielberg's ""Catch Me If You Can"", this thought constantly flits through your mind. At each turn Seal can't believe his luck, and Cruise brilliantly portrays the wide-eyed astonishment required. This is a role made for him.Also delivering his best performance in years is Domhnall Gleeson (""Ex Machina"", ""Star Wars: The Force Awakens"") as the CIA man with the (whacky) plan. Large chunks of the film are powered by his manic grin.As an actress, Sarah Wright is new to me but as well as being just stunningly photogenic she works with Cruise really well (despite being 20 years his junior - not wanting to be ageist, but this is the second Cruise film in a row I've pointed that out!)). Wright also gets my honorary award for the best airplane sex scene this decade!Written by Gary Spinelli (this being only his second feature) the script is full of wit and panache and - while almost certainly (judging from wiki) stretches the truth as far as Seal's cash-storage facilities - never completely over-eggs the pudding.Doug Liman (""Jason Bourne"", ""Edge of Tomorrow"") directs brilliantly, giving space among the action for enough character development to make you invest in what happens to the players. The 80's setting is lovingly crafted with a garish colour-palette with well-chosen documentary video inserts of Carter, Reagan, Oliver Stone, George Bush and others. It also takes really chutzpah to direct a film that (unless I missed it) had neither a title nor any credits until the end.The only vaguely negative view I had about this film is that it quietly glosses over the huge pain, death and suffering that the smuggled drugs will be causing to thousands of Americans under the covers. And this mildly guilty thought lingers with you after the lights come up to slightly - just slightly - take the edge off the fun.   Stylish, thrilling, moving and enormously funny in places, this is action cinema at its best. A must see film.(For the full graphical review of the film please visit http://bob- the- movie-man.com. Thanks.)",9.0,Anonymous,Biography
""" A Fun Lie Based on a True Story!""","American Made is about as close to a true story as Fargo was claimed to be. That is, not in any way. Doug Liman takes the bit between the teeth and attempts to make some sort of adventure comedy about a guy, who undoubtedly while having a pair, was likely to be a greedy creep. That Liman succeeds to an extent, is largely due to his directorial skills, Tom Cruise's natural charisma and Gary Spinelli's script, which serves up an entertaining blend of one part fact, mixed with four parts fiction.Cruise, who is the physical antithesis of the real life character he plays, brings a boyishly devil-may-care exuberance to his role of Barry Seal. Seal was a former TWA pilot who may or may not have flown missions for the CIA, but eventually did become a drug smuggler for the Medellín Cartel in the 1980s.Punters who love Cruise and fancy a ""Jesse James was really a fun guy looking for a few thrills"" type of story will undoubtedly enjoy this lively romp, which features many historical figures earnestly addressing the screen in newsreel footage seamlessly integrated into the central narrative. Me, I just couldn't shrug the feeling that despite the professionalism of all concerned with the production, this is a story that didn't really need to be told in this format. Seal was no Indiana Jones type hero, who was seeking the betterment of his immediate community. He was as crooked as they come and ultimately probably got what he deserved.",6.0,Anonymous,Biography
A seriously fun Cruise lead comedy/thriller,"While we all eagerly await the release of the recently announced Top Gun sequel, Tom Cruise's latest slice of polished Hollywood entertainment American Made, allows us all to see what it's like when Maverick becomes a little naughty in his retirement from flying fighter jets, verbally sparring with Iceman and making out with Kelly McGillis.Re-teaming with his Edge of Tomorrow director Doug Liman, American Made is a relentlessly energized and seriously fun examination of the true life story of American Airlines pilot Barry Seal, who gave up his life as an everyday pilot to not only become a CIA recruited pilot delivering messages, guns and various other treats to South American contacts, but a drug runner for the Pablo Escobar Columbian drug trade, which makes for a wild ride that would be utterly unbelievable were it not in fact based on truth.Fair warning to all, Liman and his leading man are totally uninterested in giving a dry history lesson of Seal's exploits, as American Made sees the two Hollywood heavy hitters instead turn their trajectory towards delivering a heightened and often over the top examination of these events and with Liman bringing his Bourne Identity and Edge of Tomorrow expertise with him to the event and with Cruise seemingly having the most fun his had in years, the risk to go for something different other than an awards baiting or dialogue heavy expose has paid off hugely, with American Made easily becoming one of the year's most purely fun and enjoyable rides.At almost 60 years of age you'd be rightfully thinking it's about time that Cruise take a seat back and enjoy a more quiet time in his career but the unstoppable and enthusiastic leading man is having a blast here bringing Seal to life.In almost every scene of the film, Cruise and Liman continue on with their rapport that they built in Edge of Tomorrow and Liman should be commended for bringing out Cruise's natural talents for comedy and when mixed with his easy going charisma that has made him such a beloved acting figure, Seal offers Cruise one of his best and most interesting roles in his long and varied career, no small feat when you consider the quality of his often underestimated C.V.American Made's frenetic and sometimes scattered focus may detract from some viewers experiences and those looking for a more sombre take on a no doubt very serious topic may be disappointed but Liman and his cast's (that includes great bit turns from the likes of Sarah Wright as Seal's wife Lucy and Caleb Landry Jones as Lucy's dim-witted brother Bubba) ability to extract the absurdness and craziness of this whole situation and turn it into such a fun piece of entertainment should be a winner in the majority of cases, much like Scorsese's Wolf of Wall Street did.Final Say –With Cruise on top form and Liman instilling his film with a breathtaking amount of energy, American Made is a pure piece of cinematic entertainment and an awesomely fun companion piece to Cruise's other well-known plane centred star vehicle.4 future presidents out of 5",8.0,Anonymous,Biography
American Remade,"Fun movie, if not for the fact that the truth was changed to protect the guilty.In real life, Barry Seal was fired from TWA in '72 when he was charged for smuggling plastic explosives across Mexico. He flew tons of coke into the States for multiple drug kingpins, including Escobar. When he was busted, he started working for the DEA as an informant. He was overweight, poisoned his fellow Americans with drugs; and didn't care about his family enough to enter WITSEC.From a historical perspective, it should be taken with a grain of salt that a guy like Seal, given his position, can be placed in a situation where everything is cool, time after time after time after time again.",5.0,Anonymous,Biography
TomCruise at his best,"A great story perfectly representing those years and with a stunning performance by Tom Cruise. I would say one of the best movie ever, in this genre, which is midway between a CIA based film and a biopic one. Barry's narration, delivered direct to camera, takes the form of a series of clips from a fuzzy home video supposedly shot in the mid-1980s, laying out the historical background in a dense fashion (he pretends at one point to confuse two countries) which seems most directly indebted to Adam McKay's The Big Short. The biggest coup is the casting of Cruise, who functions as a pure icon, recycling all his usual mannerisms – the grin, the hand gestures – and even revisiting his past as a pilot in Top Gun. The catch is that his depthless showboating for once seems intended as anything but likable.",,Anonymous,Biography
Often interesting yet never completely grabbed me,"This fictionalized account of smuggler Barry Seal has much to recommend it. Cruise is his usual charming self, the film is interspersed with these interesting montage moments, and there is breezy humor and an intriguing story of criminals working hand in hand with the U.S. government.But by the midpoint I was just feeling kind of disengaged. I wasn't quite sure what the point was. And Cruise felt slightly off in a role that would make more sense to me if he seemed a bit stupider and trashier; it seemed the equivalent of casting George Clooney to play Lyndon Johnson.In the end, I would say American Made was perfectly fine, but it's the sort of movie I will have completely forgotten in a month.",6.0,Anonymous,Biography
Too long and feels repetitive,"American Made starts off interesting enough. And Tom Cruise is likeable, as usual. But this movie drags on too long and feels somewhat repetitive. Also, upon reading the real story, it's kind of disappointing to realize how many liberties the movie took after claiming to be based on true events. It's worth one watch, but probably not more than that.",6.0,Anonymous,Biography
Corruption Corruption & Mor Corruption,"Although I am generally not a Tom Cruise fan, he was fantastic as smuggler Barry Seal. A very entertaining film. Whether the entire story is 100% accurate we will never know but one thing for sure is that the US Government is as corrupt and filthy as we all think. A great watch.Poke the toker for a couple of laughs.",7.0,Anonymous,Biography
The Fun Way of Showing Biography of Barry Seal's Unique Life,"For a biography movie, this one was interestingly done. The way the story was told made it seemed quite fun. Some portions were using dark humor and Tom Cruise was real charming in here. I could actually picture him as this real unique character. His relationship with his wife and family was also real fun to look at, especially during the moment when he tried to convince her about the good about his works.One cool thing about the movie was the very good costumes and sets. It was like we were transformed into the world of the 1970s and early 1980s when the film was set. Especially the make up effects of Tom Cruise was also exceptional. He looked a lot younger than his actual age here. Even my wife was very amazed with his appearance and looks. In addition to the costumes and sets, the film was also having some songs from that period which enhanced the aura of 70s and 80s here.The main attraction of this movie was definitely the uniqueness of Barry Seal's life as a pilot and smuggler and also the impacts he had in the US history during the Ronald Reagan's presidency then. It even had some political figures mentioned as well. The title of the movie also suit the story very nicely. You would understand why it has such title by the end of the film.In the end, you could already guess the conclusion of the movie. Especially if you are a history buff who already knew the story of Barry Seal. There appeared to be various versions of his life story, so I am not sure either whether the one we saw here was the real actual version. But anyway, in term of entertainment, the movie was made into a non boring kind of biographical movie. However, those who were expecting to see Tom Cruise kick a$$ in this movie would probably be disappointed cause this is not that kind of movie. There were some action scenes but this film could not be categorized as action type. There were no very emotional moments as well (which I found rather odd as usually biography movie would have some of those parts).Finally, if you are looking for a good biographical crime movie, this one might be a good option. Though this was not as heavy as other movies in such category, it was still interesting to see Tom Cruise's portrayal of one of the controversial character in US history. It was also directed by Doug Liman who was the director of some good and/or commercially successful movies such as The Bourne Identity, Mr. & Mrs. Smith, Edge of Tomorrow and few others. But for those who are looking for movies with lots of actions by Tom Cruise, better wait for his next Mission: Impossible movies.For my complete review, pls have a look in michaelnontonmulu.blogspot.co.id",7.0,Anonymous,Biography
Cruise and Liman make a great pair again,"Always reliable if not exactly visionary, director Doug Liman has another entertaining outing with Tom Cruise, reinventing his charm, swagger and grin as tools for finding easy cash and marital respect when honest work doesn't exactly get one far enough.Cruise plays a totally reprehensible and despicable character and yet manages to keep everyone invested in the ride that accelerates with every misstep on the way, fully captivating the audience to wait for the extent of the looming train wreck. Cruise is entirely game here, not once trying to make audience feel sorry for his character or thinking that maybe he had a heart of gold, after all.Worth pointing out is also a stellar turn from a less prolific Domhnall Gleeson whose ambitious CIA operator is equally blind, naive and brilliant, and Gleeson makes his oily presence wonderfully effective.",8.0,Anonymous,Biography
Fast-paced and zany action-drama is Tom Cruise's best movie in YEARS,"""American Made"" (2017 release; 115 min.) brings the story of Barry Seal. After a clever 1970s montage featuring Jimmy Carter's infamous feel-bad speech, the movie introduces us to Seal, a TWA pilot Who is not adverse to shaking things up a bit (literally causing turbulence). It's not long before Seal is approached by a CIA agent to do clandestine reconnaissance in South America. It's not long before Seal gets involved in the Medellin drug cartel in Colombia... At this point we're not even 15 min. into the movie, but to tell you more of the plot would spoil your viewing experience, you'll just have to see for yourself how it all plays out.Couple of comments: this movie reunites director Liman with Tom Cruise, who previously teamed up on the well-received ""Edge of Tomorrow"" (for which a sequel is being planned). Here they bring us (""Based on a true story"", we are reminded at the beginning of the movie) the story of a TWA pilot turned CIA informant turned drug runner. The movie is divided up in chapters, from ""CIA '78"" to ""Colombia '80"" and so on. While the subject matter is quite serious and Barry Seal not particularly likable per se, the movie is fast-paced and zany, and is helped tremendously by Tom Cruise's charming and very effective performance. The supporting cast are for me relatively unknowns, including Sara Wright as Barry's wife, and Domhnall Gleeson as the CIA handler. A minus point is the incessant use of hand-held cameras as well as the use of extreme close-ups. Enough already! We get that it is an action movie! There are tons of great song placements in the movie, and when George Harrison's ""Wah Wah"" plays of the closing moments and the end titles, it perfectly captures much of the movie's ebullience.""American Made"" opened wide this weekend, and I was looking forward to seeing it. The Saturday early evening screening where I saw this at here in Cincinnati was attended poorly (about 20 people in a huge auditorium), much to my surprise. Perhaps strong word-of-mouth can generate a stronger box office performance in theaters. Regardless, this is bound to find a wider audience on VOD and eventually on DVD/Blu-ray. If you are in the mood for a quick-paced and charming drug-smuggling action movie that is Tom Cruise's best movie in, literally, years, you cannot go wrong with ""American Made""",7.0,Anonymous,Biography
