title,content,rating,username,genres
Tom Cruise is amazing,"American Made is a thrilling and captivating cinematic experience that takes audiences on a wild ride through the world of drug smuggling and government corruption. Tom Cruise delivers a charismatic and electrifying performance as Barry Seal, a real-life pilot turned CIA informant turned drug smuggler. The film expertly blends action, suspense, and dark humor, keeping viewers on the edge of their seats from start to finish. Director Doug Liman's skillful storytelling and fast-paced narrative make ""American Made"" an engrossing and entertaining watch. With its intriguing plot based on true events and stellar performances, this movie is a must-see for fans of crime dramas and Tom Cruise enthusiasts alike.",10.0,Anonymous,Biography
Tragedy with a disguise of comedy.,"I wish I could laugh from the beginning to the end, but what I guess what the plot tries to tell us is too heavy to laugh off with popcorns.It may contain certain subjective views of the writer, but that should give you a high-level view of whole the world is manipulated by the power.",8.0,Anonymous,Biography
Worth a watch.,It was great to see Tom cruise in something different after a long time. The movie was good and well directed. I believe it is one of the best Tom cruise movie to come out in recent time.,8.0,Anonymous,Biography
What a disgrace that this movie tried to blame Reagan for something he didn't do,"Without spoiling it, this movie attempts to assign a heinous act to Ronald Reagan when he was in no way responsible. I'm not talking about Iran-Contra in general, but watch near the end of the movie the way they try to frame him as a heartless person who puts someone's life in danger. It's BS - he never did that. Read up on the facts of this operation.",1.0,Anonymous,Biography
Very good movie!,Excellent movie! Enthralling story line and very good acting.,9.0,Anonymous,Biography
Very Solid Little FIlm,"It's not particularily high budget or (on release) well publicised, but this is another good film starring Tom Cruise. A little bit different to the usual shooting and car chases. Following the life of an airline pilot that pitfalls his way into the deep state. First taking spy photos and then as a drug smuggler. This is a neat little film and there is not much time to feel bored. Everything happens pretty fast and at times the story suffers from a few parts where you have to fill in the blanks yourself. But I really enjoyed this film overall and it has a few funny scenes too. It is not a hugely political (propaganda) film and actually a fairly honest portrayal of South American drug smugglers and the immoral American facilitators. It is not a left wing film that is basically blaming Americans for everything, which is nice because if it had been it would have been terrible. These are all criminals and immoral people and the film isn't too worried about showing these characters as dangerous. No doubt the real life counterparts were extremely dangerous. This is portrayed brilliantly by Cruise's character having guns pointed at him every time he touches down in a cartel jungle hideout.The CIA handler in this film is also quite funny. He is very well versed in 'thief' speak and does not give anything away. Not even his real name as the movie ends! Also the guy who plays Escobar looks so like the real Escobar I was wondering at times if the real Escobar had never actually gone to jail and played his own part! The ending is a little bit predictable but is also a very emotional one for the viewer. I don't want to give too much away there. All in all a good watch",8.0,Anonymous,Biography
Messed up,"This movie really shows how messed up the American government is and how they willingly destroy people's lives in order to frame their opponents. Really made me question a lot about what I get told about Iran, Iraq, Mali, Syria, Somalia, Libya, Ukraine and Russia. You cannot trust your government.",8.0,Anonymous,Biography
An entertaining story loosely inspired by real events,"This film is centred on real life former TWA pilot Barry Seal who later spied for the CIA and smuggled drugs for the Medellin Cartel. Seal is somewhat disenchanted with his work with the airline so readily accepts when Monty Schafer, a CIA case officer offers him another job; he is to fly at low level over suspected communist camps in Central America. This is a success and he is later asked to act as a courier collecting information from Colonel, later General, Manuel Noriega in Panama. On one such trip he is approached by members of the Medellin Cartel... they have an even better offer; they will pay him handsomely to smuggle drugs into the United States. As the situation in Central America, in particular Nicaragua, hots up Seal's life becomes more complicated and dangerous... but also far more profitable.Like most films 'inspired by real events' this takes many liberties with the actual truth; that doesn't matter too much though as it never takes itself too seriously. Tom Cruise is great as Barry Seal; he has the natural charm that makes the character believable even when the situation looks about to overwhelm him. The supporting cast are solid too; notably Domhnall Gleeson as Schafer and Sarah Wright as Seal's wife Lucy. There is plenty of entertaining action, some tense moments a fair amount of humour. The story plays out nicely; it probably helps if you have some awareness of certain major events of the time and know who the likes of General Noriega and Colonel Oliver North were. Overall and entertaining film set in the world of smugglers and spies.",8.0,Anonymous,Biography
Tom Cruise is great here,"He takes a bunch of crap from the general public, but he is a very hard worker and rarely doesnt bring his A game. My biggest issue with the film is the filters used. It seems they were hiding cheap CGI at times.",8.0,Anonymous,Biography
Good one,Yeah...Good one,8.0,Anonymous,Biography
disappointing snooze,"Who doesn't love a good Tom Cruise movie? I was ready to love this but from just the first few minutes this was boring as hell and as the hours went on, the plot only thickened with boredom. Don't make the same mistake I did. Skip it.",4.0,Anonymous,Biography
"Great story, good film--but is it true?","Wow. What a tale. Is it really true? I have my doubts but, then again, knowing what I do about the Caustic Incompetence Agency, it certainly lies within the realm of the possible. Good performance by Tom Cruise, as always, whose talents have not been tainted by age.",8.0,Anonymous,Biography
what a movie,It's realistic as much as it's keeping fictional fun and adventure. It can be the only movie I'm glad Tom Cruise is always taking the part of playing himself in every movie. Because he is just fitting in this role. He is always different versions of Tom Cruise. He is definitely not a character player. He is the best double of himself. That's why he's doing most parts of his stunt actings.The movie is doing a great job to keep less its cast because narco action movie can become very confusing with their very crowded character casts. Sometimes I get lost in characters and names.,8.0,Anonymous,Biography
chaotic fun,"Very good show of roller-coaster riding aviation and muffin puffin drug humour.especially one scene with tom cruise running along with a cloud of ''flee powder'' are extremely fun. i like the sound and light settings in this movie.very nice choice of music,though a little bit chaotic and shallow script to follow. it is a hasty lesson of American hidden ''red fear'' policy era, so i feel that the basic knowledge of the real history is beneficiary to enjoy this movie..too much money to hide to make it a 10'er. this is a likable edition of tom cruise,and the movie are within the range of my top 250 movies",8.0,Anonymous,Biography
"Fast-paced, Funny, and Entertaining","American Made feels like something we've all seen before, but it plays out with so much style and charm that it remains wildly entertaining the whole way. Cruise is well-suited for the role, and he turns in arguably his best performance of the decade. The rest of the decently large cast ranges from competent to very good, but it's really only Cruise that gets the proper screen time and character depth to carry the movie, and he does very well.Doug Liman directs the movie in his usual fast-paced style, but with dealings (drug, arms, and otherwise) taking place of the prototypical action/fight scenes. The intensity of this film comes from Cruise's Barry Seal, and the situations he manages to find himself in, rather than your standard action fare. The movie mixes comedy with intensity, as Seal finds himself in increasingly richer as he takes on more dangerous scenarios. Liman does very well with this style, and it gives the movie an interesting aesthetic - almost like The Wolf of Wall Street if directed by Kathryn Bigelow.For me, this is one of the biggest surprises of the year. I personally thought the trailers made this film look incredibly generic, like a typical action rehash. What we get instead is a wholly entertaining political action/comedy that is simply super fun to watch.",9.0,Anonymous,Biography
Barry Seal is a lowlife and probably a murderer,Barry Seal is a lowlife and probably a murderer of two teenage witnesses in Arkansas. He's definitely a shameless drug runner. The casting of Tom Cruise in this role is a huge misleading mistake. There's nothing charming about this tool,2.0,Anonymous,Biography
American Made,"This movie is a must see to believe. Tom Cruise hits center mass with his performance and the supporting actors wrangle us in, depicting a true life story that is unbelievable if it weren't true. Smh at the hypocrisy and double standard of our American government. Reality is often times stranger than fiction.",10.0,Anonymous,Biography
Men provide for the family,"Barry Hill is the men. He provides for the family. He sold drugs. He smuggle weapons. He shoulder all the burdens even the wife and family don't understand. Even the wife accused him of being wrong, He just shoulder up and work hard like a mule. 
No matter how messed up his brother in law , he at least tried to be friendly and give him a job. Sadly in return is extortion and ungrateful attitude.
Sadly also he is just a pawn for the government, expendable, any time to sacrifice when not needed. 
At the very last moment, He trade his life for the lives of his family. This movie is awesome like an documentary. It illustrates a picture of the 80s American society.
Who are those state attorneys to accuse Barry of wrong doing? American bureaucratic systems are even more corrupted than mobs.
Barry Hill deserves this fortune. I was curious what his wife would think about throwing away the jewelries when she ended up in Kentucky Fried Chicken.
American Made, the name of the movie, so vivid, American government create those cartels and finally destroyed an expendable pawn to pretend the justice. 
Barry Hill, a good man, a real soldier and patriot, may you rest in peace and god have mercy in your soul.",10.0,Anonymous,Biography
Action and Truth too,It was a bit of action with history. That's what I liked; I'd heard A lot about this event. The way they put it together its about what's going on in the World right now. Still Great Job. Tom Cruise is still a GREAT Actor. This was a Great Movie & Worth watching.,10.0,Anonymous,Biography
Truth is Often Stranger Than Fiction,"I will admit, I don't know as much about this time in history as I feel like I should. Plus, with many ""Based on a True Story"" movies, it can be hard to tell sometimes what actually happened or what was compressed or exaggerated for a movie moment.But if even half of what happened in American Made is true, then it would still be a fantastic story, and Doug Liman did an excellent job bringing it to life.Tom Cruise plays Barry Seal, a pilot for TWA who is recruited by the CIA to take reconnaissance photos of Central American militants during the late 1970s to early 1980s. However, his life gets more interesting/dangerous/lucrative when he gets roped into working for Pablo Escobar smuggling drugs, and eventually transporting weapons to the Contras of Iran-Contra infamy.These events play mainly as a stage setting for the story of Seal as he juggles all of these things while trying to provide a good life for his wife Lucy, played by Sarah Wright, and their children. It presents an interesting dilemma: does Lucy trust Barry, even if it means building a fantastical rich life only to have it potentially crumble away?Indeed, Doug Liman does a great job showing the chemistry between Cruise and Wright, and in that is the film's strength.It also has fun with the narrative structure, with Seal essentially narrating his exploits through recorded tapes after the fact.Where the film sometimes slides is when it has to stop dead and explain just who all the players are and what the significance of these events is. Sure, at first they can be funny in their presentation, and as someone who doesn't know a lot about these events it can be helpful, but it tends to interrupt a fun scene at a critical time, killing the mood a bit, and it breezes on to the the next scene without a chance to bring that mood back.Overall, I would say that this film is a fun historical drama with plenty of good-natured humor to keep it afloat, and even if some things may not have actually happened, you don't care because everyone involved is having fun as well.",8.0,Anonymous,Biography
"Very original, VERY bold","This movie tells you a WHOLE lot in an action movie. It's actually very damn serious, but it is made entertaining and easier to swallow and actually I believe totally conveys the type of mood and responsibility level all the people involved were at. You think all bad people are all serious...no they apparently are totally irresponsible and do not realize the weight of their actions, and this movie shows it very well. I enjoyed it a lot.",10.0,Anonymous,Biography
Not bad but too long.,"I found the movie to be more like a collage work. It started with animations and cartoons and then they totally lost the style. It is too long for the scenes 1:35 will be the ideal length. Also, It was scratching the surface instead of going into details, I had to browse wiki in the movie to understand some points. After all it is not a documentary but not not a documentary too.",5.0,Anonymous,Biography
I did not want to like this film,"Tom Cruise is amazing, the story is excellent, well paced and always interesting. I did not want to like this film but loved it. Tom plays Barry Seal and I think he perfectly captures the essence of a devil-may care guy who gets an opportunity that is ""too good to be true"". He leaps before he looks too deeply into the implications and ends up somewhere he never imagined.At first I did not care much about Barry and his wife and kids but gradually, surprisingly, I did. Congratulations to everyone involved in this wonderful movie. It has more depth and heart than most movies and is a great story as well.",10.0,Anonymous,Biography
Worth Watching,Well paced movie with Tom Cruise's usual excellent job of acting.,10.0,Anonymous,Biography
"CIA, DEA, REAGAN, WHITE HOUSE AND THE BLUE STAR","You may see this just as a movie, but in real life THOUSANDS of innocent lives were killed in the wars at Nicaragua and Colombia, caused by the greedy American Government Institutions. Who is really going to pay for those loses? When are the Reagan/Bush/Cheney/Trump cartels going to be stopped. because the very same thing that US made to Nicaragua, is now being made right now in several other countries.
If you are an American, you may consider start acting to make of your nation ""the greatest country in the world"", instead of the puppets of the domination system (aka Isra...)",10.0,Anonymous,Biography
Tom back in the game,I absolutely loved this movie and to capture a side to Tom Cruz not yet seen I believe before. The story was true to the core every screen shot had something deep to say I recommend this movie your time will be well spent and fully entertained. I have always believed the true story's are the one worth watching. I gave it a 9 out of 10 stars. Congrats to all the actors they pulled it off with wonders.,9.0,Anonymous,Biography
Just a hell of a lot of fun!,"'AMERICAN MADE': Four and a Half Stars (Out of Five)A biopic based on the life of a former TWA pilot, named Barry Seal, who became a contract pilot working for the CIA, as well as a drug smuggler for the Medellin Cartel (in the 1980s), and later served as a DEA informant. The movie stars Tom Cruise as Barry Seal, and it costars Domhnall Gleeson and Sarah Wright. It was directed by Doug Liman (who also directed Cruise in 2014's 'EDGE OF TOMORROW'), and it was written by Gary Spinelli. The film is a modest hit at the Box Office so far, and it's also garnered mostly positive reviews from critics. I found it to be a highly entertaining, and pretty educational crime biopic.In the late 1970s, Barry Seal (Cruise) was a bored pilot working for TWA, and also smuggling illegal cigars into America. He's approached by a CIA operative, going by the name Monty Schaefer (Gleeson), and offered a job flying clandestine reconnaissance missions over South America. Seal is later asked to be a courier between the CIA and General Noriega, and during this time he's also asked to fly cocaine into the US (on return flights), by the Medellin Cartel. The CIA pretends not to be aware of this, and continues to employ Barry; while moving him and his family to Mena for safety. Seal continues working for the cartel, and the CIA (making tons of money), while also trying to keep his wife (Wright) and daughter happy.The movie is surprisingly entertaining, from the opening scene till the very last (and that's a pretty high compliment in my opinion). It's just a hell of a lot of fun! Cruise is amazing (like usual) in the lead, and he pretty much makes the whole movie work (on his own almost). Liman is a decent enough director too, but this movie is all about Tom Cruise (and he totally sells it). It's also amazing how he can make a character that should be pretty unlikable, in any other film, totally lovable (despite all of the immoral things he does). The movie is just a blast to watch, and that's saying a lot for a biopic (in my opinion). I usually think they're boring.Watch an episode of our movie review show 'MOVIE TALK' at:https://vimeo.com/236806254",9.0,Anonymous,Biography
"Its an entertaining movie, quite sensational","Some people don't like Tom Cruise and thats okay. Personally i feel he did an awesome job in the movie. he brought some humour to it which is normally reserved for the comic relief characters, but in this movie he slightly adopted that role. The action and suspense in the movie is pretty good as well. its entertaining throughout generally throughout the whole film. Its definitely a fun movie for a date or if one is bored. All in all, the plot and the scenes are satisfying and there are quite a few laughs in the movie. Go give it a watch and see for yourself. but for the most part the general audience will like and appreciate it! The supporting characters do an awesome job as well, to compliment tom cruise and he also compliments them",9.0,Anonymous,Biography
The music was bizarre!,movie tempo was quick and the music made it very bizarre! It could have been a good movie without this music.There was not enough dialogue and it was all action and action. Tom Cruze seemed to be not taking it seriously and was always smiling. But it was fun after all. It would have been to mention this is a true story. I saw none.,4.0,Anonymous,Biography
A Fast and Energetic Spin on a  Familiar Story,"American Made is a fast and energetic rise to power/fall from grace movie made in the same vein as Wolf of Wall Street and War Dogs. What sets this movie apart from those is an extremely charming performance from Tom Cruise. He gives his best performance in years, portraying a morally ambiguous yet charming character. Doug Limon's direction is also good. He crafted an energetic movie that manages to balance his kinetic style with an interesting story. If you've seen Wolf of Wall Street, War Dogs, or Goodfellas, you will probably know almost every beat of this story, but Tom Cruise's performance helps this movie stand on its own.",8.0,Anonymous,Biography
Very Entertaining --Cruise & Crew talent at its best,"Very entertaining. This movie was made with every one of its fibers to entertain. -- instead of just focusing on action shots alone to carry it like so many other lousy action movies do, this one has all the other qualities a ""real"" movie has: Very well written, acted, camera work, the pace of it is perfect ---exciting through and through. Except for the jabs at my side of the political aisle--that was hard to see. Every administration (Dem or Rep) is guilty of so much behind-the-scenes poor decision making in our history. So I hope it doesn't turn anyone an opposite aisle. But this movie is truly a success because of it's main actor, Tom Cruise, What can I say?... At the same time I have no over-the-top stumbling over myself fondness to go see all his movies, those that I do go to it's so noticeable-- he just succeeds time after time in making fun to watch movies. His on screen presence (true talent) is tops in the industry. Every time you see Cruise in a movie it's not Oh there's Tom Cruise in this movie or that movie playing this/that person, but instead you lose yourself in the actual character he plays and you just sit back and enjoy the show. This is a sign of true talent, and Mr. Cruise has talent on screen and never fails. He is what a lifetime achievement award is made for --and will be handed to one day -- hopefully many, many years away. Hats off to him yet again, he works hard to entertain and he delivers every time. (although I haven't seen all of his movies -- those I don't care for the genre: i.e. mummies or vampires.. so I have no idea how he does in those.) Go see this movie! and leave your young kids at home.",8.0,Anonymous,Biography
"Cruisin at 10,000 feet","Tom Cruise and director Doug Liman take a page out of Martin Scorsese's book with a broad biographical take on prolific 80's drugs and guns smuggler Barry Seal.The Good: Like Scorsese's Goodfellas, Casino or Wolf of Wall Street, American Made takes an overall breezy just the highlights flashback approach to a tale of a never do well who hits well above his weight class. Tom Cruise is excellent in the lead role and while the rest of the cast is a bit forgettable (There is no Joe Pesci here) they certainly do a fine job. The movie is also beautifully shot and the period details of the late seventies early eighties seem spot on.It is also nice to see a major motion picture that doesn't look like a video game or tries to pass off various parts of Canada as the United States and Columbia.The Bad: Fans of historical accuracy are in for a rough ride. For starters, the main character Barry Seal's nickname was El Gordo and he weighed over three hundred pounds. Not an exact match for Mr. Cruise. Many of the actual events shown are simply made out of the whole cloth. The movie also has an annoying habit of name dropping (Like a protagonist in an Assassin Creed video game everyone Barry meets or interacts with becomes or is famous.) They even manage to get five presidents in a movie that takes place over only seven years (Carter, Reagan, Bush, Clinton, and W all cameo in the movie through TV shots, phone calls and W in person.Also, speaking of El Gordo, good lord has Benito Martinez (David Aceveda from The Shield) put on some weight.In Conclusion: I love this style of movie that Scorsese perfected years ago (A shout out to Brian De Palma's Scarface as well of course.) Director Liman never quite reaches those heights. The lack of memorable secondary characters doesn't help but it is the fact that our main character gets all this money but seems to have no idea what to do with it outside of burying it in the yard and putting it in the bank that puts a damper on the ride. Liman never really shows any Gomorrean excess that can make these films a guilty pleasure.American Made is a very solid, handsome outing. Cruise continues to show himself as rising above his material and who always seem to give a 110%. He really is only better with age.",8.0,Anonymous,Biography
"Short on Entertainment , awkward acting .",Hollywood hypes itself and many of you swallow the bait . They take your money for a mediocre films that get better rating due to the hype . New films are the same old components juggled around and reheated . This dinosaur is looking old and pale and weary and Cruz is the same .,1.0,Anonymous,Biography
What A Watch!,"American Made was fantastic! I loved every minute of it, the story itself is superb, we start off with the story of Barry Seal (Tom Cruise) an ordinary American pilot who became a drug-runner for the CIA in the 1980s in a clandestine operation that would be exposed as the Iran-Contra Affair. That alone was enough to make me want to watch the film and I'm so glad that I did. This film excels in every area you could ask for in a movie, let's be real has Mr Cruise ever made a bad film? I have yet to discover.What I like about this entertaining masterpiece is that it's all based on a true story, all of this actually happened and that's what makes it so incredible, a man who worked for the CIA and the Medellín Cartel, Escobar was sure a story that Is a fascinating one.All in all this was an incredible film that you should not pass the opportunity on, great setting for an epic adventure from the start to finish, the character development is crazy, highly recommend. You won't be disappointed!",10.0,Anonymous,Biography
