title,content,rating,username,genres
A Classic,"From the opening scene where Christina sings ""Something's Got A Hold On Me"", you know you're in for a fun ride, this film is exactly what it set out to be, a fun no nonsense ride with great music.The acting is good and Christina is a lot better than other pop-stars who have ventured into acting like Britney or Mariah, it is something she should have done more of over the years.The film is very well choreographed and oozes sex appeal throughout, the songs are great though not having Cher and Christina duet was a giant error in judgement.I give this a 10/10 not because it's a perfect film but cause 12 years later it's something I still revisit and watch yearly.",10.0,Anonymous,Music
The first role of Cher since 1999.,"If you want to see a movie that brings out the mood and after the end leaves a strong desire to dance, then Burlesque, is the ideal choice.The beautiful girls, the costumes that leave no many in imagination, the nice choreographies, the uplifting music and the sexy atmosphere is unique characteristics of this musical, who certainly not bet at the script, which is irrelevant and banal, but at the debut of Christina Aguilera. Without being impressive and without being disappointing the famous singer, responds to a large extent at the demands of the role and of course a big help is her amazing voice. In contrast Cher is weak and is saved by the presence of Stanley Tucci, who even if repeats, always wins the spectators. The songs, while not affecting the aesthetics, they are all, irrelevant. Can for example the song lyrics, at «Nine» to be moderate, but by leaving the Cinema we humming 'Be Italian'. Here, unfortunately we have neither a memorable melody. Burlesque certainly not remembered for long -for men of course, quite the opposite will happen-but we had fun, although the whole show now seems somewhat obsolete.",5.0,Anonymous,Music
Burlesque,"I choose this film because it is a film that you can watch over and over again and never get bored of it. It is about a girl names Ali Rose who is frustrated with her boss not paying her so she packs her bags and leaves and she starts a new life in Los Angles Once in Los Angeles, Ali begins searching for places to audition, failing at every attempt to become a singer but as she is walking during the night, she follows the sound of music into a building, having unknowingly arrived at a burlesque club, where Tess and the dancers perform ""Welcome to Burlesque."" Once inside, Ali meets Jack, and decides to pursue a career on stage. Jack refers her to Tess for an audition, in which Ali is rejected instantly and ushered out by Sean Instead of leaving, Ali begins serving customers at the club as a waitress, while Tess and Sean observe with Jack asking Tess to give Ali a chance to audition Ali gets to audition and then becomes a dancer and singer.",10.0,Anonymous,Music
The Vidiot Reviews...,"BurlesqueThe difference between strippers and burlesque performers is that the latter have long tufts of thread growing out of their nipples.What's more, as this musical points out, burlesque performers also dance and sing – some better than others.Arriving in L.A. with dreams of making it as a singer, Ali (Christina Aguilera) is drawn towards the mystique of a local burlesque club.Determined to join the risqué revue, Ali begins to work at the club, despite the owner Tess' (Cher) objection.But when it becomes apparent Ali can sing better than the current lip-synching head dancer (Kristen Bell), Tess gives her the lead in hopes of raising enough capital to save the club from being torn down.While the story and acting is almost there, the musical performances by Cher and Aguilera keep Burlesque from becoming campy.Unfortunately, like burlesque itself, this movie will only interest gay men and overweight women. (Yellow Light)",5.0,Anonymous,Music
Boo for Burlesque!,"The musical ""Borelesque"" I mean ""Burlesque"" was grotesque with its formulaic tune. ""Burlesque"" stars Cher as Tess, an L.A. burlesque-club owner who must come with a big show of cash in order to save her struggling club. However, the movie is really the showcase of Christina Aguilera who also stars as Ali, an aspiring singer-dancer who heads to L.A. from Iowa to make it big, what an innovative concept for a movie! Sorry, I used to work at Sarcasmesque. Anyways, Ali slips into Tess' club, and well you could figure out the rest. female protagonist stars with lousy job, her co-workers think she is a nobody, she meets a male friend, she gets a chance to show her talent, she makes it big, she falls for male friend, she has a jealous rival out to ruin her, she has conflict with lover, she has a conflict with her superior, problems eventually get solved and the rest is. well, you get the picture. Or maybe you should not get this picture. Writer-Director Steve Antin's directorial and screenplay ""Burlesque"" antics were making me hope that the show must not go on. I was not moonstruck with Cher's over-the-top performance as Tess; if I can turn back time, I would have fast forwarded all her scenes. Aguilera was not too shabby in her debut acting performance as Ali, but I was more impressed with the voice than the act. Stanley Tucci's performance as the club's gay fashion designer in ""Burlesque"" was dressed with the same characterization as his duplicate character in ""The Devil Wears Prada"". What's next ""Tucci Wears Gucci""; sorry Stan, I know you are a hell of an actor. Eric Dane seemed bored in his portrayal of Marcus, the wealthy magnate who is trying to buy Tess' club. Kristen Bell's work as the villainous dancer Nikki also danced itself with too many over-the-top moves. Cam Gigandet's performance as Ali's love interest Jack (who is also one of the club's bartenders) was a bit charismatic but not gigantic enough. The music of ""Burlesque"" was at zero level in my goose-bump meter. So I guess it does not take a rocket scientist to figure out that ""Burlesque"" to me was a near complete mess. ** Needs Improvement",4.0,Anonymous,Music
Surpassingly refreshing and and well done film that channels the likes of Chicago and and Pretty Women,"With a nod to the past and a glimpse to the future the Iconic girl power in this movie is both symbolic and surprisingly refreshing! You can almost see Cher hand down the torch to Christina Aguilera and you watch this visual spectacular extravaganza unfold scene after scene!When I first herd of this film being in production I immediately thought ""Oh God, GLITTER! or that horrible catastrophe CROSSROADS"" But, without giving away any details, I will say I was shocked! Christina came across as a natural talent. We all know she has a stunning voice but could she cut it with those acting chops!? Im going to say Yes! It was as if she has did this all before and as I watch, full expecting her to fall on her face, I fell in love with her not just as Ali, A small town girl who moves to Hollywood to chase her dreams, but as an actress! I believe this sis the start of a bright acting future for her!Cher was phenomenal as usual but we all knew that! Who better to play Xtina's, Mentor in the fill, Tess, then Cher? I want to keep this short and sweet so I will move on to the downers!Ali, Xtina's character Ali, was a little under developed. There was not enough Info about her past and who she was before deciding to Move to California. We have no idea how she crafted her skillful voice or why she decided to chase her dream. That only bad reflection on the writers which I'm sure was originally filmed but later cut on the editing floor, And lastly, This is a bit of a bash on Xtina but nothing to serious! Though I mentioned earlier was a natural to the acting game, she had one emotional scene that just didn't work for me. At some point she is crying on the shoulder of her love interest, Jack, and it was a little unbelievable! Bad acting a little! however I don't think it took away from the film as a whole and it was the only scene her inexperience was noticeable! I believe in the upcoming roles she will prefect this craft a little better!If you like romantic comedies this is the movie for you! Its fun and playful with great characters and story line and amazing songs and dance numbers to compliment the film! Mix in Kristin Bell, Stanley Tucci, Eric Daine, and Cam Garinet and you got an all star cast to round out the roster! Amazing musical film that is definitely a mist see!",10.0,Anonymous,Music
Okay but not great,"Saw it with the wife. Not a bad film but not something I would see myself. I'm no fan of Cher or Christina. It wasn't offensive or extremely entertaining, just a movie made for fans of these singers. Cher, who I think it like 85, looks like a drag queen. She is not aging gracefully and is the perfect example of bad plastic surgery, however I do not deny her talent (but again, I'm not fan).The numbers are done well and again, this is a well made film but if you're not into this type of movie or either one of these singesr, this is a date movie at best. I saw many couples in the theater so I think it was all guys whose wives dragged them to see it, and some younger ""Glee"" type fans and fans of Christina. I did not see any guys with other guys although I'm sure in certain parts of the country, there was that in the theater too.",5.0,Anonymous,Music
Hollywood musical with lots of kick.,"Cher is great in this movie. She should be nominated for the Academy Award for Best Actress. And the movie itself is wonderful. It's far-fetched, brassy, silly, wonderful. The musical numbers are incredible. Christine Aguilera is charming and wow, can she sing! Even the bad guy is wonderful. This is the type of movie that makes you feel like you don't want it to end. It offers nonstop music, melodramatics, silly scenes, and laughs. Stanley Tucci is great as Cher's assistant, friend, and confidante. Burlesque is larger than life, it's pure escapism. The musical numbers fill the screen, the music is loud, snappy and upbeat. The movie has no lulls, is entertaining, has a simple storyline and likable characters. If anyone thinks that Cher is over the hill, watch this movie and think again, And if anyone thinks that Ms. Aguilera is not star material, watch this movie and think again. This movie is proof that the Hollywood musical is still alive and kicking.",9.0,Anonymous,Music
Ugh!,"Oh brother, thank God I didn't spend money to see this miserable excuse for a film. Where does one begin? Okay, Cher! I was in college in 1965 when Sonny & Cher hit it big and the ole girl is still pumping em out - but my God she looks younger now then she did 45 years ago - in fact Cher has had so much plastic surgery that her face is like a mask incapable of any kind of normal human expression - yikes - bizarre to say the least! I'm sure she looks great on the stage but on film, no way Jose! Please Cher no more movies! Your time has past big time! There is a really cute scene where two guys get together and one can't remember the name of the other and Eric Dane is a always fun to look at but the story is so lame, so old, so utterly lifeless and humorless that one yearns for anything to break the pall that hovers over the story like a death watch.",3.0,Anonymous,Music
One of my go-to feel good movie!!,"It's one of the best movies I've watched ever! Have watched it up to 50 times and it never disappoints. Of course the music is fantastic, it's Christina Aguilera, the acting is also 10/10, same goes for the whole plot for me. It's just amazing! Would recommend without a doubt!",10.0,Anonymous,Music
Good choreography and staging cannot make a film alone,"Being a Christina Agulera and Cher fan, the prospect of this film, and the trailer really enticed me to go and see it, however I was bitterly disappointed. Where the film really excels is on the stage. The dance routines are well choreographed and staged and do have an air of excitement about them, however once the heftier dialogue scenes took place you can see that neither the script nor the storyline have legs.The characters were very two-dimensional especially from the younger cast. Agulera's character didn't even seem to transition as she went from place to place, through each struggle. She played a so sweet she'd rot your teeth small town girl, with a big brain and big talent and her aggressive outbursts were laughable. Clearly Agulera does have a talent, which was over showcased, for singing. Her acting ability needs more work, her chemistry with the insanely good looking Cam Gigandet was as flat as the glass of coke thats been by my bed for 2 weeks. Other performers also failed to shine, Stanly Tucci who I am a fan of played his usual gay character with little enthusiasm and Kirsten Bell acting her abysmal dialogue as best she could.Cher clearly had the best character to work with, and played it reasonably well, and though with an inferior voice to Agulera, her numbers were a nice break from the excessive use of Agulera. Her face, however is so frozen in time that her acting ability is marred by the lack of expression her face can muster.The storyline was extremely weak and some of the scenes in the movie seemed to come straight out of the far superior Cabaret, starring Liza Minelli. Even though musicals don't have to have amazing story lines, it at least has to try and make the one it has as enjoyable as possible. Too much was crammed in. Several love affairs, the financial difficulties of the club, rivalry between the girls, hidden talents and friendships. Choosing one or two paths may have made this film far better, but it tried to fill too much into its excessive running time. The songs in the film though enjoyable were a little uninspired, and with Christina Agulera singing virtually every number they all start to sound a little too similar.All in all I really would not recommend this film, good song and dance sequences cannot lift this film from mediocrity and below. I went in knowing Christina Agulera had a good voice, I came out knowing nothing of the contrary. A little more scope and storyline could have made this film a whole lot more enjoyable. Instead I recommend watching Chicago or Cabaret again.",4.0,Anonymous,Music
The best musical you will ever see!,"I am dead serious, I saw this movie on Wednesday special preview of the showing. My husband who critiques every movie that we watch loved this movie and he is extremely picky. The music in this film was outstanding, and i can honestly say this film is my favorite movie ever. This movie will win awards for everything, wait in line when it premiers because it definitely will not let you downWhen the movie starts up you will instantly know what i am talking about, Christina Aguilara's voice is beautiful. As you hear her sing song after song you will not think that her voice will wow you anymore than it already had. Then when she sings the next song you are blown away once again. I love this movie, i will definitely go see it in the theaters a couple more times. Finally a movie i can call my favorite.",10.0,Anonymous,Music
Burlesque:  Fabulous Film Magic,"If you wait out the first 7 minutes of cliché small town girl heads for the big city, you will experience a glorious musical with Cher and Christina Aguilera. Set on the Sunset Strip, Burlesque is the frisky flight of fantasy of writer/director Steve Antin (whose previous claim to fame was the jock jerk in ""Goonies"").There are some singer/actors that transcend their medium and undoubtedly Cher is one. Flawless at every point in the film Cher is memorizing in every scene she's in and in every song she sings.Christina Aguilera is astonishing as the ingénue turned star that demands attention through her character's pure heart and talent.I note early in this review that this is a flight of fantasy, because there are no scenes where Ali develops her talent for dancing and singing -- she starts and ends the film as talent personified. Having been a student at UCLA, I know all too well that talent and recognition are not compulsory companions. Burlesque is in the same vein of a Gary Marshall film (""Pretty Woman""), but sexier and sometimes smoking hot.Much of the sexual heat comes from Ms. Aguilera's on screen relationship with Cam Gigandet, who portrays Jack (the lead bartender at Burlesque). In a star making performance, Mr. Gigandet is more than just eye-candy for the divas; he is Ryan Phillippe in ""Cruel Intentions"", sexy, cool, smart, and a man anyone would long to wake up to and few other men could compete with.The supporting cast, most notably Stanley Tucci, is superb. Mr. Tucci consistently steels the screen film-after-film. I fear that much of Alan Cummings' performance was left on the cutting room floor. However, Mr. Antin leaves in one comic stage performance from Mr. Cummings that adds some levity to the film.Mr. Antin lends a steady hand from scene-to-scene and paces the film well at 100 minutes. The music and choreography are perfect at every turn.Trust me. Drink this film in like champagne, and try not to worry if it's real wine or not, because you will feel like continuing the celebration after the last credit rolls.",9.0,Anonymous,Music
"Struggles to find a consistent tone and pace, but has great musical sequences, and a likable cast.","It's not a perfect musical, but for it's momentary time, it proves to be a fun diversion.The film centers on an Iowa girl named Ali (Played by Christina Aguilera), who ditches her old life to chase stardom in L.A. Whilst there, she stumbles across a worn down Burlesque club run by a retired dancer named Tess (Played with relish by Cher). Ali, the headstrong career chaser she is, eventually gets a job at the club, and proves to be a dynamite singer, often getting on the wrong side of one of the club's main dancers, Nikki (Played by Kristen Bell), but the club is currently in danger of being closed down due to Tess's struggles to pay the bills for the club.The film takes obvious influence from it's more mature cousins, Chicago and Moulin Rouge (Right down to the bling-bling costumes, saucy choreography, and fast beat music), but the film's first half is more than sublime enough for fans of those two movies, if only the second half had done a little better. The film has a tendency to drag, and to feel contrived, but it's cast is enough reason to keep watching. Aguilera is clearly cast more for her voice than her acting chops (Which are actually better than expected), and it must be intimidating for any of the cast members to have to hold their ground against standout, Cher, a cast that also includes Stanley Tucci, Cam Gigandet and Alan Cumming.Oh, and as for the musical numbers, they're right up to par. They're decorated with shining, and lovely costumes and sets, and the accompanying lyrics and music, meshed together with the fast choreography should be enough to satisfy the fan of the musical genre. The movie specifically comes equipped with a beautiful ballad performed by Cher, and written by Diane Warren, that is by far and away one of the year's very best original songs. It's just such a shame that the film can't find a consistent tone.Burlesque is certainly not a good movie, but I enjoyed it enough to give it ** out of ****",5.0,Anonymous,Music
Wtached again after many years....,"And like it more now than the first time around!!!!
My only critique is i wish there was more Cummings!
Let them all entertain you. Enjoy it for the camp and the music!",9.0,Anonymous,Music
"""I'm so glad,"" Christina, ""that you're not gay""","Corny is the best way to describe this chiched melodrama where Tess (Cher) must pay her debt to the villain before he repossesses the nightclub and tears it down. Christine Agulera plays Ali, a waitress from a small town who struggles to find a part in showbiz until she finds the struggling backward-looking burlesque club Cher owns. Of course, the dancer she must replace is drunk too often so the lucky break is tossed in her lap. Ali eventually falls in love with Jack while staying at his place after her apartment is broken into. But when the two finally find the same bed, her most romantic words are ""I'm so glad you're not gay."" She repeats this again. He finally decides to break up with his jealous fiancé and become engaged to her. Ali spends so much time dumping ""don't bug me"" lines on all the guys, can we ask: Are Ali and Tess gay? Are they in love? Could Cher and Christina Agulera be gay? The dance numbers have all the sex appeal of cold water dumped in your face. Christina's acting skills have not grown much since she was in The New Mickey Mouse Club.",5.0,Anonymous,Music
Burlesque barely misses the mark,"¨I'll be back, back on my feet. This is far from over. You haven't seen the last of me.¨ Burlesque is not actually as bad as I expected it to be, but it still has a long way to go if it wanted to revive a dying genre: musicals. Moulin Rouge and Chicago were actually great films and it seemed as if the musical genre was finally going to have a comeback at the beginning of the decade, but in recent years these films have disappointed (with Nine almost burying the genre altogether). We have a long way to go if we want to get back to the glory days of musicals from the 50s and 70s. My favorite musical all time is Oliver! and I just happened to watch that movie a few months ago, so it's a little unfair for me to judge Burlesque under those terms. The problem I have with musicals today is that most of the time the music is not part of the story, they are just there to entertain us and the story is told through acting, while on the other hand before each musical was used to tell the story and served a purpose. In Burlesque there are some good musical performances and fans of Christina Aguilera will probably be satisfied because she has several musical numbers and she is the main protagonist. This is her first acting job and she is not great, but her voice makes up for it and she does a lot of powerful singing. Fans of Cher might not be too excited because she has very little screen time and has only two musical performances (although ¨You Haven't Seen the Last of Me¨ is probably the best one of the movie and should receive an Oscar nomination for Best Song). Burlesque is Steve Antin's first feature film as a director and he also wrote the script for this movie. As a writer he hasn't had a very promising career (Chasing Papi and Glory anyone?), but this is perhaps his best work to date (not much of a compliment however).We are first introduced to Ali (Christina Aguilera), a waitress from a small town in Iowa who has big dreams and aspirations so she decides to move to Los Angeles. Once in LA she discovers a Burlesque club and immediately falls in love with it. The Burlesque Lounge is run by Tess (Cher) who owns half of the club- the other half belonging to her ex husband Vince (Peter Gallagher). Not everything is working out well for them as they are having great financial troubles and if they don't come up with the money they will have to sell the club. Marcus (Eric Dane) is a very successful businessman (and ladies man for that matter) who wants to buy the lounge for personal reasons, but Tess is not ready to give up on her dream. Ali finds a job in Burlesque as a waitress and befriends Jack (Cam Gigandet), the bartender with whom she moves in with. Ali is waiting for her shot to become one of the Burlesque girls and when the door opens she will stop at nothing to make the best of it. When Tess hears her voice she realizes that the show must revolve around her, but is it enough to save the club? The characters are one dimensional, but I'm guessing most people that go see Burlesque aren't expecting three dimensional characters, they just want to hear these girls sing. In my opinion the burlesque lounge began as one and somehow along the way it got lost and became a Christina Aguilera concert (even the stage seemed to get bigger). The film also seems to resolve itself rather easily by the end. The highlight of the film for me was Stanley Tucci's performance as Sean, the gay Stage Manager. Tucci is such a great actor and we have seen him give some terrific secondary performances before (The Devil Wears Prada) and he does so once again. The funniest moments of the film are thanks to him and he steals absolutely every scene he's in. Burlesque was worth it just for his performance alone, but then I am not a Christina Aguilera nor Cher fan so it did grow tiresome and long at times for me. Cher doesn't seem to have aged at all, she looks the same as she does ever since I can remember. Time seems to pass for everyone except for her. Her song ¨You haven't seen the last of me¨ was my favorite performance from the movie. The movie is about two hours long and after a while you begin to feel the length of the film. I wouldn't recommend this film unless you are a Christina Aguilera fan and in that case you will most probably enjoy her performance.http://estebueno10.blogspot.com/",5.0,Anonymous,Music
Little gem,"This movie was not overly surprising, however was definitely worth watching and gave me a good feeling. Good cast, great singing and dancing, I would watch it again.",8.0,Anonymous,Music
