title,content,rating,username,genres
Minions!,"This much like the first movie is a hilarious masterpiece. This time around Gru and his 3 girls are together and he starts out being on the legit side of things(seems he's retired from the villain game). When out of nowhere he's summoned by a secret agency that tracks villains and is asked to find a very specific one.Now I know the title covers my utter love for minions but I seriously cannot stress enough how much I enjoy them. If they made an entire movie out of nothing but minions I would be on cloud 9, but the makers of the entire Despicable me series are pure geniuses when it comes to both comedy and timing. This is one of the very few animated cartoons that I can truly say is not cheesy.They've managed to capture the magic of a fantastically funny world without taking away anything from any age group. I absolutely adore these movies and recommend them to EVERYONE. 10/10",10.0,Anonymous,"Animation, Comedy"
A Comedy for Small Children,"Standing as one of the most uninteresting protagonists to grace the world of animation in the past few years, my only question is: who really cares about Gru? And after watching ""Despicable Me 2"", I can't for the life of me figure out why the original even merited this sequel if the character of Gru was going to continue to be at the helm. Expecting to see a story about the reformed villain Gru (voiced by Steve Carell) ""getting back into the game"" (by which I mean being recruited by the Anti-Villain League (creative name I know) in order to help with the capture of the next super villain bent on world domination) but instead getting a throw-away love story, with forced sentimentality and a final battle sequence which comes up terribly short.OK, so if you know me then you understand that I don't care for the Minions. But I do get why small children enjoy their incoherent babbling and slapstick antics. And the youngest girl in these films is one of the cutest animated characters outside of any Pixar film. But again, I don't get the appeal of Gru outside of the well conceived plot of the original, which took a lot of people by surprise and which I even gave a positive review to.Synopsis: Watch Gru make silly faces, watch the cute kid be cutesy, but most of all watch the Minions beat each other senseless. This entire movie seems to be the result of a focus group that when asked what they enjoyed most about the first movie responded with a resounding: MINIONS! And so that's essentially what we get here, Minions at every turn. But as the most annoying part of the original, in small doses said Minions had been tolerable. But when said Minions appear in nearly every scene (as they do here) in conjunction with the relentless Minion-centric trailers we all had to sit though lo these past few months, ""Despicable Me 2"" only becomes more tiresome as it moves forward. Well, unless you wanted to see a Minions movie. And honestly, that is what many fans of the original are going to buy a ticket expecting to see. So, what do I know? Highlights: There is one funny character in this movie and it's not Kristen Wiig, who voices Lucy, an agent of the Anti-Villain League and the only character more annoying than the Minions. Clearly the best character in ""Despicable Me 2"" goes by the name of El Macho (voiced by Benjamin Bratt). But between this character, the little girl being cutesy and the two Minion covers of well known songs during the finale which is sure to get a rise out of audiences, the overall entertainment factor is still low if you are going into this film not a Minions apologist.Side Note: Do you know why the Minions aren't funny? Because their style of physical comedy is not at all clever. In fact, I don't believe their style of comedy is meant to be clever, but instead bait cheap laughs. For example: Have you ever seen a grown man hit himself in the face in order to make a crying infant laugh? Well, the Minions are kind of like that. Displaying the most infantile physical humor designed to send a room full of small children into hysterical laughter. So why millions of adults laugh at these antics is beyond me.Final Thought: While it is true that I believe the Minions are the most annoying group of animated characters since the Chipmunks, if you read this review carefully my dislike of ""Despicable Me 2"" goes deeper than a simple hatred of those freaky little tater tots with eyes. ""Despicable Me 2"" is a supremely well animated, predictable and incredibly uncreative shell of the original, with every comedic moment playing for cheap laughs. And unlike most things in life, not even Pharrell can save this production. In short, there is really no reason to watch ""Despicable Me 2"" unless you were dying to see a Minions spin off or you are under 10 years of age.Written by Markus Robinson, Edited by Nicole I. AshlandFollow me on Twitter @moviesmarkus",3.0,Anonymous,"Animation, Comedy"
Good silly fun,"After the success of 'Despicable Me' (1) a sequel was only a matter of time. If you didn't see the first, it was about - what most people would describe as - you 'pretty clichéd Bond villain,' (aka 'Gru') complete with lair and army of incompetent minions. Only his plans for world domination and chaos are thwarted when he adopts three orphan girls. If you can believe that, you probably enjoyed what followed.Now, we find him making jelly instead of nerve gas and taking his girls to the park. However, because he's turned good, he's recruited by the good-guys to take on a 'real' supervillain. And, naturally, this time round he meets a 'love interest' along the way.The bottom line is that the kids will love this. It kept my nine year old daughter entertained for hours. It's silly, colourful, loud, easy to follow and packed full of delightful animation and visual gags. Plus it contains a healthy dose of spoofing of Bond-type films which will be picked up by the adults.If you have kids, they'll love it and you shouldn't mind watching it with them (a few time, too!). I have to say that, although I enjoyed it, I didn't think it was up to the (high) standards of the Toy Story and Shrek franchises. Even thought I love Steve Carell, if I had my way, I wouldn't watch this more than once. However, that's not an option as my daughter is currently wearing out the DVD in the player.http://thewrongtreemoviereviews.blogspot.co.uk/",7.0,Anonymous,"Animation, Comedy"
Absolutely adorable!,"I went into this movie not expecting much, considering it was rated for children, and I am nineteen. However, once the movie started, I found myself laughing more than the children in the same theater did. I went with one of my friends, and he had the same experience. We were both very happy that we went to see it. I would recommend it not only to children and parents, but teenagers as well. No one is ""too cool"" for minions, and I dare say, this movie may have been better than the first one. I, for one, am extremely excited to see what happens if they make a Minion Movie, and I will be there opening weekend. If you are not a fan of the minions, even though I don't see how you couldn't be, I wouldn't recommend this movie. It's extremely minion heavy!",9.0,Anonymous,"Animation, Comedy"
"Despicable Me 2: Gru's Gone Good, But Are We Having a Gru-Time?","Grab your shrink ray and prepare for another dose of adorable villainy, because Gru is back in Despicable Me 2! This sequel reunites us with the lovable-ish supervillain turned reluctant dad, juggling fatherhood, a new love interest, and a (semi-accidental) stint as a secret agent. Does this follow-up capture the magic of the first film, or is it just another minion-filled rehash?The animation shines again, even more vibrant and detailed than before. The 3D sequences, while not groundbreaking, add a fun depth to the action scenes. Gru's character continues to be a delight, his grumpy exterior slowly melting away thanks to his adopted daughters and the ever-present shenanigans of his minion army. The new characters, like the suave agent Lucy Wilde and the flamboyant villain Eduardo Perez, are entertaining additions, each bringing their own brand of humor and chaos.So, is Despicable Me 2 worth your time? If you enjoyed the first film, then this sequel is a solid follow-up. It offers more of the same humor, heart, and stunning animation. It's a fun family film, light and entertaining, but not likely to blow your mind (unless you get hit by a stray shrink ray, of course).",7.0,Anonymous,"Animation, Comedy"
"As lively, amusing and wacky as the original, but Gru's falling in love is pure slapstick that lacks the poignancy of his turn as an accidental father the last time round","No one could have quite predicted how delightful and heart-warming 'Despicable Me' would be, and therefore how the debut toon of Chris Meledandri's Illumination Entertainment could have come out of nowhere to give Pixar a good run for its money. Boasting ingenuity and heart in its story of three orphan girls who reform a criminal mastermind and his army of yellow Minions, the film became a monster hit in the summer of 2010, all but guaranteeing this entertaining but slightly less outstanding sequel.Indeed, despite the return of directors Pierre Coffin and Chris Renaud as well as writers Ken Daurio and Cinco Paul, Gru's return feels less inventive than its predecessor, let down most noticeably by the absence of a more character-driven plot. Whereas the first film emphasised Gru's change of heart after turning into foster parent, this one struggles to find a defining character arc for him following his bad-to-good transformation, settling instead for some mild over-protectiveness and a new romantic interest.Gone are the poignant parent-child bonding scenes between Gru and his adopted kids, - Margo (Miranda Cosgrove), Edith (Dana Gaier) and little Agnes (Elsie Fisher); other than an opening sequence where Gru purposely dresses up as a fairy princess to please Agnes during her birthday party, the rest of the movie barely lets Gru spend any time with his kids. A later subplot that sees Gru's fussing over Margo's teenage crush for a cool Mexican boy feels almost like an afterthough, with most of the attention instead placed on his budding relationship with a female partner Lucy Wilde (Kristen Wiig).Wilde is the only missing piece to Gru's otherwise picture perfect family existence, so the writers have constructed a skeletal mystery as an excuse to bring Gru and Lucy together. A new agent of the Anti- Villain League, she is tasked by the League's director Silas Ramsbottom (Steve Coogan) to recruit Gru in tracking down the villain responsible for the theft of a dangerous transmutation serum from a top-secret laboratory in the Arctic Circle. Some initial resistance aside (which culminates in a hilarious send-off for Gru's evil mad scientist Dr Nefario - voiced by Russell Brand), Gru opts to join forces with Lucy.Their investigative work largely takes place within a shopping mall, where they set up a cupcake shop as a front to observe the other suspicious shopkeepers - including the owner of a Mexican restaurant called Eduardo (Benjamin Bratt) and the owner of a wig show with the even more eccentric name of Floyd Eagle-san (Ken Jeong). Intended as a perfect complement to Gru, the gregarious Lucy literally bounces and dances around Gru - but though their scenes pop with verve, their relationship lacks the endearment of Gru's with his three girls in the first movie.Seemingly aware of this, the directors carefully balance Gru and Lucy's hyperactive romance with almost stand-alone sequences of the 'oh-so- cute' and utterly irresistible Minions. Not simply in droves - whether making jam and jellies in Gru's lab or rushing in line for a dubious ice cream truck that comes around the neighbourhood - they also appear in amusing twos and threes as firemen, housemaids and babysitters, and perhaps even more so than before, threaten to steal the whole show. Rather than just Gru's assistants, they also have a bigger role to play in the hysterical finale, which deftly ties together what often exists as disparate story strands in the rest of the movie.Yet even though the plotting could do with a little more meshing, the lively visuals and consistently zany energy will surely keep you engaged throughout. Whereas Pixar or even DreamWorks' animation tend to go for beautiful visuals and even a fair amount of restraint, the French-based animators on the 'Despicable Me' movies have opted for complete and unfettered amusement as their top-most priority, and the maniacal energy and sheer nuttiness with which they have crafted many of the laugh-out- loud scenes are infectious to say the least.It certainly helps that they have a voice cast to match their ambition. Steve Carell's combination of deadpan and an Eastern European accent once again lend Gru an inimitable persona, while Wiig's brisk and bouncy delivery works superbly as his accompaniment. In equally comical fashion are other new additions Coogan and Jeong, but the one deserving of special mention is Bratt, whose devilish intonations lend Eduardo (or otherwise referred to as El Macho) both charm and menace.The uniformly excellent voice cast keep up the snappy pace of the movie, which together with the lovable Minions, strive to sustain the same entertainment value as its predecessor. And largely, this is as amusing, lively and even uproarious as the original; yet, beyond the slapstick and physical hijinks, there is still something lacking. As one character remarks in the movie, you cannot quite top Gru's out-of-this-world scheme of stealing the moon; and for that matter, neither does Gru's tale of falling in love quite match the same poignancy and sweet-natured charm of his coming-into-fatherhood story the last time round.",7.0,Anonymous,"Animation, Comedy"
Best Film I've seen in a long time,"After watching the first one only a few weeks ago to see what the fuss was about I fell in love with the film and couldn't wait for number 2 to come out.As an adult I still love children's films but for me this is not a kids film, it is a family film with enough comedy in to entertain the parents as well as the kids.From start to finish I was laughing my head off.The minions are by far the funniest things ever and I am now a massive fan of these films and in love with the minions.Definitely worth a watch, and I will be adding this to my DVD collection.",10.0,Anonymous,"Animation, Comedy"
Pure kid stuff,Minions are the soul of the sequel.Kids will find fun.But it is not so funny for adults,6.0,Anonymous,"Animation, Comedy"
"Besides a string of jokes, both adult and juvenile, the best moments in Despicable me 2 are when we get to see minions indulge in screwball mischief.","Whenever a sequel is announced, it is safe to assume that filmmakers are coming after your money in an attempt to milk the success of the original film. From a movie patron's perspective, there is always a risk of being victimized should pre-ordained expectations go south. This risk is amplified when returning viewers expect an equal or greater experience in comparison. While not quite as unique as the 2010 original, I am happy to report that Despicable Me 2 is an equally entertaining encore, just as long as your expectations are tethered to a stick of Acme dynamite. Yes; dynamite.Returning directors Pierre Coffin and Chris Renaud have brought along few tricks that are seamlessly blended into the visual quality of this animation. And of course, the use of 3D is one of them. That being said, the real treats come from returning screenwriters Ken Daurio and Cino Paul, by injecting the story with heavy doses of the most likable aspects from the predecessor — adorability and hilarity. The story is also altered where Gru (Steve Carell) is now a fervent father to his three adopted girls Margo, Edith, and Agnes, having abandoned his villainous ways of the past. But when new super-villain El Macho (Benjamin Bratt) threatens to turn Gru's lovable minions into aggressive monsters, the latter is recruited by the ""Anti-Villain League"", a secret agency whose only purpose is detecting and eliminating super-villains. All of a sudden, Gru is back to juggling again — this time as a hero and an overprotective father, while actually falling for AVL colleague and sidekick Lucy Wilde (Kristen Wiig).For a spy-spoof animation, the story does not do much to hide its high level of predictability. Instead, the screenwriters have clearly focused on slapstick gags that are well written for viewers of all ages. There are several references to heist and spy movies that adults will mentally tick off to, while kids and toddlers are more than likely to get off to a rollicking ride from the start. Making this possible are zany new characters that add extra pizazz with plenty of loony-toon moments. One such character is Bratt's El Macho, a two faced super-villain with a psychotic chicken for a side-kick and a son that steals Margo's heart from right under Gru's nose. And while Carell's Gru takes a backseat as a reformed villain, Wiig's Lucy brings out a wacky side of Gru that is straight out of the Acme crate I had mentioned earlier. But amongst the various characters and voice talents at work, nothing can prepare you for the incredibly adorable Agnes (Elsie Fisher). Also returning from her debut role in Despicable Me, Fisher's voice acting is the essence of cuteness each and every time her character is on screen.Besides a string of jokes, both adult and juvenile, the best moments in the film are when we get to see Gru's minions indulge in screwball mischief, including singing pop music with a French twist. These are also the moments when 3D is at its intentional best, so stick around for the end credits where minions audition for their 2015 movie spin-off called The Minions. But before we get there, I recommend Despicable Me 2 for the loads of fun, joy and laughter it has in store. It is easily one of the funniest animated films of the year.",7.0,Anonymous,"Animation, Comedy"
Funny!,"Very good animation, great script very funny and oodles of entertainment not seen part 1 &3 just this and the minions movie, a good franchise,thoroughly enjoyed this second instalment 👍7.5",7.0,Anonymous,"Animation, Comedy"
"Great show, even for adults","Completely loved this show and for a 40-somthing. After wasting money on garbage shows like WWZ and a few others we paid one more time and watched DM2 and have a great time. Loved the show, made up for the other disappointments. Lots of adult humor (and no, don't mean it that way, sorry Hollywood has programmed your brain that way) and great for kids too, of course. Had an actual plot not much different then Ian Flemming's works. Definitely great for kids. Great animation. Great acting. Lots of energy. Had a bit of Wild-e-coyote in there too. Funny and good ending!This 10 line bs from IMDb is pissing me off, fyi.",10.0,Anonymous,"Animation, Comedy"
Wildly Entertaining!,"""That's right, baby! Gru's back in the game with cool cars... gadgets... and weapons!""There might not be that much of an interesting story in this sequel, but I have to admit I had a blast with these lovable characters and laughed throughout the entire movie. I don't think I laughed as much with any other movie all year so I have to say this is the funniest film of the year so far. It has several clever lines and I was glad to see all these memorable characters back. Once again the minions steal the show along with Agnes who is as adorable as ever. There were also some new characters that brought some freshness to the sequel. I can understand why some adults might not have liked this film because it is predictable and has some very stupid moments, but I know kids will have a great time. They will love this sequel because the minions have more screen time and they steal the funniest scenes. I couldn't help but laugh at all the funny and adorable situation, and perhaps hearing the kids laugh at the theater made me appreciate the comedy even more. This is a very family friendly film which reminded me a lot of the old comedy from the Looney Tunes. I could sit through this film many more times without hesitating because it is a very easy watch. I think I'd even prefer to see this over the first Despicable Me, but they were both great and funny films.In this sequel we see how Gru (Steve Carell) is adapting to family life as he has put his villainous life behind him. He seems to be enjoying his life as a single parent to Margo (Miranda Cosgrove), Edith (Dana Gaier), and Agnes (Elsie Kate Fisher). Everything seems to be going well for him as he has his minions working on a jam business. Meanwhile a secret Arctic lab has been stolen and the Anti-Villain League decide to contact Gru for his expertise in order to catch the person responsible. After recruiting Gru they team him up with Agent Lucy Wilde (Kristen Wiig) and together they begin to look for suspects. Gru is convinced that the villain is Eduardo (Benjamin Bratt), who used to disguise himself as the villain known as El Macho, but he has been presumed dead for years. During their investigation, Gru's minions are being kidnapped, and the question remains as to who is the person behind all this.I really enjoyed the animation from the guys at Illumination Entertainment and thought the 3D worked nicely. I really loved the underwater scene and thought it was really breathtaking. There were some great animated moments, but the lovable minions are the ones that steal the show with their funny voices and mischiefs. I also liked the addition of Lucy who despite being a bit wacky seemed like a perfect fit for Gru. I had a great time and I'm sure kids will love this extremely entertaining movie",8.0,Anonymous,"Animation, Comedy"
On-par with the original movie,"Despicable Me 2 is on-par with the original movie. It's entertaining, it has some clever animation, but it's nothing spectacular. My kids absolutely love the minions, though.",6.0,Anonymous,"Animation, Comedy"
EXCELLENT movie..... BUT something was very concerning,"This movie was excellent but....Let me start off by saying: I am not the type of person to be easily offended by anything but there was a part of the film that made my friend and I very comfortable. It seemed very awkward and the whole theater was thrown off by it. Violence against women is not funny and should not be in a movie rated for young viewers. I'm not upset about this at all but it made the rest of the movie a little awkward.. almost as if making you wonder if someone was angry at an ex-girlfriend and decided to make this scene to spite her.I won't give anything away but the scene I am talking about involves a young women dressed in leopard print with a lot of makeup on. Her character is superficial and annoying. Long story short, she ends up being drugged while out on a date and then her limp body is tossed around and violated in a violent way (an awkward few minutes that seemed like an eternity)until she ends up face down tossed onto her front steps at the end of the night. I found it inappropriate to expose young children to that sort of behavior. I could understand if it was some sort of magic weapon used against her or something completely made up.. but drugging a woman and then violating her limp body is not something I would want to expose my children to.Just a thought. Other than that the movie way awesome. Definitely would not take my children to see it.",8.0,Anonymous,"Animation, Comedy"
It Killed 2 Hours,"How is this one the highest grossing animated films of all time? Why does it have a 7.6 on IMDb? What's so universal about dumb, whacky yellow henchman to the human psyche? Despicable Me is so average, even when compared to the original, which at least tried.Despicable Me was about a misunderstood evil villain, and his misadventures as a single father. Despicable Me 2 doesn't have themes beyond its adventure. Side characters from the original are missing or reduced to cameos. Gru is no longer a villain. His single father issues are trite. The lone development in this film is Gru's romantic relationship. Its typically cartoonish, with little romantic chemistry.At least the movie is funny. The characters are outrageous and often engage in slapstick. If you like what you've seen of the minions, you'll probably like the film's humor.Its a decent rental, if you're just looking for laughs. You don't need to watch the first.",5.0,Anonymous,"Animation, Comedy"
