title,content,rating,username,genres
"Tasteless, degrading","While the plot summary of this movie warned me that it was about a guy addicted to porn, I didn't realize the movie would be porn.My review could be taken with a grain of salt, because I left after about 10 minutes. There were only a handful of people in the theater with me, and one woman left after about 5 minutes. I was offended right from the start, but hoped that was for ""shock"" value and waited to see if it would go in a different direction, and maybe it eventually does, but the constant vulgar language, together with the near-porn filming makes this a most degrading movie for women, and for men who value women for anything other than their sexual indulgences.I suppose there are people out there who talk and behave like this, but really, do we need to promote such language and behavior as entertainment?",1.0,Anonymous,Romance
"Very well-rendered, realistic and useful movie!","There is not much knowledge of porn or sex addiction. This movie is a great effort, and very tasteful, to portray this condition which to some more or less extent affects a lot of people in our western countries.The path to true fulfillment is not consuming more or having more sex, ""loosing ourselves in porn"" and other quick-fixes. The only escape from a cyclical and boring life (depressing, if looked consciously at!) is to have compassion, be truthful to yourself and put effort to change your habits into healthier one! Compassion and real relations (not only but temporary fun) are the key!Don Jon is incredibly realistic, showing both the symptoms and the cures. Very nice! Nice job Gordon-Lewit! Great!",,Anonymous,Romance
Monica,"Brie Larson has just a very short dialog in the last scenes, But it's very good & wisely. Her acting is so well. and that's what the role of ""Monica"" needed",6.0,Anonymous,Romance
"""the situations"" untold story","A decent above average movie, not many boring parts and the movie was entertaining right up till the end.The story is about the average guy who watches porn on a daily basis and how porn may or may not have effects on relationships, it's all done in a ""jersey shore"" manor and could resemble ""the situations"" untold story.It gives you 2 sides of the story, those who struggle with porn thinking its a sin and those who just take it as a part of daily life.The movie falls short due to the fact that it isn't as edgy as it could have been and wont be as mind blowing as you could imagine, this movie is 10 years behind in the times in form of acceptance of porn and for that I don't believe many people will be looking at this story in a new light, though I'm sure the average teenager and or parent out there will.When all is said and done, porn is just another part of life and I believe the movie was trying to say just that.",7.0,Anonymous,Romance
Debutant jitters by the Don,"Joseph Gordon-Levitt writes, directs and stars in the whimsical tale about a pornographic addiction. Eons away in style, tone and gravity as compared to the similarly themed ""Shame"", ""Don Jon"" is a comedy drama set in New Jersey about Jon, a narcissistic young man, whose life is focused on his bulging biceps, one night stands and his addiction to porn. Dedicated to a simple few things, Jon isn't the type who looks for long term relationships. Until he meets the blonde bombshell Barbara Sugarman (Scarlett Johansson in her most charismatic role in years), who captures Jon's undying attention and slowly wraps him around her finger - making him take up a business course, fighting his small idiosyncrasies and - worst of all - obliging him to resign from pornhub...The star of the movie excels as the straight-forward Jersey Italian, unaware of his weakness, living in denial, yet too simplistic to remold himself. The denouement, when it comes, seems however largely out of character, as Jon gains depth, complexity and self-awareness far beyond anything suggested earlier in the movie. Such a revelatory change happens plot-wise, but seems overly forced, lacking a structural backbone which can not be explained by the impact of his affair with classmate Esther (Julianne Moore).Nonetheless, ""Don Jon"" is an extremely enjoyable affair, especially for its target group - men at large - uncovering some unspoken truths about masculinity. At times Joseph Gordon-Levitt's script reveals some true wit and foresight, with the last scene of Jon in a confessional a true mantelpiece of the movie, delivering a wickedly accurate commentary on the institution of confession. Slightly uneven, ""Don Jon"" does also mostly capture the man's point of view on the subject matter, albeit (possibly purposefully) omitting the female perspective so widely approached in rom-coms. Thankfully the comedy does so, while omitting crude sexual humour in a porn-focused movie. Joseph Gordon-Levitt delivers an admirable debut, especially with some of the manly banter and in the construction of several scenes. With time and experience (and a more subtly developed script) he may yet become competition for Ben Affleck as the most talented next-generation actor-director in America.",7.0,Anonymous,Romance
the people that write this film is vulgar and offensive?,"just goes to show how much of a chance EVERYone has to write an opinion on this site. to me, THEY are offensive. offensively dense to have missed much of the point. it's ALways amazed me. people's programed reaction to 'cursing'. which is usually a word synonymous with words that describe the same thing or event. except that THOSE words are 'acceptable'. i'd like to put you all in a room and rid the world of such stupidity, truth be told. i don't think the movie was about porn/sex addiction, either... i think we watched someone 'grow up' through some non judgmental questioning of methods and exploration of new possibilities. new programing, if you will...now for those of you that found him vulgar...could you be more specific, please? by which definition? here. i'll give you four to choose from...adjective: of or associated with the great masses of peopleadjective: being or characteristic of or appropriate to everyday languageadjective: lacking refinement or cultivation or tasteif you chose any of the first 3, i'm thinking you're a narcissistic, racist intellectual. thinking YOUR 'sense of order' is more 'correct' than those you look down your knows(sic) at.adjective: conspicuously and tastelessly indecent Example: ""A vulgar gesture"" like the looks you get from those untouchables on the other side of whatever window/counter they work on when they get to misuse their authority...so pleeeeeeeeeeease save me from your prefab moralizing senselessness. and see the whole movie... now you may return to your magazines, TV shows, commercials and movies to help you figure out what new thoughts to have, clothes to wear and things to think hip. and btw, while this movie seemed to be a 'major accomplishment' to many that praised the movie(and there WERE praiseworthy performances), the writing seemed to fill in with form/style(repetitiveness) what it didn't have to offer past adolescent tries on first pair of adult dancing shoes... on the other hand(no spoiler intended with those last 4 words. this is a pun some of you might get), i can very well see how many teeners turning the emotional corner into adulthood might love this film through identification. maybe even justify their beliefs that all the machismo was just some beer commercial that peer pressure validates way past its expiration date...",,Anonymous,Romance
"Interesting, but uninspired.","Don is a young man who lives like the prototypical New Jersey guido. His life revolves around porn, trying to score with women, working out, and having dinner with the family, roughly in that order. His lifestyle is designed to please himself, with the possible exception of spending time with the family and going to church, which is also a familial obligation.He measures success in life by easily quantifiable measures: how much weight can you lift? how many (quantifiably desirable) women can you bed? how many acts of contrition does the priest proscribe?Played by Joseph Gordon-Levitt, Jon is a simple man. He meets Barbara (Scarlett Johansson), a simple but stunning woman, and decides he has fallen in love. In the course of that relationship, he meets Esther (Julianne Moore), an older, more complex woman, who introduces him to some foreign ideas about relationships and sex. Don learns a few things in the process.The acting in this film is excellent. The story is interesting, but uninspired. Because the story is about some ""shallow"" people, there is little passion in ""Don Jon"". The sexual content will undoubtedly annoy some viewers.",7.0,Anonymous,Romance
Original and unusually romantic!,"Joseph Gordon-Levitt's directorial debut in a feature ""Don Jon"" definitely takes the cake as one of the years best romantic comedies. Funny and definitely original, ""Don Jon"" had more to it than just its suggested theme about a porn-addicted gym head and stood out with its premise that Jon had found his ""perfect"" girl but was still unfulfilled. The film really illustrated the other side of sex and love and proved that unrealistic expectations about the two can prove to be detrimental to a relationship built on superficial standards. Although there were some parts that were overly stereotypical in regards to people in New Jersey and female foreplay, for the most part it was a good film. Gordon-Levitt's film was well received and with good reason; the modern take on relationships was a breath of fresh air amongst the typical sappy romantic movies.",6.0,Anonymous,Romance
Great effort by the first time director! 6/10,"Review: When this movie starts off, I thought that it was going to be about a guy who is addicted to online porn and falls in love with a girl in a club, but it's very cleverly written by Joseph Gordon-Levitt and you can't help but get caught up in his weird lifestyle. It's a deep drama which has some interesting characters and a original script. For a young person, he has directed a very adult movie which deals with things that people are obsessed with in this day and age and how they can warp your mind. There is a lot of porn throughout the movie so if your not into that type of thing, this movie is definitely not for you, but there is a hidden message behind the whole story of Don Jon which a lot of people can relate to. Enjoyable!Round-Up: I really didn't know what to expect from this film because I haven't really heard that much about it, but after watching it, I can honestly say that I did end up getting caught up with all of the characters personals issues. I'm glad that the film made a profit because it was a great achievement by the first time director, and he had a original style of directing which was refreshing. In all, it's definitely worth a watch and I hope that Joseph Gordon-Levitt directs another movie.Budget: $6million Worldwide Gross: $30.5millionI recommend this movie to people who are into there comedy/dramas about a guy whose addicted to online porn and struggles to find love. 6/10",6.0,Anonymous,Romance
JGL obsession validated,"Joseph Gordon Levitt isn't just a dreamy actor anymore, he is officially a cinematographic artist. I am thoroughly impressed with his directorial and screen writing talents. He did an astounding job considering it was the first feature film he has ever directed. Although the idea of making a movie about a sex addict is a little risk-ay, JGL worked it into something really special. Don Jon isn't just another love story or addiction drama, it is about a man who isn't capable of getting ""lost"" in another person, a man who has trouble sexually connecting with women. This film was visually very striking and beautifully executed. Hats off to Thomas Kloss for his wonderful cinematography. Overall I definitely felt some 'good vibrations' and will not be able to get JGL's multiple sex faces off my brain for some time. -absolutely not suitable for children",8.0,Anonymous,Romance
Could Have Been Better:,"I LOVE Joseph Gordon Levitt, and this movie was a sad start to him directing his own films. This could have been done SO much better. First off, as previously stated, the accents were awful. Listening to Scarlett Johansson trying to pass off her voice as being from New Jersey made me want to cry. Second off, it is unbelievably repetitive, to the point of almost being confusing.I didn't see this movie in theaters, I was lucky enough to catch it on Netflix. That being said, if I had made the choice to see it in theaters, I wouldn't by any means have demanded my money back or walked out. It wasn't THAT terrible.Honestly, the movie has a message that just doesn't come across well because you're so busy being irritated by the little things. When you watch it, look for the message. That's all I can say. That, and I hope that when JGL directs movies in the future, it is done better than this one.Not terrible; but incredibly disappointing given the potential of all of the individuals involved with this film.",6.0,Anonymous,Romance
Very Poor,"I went to watch this film with a high expectation of it being a hilarious comedy. I was mistaken. The film is very mixed; I couldn't tell whether to laugh and some points or to take them serious. To me it had a very mixed genre.The story wasn't great and the ending seemed to be rushed. You didn't get the chance to form any sort of feelings towards the characters (other than Jon) and I just think it was really really poor.Jon was a great character but I just think much more could have been made of it! I always checked IMDb ratings before I watch ANY film. 6+ and I'll give it a chance. As this film is rated 7.2 you can see why I'm so disappointed.Only twice at the cinema has a film finished and I've said ""Well, that was sh*t"". The first was for, understandably, 'The Bounty Hunter'. Don Jon has now been added to that short list.BUT ... boobs.",3.0,Anonymous,Romance
The Vidiot Reviews,"Don JonTo never get caught browsing porn on the Internet again, simply condition your body to become aroused by auto-part websites.However, the addict in this drama prefers websites with fake headlights.Despite getting plenty of female attention, Don Jon (Joseph Gordon-Levitt) continually revisits the effortless orifice of Internet pornography.Even after landing the perfect ten (Scarlett Johansson), he still satisfies himself via visual stimuli.It's not until Jon meets the bereft, and more mature, Esther (Julianne Moore) that he learns to loose himself in the sexual experience.An astute commentary on modern male masturbator habits, this directorial debut from the film's writer, Joseph Gordon-Levitt, shows great potential.The dialogue is sharp yet sincere, the characters are developed and relatable, and its message is a meaningful one for today's stunted man.Incidentally, when they put something other than porn on the Internet, men will stop looking at porn on the Internet. Green Lightvidiotreviews.blogspot.ca",7.0,Anonymous,Romance
Bad Acting and Directing,"I wanted to see Joseph Gorden- Levitt's movie Don Jon, because I saw him in 'Mysterious Skin' directed by Gregg Araki. Joseph was good when he was young. He really knew how to act and he would put emotions in the character which would make you cry. But I was totally disappointed at Joseph in this character in Don Jon. He forgot how to act. He thought that he could really play a New Yorker and Italian plus Joseph, comedy is really hard. You are not a comedy actor. Why would you choose to write and direct and then you wanted to be a lead actor in it too. There was no real plot in the film and actors were just superficial and there was nothing natural about them. There was vulgar sex like every 10 minutes as if that was the way to keep audience engaged. Scarlett Johansson was struggling to produce New Yorker accent and I don't really care about her acting anyways. I don't know who wanted to put money into this film. Ryan Kavanaugh kept putting money into bad films that's why he is bankrupt.",1.0,Anonymous,Romance
Don Jon tells a very good message,"The story is simple and not complex, that however does not mean it's bad. It tells a good message to the audience. I really had a lot of fun with this movie. The humor is done perfect by the cast.",6.0,Anonymous,Romance
Satire at its Finest!,"I have so much respect for JGL. He's obviously an enlightened, intelligent and highly talented human being - his writing, directing and acting abilities are superb.This movie has many layers of complexity and an extraordinary amount of depth.I highly recommend watching this only after looking up the definition of 'Satire'.It looks like a lot of reviewers here just didn't understand this movie.PS. If you feel attacked while watching this movie, it's a sign you need to level up (open your mind and learn more).",10.0,Anonymous,Romance
The devil is in the details....and a sad stereotype.,"SPOILERS I really wanted to like this movie, I like Joseph Gordon-Levitt as an actor, but before he writes anymore movies, he's got to read some literature and stop watching reality TV shows. Here's a hint--reality shows are not about reality, they're meant to shock you and make you laugh. Or just shock.Where to begin? The ""jersey shore"" stereotype of of an Italian guy who likes to party and go to church? Confession every week and the only thing he confesses to is self gratification and sleeping out of wedlock, for which he receives ""penance"" of 10 Our Fathers and Hail Marys? REALLY? What time period is this set in? There are no more ""confession booths""! Penance stopped being like that for over twenty or thirty years that I am aware of. It's more like ""do something kind for someone"" or volunteer. More practical if you know what I mean. Even if I was OK with the stereotype, it's a stereotype of Essex County, NJ (think Sopranos). And, Gandolfini needed an accent coach because he's from Bergen County and, we just don't speak that way. And none of them had that even remotely right, none of them. I wanted to like this movie, I really did. But the stereotypes are just so over the top. A religious Italian guy who has sex indiscriminately, rates girls on looks with his friends, watches porn after he has sex with a random girl, a loud father who constantly watches football (uh, no...not in MY family) the Italian mother who only wants the best for her son and grandchildren (yeah, OK), and the sister constantly on her cell phone, even at the dinner table (not in any Italian family I know, at least in NJ). The stereotype older woman (and I mean OLD, over 20 years older) who somehow understands him and teaches him what TRUE love is. I can allow the beautiful manipulative girlfriend who wants a ""real man"" whatever that's supposed to mean, but you just can't take ONE college course in any school in NJ. There is a minimum number of credits for being a part time student, and there are all the many fees involved that would not make it practical to take one course even if you could.Mr. Gordon-Levitt would have better served himself if he wrote about a stereotype he did actually know, maybe a California type is so wrapped up in himself. I guess the think is, this stereotype could have been ""living in LA"" instead of NJ.So, I guess the only people who enjoyed this movie were guys who masturbate to porn on their computers and think it is normal. And they enjoyed the ti-tty shots.",1.0,Anonymous,Romance
Really Bad,"The only thing saving grace for this movie was the cast. Other than that, A movie about someone with a porn addiction just doesn't cut it for me. Half the movie was about a man ""keeping in touch with himself"" if you know what I mean. They should have focused more on the relationship with the older woman and how much it changed him rather than the younger one. I think I would have enjoyed that much more. The acting was fine, the plot fell flat. You still didn't feel sorry for him at the end which was very disappointing. The stereotypical Jersey/Staten Island family was a bit too much, also didn't get the sister on her cell phone the whole movie and only spoke once, kind of a useless role, but I guess she made her money. I was expecting a lot more for this movie.",3.0,Anonymous,Romance
This is a movie that most every guy can relate to,"Even though it seemed a bit like a chick flick from the previews, this movie was made for bachelors across America. Practically every guy I know (including myself) can relate to what Levitt presented here; and as proof of the potency of this film, I am on IMDb instead of going to a porn site, even after witnessing so many fine ladies on the big screen.Not only does Levitt provide a lot of insight that most of us already know (and usually ignore), his ability to capture the modern male's dilemma in American culture throughout the movie is therapeutic and reminds all us guys who go bar hopping that what matters most is between the ears. Now, as for Don Jon's incredible success ratio, that seems a bit far-fetched...but then again, since this seems like Levitt just getting a portion of his life off his chest and onto the big screen, I can see why he's successful with one-night-stands 95% of the time--being a celebrity and all.If you are a single guy between 20 and 40, you should strongly consider watching this film. It will reaffirm that you are not alone, that it is not a healthy lifestyle, and that it takes some risk and real courage to change.",9.0,Anonymous,Romance
Fantastic first outing as a directorial powerhouse,"Don Jon Martello, the epitome of a modern day Don Juan, is the marvelous brainchild of one of America's up and coming great actors, Joseph Gordon-Levitt. Given this is his first venture into the field of directing this should not deter anyone from seeing this movie. There is more heart and emotion in this movie than any big budget Hollywood gush fest could bring forth in a 100 million dollar budget. The realism and examination of human emotion and interaction in relationships is effortlessly presented by JGL. He critiques the expectations of beauty and love brought forth by two generations of individuals veiled with an air of coarse and hilarious dialogue. This movie seeks to do what Shame did for sex addiction 2 years before and unlike Shame, Don Jon wishes to deal with the subject in a more accessible and less depressing manner. In doing so we as viewers are given a delicious and entertaining introduction of the stigma that is porn addiction. But to focus on the actual acting the actors appear to be very comfortable and genuine with the portrayal of their characters. JGL effortlessly evinces the meathead and sex obsessed persona of Jon Martello. Scarlett Johansson just exudes sexuality and her spot on Jersey accent actually had me cringing from laughter during the movie. The helpless romantic mother (Glenne Headly), the detached and sexually obsessed father (Tony Danza), and the almost Greek tragedian and taciturn character of Monica Martello (Brie Larson) helps to round out this extremely idiosyncratic American family.Finally with the woman who teaches the meaning to Jon of what making love is all about, the sexy, sassy Esther (Julianne Moore). This movie had me entertained from beginning to slightly too cheesy end but nonetheless I recommend this movie to all modern film lovers.",9.0,Anonymous,Romance
Inauspicious directing and writing debut for JGL,"An inauspicious directing and writing debut for Joseph Gordon-Levitt. Dull plot, clumsy direction. The whole movie feels like it was a school project.Character development is superficial, at best. (Though they were fairly superficial characters. Movie could have been called ""Neanderthal mating habits""...)Some parts of the plot make no sense at all. The romance between Gordon-Levitt's character and Julianne Moore's character seemed incredibly contrived and implausible.Performances are fine. JGL does a good impersonation of a New Jersey native, and Scarlett Johansson does a good stuck-up princess routine, while looking good doing it. Julianne Moore is irritating, but that's mostly due to the script.Joseph Gordon-Levitt can only get better from here, directing- and writing-wise.",4.0,Anonymous,Romance
A journey into a man's psyche,"Ever since '3rd Rock from the Sun"", Joseph Gordon-Levitt has been proving himself as a serious actor, and this time he's proved himself to be a serious writer and director too. 'Don Jon' is probably one the most sincere and unpretentiously great films I have seen in a while.I expected to see a romantic comedy with a slight twist, but what 'Don Jon' ended up to be was a real character study of a contemporary young adult male of today, riding through different genres with ease and ending with a real moral of the story (which is kind of a rarity these days). What started out as a self indulgent mild-shock-flick on the verge of porn (during the first ten minutes or so, I really thought I'd hate the rest of the film), soon turned romantic comedy, then drama and ended up as an accurate and a very colorful portrait of a young man today sorting out his issues.Though it may seem sexist and over the top, I honestly found myself in a lot of situations JGL displays in 'Don Jon', and I believe many men will. For such an unpretentious feature, it made me think about myself more than most other films recently, and that certainly can't be a bad thing.It might not be the best film ever (it may not even be the best film of the year, for that matters), but I can honestly say I really loved it. Kudos to JGL. I'm eagerly waiting for the next one.8/10",8.0,Anonymous,Romance
