title,content,rating,username,genres
Disappointing,"My wife and I went to see Don Jon based on the fact that we both like him as an actor and the premise seemed interesting. I do believe this is a film where the premise failed to live up to expectations. At times I felt like I was watching the same movie about 10 times. Guy picks up girl at a club, sleeps with her, finishes himself off with porn numerous times per week, go to church, is absolved of his sins, and repeats. I suppose that was one of the main purposes of the film, so show a man who is unable to separate what he sees in pornography and what his expectations are of a real relationship. It was just poorly done, and giving this a 4/10 is based on my elation that Tony Danza found work as the title character's foul mouthed father and Scarlett Johansson looking like a knockout for the duration of the flick. I would not suggest checking this one out. Disappointment abound. Hopefully Joseph Gordon-Levitt's next project will be an improvement.",3.0,Anonymous,Romance
Clever movie that doesn't seems to be it at all at the beginning,"First sorry for my English, it's not my mother language...If he wouldn't show all that porn, we wouldn't get the importance that it takes in his life ! The flashback while he is eating with his girlfriend shows also that he is really addicted to it...He had an idea about everything without taking time to think about it... and was deep inside frustrated and aggressive... He did everything very fast, driving, eating, his relationships... like he was missing something in his life, but he was just repeating the same routine everyday that makes him feel like he has a normal life !While his friends were approving his way of being and his family and girlfriend always tried to change him in the way they want him to be, someone came and asked him if he is happy with his life... gave him time to discover himself...I like the scene that he is confessing at the church and realize that this is not helping him to move forward and decide to apologize to the concerned person than to the preacher...His life moved on when he begin knowing himself, his fears, his mistakes and accepted them...This movie is not only about porn or immature guys... It's about finding yourself to be able to find your soul-mate... heal your fears and understand things you do to escape the reality...Nice movie and very close to reality...",9.0,Anonymous,Romance
"Every man's movie..... ah no, every one's movie","No Doubt its an outstanding movie and every single person ""MUST WATCH"" it I was just blown out with every scene and it looked like my story. Well only the first part of it, But how come it is so close? this is modern age and we are all the same !! Selfish but not in true love..... I just cant express how much I loved it. The Star cast, that was chosen is just amazing and they did there job perfect. Moore is my all time fav but she looks old, oh I should not end this without praising the director, and The moment i got to know this was his debut I was thrilled and I know he has a great future in making real-life flicks like this !!",9.0,Anonymous,Romance
"Testing social commentary, but downright hilarious!","Been looking forward to this one. I couldn't put it in any genre other than 'romantic comedy', but its the first movie of that genre I have enjoyed. The subtle commentary on the insanity of 'princess'-type women I thought was hilarious (at one point she tells him to stop talking about cleaning products in the shop, as it isn't 'sexy') and the obsessive nature of the main character (mainly porn) is already amusing which in turn creates many amusing situations that aren't the norm for this sort of movie.It doesn't travel how you think it will, it doesn't end like any other typical romcom, it is intelligent, well-written and acted... plus it is hilarious! This is a very well-rounded movie.On the other side of the pool, I thought there was way too much sex. I get that the movie was largely a commentary on modern women and relationships in modern society, so this was the focus, but c'mon! Considering the main characters attitude to these types of films and his affection for porn, all this suggestive sex seems a tad hypocritical. It is like a concession to the box-office - something for the women? Couples..?Regardless, considering the tone and the ideals of this film are so clear-cut, I can't imagine couples seeing this film and coming out agreeing on all points!! I'd love to hear some of those conversations!!As a single 27-year-old though I found most of this flick hysterical and most of John's comments/interactions throughout are a spot-on depiction of what relationships are really like in this modern society.",8.0,Anonymous,Romance
Don Jon,"Don Jon, which was written and directed by Joseph Gordon-Levitt, is an acerbic romantic comedy that asks what would happen if two people with completely unrealistic expectations of the opposite sex happened to be in a relationship. Jon, played by Levitt, is someone who lives his life without asking questions, only indulges in what he knows and likes, especially an addiction to internet porn. Oppositely, Scarlett Johansson's Barbara is a girl whose idea of a real man and true love is what she sees in the most saccharine of Hollywood movies. Traits handed down from their parents, it seems, Jon's father played here by a gauche Tony Danza. Jon's walk down the proverbial corridor of life sees him as someone more interested in playing with himself than playing with others, and even when he's joined on that walk by Barbara, his compulsions and her single-mindedness come to drive a wedge between them. The narrative here is fairly simple, however, especially during the first half of the film, in which the usual conventions of romantic comedy are adhered to in spite of the central character's compulsory masturbatory habits. And this makes for a slightly hollow veneer, in my opinion, especially with some horribly outdated and quite banal exchanges in which girls are rated out of ten. Which, had the dialogue and design not seemed so false, it probably wouldn't have been one of many issues I have with this film. Jon's wonderment that he can view porn on his mobile phone also left me bemused at the writing of a film that's nowhere near as sharp as it would like to be. Basically, it doesn't ring true. However, the introduction of a third character, played superbly by Julianne Moore, changes the dynamics of the film. Her ever-excellent screen-presence finds her well cast as a genuinely three- dimensional character with an emotional core. Here is where the best of the film takes hold, and that's also noticeable in how Levitt directs Moore and the scenes in which she appears. Still, I was disappointed with Don Jon, which is tame next to something like Shame, and is more generic than its fledgling director may have desired. But it isn't without interest or merit, given Julianne Moore's performance. But it needed to be smarter, shorter and that bit more daring.",5.0,Anonymous,Romance
A film exploring themes that are rarely explored even if it isn't overly in depth,"Jon Martello (Joseph Gordon-Levitt) is a modern day Don Juan who only cares about a few things in his life, his body, his pad, his ride, his family, his church, his boys, his girls, and his porn-especially his porn. One night as he and his friends are scoping out women at the bar, he sees Barbara Sugarman (Scarlett Johanson), he instantly falls in ""love"" with her and eventually he begins to date her. Barbara is addicted to romantic movies, the ones with unrealistic expectations and just completely distorted related, it is used as a parallel to Jon's porn addiction and works fairly well. Jon continues to be obsessed with his porn as he dates Barbara and she expects too much of him due to the movies she watches. A set-up for failure.Another character Jon meets is Esther (Julianne Moore), he meets her at a weekly night class that Barbara asked him to sign up for. She becomes more prominent and important as the film goes on but to avoid spoilers, I won't go on. The themes of the movie are certainly important and I can't think of many films that have gotten into the depths of pornography addiction or the problem with unrealistic romantic Hollywood movies, so its nice to see. Could the movie have gone a bit more in depth? Yeah probably. But, it still manages to do a nice job of displaying problems that should be displayed.It's entertaining and filled with plenty of comedic moments especially with Jon's narration, which I'm still not a fan of voice-over narration but sometimes there really isn't much of a way to get into the head of this character, so it's a necessary I suppose. In general, I found the movie to be very tasteful and almost pure in a sense. Its one of the few movies were the aspect of love seemed to feel real and genuine, rather than the typical fakeness displayed in plenty of movies which was obviously the point of this film amongst its themes of pornography addiction. Again, it's very much on the lighter side of its themes, it doesn't try to get overly complex but still manages to explore what it needed to well. Overall, it's a good time and I'm a big fan of Joseph Gordon-Levitt as an actor and now as a director as well, I hope to see his career flourish even more.",8.0,Anonymous,Romance
Nobody is likable,"Just finished watching ""Don Jon"" on video. Immediate response is: It's hard to like any of the characters in this movie. That may be because the subject matters. There are several major issues of humanity raised in this film that may be too big for one film. I may be wrong, but I think ""Don Jon"" was meant to compare and contrast the difference between sex and sexuality as perceived through the filters of males and females. Complicated stuff, even without including the differences created/presented by cultural and ethnic social systems (ie, Asian, African, etc.) or environmental (species survival) issues. So, to keep it manageable, I will address ""Don Jon"" only vis. sexual relationships in 21st Century Northern Hemisphere, so-called ""Western"" culture. And I will summarize with a baseball analogy: A quality at-bat, but no better than a sacrifice fly. Joseph Gordon-Levitt, as writer, director and star, deserves kudos for pioneering new territory; Sexuality in the age of Internet Porn. All thinking people recognize that there has long been confusion between sex and romance; ""Don Jon"" is the only film I know of that has attempted to examine how the availability of on-line fantasy fulfillment will affect that confabulation. But it does so in what I regard as too shallow, too cursory, a manner. I also think ""Don Jon"" suffered from overly ambitious casting: I just never believed Scarlett Johansson as a manipulative, sex-as-a-tool Jersey Girl. I kept thinking she was channeling Eliza Dushku and wondering what ""Don Jon"" could have been... But back to (what I believe was) the point of ""Don Jon"": Men and Women value ""sex"" differently. At the risk of seeming simplistic, I think men are instinctively motivated to isolate sex from love while women instinctively understand that men don't recognize their inherent confusion. ""Don Jon,"" to its credit, tries to illustrate this. Unfortunately, it fails in this attempt. If I am allowed, I will quote a statement attributed to Germaine Greer: ""Men will swim across a river of snot if they believe there is friendly p***y on the opposite bank."" This aspect of male behavior, particularly in the age of internet porn, is what I think ""Don Jon"" wants to examine.Oddly, throughout the movie I kept waiting for Brie Larson's character (Monica, Jon's sister) to have an effect on the plot. She did. Brie Larson continued to play the live-action version of Jiminy Cricket she established in ""The United States of Tara"" and ""Scott Pilgrim vs....."" by being the character who ""revealed"" the truth the main character denied. Thank goodness she did it so effectively or ""Don Jon"" would have been a complete waste.The future may regard ""Don Jon"" as prescient, insightful, visionary. It may deserve these descriptors. But that's for the future.",4.0,Anonymous,Romance
BRILLIANT?,"I have seen it three times. One of my personal favourites.
Entertaining, real and overall it has a narrative of its own.",8.0,Anonymous,Romance
Did he just stroke his own ego!?!,"Seriously all this guy seems to want to do in his movie is show himself as much as he can working out, having his shirt off, getting the hottest girls and really trying to look like the coolest dude. Its worse than the bathroom mirror pictures on facebook and this one lasts for two hours.The movies only strong attribute is when the main character talks about the addiction of pornography what the mind set is like and how it effects him. By the end it even tries to give a solution to this problem.Also we already had to endure people on jersey shore and now Joseph just seems like he wants to be like them).",4.0,Anonymous,Romance
Early John Cusack meets Saturday Night Fever with a little Entourage and John Hughes,"Very good, much better than expected. High praise to Joseph G Levitt for writing, directing and starring in this.Rarely seen male point-of-view. Not a normal predictable Rom Com, although some of the scenes and perspective will be familiar (but more in a real way than a cliché).Tony Danza and the whole family were great in it, as was Scarlett Johanssen.The only valid criticism I've seen is that Scarlett Jo could have shown more skin.Be in the moment and slow down.",9.0,Anonymous,Romance
Lousy,"It begins average interesting, the idea is not bad and expectations from this movie start to rise. You wait for something to happen and here it is around the corner, it's just about to happen, and you wait a bit more, and here come end credits and question why did they even make this... The film literally has just 90 minutes long introduction and end credits. I watched it because I love J.G.L. but this movie is a real crap. I saw a comment somewhere, something like... J.G.L. yearns for a macho part his whole life and, as no one offered him such, he decided to make his own movie where he can be hotshot. So he did. And he did it badly. And how did he succeed to persuade phenomenal Julianne Moore to take part in this crap remains secret...5/10",5.0,Anonymous,Romance
Fantastic!,"Before I start reviewing this film I have to mention that in the film they mentioned pornhub.com as a master porn web page. I choose xhamster.com over it. You porn lovers will love it. It is a king of porn web pages.As far as the film goes this is it! This film goes right into the middle of the issue. THE ISSUE! Men watch porn! That is right in the middle of the men minds. They are fatally attracted to it! And a lot of women for that matter! I really think there is nothing to it. It just happens, and does not affect society for that matter. A lots of people think it matters a lot, but actually it does not.When Holland legalized prostitution in 1960s everyone thought that Dutch society would fall apart. But it did not. Opposite happened! Holland started attracting a lot of tourists. Legal prostitution spread like a wild fire to many nations on Earth, and porn is helping that. In effect I think it has a positive impact on the World. People get together, have sex and are less violent, For example in Holland there is almost no domestic violence. There is significantly less of it then in the societies where prostitution is not legal.To make a long story short, this film is fantastic and answers many questions about porn, sex, and love. It answers questions on societies in general too. It is a MUST see! Please take time to watch it.",8.0,Anonymous,Romance
This movie was a...,"Contains Spoilerwaste of my time. After I saw the Trailer for this movie a couple of weeks ago I thought ""damn, this movie looks pretty decent and has a good Cast too."" and I went into the cinema with (not too high) expectations.After the first 20 minutes I thought - okay -.But then... I don't know it got pretty boring. Every 10 min you see some porn stuff, the same cut and the same sound. Then he is in a Church and then porn again and again and again. He gets into a relationship with a woman who hates porn - mindblow-. And he's like ""yeah I am not porn addicted I can stop watching porn"". And then (you can guess) he watch's porn again.The end of Don Jon was a standart movie ending, which you probably saw in 1000 movies before. The subtext is: Pretty girls are just pretty and uptight about sex.I would'nt recommend this movie to anybody save your money!",5.0,Anonymous,Romance
Great Romantic Comedy Movie I've ever seen.,"I Love this movie. Joseph Levitt is so cute and rock. I love that the ending of this movie said that, love is not about me or you, but it's about us. How we connected to each other. And that's so sweet. It's me make learned that relationship is a huge thing of our life, we receive and we shall give, that's exactly meaning that if you want your partner to love you then you should love him back, and love itself is not just about sex, it's more than that, it's about understanding each other. Understand that, that's what he or she needs, if you want to stop his bad attitude than you should tell them easily, tell them slowly, and show to them that this is the way to change, so if they change, they will really feel comfortable with change they made. When they feel that, they will be so thankful for you. and this movie deliver this message. And it's about pure love. You're so good Levitt.",10.0,Anonymous,Romance
Superficial with a thoroughly unlikeable protagonist,Full of brash caricatures of Jersey types - loud mouthed families with awful wallpaper. The redemption is far fetched. At least it is only 90 minutes long.,4.0,Anonymous,Romance
This movie it's not about porn,"I saw a lot of comments saying that this movie it's about porn addiction. This seems so obvious. But it's not. This film it's about how much a woman respects the reality and understands her man. The truth is that every man watch porn, more or less often. But sometimes they find a woman who makes the real life better than porn, not by being more hot than the porn stars but by being close to a man needs and soul.This movie it's about finding THAT woman.This is a good, fresh, well made movie. Joseph Gordon-Levitt is a brilliant director, the script is excellent, the actors are great. Go and watch it by yourself, you may learn something new about male psychology. I gave it a ten.",10.0,Anonymous,Romance
shallow development of characters,"This movie deploys what seems wrong with movie making in the US, especially when talking about dramas and sitcoms (anybody knows what this is? i think there must be much more interesting characters to reflect today's society. as with Ted, the characters are so shallow I doubt that's the best movie makers can do to show paint strokes of today's society. Julianne Moore's character is the only thing that can make you stick to your seat. And OK, I must admit this movie brings up an interesting topic about today's vices, but I guess it turned out to be too repetitive. by the way, religion the way it's shown from this guy's perspective is just not compelling.",5.0,Anonymous,Romance
Don Jon = money poorly spent!,"Watching the trailer it looks like a movie that has a nice plot to spend a couple of hours with friends to get a few laughs; instead, seeing it in its entirety, you will understand more and more that it is actually a movie full of clichés that leaves no space for laugh, nor to an interpretation on a personal level. similar to ""the ugly truth"" that already in itself could not be called a masterpiece, Don Jon is definitely a movie that you don't see pleasantly unless you like the final granted and the insipid plot. Rated 5, due to the great disappointment of the participation of Scarlett Johansson that, given his level of acting, definitely would have done better stay at home.",5.0,Anonymous,Romance
Let us realize the effects of porn to man's life,There is clearly no need to discuss about the performance for the lead actors or actresses in the movie. They all self proved and talented and they prove it once again in this great project.The movie itself is cleverly written and lays emphasis on a man's simple life in a funny manner. Any man can find something about themselves in this movie even no body wants to admit it :)If you like Scarlet Jo you will love her in this one I can promise on that easily.Without any prejudice you should see this movie. It is highly recommended must see movie.,8.0,Anonymous,Romance
A ladies man finds some love and relationship meaning .,"""Don Jon"" is one fun sexy and wild romantic comedy that keeps you entertained and gives you feel good laughs. It's something that many men can relate to and that's being a ladies man when they bed change on a relationship to relationship meeting phase. Joseph Gordon Levitt who also wrote and directed stars as Jon a young New Jersey man who loves family, sports, a gym workout and church confessions. Yet none of those hobbies can match his love for online porn viewing and going to bed with beautiful women. At bars and clubs he meets hot sexy ladies then Jon goes to bed with these sexy colored bra wearing ladies, only he meets his match when he takes up with tough and straight talking Jersey girl Barbara(the sexy Scarlett Johansson). And Jon struggles with the porn issue even though he has hot intimacy with Barbara along the way veteran actor Tony Danza is tough with love and concern as Jon's loving dad. Oddly like all romantic comedies this film twist as in an unexpected way Jon finds love and some happiness in the form of an older woman he meets in a night class named Esther(Julianne Moore) will it last? Anyway this is one sexy feel good watch of a film that highlights what many men have a passion for casual sex and a porn love while struggling for love that's ever lasting.",8.0,Anonymous,Romance
Overrated,"I may miss something here. More than 100 reviews, 7,3 average, described as stellar and hilarious. Is it Italian dubbing's fault? Or American's idea of hilarious? Not really sure but what I found is simply ""genuine"" (like in the poster) foolishness.The first section on Jon's porn philosophy is great and the camera work, the editing, the music just represent it in all its magnificent pride. Then comes Scarlett and the massive editing stops remembering us all what real life is (and how beautiful can be...). Then you forget that it's a film and it becomes a live bad drama-bad comedy-bad docu (some actors were pretty good nonetheless): here you're not interested anymore in the editing and you just wait for something, the climax, the point, a smile... then comes the end.I don't really know if there's a point here. It seems that here we have a docu on porn addiction and sexual issues, a comedy on an ignorant nice guy in love with the most gorgeous girl of the town or a drama on sexual relationships and the balance of power between modern men and women. And I don't like either of them:The docu is superficial. Some good moments with Julienne Moore only. I appreciate the view on Jon's porn philosophy he shared with us in his simplistic style: I find many interesting points of discussion in there and would have appreciated a film ""talking"" about that.The comedy is not hilarious at all. It's a matter of tastes but this is truly bittersweet too much with the church and the family and the friends. Too much to make me something more than smile.The drama is the least engaging and you would even like to see something else instead of Scarlett. Why should be interesting that a guy falls in love for his virtual sex dream without even knowing her, then porn separates them, then you get that some women may behave like b*****s with men without brains and with the sexual life of an orango in heat. So deep and engagin.I think many reviews really overate it by finding something likable in any of the three tracks (Scarlett in the drama of course).Intouchables was hilarious. This was just... meh.",5.0,Anonymous,Romance
Recognizability,"Who else than Joseph Gordon-Levitt -one of the most versatile actors of our time- could make his directional debut about a such a controversial subject as a porn addict and make it totally work. Besides directing it he also plays Don Jon, a very macho womanizer who falls in love with Scarlett Johansson. He plays his character in a very funny and tongue in cheek way, but still believable. There are people like that out there and the recognizability of that makes it such fun to watch. I won't give away much more of the plot but I liked Levitt's first authored film a lot. Be warned though that because of the nature of the subject there might be some occasional nudity.",8.0,Anonymous,Romance
"Stereotypes amplified to ridiculous levels, then obvious ending","I like JGL, as an actor. This movie just takes 3-4 stereotypes, turns them up to 11, and beats them to death. Maybe there's something revelatory to a younger audience, but I doubt it.Julianne Moore shows her chops, because she doesn't have much to work with, but still gives a good performance. Everyone else is just going through the motions of delivering bad dialogue like they know it's bad. Even the writer doesn't seem to believe his own words.Scarlett Johansson is sufficiently irritating as the shallow, self- centered girlfriend, but her performance feels like a performance. The rest of the supporting cast just goes through the paces. Rob Brown, the friend, has a few moments toward the end of the movie, but that's about it. The material is just poor.Don't bother with this one.",4.0,Anonymous,Romance
