title,content,rating,username,genres
Don Jon Is A Profoundly Therapeutic Film!,"Anyone who has sexual, intimacy or porn addiction problems should watch this film. It will help you to heal! Even if you have none of these issues, bring your lover to this film. I guarantee you, if you're even a somewhat sensitive person, you will make passionate love to each other after watching Don Jon! It's that good!If you're a psychotherapist or if you lead a support group for intimacy or sex addiction problems, I highly recommend watching this film! It will benefit both you and your clients!While this film is geared to heterosexuals it will benefit anyone regardless of your sexual preference!If you have never experienced true emotional intimacy with another human being, or a truly loving sexual relationship, Don Jon will give you some idea what true emotional intimacy or a loving,sexual relationship is all about!This movies is so profound and it's ramifications are so deep I'm starting to get emotional myself as I write this review!",10.0,Anonymous,Romance
Joseph Gordon-Levitt is a Don in this one,"Very nice film from Joseph Gordon-Levitt, not only does he do acting, he also does some pretty good writing and directing with this film, it is a very good debut as a director I must say.Our main character holds eight things very dear, those are his body, pad, ride, family, church, boys, girls, and porn, especially the two last have some conflicts and that is what this story is centered around.It is very explicit and graphical, that works to its advantage and reveals a lot of our character Don Jon, but it also lacks a few pointers here and there, it is all moving fast and you don't really get every aspect of either Jon ""Don Jon"" Martello Jr. or the people he surrounds himself with.",7.0,Anonymous,Romance
"Wait for DVD Release, then Watch on Mute","I saw this last night, and learned sadly that Joseph Gordon-Levitt is not a writer. The trailers more than suggest that this will be an in-your-face movie about a guy with a porn addiction, and in that sense it does not disappoint. But if JGL bothered to go a little deeper (no pun) and tried to actually flesh out his characters instead of making them little more than cardboard cutouts and eye candy, this might've been watchable. It wasn't. I stayed in my seat because I had already paid the full price, but there were so many cringe-worthy moments that I was embarrassed for JGL and everyone who said yes to this movie. The dialogue was so trite and unbelievable--NO ONE TALKS LIKE THAT! Scarlett Johansson's character doesn't seem to have any dignity, as she just goes along with ""Don"" in whatever he wants to do. Julianne Moore was great, but she seems to have just been tacked on as a device to make Don seem like less of a jerk. Anyway, this just goes to show how far money will get you, because there is no way this would have been green-lit without JGL. It seems he needed an excuse to make out with Scar-Jo and Moore, and hey, who can blame him? But please, for our sake, make something with substance before releasing it to the world. I do hope he gets better if he chooses to keep writing/directing, because I'm a big fan of his acting.",2.0,Anonymous,Romance
"Charming, Well Written and Acted","Saw this not too long ago. It was really unexpectedly charming and well written. Joseph Gorden Levitt did a great job balancing all the hats of writer, director, and star. Probably not what he would be normally cast as but when you see him play it you would assume he'd be exactly who they should cast. Not many people can pull off porn addiction with such charm. I have to say I am not a fan of Scarlett Johansson. I just don't find her appealing but I could look past her for the most part because the role seemed more like her natural state LOL. Julianne Moore always does a fine job. If you get the chance it's definitely worth a watch. I am sure this is the beginning of Joseph Gordon Levitt's writing career.",,Anonymous,Romance
Entertaining,"I find Don Jon entertaining! It's awesome to be able to just sit back and relax while watching a movie. Movie these days, even comedies have some sort of thrill or adrenalin pumping factors to it. Im not complaining but its great to find a light and entertaining movie like Don Jon these days, one that can keep you from being bored despite the fact it has no thrills. Anyway, the characters are magnificent. Thumbs up to the three lead actors. Overall i give Don Jon a 7/10, despite the 'non educating' story, it actually have a good moral everyone can learn from. You can do everything right in life but it will still feel wrong if you don't have the right person beside you.",7.0,Anonymous,Romance
Badda boing,"Put off watching this because I was over the whole Jersey/Italian stereotype long ago. Unfortunately, the aforementioned stereotype is abundant. Fortunately, it's an engaging film with a good message. I found the Julianne Moore character to be refreshing and wish we could've had a bit more development or at least a less clumsy way to introduce her. A more convincing way of revealing her and Jon's burgeoning relationship would've been even better. Regardless, the movie overcomes most of its shortcomings and I would recommend 👍",7.0,Anonymous,Romance
An unpleasant but very good movie (warning: super awkward on dates!),"I expected to see a romantic comedy to watch with my girlfriend. needless to say my girlfriend was shocked by all the sexual content in this movie. I highly advise NOT to watch this movie with a girlfriend, because it can be VERY awkward.However,the movie itself contained a very important message, about how the media affected our vision of relationships. Don just wanted real life to be like internet pornography and his girlfriend just wanted life to be like romantic movies. This causes unreal expectations of the opposite sexes. I felt very attacked by the movie and so should a lot of other young people be. because movies can be fun, but a great movie deals with topics that surround us, like drugs, violence and religion.",9.0,Anonymous,Romance
"yes, it has a ""message"". a very PC message.","How is what he's doing different than her addiction to romantic movies? he's just enjoying single sex, she's cheating with her entire emotional world.
And go you guys ever read ""romantic"" novels? did you read ""50 shades""? Do you even get what it all means?",7.0,Anonymous,Romance
"Realistic, but revolves around sex too much. Has the cheesiest and least creative plot imaginable. A guy movie.","It was realistic, I'll give Joseph Gordon - Levitt that, but the plot was awful. Cheesy, overused story. It degraded women to the point where it was just disgusting to watch (I am a male, by the way (not that it should matter)). It revolved around sex and pornography way too much. I think it's pretty bad, but for some reason I didn't really mind watching it. A few underdeveloped problems and not enough character development. I give this a 5 (maybe a 6 because I'm feeling generous). The selected audience are clearly males, but I feel as if it was directed towards teenage males (which once again, I am) who don't have a full sense of how sexual or romantic relationships work. I mentioned previously that it was realistic, but to a certain extent. 5-6/10",1.0,Anonymous,Romance
"It's not a movie, it's an experience.","Joseph Gordon Levitt first has writer and director, has tries to be a relaxing filmmaker where the cast are at ease in there scenes.The story of Jon(Joseph Gordon Levitt) who lives life in the fast lane, loves watching porn, working out at the gym, and picking up on woman at the night club. But then his thing on woman change, when a young woman(Scarlett Johansson) has different response to him. Then Jons thing on woman and begins to take an interesting turn, but how will it all play out?I will not say this is a great movie, because Joseph Gordon Levitt is quite a visionary director, but I felt he had trouble writing jokes that are funny, they basically being thrown down are throats, and come across like it's trying way too hard. And the porn thing felt like a one joke that just playing itself out. But the cast do alright, Levitt performance was pretty good, so was Johansson and Tony Danza has Levitts dad.",7.0,Anonymous,Romance
Pointless,"The characters were incredibly unlikeable and there was no point to the film, the film was literally pointless. That was literally just time of my life that I'll never get back.",2.0,Anonymous,Romance
"Joseph Gordon - first movie he wrote, directed...","...and starred in, and he writes himself having sex with Scarlett Johansson. I should become a writer and actor.",,Anonymous,Romance
Don Jon tackles a taboo subject and utilises it to create a witty subtle comedy.,"This is Joseph Gordon-Levitt's baby. Directed, written, produced and starring the man himself. Technically he shows flair and promise, but the film itself lacks quite a few essentials. A promiscuous young man loves his life, where he follows the same routine every day: sleep, workout, party and have sex. In between these pivotal aspects, he finds time to watch pornography...to a point where he becomes addicted to it. Unusual subject to portray, especially for a directorial debut. It certainly is a statement! Combining pornography with relationships in order to create a comedy kind of works actually. There are moments where I did laugh, particularly as Jon repeats church confessions every week (where his sins progressively get worse). Gordon-Levitt's direction was extremely competent, I especially loved his quirky traits. Quick cuts of pornography to show his character's constant thinking of it, the repetition of certain scenes to highlight his routine and focussing on certain body parts of women to portray his infatuation with sex. The latter however, I do find incredibly distasteful. Objectifying women for the majority of the runtime was superficial. It was constant. I just didn't warm to it at all. Although, showcasing Johansson was a wise choice, both their acting and chemistry was well demonstrated. For a film that was over 90 minutes long, it really didn't go anywhere. The pace was incredibly slow. So whilst I find Don Jon to be a competent comedy with technical panache, it wasn't a subject that I was particularly fond of and found certain elements to be distasteful.",6.0,Anonymous,Romance
Entertaining enough but without a hint of subtlety or edge.,"Porn stars, be flattered. You've inspired Joseph Gordon-Levitt to write, direct and star in his first feature film to talk about how much he likes you. I used to like Levitt a few years ago when he appeared in (500) Days Of Summer and Inception, but as he's slowly turned himself into a brand that his film career hasn't justified yet, it's come with a bulking ego. I was excited for Don Jon at first, but the film and Levitt have become much less endearing. I still like what he does sometimes, Looper was one of the best films of the year. But Don Jon is a satire that tries far too hard. The caricature performances and clichéd side-characters may be deliberate, but without a straight man in sight it ends up feeling juvenile and only occasionally funny. With their forced struts, exaggerated accents, matching tank-tops and chains, they talk as if Levitt desperately wants to be in a Scorsese movie, which the flashy camera-work and editing certainly try to match. Unfortunately, the way the, albeit valid, social commentary is on the surface and in the dialogue completely negates its effect.Sure, he has a good point on the relationship between men and porn, women and rom-coms, but it's kind of stating the obvious. Despite attempts to repair one side, it doesn't elaborate on this argument or come to a thesis, it just merely brings it up. The main problem is that it's difficult to believe its main plot. With a character like Don Jon, it needs a real crisis for us to believe that he needs a real relationship. Instead the film shifts in the direction it needs to go in a contrived way. I quite like where it ends up where Don finds salvation, it certainly wasn't predictable, but there's times when the perspective of women matches this overly macho representation on men and it teeters uncomfortable lines of misogyny. However, despite overdone lighting and photography, its saving grace is its keen-edged editing which really cuts through the problem with the script where it overuses repetition without showing enough growth each time. It's mildly entertaining, somewhat interesting, but sadly without a hint of subtlety or edge. Perhaps I'm still a little bitter that Levitt gave Brie Larson literally nothing to do.6/10",6.0,Anonymous,Romance
"Sometimes crude and vulgar, but always for a reason","Don Jon is not what I would have expected Joseph Gordon-Levitt's directorial debut to be like. It tells the tale of a man deeply addicted to pornographic movies. So much so that even a million dollar babe like Scarlett Johansson can't fully satisfy his needs for sexual release. Sound vulgar and abrasive? It is, from time to time, but it's also a cutting social satire, a really good character study and a funny comedy, all wrapped into a delightful package of uncomfortableness.The best part of Don Jon are its main actors. Gordon-Levitt absolutely shines in the leading role. He captures it all. The cockiness, the charm, the uncertainty, the naiveness, the lust, the strength of character, the ideals, the idiocy. Jon feels like a real human. A strange one to be sure, but he has so many layers that you cannot help but feel like he's real. Like you could meet a dude like this at the gym or outside a nightclub.Scarlett Johansson and Julianne Moore also do credible job in portraying the two women in his life. They're polar opposites in many respects, but you can see what pulls him to them. And once again, they're both larger than life as well as real enough to please the human in us.Don Jon is not for those overly sensitive about social sensibilities. Its main themes are sex, porn, addictions, falseness of outward appearances and the masks we put on to fool both others as well as ourselves. It doesn't apologize for what it is, it doesn't shy away from anything. But if you can manage it, it's one of the funniest and most poignant social commentaries you've likely seen in a long time.",6.0,Anonymous,Romance
There are some very funny scenes in this one but it has a lot of heart and that is the reason to watch.,"""It's not that I can't stop I just figure why should I...it's not like I'm cheating on her."" Jon (Gordon-Levitt) has a fun group of friends and is passionate about a few things. One of which is porn. Because of this obsession he is unable to have a healthy relationship with anyone. When he meets Barbara (Johansson) he thinks he found the perfect girl. Little by little he begins to wonder if he will ever feel about a woman the way he feels about his porn. First off I will have to say that this is not for everyone. If you offend easy then avoid this. Also the first five minutes are the raunchiest in terms of dialog so if you can make it past that you should be OK. As far as the movie goes I did enjoy it but the thing about this movie is the abundance of sex and porn will distract from the true meaning of the movie. The movie isn't necessarily about addiction but more about watching a man trying to connect with a human in a way he never has before. There are some very funny scenes in this one but it does have a lot of heart and that is the reason to watch. Acting is great but all of this won't be given a fair chance because of the in your face porn aspect. That is a shame. Overall, a very well done and good movie that won't be given a chance by many people because of the subject. I give it a B+.",8.0,Anonymous,Romance
Not a dime,"Boy finds the girl of his parents' dreams. Then a woman finds him.Interesting rom-com that doesn't lead the laughs home. The best moment was when he interrupted his singing to a gay song as his car came to a halt next to some girls. There's lots of structure and repetition, and you can see how it might work on paper, so I guess the miss is down to the direction.Wonderful actors, but Moore and Headly should have had more developed characters. The sister was interesting - always withdrawn to her phone screen, then delivers a word of reality. I liked that, but didn't she have problems similar to her brother? The highlight was Johansson in an icy/steamy role.Pace was fine, music whimsical.Always a bad sign when you start discussing the actors. Still, it was good - but not that good.",6.0,Anonymous,Romance
for god sake what is this,well let's see movie starts with that guy the hero talking about his life and how convenient it is friends family work and girls and also the nickname don which is only given to those who are great seducers or womanizer i first of it thought it was going to be an other movie like spread but her it would be with younger women but instead i got an addict on adult movies and make love to women while hanging with a midget and a black dude guy to feel like he's cool or something after that comes the straw that broke the camels back which was that girl damn i can't say her name any ore it irritates me to just thinking about that accent and that shrill voice who did nothing but to order him around and making him her slave of desires which is actually good in real life for all losers out there but not in a movie where the actress accent is like death penalty and sums it up he goes for the old hag though she still sexy and feel comfortable with her and her body while her i may say only sees him as her late husband in bed and her dead son out of the bed because each time she sees him it's do that or do this so to sums it up don't wast your time and money on it it stinks thank you for listening feel free to comment,1.0,Anonymous,Romance
Actor. Writer. Director. Splendid. ♦ 86%,"Joseph Gordon-Levitt is a wonderful actor and his performance has always been par excellence for me. With Don Jon, he not only has considered himself as an all-rounder but also made himself a talented stalwart in the cinema industry.Don't get my appraisals so hyperbole, because: The film starts with a bang (pun unintended)! The beat music, the visual effects and the prologue as to what to expect from the guy in front of us is simply one good opening. Then, the story kicks in and the screenplay reminded me of Edgar Wright and his Cornetto trilogy. It was lovely to see the frames actually change so swiftly giving out the impression on a wider scale. The idea reaches the audience successfully. The boldness & honesty in the first part of the film makes it realistic & teenagers/adults can so highly relate to the ""masturbation factor."" You bet! Dialogs are very good. Pure work by the art, light & sound department.Then we have the performances. JGL is terrific, no doubt and his peculiar air in this would definitely make the girls drool. Then we have Scarlett Johansson who is sexy as always and acts well, too. Jullianne Moore is fine. I loved JGL's on-screen family. All of them were funny & lively & looked so real. The story is written with emotions and they kick in the second half as it gradually maneuvers into a rigid conclusion. Many reality bites have been spoken loudly in this comic romance where attention to details is one thing why direction looks good. Cinematography is good, so is the soundtrack & music. Editing could've been better.BOTTOM LINE: Highly Recommended! It speaks volumes about sex, masturbation & love. Let the boldness not affect you.Can be watched with a typical Indian family? NOT AT ALL.Profanity: Mediocre | Vulgarity: Very Strong | Sex/Nudity: Strong | Porn: Critical | Violence: Mediocre | Gore: No | Alcohol/Smoking: Mild",9.0,Anonymous,Romance
An Agreeably Offbeat Directorial Debut,"Joseph Gordon-Levitt has worked as one of Hollywood's most talented young actors for years now, so it's a relief that his writing-directing debut, ""Don Jon"", is not a vanity project but a tender, funny romantic comedy stimulatingly unconventional. Not playing himself like Woody Allen always did in his best movies, Gordon-Levitt swaps his public easygoing appeal with the greasiness of a New Joisey guido with an addiction to porn. Such a male lead would normally be reprehensible, but Gordon-Levitt, as it turns out, is a writer who pens with a great deal of heart, turning his titular Don John into an anti-Prince Charming sympathetic instead of crude.In ""Don Jon"", he is Jon Martello, a 20-ish player who only cares about, as he puts it, his body, his pad, his ride, his family, his church, his boys, his girls, and his porn. He sounds like the perfect candidate for a ""Jersey Shore"" reboot, but Jon is much more than some hulking no-brain ready to annoy the hell out of Snooki Polizzi — as a porn addict, he, despite having one-night-stands like it's his job, is unable to make an emotional, let alone physical, connection with a woman. He figures porn is better: he can lose himself in the distanced vulgarity.When out with friends one night, he spots Barbara Sugarman (Scarlett Johansson), a shapely blonde who instantaneously has him wrapped around her finger. She doesn't want to be another one of his single night flings — she wants to court, to put off sex in favor of dates, to meet each other's families, to get to know one another. Not because she's been burned before, but because she, like Jon, has an addiction: romantic comedies. She wants to be a real life Sandra Bullock, finding love in the most unexpected of places. Normally, Jon would be put off by such silliness — but Barbara is much too irresistible to let down. Problem is, his addiction is still riding strong, hindering any kind of growth in the relationship; and when he meets Esther (Julianne Moore), a damaged middle-aged woman who seems to understand him better than anyone else, things begin to get out of hand.For being such a short movie (a mere 85 minutes), ""Don Jon"" feels vast, having a lot to say and packing in quite a bit of obligatory rom-com charm. But unlike most rom-coms that rely too heavily on that rom-com charm, Gordon-Levitt digs deeper, analyzing the nature of addiction and how it can affect nearly every aspect of one's life, whether it be through a romantic relationship or a familial one. He's subtle about it, never becoming a preachy artist standing on a soapbox warning about the dangers of porn. ""Don Jon"" is so far beyond the other additions to the genre because it makes a good case to try to understand a character; even the secondary players seem rounded, not cutout (a risk considering the over-the-top NEW JOISEY flightiness of the majority of 'em).Gordon-Levitt gives an expectedly monumental performance, returning back to earth whenever he threatens to tread into Joey Tribbiani 2.0 territory, but the real stars of the film are the women, particularly Johansson and Moore. Johansson rarely gets the opportunity to let her comedic chops shine, but in ""Don Jon"" she goes all out, humorously embodying the blonde, gum-chewing, manicured, monotone Jersey girl with just enough credibility to win us over. Moore, as Jon's second love interest, is unrefined and sexy, playing a woman old enough to raise eyebrows but pushing doubts out of our judgmental windows through reasonable affinity.""Don Jon"" is a satisfying project for a major talent — Gordon-Levitt has proved himself in his acting for years, and here we finally get to witness him directing and writing like it's no big deal: it seems natural, proper. Now that we've seen what he can do with the rom-com, it's only inevitable to want to see what he does next. This is a small movie, a diamond in the rough: one can only wonder what will happen if he does something bigger.",7.0,Anonymous,Romance
Don Fail Jon,"Yes, we get it, a lot of our parents fell for it, good looking loser, works out a lot, watches porn a lot, masturbates a lot, spins stories of grandeur, goes through this one and that one, all the while they slowly get older, get poor and then wonder why they're at where they're at. Then they get debt to try and not look older poorer, like a well to do family, but in reality they continue to get older but now with debt, making them even more poor then before. The lucky ones don't end up with kids in that crap life at least, but the unlucky ones with the same crap life do, if not with more than one baby mama crap thing going on.Jersey Shore was the show that killed them, and the like, just think of how many people ruined their lives trying to be a jersey buff knock off joke while the real jersey cast at least made some money off of the sap masses before they got cut to go fade out, but at least they faded a little bit better than the poor debt buff knock off masses that fade out with no fame, no education, no money, nothing really to remember, but oh yeah, nice once was body and tan, pleaseSums it up for ya",1.0,Anonymous,Romance
