title,content,rating,username,genres
"""Easy A"" gets an A for Awesome! Emma Stone is absolutely terrific!","Olive (Emma Stone) is your typical high school outcast. She is smart, sarcastic, and smarter than your average student, which is why she is invisible in high school. One Friday, Olive's best friend Rhiannon (Aly Michalka) asks her to come away for a weekend with her and her parents. Olive respectfully declines because she states she has a date with a college freshman named George over the weekend. This isn't true mind you but just a little white lie because Olive finds Rhiannon's parents a little odd. When Monday rolls around, Rhiannon asks Olive about her date and keeps on asking her if she ""did it"" over the weekend. This is where the fun begins as Olive decides to tell yet another little white lie that turns her world upside down. Lots of laughs, fun, and 80 movie references ensue...If John Hughes were still alive today, he would be happy to see someone create a feel good teenage comedy that really lives up to all of his 80s classics. That was my first thought when I walked out of the theater after seeing ""Easy A"" over this past weekend. The movie, which from the trailer I always wanted to see but was worried about. Teen comedies today are a dime a dozen and most of them are so bland and boring that they are usually forgettable the moment you leave the theater. ""Easy A"" is truly a breathe of fresh air when it comes to teenage comedies mainly because of its story and even more importantly its cast.First off, the storyline in this film is fresh and fun. Some will say that this film is loosely based on ""The Scarlet Letter"" by Nathaniel Hawthorne, which it can be seen as to be fair. ""Easy A"" uses ""The Scarlet Letter"" as a joke within the film because Olive is reading the novel in her class and is apparently acting out the role of Hester Prynne, who is the main character in the novel. Anyway if the story of an outcast faking losing her virginity in order to get noticed isn't funny enough, you take that plot and go a step further, which makes it even funnier. By the middle of the film, Olive has said to have slept with at least half of the school. This, of course, is wildly untrue but at the same time just reminds the audience of how silly and jaded high school really is and was. The story while silly and fun really says a lot about how a lot of people are selfish for their own personal gain and are also more worried about how others view them rather than how they view themselves.Besides the storyline, the main reason this film works so well is because of Emma Stone, who proves here she has what it takes to hold a film. Emma Stone has always been a favorite of mine but this is the first time she has had a lead role. Stone is probably best known for her role in ""Zombieland,"" which she was good in but in ""Easy A"" she is just terrific. Stone isn't the typical Hollywood ""hottie"" because lets be honest she looks like your average girl. That's what makes Emma Stone so right for this role because its believable. Stone comes off as intelligent, sarcastic, and as someone who truly wants to be seen as something else. She is a natural in this role. I personally think Stone is a beautiful woman, not because of her body but because she carries herself with such an attractive personality and doesn't try to force sexiness upon the audience. She is just naturally a beautiful woman. I think in a few years from now, Stone will be looked upon as one of the best actresses in Hollywood. She really has a lot of talent and I can't wait to see her in future projects.As for the rest of the cast, they are all noteworthy as well. Patrica Clarkson and Stanley Tucci are just hilarious as Olive's parents. The playful yet loving relationship they had with Olive was refreshing and was much different than the completely controlling parents displayed in most teenage comedies. Both Clarkson and Tucci are terrific dramatic actors and it was nice seeing both of these talented actors play a silly and fun role for a change. Amanda Bynes plays Marianne, who is a religious nut job in the film. Her role in this film reminded me a lot of Mandy Moore's role in the film, ""Saved!"" I felt Bynes did a good job with the role but the entire time I kept wanting to see Mandy Moore play that role. I don't know why I guess when it comes to a crazy religious nut job Mandy Moore's face has been implanted in my brain. Thomas Haden Church is a nice addition to the cast. He plays his normal sarcastic guy role but in this film he actually isn't a douche-bag like he is in most of the other roles he plays. Even Lisa Kudrow, who I haven't seen in a film in years, does a good job with her small role.In the end, ""Easy A"" is probably one of the better films of 2010 and that came as a complete surprise to me. Sure its not an Oscar worthy piece of film-making but it's a very funny and enjoyable film from start to finish. This is the second film from director Will Gluck, who really may have some staying power in Hollywood and has really won me over with this film. As I said above, Stone is perfectly cast in the film and holds the film together like a pro. She is the reason to watch the film. Add on the funny and uniquely told story and you have yourself a fun filled little movie that makes you happy as pie when you leave the theater.",8.0,Anonymous,"Comedy, Romance"
Charming!,"The best way to describe Easy A is calling it a wiseass high school retelling of The Scarlet Letter. That can also be a temperature gauge for someone to tell ahead of time if it'll be there thing, or not. I enjoyed it a lot, thanks to a funny as hell Emma Stone who doesn't leave out the vulnerability peeking through her guise as strong young woman. It's a little more relaxed in the content department than some of the bawdier stuff that she got her start in, but still contains sufficient amounts of raunch to please the comedy hounds. Stone also has a veritable army of seasoned pros backing her up, an element which helps her, however she's quite capable of carrying a film and does so as well. She plays Olive, a spitfire high school girl who finds herself in a funny yet unfortunate situation after her dunce of a friend starts a wildfire sexual rumor about her. Soon the whole school is talking about it, and she takes action in a bizarre move to fight fire with fire...of a certain kind. She boldly takes up the mantle of the school harlot, forever changing things in her quiet serengetti of suburban youth. It all spins wildly out of control, a common characteristic of adolescence, with poor Olive stuck right in the middle of the debacle, which sucks for her but is too funny not to enjoy. Stanley Tucci (""The Bucket List"") and Patricia Clarkson are darlings as her parents, Thomas Haden Church scores points as a deliberately hip and sympathetic literature teacher, and Lisa Kudrow that old flamingo, has fun as a dour guidance counselor. There's also work from Amanda Bynes as an unhinged religious nut, the perpetually wooden Cam Gigandet, Penn Badgley and a brief cameo from Malcolm McDowell as the world's most cynical high school principal. As a riff on The Scarlett letter it keeps theme alive, and as a teen comedy with a gaggle of adults trying to keep up with the youngsters, it's a charmer. Stone holds the proceedings together very well.",7.0,Anonymous,"Comedy, Romance"
One of the Best Movies Ever!,"I LOVED this movie! I usually don't watch these types of movies, but I'm so glad I watched this one! Emma Stone is an amazing young actress who is going places. I loved her as ""Gwen"" in Spider-Man and I loved her here. So talented!And the rest of the cast was familiar to me and great at playing their roles. Like Amanda Bynes is another great actress whom I wanted to mention. I saw her in ""Sydney White"" and this character is so different from the one she's playing now. Amazing job!!! The plot and the directing is amazing. Hopefully I will see more movies with the same cast and director soon.The songs used in this movie were out of this world good. I knew almost all of them and couldn't help singing along at times. Big round of applause for the music director. Honestly this movie was amazing! Anyone who says different does not have a sense of humor!",9.0,Anonymous,"Comedy, Romance"
Easy A,"This high school comedy was a dark house last year and earned more than 80 million dollars in the box office in North America alone. It stars the new girlfriend of Spiderman Emma Stone as a modern THE SCARLET LETTER tale happened in high school without any vulgar slapstick which frequently reoccur in the recent comedies worked as set pieces. The tug-war between rumors and reputations is always tricky not only to teenagers.The film has a star-studded supporting cast, including Oscar nominees Thomas, Patricia and Stanley, as well as Lisa Kudrow, who surprisingly had a slightly repugnant role. Patricia and Stanley as the liberal parents does manifest a great affecting love and rapport with their children (the quirky respond to the adaption question), which is the most precious achievement of the film, deserves a standing ovation.Emma Stone is adorable in her first leading role, which earned her an Golden Globe nomination this year, her hoarse voice does distinguish her from other cheesy hot chicks and her personal temperament is perfect for her character, like it is emphasized in the film, the film reminds us of 80's teenage films made by the late John Hughes, time flies, nostalgia becomes the new trend, for example, the unrecognizable Amanda Bynes, I miss SHE'S THE MAN (2005) even though she is only 24 now.It is a big comfort to see a fresh teenage comedy focused on a high school girl instead of the popular nerdy geeks, and I do foresee a brighter future for Ms. Emma Stone.",7.0,Anonymous,"Comedy, Romance"
Ten,"This is such a fun, light hearted film. It was really entertaining. The cast is great. The music is also very nice! Pure enjoyment from the start to finish. I recommend. Ten stars from me.",10.0,Anonymous,"Comedy, Romance"
Nah,Not that bad but not good either I hated the unnecessary part,6.0,Anonymous,"Comedy, Romance"
Abysmal,"John Hughes would roll over in his grave if he saw this poor excuse for a high-school movie (especially since it contains several references to his blockbuster films). The plot is not believable at all, the script is encumbered with dialog that often makes the actors sound scripted, and the acting is extremely sub par overall.This movie has no sense of its own identity. It's more about the main character strutting around in slutty clothing than anything else. It is a prime example of the kind of tripe too often produced by Hollywood these days.Don't waste your time on this joke.",2.0,Anonymous,"Comedy, Romance"
A good chick flick film !!,"I was very surprised on how good this movie was. Emma stone is a talented actress and was excellent in this film. A good film to watch on a Friday, Saturday nite with your girlfriend's. I throughly enjoy it and the storyline was not to bad. Give it ago and watch it people you will be surprised on how good it is.",7.0,Anonymous,"Comedy, Romance"
mastery in character portraying,"An effortlessly entertaining High School-set comedy that bounces charmingly over-the-top, Easy A combines the occasional knowing truth with its laughs for something winning. With its smart narrative, uptempo style, genuine inner truths, and remarkable leading woman, Easy A is a success. Humorous and wise, the film provides a memorable and completely enjoyable experience.",8.0,Anonymous,"Comedy, Romance"
A John Hughes homage and a lot of overacting,"I really don't know what all the fuzz is about except for Emma Stone delivering solid acting.The story is far fetched about a high school student who is rumored to be a slut and she decides to go along with her new reputation. The director tries to mimic the feel of the earlier John Hughes movies, even bringing an homage to it by including extracts of The Breakfast Club and Ferris Buellers Day Off, but in the end delivers a rather hysterical take on high school. Except for Emma Stone as the lead, nearly all actors overact annoyingly.Easy A desperately tries to deliver a high school comedy with some more depth, but in the end gives you a headache. Who likes this kind of movies, should watch the original rather than this poor copy; check out 'The Breakfast Club' or 'Ferris Buellers Day Off'... both far superior to this.",6.0,Anonymous,"Comedy, Romance"
"Fun, Especially If You Like John Hughes","Easy A is based on Nathaniel Hawthorne's ""The Scarlet Letter"", but is an homage to the teen films of John Hughes. Director Will Gluck even uses clips from some of those films.Emma Stone plays Olive, the Hester Prynne of Ojai North High School. She is blessed with a script that gives her character intelligence and insight, combined with a mastery of pop culture references. The result is an extremely funny lampoon of various institutions and social conventions.Though Olive is the victim of social mores and social media, this comedy keeps things light, thanks to the prodigious charm of Ms. Stone. I might have to watch this film repeatedly to pick up all the references to other films and memes.Among the other great performances is Patricia Clarkson's portrayal of Olive's mother. She lends a quirkiness that feels genuine and is not demeaning to an older generation.If John Hughes can't grace us with more of his films, this is a welcome addition to the genre.(This review is approved by Abe Froman. Never had one lesson!)",8.0,Anonymous,"Comedy, Romance"
"A really fun comedy, with a great screenplay full of strong references of comedies of 80's, with a talented cast, with a remarkable work of Emma Stone","""Easy A"" is the film that definitely revealed to the world one of the best young actresses of recent decades: Emma Stone. The actress had appeared in equity in some TV series and Algus other good comedy movies like Superbad (2007), The House Bunny (2008), Paper Man (2009) Zombieland (2009), but with ""Easy A"", Emma won once its deserved prominence being indicated as the best actress in a film comedy-musical for this work and winning the MTV Movie Awards for best comedic performance, and other indications. The character Olive was made for her. Anyone who has seen Emma realizes that giving interviews wit, the way you talk, the irony of Olive very own personality Emma, who is naturally funny without forcing at any time. She is the biggest revelation of the last few years and with undeniable merits. Not to speak staggering in its beauty and charisma. Difficult even was to believe that a girl as beautiful and with that intelligence and sense of humor go unnoticed at school as shown in the film. Emma is the soul of the film and can watch the movie on the original audio because everything is so much funnier, especially the lines of Olive.Movie film debut of screenwriter Bert V. Royal and only the second film from director Will Gluck, who had only the curriculum Fired Up (2009) the film tells the story of Olive Penderghast (Emma Stone) who is an invisible girl in his school, the typical girl which has its presence known by anyone except her friend Rhiannon (Alyson Michalka). For she did not have to leave with parents Rhiannon on a weekend camping, she minds having a date with a boy. On Monday following Rhiannon asks how was the date, and to keep the story, says that Olive lost her virginity to him, but everything is heard by Marianne Bryant (Amanda Bynes), one conservative and religious extremist, spreading rumors the college and soon the unknown Olive becomes the center of attention.The situation changes the way people look at Olive, which makes her feel divided: while we feel bad for looking at it through a lie, she likes to finally get the attention of people. With that her new found fame, she identifies with the main character of the novel The Scarlet Letter and ends up helping more people off from school to be more views, pretending you had sex with them for money. The situation enhances even more when she accepted the proposal made by Brandon (Dan Byrd), her gay friend, that pretend to have sex during a school party where all are present. Thus, Brandon stops being chased, and Olive takes the time to figure slut school. Only she could not imagine the consequences would reach far his fame.It is interesting to see how the character Olive deconstruct all social relations, making them ever more banal and less true. The comedy is based on a typical American scene - a school with all possible types of adolescents and people - and inserts all possible stereotypes of the genre, and totally distort. Everyone their act with a specific motivation. We have a protagonist who was never noticed and it begins to receive the attention of all, we have the extreme religious acts that by their beliefs, the friend who happens to be jealous of the fame of his friend, etc. Of course, we know that it is all based on a lie, but is it so objectionable Olive so the decision to carry on the story?Even she can help other kids in school, their situation only increases their bad reputation. Does the decision to Olive, though it may be of help, it should be carried forward? Besides the willingness to help, Olive goes also to act as revenge. Revenge for her best friend that does not have the supported his new popularity. Revenge of the extremist religious college who spend their miserable lives. The protagonist has no control of his actions to see if this hatred filled, so that embodies adulterous protagonist of the book you are reading in class. The provocation only increases the desire to continue with this character. And when the lie becomes dangerous and reputation collapses? When the school counselor, played by Lisa Kudrow, asks Olive assume their DST, the film reaches the crucial point that shows the degree reached the lies told by the girl.The film also shows a report on bullying in schools, the lack of interest of directors towards students and homosexuality and how it is still seen by intolerant people. Finally, we have a teen comedy with an edge over the others in the genre: it has a great and original screenplay. Since the creation of the lie, the course with ""snowball effect"" and all its consequences in the life of Olive and all that surround it, until the conclusion of the story in a very creative, realistic and plausible. It is a comedy that makes you laugh at times and you keep a smile on his face all the time. Great direction of Will Gluck, good supporting cast with Thomas Haden Church, Lisa Kudrow, Malcolm McDowell, Amanda Bynes, Penn Badgley, Stanley Tucci and Patricia Clarkson.The soundtrack to Brad Segal is also used very competent and only helps to maintain the pace of the plot, and the songs used are all current pop references very successful, as ""Pocketful of Sunshine"" by Natasha Bedingfield, ""Bad Reputation"" by The Dollyrots, ""Good Life"" by One Republic, among others.It is a comedy film American teenager, but with two crucial differences to its operation: it has a good script (including inserting multiple citations 80s movies like Bueller's Day Off and The Breakfast Club, and literary works, specifically ""The Scarlet Letter"" by author Nathaniel Hawthorne) and interpretation of Emma Stone as its differentials.Despite having a sexual theme present throughout the film, is not handled by ordinary director who changed the entire focus more on the consequences experienced by the protagonist because of lies told and passed up scenes more appealing.",7.0,Anonymous,"Comedy, Romance"
"Easy A ,An adorable,must watch!","I just adore this movie. As I reflect on this charming film, I'm reminded of its witty dialogue, relatable themes, and outstanding performances. The story follows Olive Penderghast, a clever and confident high school student played by Emma Stone, as she navigates the complexities of adolescence. Olive invents a fake online reputation as a promiscuous girl to boost her social standing, but things quickly spiral out of control as rumors spread, and she finds herself struggling to maintain her true identity amidst the chaos.What I love most about Easy A is its ability to tackle real issues that many teenagers face, including peer pressure, social anxiety, and the quest for self-acceptance. The film's screenplay is full of clever one-liners, humorous observations, and satirical commentary on high school life, making it a delight to watch. Emma Stone brings Olive to life with her captivating charm, vulnerability, and impeccable comedic timing, making her performance truly unforgettable. The supporting cast, including Penn Badgley, Amanda Bynes, and Patricia Clarkson, also delivers impressive performances that add depth and nuance to the story.Overall, Easy A is a delightful, entertaining, and heartfelt film that will resonate with audiences of all ages. With its clever writing, outstanding performances, and authentic portrayal of teenage struggles, Easy A is a must-watch for anyone looking for a fun, feel-good movie experience. I highly recommend it, and I'm confident you'll fall in love with this charming film just like I did!",10.0,Anonymous,"Comedy, Romance"
A Witty and Entertaining Teen Comedy,"""Easy A"" is a fun and clever teen comedy that stands out thanks to Emma Stone's charismatic performance. She carries the film effortlessly, bringing wit and charm to Olive Penderghast, a high school student who unintentionally gains a scandalous reputation after a white lie spirals out of control.The movie is sharp in its humor and playfully satirical, drawing inspiration from The Scarlet Letter while putting a modern high school spin on it. The supporting cast, including Stanley Tucci and Patricia Clarkson as Olive's hilarious and supportive parents, adds to the film's appeal. The dialogue is snappy, and there are plenty of memorable moments that make it an enjoyable watch.However, while ""Easy A"" is entertaining, it doesn't completely escape the clichés of the teen genre. Some side characters feel underdeveloped, and the resolution, though satisfying, is a bit predictable. Still, the movie is refreshing in its self-awareness and provides a solid mix of comedy and social commentary.Overall, ""Easy A"" is an enjoyable and well-acted teen film with a smart script and a fantastic lead performance. While it's not groundbreaking, it's definitely worth a watch for its humor and charm.",7.0,Anonymous,"Comedy, Romance"
A breath of fresh air,"Though primarily targeted for girls, this is a movie that will appeal to both the genders. This is a story of Olive, a girl who inadvertently lied to a friend about losing virginity, and the news traveled faster than wildfire among the gossip obsessed teens. Suddenly, she's the school slut. However, she realizes that she doesn't really mind the attention.Easy A slightly different take on the teen genre with the obscene jokes and the ridiculous situations (I'm actually a fan of them too, if done well, like American Pie did) replaced with witty one-liners. The plot is good and the pace is just right. Will Gluck also does a commendable job as director, and makes sure that the viewer doesn't lose interest anytime during the movie. The cast and the dialogues are the best part about the movie though. Emma Stone does an excellent job, and puts in a performance sparkling with energy and vivacity. Also notable are Patricia Clarkson and Stanley Tucci, who formed an excellent chemistry with Olive and gave many light moments during the movie. The other cast members also did a fine job. The dialogues are intelligent and witty, as already mentioned.Where it lost out maybe was having too much of a feel good atmosphere, as a result you don't feel down even when Olive is crying in the movie.It's however, definitely worth a watch. Catch it!A solid 7/10",7.0,Anonymous,"Comedy, Romance"
Surprised,"When I was first saw the trailer, I was completely convinced that the movie was to catch the female audience. Suddetly my friend dragged me into the cinema to watch it while I was in USA.Easy A is a movie about Olive, who has a rumor in her high school for having ""fake"" sex with other guys.The movie did not just catch the female audience. I was surprised that easy A also catched me! The movie had some ethics moments, and I really enjoyed that.Emma Stone is playing the High School girl, with 3 different personalities(sad, happy, slutty). If it was me I would found it difficult to master them all, but she did a good job! Some of the jokes were hilarious, but my friend who is a girl told me that she saw the jokes in another way which was funnier. Well what can I say ? Anyway.. I give it a 6/10. Not a movie I wil watch over and over again, but it was enjoyable.",6.0,Anonymous,"Comedy, Romance"
Highly recommended,The soundtracks itself is worth every penny you spend on this.,8.0,Anonymous,"Comedy, Romance"
