title,content,rating,username,genres
"F'in ""A""","The more I thought about ""Easy A"", the less I liked it. This is a shame, because while there's plenty to like about it, there's just as much to dislike. The movie is inspired by ""The Scarlet Letter"" by Nathaniel Hawthorne, which I'll admit, I never got around to studying in my A.P. English class. But I know the book is about adultery, which the movie has very little to do with. True, there is some adultery in the movie. But whenever the term is thrown around in the movie, it doesn't mean what the filmmakers seem to think it means. ""Adultery"", for the record, is when a married person sleeps with someone other than his or her spouse. Olive Penderghast, as played by Emma Stone, never sleeps with a married person. In fact, she never sleeps with anyone at all.Instead, the plot starts when Olive invents a fictional boyfriend to get out of going camping with her best friend (Aly Michalka, currently starring on The CW's ""Hellcats"") and her bizarre parents. Soon, the rumor mill starts churning, and extra-virgin Olive gets a reputation as the kind of girl who ""puts out."" Moral of the story: gossip is bad. But it doesn't end there. Olive's goals as a protagonist are unclear. Confusingly, she alternates each scene between trying to dispel the rumor and trying to fuel it. You see, no one paid attention to poor Olive when they thought she was a virgin. Because she's too smart. Or nerdy. Or something. Never mind that guys everywhere would be tripping over themselves noticing her because she looks exactly like Emma Stone. Of course, the cliché of the beautiful nerd who everyone ignores has been used in countless movies before. But at least they usually put a pair of glasses on her and give her a funny hairdo until her ""transformation."" In ""Easy A"", gorgeous Emma Stone always looks like gorgeous Emma Stone.Of course, it could easily have been a plot point that guys won't talk to Olive because she chooses to be a virgin. But again the character waffles between being a virgin because she's ""not that kind of girl"" and just being a virgin because guys won't talk to her. Anyway, the movie is framed as a web-cast in which Olive bares her soul to her entire high school. Because we're expected to believe that high schoolers spend their free time watching their classmates' web-casts. Or that two hours of confession will convince them of anything other than Olive's desperation for attention.Leading Olive's persecution is Marianne (Amanda Bynes), the head of the high school's Bible study. Because in the ""Easy A"" universe, Christians are the scum of society. Nazis in any given movie set during WWII are portrayed more sympathetically than Christians are here. Amanda Bynes' character spews out ignorance and hatred while her cohorts nod and strum praise music with vacant expressions. True, there are people in real life that fit the stereotype, but the film makes no attempt to balance them out with at least one character who dares to stand up to Marianne, or to utter a word of disagreement with her, or even to possess a real personality. They just act as Marianne's brainwashed followers, while their preacher ogles high school students doing web-casts in his spare time. They're nothing more than cartoon villains.Not that any of the other characters are any more realistic or any less cartoony, but at least they have solid performances behind them. Michalka's character is filled with fun energy, Stanley Tucci and Patricia Clarkson steal the shows as Olive's wacky parents, Thomas Haden Church gets some good lines as Olive's favorite teacher, and Malcolm McDowell is criminally underused as the school principal. But it makes sense that Amanda Bynes chose to retire after filming ""Easy A."" I've never really thought of her as a bad actress. But here she plays against type, and it results in the worst performance of both Bynes' career and this movie. It's hard to tell whether she's playing Marianne as completely insincere and phony or if it's just terrible acting, but either way she succeeds in giving her character less than a single dimension.Another problem with the movie becomes apparent within the first few minutes. The pitch for the movie was ""The Scarlet Letter"" in a modern day high school by way of 1980's John Hughes teen comedies. The movie won't quit reminding the audience of this. While some self-awareness is always good, calling out that something's cliché as it happens doesn't make it any less cliché. By the time Haden Church's character mentions that he doesn't want to be like the cliché hip teacher his students see in all of the movies, you get the idea of how it would have felt if the cast of ""Alien"" had spent the entire movie discussing how their scenario was just like Jaws . . . but in outer space. While there are some clever lines, most of the time, the dialog's too ""clever"" for its own good.Emma Stone deserves her turn as a leading lady. Unfortunately, her charm isn't enough to carry the film. I enjoyed her more in her supporting turn as the last surviving hottie of a zombie apocalypse in ""Zombieland."" If the movie were cut down to its most promising moments, a scene where Stone belts along to a Natasha Bedingfield song (already viewable a dozen places online), a similar scene where she gets a full song and dance number towards the end, and any scene showcasing the family dynamics between Stone, Tucci, and Clarkson, it would have been a more enjoyable film, and it would have been rid of about an hour and ten minutes of uncomfortable dialogue. Unfortunately for screenwriter Bert V. Royal, it'd also be rid of the plot.",3.0,Anonymous,"Comedy, Romance"
Easy B,"Marianne: There's a higher power that will judge you for your indecency. Olive Penderghast: Tom Cruise?In Easy A, innocent Olive (Emma Stone) foolishly brags to have lost her ""V Card,"" starting a rumor at Southern California's Ojai Valley High School that spins out of control. At some point she becomes the Hester Prynne of the experienced girls, a reference to their currently reading Hawthorne's Scarlet Letter and a testament to the scourging of the ultra-Christians.Lest this seem a bit heavy for 17 year-old teens, the dialogue by playwright and screenplay specialist Bert V. Royal is witty, but not all the time, and timely if a bit over the top. Juno it is not, missing that comedy's acidity, sophistication, and gifted star, Ellen Page. However, the fetchingly-lisped Stone is still better than most young actresses out there playing young, romantic, and comedic.Royal's script has plenty of room for commentary on homophobia and adultery as well as the formula for a wholesome, liberal family life evidenced by Olive's parents, played to happy, flower-children harmony by Stanley Tucci and Patricia Clarkson. That couple should win a special award for playing the understanding, caring parents we all hoped to be or have, but weren't/didn't. They are marvelous.The thematic weight in this rom-com is with acceptance and truth, notwithstanding the obvious commentary about social communicating best exemplified by Facebook. In fact the entire film is framed by Olive narrating to her website about the rise and fall of her rumor.Easy A, its title ingeniously playing on Hawthorne, should have taken the rich Hawthorne subject more seriously, for there is plenty of comedic material and life-learning going on with the nineteenth century genius's stories.""She had wandered, without rule or guidance, into a moral wilderness. Her intellect and heart had their home, as it were, in desert places, where she roamed as freely as the wild Indian in his woods. The scarlet letter was her passport into regions where other women dared not tread."" Nathaniel Hawthorne, The Scarlet Letter.",,Anonymous,"Comedy, Romance"
The legacy of John Hughes is alive and well...,"A wonderful homage to the John Hughes era of 'coming of age' film, that manages to be as smart, quirky, engaging and respective of its audience. Emma Stone is fabulous as the smart, strong willed lead who decides to defy the establishment but doesn't fully anticipate the consequences. Amanda Bynes was perfect as the prissy god botherer, as is Patricia Clarkson and Stanley Tucci who are the cool parents we all wish were (or had) and Thomas Haden Church is great as the inspirational teacher who really gets his students. They are backed up with a tonne of other great supporting actors. A wonderful film you SHOULD watch with all the family.",7.0,Anonymous,"Comedy, Romance"
Smart but a bit smart for its own good.,"It's refreshing to see a teen movie that is actually for teenagers and is not diluted to appeal to young girls. Just like how it was in the eighties- and eighties films are referenced quite a bit in Easy A.The title is clever, witty, and has a bit of attitude. However, Easy A does not entirely live up to the promise of its title. It's an intelligent off-beat film for the most part but the director and writer keep congratulating themselves on their wit and quirkiness so often that the film begins to grate. There's also an unpleasant snarky tone to the whole proceedings. Olive (Emma Stone), our slutty protagonist who is not really a slut, is frequently bitchy to pretty much every other character, except her 'favourite teacher'(it's not a euphemism but the film would be much funnier if it was). She has a massive superiority complex, using every excuse to show off her wit and pretentious intellect. Apparently this film is supposed to be indicative of our generation, and it is, in the sense that everybody is self-obsessed. Despite the protagonist being sour, Emma Stone brings a bit of attitude to the film and perhaps indicates that Olive is just as self-absorbed as everybody else.The film's premise has parallels with 19th century American classic The Scarlet Letter, in which a woman is persecuted and forced to wear an A as a symbol of her adultery, whilst the man is not punished at all. However the filmmakers seem to have got confused about what adultery means, as they keep saying that Olive is an adulterer whereas her actual sin is supposed sluttiness. The film's attempt to convey the religious themes of the novel does not really pay off. I'm not religious at all but I found the obsession with attacking religious zealots rather sour and a distraction from a promising, albeit implausible, comic premise.So, school report for this film: intelligent, but a big attitude problem.",6.0,Anonymous,"Comedy, Romance"
It's not what you think it is. It's better.,"It is not what you expect from a high-school youth comedy.It is about everything you see around you in real people's lives, but refined and with a coating of cotton candy in pink.Has unexpected and good quality surprises like the time the guy in the book store answers the girl about the bible scattered all around the movie which already has very strongly founded dialogs.If you want that feeling of joy you experience after those ""good guy wins"" movies but with a bit of controversial topping and an unexpected blue cherry on top, see the movie and keep in mind that ""drama"" can simply pop-up anywhere in this movie if you know where to look.",8.0,Anonymous,"Comedy, Romance"
Didn't like it.,"This movie annoyed me too many times to continue watching it. The few parts where the Christian girl tried to annoy Lindsay Lohan's character by repeatedly jamming her pencil in the sharpener and clicking the stapler irritated me to the point of wanting to jump through the screen and strangle her. The movie was a puffed-up joke in many ways. Lindsay Lohan's parents were cute at first, but quickly became too lewd and weird for my tastes.This film is basically about what can happen when you tell a few lies; one thing builds from another, and events spiral out of control. It was clearly geared towards young women, so I'm not sure why I watched it. There were some ditzy-girl moments; the Renee Zelweger type that I don't ever expect to understand since I don't have a vagina. To sum it up, if you are a guy, the chances you won't like this movie are pretty good. If you are an older guy, you might be more prone to find it amusing, even tolerable, especially if you watch it with a significant other or family. However, I didn't feel like wasting any more time on it after one hour.",6.0,Anonymous,"Comedy, Romance"
"Witty, Smart, and Delightful","This modern update of The Scarlett Letter is full of witty dialogue, relatable characters, and good acting. It's got just enough clichés to satisfy you but it's original enough to wow you. I'd highly recommend Easy A to everyone!",10.0,Anonymous,"Comedy, Romance"
Good dialog and narrative insightful story,"The story is a change from the recent teen movies. It is more serious, well structured and thoughtful. The dialog is interesting and smart and the jokes and situations while not generally laugh out loud hilarious are quite unexpected and witty. The overall message is about rumors and reputation is actually quite insightful and entertaining. Also the pressure to fit in and concern about appearances rings true. The literary link up with the Scarlett Letter is well done.There are good supporting performances from Haden Church and Lisa Kudrow. Penn Badgely blends in well to a lot of movies now from The Stepfather to this one. Cam Gigandet is good too.Emma Stone has a lovely figure and she acts well but she hasn't got the most pleasant facial features. I understand she isn't supposed to be very pretty for this role. Its just that watching her face as the main feature for a whole movie is a little trying. Someone like Anna Faris might have been more watchable.Speaking about facial features, what on earth happened to Amanda Bynes? Did she have plastic surgery at her age? Still she is quite hilarious. This is watchable and enjoyable overall.",7.0,Anonymous,"Comedy, Romance"
Easy A: EASILY one of the best coming of age movies ever,"Easy A is a 2010 comedy movie staring Emma Stone, Penn Badgley, and Amanda Bynes and is about a clean-cut high school student relies on the school's rumor mill to advance her social and financial standing. But you probably knew that, so why is it any good? Well its extremely funny! Honestly, there were at least 5 scenes in this movie that had me crying with laughter, but maybe that's just me. The film has actually likable characters, even the antagonist, Marianne, to an extent. The main character, Olive, does things that, sure, WE probably wouldn't, but the steps leading to that decision feel realistic. And Olive's parents, played by Patricia Clarkson and Stanley Tucci, are extremely enjoyable to watch. Lastly, The film is made really well. Sure, it's not like Driver or Birdman, but for what it was trying to accomplish, being a modern day John Hughes movie, it does a really good job. To summarize, Easy A is a fantastic and funny movie I can't recommend enough",10.0,Anonymous,"Comedy, Romance"
"This is an Easy ""B""","*** out of (****)Easy A, advertised as another paint-by-numbers, textbook high school drama extravaganza with little redemption and originality and where style tops substance. Emma Stone as the lead looked very unconvincing as she hasn't been the lead in any of her films and no one could replace Lindsay Lohan in the iconic ""Mean Girls"". After seeing this film get critically acclaimed and praised, I ventured off to see it on a late Friday night. To my surprise, Easy A is one of those rare high school flicks that is just so effective and is heavily devoid of clichés, predictability, and dry characters. Pretty much every other high school flick has been pretty subpar, with the exception of ""Mean Girls"". While Easy A is certainly not one of the best films of the year, it's worth the hefty admission. With so many soulless and energy drained flicks that are only worth a fraction of what you spend on a movie ticket, Easy A is worth all your ten bucks.Easy A, which bares some resemblance to the notorious ""The Scarlet Letter"", the film even heavily references it, revolves around Olive who feels invisible to everyone at high school. Olive talks to her friend in the bathroom about a guy Olive ""dated"" and her friend thinks that Olive lost her virginity to the guy. To compromise with her friend, Olive decides to lie about losing her V-card, although, Olive's past Christian fanatic friend overhears them in the bathroom and Olive's lie is inevitably being spread. After this mishap, Olive's homosexual friend asks Olive to moan and make suggestive sounds in a room, where everyone hears, so that people think they have sex, which they don't. Olive agrees to it and now all the nerdy, outcast guys are asking Olive to do the same favor, and rather than neglect it, she milks the attention she's getting. What she doesn't know, is that acting promiscuous can give some guys the wrong idea.First off, a majority of ""Easy A"" works because of its script. There is so much wit, references, and dry-pan humor, that this script is probably one of the freshest scripts of the year. Most typical high school films have a mediocre script which heavily references pop culture and expects the audience to play along. ""Easy A"" has a few more brain cells and rather takes the road less traveled by. Furthermore, the characters in this movie are very likable and fulfill their duties. Emma Stone's performance is so charismatic and fulfilling, if Lohan were to retire a potential ""Mean Girls"" sequel, the audience would have no complaints about Stone filling in. Actually, in some ways, Stone tops Lohan's delivery. Moreover, the pacing is also highly effective. Scenes go by pretty briskly, without the film feeling too short either. Additionally, the cinematography is pretty much eye candy. This film looks very vibrant and the colors jump off of the screen. It's definitely the epitome of a high school flick.While ""Easy A"" soars, there are a few problems. Firstly, the middle kind of sags and almost brings the charismatic outing down. The audience is introduced to a more serious tone and this hurts the film's harmless atmosphere and feels awfully depressing. Furthermore, while the film is pretty much devoid of predictability, the resolution is highly predictable, which is passable considering the rest of the film is pretty unique. Lastly, I found that some of the jokes were hit and miss. For a comedy, the jokes didn't pack that much of a punch, but then again, it takes a lot for me to laugh. However, that's acceptable because the humor doesn't resort to cheap gags or schoolyard puns, instead it relies on witty delivery.Don't let the director credits fool you. This film may have been directed by the same man that gave us the mediocrity ""Fired Up"", but Gluck has vastly improved. ""Easy A"" is a wholly effective comedy because it relies on an enthralling script, solid character development, and a smooth pace. All the elements of a well-made film are here and for once in a blue moon, you can seal your brains on. Has there been a film that looks ""copy-and-paste"" but turns out to be the complete opposite and is worth every cent you spend? ""Easy A"" is a pretty good example of that. I recommend it.",7.0,Anonymous,"Comedy, Romance"
Overrated,"This movie is highly overrated, I found it unwatchable, it tried to be Juno, but the story, writing and characters are so poor that it's not even close. I guess I have hard time believing a teenager could be the smartest person in the room all the time. I know teenagers, most of them don't have a clue. As for Emma stone being cast as a misfit, big mistake. Her parents come across as cartoon characters, totally unbelievable in my eyes. Stanley tucci is unbearable as her dad. Has all the typical Hollywood stereotypes, the hypocritical Jesus freaks, the misunderstood gay kid in the closet, and the slut that's really all talk. This movie was a complete waste of time, more annoying then entertaining. Don't waste your time.",4.0,Anonymous,"Comedy, Romance"
A Pleasant Surprise!,"I didn't know anything about this movie, good or bad reviews etc, when we went to go see it and sometimes that's the best way to go see a movie. I didn't think the trailer I saw for it looked that great so I had very low expectations walking into the theatre to see it. I was pleasantly surprised by this movie, never saw the star of this movie Emma Stone in anything before but she was good - not great but definite potential in her for acting. The movie is good for what it is as an enjoyable, time wasting way to hang out with your friends and maybe have a couple of laughs. I don't think you need to catch it on the big screen but it's definitely worth a watch on DVD or if you catch it on TV or pay per view sometime.",7.0,Anonymous,"Comedy, Romance"
Easy A Makes the Grade,"Olive (Emma Stone) acknowledges she's a fairly typical high school student with fairly typical high school student problems. She has angst. She feels alone. But one day, when she tells her friend Rhiannon (Alyson Michalka) what she wants to hear, she ends up adding a reputation to her list of issues.The reputation bizarrely combines with Olive's compassion for her friend Brandon (Dan Byrd), and the next thing you know, her reputation has grown beyond control. What's a girl to do? Well, in Olive's case, she decides to grab onto the reputation along with everything it means, and ride it for all it's worth.Olive's favorite teacher, Mr. Griffth (Thomas Haden Church) knows something's going on, but he doesn't know what. Mrs. Griffith (Lisa Kudrow), the guidance counselor at the school where her husband teaches, knows something's going on, but what she knows isn't actually what it is. Crusading Christian Marianne (Amanda Bynes) thinks she knows something, but doesn't really want to know anything. Olive's parents, Rosemary (Patricia Clarkson) and Dill (Stanley Tucci) are entirely understanding of something they don't know they don't understand at all. And Woodchuck Todd (Penn Badgley)? Olive would just as soon he didn't know or understand anything at all!Easy A sounds like a fairly simplistic premise and to some extent it is. But the script is clever in ways that raise it above the basic idea, and what could be a confusing mess is actually presented with a winning combination of clarity, humor, and feeling. Much of the cohesiveness of the movie as a whole can be credited to some very skillful edits. And I loved the literary references which, far from stuffy, were actually funny and all too appropriate additions.It doesn't hurt that the acting is, in most cases, stellar. Emma Stone is perfectly cast as Olive. For all her occasional drama, I would have liked her when I was in high school and, considering that I hated everybody when I was in high school, that's saying something! I wanted to slap Amanda Bynes, and that means she did a superb job bringing Marianne to life. Patricia Clarkson and Stanley Tucci were a pure delight to watch every time they were on screen. I also really enjoyed seeing Malcolm McDowell in a small role as the school principal.BOTTOM LINE: Easy A wasn't as funny as I thought and hoped it would be, but it was somehow more moving than I'd imagined. There are laughs, but there are also tears and a few scenes where your own high school years will likely creep up on you and give a little extra kick to the happy or sad of the moment. The teens in the theatre, though, seemed to be entirely wrapped up in the immediacy of the film, and laughed more than I did. Of course, their high school memories are yet to be made...POLITICAL NOTES: None.FAMILY SUITABILITY: Easy A is rated PG for ""mature thematic elements involving teen sexuality, language and some drug material."" Because of those elements, I can't recommend Easy A for young children. Older teens, though (16 or so and up), will likely really enjoy the movie, and if you've got a sense of humor about high school, you will, too.",6.0,Anonymous,"Comedy, Romance"
