title,content,rating,username,genres
A Wonderful Movie For All Ages,"A Wonderful Movie For All Ages""Elf"" is one of the best holiday movies I have ever seen. It is a hilarious comedy that is great for all ages. The director Jon Favreau did a fantastic job with the plot line, comedy, and casting the roles for this movie. Buddy the elf played by Will Ferrell is really who makes this movie though.For example this movie is about a baby orphan named Buddy(Will Ferrell) who finds his way into Santa's sack on Christmas Eve and is then raised as and elf in the North Pole. As Buddy (Will Ferrel) grows up he realizes he is different from the other elves and Santa finally thinks he is old enough to know he is not an elf and that his real dad lives in New York City. Buddy ( Will Ferrell) then goes on a quest to find his father (James Caan) who does not know he exists, but his elf like qualities don't exactly fit in in New York City. This movie is a great holiday movie with a fun plot line.In addition, to a good plot line this movie also has hilarious comedy. On Buddy's journey to find his dad he is oblivious to everything going on around him. He has this cheerful enthusiastic attitude every where he goes and it makes this movie hilarious and an amazing experience to watch.Although many people may think this is not one of Will Ferrel's best performances, this might be because they are used to his usual roles in more adult type movies. Elf is a great movie for all ages and is especially good for families. When you watch it you can just feel the Christmas spirit surrounding you.Furthermore, I believe the actors that were casted in this movie had the perfect personalities for their roles. They all did a outstanding job and they are what make this movie so good. All of them put a lot of effort into their roles and play them very well.In conclusion, this movie is one of my all time favorite Christmas movies and will be shown on TV for the rest of our lives. I also believe it will become a classic that our kids will watch in the future. This is a need to see Christmas movie.",10.0,Anonymous,Fantasy
Made for adults?!,"I realized that this movie had a lot of adult stuff in it, though kids can also enjoy this movie. Anyway, I liked this movie, and besides, Will Ferrell is a perfect person for this movie, because he's tall enough to be an ""abnormal elf/human."" Since elves only exist in our ""La-la Land,"" I guess makers of this film wanted to make this a comedies for adults, yet it has ideas that kids love which is one thing- elves. The languages in this movie was appropriate for adults, but it offends young children under 8 years old (you'll have to see the movie in order to find out, because I don't want give ANY examples). If you've gone to the official site for Elf, you'll see that some of the screen shots for this movie is interesting for children, though this movie has some humors that adults can handle. Also, seeing Will Ferrell as a human raised by elves makes me laugh ALL THE TIME. I love to see this movie again.",9.0,Anonymous,Fantasy
Elf Script Review (No Spoilers),"The script for Elf the movie was, in my opinion, an amazing read. There was no point during my read that I was not interested and it only kept me wanting to read more. The way Jon Favreau so cleverly put together this fantastic piece of literature was so interesting and hilarious. I might actually have to read this again because I love it so much. I have never read something so intriguing, thrilling, and funny in my fifteen years of being alive. If there would be any piece of literature to recommend it would be the Elf Script because it is, in my opinion, the best. The character development of Buddy the Elf is my favorite aspect because he was funny, quirky, and lovable, he might be one of my favorite characters I've read about. The plot was also enjoyable and the way it was scripted was brilliantly delightful. If there is any way to entertain yourself it would be this fine piece of art, in my opinion, from the read to the movie it is an amazing experience I wish I could forever relive. I strongly encourage you to pick this up and read or even watch it, either way, it's a joyride that I'm sure you won't regret. "" Whoo! That's strong! Must be two percent!"" Said by Papa Elf, I think this quote relates to the story, very strong.",10.0,Anonymous,Fantasy
a great children's title,"i heard great things about this film, and expected to see goofy will farrell and giggle constantly, but was sadly disappointed. i only laughed out loud when he gets hit by the car. there were some other stuff that made me feel silly, but all in all this was a comedy, completely overrated by adults. don't get me wrong, i think it is a great film for children, and would take my own kids to it if i had any, but i heard college and high school kids telling me how funny it is, and i went into it with high expectations. my cynical self was p***ed that people mislead me, but i was pleased with the fact that as a children's movie, this is a very good film, but audiences need to grow up.",4.0,Anonymous,Fantasy
Under ten star reviews get COAL IN THEIR STOCKINGS!,"This is an absolute classic at this point. It's become an absolute must watch movie in December. It manages to be goofy, outrageous and heartfelt. I do not understand this having a 6.9 Star rating. It's approaching the twenty year mark since it's release date soon and it aged extremely well.There's no Christmas movie like it either. Hysterical!",10.0,Anonymous,Fantasy
Fun movie,"In this xmas themed comedy, Will Ferrell plays a man raised as an elf who travels to New York to find his biological father.  As silly as that sounds, this is actualy a pretty funny and amusing film that works because of Ferrell's conviction in the role and some funny bits of stunt casting including James Caan as the daddy, Bob Newhart as head elf and Ed Asner as Santa!  A funny film that the kids will love and you will actualy enjoy. GRADE: B+",9.0,Anonymous,Fantasy
Love This Movie,"This movie is great! It's good-natured, funny, and gives us some Christmas spirit. Elf is set in the present day, so technology is the same as it has always been. It also gives a nice complement to Scripture by showing us that Christmas is not about receiving, but giving. Although it never truly gives a reference to the Bible, it has a good message and is not sending people a wrong one. I highly recommend this movie because it's just downright hilarious! It's become such a classic when Christmas time is around. Everyone should watch this movie because the main character, Buddy, shows us how to be filled with Christmas spirit and how to always want to help others and not just ourselves.",10.0,Anonymous,Fantasy
The best Xmas movie,"I love this movie. I've watched it every single Xmas since it was released. Great actors (I love Farrell), story and captures that Xmas spirit. Super funny, its already a classic in my book and I will continue to watch it every Xmas.",9.0,Anonymous,Fantasy
A classic??? Hardly!!,"I watched this for the first time after seeing it high on many 'top Christmas movies' lists. It was pants. Will Ferrell is VERY annoying and the humour is definitely aimed at four year old children. I know many adults think this is hilarious but it really isn't. How this is regarded as a seasonal classic is beyond me and the predictable soppy ending was awful. One or two mildly amusing moments does not make for a classic.
I genuinely prefer the much derided 'Deck The Halls', at least it has funnier moments.",4.0,Anonymous,Fantasy
Christmas Classic Forever,I have been watching elf every single Christmas for the last 17 years my entire childhood to my 30s and will continue to do so with my children and grandchildren some day. This is a holiday classic that will live on forever. This movie puts me right into the Christmas spirit even when I'm feeling down it lifts my spirits. It's so funny and heartwarming! A true Christmas story and probably the most quotable movie ever!!,10.0,Anonymous,Fantasy
Love it ... a real good feel good film,"Who else could play Buddy the Elf but Will Ferrell? It's funny, good for both adults and kids. Don't bother waiting until Christmas to watch it.",8.0,Anonymous,Fantasy
A Good Holiday Film,"Elf, is a fun Christmas film starred by one of the most famous comedians, Will Ferrell. I remember seeing this movie on November 22nd for my dad's birthday after we saw Master and Commander and I was expecting this film to be a very stupid holiday film but it was far from that. It was actually really creative and joyful, just like all Christmas movies should be. This movie really put me into the Christmas cheer and I was very ready for it. I remember posting this comment like 6 months ago but it got deleted and I haven't posted it again since then and so now here I am posting it once again. Overall, this film was really good and when it releases this Christmas I will definitely rent it.Hedeen's outlook: 8/10 *** B",8.0,Anonymous,Fantasy
really stupid.,This is about a grown man who think he is an elf. Come on. Why do people like this movie. This is a 6.9. This is a 4. Come on. The story line awful. I was going skip this movie. But then people to say it was good movie. And it is about a grown man who think he is an elf. How stupid does a comedy movie have to be before people wake up realize they have been ripped off. Do not waste your time. And do not waste your money. What is your first clue that this is an awful movie. It is about a grown man who thinks he is an elf. Please. What is it with people do they have to think ever comedy movie ever made is funny? Do they have to like every comedy ever made.,4.0,Anonymous,Fantasy
Its Not Christmas Until Elf is On TV,"Never in the Christmas mood, until I see Elf. It's just one of those classic Christmas movies that never gets old. Its just a great, feel good, family classic. You will not be disappointed.",9.0,Anonymous,Fantasy
I like to whisper too.,"this was a comedy delight, if not for december but for the holidays. Elf is about a giant human who works in santa's work shop as an elf after being taken accidently in santa's bag. Will Ferrall is really the reason to see this film, i admire his work since SNL and since than, he has done a great job of making everybody wet their pants. Anywho, the film doesn't really concentrate on your average holiday movie, its more of finding the ones you care about. In the case, Elf finds his estrange father (james cann) after leaving the north pole and wants his father to accept him the way he is.Nice comedy, not to stupid or subtle.9/10",9.0,Anonymous,Fantasy
Awsome,This movie by far was the greatest movie to laugh outloud with. I went to see this saturday and it was sold out we went to get tickets at 3:45 and had to buy tickets for the 7:15 show. it was packed so we had to sit in the front. i telling you this movie was great. Buddy the Elf is hilarious hes so stupid yet hes so sweet. Having a 6'4 elf is funny. but when he sees his dad for the first time he has no idea that his father in fact thinks he a baffoon. i think everyone should see this you'll laugh out loud.,10.0,Anonymous,Fantasy
disappointment,"Will Ferrell was definitely not the usual funny guy he is on SNL.  This movie sucked.  I laughed a couple times, but there were parts that dragged on.  It's not worth going to the movies to see.  I had high expectations but was let down.  The fact that Ferrell doesn't ""wink at the camera"" and actually portrays his character well makes this movie a terrible one.  I gave it a 4/10.",4.0,Anonymous,Fantasy
Great!,"We watch this movie every year at Christmas. Adults and children alike laugh and enjoy the movie. Wacky and slapstick at times, the movie is equally heartfelt.",10.0,Anonymous,Fantasy
Surprisingly Good,"I went to see this movie with my family expecting something icredibly stupid and unenjoyable.  I have to say that I was pleasantly surprised!  The humor was for both adults and children, and there was a great family message throughout the film.  I would absolutely recommend Elf to families looking for a nice way to spend a free afternoon during the holidays.  This was one of the better Christmas films I've seen in a long time.",8.0,Anonymous,Fantasy
Delightful for the kids and Surreal for the adults,"If it wasn't for the tacked on and plot driven love story this would be the perfect Christmas movie. Farrell is at his absolute best and Buddy is a great comedic figure. There is so much glee and Christmas spirit that comes from Santa's biggest helper that it is hard to not get swept up in the cheesy Christmas laughs, fun and cheer.I just re-watched this today for the first time in over a decade and it struck me how there is a lot of surrealist moments in the film-Leon and the other parodies of the classic Christmas cartoons for example-that make the film really work for older folks. It's not just silly kids stuff, but there is a subversive edge to a lot of it. Notice how Santa was ready to deal with a mugger for example. I had either forgotten or didn't pick up on this quality when I first watched the film.This film just flies by; neither the director nor screenwriter puts too much time into any one joke or gag. Unlike a lot of SNL comedies it doesn't feel like a skit stretch out way to much. It is always amusing. It warms the heart a little bit too. Caan manages to make the climax work despite the weaker writing.This will be added into my Christmas rotation.",8.0,Anonymous,Fantasy
Elfpower!,"I can relate it when someone doesn't rely on a macho attitude.. It's how I want to be too.. I can't be serious.. I must be crazy.. Or else I panic.. Instead of healthy socializing.. I choose crazy.. Crazy is always the right way.. I never get too close to people.. Because when you get too close.. They start influencing you right or wrong.. I hate the idea I have no control over myself.. I must always be in control of my own actions and thoughts.. Therefor, I choose crazy over social.. If that means doing my own thing whether it's walking around in an elf suit, but with a healthy clean conscious, so it be.. If a woman doesn't want me because I'm not macho enough, then I guess I've outgrown them.. And macho is not what I'm in for.. Too bad.. If that even means staying alone, I will.. Because there's no greater joy than that of a peaceful mind..",10.0,Anonymous,Fantasy
"Charming, often funny, fantasy Christmas movie.","Papa Elf (Bob Newhart) tells a story about a thirty year old man named Buddy (Will Ferrell), who lived in the North Pole. Buddy is the only human begin living in that area, since Buddy as a baby accidentally crawls on Santa Claus' (Ed Asner) sack. Buddy is raised by Papa Elf, when Buddy finally realized that he is human. Buddy decides to find his real father, who lives in New York City. His father Walter Hobbs (James Caan) is a humorless working business man, who has an family of his own. Since Walter has an wife named Emily (Oscar-Winner:Mary Steenburgen) and their son Michael (Daniel Tray). Buddy finds New York City to be an whole different place, since some of the people, he meets are cold-blooded. Buddy decides to bring Christmas cheer to the New Yorkers, especially his father and make them believe that Santa Claus truly exists. At the same time, Buddy falls in love with a shy department store worker named Jovie (Zooey Deschanel), who has an lovely voice. This is one adventure in the Big Apple that Buddy will never forget.Directed by Jon Farveau (Iron Man 1 & 2, Made, Zathura) made an amusing Christmas movie that is somewhat different and fresh, thanks to a very likable performance by Farrell. Which Farrell is absolutely charming and child-like in his role. Deschanel is lovely in her role as Buddy's love interest. This movie has some very funny vignettes and an strong cast in the supporting roles. Caan does his best in a underwritten role. Asner and Newhart has some moments in their scene-stealing roles. Peter Dinklage has one of the funnier moments with Farrell is the biggest laugh of the movie.DVD has an sharp anamorphic Widescreen (1.85:1) transfer (Also in Pan and Scan) and an good Dolby Digital 5.1 Surround Sound. The Single Disc DVD, the only special feature is the original theatrical trailer. ""Elf"" is certainly one of those movies will play during the Christmas holidays. ""Elf"" isn't a perfect picture, it has some flaws. But it is Farrell's amusing performance gives the heart in the right place, which it will delights kids and adults. ""Elf"" is a very good movie to watch, especially during Christmas. The movie has some choice cameos, including Peter Billingsley (Who is best known playing Ralphie in ""A Christmas Story) and director:Favreau as a doctor. (****/*****).",8.0,Anonymous,Fantasy
So great and straight forward,"This a very happy-feel-good Christmas movie and Will Ferrell is just the great, naive human raised by elf's, but doesn't know. He's experiencing many things for the first time, as he travels to NY in order to find his dad. I just love this movie.",8.0,Anonymous,Fantasy
No Christmas feels right without Buddy the Elf,"There is no movie that will bring out your Christmas cheer better than Elf. It is a classic that it great for all ages. It makes you laugh and smile and most of all, excited for the holiday season!",8.0,Anonymous,Fantasy
"One of the Sweetest and Most Entertaining Christmas Movies around,","Elf is a fantastic movie with a very well written plot and a great comedic cast. It's a film that I always insist on watching at Christmas time, because it's just so much fun, I never get tired of it. The humour remains constant throughout while still managing to be sweet and very charming.The only thing I ever felt was missing from Elf was more tension between Buddy and Jovie's relationship. It's too perfect, when they meet up there is a bit of conflict, but shortly after that they have no real issues, they should have made them split and convince the audience that they were not getting back together, so that it would feel more fulfilling once they did.The performances in this film are outstanding and everyone suits their roles perfectly, whether it be James Caan as a business executive who struggles with the responsibilities of being a father, Zooey Deschanel as a complicated girl who is confused with the idea of falling in love, Bob Newhart as the father of all the elves, or Edward Asner as Father Christmas himself. Everyone plays a character that suits them and their own characteristics or personalities perfectly. The highlight of the movie is of course Will Ferrell, he is funny, charming and very lovable, though the movie may not be that old, Ferrell's performance as Buddy the Elf is already iconic, we can relate to him on several occasions, whether it be his sense of optimism, trying to find the good in everyone, or even just his love for Christmas, there are several aspects that make him one of the most beloved characters of any Christmas movie, and Ferrell is to thank for most of that.Sweet, heartwarming and very, very funny, Elf is a perfect film to watch at Christmas time that the whole family will enjoy.When Buddy, a human raised by elves in the North Pole, learns that his real father lives in New York, he heads off to find him.Best Performance: Will Ferrell",9.0,Anonymous,Fantasy
"Not quite a classic,but worth the watch all the same.","Buddy the Elf(Will FArrell,still not yet a star at this point)has never truly been an elf. But raised from infancy in the North POle and knowing nothing other than the Elf lifestyle,he is as true a helper to old St.Nick as any of the other workers that are. At full adulthood and finally starting to realize that he's not like the others back home,he sets out for New York City to find his true family,mostly his father(JAmes Caan),now a Department store exec. I suspect that one need only see the trailers to figure that when Buddy finds his true father,a host of blissfully nutty events ensues.No surprises in this film,from the hi-jinx promised to the obligatory romance for BUddy,personned in this case by a bored but decent department store worker(Zooey Deschenal,neither too sweet nor too sour). The casting is so letter perfect it seems almost brainless:Bob Newhart as Buddy's adoptive father,Ed Asner as Santa Claus,MAry Steenburgen as Caan's understanding wife,Andy Richter and Kyle Gass as Caan's underlings,Amy Sedaris as Caan's sweet secretary and Peter Dinklage as a very un-elf-life storybook author who looks like he could be a perfect ringer for one of Kris Kringle's workers. Director Jon FAvreau's movie moves as easily as any,and while I personally wouldn't call this a ""new classic""(though it would still seem like MIracle on 34th Street compared with another holiday themed film that came out around that time,Bad Santa)in Yule flicks,this makes for perfectly fine holiday themed entertainment.",8.0,Anonymous,Fantasy
Great Christmas Movie!,"Elf is one of the better Christmas movie I have seen. The only movies associated with Christmas that are better than this are the first two Home Alone movies. This is nothing Oscar-worthy but it is a feel-good holiday film. I think Will Ferrell is an mediocre actor at best but I feel this is his best role.This is about a human who was raised in the Arctic by Santa and the elves. When he is thirty, he ventures out to find his real dad. Unfortunately for Buddy, his dad seems to have no interest in having him as a son.The acting is pretty good. I mentioned Ferrell before and I am surprised on how I actually liked him. The older guys like James Caan, Edward Asner, and Bob Newhart were wonderfully cast.Overall, this is a fantastic Christmas tale. It's definitely the best one this century so far. I rate this film 9/10.",9.0,Anonymous,Fantasy
One to watch every year,"We watch this movie every year with our kids, never gets old, only gets better! That score is not representative of how people actually feel about this movie, so many people I know watch this every year, it is a true Christmas classic!",9.0,Anonymous,Fantasy
There is no word strong enough to pan this film,"If the name Will Farrell is not enough to scare you away from this film - ANY film - allow me to mention one of the 'funny' parts: the one in which Elf Will burps uninterruptedly for 5 interminable minutes. Yeah. Ha, ha, ha. Wasn't that full of the Christmas spirit?And how about Ed Asner, playing Santa? What's next? Hateful, foul-mouthed Rosie O'Donnell playing Mother Theresa?I could not believe this mindless garbage got so many good reviews. SCARY. Then again, it explains a lot.Since Hollyweirdos always bleat endlessly about helping the needy and the indigent, I suggest that, instead of enriching themselves making rubbish like this they invest the money in feeding and clothing poor people in 3rd world countries. That would take a great load off the American tax-payer, and would make national security a child's play.",1.0,Anonymous,Fantasy
One of the funniest christmas movies ever to a non christian,I dont celebrate christmas due to being muslim but i can happly say that this film apeals to all people even if you hate christmas,10.0,Anonymous,Fantasy
One of the BEST Christmas movies ever!,"This movie is for everyone! Will Ferrell nails the innocence of a young boy in need of a male parental unit. It doesn't try to manipulate your feelings , it just entertains you through out the movie! My daughter loves this movie and is now 20 years old ( it's 2019) And she loves this film more each and every year! If you want a movie anyone will enjoy, this is it! Make your memories with loved ones and enjoy this beauty!",10.0,Anonymous,Fantasy
Emotion roller coaster,This movie has everything to being humerus to being heart touching. I love this one for that and try to rewatch it every year around Christmas. I am also biased about this movie because I grew up on it. Watched at school and with grand parents.10/10 (Just go watch it),8.0,Anonymous,Fantasy
Full of Christmas spirit,"A must watch every year.
Funny and moving, I can't really find anything wrong with it.",9.0,Anonymous,Fantasy
"Great concept, poor delivery","Saw a preview showing and have to say that I was disappointed in the final product.""Elf"" is the story of Buddy (Will Farrell), who grows up at the North Pole after Santa finds him in his bag of toys after returning from another Christmas Eve. Buddy is raised as any other elf, but his human size starts to make life difficult. So off he goes to find his human father, played by James Caan. He soon finds that his real father already has a son that gets no attention.The story concept is interesting enough, and for that reason the first 15 minutes (which show the back story up through Will Farrell's departing the North Pole) are fairly entertaining. The jokes about Buddy's size are not overplayed as they could have been. There's an effective scene that involves Buddy and jack-in-the-boxes that was understatedly funny.Then, it all goes downhill. Farrell is effective as Buddy, doing a pretty good fish-out-of-water job in NYC. But a lot of the jokes that could have gone into the story seem left out. He seems to adjust way to quickly to his surroundings.Things get a little better as Buddy discovers love, both for the opposite sex and for his long, lost father. But again it seems like the director misses what he was aiming for. There are a lot of missed opportunities to flush out James Caan's relationship with his young son. Instead we are quickly shown the distance between them, with very little else to go on.The ending sequence is totally off the mark. The idea that Central Park would be deserted seems downright impossible, yet the movie progresses as if it's a real possibility.In the end, the movie just doesn't deliver an its hilarious possibility.",3.0,Anonymous,Fantasy
