title,content,rating,username,genres
"A Fun Movie, But A Little Overrated.","Elf is already one of the most popular Christmas movies of all time, so in a way, this may already be kind of a pointless review. But I am going to review it anyway, since I haven't before, and this can be for the people who haven't seen it, or the people who may want to revisit it.Elf stars Will Ferrell, playing an elf named Buddy. When he was a baby, he snuck into Santa's bag while living in an orphanage and ended up in the North Pole, so one of the elves offered to raise him.As Buddy gets older, he learns that he still has a father (played by James Caan), and feeling like a misfit at home, he decides to go to New York to see him, only to find that there is little Christmas cheer there. Not for long...To start with praise, this is a really fun movie with my iconic scenes. Mention Elf to someone and see what they quote. They may say: ""World's Best Cup of Coffee! Great job everybody!"" or ""I'm in a store and I'm singing"", or ""He's an angry elf!"", or even: ""Oh, wait, I forgot to give you a hug!"" This may rank with It's A Wonderful Life as one of the most quotable Christmas movies of all time.Because of the lines I've mentioned and the goofy situations Buddy gets himself into, Elf is also a very funny movie. While writing this, I took a break to read the Quotes section on IMDB and found myself smiling and giggling at the favorite lines of others. Even now, the humor still works overall.Elf also contains many great actors. Will Ferrell is a mixed bag for me, I like some of his work and some of it I don't. However, Elf is easily one of my favorite of his works. James Caan does a fine job as his Dad, who is a grump at Christmas Time. Although, it makes it kind of odd (in a funny way) to later see him in a movie like The Godfather or Misery later on in life.Actors like Zooey Deschanel, Ed Asner, and Bob Newhart do great in their parts, as well as the other actors. Jon Faverau, the director, even has a cameo as a doctor and a Narwhal. (""Bye, Buddy! Hope you find your Dad!"") And to think in 5 years he would direct Iron Man!Despite the charm Elf has, I do have an issue with it now as an adult who grew up on this movie. Let me explain:This movie came out when I was 5, and there is no way to count the amount of times I have seen it in the last 18 years. My uncle had the DVD, and most Christmases included watching it, up until I was about 12. Let's assume that's 6 Christmases, since we may not have watched it EVERY year. There were a few times I saw it at school before winter break, let's say about 4 times.I also got the movie on DVD for Christmas when I was 11 or 12, but I think I used that DVD once. I also have a friend who owns it and we've seen it twice together. That alone makes for about 13 viewings that I can remember, again in 18 years.That is where my ""flaw"" with Elf comes in. There's some movies I can see again and again, and as I have gotten older, I have realized that this isn't exactly one of them.It's still a fun movie, but for lack of a better term, my viewings of Elf are somewhat tainted due to how many times I have seen it. For example, when I was a kid I used to find this funny:""Okay, everybody, Santa's coming...""""SANTA! OH MY GOSH!... I know him!""Which is cute and all, but I dare you to watch that a dozen times in a row and not get annoyed. That is how that scene feels now, kind of.Does that make it a bad movie? Not at all. I just don't have the same appreciation of it as I did in say, elementary school.On that note, Elf released in theaters on November 7th, 2003. One of my favorite Christmas movies, Love Actually, happened to be released on the same day. I have gladly seen that about 5 times, it's that wonderful and charming. Elf doesn't quite do that for me on that level.So do I recommend Elf? Of course. I'm not a Scrooge or a Grinch for crying out loud! But I would have higher suggestions for Love Actually, It's A Wonderful Life, Scrooge from 1970, Prancer, and other personal favorites.I will most likely see this more times later on, and I'm okay with that. Is it one of my favorite Christmas movies? Not exactly. Is it still a good time? Yes. Elf is like Buddy's favorite food- spaghetti with syrup and sprinkles. It's super sweet, but not to be digested in large amounts.Note: This is intended to be the first of 25 Christmas reviews- one posted a day.",9.0,Anonymous,Fantasy
"The Elf movie is not fit for children, or adults!  It's disgusting!","I am really sad, that I bought the Elf movie for my 8, 10 and 12 year old children. As they watched it, my middle child alerted me, ""Mommy, they're saying and doing bad things!"" I felt ashamed that I had bought the movie and I clicked it off! I told my kids, that I was sorry, and that I didn't expect the movie was going to be vulgar.I know that another viewer said this, but I'm going to repeat the warning: Please do not buy this for your children. The Elf movie is not fit for them, nor for any moral adult either!I can't understand how anyone could give the Elf movie a good rating. Only perverts could do that! It makes me sick, that there are few good movies today. It's hard to find a decent movie now. Few are rated NR, or G, but that's all that I will buy from now on.Please do not buy the Elf movie. If you are a normal, caring person, like I am, the film will be a waste of money and it will just make you upset, so don't buy this!",1.0,Anonymous,Fantasy
6.5/10,"Thirty years prior to the events of the film, a baby crawls into Santa's sack at an orphanage. Santa unwittingly takes the baby back to the North Pole, where it is decided that Papa Elf (Bob Newhart) will raise him. The baby, named Buddy (Will Ferrell), is raised unaware that he is actually a human, until his enormous size and poor toy-making abilities cause Papa Elf to tell him the truth. The old elf reveals that Buddy was born to Walter Hobbs and Susan Wells and placed up for adoption, that Walter never knew Buddy was born, and that he now works at a children's book company in New York. Immediately and full of optimism, Buddy sets out for New York to find his father.""Elf"" is self consciously structured in the most academical and basic way screenplays are written, it is screen writing 1-0-1 and it knows that, so even though it cannot be commended for a remarkable depth, there is just no resisting the charm and the comedy this film has to offer with what is possibly, still to this day, Ferrel's best performance.For someone who has always been somewhat of a Ferrell critic: I have rarely been able to enjoy his comedies and sketches, this film really surprised me and that is exactly because Ferrel is cast perfectly in the role of an over-enthusiastic human who thinks he is an elf. His zany and over the top comedy and his exaggerated facial gestures fit this film perfectly and grace us with moments of really good comedy. Favareau knows how to build upon this and has always the right camera set-up to enhance the comedic effect. He uses the classic shtick of people or objects entering or exiting into frame to incredible effect and even does some innovative things with the technique that really surprised me and had me rolling with laughter.The film also has a classic Christmas message and story: the characters by the end need to save Christmas and to do so they have to believe in the Christmas spirit. It is standard stuff, but the film is written very effectively and its colorful characters navigate through a sufficiently original premise and set-pieces which make for an undeniably pleasant flow. You care about everyone involved thanks to some solid work from all the performers. Yet, once again, what really pushes the film a notch above has to be the comedy, it is inventive and always different, it does not go for the same gag over and over again as it would be easy to do with a fish-out-of-water story.As I said, ""Elf"" cannot be praised for bringing to the table something new. The structure is predictable down to every emotional beat. There isn't a sense of overwhelming emotion involved with the characters and their struggle is never really given depth exactly because we know how it is going to go.Still, the fact that the film is self conscious about that helps it build around a pleasant family movie which is also a very good Christmas comedy with enough flare to keep you pleasantly entertained for the whole duration.",6.0,Anonymous,Fantasy
Too funny!,"Elf is hilarious! It's never ending enjoyment with terrific acting. All the scenes in this movie are amazing. Will Ferrell owns every scene and makes everyone around him light up. The music and Christmas decorations are great, and the story is different.
Overall, it's a perfect Christmas movie.",10.0,Anonymous,Fantasy
"This movie is a good natured, feel good movie. It will put you in the Christmas spirit!","My vote is showing up as a ""6"", because I clicked too soon....I really wanted to vote a ""10""!!! My husband and I took our 4 kids to see this movie on Thanksgiving Day.  I wasn't expecting much, because I'm not a big Will Farrell fan (sorry Will). I was thrilled to see a good natured family movie my kids liked. No cussing, nudity, or violence. Granted, it wasn't spectacular, but it brought a smile to my face and put me in the Christmas mood!  Bravo to Zooey (the girl who played ""Jovie"") for her wonderful singing voice!  I think parents should take their kids to see this movie.",6.0,Anonymous,Fantasy
It's become a classic,"Took me 20 years to watch. Funny, endearing and wonderfully irreverent. Move over ""A Christmas Story"", make room for ""Elf"" and when the kids go to bed play ""Bad Santa"".",10.0,Anonymous,Fantasy
A Christmas Classic,It's nice to watch a Christmas movie go from a current film to a timeless treasure . It still happens and here's an example . Great movie !,10.0,Anonymous,Fantasy
Takes a nose-dive the last 15 minutes,"I was pretty cynical about watching this movie, but not having anything else to do, I did, and was quite pleasantly surprised by the terrific and innocent feel of the first half of the film, as well as some great performances by Farrell and Caan.But something must have happened with the studio, or the script because the last 15 minutes spirals into a terribly contrived and generic Christmas film. Its worth watching just for Farrell, and the magical first half.",6.0,Anonymous,Fantasy
Classic Christmas movie!!,One of my favorite Christmas movies. Will Ferrell was a great choice for the elf. Great cast. Extremely funny and goofy with a great story. Just sit back and enjoy.,10.0,Anonymous,Fantasy
Great Christmas Comedy for the Whole Family,"After crawling into Santa's bag as a baby, Buddy, played by Will Ferrell, gets raised by elves in the North Pole. However, as he gets older, he soon realizes that he just can't live in an elf's world. He decides to go to New York City to find his real dad, who happens to be on the naughty list. But Buddy soon realizes that New York is nothing like the North Pole, and once again, he struggles to fit in.I found the film to be very enjoyable and entertaining. Will Ferrell was the perfect choice for Buddy, and you just can't help but laugh at the crazy things he does in New York. Eating gum off the sidewalk, attempting to use an escalator; the jokes are funny for children and adults alike. The ending is thrilling and kids will surely love it; adults likewise, despise some unnecessary sentiment thrown in. So overall, the movie is nothing spectacular, but it is a fun and refreshing Christmas comedy for the whole family.",7.0,Anonymous,Fantasy
Horrid,Another awful movie by the talentless Will Farrell. If think fart humor is still funny or you were born after good comedians did not exist this is for you.,1.0,Anonymous,Fantasy
Funny,"I decided to see this movie instead of the overhyped Cat In The Hat.  From what I read, I made a good choice.  I though Will Ferrell was funny on SNL (it has suffered in his absence) and he is funny here too.  I actually believed he was this oversized elf looking for his natural father.  And it turns out to be Sonny Corleone (actually James Caan, the actor who played Sonny in The Godfather though that would be a movie worth seeing).  Many people think Caan is miscast, but I don't agree.  Caan is a perfect cynic to Ferrell's believer.  The other interesting casting is Bob Newhart as an elf and Ed Asner as Santa Claus.  It's interesting to see them in a movie like this.  See this movie again and again.  7/10",7.0,Anonymous,Fantasy
good holiday fun,"This was a funny holiday film with great performances all around. Will Ferrell gives one of the best performances of his career (and one of the funniest) as a human raised by Santa and his elves. When he was a baby, he crawled into Santa's sack, which explains how he got there. Now that he's an adult and six feet tall, he realizes he's no elf. He gets Santa's permission to go to New York and find his father, who is on Santa's naughty list. Once he arrives in New York City, however, he has a tougher time adjusting to the ""human"" world than he ever imagined. He tracks down his father (well played by James Caan) and convinces him of who he is. Initially a jerk, having Buddy (Ferrell) in his life makes Cann make some changes in his life and priorities. He is originally totally immersed in his job. I think this was a wonderful family film for the holidays and really recommend it.*** out of ****",9.0,Anonymous,Fantasy
Very mixed review.,"Stars: Will Ferrell, James Caan, Ed Asner, Zooey Dechanel, Bob Newhart, Amy Sedaris, Andy Richter, Kyle Gaas, Artie Lange.Let me start by saying that I thought all the performances in this film were good. Will Ferrell was good, James Caan kept the movie afloat, Bob Newhart was a great presence. With such a great cast, I'm amazed they made such a mediocre film. The character of buddy the elf is kind of a one note joke, ""fish out of water"" character that really has no development in the film. Buddy is a human, who was raised as an elf, that goes back to New York to visit his birth father who never knew he was born. In New York he acts like an idiot, getting hit by cars and eating gum off the bottom of benches, etc. Buddy meets a girl played by Zooey Dechanel, who has a problem singing in public. I guess this movie is good for kids, but I found it to be very stupid. I thought Bob Newhart's narration (through the beginning and at the end) was a nice touch.My rating: C. 94 mins. PG for crude humor and mild language",6.0,Anonymous,Fantasy
A Generous dose of Christmas spirit.,"30 Years ago Buddy became the first human to set foot in Santa's workshop. In an orphanage, Buddy was just a baby when he sneaked into Santa's sack. Santa decided to raise him as an Elf.Buddy (Will Ferrell) always believed he was an Elf, just much bigger than the others. When he overhears elves calling him a human, Papa Elf confirms Buddy's fears. His mother has long since passed away, but his biological father lives in New York. And so Buddy embarks on a journey to the city.Buddy's father is publisher Walter Hobbs (James Caan), and happens to be on Santa's naughty list. When Buddy finally convinces Walter he is indeed his son, Walter lets him stay with him. But with Buddy unaccustomed to city life - and with the mind of a child - this proves to be no easy task.Plenty misadventures and funny moments ensue. Although 'Elf' is indeed slapstick as expected, I surprisingly enjoyed it more than anticipated, and there were indeed many truly funny moments. I thought Will Ferrell was perfectly cast as Buddy, the Elf.",6.0,Anonymous,Fantasy
Cute & Sweet,"Buddy is an orphaned baby who accidentally gets into Santa's sack and winds up in the North Pole. Santa and the elves decides to keep the human baby and raise him as an elf. When Buddy gets older, he finds out he's adopted and he learns who his parents really are. Buddy then sets out on an adventure to find his biological father in NYC. The enthusiastic elf-man doesn't fit into human culture very well and that leads to quite a humors time.The best way to describe this film is cute and sweet. I got quite a few laughs and smiles watching this crazy elf-man (Will Ferrell) trying to fit in and understand human culture.Worth watching this holiday classic.8/10.",8.0,Anonymous,Fantasy
"Buddy the elf, what's your favourite colour?","Jon Faverous Elf, is a hilarious Christmas classic. Me and the family love to watch it every December, and it never gets old. By this point I have pretty much mesmerised every hilarious word that has come out of buddy's mouth. For example, Buddy the elf what's your favourite colour, what's a Christmas gram I want one, wait if your the real Santa what song did I sing for you on your birthday, wow your an angry elf. And many more. Every single word, sound, or action that Buddy does makes me and the whole family crack up. And the perfect actor was chosen to play this amusing role Will Ferrell. Not only is it funny, it has some good Christmas themes like having some Christmas spirit, to help Santa's sleigh fly, and the best way to spread Christmas cheer is to sing loud for all to hear, and to love and respect your family.",10.0,Anonymous,Fantasy
Needed More Time In The Workshop,"Can a real Christmas movie get made in our cynical, charm-free 21st century? Probably not, if ""Elf"" is the best stab at it so far.Up in the North Pole, Buddy the Elf (Will Ferrell) discovers he isn't an elf at all, but a displaced human orphan who found his way into Santa's bag at the end of a busy Christmas and was then raised in Santa's workshop. He undertakes to reconnect with his biological father, Walter Hobbs (James Caan), a gruff Manhattan executive who has found his way on Santa's naughty list.Odd to step back in time and see Will Ferrell in this early starring role, playing so resolutely to PG sensibilities that he almost seems made of gingerbread. Unless you own Keebler stock or have an aversion to watching spaghetti being eaten with maple syrup, there's little here to offend you.Alas, ""Elf"" is a film that thinks it's way cuter than it actually is. The idea of hearkening back to the stop-action TV Christmas shows I grew up with back in the 1970s is pleasant enough, and so is seeing NYC all dolled up for the holidays. But the story is a one-joke premise stretched well past its limit: Ferrell doing his man-child thing wearing an elf suit in the big city.One sequence demonstrates for me the limited nature of the film. In it, a children's book author played by another future big star, Peter Dinklage, comes to Caan's publishing house office to help concept an idea. Buddy spots him and immediately calls to him as a fellow elf, thus sparking a WWF rumble in the conference room.Sure, Dinklage is a little person and so the joke gets a bit of a laugh, but not anything to build deeper humor from. Why not, since we know Buddy is an overgrown kid, move past that and have the two get into a spirited disagreement about kiddie fiction, or what weather conditions are like on the North Pole? Instead, it's a short joke, some mayhem, and then cue the next scene.The film has a lot of go-nowhere moments like that, whether it's Buddy getting mistaken for a store employee at Gimbel's or Buddy's stop-motion pals on the North Pole. Caan deserves credit for playing his part with a deft lightness I wasn't expecting, and indeed most of the supporting work is fun. I especially enjoyed Bob Newhart as an especially sedate elf who looks after Buddy.There are also some funny bits for fans of Ferrell's wilder roles. Watching Buddy get into it with a department-store Santa (Artie Lange) who he accuses of being a fraud (""You sit on a throne of lies!"") is good for a few laughs, even if it devolves into another rumble. Zooey Deschanel is sweet as Buddy's left-field romantic interest, and the ending actually manages to be rousing, shot as it was literally in the ashes of 9/11.But manipulation is kind of at the heart of this film, both when it's working and when it's not. For all his evident good taste and desire to please, director Jon Favreau seems at a loss when it comes to finding that next gear and giving ""Elf"" a sense of wonder or of mission. It's pleasant and light, and often amusing, but still leaves you with the feeling of a misfit toy.",5.0,Anonymous,Fantasy
An unexpected pleasure!,"I signed on to this site now to check if Will Ferrell received any awards for his portrayal of Elf. He really tapped into his inner child for this one, because he is spot-on in this role. Its a difficult job for any adult actor to convey such innocent charm. The supporting characters are good, the directing very good, and the writing is excellent. I loved the run home to hide in his bathroom in his undersized house when he had his feelings hurt. The film was weaker in its second half, but Will Ferrell makes Elf such an endearing character that I've watched it repeatedly for just that.I really don't care for Will Ferrell's other movies or characters, but this was a wonderful performance!",7.0,Anonymous,Fantasy
A cute Christmas movie,"This movie came out when I was young, nine or so, and I remember giggling and laughing through this film. C'mon, it was cute, I loved it and still do. But, this is just my personal opinion. I'll give an overview of the movie.The Plot: The overall plot was...cute. Nothing amazing, just a typical Christmas tale. It tells the story of a young man who was raised by elves, and once finding out who he 'truly is', a human, sets out on a journey to meet his real family. And, before he sets out, Santa gives him horrible news. His father is on the naughty list. Buddy greets this by yelling 'NO!!!' as loudly as he can. Finally, he sets off to New York to find his dad, and meet his brother, a little boy played by the adorable Daniel Tay, and his father's new wife. Overall, it's a sweet plot with a sweet ending. No miracle, but it's cute.The Jokes: If you're looking for jokes that you'd find on Comedy Central, then don't both with this movie. But if you're looking for primarily kid-appropriate, Nickelodeon-like jokes, then look no further. This is the movie for you. Children from about five/sixish to eleven should enjoy this movie, along with a handful of preteens/teenagers (such as myself).The Acting: Okay, the acting's not great. It's adequate at the most. Will Ferrell plays his regular yell-out-lines role, though his facial features and comedic timing are pretty good. Zooey Deschanel's good, not perfect, but good. She definitely evens out the movie without trying to overuse comedy or burst out in exaggerated lines like a certain actor in this movie who was mentioned earlier. James Caan was probably the best in this movie. No, his performance wasn't Oscar-worthy, but it was better than the majority of the performances. He believably plays a spiritless man who's in denial of having Buddy as a son, and never really trails out of character. Finally, Daniel Tay, who plays Buddy's brother and, as we see later in the movie, good friend, is absolutely adorable in his snow hat. His acting's pretty good, not perfect, it was just a regular child performance. However, his performance is pretty much brushed aside because he's overshadowed by his adult co-stars. The other cast members were good, not great, and I must add that Lydia Lawson-Baird, who only says two or three lines, will practically melt your heart with her sweet presence upon screen.Overall, it's a cute movie, good for kids. Don't watch this movie expecting something Oscar-worthy. If you're looking for a kid-appropriate movie, then this is the movie for you.",10.0,Anonymous,Fantasy
THE WILL FERELL ONE MAN SHOW,"Elf is a great kid's movie, no doubt about that! But it's an average adult movie at best, Will Ferell is brillant as ""Buddy"" the elf but, we're missing some of great S.N.L. Charisma that would make this film a real holiday classic (aka- chevy chase in Christmas vacation, bill murray in Scrooged).With that said, A solid 7 out of 10 for this so so funny kiddie movie.Will: Do more pg-13 stuff like snl ur funny!!",7.0,Anonymous,Fantasy
I can't believe I never reviewed Elf before!,I have now seen this movie about a dozen times as it has become a Holidays classic not only for me but pretty much everyone I know. To me Will Ferrell movies are always a bit of a hit or miss but Elf is without a doubt in the hit category. In fact I really can't imagine any other actor they could have cast better than him for this role. There is enough heart and magic in this movie to please both adults and children equally and make it a family must watch during the Holidays. On a side note I am very happy to have learned recently that Will Ferrell has always gave an unwavering NO to any attempts at what would probably be a lame sequel!,8.0,Anonymous,Fantasy
A very funny family film!,"This is a very funny family movie that you can take your kids to. It is very cute to start off with a storyteller (Papa Elf) telling the story about what happened. They chose great actors to play the parts.Elf is a story about a man who lives in the North Pole. He figures out that he is adopted, so he goes to New York to find his real dad. The ""elf"" has a lot of trouble fitting in. EXTREME LAUGHS! See Elf.",7.0,Anonymous,Fantasy
