title,content,rating,username,genres
Better Than Average XMAS film: Elf,"To start off, Elf is not in the same category as A Christmas Story or A Christmas Carol. It is not even as good as Miracle on 34th Street, which had much better acting and dialogue. That being said, for the current generation of moviegoers, who are easily satisfied with whatever is served up to them as long as it has great production values (and this film has), Elf will more than fill the bill. I am a big fan of Will Farrell, and he does a great job of containing himself (something difficult for him to do) and not running amok with sexual innuendo (something that is totally lacking in the film; and rightfully so). I thought the casting of Caan was odd, but the rest of the cast seem to be mailing it in, anyway. Who can share a scene with Will Farrell and survive? Good film for the kids around Xmas.",6.0,Anonymous,Fantasy
Timeless festive fun,"There are very few Christmas movies, or movies in general for that matter, that I could watch over and over again without getting sick of. 'Elf' is one of those movies.We're approaching the festive season as I write this review and, being such a crowdpleaser, this movie is already appearing in TV listings everywhere. It seems to grow in popularity year-on-year and it's hard to believe that it's been 14 years since its release.Will Ferrell without doubt makes the film what it is. He gets his character spot on and provides plenty of laughs for adults as well as kids. There are some hilarious individual scenes and the movie as a whole is just great fun, which is what Christmas movies should be.For sheer entertainment value, 'Elf' is without question one of the best.",8.0,Anonymous,Fantasy
"135,000 people can't be wrong!","Clearly some contributors to IMDb have no sense of fun or Christmas. This is a harmless film, aimed mainly at kids, which is an easy watch at Christmas. 135,000 average almost 7 out of 10 with their opinions on this site, so who are these few humourless people who feel they can criticize so freely. It may not be Hamlet but it has many saving graces and clearly appeals to the majority who watch it.Jamess Caan's role is a million miles from his role in The Godfather, where he met with a very bloody end. Will Ferrell built a reputation on this film so it had a positive effect.Bob Newhart took a break from running the Driving School and Ed Asner is also prominent.The film received positive reviews from critics and it earned $220.4 million world wide on a $33 million budget. That is a whole lot more people who cannot be wrong. Happy Christmas!Reach for the channel tuner if it's not your cup of tea but many more feel this movie is an integral part of the Christmas holidays.Happy Christmas!",7.0,Anonymous,Fantasy
"Horrendous, Stupid, NOT Funny","It is incomprehensible that this film garners a 7.1 on here. It's sappy, stupid and obnoxious. Used to be that stars who had a name would be worried about being involved in a film that was totally vapid. That day is long gone. The story is so stupid. The ending is so sentimental and dumb. As the sputtering blunderbus flew off during the climax of this piece of crap, I could only think of the scores of starving people who could have been fed instead of spending millions on this useless pablum. And John Favreau doing this is all the more hilarious. The way he chomps his cigar while waxing unpoetic about the biz on Bravo, you'd actually think he had more in mind than just cashing in on pieces of garbage like this. The whole cast looks like they are attending a wake except for Will Ferrell who turns in another classic post-SNL performance: one dimensional, schticky idiocy that might work in a 2m skit, but leaves you numb after an hour and a half.",1.0,Anonymous,Fantasy
not funny but shallow entertainment for kids,"I was disappointed in this movie simply because it wasn't a comedy.  It was just a simple kid/family movie about a naïve if not slightly retarded man who thinks he's an elf.  Even in a movie about Santa, the leaps that Cann's character and Elf's girlfriend made by the end of the movie were unbelievable.  Why would a pretty blonde like that even talk to an elfin retard who can't figure out an escalator? If you're going to throw the sap around, at least make it somewhat believable. This disappointing movie contains exactly TWO laughs.  The first occurs early when they explain that elves can only do three jobs (shoe repair, cookie maker, Santa worker) and shows the hazards of putting an oven in an oak tree. The second, is when elf tries to top the tree with a star using a couch as a trampoline.  Other then this, the movie is just shallow entertainment for kids under the age of ten. Don't go in to this movie looking for a comedy.",,Anonymous,Fantasy
"Sometimes unsurprisingly cheesy, but an overall impressive Christmas comedy","I have now seen a bunch of movies starring former ""Saturday Night Live"" comedian Will Ferrell, but it took me a while to get around to seeing this one, even though I have now been aware of its existence for probably about three years. It's getting to be that time of year again, and just yesterday, I finally rented ""Elf"", not exactly sure how impressed I would be. It could have easily turned out to be yet another cheesy, boring family movie from recent years, but while it may seem like that at times, it usually isn't. It's sometimes cheesy, and certainly not consistently hilarious, but I'm still impressed.One Christmas Eve, a baby boy at an orphanage is placed in his crib shortly before Santa comes. When Santa is not looking, the baby crawls into his sack and stows away to the North Pole, which is where he's finally discovered in that sack! The elves name him Buddy, after the label on his diaper, and Papa Elf volunteers to raise him. So, Buddy grows up at the North Pole, living the life of an elf, and still thinking he's one of them, even though he's a lot bigger than the others, and can't make toys nearly as fast as them. After finally finding out that he's actually a human, he learns about his real father, Walter Hobbs, who is a children's book publishing executive in New York, and doesn't even know Buddy was born! Buddy learns from Santa that Walter is on his naughty list, due to his selfishness, and the human raised by elves sets out to New York to find his father and change him. Obviously, this won't be easy, and it doesn't help that Buddy has never experienced the human world that awaits.The film starts out with an opening narration from Papa Elf, which certainly isn't the best part, and the segment where he says how trolls once worked for Santa, but they weren't toilet trained, showing an example with a troll in a diaper, may suggest the film is going to be another cheap gross-out comedy for kids. But hey, not so fast! The vast majority of the film is definitely NOT like that! I got some BIG laughs out of this movie, I think starting with some of the gags that involve Buddy's life as a grown human at the North Pole. I definitely laughed pretty hard when the main character meets a raccoon on his way to New York and tries to be affectionate with it! After he arrives in the city, the things he does there, being unfamiliar with life in a community like this, a lot different from the North Pole, are also good for laughs. Some of the gags I didn't care much for, including Buddy spinning around in a revolving door until he throws up in a garbage can, but for the most part, Will Ferrell's antics in the lead role didn't fail to amuse me. Interesting story as well.Being about Santa and his elves at the North Pole, one might think ""Elf"" is strictly for kids, and I guess I thought that might be the case. However, overall, I would say it has enough to please both child and adult viewers, not ALL of them of course (it's obviously not for the many Will Ferrell haters out there), but a lot of them. Now, there are obvious reasons why this movie is rated PG, a great example being Jovie (an employee at Gimbels, a clothing store in New York) singing in the shower, and Buddy coming into the restroom to sing along, not realizing she's naked! I found this to be another comedic highlight in the film, but parents might want to be cautious. Anyway, while this movie clearly isn't perfectly clean family fun, I would say it's close enough to it, and a lot better than the last Christmas movie I watched, ""Deck the Halls"", that's for sure",7.0,Anonymous,Fantasy
One of the Best Christmas Movies,"This movie is incredible, and it's almost impossible that this movie could've been better.I loved the character growth and development, and the climax is golden.Overall, probably about 9.5 stars.This movie is hilarious, and I completely recommend, because not liking this movie is very rare.Twenty years after it came out, I can assure you that this is a classic.Everyone in my family loves this movie, and we watch it every year.Thank you for reading my review, and don't forget to check this movie out, because it really is incredible!Merry Christmas, happy new year.While it's still 24 days until Christmas, this movie doesn't fail to give you Christmas spirit, if you watch it on Christmas Eve or July 7th.",10.0,Anonymous,Fantasy
Elf Is One Of The Best.........,"This is an instant classic film. From beginning to end, ( and I mean beginning to end ) is fantastic. The directing, writing and acting. Everything about this film is hilarious, light hearted and fun for the entire family and will live on for generations to come. From the jokes in the narration to the final conclusions in the end, everything about Elf just works flawlessly. Elf is a very out of pocket film to be as good as it is, and really shouldn't be. But nevertheless, Elf is just a perfect film. Will Ferrell did his absolute best in this film and you can tell why. Overall this is a must watch film for everyone who likes anything funny.",10.0,Anonymous,Fantasy
Elf - Still Good,This is still one of my favorite Will Ferrell movies. It is genuinely funny and it has a heartfelt message about Christmas and family. I still chuckle at the fact that they portray the North Pole as a Rankin Bass stop action set from any Christmas classic like Rudolph the Red-Nosed Reindeer. It's good and I enjoy it every Christmas season.,6.0,Anonymous,Fantasy
A Modern Christmas Classic,"If you ignore the movie critic criteria of what defines ""quality cinema"" you'll find great enjoyment in Elf, a well cast, and adorably directed film. Maestro director Favreau delivers a wonderfully charming Christmas classic that can be enjoyed holiday season, after holiday season.",9.0,Anonymous,Fantasy
A brilliant Christmas comedy!,"I remember when I first saw Elf at a specialized showing at AMC Theater in Neshaminy Mall back in 2009. And I love it!Elf centers around Buddy (played by Will Ferrell), a 30-year-old man, who as a orphaned baby, snuck into Santa Clause's (Ed Asner) sack on Christmas Eve, at the orphanage that he lived in. After being brought back to the North Pole by mistake, Buddy was raised by one of Santa's elves, Papa Elf (Bob Newhart), and grew up thinking his entire life that he was an elf... despite being three times the size of the other elves, and being the slowest at making toys. Upon learning that he's a human, Buddy departs from the North Pole and travels down to New York City, without shedding his elf garments, to meet his birthfather, Walter Hobs (James Caan)... who turns out to be a cynical and self-centered businessman, and on Santa's naughty list. Because Walter never even knew that Buddy was born, he takes Buddy to a doctor for a DNA test, and finds, to his dismay, that Buddy is indeed his son. As a result, Walter is forced to start a relationship with Buddy. And the results get more and more chaotic.The acting is brilliant. Will Ferrell is hilarious as Buddy. James Caan (may he rest in peace) is magnificent as Walter. I really like the contrast that their performances create between Buddy and Walter. While Buddy is incredibly good-natured and kind, but naive and simple-minded, Walter is cynical and small-minded. Ed Asner (may he also rest in peace) is perfect as Santa. Zooey Deschanel is really good as Jovie, the resentful, standoffish Gimbels employee that Buddy falls for. She starts off bitter and cold, but really softens up as the movie goes on. Plus, she has an amazing singing voice.The movie is also jam-packed with comedy that hits every right note! Favorite scenes of mine include Buddy chugging 2 whole liters of Coke and then unleashing a KILLER 12-second burp (dubbed in by Maurice LaMarche, one of the most brilliant voice-actors alive), getting into a fight with the Gimbels Santa after discovering that he's fake, wandering into the women's locker room when he hears Jovie singing in the shower, putting syrup and candy all over a plate of spaghetti (Mmmmm!), and answering a phone call meant for Walter: ""Buddy the Elf, what's your favorite color?"" HA! Oh, and the scene of him mistaking renowned children's author Miles Finch (played by the FLAWLESSLY cast Peter Dinklage) for an elf. PRICELESS! The movie is also heartwarming at times, like with Buddy and Jovie's falling-in-love montage, and Walter finally warming up to Buddy.The music is also great! I panned John Debney's score for Home Alone 6, but his score for this movie is beautiful and amazing, and really sells that Christmas vibe. The songs choices are also really good.Everything considered, Elf is a triumph at Christmas uplift and comedy, and one of my favorites to watch at Christmas. If you don't believe me, watch it for yourself! You'll be laughing like crazy.",10.0,Anonymous,Fantasy
Strictly for the teeny tots,"I don't see how anyone over the age of about 8 could find this film enjoyable.  The story is cute enough, but the performances are flat and the dialogue is dead.  I got maybe 3 small laughs out of the whole movie, and spent the rest of the time wondering Is this *ever* going to get funny? Your kindergarten class will probably love this, but otherwise do yourself a favor and skip it.",4.0,Anonymous,Fantasy
The Book,"Sometimes a movie's story says a lot about how it came about. Let's imagine the green light board at the production group meeting and deciding they need a cute Xmas movie fast.Is it any wonder that the central storyline involves a ""book"" company with Green in the name which needs a product by Xmas. In panic, they call in a little guy. He shows up with a formula. The formula of this project is half ""Big"" and half ""The Family Man"" and its ilk. Small wonder that the film ends with our little guy writing the story that we see.I suppose it is well enough done for what it is. But the problem with this is also embedded in the story. Santa's sleigh used to be powered by good old Xmas cheer just like Xmas movies used to be.Now, both the sleigh and its movie container need artificial motors.Ted's Evaluation -- 1 of 3: You can find something better to do with this part of your life.",,Anonymous,Fantasy
Your very good elf...,"A delightful Christmas fantasy for all the family, proof that latter-day Hollywood can still knock out a charming festive film, just like in the old days.Sharing with the classic ""Miracle on 34th Street"" its New York department store setting, the story here is as improbable as any you'll encounter on any Feast of Stephen you care to mention. But forget that and just enjoy Will Ferrell accomplishing a wide-eyed but never over-played naiveté rarely seen since Jimmy Stewart in ""Harvey"" as the innocent elf (actually a human baby born out of wedlock) abroad, attempting to bond with his curmudgeonly old dad this particular Christmas (of course!).Thus Buddy's many humorous adventures and encounters with the people, sights and sounds of New York naturally take us on an emotional roller-coaster ride but by the end of the movie, as if you didn't know, he's gotten a pretty co-worker (the wonderfully named Zooey Deschanel) to fall in love with him, made up big-time with his dad and just for good measure restored Christmas spirit to all and sundry in a nice, even exciting conclusion, which gives us the memorable sight of Santa's sleigh taking off over Central Park so that old Saint Nick can get on with his naughty or nice list.The casting is very good, James Caan, like fellow 70's tough guy De Niro before him, adapting neatly to family comedy, with in support, the ever-lovely Mary Steenburgen as his too-good-for-him wife and old MTM stalwarts Bob Newhart and Ed Asner, even more improbably as Buddy's adopted elf-father and Santa Claus respectively. Ferrell makes the film though, his wide-eyed wonder infectious right from the outset. The only real drawback for me really was the too-obvious product placement inserts. Otherwise, the film stays away from maudlin sentimentality particularly in its treatment of children and is filled with uplifting Christmas music, settings and spirit, rarely stooping to vulgarity for its laughs (okay, we do get a couple of near-obligatory flatulence and burping jokes, but that's okay, kids love 'em!).I heartily recommend anyone in need of a Christmas tonic to watch ""Elf"" and bring out your inner-child.",7.0,Anonymous,Fantasy
"""There's not enough Christmas spirit!""","Elf (2003) -I first watched this film, because I was hungover at a friends house and couldn't change the channel and I am so glad that I did, because it is now a must see every year.A happy Christmassy place that was obviously full of fun, their version of the North Pole had a quirky, cartoony style that was inspired and made it clear how different the worlds Buddy The Elf found himself in really were.I had always found Will Ferrell's (Buddy) films to be a bit too childish and abrasive for my tastes, so I was surprised to find that I adored this film and that he was, of course, ideal in the role of a child like Human, raised by Elves.There were a few moments that I would typically associate with the Will Ferrell type of films that I have seen bits of or avoided based on the trailers and they did get on my nerves slightly, but I got over them fairly quickly, because everything else was just so brilliant.It had many great actors in it and no one gave a duff performance. I liked Mary Steenburgen playing Emily Hobbs, although it was a relatively small part for her and I found a new appreciation for Zooey Deschanel, because she had a great voice and was lovely as Jovie. I have since adored her as Jess in 'New Girl' (2011-8) and recommend it to everyone.Even James Caan was perfect as the grumpy old Walter Hobbs, whom Buddy visited in New York. Bob Newhart was also the absolute cutest as Papa Elf, who suffered greatly as Buddy's adoptive father.All of the Elves were actually very cute and cleverly depicted, including Peter Billingsley, the kid from the American classic, seasonal film 'A Christmas Story' (1983), as Ming Ming, which I thought was a clever touch.Veteran Santa, Edward Asner was a tad grumpy in the role for me, but he didn't effect things too much for it, because the story followed Buddy so closely and the shenanigans he got up to in The Big Apple, leaving Santa as just a bit part.Said Shenanigans were full of wit, joy and laughs aplenty, thanks in a large part to the brilliant direction by Jon Favreau, the genius behind 'Iron Man' (2008) and 'The Mandalorian' (2019-). He clearly had a liking for cult Christmas style and a great sense of humour, which delivered this enchanting tale.961.04/1000.",10.0,Anonymous,Fantasy
A Will Ferrell Christmas Story,"Elf is considered an American Christmas classic and it is a film that has a charm to it. Will Ferrell doing what he does well, play a giant man-child which well works well in Elf because he was so innocent. There was an attempt at a heartfelt story with Buddy (Ferrell) trying to bond with his biological dad (James Caan) despite his dad not wanting to know. However, the comedy depends on how much you like Ferrell's style of comedy. I do like the ending because it does have a warm fuzzy feeling when the public by Central Park starts singing Christmas Carols and a Christmas choir singing when Santa appears before the public.",6.0,Anonymous,Fantasy
The Perfect Film to Get Into the Holiday Spirit,"Legends Jon Favreau and Will Ferrell have created an instant classic perfect for getting you into the holiday spirit. This film is absolutely hysterical thanks to Ferrell's quirky antics and improvised style throughout nearly all of the film. There's a lot of heart that's suitable for ALL ages, making it extremely kid friendly. However there are a few moments of innuendo that will need explaining but they're extremely mild. And due to the main character being ""a fish out of water"" in New York, his antics may be questionable to younger audiences but are mostly humorous. But this film also has a lot of heartwarming messages as well, and not just about being in the Christmas spirit. It's also about family is what matters more than anything, believing in yourself, and how you don't need to change who you truly are just to be accepted by others, be it friends, a girl you like, or even family. This film is so heartwarming and family with a stellar cast it's become an annual Christmas tradition of mine to watch it every Christmas Eve! If you've never seen this film, you're missing out on a hysterical classic!!",10.0,Anonymous,Fantasy
A GREAT/CLASSIC CHRISTMAS MOVIE!!!,Elf is a beautifully shot film with a phenomenal cast and a great storyline. The perfect Christmas time movie. A+++ Film.,10.0,Anonymous,Fantasy
Really nice movie,"When i first thought about seeing this film, I was expected it to be some cheesy Christmas movie where Will Ferrell acts like an idiot but i was pretty wrong. Will Ferrell's character is a 30 year elf and he acts as if he hasn't seen humans..Although some of his acting is a little over the top he plays his character well. But other than that, the movie is a really nice Christmas movie. Its a classic Christmas story.In the beginning it starts out a little boring but then it picks up the pace and the movie gets more interesting. It starts better when Buddy (Will Ferrell) goes and moves out of his elf home and decides to find he's real dad in New York...This movie isn't really funny but it has some funny scenes. For example when Buddy goes to the mall and see's Santa Clause for the first time but he notices that its an impostor, then they start fighting...Another funny scene is when Buddy hangs out with his brother Michael after school then they see bullies throwing snow balls at them, so Buddy starts making a ton of snow balls then they start firing back at them and the bullies leave and run away. That was classic The movie is a really nice film but it has its mistakes, anyway great work",7.0,Anonymous,Fantasy
An Instant Christmas Classic!,Such a great original Christmas story that brings the Christmas Spirit! Ferrell crushes this role as Buddy the Elf. His energy is enough to carry the whole film.,10.0,Anonymous,Fantasy
Spagetti  Syrup And Gingerbread Men,"Will Farrell has done better films than this one but this is a warm feel good holiday film. When you look at it as a whole film, it holds a certain charm. That charm is established by framing the story around belief in the fantasy known as Christmas.This is the most extensive work done by Bob Newhart since the 1990's. Bob is the framework that holds this story together. Ed Asner has a very small role as Santa & is just here enough to be recognizable having little chance to do much acting.Brunette bomb shell Zooey Deschannel is charming as a blonde & proves she can sing. Hopefully she will get some better roles as her young career has proved she can handle them. In this movie, she makes the viewer buy that young innocent charm as she glows here.Faizon Love is excellent in support as the Gimbles store manager. James Caan is OK here, less annoying than in some films, but for some reason he does not seem to get really good roles anymore.There are some gross holiday bits, like downing a 2 liter Coke & a 5 minute belch which is entirely logical, and then some bits which are funny physical comedy. Farrell does not carry the whole show here and that is a good thing. While he is considered the star of his films, his films are better when the support can carry them. His easily worst film is Bewitched where he tried to carry the entire film & flopped badly.This doesn't measure up to classic holiday films but is better than some of the lame efforts of recent years.",6.0,Anonymous,Fantasy
