title,content,rating,username,genres
Gran Torino Serves Up A Vintage Clint Eastwood!,"In Clint Eastwood's Gran Torino, he stars as Walt Kowalski, a cantankerous, beer-swilling Korean War veteran and former Ford factory worker who lives in a run-down portion of Detroit ravaged by white flight. Recently widowed, Walt is old-school: He hates his children for driving Japanese trucks and for trying to put him into an assisted-living facility and his grandchildren for their insolence and impropriety. Compounding Walt's loneliness is that he has become a stranger in his hometown; his neighbors all have died or moved away, and a cadre of ""dog-eating"" Hmong immigrants has taken their place, whom he incessantly disparages. His gruff demeanor and steady stream of racial epithets make him unsociable for his neighbors.The tension comes to a head when Thao, the teenage boy next door, tries to steal Walt's prized possession - the eponymous Gran Torino, a 1972 vintage Ford automobile - as part of an initiation into a local gang. Unaware that Thao was the would-be thief he chased off the night before, Walt breaks up a fight between the wayward youth and his gangster tormentors that spills onto his yard. Seen as a savior by the Hmong community, he is showered with gifts - much to his displeasure, as they insist that the boy pay for his crime with a lengthy dose of community service under the supervision of Kowalski. Walt reluctantly takes Thao under his wing, and befriends Thao's older sister Sue. The Oriental boy and girl next door make Walt see the good in gooks as we watch this curmudgeonly Scrooge figure open his eyes and mind to the realities of a multicultural America. He quickly discovers he has more in common with his culturally conservative neighbors than his own kin who regard him as an embarrassing dinosaur to be shipped off to a retirement home. However, Gran Torino gradually takes a darker turn and becomes a much more poignant depiction of Kowalski's willingness to seek redemption.Gran Torino is surprisingly funny; as Walt's icy exterior melts away and culture shock leads to wary respect, one can't help but laugh. With a personality as prickly as his looks - flint-eyed squint, sour puss, scruffy hair - he's a bad-ass old coot, who spits his disapproval at the world. It's an idiosyncratic performance that might easily have descended into comedic caricature. But Clint Eastwood somehow pulls it off with profound pathos and bravado. He also directs with his typically sure hand; the plot moves relentlessly forward on his formidable shoulders, assisted by the slyly hilarious dialogues.Gran Torino could have become a tediously pious fable about a racist learning the error of his ways, or - in its final act - an audience- pleasing revenge fantasy. But Eastwood bravely avoids both extremes. Gran Torino is vintage 'Dirty Harry' – Reloaded!",9.0,Anonymous,Drama
"This movie is fantastic, but one person ruins almost everything...","OK, so this movie is really good! I loved it actually!Buuuut, its got one MAJOR flaw! And his name is Bee Vang.This guy is seriously one of the worst actors i have ever seen! He is so bad, it almost ruined the whole movie for me! What did Mr. Eastwood think when he filmed this? Didn't he notice how horrible this guy is at acting? I don't understand how he let Vang play such an important role in this movie when he is so bad at acting!The movie plot is awesome! All the actors are doing a really good job, except for Vang.Eastwood does one of his best performances since The unforgiven. Too bad Vang ruins it all in every scene they share by making me laugh out hardtime of how dreadful his acting is.I know this pretty much is nagging but its irritating me how bad this guy is! Please never let him act in a movie again!Otherwise this wouldve been one of my favourite movies. Its awesome, and very entertaining.",7.0,Anonymous,Drama
watch harry brown instead.,"in short. woeful acting from everyone, its really, really bad, clint's never been a great actor in the true sense of the word, but he always had a huge presence which is still here somewhat but his lazy delivery is just the tip of the iceberg when it comes to the stilted performances here. this leads us to the next stages, script and characters, neither of which help the actors performances. the dialogue is awful, stilted and wooden and the characters are so stereotypical its unreal and make the whole thing almost laughable if it wasn't so insulting to any viewer who doesn't keep their brain in a jar. i said in short so id best just leave off with the plot, predictable, predictable and, yes, very, very predictable. clint is a screen legend but im sure if he made a documentary on paint drying itd be nominated for an Oscaror two, i genuinely wish more effort had been put in and some enjoyment could be had. watch harry brown instead.",1.0,Anonymous,Drama
Outstanding,"I won't put any spoilers in. Quite simply, I found this film high class and very entertaining. I doubt that Clint Eastwood has surpassed this effort as an actor or a director. It's as good as his last effort, ""Million Dollar Baby"" at least. I did find some comments by the critics quite amusing. Someone thought that 90% of the people commenting on this film wouldn't know good acting or a good script if they saw it. That is not only laughable to most of the 28000 people voting on this movie (at the time of writing), but it represents a staggering case of self denial. It does present a valid statistic though. Over 90% of a lot of people have rated this 7/10 or better. That is all you need to know. See the film!",9.0,Anonymous,Drama
Eastwood knows how to make en exit,"They say this is Eastwood's last acting role. If so, I'm happy and sad.On one hand, there would be no further Eastwood roles! No more great one-liners and outsmarting everyone else! On the other hand, he went out on top. He didn't drag out his career too long and have his reputation ruined because of it.Eastwood was perfect for the role of Walt Kowalski, the mean, racist Korean War veteran who just likes things done his old-fashioned way. Every line he had was worthy of being called memorable.As well as on screen, Eastwood did a great job behind the scenes. THe camera-work and writing were the best I've seen in years.This was the best movie I have seen in the theater in years. I was so fortunate to see it opening day. There were many people there and everyone I asked afterward said it was great. I have not heard a single negative thing about it yet.This was a great finish to a great career for Eastwood. I'm glad he ended it with a bang.10/10.",10.0,Anonymous,Drama
One of Clint Eastwood's better performances.,"This is not only a good movie, it may be one Clint Eastwood's better performances as as an actor. Rarely has Mr. Eastwood been more effective and entertaining, and for a career as successful as his, that's saying a mouthful. The movie itself is good, although there are some glitches in the plot and some overly contrived dialog. But the basic story is solid, with themes relating to social change, ethnic tensions, gang violence, aging, family tensions, and immigrants. Most interesting is the portrayal of members of the Hmong community who at first seem utterly out of place in its American setting but soon becomes apparent that they too share American values, both positive and negative. The movie also does an effective job of dramatizing ethnic tensions between minority groups. The main star, however, is Mr. Eastwood and his character Walt Kowalski around whom the story revolves. This movie is certainly worth watching and provides good entertainment.",9.0,Anonymous,Drama
Loved it,"Gran Torino just adds to the great collection of movies that have come out this year. I'm only 15 so i haven't been able to enjoy Clint Eastwoods movies over the years. But after watching Gran Torino i know that he is a movie legend. I can't wait to see Changeling.Gran Torino is wonderfully written, nicely directed and is made even better with its great cast.This isn't a movie i would normally get sucked into. There is talking all through the movie. But it was so gripping and intense. But i felt the ending was too predictable and was too short. But it was still good.Gran Torino is a movie that will be a classic in 50 years. I highly recommend it. Gran Torino is one of 2008's best movies.9/10",9.0,Anonymous,Drama
"A great film, highly recommended.","I saw this film after a good word from a friend. I'm very happy I took the time to view it! Clint Eastwood is a perfectly-played, gruff, old man in a changing world. He puts the safety of his neighborhood into his own hands. What's surprising is that this isn't the whole story; much of the movie is dedicated to building relationships and coming to understand Walt Kowalski.I especially appreciated the accurate references to the Hmong culture. My grandmother worked in social work for their people for many years, and the fashion and even home decorations are legitimate and detailed.A must-see! Really an exceptional film.",9.0,Anonymous,Drama
Gran Torino,"It's curious that the main English language awards largely ignored this, yet it won both a David and a César in Europe and is definately one of Clint Eastwood's more characterful efforts. He is the curmudgeonly ""Walt"" who has recently lost his wife, has an arms-length relationship with his son and looks disapprovingly as his neighbourhood ceases to be the home of ""Americans""! His prize possession is his Gran Tornino car and he doesn't take to kindly to Bee Vang's ""Thao"" (or ""Toad"") trying to pinch it. Quickly, though, he sees that this young man and his sister ""Sue"" (Ahney Her) are being bullied by their thuggish extended family - a gang of obnoxious would-be gangsters who drive the streets picking fights and taunting people. He decides to intervene and the rest of the story sees a bond develop between him and his new ""family"" based on a degree of mutual understanding, trust, and ""Toad"" becoming his slave for a fortnight by way of penance! We are given some clues along the way as to the grand designs of ""Walt"" as he sets up a denouement, after a brutal assault on ""Sue"", that will satisfy not just himself, but keep his neighbours safe too. It's not the most naturally written dialogue, indeed at times it's quite forced but the underlying premiss of bigotry and the attitudes of intolerance and bullying are well addressed. The characterisation of the distant and prejudiced ""Walt"" is delivered engagingly, and with some dark humour, by a star/director who has a point to make. There's also quite a gently potent effort from Christopher Carley as the local priest. He is trying to offer the perfunctory words of hope and comfort to this veteran and he perseveres despite the dog's abuse he receives from a man who no longer feels it necessary to commit to the niceties of society. Clearly, 'Walt"" cares little for what is left of his life nor for any of his sins to be forgiven. It's about grief, relevance, community and I think it works. Give it a go.",7.0,Anonymous,Drama
"""Gran Torino"" a grand film!","I just saw this film today and while it is not the ""perfect"" movie, I was really moved by Eastwood's performance. Why was he not nominated for an Oscar? His performance was certainly equal in caliber to the others nominated. And this comment is coming from someone who never really appreciated Clint Eastwood till later in his career. He is definitely an accomplished director, but his performances in later films such as ""Million Dollar Baby"" and ""The Bridges of Madison County"" have proved what a gifted actor he truly is. I am sorry that the academy chose to ignore his wonderful performance in this film. And if this really is his farewell screen performance, it's a sad farewell from the Hollywood industry.",9.0,Anonymous,Drama
Clint Eastwood at his worst,"Honestly, this movie deserves more than one star but I need to neutralize all these nine and ten stars that I can't understand. I like Clint Eastwood's movies as much as anyone else, and I know it might be the last one in which he shows up on the screen, but it's not even close to being one of his best movie. Even that one good thing that some reviewers mentioned, and that is Clint Eastwood's acting, looks good only in comparison to the very bad job the rest of the cast does. I mean, what's with that growl? Didn't we have a multiple other hints, none of them subtle, that Mr. Kowalski is an embittered old man? Somewhere in the middle, I hoped that would be a movie about what a parent or a friend could or should do when a kid is bothered by a local gang. But, there is no any effort to think about that problem any deeper. Too bad!",1.0,Anonymous,Drama
"Thank you, just thank you","I have the main song of the film, ""Gran Torino"", stuck in my head. It goes: ""Engines humm and bitter dreams grow/heart locked in a Gran Torino/it beats a lonely rhythm all night long"". Clint Eastwood has always been a man to fear, even more as years go by because, as my friend Urdinez says, he's like wine; and gets better with time. What does Eastwood, the genius filmmaker feels? What does he think about life? In ""Gran Torino"", probably his last effort as an actor/producer/director, we see a man completely exposed, and the movie may contain the answer.It's not that what Clint has inside is important, but his Walt Kowalski is one of his typical characters; one of those men who will do everything by themselves and don't even accept the help of their own family. His performance is so hearfelt, so perfect, that's it's hard not to imagine Mr. Eastwood keeping a Gran Torino in the darkness of a garage.Clint works hard to establish the personality of his war veteran from the first scene in which, during the funeral of his wife, he grumbles at the sight of a piercing his granddaughter has in her belly. This scene also presents, by making a fool of him, Father Janovich (Christopher Carley), another of the film's crucial players as he preaches a ridiculous sermon about life and death. With his wife dead, Walt will now be almost the only American (with a flag hanging on his porch, of course) in a quiet neighborhood inhabited by Chinese immigrants; and when a kid next door named Thao (Bee Vang) tries to steal his Gran Torino, we know peace can't last too long.Walk Kowalski doesn't like priests nor Chinese or African American people, not even Irish or Italians; or maybe he does, but he certainly doesn't show it. The narrative mastery Eastwood has achieved at this point of his career lets him present two or three scenes in which some Latinos, blacks or Chinese gang bangers molest Thao and her sister (a fantastic Ahnie Her; watch the scene in which she's molested and you'll find an mild but nice social and even cinematographic commentary). When things are about to get ugly, Walt always appears, with a rifle on his waist, to save the kids who start-along with their family that leaves him all kinds of gifts on his porch-viewing him as a hero. But Walt doesn't want to be one; such as Frank didn't want to train Maggie in ""Million Dollar Baby"".As it occurs with most of Clint's recent films, there seems to be a lot unsaid between scenes, mostly in the scenes Walt speaks to the young priest. Boxes that are hardly opened, secrets from the past that haunt Walk Kowalski. And ""Gran Torino"" is not about an old man trying to be better; it's about an old man doing what he always did and finding some friends because of it. These are definitely not the friends he would have chosen but the ones who chose him.In between there's a lot of beer to be drunk, a lot of food to be eaten, a lot of culture to be learnt and even some life lessons. The miracle is that everything is natural and shot with a careful eye in the light of day and in two or three main scenarios. When the night comes and the movie gets darker, Clint is very close from letting the movie slip away but never does. One shot of him sitting in an old couch, with the light on one side of his face and complete obscurity in the other one, is the highest point of his collaboration with director of photography Tom Stern and probably the movie's most painful moment.It occurs with almost no music, and the music (written by Clint's son and probably himself) is another of the pilars of this masterpiece that brings every production element together. A lot of war drums in moments of tension, an almost muted bass playing the melody of the theme song in moments of quietness. And the script, almost flawless and inevitably funny as Walt insults every person he encounters on the street, whether they have good or bad intentions; but unnecessarily clarifying after the last encounter the old man has with the priest.I wanted to express this final thought. When a man who has received orders all his life, doesn't do what he's told, there's always the chance that something goes wrong. Maybe he can fix it, and we'll listen to phrases that only Clint can say and believe them. Things that are right in the like: ""I finish things, that's what I do"". ""Gran Torino"" is a film with class, not only because it has what we call class, but because it is classic; 'old-school' as Urdinez said. The kind of movie that doesn't get made anymore, in which from something ordinary you end up finding things you want to call extraordinary. Thank you Clint.",9.0,Anonymous,Drama
Clint's Finest Hour,"The movie has been described as ""Classic Eastwood"" and in a sense this is true. Even the previews show Eastwood's character (Walt Kowalski) aiming an M1 Garand and telling the trespassers ""get off my lawn."" There were a couple of times I wanted (nay, expected) him to utter that classic line ""go ahead, make my day"" (but he didn't).Still there were times I laughed so hard it hurt, and then I cringed and braced myself as the drama unfolded. I laughed at the relationship between Clint's character and the neighbor lady on the front porch. Then, I cheered quietly about the same relationship. I went to see the show with my teenage granddaughter and as we left the theater she said ""I haven't cried at a movie since I was 11."" This movie really has something to evoke every emotion, and the audience seemed to feel it too.But, I'll tell you who stole the show, and who has seemingly been ignored in this movie -- that's Ahney Her, the young actress who plays Sue. From every indication, this is her first acting role before the camera. Yet, here she is, co-staring with Clint Eastwood, working under him while he directs the movie, and while she's got to be perhaps only one third his age, she goes toe to toe with him throughout the movie. In the yard, in the house, among family, at intersections on public streets, in his truck, she's right there with him giving a performance I'll never forget (and I doubt she will either).The building relationship between an older white male, recently widowed, living as the last remnant of his class and culture in a neighborhood suffering from ""white flight"" and the newer residents is outstanding. Having served in the military, along the Pacific rim, having grown up in a white, middle class, blue collar neighborhood, I could easily relate to Walt Kowalski and many of the issues he struggled to deal with.I don't know if this is going to be Clint's swansong, I hope not. But, even if it is, he couldn't end on a brighter note.",8.0,Anonymous,Drama
"A powerful performance from the iconic Eastwood, his character inspires and he proves that anyone can come to terms to an unexpected friendship.","Clint Eastwood the man the tough guy himself certainly is in top form here with his latest ""Gran Torino"" which perhaps could be his final screen role, considering he's close to approaching the age of 80 years old. And after you watch this you will feel as fresh as ever and happy with Clint's performance as his manner is as gruff and as macho as ever. Only on this journey you see how no matter how gruff that this old man can humble when it comes to the ways of the world and can develop new and unlikely friendships.Eastwood is Walt Kowalski a Korean war vet who lives in Michigan and after retiring as an auto worker and upon the passing of his wife, the world has certainly darkened for Walt. Yet Walt is a tough natured type of a guy one who's wise with wisdom and he lives with his most prized possession a 1972 ""Gran Torino"" yet mostly his gruff and tough nature is the eye catcher that most see about him including family. Yet the film theme turns social when it shows the nature of racism. From the start you the viewer see with Walt's actions(tobacco chewing) and tough witty talk(racial slang and jokes)that he's clearly a bigot and has plenty of stubborn blood flowing in him. And when a Hmong family moves in next door this is when Walt's life and character is tested the most.It is here we see that film takes on a complex and tough grumble journey of a process of character transformation. And the theme of racism is so common as so many of us have dealt with it in our lives in some form. Even though the undercurrent and subplot of the neighborhood gang issues and the violence of the film shows a side of Eastwood's character to be somewhat of a local superhero to the family, it still fails in comparison to the films message of learning to accept a new take on friendship. The development and growth you see in many of the scenes between Eastwood and Bee Vang(good supporting work)grow on your thoughts and emotions. As after seeing this film it leaves everyone with the hope of a better world proving that all of us no matter what racial, ethnic, or cultural background are the same and bleed the same blood. Really it's a hope for a better world showing that unlikely friendships can develop and that even the most stubborn and strongest types of people(Kowalski) can have a change of heart and view the world differently and change before they pass on.Overall wonderful work from Eastwood maybe one of his strongest, yet his performances are always well done with class and perfection. It's a must see here for the fact that this could be the legends last screen time perhaps. And too for the strong message that this film sends of looking at friendship and growing to change one's ways in such an unblinking way makes it very powerful and certainly a film to be respected. So ""Gran Torino"" in my view is certainly one film that drove into the winners circle.",9.0,Anonymous,Drama
Clint Eastwood At His Best,"It may seem strange to say this about a well-known actor such as Clint Eastwood who's had a lot of successful movies in his career, but I don't think I've ever enjoyed an Eastwood movie as much as I enjoyed this one. Eastwood (who also directed) was perfectly cast as Walt Kowalski, an aging Korean War veteran whose wife has just died as the movie opens, whose family wants little to do with him except to get their hands on his house and his prized 1972 Gran Torino, and who is tormented by the fact that his neighbourhood has been taken over by Asians. Kowalski's racist nature was actually comical (in an Archie Bunker sort of way) but the most impressive thing about Eastwood's performance was how well he portrayed Kowalski's gradual change of heart toward his neighbours, beginning with his unexpected friendship with young Sue (a great performance by Ahney Her) and developing into his role as the neighbourhood's protector against the violent Asian gangs that continually invade the area. In that sense, Eastwood began to resemble an elderly Dirty Harry, with ""get off my lawn"" becoming Kowalski's version of ""make my day."" As Kowalski growls his way through his various encounters, first with his neighbours and then with the gangs, you are both appalled and amused by the character. You root for him in his battles with the gang, and finally end up applauding his ingenious and selfless way of getting the bums off the street and protecting his Asian neighbours who, as the last scenes of the movie demonstrate, have become far more his family than his real family had ever been. This is funny, action-packed, emotional at times (especially after Sue is attacked) and, in a strange sort of way for a very violent movie, even uplifting at the end. It's truly a superb piece of work by Eastwood.",9.0,Anonymous,Drama
