title,content,rating,username,genres
"""The lessons of life and death""","GRAN TORINO is another masterpiece from Clint Eastwood and is a story that resonates with the diverse cultures of America today and the issues of assimilation into a white America. Eastwood portrays a typical blue collar American in the Midwest, hesitant to change, and dealing with his own personal issues. But when he takes on his neighbors and begins to understand their differences,along with their culture, magic happens on the screen and Eastwood's journey is one that brings laughter, as well as tears, to his growth and love for others. The Golden Globes missed out on this film, but Eastwood should be there at Oscar time and GRAN TORINO is a film that should be justly rewarded as the themes of life, death, family and assimilation of cultures into the American main stream, are extremely important ones. I can hardly wait until the Oscar nominations for GRAN TORINO.",10.0,Anonymous,Drama
Magnum Bunker,"I recently saw this during its opening weekend in the Phoenix area. Clint Eastwood directs himself in this urban story of a retired automotive factory worker in Detroit who's wife has recently died and is left alone with his dog in a crumbling former blue collar neighborhood that has been inhabited by Hmong immigrants. An ambitious year for Eastwood as a director with this film coming at the heels of his critically acclaimed ""Changeling"" he goes in front of the camera to deliver yet another classic Eastwood character. At age 78 he plays a crusty bigot who is at odds with his grown sons and their families and the modern world in general. Filled with great lines from a story by Dave Johannson and screenplay by Nick Schenk it's got to be the wittiest drama ever. I hope it's not Eastwood's swangsong as an actor and we see more of him on screen. A great film. a classic and I would give it a 9.5 out of 10.",9.0,Anonymous,Drama
"Extremely flawed film, which still packs a punch...","Gran Torino is a film with a lot of problems, which ultimately packs an emotional punch which will affect most audiences..Part of the problem here is that the subject matter feels like a well worn path - mined in so many previous films - gang violence, racism etc..All treated with equal measures of serious drama and humor.The script is also very clunky, and some of the scenes seem woven together just that little bit too perfunctorily..It's somewhat surprising that Clint, who i rate as a cinema legend (actor and director) couldn't beat this into a tighter, leaner film...The performances are all fine, the racial slurs appropriately confronting in the script..but there is a definite lack of style and the deft touch required to make this kind of subject go from over-earnest preaching to greatness However flawed, by the time you hear Clint refrain the theme in his gruff voice as the credits roll the powerful message of this film should have had its impact.",7.0,Anonymous,Drama
We all love Clint Eastwood but can we PLEASE be honest and admit he made a bad movie!?,"I can't understand WHY so many reviews on here are just kissing Clint Eastwoods ass. There's no question Clint Eastwood is a brilliant actor and director. I went into this film expecting nothing less quality than ""Million Dollar Baby"", ""Mystic River"" and ""Midnight in the Garden of Good and Evil"". But this movie did NOT live up to any of those for a number of reasons.I'll keep my review short but anyone with an objective mind has to be able to agree that many scenes and lines in this script were laughable. It says a lot when more than 1/2 the movie theater was laughing throughout the movie. Casting choices were no better. The priest was AWFUL. i appreciate Eastwood wanting to cast no names, and in the case of the the two Hmong children, locals as well who were starring in their first feature film. Unfortunately this backfired big time. They were not believable and their acting in many scenes was downright awful.I appreciate the story they were trying to tell and I have no problem with the language but we all need to admit when a great filmmaker makes a poor film.",3.0,Anonymous,Drama
A classic,"A variation on a storyline of countless movies but few, if any, this good. It would have been very easy to screw up this movie but Eastwood turns it into one more modest masterpiece. It's difficult to imagine anyone else playing his part and especially the comic aspect of it with the same dead on results. Having been an admirer of Mr Eastwood for most of my life I think his secret as a director might be that he has the attitude of a craftsman rather than an ""artist"". From what I've read about his on set tactics he seems to be relaxed and patient enough to wait for good things to happen and tasteful and experienced enough to recognize them when they do. This is definitely one of the movies he will be remembered for, both as an actor and a director. A couple of major awards would definitely be in order!",10.0,Anonymous,Drama
Eastwood does it again!!!,"Eastwood's age doesn't stop him from making masterpieces, and he proves it by making this powerful drama, where he stars and directs, showing the world that he's still go it. One of the most emotional films I, or the whole world has ever seen. It just goes to show that age has nothing to do with pride.Former Korean fighter Walt Kowalski observes his new Korean neighbors during his wife's funeral, and automatically hates them. Walt's life could be described as gone, for he can't cope with the fact that he's worn out, and can't reach out to his two spoiled sons. He catches one of the Koreans who moved in next door try to steal his most prized possession, his 1972 Gran Torino. He realizes the kid, named Thao, (Bee Vang) was forced into it by his trouble making cousin, who's in a Korean gang. Despite several insults and arguments, Walt conjures up a relationship with him, as they bond together into a partnership.As usual, Eastwood gives a spectacular performance and gets extremely into his character, as well as the others. The music, also by him is not half bad. Despite Eastwood's lack of singing abilities, he still manages to get through it.A dark tone sets itself throughout the movie, turning to disturbing scenes of depression and hate. The final scene in the movie will bring you down to tears. As for everything else, just an all out brilliant masterpiece that is well expected of Eastwood.",10.0,Anonymous,Drama
Classic Clint Eastwood,"Let's face it, if you don't like any of Clint Eastwood characters, you are not going to give this film the sort of credit that it deserves.But regardless of how you view Eastwoods's career going into it, you will still laugh, cry and enjoy watching it immensely! I saw this in a theater with a packed-to-almost-overflowing audience (there were actually people standing on their feet watching the move at the back of the movie house). The laughter from the crowd in the funny places was loud and genuine and the silence from this same large group was complete during the more poignant ones.At the end of the film, the entire audience clapped during the credits.This is not a perfect film, but it is damned close. Clint Eastwood gives one of his best performances *ever* in this film and with only a few rare exceptions, virtually carries every scene.The only scene that felt a bit too scripted was the barber shop scene with Walt, Thao, and Barber Martin, though it was still damned funny! Even if you don't love Clint Eastwood, you will love this movie. And if like me you are an Eastwood fan, you will experience one of his finest moments on film.Bravo, Clint! Thank you for giving it your all once again.",10.0,Anonymous,Drama
Better than I expected!,"For some strange reason I avoided this movie for all this time. I presumed it would be a routine movie around the subject of racism with stereotypical characters.I should have known better - as it stars and is directed by the great Clint Eastwood. Admittedly the movie does start out fairly predictably and you kinda think you can guess how the story might pan out.Good performances by all the major players - the goodies and the baddies!!! The thug gang types were very realistic. I do think that Clint's racist character is very in-tune with the 'average' racist in as much as he has preconceived ideas and beliefs about 'recent' foreign immigrants. Clint's character himself is an polish immigrant from many years ago and regards himself as a true American, rather than a Polish immigrant! Worth a watch - it comes round on TV fairly regularly - it is more than just a routine racism movie, it goes a lot deeper.",8.0,Anonymous,Drama
not realistic,"All Clint Eastwood directed movies are watchable as there's always a poignant story to tell that ambles along in its own time, this movie is no exception. However, unlike his earlier work, I found it very unrealistic that Walt would effectively give up his life for Thao. In the space of a few scenes, we're meant to believe that this crusty, inflexible, set in his ways, racist etc old man who has hated Asians and their ilk for generations now would fall over for them, I don't buy it even if he hates his family and is dying himself. Men like that always go to their grave bitter and angry. But as Clint was acting in his own movie, he can do what he wants I guess. Similarily, when confronting gang bangers in earlier scenes, again why would they just stand aside and let him do whatever he wants, maybe Clint was yearning to be ""harry"" one last time, very noble but sadly unrealistic and that detracts from the movie for me. Otherwise, its a decent story about modern America although, at times it seemed like a documentary about the Hmong people with sue explaining their culture, why they are in the US etc! Clint Eastwood is an amazing actor and director but I think his ego got in the way of this film.",6.0,Anonymous,Drama
Another Masterpiece From Mr. Eastwood,"This movie is by far one of the best pictures of this decade. Mr. Eastwood has obviously perfected his trade.. making movies that entertain and teach on the highest possible level.. Very well written script.. and a genius performance by Mr.Eastwood that its almost impossible to see anyone who can top that . This movie is really genuine in its story, emotions and its lessons.. it will leave you thinking a lot about matters of life and death and it has the perfect balance between tragedy , drama and comedy. Just watching the facial expressions of Mr. Eastwood in the very first ( Funeral ) scene really says a lot. I salute Mr.Eastwood and all the cast for the wonderful performance. This is a must see movie! 10 out of 10... Period.",10.0,Anonymous,Drama
What a shame.,"When I first looked up this movie on IMDb, and saw the nominations along with the user rating; I thought this movie was going to be a blast. I started to watch it, with great expectations. But as the movie went on, with Mr. Eastwood constantly making inhuman noises, launching non-funny - but ""all-american; I'm-a-RAW-son-of-a-b****, the world has hurt me, and left me to rot"" jokes, and ""mingleing"" with the horrible cast - I just wasn't entertained. I'm still getting goosebumps of humiliation on behalf of Bee Vang (The actor who plays Thao), in the scene where he is locked in Walt's cellar; once again, horrible, horrible. At the end, I was just really disappointed in the movie. It could have been a great accomplishment - but it didn't, at all, rip itself off the Hollywood wallpaper. We have seen this movie a thousand times before, and will most likely see a thousand more of them (perhaps a few this Summer already).So WHY this movie is rated 8,5 here, and has been nominated for a golden globe, is a mystery to me.Footnote - Clint proves, that just because you have done a curtain thing for many, many years - it doesn't mean that you have gotten better and better.",2.0,Anonymous,Drama
"""As Good As It Gets"" meets ""Dirty Harry""","""Gran Torino"" really took me by surprise. I expected a movie that was much more serious in tone. After the epic ""Changeling"", the two World War II movies, ""Million Dollar Baby"" and ""Mystic River"" I didn't think Eastwood would get back to entertaining cinema anymore. And yet, ""Gran Torino"" is just that for the most part. The first two thirds of the movie are actually laugh out loud funny. Eastwood's Walt Kowalski runs his mouth with so many politically incorrect statements, it's a delight. The character is somehow reminiscent of Jack Nicholson in ""As Good As It Gets"", but of course Eastwood adds his own ""Dirty Harry""-spin.Kowalski is a gun toding, grumpy old Republican, slightly racist, but with a golden heart. At first disgusted by the all Asian neighbourhood, Walt doesn't give a crap about the people living next door. However, more or less by accident he strikes up an unlikely friendship with the family's daughter and finds himself caring more and more for her and her mother and brother.As I've said, watching this movie you can have a jolly good time. The line's are funny because Eastwood delivers his racist slurs so dryly and quickly. It's not all mindless comedy, though. If it was, you wouldn't care as much for the characters. ""Gran Torino"" has a nice morale to it - drawing blood for blood isn't the right thing to do, and prejudice is no good.Still, Eastwood's latest movie as a director (and his last as an actor) is more entertaining than it is educating. The dialog seems structured for the most part, the characters are a bit clichéd and the ending is highly unrealistic. None of that takes away from the quality of Eastwood's work, though. I'd even go as far as calling this the best movie he's made since ""Unforgiven"", maybe even longer.",8.0,Anonymous,Drama
Eastwood's Final Performance is Vintage Clint,"I've seen this movie twice already and I'm sure I'll see it again. I think it's going to be one of those movies, like ""Full Metal Jacket"" or ""Apocalypse Now"" that people will want to see again and again, based solely on Eastwood's unforgettable performance as Walt Kowalski, a retired auto worker living in a bad neighborhood in Detroit. Walt's character is a composite of Eastwood's many different screen personas he's portrayed throughout his long career: ""Dirty"" Harry Callahan, William ""Bill"" Munney, and the boxing trainer Frankie Dunn from ""Million Dollar Baby"" come to mind.The plot is Walt's wife has recently died and he is alone in his home, coming to grips with what's left of his life. He doesn't get along with his sons, who live in the distant suburbs. He has a contentious relationship with his parish priest, who won't take no for an answer when it comes to getting Walt to attend confession. He doesn't get along with his neighbors, who happen to be Hmong immigrants. However, when the neighbors are harassed by Asian gangs, Walt springs to their defense and an unlikely friendship develops between Walt, his neighbors, and the Hmong community, who view Walt as a hero. The rest of the film develops the friendship between Walt, and his neighbors Thao, and Sue, both Hmong teenagers, while protecting them from the predations of the marauding Asian gang.It's an incredible story with a fitting ending. Eastwood has gone on record as saying this is his last film as a lead actor. It's seems only right and proper that his last film was his best.",10.0,Anonymous,Drama
A Blue Collar Character Study,"Roger Ebert wrote many brilliant movie reviews. He missed on this one. He said it was a formula story of a gruff old man whose heart was softened. That description applies better to Pixar's ""Up"" than to this movie.We don't see Walt Kowalsky's character change, we see it gradually revealed. He throws around ethnic slurs because working people of his generation did. For him they are descriptions, not pejorative. He lives in a multi ethnic neighborhood and knows enough about the people around him to use them accurately. He is well aware that it's unfashionable. He takes Thao to the barber shop to teach him the nuances.Walt Kowalski served as an infantryman in the Korean War. People probably called him a hero. He knows better. The enemy troops were always human to him; just another ethnicity. Many were younger than he was. His time there marked him.His wife is dead. He's unhappy with the way his sons turned out. His neighbors have a serious gang problem. He sees a way to solve it, and perhaps be a true hero.",10.0,Anonymous,Drama
Exceptional,"I'll keep this short, Gran Torino was an amazing film. I walked in knowing little about the plot but hearing it was a great film. My expectations were low so it probably increased my overall reaction.You can find a better plot description elsewhere so I won't waste your (and my) time. Clint Eastwood was absolutely fantastic and I was shocked to see a best actor nomination wasn't given to one of the best performances I have ever seen in a film. The Asian gang harassing the neighborhood were menacing and genuinely scary. I felt uneasy every time they showed up and was glad they weren't reduced to the clichés they so easily could have become.But what made the movie for me was that Gran Torino felt real. It didn't feel like a green screen studio with paid actors and trailers off screen. There weren't any references to Eastwood's older films, no shameless product placement and nothing that could show you're watching a movie rather than looking out your window.See this film.",8.0,Anonymous,Drama
So real,"Mr. Eastwood, Bravo. You have an amazing way of writing and acting that touches every cord. I went to this movie not really knowing what it was about but you told a story that really touched my heart.I had a neighbor just like Walt, a WW I veteran that all the kids in our town were afraid of but me and my siblings. He protected our end of the street with the vigor of a warrior while feeding me peppermint candies. I had forgotten about Ken until now. I believe that he has continued to protect me all these years.Your movie has so many levels, from respect and acceptance within a family, restitution of past events, repentance, true love, genuineness, and I could go on if I was an eloquent writer such as yourself. The theater audience laughed in disbelief during the movie at what you were saying and sobbed during the credits as if we had lost our own father. I have never seen an audience respond in such a way in my life and it was because of your genius. Thank you.",10.0,Anonymous,Drama
Eastwood is alone by also his character and performance,"İ was hoping something more in the beginning because in Eastwood's films i expect more,his intelligence is unquestionable but in this film he is playing by himself. He really shows his quality by his performance (one of the best in this year) but the rest of the cast was miserable. So film can be watch just for one man's acting.Eastwood's direction is perfect simple but effective and screenplay(jokes was brilliant) is well but not good enough to tolerance bad acting.But i can guarantee you that you will laugh a lot when watching Eastwood he is really good at in this in this film.He must choose the rest of his cast more carefully after this film",7.0,Anonymous,Drama
An amazing roller coaster,"For thinking, caring people, do they get any better than this?It's been over for 10 minutes and I'm still wiping away the tears... of joy and sadness and a reflection of my total involvement....There is so much to learn in this movie - about prejudice and compassion. About caring and joy. About humanity and the Dalai Lama's assertion that we are all united by humanity.You laugh, you cry. You exult and you cringe.Plenty of synopses here. I don't need to go there. Just SEE this movie! It totally deserved a truckload of Oscars.Eastwood does it again!",10.0,Anonymous,Drama
Very solid picture,"Greetings from Lithuania.""Gran Torino"" (2008) is just another great proof that Clint Eastwood is a living legend. This another great movie by / with Clint Eastwood. Story is simple but universal, pacing of this movie is great, cinematography is steady and solid as well as script, acting and craftsmanship overall. Althugh i was a bit surprised that this movie ranks higher in IMDb then his Clint Eastwood's masterpiece ""Million Dollar Baby"", nevertheless ""Gran Torino"" is superbly solid movie in all directions.Overall, if you haven't seen it yet, ""Gran Torino"" is a safe bet. It has involving story, very solid overall craftsmanship and superb performance by Clint Eastwood. You can't ask for more.",9.0,Anonymous,Drama
An instant classic,"When I saw Gran Torino in the cinema, I found myself gloriously amused in one second – and howling like a lap dog in the next. In a nutshell: I wished the film would never have ended. So I was curious if I would still benefit by watching it a second time – if it might actually be called an instant classic. And my answer: I did. And it might.Eastwood sticks to his style by addressing the central topics of life in his very own (we nearly called it Clintonesque) way. As was the case for Million Dollar Baby – and perhaps any great film – our fascination is not caused by the topic's irresistibility (or have we recently missed a drama starring an intractable pensioner with xenophobic – not to say misanthropic – tendencies?), but by the breath-takingly outlined characters and their interaction. Nevertheless, we need to take a short look at the plot: Walt's life is in shambles. His wife left him via a coffin, his children want no part of him (except for his car and house), and his neighborhood has been overrun by immigrant clans a long time ago. Thus he's got nothing left but his dog; and his Gran Torino, this battleship of a Ford he helped to build decades ago as an assembly-line worker. This is the starting situation for a 116-minute-long emotional roller coaster ride through strange and even stranger cultures.By the film's virtuously proportioned intensity and dialogues with snarky humor we are not only invited, but are intrigued to participate in Walt's second life. Quite unintentionally, he changes the lives of an inexperienced clergyman, a neighboring family and finally – his own.",10.0,Anonymous,Drama
Powerful Movie!,"This is definitely in the top 3 of 2008 films. This movie is so great, I can hardly describe my feelings in words. Clint Eastwood did such a great job making a film that moves yous and that everyone would like.Clint Eastwood plays Walt. Walt is a racist Korean War veteran. His next door neighbor, a Hmong tries to steal his mint condition Gran Torino. He is caught by Walt and he instantly reforms the kid and protects his family from a threatening gang.The acting is very good. The only actor that everyone knows is the masterful Clint Eastwood. The Hmong actors are unknown but they did a n excellent job.The story keeps you on your toes, waiting what's going to happen next. The music is great. The song during the end credits is great. You even get to hear Clint sing.At 78, Clint still goes strong as a drinking, smoking, mean racist dude. Go Clint! I rate this film 10/10.",10.0,Anonymous,Drama
Grandpa Torino,"The plot of the story you most likely know so I'll skip that and just give you my 2 measly cents.Clint's latest flick of self-change, bravery and having an open mind is definitely another solid flick from this phenom of an actor/director. Gran Torino isn't perfect like his past pictures like Million Dollar Baby or Letters and Flag, but it succeeds like those do in giving messages.The film's really only gripe is the acting by the Hmong characters. I don't know why exactly that they all seemed to have zero acting experience but I'm sure Clint had a hand in that. Probably to make the movie seem more authentic he chose non-actors to be casted. And actually it works if you think about it that way. It's a guess, but it really seems that was the case.The story and the message he was delivering to people his own age is what stood out for me. I can't count how many times I've seen old timers be flat out racist or just express themselves as if the problems they were plagued by years and years ago are still a legit reason to be crotchety today. Stubbornness, narrow-minded ideals are major issues with war vets and children of the years past. It's obvious this will most likely be an ever-present problem but with Clint's celebrity and his loyal following of people who grew up with him, I'm sure it'll sink in some of these old farts heads that this is the sure way to think. Even for a young guy like myself I take these lessons displayed and try to keep my mind from becoming close-minded.So next time I hit up the local dive bar, the YMCA or anywhere for that matter and I hear a disgruntled old poop talk about his 30+ year issues, I'll tell him/her to watch Gran Torino. Then they'll probably tell me they don't watch movies.....",8.0,Anonymous,Drama
