title,content,rating,username,genres
Completely overrated,"Gran Torino is the story of the friendship between Walt, a retired soldier and widower, and a Laotian family living next door, and the struggle of the youngest siblings not to be swallowed by the street gangs in town. It is an ode to peaceful coexistence and the right to have a better future, a non pre-conditioned racial one.The story has all the elements to be successful, since it has a lovely story of interracial friendship, initiation to maturity, migration, and of good people who want to live in peace. I liked the history of the Laotian neighbors as depicted the reality of immigration and survival in a new racial and cultural environment.I loved the performance of Ahney Her as Sue and Bee Vang as her brother Thao, which are very expressive, sincere and sensitive. I liked the sub- story of the punishment that Walt gives Thao to pay for his fault. I also liked the unexpected end, an example of sacrifice for the welfare of others, which surprises the spectator because the film is quite violent, even the poster seems to indicate that.These good elements were not enough to me because of the tempo of the film, which doesn't't have a crescendo or doesn't demarcates what is important from what is superfluous. The story sometimes gets lost in the superfluous, forgetting those elements of the story that were more interesting and important; for example, all the sub-stories of Walt's family don't add anything to the story or serve to draw Walt's character better. Some characters are badly drawn (Walt, for example, looks like an ailing Dirty Harry, a repetition of past roles) while others are too stereotypical and predictable (such as the Asian boys band.)The film is just OK. I thought it was a commissioned one, the kind of film that some directors have to direct to make money and finance more daring projects.",6.0,Anonymous,Drama
"Clint Eastwood, Strikes Again","Clint Eastwood does it again. not only does he do a good job acting as a Korean war vet, and a grumpy old man. but he also does a fantastic job directing this movie. Gran Torino, is one of my favorite movies iv'e ever seen. warning, this movie has extreme graphic, and offensive language, and some scenes of violence. beginning to end i was at the very edge of my seat watching this movie. it had some funny scenes as well as some serious and definitely sad scenes. there is good character development. Pros: gripping story, and has good/funny dialogue at some parts. unfortunately it does have a disappointing ending which i wont spoil for you. Cons: i tried hard to find something wrong with this film. and i cant seem to find one besides the racial slurs towards Chinese people. Even then, that didn't bother me. a definite 10/10",10.0,Anonymous,Drama
A man comes to grips with his past,"It's hard to write about the emotional impact of 2008's ""Gran Torino,"" directed by and starring Clint Eastwood. At times, it's so funny, you're crying with laughter, and at other times, so sad that you're crying for a different reason. Whatever it is, it's Clint Eastwood's best performance, and certainly one of his best movies.Eastwood plays Walt Kowalski, a recent widower and Korean war vet who doesn't have a relationship with either of his two sons. He's a complete bigot and a racist. He has guilt about the people he killed in Korea.The best that can be said about him, at the beginning of the movie anyway, is that he loves his dog. And that seems to be about all he loves - the dog and his magnificent 1972 Gran Torino.One night, he catches someone trying to steal it and, using his trusty big gun, runs the thief off of his property. It's the Hmong boy next door, Thao (Bee Vang), whose cousin is a Hmong gang member and trying to initiate the confused Thao.""Hmong girls go to college,"" his sister Ahney (Sue Lor) explains to Walt. ""Hmong boys go to jail."" Gradually, thanks to Ahney's easy way with him, and the fact that he thinks she's ""all right,"" Walt is lured next door for a family gathering. It's awkward at times, but he loves the food.He detests the gang - he keeps them from assaulting Ahney and stops an attack on Thao, earning him the undying gratitude of Hmong neighborhood. When Thao is sent to work for Walt as an act of contrition for trying to steal his car, Walt takes an interest in the boy's future - and he won't have a future if the gang influence isn't stopped.What we learn about Walt - and what Walt learns and teaches - is what ""Gran Torino"" is all about. The car, like Walt, is out of place and part of a bygone era in an old neighborhood largely inhabited now by the Hmong people. Yet he and the car belong there.The best moments are between Thao and Walt, especially when Walt teaches Thao to ""man up"" - definitely the funniest scenes in the film.A priest (Christopher Carley) promised Walt's late wife that he would get Walt to go to confession. Carley with his baby face and quiet manner, is very well cast, and the scenes between the two men are very good.All the performances are excellent, but Eastwood here has created one of the all-time great characters. It's fascinating to see what he has accomplished since he first came to public attention as a robust, handsome western hunk in ""Rawhide.""He has emerged as a great artist - most of his films are infused with complex characters and profound emotions. Not every performer has the opportunity or ability to grow in his work, but Eastwood was given that opportunity and made the most of it. At 78, he's better than ever.",10.0,Anonymous,Drama
A diamond on the rough,"In today's world of cheesy action movies (Transporter ??) and pathetic attempts at bathroom humor (Meet the Spartans, Disaster Movie) i find it very hard to find a movie that i am willing to go pay 12 dollars at the theater to go watch.Gran Torino is one of those rare gems that both lures me to theater and has me leaving satisfied. Clint Eastwood delivers another brilliant performance as grizzled Korean War veteran Walt Kowalski. A true fish out of water, and anti-hero of sorts. A man obsessed with the notions of honor and respect thrust into a neighborhood that seems to know very little of those two concepts. And Eastwood portrays this character so well he could easily be anyone's old school war veteran relative.On that note, i found the acting to be perfect for the movie. Everyone who says the Hmong family was horribly acted has surely been spoiled by too many glitzy Hollywood blockbuster that will cast Brad Pitt for a one line role. The Hmong family were just that, a family of people, and that is how they behaved. The actors cast did their job and portrayed what they supposed to - a decent family in an indecent neighborhood. I found it MUCH easier to relate to a bunch of unknowns who exhibited real human emotion than a cast of over pampered celebrities who i figure have little or no attachment to the role they are playing. BOTTOM LINE: you care about the characters, you smile when they succeed, and you cry when they do.The story itself was a true roller coaster ride in every sense of the term. The scenes switched from comedic to tragic at a drop of a hat and it worked so well. The theater seemed to move in the direction the film did and several times during the film there was barely a dry eye in the theater.This film DEFINITELY deserves an Oscar look. And in a year where The Dark Knight has received so much award hype Gran Torino may certainly prove to be a dark horse and steal a few awards. 10/10",10.0,Anonymous,Drama
Clint drives it home,"I felt myself being gripped watching this movie from beginning to end. Clint always seems to make ""un Hollywood"" movies, by this I mean it's not a love story with a cheesy ending, or an action movie with a hero like Tom Cruise in it.I liken him to Woody Allen. They both make movies that are just a little different to the norm. I really like that sortof movie, I thrive to watch movies like this.Of course we need the fun movies and of course we like to get lost in a good ole romance, but once in awhile I like to see something with an unusual script.Saying this the script for Torino was not earth shattering different to anything else I've seen. You've seen grumpy in grumpy old men (there is a bit of humour in this movie too), but it's the simplicity of the whole movie that brings it to life.A man (Clint) who is a nasty guy, befriends a boy brings who brings out the good in him. The acting is superb and the movie moves at a good pace, never boring us with Clint'c characters constant nastiness.I will say this without giving anything away - it is worth watching just for the ending.",10.0,Anonymous,Drama
This Is a Lousy Movie,"What reason did Clint Eastwood make this movie? What purpose did it serve? This movie was not realistic. It was insulting and quite ridiculous. It took the Vietnam War and brought it to Detroit. The scenes of violence were quite disturbing and were shown to play on the continuous need for violence as entertainment. There are such disturbing scenes of Hmong people being abused both physically and mentally. This character in the movie was far from a hero. He was cynical, bitter, and racist. His death at the end did not move me in the least. I was just glad to see the ending credits. It is time for old Clint Eastwood to find another hobby.",,Anonymous,Drama
Didn't live up to the hype!,"Gran Torino is a feel-good type of movie with a pleasant story, beautiful meaning and a great performance by Clint Eastwood. Unfortunately, that's where all the good stuff ends. The movie doesn't have a proper form. The plot is row, superficial and without a real tension. After 15 minutes, you can pretty much guess the stroy's process. We hear about Walt's war time memories but the movie fails to take us deep into his emotions and relationships so his changing seems untouchable for audiences. Side characters are also poorly producted. I mean what the hell is it with that church dude or those gangsters anyway? The most noticeable disadvantage of this movie however is the acting. Everybody's performance except Mr. Eastwood is bad, especially the Asian boy. His acting is unacceptable. It's genuinely annoying and ridiculous.",6.0,Anonymous,Drama
Genius of a Film Clint Eastwood. The Demise of Detroit and Timing,"This had to be one of Clint Eastwood's most timely made and produced movies . It is hard to say it is the best because he is a Genius and filled with a tenacious spirit at his talents which are so broad. The closing Song He did, The demise of a former Mega City with the auto industry shutting down. The one thing I respect the most is he used actors and actresses in new positions and they pulled it off. For all the flack Clint received about racial divides portrayed in the film it was all jealousy and poppycock. He offered these young actors and actresses an opportunity of a life time. What would a retired Vet think of when he comes home to ruins. He did an incredible job and I cried through a lot of it with his ability to pull on emotional strings like sacrificing his life for a young man that ran with the wrong crowd. I can't say enough to give him but an A+ 20 points. Incredible film depicting reality in a city that has gone to be a ghost town just like the mining towns of America. Bravo Bravo",10.0,Anonymous,Drama
Eastwood's Masculinity: A National Resource,"""Gran Torino"" is a small, intimate, low-budget movie with no special effects. It is the best movie of 2008. ""Gran Torino"" exhibits courage and pertinence that other films only wish they could have. This movie is so true, and so subversive of PC BS, it's amazing that it got made, and that audiences are allowed to see it.This is the first mainstream Hollywood movie in decades that treats a despised group of people  white, working class, Catholic ethnics, in this case, specifically, Poles  with any respect, affection, seriousness or dignity at all. There are a few movies where Italians or Greeks are allowed to be goofy, eccentric romantics (""Moonstruck,"" ""My Big Fat, Greek Wedding"") or glamorous Mafiosi, but a Hollywood movie that focuses, with respect, on a working class white ethnic man and his deteriorating neighborhood is hard to find.""Gran Torino"" actually celebrates working class, Polish values: working hard, every day, minding your own business, maintaining your house, being a decent neighbor, doing the right thing. Eastwood, in our current Politically Correct environment that denigrates traditional masculinity, has the courage to be a man. An unapologetic man. A real man.The film has the courage to expose the festering tragedy taking place in working class neighborhoods across America. As manufacturing jobs have left, neighborhoods that Polish Americans like Walt Kowalski struggled, against all odds, to build, from their own blood, sweat, and tears, have been abandoned to rampant criminality, social degeneracy, and gang warfare. Since the witnesses of this vast slum-ification of America are working class people, elites don't care, and never address these issues, or address them with all the Politically Correct idiocy demonstrated by the one white liberal in this movie, who dresses and talks like a rapper, and responds with laughable inadequacy when he and his girlfriend are menaced on the street.Clint Eastwood is magnificent. He models honorable masculinity, both for his fatherless next-door-neighbor, and for us in the audience. ""This is how it's done, folks,"" he teaches. The wise will listen.The movie further pokes Political Correctness in the eye by having Walt carelessly toss around ethnic slurs. I can't even type the words Walt uses into this review because this site actually is programmed to delete them. This is Big Brother, folks.What Walt / Clint / ""Gran Torino"" is saying is clear: PC taboos are a joke. What matters is how you comport yourself when the rubber meets the road. At that moment, the white liberal in the movie is exposed for the complete phony he is, and Walt is revealed to be a deeply caring, responsible person whose values are the only values that can lead to a truly resurgent America that can handle its multicultural population in the best way for all. It doesn't matter what words you use or what jokes you tell at the bar. What matters is this: are you a decent person? Do you treat others with decency? That's what matters, folks, not PC taboos and games.",10.0,Anonymous,Drama
Eastwood forever!,"Clint Eastwood has recently hinted that this may be his final film as an actor, and if so, he has gone out on a very high note. Hard to imagine any other actor playing the bigoted old widower Walt Kowalsky. Basically imagine Clint's Gunney Highway character twenty years older and twenty years meaner. In the opening scene we see his wife's sparsely attended funeral, and Kowalsky's obvious contempt for his remaining family whom he considers either soft or disrespectful. After a get-together for the family back at his place, Walt suddenly finds himself basically alone with only his old dog for company. And worst of all (for him) the downtrodden neighborhood in which he lives is virtually free of white people. Most of his neighbors are Mhnog who find him as strange as he finds them. At least they are generally polite to him, where he verbally assaults them at every chance.Trouble arises for the young teenage Mhong boy next door who is the target of his cousin's gang. They try to get the boy to steal Kowalsky's vintage 1972 car of the film's title. Kowalsky stops the boy in his tracks, and the boy's family sentences him to work for Kowalsky to repay his debt of shame. Kowalsky wants nothing of this until he realizes that he can use the boy to make all kinds of improvements around the neighborhood. Over the course of the film, Kowalsky bonds with his Mhong neighbors and they help each other out when necessary. But when street gangs are involved, this kind of conflict can only end after someone is dead.The film handles some very delicate subject matter and uses humor to let different ethnic groups and minorities come to terms. The amount of racial stereotype humor will offend some, and maybe only an actor of Eastwood's clout could play such a bigoted character and make him likable. But thankfully this is not a film that condescends to its viewers. It makes no excuses for Kowalsky, but also paints him as a real person and not a stereotypical hateful white man. Once he gets to know his neighbors, we see his true human side... even if he still refers to their daughter as a ""dragon lady"" or the boy as a ""zipper"". And the film also points out how difficult it can be for young people of any race to avoid gangs in economically depressed areas. At one point, Kowalsky watches a carload of gang bangers drive by, and instantly thinks of the boy next door. ""He doesn't stand a chance,"" he mutters to himself. And when things finally come to a head, the film can really only end the way it does. Kowalsky is tough as nails, but at his age he is no action hero. But he ends up ridding the neighborhood of the gang the only way he can.This film may well win Eastwood some more awards for his ever-increasing war chest. If not as an actor, then certainly as a director... Clint must carry on and on. And one more note. Spike Lee, who has recently been critical of Eastwood has based his entire career on pointing the finger at other people. Spike old pal, you'd better just worry about making your own films watchable! Because they haven't been for a long time. 10 of 10 stars for Gran Torino.The Hound.",10.0,Anonymous,Drama
Ever notice how you come across somebody once in a while you shouldn't have messed with? That's me.,"I sat in a full theater with what I suspect was a crowd older than me. You have to have a crowd like that to appreciate what Eastwood was trying to say.The crowd laughed at all the right parts in the movie: the time when Eastwood's character would let out a stream of non-PC comments, and the time when he stood down the punks.Maybe we have become a nation that is too PC and I believe Eastwood was telling us that. The old man had his ghosts and it was eating at him from inside. He couldn't relate to any other world. A man has to do what a man has to do is the saying, I believe. If you can't understand that, than you are not a man, just someone to be pitied or ridiculed.But, there was a soft side of the character that opened the door to a relationship with a young man who really needed a father. The relationship grew so great that Eastwood's character did the most noble thing one man could do for another.Eastwood was magnificent, Ahney Her was a treasure, and Bee Vang was perfect. I really hope to see more of these two in the future.",8.0,Anonymous,Drama
Something Special,"I am totally surprised that ""Clint Eastwood"" chose to make a movie like this - I mean, he has the clout to do ""anything"" he wants, yet he did this funny, little, odd, but honest, and contemporary movie about the changing face of America. Although Eastwood does fall victim to his own type-casting as, ""Mr. Tough Guy"". The risk of taking on a story about an angry, Old Man, living next door to a Hmong Family in the Midwest isn't exactly the usual ""Hollywood"" movie. Yet, the movie opened to better than competitive ticket sales. Also, the Hmong cast members were just right - Eastwood as Director does an excellent job not stereotyping and getting the generational points across. This movie is definitely worth watching for its original story. And though it has insight into race relations, race is not the pretentious message here.",10.0,Anonymous,Drama
Clint Eastwood hits home in this inspiring and brutally arresting drama,"It's hard to set low expectations for a Hollywood piece starring and directed by Clint Eastwood, the old actor who's spawned as a major Hollywood icon as well as an iconic figure to the American culture. For the past six decades, this fine actor has brought smiles an praises to fans everywhere from his portrayal of the nameless cowboy in the Dollars trilogy to his awe-inspiring directorial works in recent years, and his legacy still continues. This captivating drama starring the iconic actor as well as directed him isn't quite up the par with his legendary works, and can be easily be seen as just one of his minor pieces; but the energy he delivers from both his acting and directorial skills still deserve our attention. Eastwood plays Walt Kowalski, a disgruntled Korean War veteran who's just lost his beloved wife and now lives alone in a depressed state. The old man chooses to alienate himself from everyone including his family, and can't bare to have anyone in his property, particularly a Korean family who moves in next door in the racially diverse neighborhood. Though he unexpectedly makes acquaintance with the teenager girl Sue (played by Ahney Her), he gains tension towards her younger brother Thao (played by Bee Vang) after he sneaks into his garage one night attempting to steal his 1972 Gran Torino under the pressure of his cousin's gang members. Kowalski sets out to reform the young teen by developing a bond with him, and soon unexpectedly finds himself drawn into protecting the family against the gangs that threaten them.Clint Eastwood serves as the pinnacle and emotional core that embraces the beauty of this film. Though there are a few flaws in terms of narrative, his brutally gripping portrayal of the lead character manages to lay those blemishes to obscurity. In the beginning of the film, we are introduced to his character who is gripped with tragedy and struggles with his faith with only his church preacher Father Janovich (played by Christopher Carley) being his aiding hand. Before too long, the character retains a grumpy, tough-minded, and prejudicial demeanor as he's grown hate to everyone of various racial status. One scene the young Korean teenager beaten and harassed by a gang who put him in a dog pile on Kowalski's yard, only to be interrupted by Kowalski himself who points a rifle at them and threatens to open fire if they don't leave his property. The scene is truly intense and sparks a fair amount of tension and unease. Furthermore, the character's near-constant use of racial slurs towards Asians and African-Americans and intimidating threats punctuate his cynical and hard-to-like nature. Clint Eastwood gives honestly one of his most arresting performances in recent years. He's an actor who doesn't take commitment for his role for granted. The almost equally powerful aspect of the film is the ironic relationships between the main character and the young Korean teenager who is brilliantly portrayed by Bee Vang. We watch as the bond between the two characters changes not only the troubled young man from turning to a life of crime by his cousin's tyrannical gang but also Kowalski's attitude towards the family and his determination to protect the family he once despised. The atmosphere is both dark and deeply moving, particularly the powerful and bittersweet ending.Gran Torino is a dark, yet enthralling drama anchored by a gripping performance by Clint Eastwood and a powerful story that is hard to ignore. The film is an interesting piece of cinematic work that though may feel like a minor piece compared to Eastwood's other work, gracefully deserves your attention but only for mature audiences who can handle the dark, cynical tone of the story.",9.0,Anonymous,Drama
Clint Eastwood at his best,"A beautifully produced piece of art. Characters, unique story, actors. Everything just fits the mold perfectly. Also soundtrack is absolutely phenomenal. Anyone who truly loves film can not get enough of this Eastwood masterpiece. It's also the origin of those Eastwood memes you saw online, so you know is good.Movie is from 2008 and it still speaks the audience, since we still have same problems in our society as 2008. Some things have gone even worse in USA since this movie premiered. The way Eastwood is telling for example immigration story is simply awe-inspiring. Eastwood goes all out to show the viewers what life is in these day for old guys.",10.0,Anonymous,Drama
How can this movie get such high ratings??,"I was seriously disappointed in this movie. The movie started off with some potential and seemed like it could get a bit interesting but after the movie progressed it just became very unbelievable. The acting for starters was HORRIBLE. Somehow this old man Clint becomes friend with his immigrant neighbour who's cousin is trying to recruit him into a gang. The relationship between clint and this family was completely unbelievable and interaction between the two was so unrealistic it just spoiled the movie. Clint also often threatens this gangs through several gestures all of which these gangsters blow off, their reaction to him is also very unrealistic. This movie is at best a rental.",6.0,Anonymous,Drama
