title,content,rating,username,genres
The Epic Conclusion We Were All Waiting For,"Harry Potter and the Deathly Hallows: Part 2 is a thrilling and emotional conclusion to the beloved franchise that fans have been waiting for. This final chapter in the series is action-packed and wraps up the story in a satisfying way.The movie picks up where Part 1 left off, with Harry, Ron, and Hermione continuing their search for the remaining Horcruxes. They are determined to destroy them all in order to defeat Voldemort once and for all. The film is filled with intense battle scenes, as the trio and their friends at Hogwarts prepare for the ultimate showdown.The acting in this film is superb, with Daniel Radcliffe, Emma Watson, and Rupert Grint giving powerful performances as Harry, Hermione, and Ron respectively. The supporting cast is also exceptional, with Alan Rickman delivering a standout performance as Severus Snape, and Ralph Fiennes portraying a menacing and chilling Voldemort.The special effects in this film are top-notch, with stunning visuals that transport the audience into the magical world of Hogwarts. The action sequences are expertly choreographed, creating an immersive experience for viewers.One of the highlights of this film is the emotional depth that it explores. The relationships between the characters are tested and pushed to their limits, leading to heart-wrenching moments that will have viewers reaching for the tissues. The theme of sacrifice is also explored in a meaningful way, as the characters must make difficult choices in order to save the ones they love.While the film does an excellent job of wrapping up the series, there are a few moments that feel rushed or incomplete. Some characters and plot points are not given the time or attention they deserve, leaving a sense of missed opportunities.Overall, Harry Potter and the Deathly Hallows: Part 2 is a satisfying conclusion to a beloved series. The emotional depth, expertly crafted action sequences, and outstanding performances make it a must-see for fans of the franchise. It may not be perfect, but it is a fitting end to the magical journey that has captivated audiences for over a decade.",8.0,Anonymous,"Adventure, Drama, Fantasy"
Eh....,"I will start by saying that I really enjoyed the Deathly Hallows: Part 1. I thought, for me, it was the best of the Harry Potter films. Part 2 isn't a horrible movie, it actually starts out with some really well shot scenes. Nice pacing and a serious tone to what's being set up.I must say though that by the end of the film I felt very unsatisfied. I was told that the film was full of action and little else, but its almost like they decided to not put any heart or emotion into the film, while at the same time not really having all that much action in it either.I was very very unhappy with how they portrayed the ending. Weak. It strayed from the book a good bit......and not for the better. I also found it quite odd with what they chose to spend lots of time on and what they decided to cut very short.The series is now over and it is what it is. I just wish they could have nailed the last piece.",6.0,Anonymous,"Adventure, Drama, Fantasy"
Perfect way to end the series,"I loved this one as well, Perfect way to end the series",10.0,Anonymous,"Adventure, Drama, Fantasy"
Goodbye,"--------
It's not a bad movie by all means, but I might have expected better from it, or there is a possibility I wasn't in a good mood to watch it, lol. Either way, it was full of action, but they may have skipped explaining a few things to rush it to the end. I would say the ending was fair and a good closing to this great series.I never read the books and probably will never do, nevertheless no one can deny the Harry Potter series was part of many of our childhood and many of us probably imagined ourselves holding a wand and doing magical spells and wishing to be in their world :)
-------",7.0,Anonymous,"Adventure, Drama, Fantasy"
The Nostalgia of my childhood,"I know I am very late to the party and I am disappointed with myself that it took me so much time to finish them all. Watched the first 3 when I was 8 years old, loved, always stayed with me.But never watched the rest, just strayed away.Yet when I finally watched it, I did not believe why I waited so late to finish it all. Personally one of my favorites there ever will be, not many or hardly any will ever top this is special genre.I loved the trio dynamic of 3 friends, I loved the friend relationship between Harry and Hermione, just was far better then romantically one, all 3 had one of best on screen chemistry and dynamics.Some special characters deserve shout out, Severus Snape was the highlight along with Voldemort, Dumbledore and many others.The story spanning over 8 films was just great for me and finale was just as good, the setting, cinematic, atmosphere were also breathtaking.All in All one of greatest film series to be ever produced.",10.0,Anonymous,"Adventure, Drama, Fantasy"
Perfect Ending,"Deathly Hallows Part 2 is a thrilling, action-packed, emotional, visually arresting, wonderfully acted and ultimately satisfying conclusion to the series. Alan Rickman was snubbed an Oscar nomination for his beautiful portrayal of Severus Snape.",10.0,Anonymous,"Adventure, Drama, Fantasy"
The epic ending!,"Finally, a long-anticipated final chapter of the Harry Porter series and yes, it's good. An epic ending.Harry Porter 7, Part 2 is kind of an adventurous ride, started with daring venture, then came the series of startling discoveries, and end with an epic fight. It's intriguing, tense, full of emotions, and it's fun. Unlike other blockbuster, high budget movies where a large sum of money is spent on stunning visuals but not on the character development or storyline, Harry Porter 7 excels in both – spectacular views with outstanding plot. It's an understatement if one says the movie's success is all due to the fame of J. K. Rowlings' novel. No it's not. In fact, they did a bit of modification to the original story, and it turns out even better than the original story, in my opinion. And don't forget to mention the pacing, the music, the settings, everything in the movie is brilliant. It really gives you the feelings of a dark, frightful atmosphereThe whole casts are good, and Alan Rickman's performance of Snape is excellent. Besides acting, voice of characters are superb, from the mumbling of Snape to the shady intimidating sound of You-Know-Who. And my quirky lovely Helena Bonham Carter, i adores her in her role of Bellatrix. Personal favor, though.The only setback is you need to go back either Part 1 or to the book, to fully appreciate Part 2. Personally, this Part 2 makes me want to go watch the whole series from the beginnings. It's well worth it.For more reviews, please visit: http://voicemotion.wordpress.com/",7.0,Anonymous,"Adventure, Drama, Fantasy"
Harry Potter and the Deathly Hallows: Part 2,"Harry Potter and the Deathly Hallows: Part 2 is absolutely breathtaking! David Yates has been a favorable director for these films, and he really showcased his talents here. He crafted so many gorgeous shots, with a couple new creative tricks, while Mark Day's editing was absolutely seamless, really knitting the scenes together beautifully.David Yates let Part 1 take all the set up hits, and completely focused on making this a high octane, blast of fun! Yates does an amazing job of bringing all of the former events and foreshadowing together, to create countless amazing moments! There were so many twists and turns, keeping the narrative fresh, while moving at such a brisk pace with great momentum. Yates does a fantastic job of setting up this really dark and dreary tone, backed up by the amazing cinematography, and a great score, while really balancing the emotional keys well with the dark tone.It has been a great honor and pleasure to have seen all of these characters grow and mature, over the seventeen years of the saga - it's truly sad to say that it's over. Yates does an amazing job of bringing in all of the characters from the past films, and balancing them super well within the narrative. There were just countless great character moments, displaying their true talents in their own way. After all this time, you can really feel and understand the characters motives and feelings, because everyone is fleshed out so nicely, having great chemisty across the board.As a finale should be, the magic and action sequences were off the charts! It was by far the best showing of their magical abilities, having so many intriguing sequences! The amount of stakes that were set was amazing, having constant tention throughout the entire narrative.Overall, Harry Potter and the Deathly Hallows: Part 2, is phenomenal! It is by far the most entertaining film of the saga, and arguably the best; I just can't put it over The Prisoner of Azkaban!",7.0,Anonymous,"Adventure, Drama, Fantasy"
It was just the best way of spoiling such an amazing novel,"It was an amazing title for an amazing book. Even though I was a fan of the ""Lord of the Rings"" and I never was actually into ""Harry Potter"", I believed in the power of this author and this masterpiece; after reading the book. Extra-ordinary work of character development, relations and creativity. Extra-ordinary work of humour , fantasy and imagination. The power of mankind in terms of how different could it be from other creatures in expansion of such beautiful art-works was observable within this book. Oh, Should I write about the Movie here? Well I have to confess like this: It was just the best way of spoiling such an amazing novel.",4.0,Anonymous,"Adventure, Drama, Fantasy"
One huge payoff,"Featuring some of the best scenes of the franchises, as well as conveying a sense of epic doom and wartime resilience, 'Hallows' Part 2 successfully ends the saga with a bang, which not many movie series can claim to do well enough.",9.0,Anonymous,"Adventure, Drama, Fantasy"
magical,"The conclusion to the series hits some of the strongest emotional beats, mainly due to our long-standing connection with the characters, and provides some grand visual treats in the form of extended magical battles. While 'Harry Potter And The Deathly Hallows: Part 2 (2011)' may be the biggest in scale and it is entertaining, it does feel lacking in depth - since some things are left oddly unexplained - and instead comes across as an extended third act for its duration. It actually plays out like one long climax, with little of the build-up required to further invest the audience, but at least it's well paced and doesn't hang about. A strong note on which to end a phenomenal series.",10.0,Anonymous,"Adventure, Drama, Fantasy"
The world is sadder without Harry Potter,"I'm a 90s kid. I LITERALLY grew up reading, watching and absolutely LOVING the Harry Potter franchise films. I saw the first HP movie on its premiere when i was only 9, and having not read the books before, I was absolutely blown away with HP (I used to diss it but from this point, I was the biggest fan). As I grew up, so did the HP cast and I felt very emotionally attached to them as I kept on loving their movies. I was disappointed with films 5 - 7.5 and I really thought that David Yates had ruined the movies. However I was wrong as shown in this movie. Words aren't enough to describe this movie to the majority of teens around the world who grew up watching HP movies (like me). This is the first time I've literally burst out crying like mad in the cinemas. The Prince's Tale absolutely brought me to great big tears and My Previous fave HP movie (azkabhan) was overly topped by this one. In fact, I think this is my ALL TIME FAVE MOVIE. In my opinion, the Oscars have been ignoring the HP franchise way too much. This movie DESERVES TO WIN BEST PICTURE AT THE Oscars. Most 90s kids internationally admit that this franchise has kept them laughing and entertained throughout their teenage years and a franchise other than HP has never been beloved and gave so much happiness to a generation globally. I not only cried at the absolute tear breaking moving emotions displayed through mind blowing acting my Dan Radcliffe (His acting has improved enormously through out the movies, but his acting in this one was Oscar WORTHY for BEST ACTOR full stop), but the terrible fact that with HP over, I feel that my childhood is over (it really is)and since I am so emotionally attached to HP characters, I couldn't easily let them go. With HP ended, I feel my youth is ending and it is. HP kept my teenage years with something to look forward to in the cinemas through 10 years, and no other franchise in the world has achieved that. HP is the BEST and most beloved franchise in the world to the 90s kids and it won't change because HP not only represents the height of entertainment in our era, but it represents our youth and joyful memories of our school days. I am still very sad that HP is over, more than anyone. I've read all the books, watched all the movies, but I have to say, this movie is the best of all, the perfect finish to a perfect franchise. And whatever other overrated franchises like twilight may be a better representation of their youth to the minority, the majority of 90s kids around the world will always pick HP as their all time favorite franchise ever. It will go down in history not only with success in numbers but in the hearts of 90s kids and other youth of this era. I would be very disappointed if Daniel Radcliffe who is obviously a very talented and hard working professional actor does not win Best actor at the Oscars, because I've never seen an actor at his age display a character with such ground breaking emotion and reality. I would be more disappointed if this movie does not win Best Picture at the Oscars, because this movie is not just a movie, but a form of happiness that have kept the youth of our era entertained for a decade and that is something that is not likely to be achieved even in the future.",10.0,Anonymous,"Adventure, Drama, Fantasy"
Yates : a total dissapointment,"Since david Yates took over the franachise it went downhill fast .The dialog became. Much lees important , or changed drasticly and the action became much more importand .Everything was rushed and the emotional scenes en important info for the story and for the relations between the characters was damaged because of it .Mr Yates made a big mistake , a mistake that is made more often in modern blockbusters .And that is that Harry Potter is not a story about wizards witches elves magic
and wands , but a story about courage , sacrifice , friendship and the fight between good and evil.",6.0,Anonymous,"Adventure, Drama, Fantasy"
"The End of a Saga, The End of It all","A great film, I love the Harry Potter films, all sparking there own magic and telling fantastic stories. Some are Travel Hp 5 and 7 Respectfuly and the others containing a sense of magic, and family dynamics, Hp 1 and 2. And Harry Potter and the Goblet of Fire having action as it's main aim, Hp 6 being Dramatic and dark. But the increadible arc ends when we are hit with the 8th Installment of the franchise, that embarks on a greater adventure like no other. Harry Potter and the Deathly Hallows Part 2, Ends the run of films well.Neville Longbottom was always the most awkward one out of the friend group, and he was always embarrassed on a weekly basis. However, that all changes in this film. He's tougher and certainly more braver. This is perfect growth as he was always the shell, now he's finally concured any on going fears, and decides to help the gang defeat the one we do not speak his name. It's great to see him taking on a fierce roll, it shows he's changed as a character. And that's sometimes Vital.I love the scenes when Harry Is talking to Dumbledore and the importance of Dumbledore throughout the series. As he was such a key character in the franchise so even though he had previously passed away, I like seeing him again, and being the guidance for Harry, Much like in the Chamber of Secrets. It works here too, because we know what Dumbledore means to Harry, Goblet of Fire didn't quite get that right, but we atleast got to see the importance of him, and why he was a key figure in the series as a whole.It feels like a true Finale as well, as everyone gets to join in on the madness, and even destroy the villains themselves. It highlights the importance of each character and why they are in this film in particular, Like Ron's, Ginnys, Fred and George's mum is annoyed with Bellatrix is nasty comment towards her own daughter, so she becomes strong and fierce and kills her. It's a great way of showing emotion and the characters importance to the series as a whole. Which is a great build up to what was happening before, Characters having more things to do, getting more involved in the plot, it works here.I like the fact that Ginny and Harry had kids, much like Ron and Hermione. They had kids, and at the end of the story they got shiped of to Hogwarts, as well as there parents who had gone previously. It's a great way to end on a cliffhanger and add a bit of mystery to the mix, it gells well with ending the franchise, and even starting a new legacy. And Part 8 does a fantastic job of this. The only real thing, was Harry and Ginnys relationship. As it was rather under-developed, with that said a great way to end the franchise. It went out on a high, a Finale done right.Would I recommend this film?,Yes, Fantastic. Especially if your a Potterhead, you'll love it!",7.0,Anonymous,"Adventure, Drama, Fantasy"
Lost the Charming Magic,"14 July 2011. When the special effects seem fake at times, when there is a scene later in the movie that appears to be a memory that is photographically superior to most of the rest of the movie in terms of sharp clarity, when the character development and evolution seems to have stalled, when characters die off screen losing the emotive intensity, when the high point of the movie, perhaps the one that really stands out comes towards the end of the movie where Harry Potter must face himself doesn't really flesh out completely and latter scenes seem to also give away the surprise, when the pieces and mystery seem patched together, it appears this last Harry Potter has grown up into adolescence when magic becomes only dreams and fairy tales, stuff that only young children believe in. It seems that Potter has outgrown the need for magic.",6.0,Anonymous,"Adventure, Drama, Fantasy"
A middling series ends on a low-point.,"I'll admit that I've never been big on the film series as a whole (only saying I even liked two of the installments), but after the major emotional improvement that was Deathly Hallows: Part I it just felt like they threw all of that way for Part II. They put 95% of the focus onto Harry and let all of the other characters fall by the wayside, so when major emotional peaks happened like the Hermoine and Ron kiss that had been building for eight entire films, it became this throwaway moment that had no significance. This happened a good dozen or so times throughout the film with moments that were supposed to be huge emotional payoffs and ended up just feeling like footnotes on ""The Harry Story"" for two hours.This is the only film in the series where I felt like they should have actually made it longer, since instead of dragging like some of the installments it felt like so much of it was incredibly rushed to get to Harry's big scenes (several of which did drag a lot). Several of the big moments felt incredibly cheesy, but the action scenes were pretty well done other than the pauses in the middle of them for poorly delivered one-liners. My favorite character in the book series ended up being someone I couldn't have cared less about in the films and his huge moment here gave me absolutely nothing. Overall, a large disappointment to end a very disappointing series.",3.0,Anonymous,"Adventure, Drama, Fantasy"
It was EXCELLENT!,"I'm a big harry potter fan since the first movie, it gave me thrills and excitement. It was so sad that this is the end of the movie series. Daniel made an incredible job in portraying Harry Potter. Rupert is so funny, he made Ron Weasley a great man. Emma as Hermoine is the BEST! She did an amazing job in every movie especially in this movie where she gave 200% of her effort! The sounds and the visual are great. The effects are so amazing, every scene is worth the watch. The other cast is great as well as the main characters. Everything in the movie was magnificent! The directors, producers and every staff made a wonderful job. If I were you, I will watch it in cinemas and buy a DVD. It will never get old even you watch it 50+ times.",10.0,Anonymous,"Adventure, Drama, Fantasy"
"WOW, dark and amazing,,,","I'm not a huge fan of the harry potter's movies, i love the books more than the movies, but I have to admit hell yeah I loved this movie. Nowadays i'm in Egypt_thanx 2 my dad_ I decided to go to the cinema, from the first scene of the movie i was like glued to my seat, I loved the dark atmosphere of the movie, it gave another taste to the movie, another thing is the battle scenes i was blown off how amazing are they, the only drawback is the 3D thing, you know these kinds of movies needs you to be concentrated to the details and you must live the dark atmosphere that this film provides, but the 3D effects weren't bad but I'd prefer if the released it in 2D but whatever money talks in these situations. So this weekend get your mates, family or whatever go to the cinema, and watch the damn movie, if you don't watch will then you'' loose a lot, i grantee that you'll enjoy your time, yup this franchise couldn't better than this.",10.0,Anonymous,"Adventure, Drama, Fantasy"
I had a marvelous time.,"Everyone returns, including the brother and dead sister of the beloved Professor Dumbledore, who live in an oil painting, and even the ghost of Dumbledore himself, played once again by Michael Gambon. Hogwarts is now in the malevolent hands of the sinister Severus Snape (hissing, sniveling Alan Rickman), who is holding students and staff hostage as they wait for Harry to rescue them. The walls and platforms that hold up Hogwarts crumble and collapse like Tinker Toys in a masterpiece of destruction, turning the school of magic into the world's most colossal rubbish heap. A humongous man-eating snake with fangs that strike the audience in 3-D almost devours Hermione, while Ron narrowly escapes a cauldron of flames on a broomstick. With Hogwarts gone and almost every member of the cast killed off by Voldemort, there could obviously never be another installment. But there's still time for tender-hearted Professor Minerva McGonagell (Maggie Smith) to save the day with a spell she's been waiting for years to try. There is even a flashback that explains the sinister role Snape played in Harry's life story that I found unexpectedly touching. The only thing left to do to bring this saga to a heart-stopping conclusion is for Harry to enter the forbidden forest of death like a true hero and face his destiny with Voldemort, played one last time by the hatchet-faced Ralph Fiennes, who actually shows his human side for the first time. Frankly, I'm sorry to see him go.None of it makes one lick of sense and a lot of the dialogue is pure jabberwocky, decipherable only by those who know the books by heart. This includes billions of rabid fans, so I don't think anyone is even slightly worried that a little formality like incoherence will affect the box office. The movie never wore out my patience like Part 1 did, because the awesome effects take over where the plot used to be, and although this is the end, my guess is that it will fire the imagination for years to come. What fun to feel like a kid again. I had a marvelous time.",7.0,Anonymous,"Adventure, Drama, Fantasy"
David Yates Conjures A Magnificent End to A Renowned Book/Film Series,"Since 2001, I've watched every Harry Potter film ever made. Now here's something that can be difficult to put in proper words. I'm just... in complete shock and have to say that it's an astounding and compelling end to a famous franchise!The top film critics were absolutely right about it all. The series started off as a lighthearted piece where we got to know the young cast, but as the movies progressed further into a darker tone (with ""Prisoner of Azkaban"" director Alfonso Cuaron starting it there), we see this cast growing up before our eyes, delivering such wonderful performances. It was certainly not overacting, director David Yates turned it all around with such finesse ever since he took control of 2007's ""Order of the Phoenix.""The final duel of Harry Potter vs. Lord Voldemort has finally arrived and I was at the edge of my seat anxiously waiting to see the end result (I could literally hear some people gasping, slowly cheering, and even a small handful of them tearing up).I've read the original book of ""Deathly Hallows"" and there were quite a few changes that occurred in the movie (though I won't say what those are). Point here is, it's very intricate to interpret this particular book into film, but at least this adaptation kept as closely as it can to the original. Daniel Radcliffe, Rupert Grint, and Emma Watson have permanently solidified their careers, thanks to the franchise that has shaped them as we see today!With great robustness in the story both in triumph and tragedy, author JK Rowling certainly brought us to our knees begging to see more.",10.0,Anonymous,"Adventure, Drama, Fantasy"
