title,content,rating,username,genres
3D version not very exiting,"I've watched the movie in a 3D version. During the movie I noticed that quite often you see a sort of Schiller like theater setting in layers appearing on the screen. First layer is sharp, other layers are often not sharp. In photography terms we call this the depth of field. I actually haven't given 3D a lot of thought since it came available, but seeing The Deathly Hallows I realized that when you watch a 3d movie, you want a high level of dept of field. In that case most layers will be sharp giving you a good 3D experience of the movie like looking through a window. Lot's of detail become visible. As the Deathly Hallows don't often use a high DOF, I can't recommend the 3D version as an extra feature to the movie experience, often it's rather annoying to watch this version compared to the 2D movie.",6.0,Anonymous,"Adventure, Drama, Fantasy"
Loved this movie,"I Loved this movie, it was brilliant or it was hundred more times brilliant that i thought it would be. And this is a must see movie so please go and book tickets and see the movie. And lets do this movie the best Harry Potter/And any other movie that exist in IMDb, I think that this movie deserves a 9.2-9.4 something like that so lets set a review to this movie and try to do this the best movie ever! Im not saying this cause I'm a Hp fan its much more then that, If I didn't like the movie i would say give it bad result's, bur as I expect it was amazing amazingly done, and I think every Hp fan and not Hp fans will think so, cause one of my friends didn't like harry potter, bur when he tried to see this he thought it was amazing, but he didn't like the previously movies so much! So ya go and see the movie.",10.0,Anonymous,"Adventure, Drama, Fantasy"
Wizard ending,"Knowing in advance both how the story goes (and with J K Rowling on board as a co- producer, that it wasn't going to be changed much) and naturally how it ends, it was incumbent on Peter Yates to nonetheless deliver the big finish to Harry's adventures and in particular his final showdown with Voldemort. I wasn't disappointed and in the end had only minor quibbles about the resolution.The dark atmosphere from Part 1 is continued with the action mostly played out in scenes of brooding darkness and to the background of weighty soundtrack music. There is noticeably less of Hermione and Ron, which is only right given the necessary one-on-one fight with Voldemort at the conclusion. While that duel, with shades of Holmes and Moriarty, was always going to be the climax here, I enjoyed the build-up to it, with the escape from Gringotts, Snape's revelatory Pensieve memories, Harry's supernatural interviews with Rowena Ravenclaw (and Dumbledore), plus of course the blowing-up of Hogwarts all contributing to the excitement and anticipation.Rowling herself has stated that from the first, she had a clear vision of Harry and Voldemort's final reckoning with both of them circling each other in a blasted landscape and this was exactly what was delivered. I did however feel confused if not cheated as to how the Elder wand reverted to Harry, when all along Voldemort had made such a strong claim for it, but still the Evil Lord's demise was spectacularly satisfying when it came.My only other carps were the pointless inclusion of the 19-years-on epilogue, which added nothing and detracted from the high point achieved with the death of Voldemort (I know it's in the book, but it told us nothing important - as if we didn't know they were all going to live happily ever), the abbreviated round-up afforded different characters from previous episodes, especially Hagrid, the Weasley parents and Jim Broadbent's character, plus it can't be denied that the three main characters by now seem too a little old for their parts (although it's not their fault that the time needed to create such large-scale movies by- passed their characters' natural time-lines) and my old caveat that too many of the supporting parts were played by too-familiar faces from British acting royalty (it's a wonder Judi Dench didn't get a look in).But in the whole this was fantastic entertainment and a worthy finish to the saga, which I hope they don't spoil by rebooting sometime in the future.",8.0,Anonymous,"Adventure, Drama, Fantasy"
Satisfying conclusion,"Thus endeth one of the most popular - and profitable - series in movie history. And the good news is that it ends more with a bang than with a whimper. For once we push through the clutter of wand-waving, spell-casting and jaw-dropping CGI effects that have been the hallmark of the works, we're left with a moving, deeply human tale of an honorable man (Daniel Radcliffe) putting his life on the line for those he loves.The movie finally reaches the climax that the series has been leading to all along: the fight-to-the-death battle between Harry and his arch nemesis, Voldemort, the man who killed his parents. The one criticism one might have with this scenario is that it essentially reduces most of the other characters - including the lovable Ron (Rupert Grint) and Hermione (Emily Watson) - to mere onlookers of the action.As directed by David Yates, ""Harry Potter and the Deathly Harrows - Part 2"" has drama and action to spare, but it's the human element - along with an epilogue that hits all the right notes - that brings the beloved series to such a satisfying conclusion.",8.0,Anonymous,"Adventure, Drama, Fantasy"
"""The Return of Harry"" or... and so ended a genre-defining saga...","Well, well, well...After an epic seven-movie tour into the world of Harry Potter, here comes the final and so overwhelming conclusion of not only a decade-defining but a genre-defining franchise.Author J.K. Rowling not only revolutionized children literature through her winning streak of best-sellers but inspired what would become a landmarks of a genre relying both on spectacular special effects boosted by computer technology but traditional three-act structure (exposition with the first three films, second act starting halfway through the fourth, and the climax in the last two films) with all the compelling elements of storytelling: the fight between good and evil, the coming-of-age and the whole escapism into a world never seen before. Like Lewis Carroll, J.R.R Tolkien and George Lucas, Rowling created a whole new universe, a myth.Hogwarts, Dumbledore, Gryffindor, Aveda Kadevra... and so on and so forth, all these words have become part of an international lexicon, a staple of pop culture bound to be passed from generations to generations and to enchant children and adults all over the world. It is no surprising that the film concludes with Harry, Hermione and Ron playing grown-ups taking their children to Hogwarts through platform 3/4 like in the first film, we've all grown up watching Harry, Ron and Hermione from their baby-faced years to their maturity, and then will come a time where we'll look back at the 2011 film with equally powerful nostalgia. Oh yes, I'm sure the films will all live up to their reputation in nineteen years... and beyond.And from that emotional finale, we guess that Hogwarts have probably been rebuilt and the harrowing and deadly journey that culminated with the final fight between Voldemort and his forces of Dark magic and the resistance that combined all the cumulated knowledge of centuries of wizardry will be part of the new mythology. And I feel less like reviewing the film than concluding my seven reviews by saying that the franchise couldn't have a better conclusion. For simple reasons that don't take much analysis: first of all, it is set in Hogwarts, and while it's heartbreaking to watch so many places we're familiar with being reduced to ashes or ruins by bolts of lightning and random attacks, it's captivating to watch all the players defending the place to death.And there are deaths. Many are particularly tough to handle. And for those who have the chance to live, the story provides them chances to outdo themselves, Neville ends up having one of the most interesting arcs in the series, Mr. McGonagol and Mrs. Weasley have also their moment of awesome, and there are two reveals about Dumbledore and Snape that made me question my previous reviews and the way I instantly jumped to conclusions, underestimating Rowling's smart writing. I knew there was something enigmatic with Snape from the very start and by maintaining such a mysterious character for so long over the series, Rowling proved that she didn't have a talent for writing stories but also -as it's the case with Harry Potter- stories within stories.And this ""Deathly Hallows Part II"", as far as storytelling is concerned, is fueled with spectacular action like a fitting climax, it doesn't waste time for exposition as no introduction is needed anymore, we're already familiar with the characters and the themes. So the film plays like ""The Return of Harry"" echoing the Jedi's or the King's. And for all the action-packed scenes that are traditional offerings but never get ""routinely"", the integrity of the narrative is maintained. And the heart of the story is kept as well through reveals of relationships that were the core of the saga all along. Reading about Rowling that she lost her mother of Multiple Sclerosis before she could enjoy even the first book broke my heart but it might have shaped her inspiration when writing about the relationship between Harry and her mother, and a few other characters, or even between Harry with Voldemort.And one can't of course review this film without praising Ralph Fiennes's performance. The actor's been kept away for too long to finally implode, proving to be more than a menacing presence. He steals the show with a glare, a joke, or his hideous nose-less face... it's like the film or the book couldn't fail because it had just the perfect villain. As they say, a film is as good as its villain... but it's also as good as its ending, and while not all the chapters of the saga are equally entertaining, this last opus is a masterful conclusion and I understand now why it's the only one to be on the Top 250. It's entertaining, thrilling, suspenseful, sad, deep and comes full circle through an ending where you can't just help but shed a tear while saying goodbye to these character we've seen evolving from their childhood and even when the wizardry world was as its ""infancy"" from our perspective.How fitful that the ending scene is in a Train Station, like Hitchcock another master storyteller, Rowling loved trains and it was trains that inspired her the first vision of Harry Potter, a kid taking a train to go to a wizard school... it's only appropriate that the film would end with that note, maybe telling children that everything is possible, that they also can have their own ""train"" of inspiration and image a little something that can grow out of magical proportions. She wanted a character who could do something she couldn't: fly, she created Harry Potter and became an inspiration, a billionaire, and a name that would be mentioned in the same breath as Tolkien when fantasy literature would be approached by fans or scholars.If only I let my curiosity win over me and watch the first film, I can't believe I waited so long. Maybe I should take it as a lesson now and give a try and watch ""Fantastic Beasts"".",10.0,Anonymous,"Adventure, Drama, Fantasy"
Much Better Than Part 1,At least this 2nd film feels like a Harry Potter film - I couldn't say that about Deadly Hollows Part 1 (which bored me). This film feels like Harry Potter again - particularly the climax. I was a bit shocked at how the story played out - was a good ending.7/10.,7.0,Anonymous,"Adventure, Drama, Fantasy"
Harry Potter,"Very good movie with very good end, nice CGI and very good actor's. I suggest start with first one.",10.0,Anonymous,"Adventure, Drama, Fantasy"
"Good, but not Spectacular","I like many other fans went into the midnight showing of this with very high expectations. I was looking forward to amazing battle scenes from all the various wizards at Hogwarts. I was very underwhelmed by the action sequences. They had all been done before. I was hoping for emotion from the defense of the castle. The deaths of major characters were just glossed over in about 30 seconds. I remember reading the book and being heart broken when people died, and I didn't feel any emotion during the movie towards them.Don't bet me wrong, I enjoyed the movie. I just craved more! I almost felt like there should have been a colaboration with Michael Bay for the action sequences, to make them bigger and just more spectacular. I mean Hagrid had like 3 lines and didn't show up until like 3/4 the way through the film. I felt if they would have added another 20 min of action it would have been a spectacular film for the ages. As of right now, I see it just as OK.",6.0,Anonymous,"Adventure, Drama, Fantasy"
"Good, but lacking the gravitas required to be Great.","Harry Potter and the Deathly Hallows part II was always going to be big and epic and pompous, all of which it delivers. It was also going to be the movie that ends the Harry Potter series, which is something it struggles with a bit more.Beginning with a brief flashback of part 1's final shot, the movie picks of exactly were the last ended. It does so though, without ever feeling forced or abrupt, rather letting the first five or ten minutes be conversations (Griphook and Ollivander respectively) before turning the heat on. After that, the movie attacks you with such ferocity you barely breathe until the ending scene.However, the action is always controlled. This could easily have been destroyed by trying to make it into a classic war movie, but though Yates dips in with plenty of battle scenes, he never goes the full Michael Bay. All in all, you end up feeling they might have shown more, letting a few key deaths happen off screen, but for the all-important PG-rating.As for following the book, from the start of it keeps the distance needed to make it film able whilst still remaining true to the material. As we near the end of the battle it differs even more, yet still letting the events happen more or less like in the novel, and though it differs most in the climactic showdown, fans of the novel will be delighted to know the epilogue is translated nearly word by word.The performances are stellar; Maggie Smith shines, as does Matthew Lewis and Radcliff does his best to carry the movie, a feat in which he mostly succeeds. For me though, the standout actors are, of course, Alan Rickman, giving his Snape a whole new dimension, but also, possibly surprising; Cieran Hinds as Aberforth Dumbledore. It isn't a big role, but he portrays it with such charisma and gravitas (especially one fantastic shot) I ended up wondering if he wouldn't have made a better Albus than Gambon. Alas, to late for that now.Despite this I have only given it a 6. Why? Because it lacks the soul and warmth it should have had. Sure there are scenes (the forest springs to mind at once) that puts pressure on your tear canals, but it isn't enough, there is not a strong enough feeling of conclusion, it just doesn't quite deliver. In the end, it never manages to top the ending from Philosophers Stone.As a conclusion, it is the same old criticism that has plagued the movie-series – the books were better. And though it is magnificently grand and spectacular, it sadly never really becomes the ""Return of the King"" it ought to have been.",,Anonymous,"Adventure, Drama, Fantasy"
Astonishing,"When I watched this film for the first time, my expectations were actually very low, since I knew what they've done to the books in film six and seven. You have to know that I'm always quite finicky about the correct transcription of literary material into films. But compared to the former Harry-Potter-Films, this one is quite close to the book on which the film was based (comparatively).All in all this last film is fairly good. It is thrilling, the effects are great, the book was not completely shredded. So even if you don't like adaptations, this one is quite viewable.I hope there are not too many mistakes in my text. If there are, I'm sorry, but I'm no native speaker.",6.0,Anonymous,"Adventure, Drama, Fantasy"
PERFECT ENDING.,"A perfect way to end the saga. Epic climax. Gonna miss these films, but cant stop rewatching the whole story again and again.",9.0,Anonymous,"Adventure, Drama, Fantasy"
It's a nice wrap-up.,"I've been a fan of the Harry Potter series from the start. Not a huge fan, but I've watched them all and I've enjoyed most of them.If I were to the describe this movie as short as possible, I would say it's ""a Harry Potter movie"". It's almost a niche genre. You know what to expect at this point. The movie doesn't stray away from the others, and it doesn't try anything knew. But it wraps up the story quite nicely in a believable way.There are a few things that were a bit unsettling, but I wont spoil anything.If you are like Harry Potter movies and some intense wand action, give it a watch!",6.0,Anonymous,"Adventure, Drama, Fantasy"
beautiful and perfect way to finish 10 years of work,"I am a huge Harry Potter book fan, and have always been a bit disappointed with each film. There has always been key aspects left out, bits that weren't put together as well as the novels, etc. But coming into this film I was hoping to not leave the theatre thinking, I wish they had done this or that, and after waiting in line for 7 hours, I left the theatre with tears in my eyes and a feeling of utter content. Through out the movie each piece that has hung in the air through out all 8 movies, was finally tied together, finally you were able to understand what everything was for and why it happened that way.The film finished with perfection, and although much did differ from the novels it was changed only for the better, and in this case (unlike in past movies) they actually succeeded in making that change, BETTER.I recommend not only seeing this movie as soon as possible, but if you are not too familiar with the Harry Potter tale, please go to a block buster or a book store and either watch or read this series, because it is truly a masterpieceGreat way to finish the series, and i'm truly saddened that it is time for goodbye.",10.0,Anonymous,"Adventure, Drama, Fantasy"
Must see! A great ending to a spectacular series,"The end of the Harry potter series has now come, but the last film will surely make it one to remember. At least for myself I can say that I had quite the adrenaline rush to see how Harry Potter and his brave companions would destroy the remaining horcruxes and at last kill Voldemort. I must say Director David Yates really gave the much anticipated film it's character.The film started literally where it took off in part 1. Voldemort got his almighty powerful wand and it seemed that chances were slim for Harry to succeed the dark lord. If you have not read the book, I won't drop a spoiler rather tell you that the young Hogwarts students have it in them to give the dark lord a run for his money(power).What really gave me the chills was when Harry & Voldemort fought for the last time. Ten years we have been waiting to see what happens and trust me, it's worth the wait! I was in shock when I found out what happened to Harry before this, I would've never guessed.Overall, 3-D is great, action is amazing, and the ending to an amazing saga could not be better!",9.0,Anonymous,"Adventure, Drama, Fantasy"
Outstanding Movie!!!,"Harry Potter and Deathly Hallows: Part 2 is an Outstanding Movie.Many surprises gonna shock audience in this part. Specially real character of Snap is revealed in this part, i think which is the best part of the Movie. The secret of the death of Headmaster(In Harry Potter 6) is also shocking. Death of some characters is not so appreciable. But all over the final part will be the biggest hit of the series.It's Oscar Winning Movie. Acting of all the actors are outstanding. Direction of the movie is very good. Music and Special Effects are really mind blowing.The Perfect End of the series of Harry Potter. I can say that ""It couldn't be better End than this"". It's really a must watch movie.",10.0,Anonymous,"Adventure, Drama, Fantasy"
Possibly the best in the series,"I watched this movie on July 13th, in Denmark. It was absolutely magnificent. The 3D was great. The movie was very dark and tragic, and they had still managed to add humor to the story. It was very enjoyable. For those who have not read the books, there will be surprises that you cannot foresee. For those who have read the books, the surprises will be well done. This is perhaps the only movie that tells the story with all the detail and beauty that it should be told. You're in for a thrilling end to an amazing series. The acting was fantastic, the special-effects wonderful and the lines and sound was captivating. I am a dedicated Harry Potter fan and have been for 11 years, and when the Credits rolled, I cried. Beautiful movie, well-worth watching again, and again, and again, and again, and again...",10.0,Anonymous,"Adventure, Drama, Fantasy"
Much improved over Part 1 and a rather satisfying way to go.,"Aaaaaaaaahh redemption. Much improved over part 1. The acting and dialogue were still a bit stiff and my comments previously on how magical combat it handled still stands but there is much more going on this time. The battle of Hogwarts was surprisingly rather well handled. Despite my issues with the combat, there were some little bits of creativity like a quick time freeze and large fiery beasts. Although basic, the terracotta army was pretty cool to see also. Many character deaths made the stakes and consequences feel more real adding some emotional depth that wasn't there for me in part 1 (other than Dobby). The action was much more competently filmed but there were quite a few moments where it felt like the extras were running or standing around not doing anything. More of a nitpick though.Overall a rather satisfying end to this cultural phenomenon of a franchise. I still think there was a lot of missed potential in terms of magical creativity but I'm glad I finally got around to seeing Harry Potter off.",7.0,Anonymous,"Adventure, Drama, Fantasy"
"A heart touching send off to the series, but can't stand on it's own feet","Deathly Hallows Pt. 2 is the epic conclusion to the movie series, and the final piece of the Harry Potter lore. It was a great and heart touching send off, with many tears shed.The movie clocks in at 2 hours and 10 minutes, but I really wanted it to be much longer than that. For a final movie that says good bye to the characters, a lot was cut out from the book, and many deaths of important characters( not spoiling who ) were not, how do I say, good enough. You'll see.Reading the book, I almost cried because the preparation for the epic battle was awesome, and the battle itself ( in the book ) was explosive, full of action, and full of tears, laughter, and danger.In the movie however, the battles take place in the background, while the Harry and the crew go and hunt onward. This scaled the epicness back for me, and had me wanting more. The book explained much more in detail, and I hadn't read the book, I would have been lost. My friend hadn't, and all he did was ask questions after the film was over.The movie was a good time, a sad time, and a good enough send off to this series of wizards and witches. I just wish it had more substance, more to give the series an epic final goodbye, like the Lord of the Rings series did. I'll take it for what it is, and this film will be remembered for a long time.",,Anonymous,"Adventure, Drama, Fantasy"
Its Voldermort not MR bean!!,"They movie is excellent to begin with! They did justice to it as both a movie for children and adults! Thought the ppl who read the book must have been disappointed with the climax. 1) its voldermort and not Mr Bean!! Voldermort looked like a joke!! Hugging malfoy like an old freak?? seriously?? His laughter had no sinister feel behind it!2) Harry and voldermort diving!! its good but seriously they should have made harry call voldermort as Tom riddle in front of everyone!! Those precious dialog were cut!3) The final fight when o one was watching?!?!! and after that he just walks in great hall and every one is busy relaxing!! No hugs or anything!! its Voldermort who is killed not a next door punk!!4) Lupin,Tonks and Fred deserved extra 5 minutes of attention!!5) Hogwarts seemed empty when harry walks to surrender himself to Voldermort and HErmoine n Ron let him go??Where is the invincibility cloak??6)No Grawpy and cenetaurs!! what happened??7) Lupin mentioning Harry as god father must have been there!! Also Snape communicating with Dumbeldore portrait and asking if he doesn't have any soul!!These in all would have added an extra 15 minutes! But at the end of the decade and one the most popular series, IT REALLY DESERVED THOSE EXTRA 15 MINUTES.PERIOD. MY RATING-8.0...",10.0,Anonymous,"Adventure, Drama, Fantasy"
Epic Performances,"The film was epic. I am a huge fan and arrived at the theater at noon dressed up in anticipation. However, nothing could have prepared me for this. It was incredible. Enjoy and savor it. You will not be disappointed in a single performance. The kids have grown so much over the years and Alan Rickman gives one of the performances of his career. Very very rarely do you gerecieve the opportunity to witness the total completion of something that you have loved for more than 10 years. Especially on screen. While many tears were dropped, it is a feeling of completeness. Those who worked on it should be more than proud as it was an honor to watch.",10.0,Anonymous,"Adventure, Drama, Fantasy"
