title,content,rating,username,genres
Amazing finale to a great franchise,"""Harry Potter and the Deathly Hallows: Part 2"" was yet again directed by David Yates and is the second part of the seventh instalment of the franchise. In order to finally defeat Lord Voldemort, Harry Potter and his friends have to find and destroy the remaining four Horcruxes. Little do they know that the Dark Lord is in possession of the strongest wand to ever be created - the Elder Wand.This is it, the big finale everybody has been waiting for for nearly ten years and it delivers. All the previous movies have set this up to be the big showdown the series deserved. The only thing that feels lacklustre is its pasting. At times this film can feel a little rushed, as there is still a lot to cover (the destruction of four Horcruxes) over the rather short runtime (at least for a Harry Potter movie) of merely two hours. This is just a minor issue I have and is probably a result of some other movies not contributing as much to the set up of the finale as they could have. Nevertheless this is still a brilliant ending to the franchise and overall an amazing movie.",8.0,Anonymous,"Adventure, Drama, Fantasy"
"My favorite in this movie franchise, probably the best movie of summer 2011","I was never really a fan of Harry Potter and especially the movies. But I gotta admit this final installment was just awesome. It wasn't as epic as I thought it would be but it's still epic. The plot also has some very emotional twist and turns that will make some viewers cry a little while watching. The girl next to me couldn't stop weeping. The special effects are top notch and the acting is the best in this franchise. I never thought I would be sad to see this franchise finally end. But during the final scene it was sad...Well just slightly that it's the end. One big gripe I have is how some of the main characters gets killed off way too easily and some even off screen. Anyways that is just a small complaint, overall this is a movie that is worth seeing it in theater. It's a great conclusion to this popular series.8.4/10",8.0,Anonymous,"Adventure, Drama, Fantasy"
Great as the book,This part of the deathly hallows is splendidly done. Even some parts I think the movie showed it much better than the book like the battle of Hogwarts in the movie it was magnificent. Both the movie and the book completed each other. Also it was very touching at the end when Nivel killed the snake ( for there was 2 boys born on the same day and both had part of killing the one who must not be named ),9.0,Anonymous,"Adventure, Drama, Fantasy"
Wizard,"The best movie ever! 
I grew up with the characters :) 
One negative thing, they didn't mention Dobby's love :( but it is in the book!!!!",10.0,Anonymous,"Adventure, Drama, Fantasy"
"It is the quality of one's convictions that determines success, not the number of followers.","So here it is, the 8th and final instalment of a film franchise that has lasted 10 years and runs at just under 20 hours in total. Following straight on from the frustratingly incomplete scene setter that was Deathly Hallows Part 1, we continue to track Harry, Hermione and Ron as they search for the remaining Horcruxes that will render the evil Lord Voldermort as a mere mortal. This narrative thread is run concurrently with the Voldermort movements, where he now has in his possession The Elder Wand (the wand to rule them all) and has gathered a vast army to descend upon Hogwarts and achieve his ultimate goal of killing Harry. Meanwhile vital character story arcs are filled in and secrets will out...David Yates directs and Steve Kloves adapts to the screen, both of whom were perfect choices given their considerable input to the series. Smartly the pic has been kept to a 2 hour and 10 minute run time, and thankfully it flows nicely and the pace never stalls. Being one of those who has never read the books I can't say what has been left out or if anything has been tampered with for dramatic licence? What I know for sure is that the emotional investment garnered from being with this story for so long, to be part of these characters lives, watching them grow, ensures that this closure piece pounds the senses. Sitting down to watch it you realise that we are going to lose people we care for, and Hogwarts, the wonderful place we fist glimpsed across the night time water, is going to be attacked and reduced to a battle scarred place of war.As the effects work dazzles and the one time child actors come shining through as mature actors who have casted off previous wooden traits, the story filling strands show just what wonderful work Rowling achieved on the page. Some of the characters never stood a chance in life, some carried deep emotional scars, and others held secrets so crucial to the whole Potter universe. For a series of such fantastical genre sparkle, the Harry Potter world eventually reveals itself to be a deep and fortified humanist drama, and engaging it most certainly is. That this is achieved as battlefield carnage is raised, with wand wars booming up on the screen, it means credit is due to all involved in the making of such a cherished and intensely followed Octalogy.Is it the earth shattering finale one hoped for? Well not quite. Story wise for sure that is the case, but with the whole story driving towards the final battle between Harry and Voldermort, it's disappointing to find it's rather brief and in truth anti climatic. Harry the boy now burgeoning into a man versus the snake faced despot surely should have been a crowning glory, but sadly not so. To compound this irritating disappointment, we then get the epilogue that is bogged down by aging make-up design that is almost laughable. But these are just annoyances, not film killers, for this has been a magical ride for 10 years. Fans will feel a gap in the heart now it's over, maybe even shed a Snape like tear as well? Yet ultimately it has been a triumph and the rewatchable factor for the whole series will always remain high. 8/10",8.0,Anonymous,"Adventure, Drama, Fantasy"
Well...,"I don't really know how to describe this movie, so I'll make use of my Spanish and say that Part II was ""asi-asi"". Yes, it is arguably the greatest saga ever told, probably the greatest I will be alive for, but as a stand-alone movie, it was mediocre. The writers/director overlooked numerous subplots from the book, and the movie felt a little impersonal. When the big battles come, and you are watching characters you fell in love with almost a decade ago meet an untimely end, you don't get very emotional like you should because it all happens so fast. Half of the heartfelt moments of the movie are basically summed up in one or two lines with melodramatic acting/writing. Not a terrible job by any of the actors, but this movie deserved a better effort all around. Not Oscar worthy in the least bit, not epic enough in the least bit, but not worth avoiding. Despite all my negative words, I do not believe this movie did harm to the Potter series, it just should have been better. I give it a 7/10 because I still enjoyed my movie going experience.",7.0,Anonymous,"Adventure, Drama, Fantasy"
Awesome Movie,"Tyson Edou Civil ""The movie was the best i have ever seen it was awesome Every single tiny thing comes back later, it's absolutely amazing. I think it was amazing, the best film I've ever seen. I have watch this movie all part from beginning to End may be many times. when i have get some free time i preferred to watch Harry Potter Movies. Hermione Granger is the best character of the film i liked.""",10.0,Anonymous,"Adventure, Drama, Fantasy"
It was magnificent.,"I've seen it and after reflecting on it, and indeed the entire series, I don't think I have very much to say. There are heaps of people who have valid criticisms with both the books and especially the films. Neither are perfect. I always thought the films were mainly targeted towards the existing fanbase as opposed to reaching out to an ignorant audience. I think the films can be forgiven, then, for not always doing the books complete justice. But despite those flaws and more, I was left deeply touched by the end of it all. And that's all that matters to me.It's not a critique. I'm totally biased. And it's the 9 year old child in me telling me that. It's been a huge influence in my life. I was never encouraged to read or to write as a child, and the first Harry Potter novel was my first real exposure to any kind of literature. Because of that, I can't help but associate writing as being something magical and wondrous. My first stories were Harry Potter fanfics. I credit my love of English and my passion for writing to those wonderful books. So yeah. I loved the film. I love the films. I love the books. I'm a hopeless and shameless supporter. And I'm very grateful for the impact it's had on my life and many, many others. That is what, I think, will be remembered.",,Anonymous,"Adventure, Drama, Fantasy"
Just The Send-Off That The Series Deserves,"The final chapter of the Harry Potter series approaches in which Harry (Daniel Radcliffe, Now You See Me 2), Hermione (Emma Watson, Beauty and the Beast) and Ron (Rupert Grint, Driving Lessons) must locate and destroy the remaining Horcruxes to weaken Voldemort (Ralph Fiennes, The Grand Budapest Hotel) so that they can defeat him leading to the saving of the wizarding kind. Though mixed feelings and thoughts flood the last Harry Potter movie because of how dark it is compared to the book and all the missed opportunities to follow the book more, though it is still amazing and just the send-off that the epic series deserves.",9.0,Anonymous,"Adventure, Drama, Fantasy"
Wow what a finale,"I firstly need to say this...reading so many reviews on this and any film that people always forget a few things...1..any film made after a book and based on said book is just that 'based on' so it wouldn't be the same.2...a review is a little about what you enjoyed and how and why you liked it so others can with an open mind watch the film for themselves and make their own judgements.So the film...it for me was fantastic, I have seen the series around 25 times now and at least 4 times at the pictures for all 8 and I love them every time. I can remember seeing these as they came out every year and as we approached this final film I was scared, sad, excited and thrilled for its release and like many I left the cinema in tears and sad that it was all over.In this final part Harry and friends have to find and destroy the remaining Horcruxes and many things are learnt about some that will shock you and at the same time make you sad as you would now see that certain people were actually Harry's friend not foe. We then see an epic battle and it's all centred around Hogwarts with virtually the whole cast from all the films returning.It's exciting, sad and thrilling to watch and the ending wasn't needed in my eyes but it worked.I do think that this series of Harry Potter is the only series of films that either remained as good each sequel or got better. Warner and J.K. Rowling deserved to be knighted for such a spectacular set. Well done",10.0,Anonymous,"Adventure, Drama, Fantasy"
It all ends here...or in 2024.,"I admittedly didn't fully appreciate this film until after a rewatch, but it builds on everything the first movie presented in compelling ways. It's like a ""Battle of the Five Armies"" before ""Battle of the Five Armies"" and I admittedly prefer that movie. For being an action montage, it overall punches its audience in the gut with emotional stakes while still being a blast to sit through.",9.0,Anonymous,"Adventure, Drama, Fantasy"
"Every little thing he does is magicget it, like the song?","Finales of this magnitude usually come about once every few years for television shows, but very rarely for feature films. However, this is most certainly the case for the epic conclusion to the Harry Potter saga, filled with equal parts fan-servicing closure and genuinely emotive scenes for those less devout followers like myself. Personally, the film falls short of being the ultimate achievement in filmmaking it would've aspired to, but that does not mean it wasn't an exciting and overly engaging movie from start to finish.Part 2 picks up right where its predecessor left off, with Voldemort (Ralph Fiennes) celebrating his theft of the Elder Wand from Dumbledore's tomb. Cut to our three heroes Harry (Daniel Radcliffe), Hermione (Emma Watson) and Ron (Rupert Grint), who must find and destroy the last remaining Horcruxes: a collection of rare items and the only things keeping Voldemort alive. And during the climactic battle between good and evil, we learn the all-important secrets surrounding Harry, Voldemort, Snape and other key players in the Potter universe.In fact, one aspect Part 2 conveys better than any other film in the series is the hero-villain relationship. It only makes sense that a film that has had so much time to flesh out its characters should develop some sort of key bond between the two rivals; one that goes beyond the stereotypical battle of good versus bad. I likened the situation to that of Star Wars. We know exactly what the respective hero and villain stand for, and yet they are more alike than perhaps either of them even want to acknowledge. My apologies if this sounds a little cloudy, but I risk getting blown to bits in a minefield of spoilers if I keep rambling on.I love to see filmmakers taking steps to initiate innovation in directing, and David Yates must be accordingly credited with presenting a unique plot structure. Rather than possessing a clear beginning, middle and end, this film starts off with a short introduction and a set piece at Gringotts Bank (where a Horcrux is hidden). From there, the next ninety minutes play out as one enormous set piece inside Hogwarts, combining the fight for the school, search for the remaining Horcruxes and Harry's date with destiny into a grandiose visual spectacle.But that doesn't mean the film lacks substance when it's needed. Granted, I felt little sympathy for most secondary characters that were lost, but Harry's delving into Snape's memories (revealing the true colours of his character) is arguably the strongest and most poignant scene of the film. Coupled with Harry's vision of his dead parents before facing Voldemort in the final act, the greatest achievement of these scenes is that they evoked sympathy from someone who did not expect to become so emotionally attached to any character.The film does temporarily fall into the trap of playing out like a video game considering the task of moving from one Horcrux to another: items that are nothing more than MacGuffins at their most basic level (see: Sucker Punch). This can detract from the pacing at some points, especially since the film tends to intercut between the revelations of Harry's past, and his friends' efforts to destroy the items which, by comparison, seem far less integral to the plot.Script-wise, Part 2 treads water, delivering a decent screenplay that dosen't exactly stretch one's imagination. It can become rather stale (after a while everything becomes 'brilliant' this or 'bloody hell' that) but overall it isn't a huge concern. What was disappointing, though, was the cheesy 'nineteen years later' epilogue. Aside from the obvious fact that no-one looks as if they've aged a day, it serves no real purpose in the film, and does nothing to dilute my general hatred of tacked-on 'and then this happened' scenes to close out a movie. Still, a solid effort, and a fitting end to an imaginative series.*There's nothing I love more than a bit of feedback, good or bad. So drop me a line on jnatsis@iprimus.com.au and let me know what you thought of my review.*",7.0,Anonymous,"Adventure, Drama, Fantasy"
Deathly Hallows Part 2 a big disappointment,"Just like the previous 2 Harry Potter films Deathly Hallows Part 2 was a big disappointment. Again many important and dramatic parts of the story were left out. So many things were changed from the book itself, and that took away so much from the story and made the movie disappointing. I can't understand how so many people found this movie to be so wonderful. I found myself during the movie just shaking my head at how things were done in the movie. If you have read the book and enjoyed the story you will probably find this movie to be so disappointing in so many ways. Don't take my word for it though. Go and see it for yourself, but don't expect too much from it.",,Anonymous,"Adventure, Drama, Fantasy"
LEGENDARY!,Best cinematic universe out there! Thank you J.K Rowling.,9.0,Anonymous,"Adventure, Drama, Fantasy"
Bye,"After two super-long trailers, all the plots of the climax seem to be clean and tidy. The childhood chocolate frog jumped back into the carriage, and the train, full of the youth of a generation, once again headed for Hogwarts",10.0,Anonymous,"Adventure, Drama, Fantasy"
I can't just get enough....,"I love the series from the start, these are just incredible. I have read the whole series, watch the whole film series twice but never I felt tired. I can watch them again and again, i wanna live in that world.The way story unfolds, the way everything is connected to each other like a thread just make it so alive. The character are so wonderfully written, they all felt relatable. It felt like each if the character are just part of my own personality one way or another. I always imagine living in a world like that, with the same characters. This series revoked the will of mine to become a writer again. The action by all the actors were incredible.",10.0,Anonymous,"Adventure, Drama, Fantasy"
"Despite A Few Set-Backs, This Is Such A Good Ending For The Harry Potter Franchise","Pros:
1. The comedy produces genuine laughs and is appropriately placed.
2. The score, for the most part, booms out to add an extra layer of intensity, apprehension and excitement.
3. Once again, the special effects are wondrous and still look amazing 10 years later.
4. Daniel Radcliffe (Harry Potter), Emma Watson (Hermione Granger), Rupert Grint (Ron Weasley), Ralph Fiennes (Lord Voldemort) and Alan Rickman (Severus Snape).
5. The sound design and sound mixing is fantastic as usual, and it helps to bring so much of the wizarding world to life.
6. The tender and emotional moments send legitimate shivers down your spine, specifically when Severus Snape acknowledges his love for Lily Potter (Geraldine Somerville), and when Harry Potter is being comforted by his deceased loved ones.
7. The Battle of Hogwarts is awe-inspiring in its scope and execution, with some of the visuals being extraordinary.
8. The movie concludes the franchise greatly with the story being rounded out touchingly.Cons:
1. There is a scene wherein a spinning camera movement is implemented and it's just strange and distracting, thus adding nothing to the scene.
2. The lighting is far too dark at certain times so it makes it really hard to make anything out.
3. The score at times can either be pointlessly inserted, or it's just overbearing.",8.0,Anonymous,"Adventure, Drama, Fantasy"
go be nerdy if you have seen the other films you won't be disappointed,"So I watched the mega blockbuster finale to the Harry ""the nerd sorcerer"" Potter saga ""Harry Potter and the Deathly Hallows: Part 2"" from 2011. So was this movie good, I say abracadabra bitch, or yes in muggle speak. I have seen every Harry Potter movie and enjoyed them all. I especially like how the movies (and I guess the books to) have matured with each passing film. They also went from somewhat structured like in the sorcerers stone to less predictable and original as time has passed. I saw this last one in IMAX 3D, I personally found the 3D to not be mind blowing, which I think is common among films not shot in 3D. So if I was you I would save the cash and see this in regular boring ole' 2D. So this movie just like the others is a little dark, has fascinating characters, a mystery to be solved and mysteries to be revealed. This movie delivers these Harry standards in spades. This movie was enjoyable except for the final scene for me. I won't spoil it but it is taken from the final books epilogue. It seemed tacked on and kind of pointless. I personally think much like star wars we have not seen the last Harry Potter film. I see the next one coming in about 10 years after the next Harry book by Rowling comes out called ""Harry Potter and the quest to find something else to write that failed and the search for more money."" I think the next one should be R with a little graphic interracial (muggle on wizard) hardcore action. So this movie is a worthy ending to the series, it answers all the questions, has a wide demographic base from young to old from magic nerd to jock. So go enjoy and be nerdy for a couple of hours, but just don't start here these movies for the most part should be watched in order. if you like concise reviews of interesting films please read my other reviews at http://raouldukeatthemovies.blogspot.com/",7.0,Anonymous,"Adventure, Drama, Fantasy"
The best movie of 2011 💖,"Today is a very important day. Is the day that we celebrating the 10th anniversary for this movie, the film is the conclusion for the Harry Potter saga and one of the best films ever made in history. I didn't expect the ending to be so beautiful, whoever say that the ending of the film is disappointing maybe he lives from another planet. This movie like avengers endgame has a cinematic feat that the next generations will press. I consider it a cinematic masterpiece that will be unforgettable forever.",9.0,Anonymous,"Adventure, Drama, Fantasy"
"Superb, Awesome !!!",I totally liked it. The complete series of Harry Potter is awesome! It needed a awesome ending.. The final part of this series should be like this. HP8 deserved to be the final part of HP series because of its awesome direction.. Acting is awesome! Casting is awesome! Story is awesome! Music is awesome! Action is awesome! Direction is awesome! Everything is just Awesome!! I totally liked it. The complete series of Harry Potter is awesome! It needed a awesome ending.. The final part of this series should be like this. HP8 deserved to be the final part of HP series because of its awesome direction.. Acting is awesome! Casting is awesome! Story is awesome! Music is awesome! Action is awesome! Direction is awesome! Everything is just Awesome!!,10.0,Anonymous,"Adventure, Drama, Fantasy"
The final confrontation,"As the second of a two-part series finale, this was it. Harry Potter has to destroy the last of Voldemort's secret life forces and end things once and for all. And the battle all comes down to the showdown at the now-overrun Hogwarts School of Witchcraft and Wizardry. Who will survive? Who will die? The answers to these and all other questions will be revealed when you watch the film. There were some changes but they didn't bother me in the slightest. As the final chapter of the film series, this is how it really ends. It's been a while since I've read the book and seen the movie, but I enjoyed both and I'm not sure which is better; they're both good. If you're more of a movie buff and love Harry Potter, this is the crown jewel. Don't wait. See it.",8.0,Anonymous,"Adventure, Drama, Fantasy"
Better than the first part.,"After seeing the first part that I found boring I thought that Harry Potter part two was better. My rating: 6/10 (not so bad). My opinion about the movie is that it has very good special effects and that it is the only thing I liked the ""most"" in Harry Potter. The special effects are the most used details in Harry Potter movie and they are so excellent, especially the scene where we see the battle of Voldemort against Harry Potter and this is the scene I preferred the most in the film. It was so well done! But it doesn't mean that I found it super good. Not at all. I am not really a fan of Harry film. I never really understood the Harry Potter stories and it is too difficult for me to understand and to make sense with it. Probably because, I never read any of the books. Harry Potter is a very violent film with a lot of bloody scenes. It is too violent sometimes. My sister read some or every Harry books but not me. But I have to admit that some things are good in the film (like the special effects, of course). Harry Potter is a good story. I've seen the entire seven films and I preferred the second and fifth one (I think). It is very hard for me to understand Harry's stories. I saw it at the cinema in 3D and to be honest the 3D glasses didn't give anything special to the screen. It was so boring! I wonder if Harry Potter is a real success in the world. But for me it isn't. There are a lot of sad feelings in the Harry films. It is very sad sometimes. But it is scarry at the same time. I will give only 1 Oscar for Harry Potter film. Good try anyway. My name is Constantin and I am fourteen years old. Goodbye.",6.0,Anonymous,"Adventure, Drama, Fantasy"
