title,content,rating,username,genres
One of the scariest movies of all time!,"Insidious comes from two of my all-time favourite filmmakers: James Wan and Leigh Whannell. Nevermind the fact that this film is on a $1 million budget and the cast is filled with no big names. This movie will blow your mind.Keep this all in mind as you watch this horror masterpiece. It takes you on an intense ride that will have you squirming in your seat. It is probably going to be the best horror film of 2011, and one of the top ten of the year, as well. It's just so damn good.It starts off showing a family unpacking boxes in their new home, when strange things start happening making me think of The Haunting in the Connecticut. It quickly dives into depression as the son Dalton falls into what the doctors deem as a coma...but not really. But the strange things don't stop but instead grow more intense. Even when the family changes environments by moving to another house, the family is plagued with the spirits in the house.It doesn't follow the same set-up-pay-off format as Paranormal Activity, and nor does it follow the disturbing nature of Dead Silence. Instead, it combines these two elements to give us the psychological aspect, but while also giving us jump scenes.I lept from my seat at one point because this movie is scary. It doesn't have any bloody scenes but it is not necessary here. It doesn't have any of those scenes like Paranormal Activity, but instead makes it's own scare scenes using lighting and effects. It is truly a freaky film by most of what happens in the the second half of the movie.Perhaps the creepiest thing in the movie is the song that is sung by Tiny Tim. It occurs briefly twice in the movie, but both times send some serious shivers down your spine. It chills me and although this movie freaked me out more than any movie has, I would love to see it again. Seriously, folks, if you haven't yet seen Insidious and want a good scare and want a good film to see for the early 2011, go see it.",9.0,Anonymous,"Horror, Mystery"
"Decent film, stays fun! Lighten up movie know it all!","I will say that most of these reviews are correct about Insidious. It does borrow a lot from other films. No there are no Academy Award winning performances. No it's not the Exorcist. All that being said for the so called movie review ""experts"" here on IMDb lets remember what movies are for. They are for entertainment.What this film wasn't was the waste of money some people state here. Come on guys. This film was fun. Great camera work here akin to House on Haunted Hill. Awesome music, combined with the odd camera angles makes for unsettling suspense. I also liked the new angles on old concepts.This movie ultimately does not take itself too seriously and that is important. Maybe thats what causes some fellow movie goers to go out of their way to rip this movie to shreds. There are very serious horrors that are the comparisons. The Exorcist, the Sixth Sense, Night of the Living Dead...these classics are for the most part totally humorless and damn scary. Insidious does not fall into this bracket. Phantasm, the Evil Dead, Nightmare on Elm Street, Poltergiest...these movies remind me a little of Insidious.If you haven't seen it it's worth watching to judge for yourself. People go way overboard with these reviews. Its not Shawshanks Redemption but it's not Superbabies 2, lol.",6.0,Anonymous,"Horror, Mystery"
"Like Most 21st Century American Horror, It Goes For Cheap Scares","There's a guy in my office that occasionally hides under my work desk and yells ""BOO"" when I return from the restroom. Sometimes he jumps out from the coat closet near the front door, or hides behind the wall adjacent to the office kitchen. Every time he uses the same lame ""BOO"" scream because he's too stupid to properly construct an effective scare. It worked the first few times but now it's totally worthless. He can't scare me. I, on the other hand, will occasionally hide behind his door in the morning before he arrives. His office lights are usually off and the lighting is dim. He'll walk into his office, feel someone's presence, turn around and see a shadow near the door. Is it a part of his imagination or is it real? He squints his eyes for a few seconds and then notices that someone is actually there. It scares the crap out of him every time, and I don't even need to scream ""BOO!"" Ironically, sometimes when I don't do it he'll stop by my office and say, ""Man, I thought I saw you this morning.""This very basic difference between amateur shock tactics and well-constructed sequences of terror is something that 21st Century American filmmakers ignore with reckless abandon. In case you hadn't noticed, the American horror industry has sucked for quite some time, and one major reason is that they almost always go for the cheapest, laziest routes to producing scares. In the case of Insidious, it's jump scares supplemented with 100-decibel piano/violin BOOMs. If Insidious limited itself to 2 or 3 such moments (or even 4 or 5), then it could have saved enough room for more mature, expertly crafted horror elements. Unbelievably, Insidious tosses in approximately 20 jump scares, an unacceptable descent into unprecedented laziness. The condensed nature of the jumps falls prey to the law of diminishing returns. It would be like the guy at my office jumping in front of me and yelling ""BOO"" every 3 minutes. It quickly becomes a parody of itself.Brian Salisbury from ""Film School Rejects"" makes some good points in his review of Insidious, so I'd like to quote him here: ""Seriously, horror filmmakers: put a moratorium on jump scares. I know everyone and their brother is using jump scares as a counterattack against increasingly desensitized audiences, but it's time to give up the ghost (pun only slightly intended). I got sick and tired of something popping up like Jack-in-the-Box every five seconds obscuring my vision from the much more interesting, and far scarier, story going on behind it. Jump scares are the junk food of horror films – providing only superficial and extremely temporary sensory nourishment. Soon enough, your brain is hungry again for that fear response and jump scares are about as substantial as eating a box of Twinkies on Thanksgiving Day. When you watch the Oscars and the category of Achievement in Sound Mixing comes up (you know, when you normally make a trip to the bathroom), you may ponder on the value of a film's sound mixer or sound designer. Five minutes into Insidious, you will understand the dire necessity of these artists if only by virtue of the fact that we're subjected to their spectacular failures for 90 minutes. Every apparition carries with it its own deafening shriek and every jump scare is heralded with an explosion of disharmonious (read: eardrum-shredding) violins. It seems to be operating under the same delusion as Drag Me to Hell that loud = scary. But, along with jump scares, incessant loud noises are the charlatans of fright. We are not infants, so please refrain from resorting to the same tactics that terrify barely cognitive life forms.""That sums things up nicely. The praise that Insidious has earned for it's cheap scare tactics should be concerning for fans of the genre, because a transition from the recent torture/gore trend towards jump scare compilations isn't much of a progression for the pitiable American horror industry. Take away the 100-decibel piano/violin BOOMs and almost none of the jumps will work on your mainstream cinephile. (And by ""work"" I'm using the generous term ""startle"", which is probably the laziest way to scare someone.) The storyline is stupid, the acting is mediocre at best, the dialogue ranges from decent to lame, and the dramatic elements are limp. The only true positive is the fairly brisk pacing that keeps things from getting unbearably boring.Despite everyone I know complaining about my biased preference for Japanese and South Korean horror, it's pretty damn obvious that my fellow Americans are simply too incompetent to construct long-sustained sequences of terror, produce dense atmosphere, develop interesting psychological/philosophical elements, use ambiguity properly, patiently utilize deliberate pacing to build tension, or supplement horror with good story lines and characters. If Insidious is the creme de la creme of modern American horror, then it's time to write an epitaph.",4.0,Anonymous,"Horror, Mystery"
Refreshing Old School Scarefest without need for Gore and CGI,"Just seen this at a preview screening in London.From the makers of Saw, this was surprisingly devoid of any gore and instead what we get is a refreshingly old school scare fest, 80s style. No stupid over-used CGI, just good effective camera work and traditional make up effects (akin to that of Sixth Sense).But this film was so similar in structure to one of my favourite 80s scary movie that if I mention what that movie is, I feel I would spoil the whole movie for you! I'm pretty much saying this is an act for act total rip off of that movie. I'm surprised they're not even calling it a remake, or a reboot. But I don't mind the extraordinary similarities as this has its own signature and flavour to win over fans of the ""original"" and definitely will win over those who haven't.Did I jump out of my skin? At least 20 bloody times. At one time I worried if I was too far away to get back in my body. Granted, they are your traditional BOO moments with the sound cranked up to maximum, you know the type but they are pretty damn effective and done with great timing and excellent editing.The audience I saw this with clearly loved the scares whilst dreading it at the same time. It's amusing to find people trying to laugh the scares off and I was one of them, its like a defence mechanism. You know you just got tango'd so what do you do? you try laugh it off!Having said that I think they used that card a bit too many times in the first and second act so it was quite noticeable that later scary moments didn't quite have us jumping out of our seats and in fact some of it fell quite flat.My other gripe was that the last act did not quite reach the urgency of excitement that the film was clearly building to, some more tightening in the editing was needed here. I might have felt that way because I'm uncontrollably comparing it too much to the ""original"". I was also hoping for a little more visual imagination in that last act. But I later found out that this movie was made on a minuscule budget of $800,000. Considering this, they did a damn good job of making use of every penny of it. So it was moderately exciting but not as fulfilling as I would have liked.Even though I think this a clear rip off of an 80s film I love, this delivered exactly what our sadistic inner demons have been crying out for lately, a movie that scares the bejesus out of us.So this is a great movie to watch on a Friday or Saturday night with your friends and for guys with their dates as I guarantee your arms will be sore as your girlfriends grab you violently several times.",8.0,Anonymous,"Horror, Mystery"
Good but not that much!,"Idk why but I have a different liking for the Conjuring series by Dir. Wan. May be its because of the plane depiction of the sightings or feelings. I did not find anything which seems to be realistic. The main ghostly figure shown is also not upto the mark, but still, I will give it a 6 bcoz, there were some jumpscare parts :-
1. When that ghost appeared just behind Josh. (Scariest, as it is a sudden jumpscare.)(Written only one as, it will be wrong for the first time viewers!)
At last the only thing I wanna say, the movie is good, nice, but not upto that mark. POV may vary still A MUST WATCH.",6.0,Anonymous,"Horror, Mystery"
Great horror but not a awesome horror movie,"Just happened i bought this movie and i watch.Rumor say that this show get high rating so i decide to watch but does not creep me out and make me close my eyes and not give me some thrill. But it give me want to know the ending that it. OK i give some short summary about this movie is about the father and his son has ability sleep walk to the spirit world dimension and some very nasty spirit want their body and his son trap in spirit world dimension only his father can rescue him. If this movie transform as PC game like FEAR and Silent hill. i definitely play it.Yes, this movie too fiction and very faking. The boy acting so down to the drain. I think this movie is not creep you up bot just some lame entertainment horror movie. In the end i hope this movie is best if convert as game.",6.0,Anonymous,"Horror, Mystery"
Three reasons to see this movie:,"1) I haven't logged into my IMDb account in about a year and a half. I did today just to give this 9/10.2) I have never yelled like a little bitch in a movie before. In cinemas or watching at home. I did in this. I am still so on edge and feeling physically ill from being in panic mode for so long I fear I might not sleep tonight. Or, ever again.3) Go see this movie. If you want a jump out of your seat, ""I won't be able to sleep tonight"" film, (a more old fashioned screeching violins horror) that you wish they would keep making, go see it now.Filmmakers need to keep making horror movies like this.",8.0,Anonymous,"Horror, Mystery"
Slightly better than run of the mill,"When a kid sees eerie creatures in the night the parents do the usual thing - they comfort the kid and blame childhood fantasy. But when the kid slips into a coma and other people in the house start seeing things they may have been wrong.Films like this are a dime in a dozen and they usually pick one of the more classical films and take whatever they can from that one. This one is no different and leans very heavily on Poltergeist (1982). It's still rather different from that one though so it's OK, it's better to copy creatively than to create badly after all.The tension build in the film is quite good. It starts slowly but gets under the skin eventually. Attempted shock moments are there but are completely ineffective (and might just be designed to be like that) but they don't disturb anything. As the film rolls on and picks up speed it becomes a pleasant watch but never goes above that level. So, all in all, slightly better than run of the mill.7 out of 10 dark intentions",7.0,Anonymous,"Horror, Mystery"
Not good at all!!,It looks like there are either a lot of relatives or a lot of people being paid to write reviews because I don't know how anyone can say this movie was good.The concept wasn't bad but the execution was god awful. The direction was amateurish. The camera angles were awful and (one of my pet peeves) WAY too many close ups. The make-up looked like it was done by high school kids.You never really connect with any of the characters so you don't care what happens to any of them. The whole thing was just BAD.Wait for this to come out on DVD or even cable. I read all the good reviews and thought that the bad reviews were just people that don't really like horror movies. I was wrong. I'm really not kidding when I say that I think people were paid to write reviews.,3.0,Anonymous,"Horror, Mystery"
Insidious...One way ticket to see your psychiatrist,"Have you ever been so horrified that you cried tears of fear? Have you ever seen a film so creepy you can't stop shaking for hours? This is one such film. Many have lauded the cinematography and I must give praise as well.The concept, not too out of the ordinary, however, it has a much more concrete twist if you will about it.To me, not only were the images immensely disturbing and frightening, the whole idea of what was happening did me in the most.When people think of haunted houses and ghost it is fuzzy, beyond us. This film eerily made the concept of apparitions plausible almost scientifically.Listen to what is said carefully and think about especially when it comes to the how and why.See this film. Please do not see it if you have health issues. I'm healthy and usually am like a typical man and don't get scared easily (except for psychological films like Event Horizon).This movie made me scream out loud in panic.",9.0,Anonymous,"Horror, Mystery"
Behind the Red Door,"Greetings again from the darkness. Ahh, the lost art of horror films. I don't mean slasher films or gore-fests. I mean real horror films. The ""Saw"" series falls into gore-fest and its collaborators, director James Wan and writer Leigh Whannel, team up again for a more traditional horror film ... one designed to scare the viewer, rather than just gross out society.The film opens as Patrick Wilson and Rose Byrne move into a beautiful old house with their two young sons and infant daughter. By beautiful house, of course I mean terribly creepy with nooks and crannies, creaking floorboards, squeaky doors and an attic designed by Satan. The mom (Byrne) quickly realizes things aren't just right with this house, and as is customary in horror films, the dad finds some lame excuse to work late so the mom and kids can be haunted without him.There are some bits and pieces from classic horror films like ""The Exorcist"", ""Poltergeist"", ""Amityville Horror"" and, yes, ""Saw"" (but not the gory stuff). Remarkably, this film is rated PG-13 which means the filmmakers really have to tell a story ... and they do.The mom gets so desperate, she begs to move. They do. Guess what? Things aren't better. So mother-in-law Barbara Hershey says she knows someone. Next thing you know, two goof-balls that look like they should have their own cable show are in the house confirming something is definitely amiss. So they call in their boss. Unfortunately, the great Zelda Rubinstein (Poltergeist) passed away, so our expert is played by Lin Shayle. She does an effective job explaining astral projection and the next thing you know all hell has broken loose. Nice work lady.What makes the film work are the characters, the setting, the atmosphere and the really nice build-up of suspense and drama. Sure I think there were some details that could have been handled much better. For instance, the ""other"" brother looks like he is going to be a factor, but instead all of the attention goes to Ty Simpkins as Dalton. Simpkins was seen recently with Russell Crowe in ""The Next 3 Days"". Also, more of the backstory with Hershey and Wilson's childhood could have proved very interesting.Still, I will say if you are a fan of horror films, this one is worth seeing. If nothing else, you will absolutely love the opening credits with their haunted images and smoky font. It's a bit of a fun challenge to find the ""image"" in each of the opening sequences. Just make sure to finish your popcorn before the movie starts. That stuff is too expensive to be tossing across the aisle when you JUMP!!",6.0,Anonymous,"Horror, Mystery"
"decent, but nothing special","I read some reviews here before watching this film, and at first glance this movie seemed to be very promising. However I didn't feel very scary while watching this film because the plot was easily predictable and primitive at times.The costumes and special effects were not too sophisticated.What rescued this film from disaster is an incredible acting by Patrick Wilson, Rose Byrne and Ty Simpkins. They are the reason this movie was worth watching, but due to flawed plot I am forced to get 4 point away from this film.The problem with these kind of films is that closed space, i.e. haunted house, was used so many times before in other horror movies, that the more you watch such movies, the more silly they look. I love such films as Paranormal activity, or Blair witch project, as they are original in context of other horror movies. A lot of already seen details are not scary anymore, movie-makers have to think more to get an interesting horror movie now.",6.0,Anonymous,"Horror, Mystery"
Gives hope for horror,"This movie has restored my hope in the horror genre. It does just about everything right. One thing that particularly impressed me is the fact that they managed to keep it scary while revealing what was haunting them. This movie mixes both terrifying visuals and a haunting story to create a old-style yet unique horror experience. As for comedy, it does have a little bit at the very right moments to act as comic relief. And one scene is quirky yet unsettling at the same time. Insidious isn't like any other modern horror movie, it take queues from the classics while mixing in a modern feel and is a very good combination of the two. Also, the acting is superb. Watch this movie if you are a fan of horror.",8.0,Anonymous,"Horror, Mystery"
2nd half of the film messes up the movie.,***MAY CONTAIN SPOILERS***The first half of the film was terrifying I thought the scares were so effective and the suspense was high. The film succeeded in showing enough but not too much and the ghosts looked scary. But as the film shows more of its ghosts and demon it ruined everything the first half worked for. The demon looked awfully like dark maul from Star Wars and having it sharpen it's nails in a room full of dolls and puppets with tip toe through the tulips was so cheesy and by then I lost interest. also when it showed the ghosts more and actually had them fighting it just took the realism and scariness from the film. It just did too much for me I'm the type that likes my movies to have many scares but it can't be too much and this film just went off the rails. The conclusion was suspenseful and I knew right from the end there was going to be a sequel no matter how long they took to announce it. Hopefully it's sequel will be an extended full movie of this films first half.,6.0,Anonymous,"Horror, Mystery"
Insidious is Truly Insidious,"How many horror movies are actually scary? Three, maybe four? Make that five. Insidious just made the list.James Wan's Insidious is unusual in every sense of the word. It's a 100-minute thrill ride that is a homage to countless horror movies, including Poltergeist and The Shining, and often enough, Insidious succeeds in bringing the scares. Terrifying and entertaining, Insidious threatens its viewer with an insulting amount of jump scares, however it does not matter when the result is this good. Popcorn entertainment may not be this fun again for a while.Insidious' plot may sound contrived, and that's because it is. Leigh Whanell's original script borrows a lot of previous horror greats. Renai (Rose Byrne) and Josh Lambert (Patrick Wilson) are a married couple with three children that have just moved into a new house. Yet not everything is perfect. The protagonists' marriage is tense and cold and there's something deeply unsettling about their home. It isn't long before one of their sons, Dalton, falls from a ladder while he is investigating a noise in the attic and becomes comatose. The house isn't done with the Lamberts yet. And the filmmakers aren't done with us either.Wan shows a clear sense of maturity with Insidious. That is to say that he has stepped it up from the bloody albeit twisty Saw and the boring Dead Silence. Insidious alludes to past horror masterpieces frequently, and after all, isn't copying the sincerest form of flattery? Wan uses all this to his advantage--Insidious becomes creaky, slow carnival ride that never lets up. Wan has clearly learned from the masters; now he's just showing off.As if Insidious' atmospheric tone wasn't enough, Wan has made Insidious a textbook example of horror done right. Lighting is used to create intrigue and mystery; the camera whirls and shakes to give the film an unsettling dissonance. Often Insidious verges on corny, but this is all with good intent. Violins certainly hit the high notes to give the viewer chills.But Insidious is far from perfect. In fact, Wan's film is still marred by many flaws, notably a tonal change about halfway through that nearly wrecks any momentum gained in the quiet first act. It also seems that every two minutes there is a jump scene. This is a something that works at first, but by the end of it, it gets to be a bit much. And while there is some much needed comic relief in some of the scariest parts, it doesn't quite hang together when jokes are made. Furthermore, some elements of the plot are nonsensical, yet all this can be missed when disbelief is suspended.In 2009, Paranormal Activity was hailed as one of the scariest movies ever. It's time for Insidious to get the recognition it deserves. Insidious may not be everyone's type of horror movie, but it's an intelligent, scary, and well-made film designed for people who actually care about watching movies. Although Insidious may take itself way too seriously, it's hard to ignore a film that is so intensely scary as this. There's one scene where Lorraine, played by Barbra Hershey, says, ""I had a dream last night. I was in the house. I was very afraid."" Aren't we all, darling.",9.0,Anonymous,"Horror, Mystery"
