title,content,rating,username,genres
You may enjoy it more if you have zero expectations,"I am a horror movie fan and I try to catch horror movies that get a good word-of-mouth. This movie ""Insidious"" is one such movie, with some critics giving it an A rating, very rare in the horror genre.""Insidious"" involves a child, and that is usually a positive thing among horror classics, like ""The Exorcist,"" ""The Omen"" and ""Poltergeist"" to ""The Sixth Sense"" and ""The Others."" Little Dalton Lambert suddenly falls into an unexplained coma one day, with no plausible medical explanation. From then on, their house began to manifest various ghostly goings-on that scares the living hell out of his parents Josh (Patrick Wilson) and Renai (Rose Byrne). Pushed to the wall, they consult paranormal ""experts"" to solve their supernatural problems. Can Dalton still be saved?The device used to explain what happened to Dalton and what can be done to deal with the situation was quite ingeniously conceived by the writer Leigh Whannell. However, the execution though by the director James Wan is a tad disappointing in several parts. This movie pulls out all of the traditional horror tricks to make this movie scary. The shadowy darkness, the loud startling music, all to bring about a creepy atmosphere and jolting surprises and screams from the audience. The images of the ghostly tormentors while disturbing and unsettling are more weird than really scary.I believe that I may have been affected by expecting too much from this film. I was expecting an A-rated horror movie, but ended up rating it as merely an average one for the genre.",6.0,Anonymous,"Horror, Mystery"
"Solid horror film by very talented fellas,  Wan n Whannell.","I saw this first on a DVD in 2011. As a fan of James Wan (Saw, Death sentence n Dead silence), i was excited to see this film. Insidious starts off on a routine note - a family moves into a new house and are absolutely in love with it. Soon strange, supernatural-like things start to happen n the son goes into coma after falling from a ladder in the attic. Sensibly the family moves into a new house. Thinking they've left those occurrences behind, they soon discover that it's not the house that was haunted but their son. Insidious was actually scary at some points. There were several pretty chilling set pieces and the ghost designs were particularly creepy. There is this one scene where the red demon is standing next to the sons bed n the granny inquires the demon. Man, that really terrified me. Another scene was the one wher someone is walking behind the curtains. While watching this scene i turned behind to check my window. The scary moments are well-paced and always effective. Creepy figures emerge from the shadows and appear in the background in an unpredictable fashion. The soundtrack complemented it well. The cast is remarkable. Patrick Wilson, Rose Byrne n Lin Shaye all gave good performances.",9.0,Anonymous,"Horror, Mystery"
An average movie with some scares...,"This movie does what it sets out to do, it makes you jump.The plot is good and the concept works, the lead actors will also draw you in and make you part of this movie.However other then being a movie that makes you jump I struggle to find any features that make it a good movie. The first half for me is a winner but as we progress the film starts to feel rushed. The story line becomes odd and the horrors begin to look cheap. It falls fowl of the issues most movies that want to scare us do.You see the evil and laugh, the demons and ghouls look like drama students let loose with makeup, the limited use of cgi which I prefer looks cheap.Did it scare me? Well yes it did, up to a point. However I wouldn't class it as the scariest film in years. It's simply a good, basic, horror flick which lets it self down in the later stages.",6.0,Anonymous,"Horror, Mystery"
Initial scares give way to a schlocky crapfest,"The first act of ""Insidious"", while not breaking any new ground, offered several genuine scary moments. That is until morphed into a ridiculous miss-mash of bad filmmaking.The climax was so badly conceived and executed I was begging for it to end.Who are the people giving this movie good marks? I am perplexed. Maybe young teeny- boppers. It is very sad that dreck like this makes money. A good marketing campaign and cool billboards seem to have made this a financial success. Even worse...they are making a sequel.Indeed, there is no accounting for taste.",3.0,Anonymous,"Horror, Mystery"
Must watch...horror,This represent my opinion.For all movies I rate I mean the following:10= exellent movie8= good movie but less than exellent5= you will not regret watching.2= wasting time,10.0,Anonymous,"Horror, Mystery"
"Not scary, just boring","I saw this movie because I'd seen a lot of reviews that said it was great and pretty scary. It is neither.The acting was alright. That is about it for the good points.The demon or whatever it is looks like Darth Maul with a big nose- it looks silly. The ghosts or whatever they are, are all annoying and not original- I was waiting for a guy with a mustache, holding his head under his arm to come strolling along at any moment.The part where it turns really bad is when they start talking about the astral projection. That could have been a good, interesting twist, but it just ended up being silly.When the psychic woman gets the guy to draw pictures for her, it seemed pointless. Why does she need him to do that?? What is the point??? Why does she need him to write down what she says too?? What is with the sandman mask? Why can't she just talk normally?? Too many things in there just for the sake of trying to make it ""spooky"".This movie is like a really bad Freddy's Nightmares episode.",1.0,Anonymous,"Horror, Mystery"
Solid Work From the Saw Boys,"A family looks to prevent evil spirits from trapping their comatose child (Ty Simpkins) in a realm called The Further.This film is marketed as being from the creators of ""Paranormal Activity"", which makes sense given the subject matter -- but this is really the brainchild of the ""Saw"" boys -- being directed by James Wan and written by Leigh Whannell (who also appears as a character). For an added bonus, horror veteran Lin Shaye is here in one of her best roles.This film is legitimately creepy. I am not big on ""jump"" or ""bus"" scares, and even less of a fan of computer animation, but this film just impressed me. There were so many shots that made it worthwhile, with quick flashes of a shadowy figure -- just enough to get the imagination to conjure up something more. The best balance for horror is the use of the seen and the unseen in a certain mixture -- not sure precisely how much, but the makers of this film clearly do. I think ""Insidious"" was overlooked by many and that is just a shame.The advertising consistently used quotes from reviews to insist this film is the best thing since either ""Poltergeist"" or ""Exorcist"". I assume anyone who reads that thinks it's an exaggeration. But do not think it exaggerates too much -- these are not just cherry-picked quotes. While putting ""Insidious"" in the same league as either of those two films is hard to do, it is not far behind... in fact, I would not even mind saying it gives ""Poltergeist"" a run for its money...While I hope ""Insidious"" does not turn into a franchise (we are all a little burned out on ""Saw"", ""Paranormal Activity"" and ""The Collector""), as it stands, this film is a winner. It takes the haunting subgenre of horror and completely turns it on its head... for the better.",7.0,Anonymous,"Horror, Mystery"
"It's a very scary movie, full of jumpscares","First of all, when I first watched the official trailer of the movie I liked it and I had high expectations about it. Eventually, it was as good as I had imagined and I enjoyed it, a lot. The plot of the movie was very interesting and mysterious, but not innovative because there are many supernatural movies similar to this one. The storyline was very well-written and well-explained, even though it was simple and easy to understand. The characters (family members) were interesting, well-developed and likeable. The filming location of the movie was just a big family house in a quiet neighborhood. The casting choices were nice and their performances were descent. I have to admit, it was a very scary movie, creepy and there were too many unpredictable jumpscares. Moreover, the cinematography and the score of the movie were both incredible. The opening scene was predictable, but it was very creepy and promising. The ending scene was kinda unpredictable, terrifying and I liked it. By the way, the demon's appearance was definitely terrifying. Overall, ""Insidious"" was an enjoyable horror film, intense, scary and I would definitely recommend it to anyone!",9.0,Anonymous,"Horror, Mystery"
WOW!!!,"I just watched Insidious for the first time, and I've got to say that it's really entertaining; a horror film that's packed with frights and fun and a horror film that does not feel like a PG13 flick. Incredibly amazing performance from horror legend and icon, Lin Shaye as Elise Rainier, and frighteningly eerie performance from Joseph Bishara as the Lipstick Face Demon. Can't wait to see the other chapters!",10.0,Anonymous,"Horror, Mystery"
"Not bad, definitely not scary","I am gonna start out by saying, I am not a huge fan of the haunted house style of movie. I will say that this movie did impress me though. It isn't really scary, at all, creepy is more of the term I would use. Not once did I just feel like my heart was gonna explode, and anyone who says that it was terrifying was probably 1. a twilight fan or 2. a 15 year old girl, sorry but this isn't scary. Dead Silence was better in my opinion for the whole scare factor, and it was only a shock and awww film. Insidious is the type of movie that inspires a dark, eerie mood. It was a little to similar to poltergeist though in my opinion. I put this up because I was sick of people saying this is terrifying when in fact it isn't even close. I do recommend that you should watch it though, especially if you like poltergeist type movies.",7.0,Anonymous,"Horror, Mystery"
Impressive,"Insidious is really impressive because it's one of the few movies that proves talent always winsStory
Is really good and so attractive but with unexplainable things and it's really weird and questionableCharacters and actors
There is nothing unique about them at all they are just normal either the actors they hadn't to do much and they didn't but it the right thing for the actors not the charactersMusic
Is iconic and super spooky when I just hear it alone it scares the hell out of me thanks to Joseph BisharaDirecting
I know James wan before I saw furious 7 and the conjuring 1&2 so I'm happy to see him in his early days he is the one I meant with talent from the magnanimous takes and great filming and unique directing style and the right music in the right time.",7.0,Anonymous,"Horror, Mystery"
Astro...turfing to the max,"The reviews giving 10* smell like money spent on an advertising campaign which wishes to look like grassroots...For a good eye it's a bad movie sucking the benefits from words like : ""independent"", ""original"", ""scary"" and so on! New media will never be credible with this kind of attitude! When bad acting meets lack of creativity, you get a scary movie like this one... why don't they start to show us a black screen and then pop - up some white faces and scream when the atmosphere is most silent! Then you'll get some heart attacks or other results alike! So keep creating ""real"" accounts and submit positive critics, lying doesn't cost a thing! Make them vote like they're doing it from the heart and you'll obtain a 7+ grade! I sincerely appreciate the IMDb site posting other scores and critics than the ones coming from astro-turfers!",1.0,Anonymous,"Horror, Mystery"
"Some clever and big scares, let down with lazy plot","With the 'saw' franchise at its (depressing and three dimensional) end, a horror sized hole in Hollywood has been created. With insidious hoping to fill it. Insidious follows the story of a family who are looking to prevent evil spirits from trapping their comatose child in a realm called 'the further'. With quite a unique concept does insidious deliver? and above all, scare?The effective technique to 'show as little of the villain as possible' in a horror film applies to Insidious all too much. This isn't a problem for the 1st half of the film, as the majority of the first 45 minutes doesn't include the main bad guy only his 'ghost henchmen'. When the main villain is eventually revealed to us the shocking effect of his first appearance quickly wears of, as he is showed time and time again. If they had just held back his screen time he would have been much more scary and shocking. Unfortunately this villain who was supposed to be the main centerpiece of the scares turns out the be the main centerpiece of the laughs.Saying that, I thought that some scenes where absolutely terrifying, showing sparks of genius at times.Especially at one point, which has to be one of the most unsettling scenes in horror film history ( in my opinion) I won' spoil it, all i'll say is 'tiptoe through the tulips'! The scares are partly down to tempo of the film, it takes a while to get started but once it does the scares hit hard in some clever sequences, this creates a really tense atmosphere that had me in hysterics. However i couldn't help but feel let down after the film as the terrific scares in this film are ruined by the ridiculous and unrealistic plot. As the plot gets more and more silly throughout the film, new characters are added, which just increases my annoyance! 3 characters enter the film who provide no scares or suspense whatsoever, they just drag the film down and pull the viewers away from the suspense by providing awful comedic value.This film provided terrifying moments at times, but the disappointing lack of realistic plot dragged the film down. If this film had maintained its suspense that was created by the 'ghosts' in around the 45 minute mark, this film would be a real winner and one worthy of attention.I want to give this film a 8 stars but the lack of plot, silly characters and unconvincing, tame bad guy means that i have to give this film a 7.Calum. Russell",7.0,Anonymous,"Horror, Mystery"
B movieish but good & combines many movies very well,"7.6 Actually but this movie wasn't high budget and you can tell. It's kinda B movieish but really good with a budget of $1.5 million dollars it's pretty low however it's pretty decent. It kinda combines Poltergeist (though defiantly not the extremely high budget), Paranormal Activity, and The Exorcist all into one with a little of it's own elements. Overall good movie I just hope they don't ruin it with a bad sequel. It obviously needs a sequel I just hope it's not a bad one. Another thing is that it's rated PG-13. What?! Yep it has a PG-13 rating and it's still scary. I've always praised PG-13 horror movies because 1.There is either very little violence or none at all. 2. It's scary without being gory to where you're not flinching at every kill scene but every time there's something scary you're just numb. 3.Every scare is specific; and finally 4. It actually has to be I don't know SCARY to be IN the horror genre.",7.0,Anonymous,"Horror, Mystery"
"The best since ""Poltergeist""","James Wan's finest! A very well-directed and written movie, no doubt. As I was watching i had visions from ""Poltergeist"" and ""The Entity"". Wan payed a great homage to these paranormal movies of the 80's and won't let you down. This is a very good movie, worth watching in a movie theater. And it scares, in these days it's hard to come by. The key Wan uses here is to keep it simple and clean, no gore or violence but following a solid story makes this film much stronger than just a horror and gory movie. Wan is not used to this, that's why we see a more serious side of him, that I loved. This one did take me back to those days and trust me, it scares! Let's not also forget the presence of Barbara Hershey, the one who scared a generation in ""The Entity"". Go see this, if you love paranormal, this is the right formula for a good movie.",7.0,Anonymous,"Horror, Mystery"
A pretty decent horror movie.,"I'd say this was a pretty decent movie! It had it's moments where you were jumping around and waiting for things to happen and they never did, which is really great!The end was really good!!I'd see it if you want to get scared a little and need to think about it a bit!This movie was the best i have ever seen in my life. I have seen a lot of horror films and this one was the best one so far i would recommend this movie to scare the crap out of your children . If you just want to hang out with your buds you and your friends can go and rent this movie and you can scare your friends.",10.0,Anonymous,"Horror, Mystery"
Horrifying movie with a very lackluster finish,"I am not a proponent of giving out any details of a movies plot in a review due to it setting an expectation to another person. The movie has a great plot and theme. The degree of suspense is set high and for a lot of the movie kept me on my toes and had me wanting to take shelter under my blanket if I was still a child. The fatal flaw is that towards the end, and note I am not stating specifically the ending, the movie seems rushed and as if the producers were running low on the budget. If rating the movie from beginning until before the last 15-20 minutes this film would be an 8.5-9. All in all, I would say this movie is well worth the 2 hours you will have to sacrifice from your busy life to enjoy and is a welcome title to a genre that has in the past decade been polluted with mostly cliché garbage.",6.0,Anonymous,"Horror, Mystery"
A great atmosphere is let down by everything else being a total mess,"STAR RATING: ***** Saturday Night **** Friday Night *** Friday Morning ** Sunday Night * Monday MorningJosh (Patrick Wilson) and Rose (Reni Lambert) move with their young son Dalton (Ty Simpkins) into a new home. However, after Dalton suffers a fall, his parents find him trapped in a coma he can't seem to break free from. Worse, shortly afterwards, spooky events take place around the house, causing them to relocate again...only for these events to follow them, causing them to face a terrifying truth about their son that will force them to go above their realm of belief to save him.If Insidious does nothing else right (which it doesn't) it does create a terrific, unnerving atmosphere that fits it's status as a horror film perfectly, not only in the opening titles with the jarring, skin crawling soundtrack, but the impressively grey, drained cinematography in the set up that follows, with an impressive use of no sound to hammer this home.Saw director James Wan shows more restraint and ditches the blood/gore excess and concentrates on setting up the ground work for a decent horror picture. Sadly, he fails to create characters we can care about or a story that is in any way engaging, leaving it to degenerate more and more into preposterousness which robs some of the admittedly eerie scenes of their effectiveness.Horror is one of those genres where if it's done right, things work wonders but when it doesn't, it's just a complete mess, which sadly is the case with Insidious. Atmospherically, and even visually, it's perfect, but sadly all the other components fail to come together and despite being a short film, it feels like a big slog to get to the end. *",2.0,Anonymous,"Horror, Mystery"
"Dreadful, truly one of the worst","I don't really know where to begin with this movie. It has been one of those movies that I never got around to watching and then completely forgot all about it. Well recently I finally got around to watching this film and I have to say by the end I didn't know whether to laugh or to cry.Laugh because the movie was absolutely shockingly atrocious, or cry because I'd wasted a part of my life watching this garbage that I will never get back.20 minutes in to the film I thought that it was going to be really good, The story was set really nicely and then I was just waiting for all hell to break loose.Well it didn't, what followed was an hour of utterly ludicrous loud noises aimed to scare the living daylights out of you by having a really low volume for the dialogue and then hitting you with 1000 decibels of noise. It got old very very very quickly. At first I thought it was just me imagining noises being more loud than usual in a horror film, but I realised that was the only weapon this film had up its sleeve. The storyline turned into something that even a few days later I still chuckle to myself about. The effects were some of the worst seen in film since the 70's and the scary things in the film were so terrible they actually made you laugh.Basically the entire film was over an hour of trying to deafen you by playing over the top loud noises when something scary was supposed to be happening and masking the fact that what you were actually seeing was not scary but funny. If you play the supposedly scary parts of this film without the sound you will literally burst into laughter about what you are seeing.People are reactionary on here and review things straight after they see the movie which is understandable. However, it has been a few days since I watched this film, so I have had time to think and evaluate this movie with a clear mind and I can genuinely say this was one of the worst horror movies I have ever seen, and one of the worst movies in general, I truly don't understand the hype surrounding this film on here and how well regarded it is and the director.I have read the second installment of this joke film follows the same concept of loud noises to create cheap scares so I will definitely give that one a miss, how they can make 3 of these things says everything about Hollywood and $$$$.",,Anonymous,"Horror, Mystery"
A dreadful modern chiller with a classic touch,"James Wan's ""Insidious"" borrows, like almost every Hollywood horror flick, the clichés, jump scares, and ideas from all the commercial horror movies from the past decades. However, it manages to successfully build a mysterious, eerie and dreadful atmosphere. Patrick Wilson and Rose Byrne headline a cast that delivers a good portrait of the haunted family with a first half that sets the bar high, very high, that will leave you at the edge of the seat and afraid of dark. The final act tough begins too soon and drags for too long, taking the movie through a fantasy outcome that is doubtful and perhaps too literal. It is a nice chiller tough, and those are getting rarer by the day. Well done. Visit thefadingcam blog on blogspot for more! Also like us on facebook to follow all our reviews!",6.0,Anonymous,"Horror, Mystery"
A PG Poltergeist?,"I don't know if there is any real direct correlation between Insidious and Poltergeist but the similarities are quite prevalent. I enjoyed this movie for what it is but if you're really looking for jump scares, there really isn't much here. No mold broken here.",7.0,Anonymous,"Horror, Mystery"
Truly fantastic!,"The classic retro horror atmosphere of this movie is superb!For me personally any horror fanatic worth his salt should know that scary often comes from great direction and production, not the ability to make blood splatter, and this is where this movie does it for me.Insidious not only has a great plot carried out by a great cast, it also has an enjoyable feel all the way through.You can be smiling one moment and wide eyed the next.A personal favourite I can watch again and again.",9.0,Anonymous,"Horror, Mystery"
The best new- released horror movie fore a Long time!,"Insidious is probably the best horror movie I've seen in a long time. Getting tired of the ""they live inside a cabin in the woods without coverage on your mobile"" look. This is really something new that makes you not know exactly when something will happen which makes you scared. The story is well written and very good actor in my opinion, it comes with the act and is something I appreciate very much of a horror movie. I fought It would be just like that when I saw that the guys from ""SAW"" directed it ques they are weary talented and together with the ""Paranomal Activity"" gang, they have created together a masterpiece of Horror category. So get ready with the popcorn bowl, call all you're friends and pull the home theater to max ""cause its gonna be a bumpy ride""! :)",7.0,Anonymous,"Horror, Mystery"
Finally a supernatural movie that delivers,Finally a supernatural movie that delivered For so long the genre has disappointed me With cheesy camera tricks and scares But insidious has reinstalled my faith in the genre This has great scares a great story line That will keep you watchingThe Lamberts son falls into a deep coma medical science can't explain it The hospital allows the Lamberts to have their child at home While he's in a coma But soon ghosts Demons Poltergeist and the supernatural start to arrive Turning the Lamberts house into a living nightmare they attempt to flee But soon realize this goes beyond a simple haunted house,10.0,Anonymous,"Horror, Mystery"
