title,content,rating,username,genres
Let Sleeping Dogs Lie,"Every so often two movies are released the same calendar year with a similar story—ala Dante's Peak and Volcano, both released in 1997, Deep Impact and Armageddon in 1998, The Illusionist and The Prestige in 2006, Olympus has Fallen and White House Down in 2013 or we can go all the way back to 1984 with Breakin' and Beat Street. I mention this because part way through this movie I couldn't help but realize how eerily similar it is to The Equalizer.The Equalizer, starring Denzel Washington, was about a retired, highly skilled agent that was living alone because he had lost his wife. He was drawn out of retirement by the Russian Mafia because of their iniquities.John Wick, starring Keanu Reeves, is about a retired, highly skilled assassin that lives alone because he lost his wife. He has also been drawn out of retirement by Russians because of their iniquities. That's where the similarities end. Even though John Wick is a good movie I give the nod to The Equalizer over it for a few reasons:1.) Denzel over Keanu. Reeves still has all of the range of a cardboard cutout.2.) The story. Every vengeance/vigilante film requires an impetus for the revenge/vigilantism. Sometimes we, the viewer, don't really care what that reason is, we just want to see some professional butt whipping. Even if that is the case, that's not to say that some causes are not better than others. The cause in John Wick was good just how it came about was very elementary.3.) The head scratching moments. John Wick has three moments that leave you scratching your head with a puzzled look on your face. They are fairly obvious as they are right out of the movie cliché manual. It doesn't cripple the movie but it makes you wonder: in this day and age with a hundred years of movies to refer to, why drum up the same old good guy and bad guy clichés?Those are my only beefs. They aren't enough to ruin the movie well, they might ruin it for some. Once the action kicks into gear it's a real treat. John Wick is masterful with a gun. It's like he took martial arts classes with guns. Instead of giving you a well-placed punch or kick, he uses bullets. And there was something they did well in this movie which I'd never seen in a movie before this one. John Wick had to often, and quite obviously, change magazines in his weapons. John Wick made it very apparent that his guns do not have magazines with unlimited rounds, and that you very well may have to replace a magazine at a very inconvenient time. That was refreshing.",7.0,Anonymous,"Action, Crime"
As personal as it can get!,"John Wick is a well made action movie that does not consist of big explosion and bigger sets. Most of its action pieces rely heavily on close combat and gun. It is stylishly and sleekly done with a tormented Keanu Reeves at the centre of things. The choreographed action sequences are very much close and personal with the brutality of every shot fired and every blow landed resonant in the shots. The directors who were formerly stunt directors have infused variety in the settings in which the action takes place and keep the action flowing. And one thing that really got me interested was how the movie weaves a community of thugs, smugglers, assassins and mob bosses. It seems as if it is altogether a different world with its own set of laws, ethics, codes and loyalties. Since the story is an internal one happening in the underbelly of New York city, this is the only world you get to see and it is intriguing and fascinating, so much like our world and so much unlike ours driven by our desire to survive and thrive. John Wick is the kind of action movie that is rare to find nowadays. If you like some old fashioned vendetta movie and love to see Keanu Reeves kicking some asses, this is the movie for you!",7.0,Anonymous,"Action, Crime"
Keanu Reeves is back.,"Keanu Reeves is back, HELL YEAH!!John Wick is a movie about, well, John Wick, a normal guy whose wife recently died and her dying gift to him was a dog. Theon the d**k less a**hole from Game of thrones was being his usual d**k self in this movie and decides to kill John wick's dog and steal his sweet ass mustang. Little did he know that John wick wasn't just some normal guy. And we get our revenge action movie. You don't kill someone's dog and steal their ride, you just don't.While many people might find the plot stupid or something, let me tell you, there is a lot more to it than a simple revenge tale. The movie knows what it is and executes it perfectly. But underneath all that revenge, there is some really cool world building going on. There are these rules, managements, neutral zones etc, which push John Wick from being just a simple brainless revenge movie. I hope they make sequels to it as there is A LOT of potential for this become an awesome franchise.Coming back to Keanu Reeves, HOLY S***, he was awesome in this movie. Being a Keanu Reeves fan, it is so great to see him finally get a role where he can shine again. The dude kills it as John Wick. He is cool, he is sleek and he is a total Bada**. Hell, he might give Liam Neeson and Matt Damon a run for their money. :p You appreciate him even more knowing that he did 90% of the stunts in this movie. Because of that, the action scenes consisted of long takes instead of the usual quick cuts we see in Hollywood movies and made the action SO MUCH BETTER. Couple that with good cinematography, slick and sleek directing and pumping soundtrack, and you get yourself an awesome RARE action movie.Another thing this movie did well was that even though John Wick is shown to be one of the best or THE BEST in his work, he is not invincible or immortal, at the end, he is a human. Many similar movies forget this point and make their heroes way TOO good that it takes you out of the experience.I really really hope this movie does well enough on the box office that we get a sequel from the same team. Highly recommended if you are looking for an action movie or are a Keanu Reeves fan.8.5/10",9.0,Anonymous,"Action, Crime"
Please see this movie.,"John Wick is an interesting film that came and went before our eyes. Yet those who did decide to give it a chance, seem to love it very much. It's 'Certified Fresh' on Rottentomatoes and has a 7.5 rating on IMDb as of right now. Impressive for a film that is basically one shoot out after the next....after the next....after the next.An ex hit-man comes out of retirement after he's attacked by three thugs in his home. This attack leaves him beaten, without a car and a dead dog, which was given to him by his recently deceased wife. Big mistake. Once these guys tries to sell the muscle car to a garage that strips parts, the owner seems to instantly recognize it. The man asks, who's car this is. Who cares? The young spoiled brat replies. I can tell you one thing, we beat his ass to get it, and his stupid dog too. Bam, punched in the face. The kid goes crying to his mob boss of a father, who then calls up that mechanic. Did you punch my son in the face? Yes sir, I did. Why, he asked. Well sir, because he stole John Wick's car...and killed his dog.Oh crap.This sets up the film, the classic revenge tale. Nothing really new here. We've seen dozens of films where the retired killer has to come out of retirement to revenge the death of a loved one. This time it happens to be a canine. The dog is adorably cute and my wife was in tears...TEARS I TELL YOU, when they killed the poor pup. About one scene before it happened, she says to me, ""Are they going to kill the dog?"" Terrified of the answer that I would not give her. Well, yes, they did. She instantly wanted John Wick to kill EVERYONE. So I guess when a dog gets it, you instantly want those responsible dead. Funny, I feel the same way. When people die on film, no big deal, but when an animal dies, all hell breaks lose.After that is out of the way, John Wick suits up to take out those who have wronged him. It just happens to be the son of his former boss. So when the boss finds out, he knows he's in trouble. So now he has to get to Wick before Wick gets to them. Thus, the body count piles up. It piles up in a finely tuned operatic fashion, as the action sequences are some of the best in the last few years. Wick uses his guns with precision. Shot to the chest, then to the head. It's robotic. One man against a dozen? Fair fight.To say the action in John Wick is stylized in an understatement. This is one of the best action films in years. Chad Stahelski, a stunt coordinator, makes his directing debut here. So he knows his way around a fight, being responsible for such films as the Expendables, The Wolverine, Tron: Legacy, and many many more. I like this new trend of giving people from different departments a chance at the directing chair. See what they can bring to the table. The man clearly knows his stuff, so give him a script to shoot and see what he can achieve. He nails it here. One impressive sequence has Wick going into a club, with multiple levels and rooms and takes out the bad guys one by one. First silently, then when all hell breaks lose, with calm and ease. Bottom line: This is one FUN film.Reeves never impresses with his acting ability. It's kind of a running gag with people that he cannot act his way out of a paper bag. One scene here has him actually showing some emotion, which is when he reads the letter from his wife after receiving the dog. The rest of the film is how bad ass can Reeves look while taking out dozens of people. The answer, really bad ass. Familiar faces show up, such as Willem Dafoe, as another assassin. Adrianne Palicki as a beautiful....well...assassin. Michael Nyqvist, from the original Girl With the Dragon Tattoo series, plays the Russian Mobster, whose son, Alfie Allen aka Theon Greyjoy, gets him into this mess. As if we needed another reason to hate Theon. Finally Ian McShane as a friendly face in a crowd of so few.The world created in John Wick is interesting to me. These assassins have gold coins that get them into these places that only the secret society of assassins can access. There are hidden clubs, hotel rooms, etc. How can all these assassins and hit-men be in a club and not want to shoot each other. Well, there seem to be certain rules. Don't break them, or there might be consequences.Those club scenes are really fun. Jonathan Sela, the DOP, bathes the film is icy blues and nice neon lighting for those club scenes. Giving it a heightened look and feel. Everything about the film feels smooth as ice, just like John Wick. The directing style reflects the lead character. Aggressive when it needs to be, but calm and collected most of the time. When I say aggressive, boy do I mean aggressive. Wick acts like a man with nothing to lose, no fear. He will walk right into the lions den to get the job done.John Wick is one of the biggest surprises of 2014 for me. While some might call it a no brainer repetitive action film I call it high class action fun. FUN is the key word here. Watching John Wick dispose of those bodies was fun. Seeing this society of people who all know each other was fun. Seeing Keanu Reeves back in the limelight doing what he does best? You called it...fun.",8.0,Anonymous,"Action, Crime"
John Wick busy equalizing,"A grieving hit man after a series of unfortunate events goes about exacting revenge on his former boss' son.Since Rocky 4 the stereotype Russian bad guy films seemed to ease off, however, mirroring the politics of today there appears to be an increasing influx of bad guy Russians, Equalizer, Taken 3, Jack Ryan, Die Hard 5 to name just a few. Amongst the abundance of them comes John Wick with its on location feel and slick action sequences.Wonderfully directed by Chad Stahelski & David Leitch's with great action scenes and Derek Kolstad's solid dialogue Wick goes from one scene to the next exacting revenge on those who have wronged him. Its a fine straightforward affair without the quirkiness or humour of the likes director Guy Ritchie or Paul McGuigan. Stahelski delivers a straight up action thriller with hard hitting violence, blood baths through a hotel, church, cars and blood spattered clubs. Unashamedly from the shootouts to knife fights it oozes cool, complemented by the lighting, sound design, music tracks and score from Tyler Bates.The cast are unprecedentedly on form with Michael Nyqvist, Alfie Allen, Adrianne Palicki and memorable Willem Dafoe. Bridget Moynahan and Ian McShane cameo with John Leguizamo small part effortlessly stealing the cameo show. Keane Reeves is perfectly cast with his minimal dialogue and screen presence.Even with its dark tone it's more fun than the comparable excellent Equalizer. Yes, like all actions there's an obligatory Jason Statham/Van Damme-like showdown/fight off and John Wick is unavoidably reminiscent of Get Carter and Payback but as a revenge action it is as completely rounded as they come - recommended.",,Anonymous,"Action, Crime"
"Action, Action, Action","The setting is similar to many comic themed movies; think Sin City. If you are looking for a mind blowing plot that keeps your attention throughout the movie this isn't the movie for you. However, if you are looking for fun, action packed film that keeps your attention for almost two hours then its the right flick to check out. I'm not exactly sure what the record is for most kills in a movie, however, would be that this would give it a run for the money. Every kill was done with such precision you find yourself excited about the next one. Its certainly nice to see Keanu back on the screen. Although not as good as Speed or Point Break, he gives a fantastic performance. Move aside Stephen Segal and Jean Claude! Fun movie to see on the big screen.",6.0,Anonymous,"Action, Crime"
Do not ever mess with other man's automobile. And his dog!,"Gritty, stylish and fast paced action film with very overused revenge/back from retirement plot. But you don't even notice the paper thin plot because of the strong characters and well directed action scenes. There were not a single dull moment in this hour and half long film. It was very good that writer/director didn't waste much time on the John Wick character's back story. We got to see the glimpse of his life and that was all the viewer needed. The mystery behind John Wick only grows when we see the first reactions of some other characters, when they learn that he has been attacked. It wasn't only John Wick's character that actually evolved without much development. Every talking scene we learned to know the players more and more, but just enough to keep them mysterious and keep us still interested. It's something that is missing in most of the newer action films. Real powerful acting work. It was real pleasure to see Keanu back at his top form. And kudos to the screenwriter who managed to write Russian dialog that actually sounded little bit like Russian, not just some pointless gibberish. And of course the actors, who managed to speak it understandably.",8.0,Anonymous,"Action, Crime"
Woof!,"Keanu Reeves is the John Wick of the title, a grieving one man army who gets tipped over the edge when gangsters kill his dog. Carnage ensues.The paying public do like a good revenge flick, there have been plenty this last couple of decades, and they do go down well. Once the set-up has been staged - Wick grieves at the loss of his loved one - gets some small joy via a pet - only to have that snatched away from him, then the film becomes a joyously unstoppable actioner.Wick, in good hands with a moody and beefy Reeves (face fuzz strange, though) strong in presence, cuts a swathe through the gangland eastern blockers. And that's pretty much it! Characterisations are thin on the ground, it's a bit nutty and of course preposterous, but boy is it fun. There you go, a box office winning actioner without pretensions. Enjoy. 7/10",7.0,Anonymous,"Action, Crime"
The Real Terminator 3,"Forget that garbage, that came after T2 ! This is the REAL TERMINATOR 3 ! Another fairy tale about another indestructible KILLING MACHINE ! YES! The fantasy of every child or puppy dog, who ever suffered at the hands of a bully. Acting? Did ARNIE need to act? Other than being ARNIE? Yup! Keanu has the chops! No Austrian accent, but you can't have everything. He mows down the BADDIES, like they were ""Dumb and Dumber"". Great photography, great muscle cars, and a non-stop path of destruction. A deadly stare, that'll be the last thing the MEANIES ever see! Is it realistic? Of course not! It's a DREAM. A real BAD DREAM if you F*CK with the ""Bad Man's"" puppy. Rated #1 by the SPCA.",8.0,Anonymous,"Action, Crime"
"Not the best action movie of the year, but it'st sly, swift and stylish","This is a sly, swift and stylish action movie that is actually a decent popcorn flick. Sure the plot isn't anything grand, but that isn't the core of this movie. A movie such as this needs a spark and how to go about it from there on. It isn't as adrenaline filled entertainment like ""The Raid"" or has a super well blended and enticing story mixed with action like ""The Raid 2"" but it'st still a pretty cool movie. And seeing Keanu Reeves kicking ass and taking names is just the bonus. Like I said the plot doesn't have anything that really stands out, but the stylish cinematography, choreography with enough cool action elements make this one worth at least one watch. Especially if you like action movies. However I could see why some audiences would not like this movie and why some people just wouldn't. You could really tell the directors got their ideas from past action movies, anime and video games. ""Max Payne 3"" really came to mind while watching this.7.5/10",7.0,Anonymous,"Action, Crime"
This thing's got bite. Nice change of pace.,"Keanu Reeves isn't the guy that seems suited for your usual revenge flick, but he works fairy well for ""John Wick"". There's an inherent detachment to Reeves for a good portion of the film, but he's also got that quiet brooding that roils beneath the surface.Probably the best thing about this movie are the action scenes, which aren't cut to shreds. They're well-staged and have a nice fluid brutality to them. Simple but effective.What was also really nice was the clearly defined (under)world with its coded language, currency ad protocols. It harked back to ""Payback"" and the mob-as-corporate-culture. Also, Wick had modern dress and domestic appointments (probably due to his departed wife), but he's using an old touchtone phone and getting around in circa '79s cars. Little touches that add character.It's great news that they're planning a sequel. They've already built the world, and I'm in for more.",7.0,Anonymous,"Action, Crime"
Disgusting,"So disgusting is this piece of filth that after one hour of perpetual killings, many of them graphic and sadistic, I simply had to leave the room and get some fresh air. I then immediately destroyed the DVD as a public service.The makers of this material should be arrested and imprisoned for corrupting society. And anyone who actually enjoys watching this ordure should immediately seek mental health advice. What plot there is can only be described as infantile and absurd. The film is simply a vehicle for promoting video games where the player searches out black hooded figures to exterminate them.We are expected to believe that a trained hit-man is woken at night by his puppy only to be hijacked by three (naturally) Russian mafia gangsters who beat him up, steal his treasured car and kill his dog.This same man then kills literally hundreds of security guards and other hit men who come at him one by one in a morbid procession of death. Night club revelers carry on regardless as security men are gunned down in their midst. Other security guards have their throats cut whilst seemingly standing there helplessly waiting for death.The concept that all these security men all have partners, mothers and families does not deter the hero. We are encouraged to think that any scale of revenge is permissible under all circumstances and to all proportions even though most of these murdered guards didn't actually do anything against him.The only merit of this film is that it represents perfectly the mentality of American culture; namely that if a cell of terrorists kill a few thousand Americans we are entitled to launch decades or war thereafter, bring tens of millions of innocent Muslim civilians into endless suffering and destroy the entire culture of the Middle East. Disproportionate revenge is the spirit of our age and John Wick is it's prophet.",1.0,Anonymous,"Action, Crime"
'Death Wish' meets 'Point Blank' !,"In today's day it is as hard to make a good action movie as it is to break box office records. Thrillers may be based on tried and tested formulate, but that is the reason why to bring something new and refreshing becomes harder and harder in this genre. 'John Wick' is a tale of revenge, a man with a violent past who is brought back to the life he left behind when he is brutally attacked and his dog is killed. The plot works because it doesn't try anything new, in fact it takes you back several decades to Lee Marvin in 'Point Blank'. Keanu Reeves's character of 'John Wick' is a throwback to Lee Marvin, Charles Bronson and every other bad ass who doesn't bother to say much but shoots instead. This in itself is refreshing, just a simple action thriller with no over-complicated storyline and ingenious twist. This movie is quite different to the other great tale of revenge released at the same time; 'The Equalizer', mainly because Keanu Reeves is a much different actor to Denzel Washington. John Wick is for the lovers of hard action and no frills!",8.0,Anonymous,"Action, Crime"
"Good movie, as long as you don't expect character development.","It's just good fun. The acting starts off kind of cheesy, but after the first 20 minutes, it's all action after that...and pretty good. For all those out there who studied Freud as an undergrad and like deep, multi- layered, multi-faceted characters, with a lot of character development...stay home and read a good book. If you need to get your mind off your boss who might (or might not) be an _ss, your parents (or your wife) nagging you, then this is the movie for you.Every movie can't have you in tears, or have you thinking, why were we put here on this planet, in this time, in this universe...or maybe, THIS is the parallel universe (I just blew your mind), blah, blah, blah. Bottom line is this movie will entertain you, give it a chance. It's about a man and his gun(s) getting revenge.",7.0,Anonymous,"Action, Crime"
Don't Set Him Off .......,"John Wick was an explosive, action packed thrill ride. Highly entertaining for the majority of the runtime thanks to the heart pounding music, breath taking stunts and Keanu Reeves himself. The cinematography used in this film is extraordinary especially during the night club scene where I have never witnessed Keanu Reeves kick that much ass since the matrix. There were stirring hand to hand combat scenes and verbal responses to the death scenes as I sat in my chair feeling the adrenaline throbbing in my insides. As for the performances, the acting was satisfying enough for an action flick, except for Willem Dafoe he was excellent, but c'mon he's always excellent.The action sequences were handled very nicely every shot was sharp and precise unlike recent action films that use shaky cam techniques, where you can't even identify whose fighting who. Which makes this a very refreshing action film, and highly satisfying for any one who wants Neo back on the big screen. I would highly recommend this film for any action lovers or any Keanu Reeves fan *(and Willem Dafoe). Hands down best 2014 Action flick and a successful resurrection for Kenau's career.",8.0,Anonymous,"Action, Crime"
Uneven and long but plenty of good ingredients,"John Wick might be the most uneven film I've seen in 2014. The premise is good and the film well-constructed but the pacing is poor. It takes far too long for the action to kick in. The first hour is all setup, with characters repeatedly telling each other (and the audience) that John Wick is really tough. However, it takes forever for us to actually see this, with only one good action sequence in the first hour. When the action finally kicks in, its pretty glorious, but it overstays its welcome in the final act. With one dramatic fight scene after another, towards the end John Wick feels too much like a video game, with the protagonist simply proceeding through enemies like levels.Keanu Reeves reminds us in the overlong opening act why producers and directors don't hire him for his acting talents. Fortunately, once the first hour has dragged on, he reminds us why we do hire him - he's a complete badass who at 50 plus years old is absolutely still in his prime. Dean Winters and Alfie Allen are excellent casting additions, though not exactly for acting talent, but for the presence they bring to the film.Overall, John Wick is a nice time-killer and most promisingly, constructs a world I would love to revisit (in a better paced sequel).",7.0,Anonymous,"Action, Crime"
Action hero has a new name!,"Action hero has anew name and his name is John Wick! This is a definite surprise movie for me- I didn't expect it to be as good as it was.Keanu has been out of the limelight for a while, but what an epic come back in my eyes. I can't help but think back to Bill and Ted days! (This is a far cry from those days!!!!) The long and short of it is that John Wick seeks revenge for the killing of his loved ones. Not original in idea, but still a good movie.Great action scenes, lot's of fighting, gun battles, twists and other stuff to make it what it is.If you like action movies, get it and watch it!",9.0,Anonymous,"Action, Crime"
