title,content,rating,username,genres
Don't mess with the dog!,"Keanu Reeves has not offered the cinematic world much since The Matrix trilogy. Can John Wick reignite his impact?Walking into the cinema... John Wick has had a positive buzz, but is it enough to get people to the theatres? The appeal is seeing Keanu back in his wheel house. Films with short bits of dialogue, subtle humour and a multitude of action. Not since Point Break has Reeves had a role that looked so right for him.Overall rating: 3 stars Cinematic value: 3.75 stars Family value: 1.5 stars'Fortune favours the brave' English translation of John Wick's tattoo'Do not mess with a man's dog' is basic knowledge in film class 101. From Old Yeller to Turner & Hooch, the dog serves as the catalyst for some of the key events in film history. John Wick is no different. Wick's last gift from his recently deceased wife is a puppy named Daisy. She serves as a connection to his wife and as comfort during his grief. Through a chance encounter with the Russian mafia, he is robbed and without spoiling too much of the story, they mess with the dog. Which unleashes a tale of revenge and a horrific day at the office for the men who robbed John Wick. Call it arrogance or naivety, these thieves robbed the wrong guy. Wick only recently retired from being a hit-man. Wick was not just any assassin, but The Bogeyman, feared by the mere mention of his name. The thieves cause the emotional tipping point for him to unleash his revenge on the dark criminal underworld. The story takes Wick on a hunt for the men who 'took away his opportunity to grieve' and through the process, his past is revealed and the audience is introduced to the hit-man's hidden world. His target through most of the film is Iosef Tarasov played by Alfie Allen (Game of Thrones), who seems to have perfected the pathetic, elder son role in television and on the big screen. The unsympathetic character of Iosef seems to warrant the inevitable vigilante justice from his introductory scene. As with most revenge films, the believability of survival of the main character goes beyond comprehension, but it is an undeniable, guilty pleasure to experience.Keanu Reeves (Matrix) is the champion for the average man. He never comes off as too smart or fit, but is at his best with little dialogue and multiple points of action. This film happens fast and is over before you can consider the sheer lunacy of the concept. The debutant directorial team of David Leitch and Chad Stahelski, give Reeves the perfect storyline to capitalise on his strengths. Like all of the action in this film, they seem to understand that the best lines come quick, subtle and hit their mark. John Wick is a simple story of revenge shot against a dark, criminal landscape, but moves beyond the cliché. Do not misunderstand, this film is exceptionally violent, but the actions of Reeves are projected thorough the film with a force that is fuelled by well drawn supporting characters. Michael Nyqvist, Ian McShane and Willem Dafoe manage well orchestrated dialogue and fill in the necessary back story to quicken the pace of the film. They allow Reeves to be the action lead and he is only required to deliver memorable one liners. The quick linguistic delivery adds the needed levity for the audience to catch their breath.The film deserves its rating due to violence and language, but it does open the door to many conversation points. John Wick wrestles with the love and loss of his wife. Opening a door into the raw emotion that occurs in the life of a spouse that grieves. The loneliness, love and anger spins together into a mix that is not healthy in this film, but warrants consideration and discussion. Should people be given allowance during a time of trauma of the magnitude? The other significant plot point that should be considered is 'The Code.' When the movie moves to The Continental Hotel, things get interesting. This is a world where hit men and women go for a place of neutrality. Winston (Ian McShane) is the owner and stresses the code that underpins this violent world. Only those within the system seem to know the code and understand the penalties for breaking it, but the bigger question is who is the one who determines the code and how should justice be enacted? John Wick is merely another revenge film, but even the simplest of stories can open the door for the bigger questions of life and could even fuel conversation for those who regularly attend these films.Leaving the cinema... This is a simple, but well made film. Cinematic simplicity is a fine line. The creators of the film have to determine what to add or take away for the effectiveness of a film. Sometimes it works and sometimes it does not, but with John Wick it works. This was the right film to capitalise on Keanu Reeves strengths and was a fresh telling of a well worn story line.If you remember anything, don't mess with the dog!Reel Dialogue: What are the bigger questions to consider from this film? 1. Is revenge the answer to injustice? (Psalm 37: 27-29, Romans 12:17-21) 2. What is biblical justice? (Psalm 7:9, Romans 3:5-6) 3. Who determines right and wrong? (John 3:19-21, Matthew 28:18)Please study the rating before going to see this film.Written by Russell Matthews based on a five star rating system @ Russelling Reviews #russellingreviews",7.0,Anonymous,"Action, Crime"
Keanu Reeves has starred in a good movie after a long time,"Keanu Reeves is back in form as "" John Wick "" and how. Keanu must have been waiting for a long time to play a role like this. Both John Wick's wife and the dog she had gifted him, get killed and he sets out to avenge their deaths. The movie is approximately an hour and a half long and comprises of some insane action sequences coupled with some amazing background music. And Keanu justifies playing a role like this all the more because his name is synonymous with "" The Matrix Trilogy"" and ""Speed"". Ever since the Matrix movies released I've always wanted Keanu to play meaningful action-oriented roles. Unfortunately he hadn't managed to bag such roles until he signed for this movie.Keanu's looks in this movie have been planned in accordance with the nature of his character and the trying times his character is shown to be going through.Also, another plus point of this movie is that the villains look menacing. In an 'out-an-out' action thriller like this, it's imperative that the villains look their parts and each and every one of them have played their parts to perfection. Willem Dafoe does a fantastic job as Marcus.So Keanu Reeves has been a part of a good movie after a long hiatus. Whch is why people should go to the nearest theater and watch this movie as soon as possible.",8.0,Anonymous,"Action, Crime"
I think a DVD of this film comes with your AARP membership...,"On one level, a kind of cartoony action film for fans of KR.On a deeper level, the films asks profound questions about valuable skills lost to society when competent people retire.On an historical level this film may be an unintended tribute to director Michael Winner, who died the year it was in production.This was exactly and precisely the sort of film that Winner specialized in, back in the glory days. Would have starred Charles Bronson (again, sadly, no longer with us).Haters begone. If JCVD and Segal can keep churning out muck at a age when they should be in rocking chairs, let's give good old KR a little rope .. and then wait to see who he hangs with it.",7.0,Anonymous,"Action, Crime"
"Welcome Back, Mr. Reeves! Welcome Back!","Absolutely remorseless, purely unadulterated & downright violent from start to finish, John Wick is possibly the most stylishly crafted, feverishly paced, seamlessly executed, intensely entertaining & immensely satisfying action flick to come out from Hollywood after a very long time which, apart from marking a welcome return to action for Keanu Reeves, also triumphs as one of the biggest cinematic surprises of the year, not to mention the coolest by far.Very refined in its visual presentation, taking a no-holds-barred approach with its content & providing heavy doses of pulse-pounding entertainment that many viewers will want to revisit again n again, John Wick is amongst the most impressive looking motion pictures of the year that takes its simple premise to an unexpected high, thanks to its kinetic direction, breathtaking action, neat cinematography, slick editing & a magnificent lead performance from Keanu Reeves.The film tells the story of its titular character who used to be an ultimate assassin but retired to take care of his dying wife. Losing her to cancer, he receives a posthumous gift from her in the form of a puppy, with whom he eventually connects. Things are set in motion when few Russian thugs invade his home to steal his car but also end up beating him & killing his dog. And so the ex-hit-man comes out of his retirement to unleash carnage on the gangsters who took everything away from him.Produced & directed by the first time filmmakers in Chad Stahelski & David Leitch, who until now had worked in the film industry as stunt coordinators, John Wick marks a stunning directional debut for both of them & is a spectacular start to their filmmaking careers. And Derek Kolstad's screenplay doesn't waste much time in setting up its premise or introducing its characters & gets right down on business from the start by telling just enough about Wick to get the plot moving.Technically, there is a lot to admire about John Wick as the film exhibits an otherworldly setting for a revenge thriller that makes minimal use of elements not relevant to the plot. Camera-work makes its mark in the close-combat sequences for it provides a clear view of the carnage & isn't ruined by excessive editing or shaky cam. Editing paces the story with vicious velocity while its cool soundtrack further enhances the experience by remaining in tone with the film's events.Coming to the performances, the film features a capable cast in Keanu Reeves, Willem Dafoe, Michael Nyqvist, Alfie Allen, Ian McShane, John Leguizamo & others, amongst which both Reeves & Dafoe end up impressing the most. With a character that's tailor-made for his talent & combined with his magnetic screen presence, Reeves delivers a swashbuckling performance & easily steals the show. Dafoe follows him close & despite his short role, manages to leave his mark.Yet the best thing about John Wick remains its action sequences that are stupendously carried out. With its debutant directors already well-versed in the field of action choreography & stunt work, the two manage to add new freshness to the combat sequences by nicely blending its gunplay with grounded martial arts to single-handedly elevate John Wick into the league of cinema's finest action entertainers to come out in recent years.On an overall scale, John Wick is a smart, sophisticated & incredibly well-polished cinema that nicely balances its high-octane action & finely enacted drama to succeed as a potent, kinetic & relentless entertainer. Helmed by two new directors who understand what great action is about, boasting a script that knows where to draw the line & spearheaded by Keanu Reeves' badass performance, John Wick is an instant classic that comes as a must for every action film fanatic out there.Welcome back, Mr. Reeves! Welcome back!",,Anonymous,"Action, Crime"
Razor-sharp hybrid of sizzling action and stylish noir,"The world of hitmen and mobsters is revitalized in this razor-sharp hybrid of sizzling action and stylish noir evocative of the old hard-boiled detective genre. Keanu Reeves is perfectly cast as the icy, superhuman hitman who finds himself making an involuntary comeback in the business after his wife dies and he falls victim to a violent burglary. Enter mega kill-mode! Naturally, Wick's skill is way beyond belief, and the film is willing to make every kind of concession in order to satisfy its own vanity, but it is so forward-moving and enterprising that it almost makes you believe it isn't completely self-centered and intrinsically cliché-ridden. John Wick is great fun for those who think stuff like this is great fun.",7.0,Anonymous,"Action, Crime"
The Start of an insanely compelling series,"John Wick is such a unique film from others as it goes straight into the story without needing to fill in about characters slowly for the first portion. John Wick makes sure you know its about the action first and the story second but it works so well weirdly. You learn about these different aspects in this universe as compared to real life and it confuses you at first but you become comfortable with it eventually. The fight scenes are top tier with the cinematography being second to none. Though I can understand someone liking this film more I view it more as a perfect building block for the insane story ahead, keeping itself simple as to not over do you with what's yet to come. The antagonists were perfect for the movie but not perfect themselves as it felt purposeful to leave room for improvement in that area for the future movies.",7.0,Anonymous,"Action, Crime"
Must watch!,"It's an awesome movie and I really liked it but one thing I that didn't made sense to me was that who takes so hard revenge for a car and a dog? Other than that I say that GO AND WATCH THE MOVIE!!! movie starts like this..... The movie's setup is almost comical in its simplicity. Reeves plays the hero of the title, a legendarily immortal (almost Keyser Söze-like) hit-man who retired from the profession five years earlier when he fell in love. But his wife has just passed away, and some hot- headed Russian gangster (Game of Thrones' Alfie Allen) has foolishly interrupted his grieving by stealing his 1969 Ford Mustang, beating the snot out of him, and killing his dog. And you just don't mess with a man's dog. John Wick is back in business. Decked out in a natty black three-piece suit and a scruffy beard, Wick is a classic man of few words. He's Clint Eastwood minus the cheroot and the spaghetti. I'd be surprised if he speaks more than a dozen lines in the film. But when he opens his mouth, you can be damn sure he means what he says. His is the language of high-caliber bursts of lead and acrobatic fists-of-fury beat-downs.",9.0,Anonymous,"Action, Crime"
Unable to understand the negativity??,"Expectations of audience - Oscar winning script and storyline. ""Seriously""?? What were you expecting after seeing promos?? If audience was that smart, why watch it at the first place. Ohhh, ""To trash talk""..You watch such movies for thrill and that's it. What are you trying understand or dig? Movie was publicized as action/thriller and that's what it was. I had fun watching it. Seen it before, saw it again. What does it prove? Answer - difference of opinion.Entertained with shooting sequences and satisfied with murder of Greyjoy and the scoundrel bunch😏",7.0,Anonymous,"Action, Crime"
A fun movie with good action scenes.,"John wick is a very good movie, its plot is understandable and it's basically Keanu pissed and killing everyone. It could tend to get a bit boring for me, but the action scenes are what are interesting. I love Keanu Reeves, but it just felt like he played as Keanu Reeves. I don't really see a John Wick.",7.0,Anonymous,"Action, Crime"
Duty to society,"As one of my fellow reviewers recommended in one of the earlier comments, I saw the movie and now I am doing my duty to society, getting this abomination closer to the rating it should have. This is the cinema version of another abomination which is poisoning our children's brains these days, Fortnite. Nothing but mindless, senseless killing. I am sorry for Keanu Reeves for having his name forever linked to this pile of garbage.",1.0,Anonymous,"Action, Crime"
Bad-Ass Personafied!,"'John Wick' is pure fun. A mind-blowing action flick, that's high on energy & extremely high on vengeance. The fast-pace along-with astounding action-sequences, make this 2014 box-office hit, a certified winner!'John Wick' Synopsis: An ex-hit-man comes out of retirement to track down the gangsters that took everything from him.'John Wick' is a complete action entertainer. Its very well paced & competently executed. Derek Kolstad's Screenplay focuses of pure brutal action & is superbly gripping. Chad Stahelski's Direction is more than satisfactory. Cinematography is skilled. Editing is sharp. Action-Sequences are just amazing. Each & Every Stunt has been choreographed magnificently.Performance-Wise: Keanu Reeves is at his very best! As John Wick, the revenge-driven protagonist, Reeves hits the right target & reaffirms his status as an action star. Willem Dafoe is in terrific form, yet again. Ian McShane has a brief role, but leaves a solid mark. John Leguizamo shines. Michael Nyqvist as the antagonist, is fabulously evil.On the whole, Love Action Films? Watch 'John Wick'. It can't get better than this!",9.0,Anonymous,"Action, Crime"
"Visually slick, a lot of fun","Ultimately, doesn't really amount to much in terms of substance. But the film clearly knows that, the filmmakers are very aware and they play it up to its maximum potential. Reeves actually makes for a solid action lead here, and the film does good with its incredible style by allowing a lot of quiet intensity to play out before the big action scenes. The film is incredibly stylized, so I could see that being a problem for many, but to me, completely reminiscent of Drive and everything that art-house action can do. I don't know how the film will hold up in the future, but as of now, I'm in sort of love. I highly recommend this, aesthetically very pleasing and also a lot of fun.",,Anonymous,"Action, Crime"
Good story but didn't tell more about the main character,"I'm going to review this movie based on four things: The story, the cinema photography, and the characters.
The Story: well the story is based on revenge and it's interesting to see how these kind of story end up, but the annoying part is that all he is doing is just killing they could have just showed us a background of his story
Also I liked that he wont stop at nothing to get his revenge it shows us that he's detrement I really liked that about the story.
Character: Keanu Reeves played John Wick really well. his look, his hair are well suited, speaking of suits the suits in the movie look really good and it makes him look like a villain.
Most of the characters did a good job in the movie. Also I really enjoyed Keanu Reeves shooting skills he shoots like it's a real gun whcih is really nice .
cinema photography: They did a good job in terms of continuous shot while he was shooting people
The low light/ dark shots were nice not too dark no to bright
So yeah I gave it 8.0/10 since they didn't show more of his story rather they showwed more of him killing.",7.0,Anonymous,"Action, Crime"
"Stunning, Intense and Cool.","This is one stunning film, i mean the one that makes you watch it with cooling grace of fantastic acting, settings, fight scenes, quick paced madness that is John Wick.The ""Coolest Hit-man"" you will know.But the kicker with this thrill ride is the way the frame matched perfectly with the acting and SOUNDTRACK. This Soundtrack is beautiful, memorizing and enchanting. Absolutely loved the way it brought you deeper into someone we come to sympathize for, for who he really is. The paradox you discover along the way. Totally engaging you.Highly recommend this, Loud, dark and intense film.",10.0,Anonymous,"Action, Crime"
Great entertainment,"It's dumb fun, good dumb fun. Most of the issues with this movie are drowned out with the amazing action sequences, and the fast, exhibilirating pace. It has some creative use of color, and good cinematography, but what holds it down for me is only a few cliches, over exposition, and under developed characters. It could be more creative, with a movie like this you can do anything that fits the excitement, but some things are very basic, like the exposition, some times it does a great job at the ""show don't tell rule"", then right after has the characters talking about John Wick's back story instead of just showing us, like I would prefer. Either way, it is entertaining, and that's all it really needs to be.",7.0,Anonymous,"Action, Crime"
A ballet with guns and a brand new world.,"The directorial debut of Chad Stahelski, former stuntman of Keanu Reeves, is everything a fan of the genre, for a long time, has been expecting. With a beautiful choreographed violence, with very well made clichés and presenting a small new world of empathic criminals, creditors of dangerous deadly skills, John Wick is the name that everyone should know.Called to be the best action film of 2014, John Wick is a violent dance of bullet and blood that reflects all the years of experience of it's director as a stunt man and stunt coordinator. Each armed combat we have the opportunity to enjoy is wonderfully imagined, well polished and sublimely executed by a Reeves, that finally, is back, and apparently with a name that could have the title of legend. Filling the 101 minutes of pleasant clichés, Derek Kolstad delivers a script with a new and unique underworld, made out of rules that must be obeyed and a moral code that can be broken if the price is right. With a simple plot, good humor and a Keanu Reeves back to his days of anti-hero chosen by chance, John Wick is a possible franchise that should continue with its beautifully made clichés, that should exaggerate their camera movements and that should fill with cameos every table of that little new world.John Wick: 8/10.",10.0,Anonymous,"Action, Crime"
Point Blank range of goodness,"I really liked this film and was really not expecting to. Whenever Keanu Reeves dons a beard, he turns into this believable bad ass that is fun to watch. While I don't think the character of John Wick had really any amazing hand-to-hand fighting skills, his real skill was the point blank range shot. No hesitation, just one after another killed by his skill for doing this. It was quite brutal, I'll be honest, but nonetheless very effective. Theon Greyjoy was unrecognizable (at first) as the snotty son who thought he could get away with killing Wick's dog. I loved the whole hotel/safehouse aspect of the story, that was pretty cool. I haven't seen the sequel yet but I've been told it's better than the first one so I'm looking forward to seeing it soon.Overall, I would recommend this movie to action lovers for sure and maybe those who are looking for a good action movie because there hasn't been a good one in quite a while it seems.",7.0,Anonymous,"Action, Crime"
