title,content,rating,username,genres
Glued to the screen,"John wick was something very fresh in an age of action movies, what I believe drove it's success and appeal to an audience that seemed to grow and grow was the hand to hand combat, John using many different fighting techniques, weapons and all of it felt and looked so real, there were so many continuing shots and it's a testament to Keanu who performed the majority of his own stunts.The story is simple, his wife passes and leaves him a dog who ends up getting killed by a Russian thug who is the son of a high up Russian mobster. Believe me when I say it's not the story we show up for, it's nice to get it and in further movies we do, but it's the action.With so many comic movies and other action movies I can't think of many that even come close to these fight scenes, Netflix Daredevil would be the closest.I enjoyed most of this movie, not to gone on the last 20 minutes to be honest but overall it's a fantastic movie.",8.0,Anonymous,"Action, Crime"
Shoot 'em Up,"There's something simple yet brilliant about the concept of a film that fills in all the gaps of our imagination and attention span, one that refuses to dilly dally with furthering plot points and ulterior motives that lead characters to do the things they do and say the things they say. 'John Wick' brings us everything we wished for from quick action, simple story, and an accessible premise--get the guys who killed my dog and stole my car. What's even more brilliant than the simple story is the style this debut director has developed almost by accident. We have excellent neo-noir cinematography, quick and witty dialogue, and grungy 90's video game rock play in our eardrums, sprinkled in with excessive gun violence and relentless kick-assery. If this first installment of a great idea doesn't fulfill your aggressive emotions, I don't know what will.",10.0,Anonymous,"Action, Crime"
"Keanu Is In It? Okay, I'll Watch","What can I say? The boyfriend loves this film, and I, like the rest of the world, love Keanu. If he's in it, I am okay with watching it. It's an okay movie. When the shooting scenes become unrealistic and excessive, I become a little ho-hum about the film. That's what happened here. Give me Speed, or give me death!! (Speed is my favorite Keanu movie.)",6.0,Anonymous,"Action, Crime"
A Stunning Achievement in Action: John Wick Combines Thrilling Action Sequences with Emotional Depth,"John Wick is a movie that has quickly become a classic in the action genre. The film stars Keanu Reeves as the title character, a retired hitman who is forced back into the game after the death of his wife and the theft of his prized possession - a vintage Mustang.One of the most impressive things about John Wick is its stunning action sequences. The choreography is impeccable, with Reeves and the stunt team pulling off some truly breathtaking moves. The fight scenes are intense and violent, but never feel gratuitous or over-the-top. They are always in service of the story, and serve to highlight the skill and determination of John Wick.But what sets John Wick apart from other action movies is its attention to detail. Every aspect of the film feels carefully crafted and considered, from the stunning cinematography to the intricate world-building. The film takes place in a unique universe where hitmen have their own currency, hotels, and rules of engagement. It's a world that feels both familiar and completely new.One of the standout performances in the film comes from Willem Dafoe as Marcus, a fellow hitman and friend of John Wick. Dafoe brings a quiet intensity to the role, and his scenes with Reeves crackle with chemistry and tension. Another standout is Michael Nyqvist as Viggo Tarasov, the film's main villain. Nyqvist plays Viggo with a quiet menace, making him a formidable opponent for John Wick.But ultimately, the film belongs to Reeves. He brings a quiet intensity to the role, conveying both the pain and determination of a man who has lost everything. His physical performance is also incredibly impressive, with Reeves performing many of his own stunts and fight scenes. It's clear that he put in a lot of work to bring John Wick to life, and it pays off in spades.One of the things that sets John Wick apart from other action movies is its commitment to world-building. The film creates a rich, complex universe that feels like it could exist outside of the confines of the film itself. From the Continental Hotel, a safe haven for hitmen, to the intricate rules that govern the world of assassins, every detail is considered and adds to the overall experience of the film.But despite its impressive world-building and stunning action sequences, what really sets John Wick apart is its emotional core. At its heart, the film is a story of love and loss, of a man driven to violence by his grief. It's a powerful and relatable story, and one that elevates the film beyond its genre trappings.Overall, John Wick is a stunning achievement in the action genre. It's a film that is both beautiful and brutal, with incredible performances and some of the best action sequences in recent memory. It's a film that deserves to be seen and celebrated, and one that will undoubtedly stand the test of time. If you haven't seen it yet, do yourself a favor and check it out.",9.0,Anonymous,"Action, Crime"
A great action movie,"This is a great action movie. The premise is as simple as it is effective: John Wick loses everything, and goes on a revenge spree. The reason why it works so well, is that the characters and the setting are both very interesting, and the action scenes are very good.The movie is set in an almost comic book like world, where there's a community of hit men and people in the underworld, with their own set of morals and code. They all use certain businesses (or services), which ties them all together. It's this universe that makes me curious for sequels to John Wick. The characters in this universe are mostly quite fun, and a lot of that owes to great casting. The way they gradually reveal John Wick's past is interesting, and it leaves you wanting to know more about who he once was.But, despite all the good things about the movie, it never elevates above its genre.",7.0,Anonymous,"Action, Crime"
Fighting as dance,"Perfects the genre of action movie by distilling it down to a tight, simple-yet-dramatic story, and expert fight choreography. Set to an entrancing soundtrack and shot in long takes. It succeeds by sticking tightly to these basic principles.",9.0,Anonymous,"Action, Crime"
An alright film but loud,"It was a good action film and I did really enjoy it, but where the action and the background music were loud the actors spoke too quietly, it was very confusing as I sometimes had to rewind scenes to hear what was going on.",6.0,Anonymous,"Action, Crime"
John Wick is a standout entry in the action genre,"I recently revisited John Wick (2014) on Netflix. The film follows a retired assassin who emerges from retirement following a devastating home invasion that results in the death of his beloved dog. Seeking vengeance, Wick hunts down those responsible, leaving a trail of destruction in his wake.Directed by Chad Stahelski (known for the John Wick series), the film features a stellar cast including Keanu Reeves (The Matrix), Willem Dafoe (Spider-Man), John Leguizamo (Spawn), Ian McShane (Deadwood), Alfie Allen (Game of Thrones) and David Patrick Kelly (The Warriors).For fans of the action genre, John Wick is a feast for the senses. Reeves shines as the stoic yet relentless hero, while Leguizamo and McShane deliver captivating supporting performances. Dafoe's presence adds an extra layer of intrigue to the narrative. The film sets up its backstory and circumstances effectively, and the action sequences are nothing short of spectacular. With well-choreographed fight scenes and impressive gore, the film keeps audiences on the edge of their seats. The intense shootouts are executed with precision, making it easy to rally behind the protagonist in his quest for justice. Plus, the film boasts a memorable soundtrack that complements the adrenaline-pumping action.In conclusion, John Wick is a standout entry in the action genre, earning a solid 7.5-8/10 rating and a strong recommendation.",8.0,Anonymous,"Action, Crime"
Hypnotized somewhat,"Need to make a John wick on how he became John wick for real ,the younger years......epic money!!!!!!",7.0,Anonymous,"Action, Crime"
totally boring and utterly ridiculous movie,"though i usually enjoy more movies where there is a delicate balance between substance and style - the film has an intelligent story and characterization that produces deep emotions, too - i also find great and perhaps a little guilty pleasure watching action films once in a while but this is one of the films in its genre in which i simply do not find anything enjoyable or pleasurable at all. it is totally boring and utterly ridiculous watching experience and i only wonder why on earth it was ever even made in the first place? there is NOTHING original. everything has been seen hundreds of times in hundreds of other movies...the characters are silly the story is totally predictable almost in every turn and there is absolutely no humor which may be the worst thing of all: all the people concerned producing this piece of stupid crap take themselves so damn too seriously and that is the most apparent source of yawn breaking boredom most viewers must feel at it. it is just another stupid piece of dull action cinema.keanu reeves who is still a sight for most female and many male sore eyes even in his fifties cannot save it (i think quite few women would have the overwhelming interest to watch the film despite its handsome protagonist). reeves as a retired professional hit man is as irritating cardboard character as anything else in the film. for most male viewers it is still enough if you slaughter a hundred guys around you with a relevant weapons arsenal and sprinkle blood on the walls in endless killing euphoria while on your vengeance tour de force but that kind of treatment when consistent all the way from the beginning to the end rarely makes a very good action movie. there must be something more.i admit that south koreans who are the real masters of the action genre nowadays have sometimes managed to do a fair movie from the scratch but this film crew has not been able to do so.total waste of time.",1.0,Anonymous,"Action, Crime"
Great action movie,"I'm watching this movie for the first time in 2021, and I loved it. They kill his dog, he kills hundreds for revenge. What more do you need in an action movie? Good old 80's style.",9.0,Anonymous,"Action, Crime"
The return of Keanu,Keanu returns in full force. After many bad movies he returned to what he's good at. Taking a simple movie and working with a director who understands action. The thing I love the most is the long takes compared to quick cuts in the taken movies during fight scenes.,8.0,Anonymous,"Action, Crime"
Boring despite the violence.,So much violence for nothing. He can kill more than Stalonne and Schwarzenegger together.,6.0,Anonymous,"Action, Crime"
Satisfying film.,"Everything was in good place. We had Action, drama and comedy in one gold movie. Emotions while watching this film were incredible. I've seen some action movies in my life, and this one is for sure one of the best I could watch. In short I can recommend this movie to every one, because if you are looking for the movie of action with deep story about our protagonist, but also don't want to know everything about his life then you, my friend are at a good place. Because even if he doesn't have life that look like life of a regular person, he have normal human emotions and motives. What can I say, if you want to know if I'm telling the truth then better watch it yourself.",9.0,Anonymous,"Action, Crime"
aesthetic and violent,"As John Wick: Chapter 2 is on screens and gets unexpected good reviews and not only from fans, I thought that it's a good opportunity to see the first and original John Wick which also received some positive echos, much above what is typically delivered for a film in its genre. It's certainly a matter of setting expectations, but I personally was not disappointed. If violent action movies are one of the genres that entertain you, good chances that you will not be disappointed either.Rule #1 to enjoy such a film is to accept the conventions of the genre. The story takes place in the parallel universe of the crime underworld. Although bodies start to accumulate in piles pretty soon, there is no policeman in view with the exception of one cop showing up at one point, looking at the scene of the carnage and wishing good evening to the hero who happens to be a professional killer. This parallel universe is not lawless, it's just that the laws or better said the rules are different. There is a code of honor, there are territories of neutrality, and there is only one punishment - death - for breaking rules or trespassing borders. At the roots of the story stands a failed tentative by the main hero to break the cycle of violence of his profession and jump in the universe of normal people. All this is just memories when the action starts. This film is for Keanu Reeves what 'Jack Reacher' is for Tom Cruise and I suspect that at some point even taking the name of the hero as a title is not a coincidence. It's the start of a series and the second installment was not too late to come.Assuming you bought into the story and the convention, there is some good stuff to enjoy. Stuntman Chad Stahelski is sitting for the first time on the film director chair and he delivers exactly what is expected - a coherent story telling and perfect choreography of the many action scenes that occupy more than half of the duration of the movie. Keanu Reeves delivers what is expected, and a few other fine actors show up in small and even smaller supporting roles. Cinematography is just beautiful, with combinations of dark colors that fit well the violent dark universe that they populate. If you can just forget how sketchy the whole story (or pretext) of the film is, you have good reasons to enjoy it.",6.0,Anonymous,"Action, Crime"
Essentially a slick revenge action cartoon,"It's a human revenge action cartoon set in the 2010s in New York City and New Jersey. It follows a former hitman, John Wick (Keanu Reeves), for the Russian Mafia, who left the criminal life to marry Helen (Bridget Moynahan) a little over five years previously. Helen dies of a fatal disease but bequeaths a little beagle puppy to aid in his grief. However, Iosef Tarasov (Alfie Allen), the son of Russian Mafia leader Viggo Tarasov (Michael Nyqvist), has an encounter with Wick that ends in Iosef stealing Wick's prize car, killing the beagle, and injuring Wick.This incident draws Wick into revenge mode that, by some counts, results in 80 deaths--77 of them by John Wick. Some of the more interesting characters he engages with include fellow assassin Ms. Perkins (Adrianne Palicki), former mentor and expert sniper Marcus (Willem Dafoe, and Viggo Tarasov's attorney, Avi (Dean Winters). By the end of this movie, Dean Winters looks a lot like his character in the mayhem insurance ads.One can only describe ""John Wick"" as a cartoon. The body count (more than one every two minutes), the accuracy of Wick's shooting, the superficial character development, the limited plot, and the breakneck action after a soulful introduction all suggest a cartoon. Keanu Reeves acts and looks like a decent anti-hero. Despite all the violence, there is surprisingly little blood. The body count apparently goes up in all the subsequent Wick movies, so one of these might be enough. It was entertaining for one time, though.",7.0,Anonymous,"Action, Crime"
Template for how to make a great action movie!,"Who would've thought a movie about someone taking revenge for their dog, would lead to one of the best action franchises of all time?Rewatching the first one after all this time, John Wick isn't as badass here as he is in later entries. He survives a lot because the antagonist don't simply kill him or because his friend saves him. It also ends weirdly with a one on one fight with an old man.Nevertheless, it is still a terrific action movie with memorable action sequences such as the house and the club shoot-out. Keanu was also a great casting choice!This should be a template for how to make a great action movie!",8.0,Anonymous,"Action, Crime"
Don't waste your time,"Shitty movie. Honestly, after the first 20 minutes, I had to turn if off. Really? Killing a dog? Was that necessary? Also, it hurt my ears to hear the TERRIBLE Russian being spoken by the ""bad dudes"", and the guys who play the gang members aren't even Russian for god sakes. And as a Russian, I gotta say I am also incredibly sick of Hollywood literally ALWAYS using Russians as the ""bad guys"". Change it up for once. Keanu Reeves has played the same character- even if different movies- for the last several years. Blah blah, revenge, ex-hit-man, blah blah, good guy versus bad guys, blah blah blah. Hollywood movies these days are all identical and lack originality. Save your time and watch something older, like an action movie from the 80s and 90s.",2.0,Anonymous,"Action, Crime"
Easily the best balls out action film in along time.,"It's really good. It's a bit like the crow in away he only kills bad people you don't have to feel bad.
Wick actually goes out of his way by not killing certain former colleagues.
Excellent use of music and great to see Ian mcshane.
Excellent performance all around.
It's easily the best film in the John Wick franchise.",10.0,Anonymous,"Action, Crime"
Great ACTION Film,"I have no earthly idea why people want this to be anything else than it is supposed to be - it is an endless shoot em' out. It is unashamed of this, it boldly pronounces this. It is pure action incarnate, like the movie 300. If you're looking for something deep, look elsewhere.This is not to say that there is no plot - the story fits in (and thought-out the sequels) nicely enough. This should be seen in light of the other movies, as a collection or part of one panoramic picture. In doing so, you will unearth the plot which I will not be spoiling here.If you're sick of what one would stuggle to call a ""storyline"" in modern movies, this is great break from that. It is akin to The Northman, one of these gems or an 'out' for the typical trash in circulation.Keanu Reeves plays his part excellently. Cold, ruthless, and original. In fact, compared to other classic action films like the Transporter, his style has a bit more ""realism"" to it. With a rigid repeatable technique, he kills his enemies.My real rating for this is an 8.",10.0,Anonymous,"Action, Crime"
A Great B movie on a mainstream market,"Aahhh, it took me a while to watch this movie, because it looks like just another bad action flick, the poster is not helping either. I love films, from foreign, docs,festival to the Hollywood blockbusters of all genres. I hunt for certain directors, and I do love intellectual films or some might call them art flicks. But the genre that I do miss is the action trash ( grind house films ) In the glory days of VHS, many films were released only for the VHS market. Many of those are the simple, dirty action films, some are bad and some are so bad it's great. Well..John Wick reminds me of that. No BS, revenge films.If you are aware of the Charles Bronson's Death wish, John wick has a similar idea. Recently I am very happy with what Liam Neeson does ( Taken 1,2 and A walk among tombstone )John wick has similar feel . Don't expect Cannes films or look for holes, this is, like I said a B movie on a mainstream market. Great ride, shoot'em up midnight snack ( only if those seedy cinemas still around )",7.0,Anonymous,"Action, Crime"
Great Movie,"John Wick is a well made movie with good acting, visual effects, and sound design. Although the concept of its plot is a bit stupid, it was able to expound on it and make it less shallow by giving it more background and motive. One of the best aspects is its acting. The movie's action scenes were well made, and the actors chosen to fit these roles performed well in these scenes. This, combined with well done visual effects and sound design, kept the audience on the edge of their seats. But despite this, the concept the plot is based of is quite shallow. Though the writers gave it more background and motive in an attempt to expound on the concept, their efforts are unable to fully mask its flaws in the plot.For me, this movie was able to differentiate itself from most of the other action films that I have watched. What made the movie stick out for me was its ability to take a generally predictable plot formula and expound on it. Although storyline is not the movie's strongest points, thee film's writers were able to mask the concept and change the sequence ""formula"" to make it less predictable and more interesting.",8.0,Anonymous,"Action, Crime"
"Yeah, I'm Thinking Keanu Reeves Is Back!","American cinema has been continually producing very bland and forgettable action movies (The Equalizer serves as a recent example— does anyone even remember that movie?). This year's earlier martial arts showcase, The Raid 2, easily beats out everything else from the genre's crop, and that is especially including the Marvel/superhero movies that are more about spectacular set pieces than innovative, fascinating action choreography. Well, maybe the American Kung-Fu fan/renowned action star is the best chance we have at an effective American action film at this point.""People keep asking if I'm back; yeah, I'm thinking I'm back!"" Keanu Reeves returns to staple badassery as John Wick who has recently lost his wife to cancer. After the painful funeral, he unexpectedly receives a delivery package at his door—a final gift from his wife in order to help ease his grief: a cute, little dog. Of course, trouble never ceases to find Wick and after unintentionally pissing off a group of Russian mobsters at a gas station, they give him an unpleasant visit where he witnesses the murder of his dog and suffers a brutal beating. Oh, it's on! Little do those guys know who they're messing with—a bogeyman who has even spooked the mob boss into beating some sense into his culprit son and letting him know what exactly he has done. John Wick—with his deadly skills teased and his true background mysterious— readies his weapons, and pure ruthless revenge ensues from there on out.The movie accomplishes just what American action cinema fails at every time. The action sequences are filmed with the use of astonishing cinematography—plenty of wide shots to perfectly display everything that transpires on-screen without confusing the audience. The camera invariably gives us a good layout of the particular environment, which is followed by John Wick's clever utilization of those surroundings to break bones and rupture skulls. In fact, the film is so embellished with glitzy style that even its subtitles come all vibrantly colored with a catchy font and ingenious screen placement.The majority of the film is set at nighttime, and thus, we get that metropolitan vibe along with a dusky color palette—an alluring greenish/bluish hue. In addition, a groovy, cool soundtrack incessantly complements the impressive action sequences; the best segment taking place in a violet-lit, intensely-staged night club as guns blaze and dubstep drowns out the screams. And despite Keanu Reeve's transparently limited acting range, this tough-as-nails role certainly plays to his strengths with the intimidating monotone one-liner delivery and that never-ending, rigid look of sheer ire.Unlike The Raid 2 however, there's no compelling narrative to give the film's duration any necessity to continue. John Wick simply comprises one action scene after another. Unfortunately, the combat gets repetitive fairly quickly—repeating wrestling techniques (choke holds, etc.) and blowing brains out with the same up-close strategy—and it honestly feels like the plot struggles with where to proceed next. ""Oh, I need to kill this guy, and now I have to kill this other guy in another location."" The story essentially follows this formula and hopes that the viewers find that adequate enough for non-stop entertainment. An hour in though, it clearly begins to drag and doesn't show any sort of storytelling restraint in terms of when enough is enough, which is the same issue The Equalizer shared.If this high-octane extravaganza was only slimmed down by thirty minutes, it would've made for a far more satisfying and memorable experience, but I just can't say that John Wick even compares to the consistent mastery The Raid 2 boasted. This one has its fair share of cheesy, awkward moments (albeit with intention) but also just overall shallowness. With that being said, beholding the first hour alone makes it worth seeing over every American action movie this year (I still don't know if that says a lot about the staleness of the genre nowadays, or if I should just accept that John Wick surely possesses stunning quality?).",6.0,Anonymous,"Action, Crime"
Absolutely awesome!,"Awesome overload!!! I love this movie the most out of all the John Wick sequels. It's fast moving, intense, epic and did I mention just awesome?!",10.0,Anonymous,"Action, Crime"
