title,content,rating,username,genres
Wasted number of minutes,"122No special meaning attached to that number, just the number of minutes I wasted watching Knowing, knowing that Nicholas Cage will usually take any job that comes along in rarely a quality film (Adaptation (2002) was the last good one, I believe). John Koestler (Cage), an astrophysicist from MIT, discovers meaning in a random list of numbers pulled from a fifty year old time capsule.It doesn't take him long to figure out the numbers predict disasters since 1959; what he never figures out is what a disaster the film is, a compendium of sci-fi clichés from creepy mute Aryans to a clueless MIT professor, who continues to put him and his motherless son in harms way through stupidity hardly becoming an intellectual.That Koestler lost his wife last year seems a staple now of the genre; that he meets an attractive single mom crucial to the solving of the mystery is another common element. That no meaningful thematic or character development issues color the bland here is painfully obvious after that grueling 122 minutes The last line of the film is, ""This is not the end."" I certainly hope it is; a sequel would leave the free ticket-holder preview audience as burned as the blazing sun in summer at the equator.Let this be the end, please.",,Anonymous,Mystery
Knows a lot! Until the end,"Knowing is one of those sci-fi films that rely on a jaw-dropping ending. Something really well thought out and intelligent. Unfortunately Knowing fails to deliver that impact. The film starts off brilliantly with an interesting flashback to a distant little girl who scribbles a load of numbers into a time capsule. Flash-forward to 50 years later and who ends up getting that picture but Nicolas Cage's son (not his actual son, but you know). I thought the film did quite a good job of building up th characters and creating an involving storyline, so you cared what happened Nicolas and his family. Although some of it was schmaltzy and over-sentimental such as the sign language when his son went to bed, but it made a great effort of caring for the characters.Some of it did defy belief as well, such as randomly noticing that the bunch of numbers had a link to 9/11 but I suppose the story does need something to push it along, whatever that may be. But what's great about Knowing is that it's never boring, thanks to the great build-up to the disasters. The disasters themselves aren't that incredible, but the build-up of not knowing what's going to happen is highly suspenseful. As the mystery unfolds it also becomes incredibly gripping, and you look forward to what the end is going to offer! Unfortunately it doesn't offer much.I found the ending to be incredibly clunky and awkward. It didn't feel as if it fitted within the film and also seemed lazy and plonked. The ending was a total cop-out to me and it's a shame because the build-up getting there is marvellously entertaining, but all you get is a piece of hokum that deserved to be something intelligent. However, Knowing is not an amazingly clever film, it's just a piece of entertainment and it certainly achieves that. Nicolas Cage is as wooden as ever, but if you can over look that, then it's certainly a film worthy of your time (if you can learn to forgive the ending). The special effects are quite impressive too.",7.0,Anonymous,Mystery
Religious theme?,"I haven't seen this film since the release date but i'm sure i have a few comments to put forward still :) I have seen many films with Nicholas Cage and there is none like this. I believe not only is this film based on supernatural beings but also that this film brings a religious point to not conflict it, but instead pair with it.Although not religious myself i am of the understanding that in the bible, God promised a promised land. Could this be a message, i also see the supernatural figures as a representation of angels.However, this could all not be the the point of the film, but that is how i interpreted it.The film brings deep meaning as well as a horror, thriller and action stance to it.7 out of 10 Thanks guys",6.0,Anonymous,Mystery
You don't have to Know - just check your brain in and give it a chance.,"Knowing is a film that requires the suspension of disbelief, but then so too does The Sixth Sense, Aliens and Terminator 2, and we easily manage with them and they are considered classics. For some reason this has been panned a little for being unbelievable yet a child who can see and interact with dead people does not.In any case the first 90 minutes of Knowing is consistently engaging and for a few minutes outstanding. Unfortunately though it is let down a little through overreaching just a little in the last quarter.Nic Cage plays John, a university lecturer whose wife has passed away and who lives with his son Caleb, who at age 11 ish is finding his way in life and as such is both idealistic (annoying) and wants to be more independent.Caleb attends a school where 50 years previous a time capsule was buried (shown in a brief earlier sequence), on the day of the unearthing each child at the school gets to open an envelope left by a student 50 years prior, Caleb of course gets the one that sets events in motion.Two things before proceeding: 1/ The Time Capsule was ""unearthed"" by two hooks, there was no code, padlock or preventative measures in place to stop theft, and it was in the middle of an open courtyard. You're expecting me to think that for 50 years no mischievous kids thought to pull it up and fill it with dog poop? Or used socks? 2/ The film revolves around an intricate code left by one of the students. 99.99% recurring of the population would have turfed it after a momentary glance, and even if they had decided to look into it there was no way in hell they could decipher it. The movie would be better served if it were titled Not Knowing, but that movie wouldn't have been made would it? Caleb instantly forgets the page filled with numbers, though he does take it home where John somehow deciphers a code from it.In essence some of the numbers relate to historic (and future) dates, followed by numbers which relate to mortality figures in disasters that occurred on those dates, the nerve wracking thing is that there are more dates to come, and that they are all in the near future.John goes to visit the teacher who was present at the original time capsule burial, we find that the girl who wrote the code was a little odd, and that after writing the code she was found in a dark room in a sort of trance. (Things the audience knew from the first scene by the way.) So far, so what really.But the best scene in the film has John stuck in a traffic jam on the way to pick up Caleb from school, as he waits in traffic he realizes what the other numbers in the code refer to, and hi theory is instantly and spectacularly proved correct when a plane falls from the sky in a terrible crash that is both horrible and wayyy cool.The fun bit, there are two disasters left before the code finishes, so now John knows where these events will occur, and the likely death toll, except that the final death toll simply says ""EE"", instead of numbers.(Needless to say when they find out what the code means it's a bit of a bummer.) John has a decision, does he go to the site of the future disaster or stay the hell away? I'll leave that for you to find out, but after a slowish start I found the middle hour of the film quite immersive, even when the circumstances became more convoluted through the introduction of more characters I still wanted to see where it was going. It was only towards the end that I felt the plot went a little too far in trying to ramp up the cool factor that I got a little annoyed.This is a Nic Cage movie, he carries the entire thing and it largely revolves around his performance, which is fine as he is believable here, Rose Byrne comes in after a while as the daughter of the code writing little girl (she had Rose once she was an adult obviously) and does the whole ""This can't be real"" thing for just long enough without it being tiring, and the two kids (by the end) are only mildly annoying mostly.The centerpiece is really the plane crash, for the few minutes leading up to it and the thirty or so minutes after I was hooked and willing to take whatever leap of disbelief they asked of me, only they kept ratcheting up the action and overstepped the mark just enough that they managed to reduce the impact.I still think that Knowing is a fine film and worthy of a look, it doesn't really go off the rails, but the ending did end up costing it some realism and impact, and I thought that by simply toning down a couple of things this could have been a great film.As it stands I put it near Déjà vu as movies with noticeable flaws, but that are good enough that you are willing to ignore or move past them because the filmmakers tried to make something different, unique and exceptional, even though in both cases they didn't quite get there.Final Rating – 7.5 / 10. If ever a Director's Cut was needed, this would be it. This could have actually been improved by removing (only) a couple of things. Right now though it is still good, just not great.If you liked this review (or even if you didn't) check out oneguyrambling.com",7.0,Anonymous,Mystery
Calvinism Redux,"Harrison Ford is clearly the most famous actor with a long history of SF&F films, but Tom Cruise had a nice little run of his own (Vanilla Sky, 2001, 7; Minority Report, 2002, 8; War of the Worlds, 2005, 5). We'll pass quietly over Keanu Reeves. Brendan Fraser has made a career, if not exactly a name, in the genre. And now we need to acknowledge that Nicolas Cage is lending his considerable screen cred to our favorite kind of flix. The question going into this TEOTWAWKI epic is whether it would be a splendid effort like Next (2007, 8) or a disappointment like Ghost Rider (2007, 5). Alas, it's a fuddled testimonial to Calvinism's doctrine of predestination.50 years ago, kids in suburban Massachusetts did a bunch of drawings intended for their new elementary school's time capsule  except for 1 odd little girl, who just filled her paper with endless digits. Cut to 2009, where that paper winds up in the hands of little Caleb Koestler, son of widowed and cynical MIT professor John Koestler (Cage). Among the plethora of digits is the string ""911012996"". Now, you might think that it was the ""911"" that captured Koestler's attention, but no; he writes the string on a whiteboard and then spends some time mulling where to put the slash marks. The ""2996"" is, of course, the death toll on that fateful day, and Koestler soon discovers the dates and fatality counts of many other disasters in the previous half century  plus 3 that are slotted for the next couple of days. Every such entry is also trailed by a string of other digits, and the genii at MIT are unable to figure out at 1st what they mean. (Of my 1st 2 instantaneous hypotheses  location and junk DNA  the more obvious proved correct.) But it's asinine for a fellow prof to liken the predictions to numerology (as in The Number 23) or suggest that maybe Koestler is following in the delusional footsteps of John Nash (brilliantly depicted in A Beautiful Mind) when the numbers are so clearly related to real, and supposedly unpredictable, events.Koestler tries to prevent the predicted disasters, but to no avail. Evidently it's all been written down in the Big Book in the Sky eons ago, and mere mortals are powerless before destiny. It goes on like this, getting progressively gloomier, until we arrive at an improbable ending that makes The Day the Earth Stood Still look like Rebecca of Sunnybrook Farm.The acting and effects are quite convincing while you're in the theater, the kids are cute, and the dialog (under the circumstances) is realistic, so the flik isn't an absolute dog.",4.0,Anonymous,Mystery
"Well, Whaddayaknow.....","I find it particularly interesting that many of the folks who express how much they didn't like ""Knowing"" are pretty much anti-religion, anti-God, anti-Christian atheists. God help us that Hollywood dare come out with a secular film with Biblical overtones.Like the Bible isn't drama, and not full of amazing stories, and those, oh definitely not worth telling. Right. It has nothing to do with future telling, father-son relationships, mystery, intrigue, family, love, trust, anger, indifference, jealousy, rage, suffering, beings from other-than-earth, angelic protectors, apocalyptic events,....nah, the Bible doesn't have any of those kinds of stories.Please.Where do you think Hollywood and writers-at-large get some of their ideas, anyway? Truth is, they've been floating around for over 6,000 years.Go see ""Knowing."" It's a genuinely thought-provoking, comment-worthy, edge-of-your-seat-whoa!, even heart-touching, remarkably good film.",10.0,Anonymous,Mystery
Disappointing,"The movie had a good start but went down hill fast. The first 30 minutes or so of this movie were good and did a nice job of building the rest of the story, but it got progressively worse after those 30 or so minutes.It was hard to even tell where the climax was, because I never felt any excitement or 'edge of my seat' action. The story jumped around so much, almost like they made it up as they went.It was an overall bad movie with a horrible ending that made no sense, it had no greater value, spoon-fed you the entire movie (definitely not a thinking movie), and had random parts that jumped around so much but weren't complicated enough to ever make you think, despite its intention to be an adventure and mystery movie.In the end, this movie definitely is not up to par with Nicholas Cage's other adventure movies such as National Treasure or even Next.",3.0,Anonymous,Mystery
This is something else,"Alex Proyas already had a special place in sci-fi lovers heart for Dark City (let's not talk about THAT insult to Asimov). And here we see a movie even better than Dark City. I wouldn't think Proyas may exceed Dark City, but yes he did.This movie is something else. It can not be compared with other big-budget Hollywood sci-fi's. It can not be compared with other disaster movies. You have to ""hear"" what this movie tells.Overall it is a great experience, but the peak is final 90 seconds, imo. Where Nic Cage (who's surprisingly better than all of his recent works) drives to the city. Absolutely great.See this movie. Such a gem comes only in every 10 years.",10.0,Anonymous,Mystery
One of the worst films of 2009,"""Knowing"" is a like a bizarre rip off of M. Night Shyamalan (and why would anyone want to rip off Shyamalan at this point?) mixed with a little ""DaVinci Code"", some brainless sci-fi, and end-of-the-world pseudo religion. Director Alex Proyas has created some nice visuals, but it's such a pointlessly bleak and stupid movie that it's impossible to imagine how it was thought anyone would be entertained by this. If anyone needs to know how to predict disaster, it's Nicolas Cage so he can stop making movies like this. Insetad of paying to the see the film, covert $7.00 into quarters, and flush them down the toilet one by one. It will be just as cost effective, and twice as entertaining.I want to hurt this movie.",2.0,Anonymous,Mystery
The worst film,No benifit of this film. I was laughting when I wached this,,Anonymous,Mystery
Plot - meet holes. Holes - meet plot,"How would one go through life is one would know what would be happening next? It's a question that is silently posed in this film but it's never really answered. It all starts when a young kid, upon being asked to make a drawing to store in a time-capsule does not draw a picture but writes down what seems to be random numbers instead. When years after the time-capsule is opened again the paper with the numbers comes into the hands of a father and his child and the father starts to stare at the numbers, attempting to find a pattern or meaning in them. What he finds scares him more than anything has ever scared him before.This film starts by making one big claim. If one can accept that claim to be truth it turns the film in a pretty standard but OK film with a fun but plot-holed filled story. If one can not accept that claim the film quickly turns into a long series of irritations. It plays out fairly decently, building on the initial claim and adding more twists to it, eventually digging its own grave a bit because it contradicts itself a few times. It doesn't completely run out of air though and in the end its OK enough to have people leave the cinema without being completely bummed out.6 out of 10 random numbers in a stream",6.0,Anonymous,Mystery
Next,"Nicolas Cage made a movie prior to that (a couple of years before this movie actually) called ""Next"". My first thoughts were, that Knowing sounded to much like that movie. But it's nothing like that, it is more connected to the ""Day the Earth Stood still"" Remake. But quite better than that. Alex Proyas is on the helm, which promised me a good movie ...Nicolas Cage just deliver 100%, the movie has it's holes and bumps, it just doesn't move along smoothly. It's a shame, because the premise of the movie is great. I liked it and I really liked the ending. I still can't give the movie a better rating. It's good, but it has so many flaws, that I can see that quite a few people didn't like it at all.",6.0,Anonymous,Mystery
One of the best SciFi movies ever,This is a movie which stays in mind for a while and the ending left me with tears in my eyes. Same as the ratings. People you are ridiculous.,10.0,Anonymous,Mystery
Knowing: you're better off Not,"Ryne Douglas Pearson (screenplay), Juliet Snowden your names will always be at hand whenever I am reading film reviews. There are films where patience is rewarded by the final denouement. This is NOT one of them. Moronic is the only description suitable for this script. someone blamed this on Scientology - its hard to believe they are that banal; I put it down to Hollywood nepotism. Its also hard to fulfill IMDBs requirement for 10 lines of text to describe this incredibly stupid film. Perhaps one can say the final special effects (a regurgitation of Star Treks Genesis project) are worth watching tho again they have no relevance to the script",1.0,Anonymous,Mystery
Knowing Will Generate Questions,"John Koestler (Nicolas Cage), a professor at MIT, knows which side of the debate he falls on when he teaches his students about choices. Are they random or determined? Stuff just happens, he tells his class. He tries to live his life accordingly. When he's not teaching in class or taking care of his partially deaf son, Caleb (Chandler Canterbury), he drinks away his sorrows. He's unhappy that his wife passed away in an accident and has taken a passive seat on the life bus. Although like everyone, he wants desperately to know that life isn't a waste, his highest goal has become keeping his son ""safe."" If stuff just happens, he won't let anything happen to Caleb by keeping him home.One day, something happens which challenges his beliefs to the core. His son's school is opening the time capsule a class buried in 1959, 50 year ago. Each student gets to open a letter from a student describing the future. Out of all the letters possible, Caleb gets the most disturbing one, a letter covered with seemingly random numbers. During one of his typical drunken stupors, John studies the numbers carefully and decides the same thing that Richard Dreyfuss did in Close Encounters: ""This means something."" Of course his confidantes all think he has lost his marbles, so John must seek out the truth in an alternate way. He finds a fitting colleague in the somewhat creepy, somewhat attractive Diana (Rose Byrne), who has a connection with the original creator of the letter Caleb opened from the time capsule.This is a suspenseful story, part science fiction, part thriller, which will challenge viewers to decide what they believe in the aforementioned debate. And unlike the sensation we find in some suspense stories, viewers won't have to suspend much belief to go along for the ride. John's journey happens step be step, each event happening in perfectly logical order. Is John creating his own story or is he just following the steps laid out for him long ago? Much of the story is laid out in cold, muted tones. We see how cold John's life is through the lens of the director's camera. When the tone finally changes to warm and bright on the screen, and it is oh so glorious to behold, we understand that John finally knows what he needs to do and is able to do it with 100% of his heart.",8.0,Anonymous,Mystery
What happens when the numbers run out?,"After a not so hot streak of low end, trashy movies, Nicolas Cage has come back from the dead starring in this high powered apocalyptic horror/sci-fi breed from director Alex Proyas. I've always been a big fan of Cage, but not so much lately when he starred in what seemed to be a slew of uninspired movies that can be compared to garbage eaten by rats. But alas, guided by the right hands of a man with a vision and free reign, Cage returns to form and carries the whole movie all the way through. What's more is that he didn't need to don an ugly looking hairstyle, just a normal one and no killer bees, motorcycles on fire and Thai prostitutes either so my faith in him has been restored. I've heard news that he plans to retire soon, I say no.The man clearly has more to offer and to some, the stench of the havoc caused by Wicker Man, Ghost Rider and Bangkok Dangerous is still there. Maybe take another jab at the Oscar gold too. Nicolas Cage aside, I can't figure out what the movie really tries to be. There's part where it passes off as a horror movie and there are parts where the vibe is just pure science fiction. But I call a mix between the two because there's just enough to make it horrific and just the right amount to call it sci-fi. Alex Proyas, the man behind such great films like Dark City and The Crow may have made his best one yet with this movie. Peppered with great CG effects, just the right amount of dialogue for a movie like this and a couple of mind melting scenes that will cause your brain to leak out your ears. I saw it in a theater and I was on my toes the whole time probably because of the effective mood the director has toned it with and the astounding and ear shattering music score by Marco Beltrami.I wouldn't wanna spoil the ending but I can vouch for its uniqueness. Definitely not your typical Hollywood ending one expects it to be, I like how the director probably just slammed it all over the Roman Catholic church with the way the ending turned out and still, leaving a mark and a message that will make an impact to the audience and they won't even see it coming.One of the best films I've seen since 2009 kicked things off. It is just refreshing to see this one atop the box office and not some low rent, B-grade studio movie. Highly recommended.",6.0,Anonymous,Mystery
So angry!!,"If I hadn't seen the end of this film... I would have given it 8.5 out of 10. BUT...Worst ending ever!!! Very much a ""What lies Beneath"" kind of tension film - but with brilliant action scenes, fantastic special effects and gripping story.I was throughly enjoying the film... Jumping every now and then, very spooked and excited to find out what was going to happen next! Brilliant suspense and drama throughout...Then the ending was TERRIBLE. In fact I would say it was on a par with the last Indiana Jones film for absolute disappointment.",1.0,Anonymous,Mystery
"Worth watching, although it could have been better","Nowadays, it seems that the attention threshold for the average movie viewer is so high, that directors think they need to rip planets apart in order to be noticed by a wider audience. The movie is without doubt dynamic, with lots of good special effects and tense moments which will grab your attention until the end. But it has some usual Hollywood clichés: over-dramatization and shallow and unrealistic characters (Who writes those silly characters anyway?). The scientific background is mainly credible, there are no screaming misconceptions, like in other modern ""doomsday"" movies. Of course, there are many strong fantasy elements, which can be hardly called scientific, but make the story interesting. I was left with the impression, that with so much effort, money and good actors in this movie, it could have been much better.(like the 90% of other Hollywood production today). With just a bit more intelligent storytelling, it would be probably harder to understand for ""the masses"", but it could be a great movie. Instead of that, it has a somewhat mediocre feel about it, although a few memorable scenes and interesting ideas make it definitively worth watching.",7.0,Anonymous,Mystery
