title,content,rating,username,genres
Creepy and Disappointing,"I didn't enjoy Knowing. The story didn't make any sense and the film was fairly depressing. It's a big budget Hollywood movie so it's well made and has excellent special effects. However If you have had a stressful week and are looking for some light entertainment, this film is probably not for you. I considered walking out, it was one of the worst films I have seen in awhileThe film starts in 1959 with a strange little girl is able to predict catastrophic events where lots of people die. She deposits a page of numbers into a time capsule which is re-opened in 2009. She forecasts the end of the world and becomes a very odd woman who dies living alone. Nick Cage analyzes patterns in the numbers and bizarre things start to happen.Nick Cage's character is not very appealing. He plays an alcoholic, MIT professor who grieves for his dead wife. Cage's character is unhappy, estranged from his family and won't let his young son do normal things like play soccer or stay with friends. The movie features creepy aliens who turn up periodically and just watch, we don't find out their role until the end.Biblical prophesy is mentioned and there is some discussion about predestination but you feel it's just been included to appease any Christians who might be watching. You never discover how the aliens, the Bible and the little girl's predictions all fit together. The aliens could be working with God but it's all rather confusing and hard to understand. At the end of the day I didn't care, because it all seemed very silly.There are several catastrophic events which look spectacular on screen, but the acting is overwrought and the film gloomy. Overall,it's a movie to avoid.",4.0,Anonymous,Mystery
A disaster,"This movie was a disaster. Ugh. It was part Close Encounters/sci-fi, part disaster (and how much more disastrous can you do than the destruction of the ENTIRE WORLD...sheesh), part horror/suspense, etc. etc. The attempts at sentimentality were pathetic at best. Nicolas Cage looked awful in the role of an alcoholic single dad. The plot was clearly influenced by humanist/vonDaniken scifi theology and even cultic beliefs (i.e. Heaven's Gate cult), and it's ""explanations"" for famous Bible stories (i.e. Adam and Eve, Noah's Ark, angels, rapture) were offensive. What a depressing and hopeless movie. Seeing this movie in the theater has reminded me afresh to check movie reviews before plunking out $10 for a ticket. What a waste of money.",1.0,Anonymous,Mystery
Movie sounds like the Dresden code doomsday prediction.,"The theme of the movie appears haunting analogous to the Dresden codex from the Mayan civilization. This code made between 1200 to 1250 BC appears to have various astrological predictions of various eclipses and other events that will be occurring. One notable even was a solar eclipse in July 1991 that was predicted accurately.However, there was one weird aspect of this prediction. It was stated that a ""meeting of the brethren"" would be occurring on that date. On Mexico, where this eclipse occurred there was a number of UFO sitings recorded on video and observed by many eye witnesses.This same codex has an end date of December 12, 2012. Mausumi Dikpaki, of the National Centre of Atmospheric Research (can be googled) suggests that a solar storm will occur on that year that's stronger than any other solar storms in history. Sun activity is now actually lower than usual, which she calls the eye of the storm. She predicts a 30-50% stronger solar storm than ever before. This means there is a possibility that a strong solar storm could really occur around that time as predicted by that codex.If you were to take analogy with the movie's motif, such as the numbers on the paper in a time-capsule predicting events of the future and compare it to this codex, you add the UFO alien element, as with the 1991 solar eclipse seen over Mexico as validating the authority of predictions of this codex. Then the movie takes on a more haunting and scary tone.The aliens in the movie are actually ""Nordics"". They are tall, blondish human looking people that are commonly seen in Europe. If you take all these sort of elements and make a creative work of fiction -- then you have something like this movie ""Knowing"".I actually appreciated the theme of the movie and it's inspiration for me to do this private research from a tip I got watching ""Mexico Roswell"" from UFO files last year and looking more deeply into the Dresden codex leading into a deeply rich intellectual experience.After doing the research, this is a brilliant fictional story, taking mythological beliefs and stories and making some sort of compilation. If you are well versed in this sort of stuff, this movie will freak you out, guaranteed. Not because of the cheesy acting through, but more what it represents.",10.0,Anonymous,Mystery
Very underrated,"Knowing is one of the most interesting films I have ever seen. The story is a real attention getter. Nicholas Cage & Rose Byrne both are fantastic in lead roles, in fact I would say this is Cages best effort. The Easter eggs(white rabbit) no pun intended are throughout the film. I won't spoil the storyline other than to say it is an end of days film that won't offend Christians, even though it doesn't follow the Revelation 100%. Overall this film deserves much better reviews than some gave it. Excellent 10/10.",10.0,Anonymous,Mystery
A message for those who have ears to hear!,"I too was affected by this movie. I saw it 4 times! I don't see movies more than once unless they really move me. There was a personal message for every person who sees it. Each time I saw it, I saw different elements that made the movie that much more meaningful. I thought it was done very well. We may rub shoulders with people that have the same gifting as the young girl and not even know it and we just think they are strange. Or we may have that type of gifting and people consider us strange. There is a purpose we are shown things that will happen in the future, so we can warn others. I believe this movie has a very pertinent message for every person of times to come.",10.0,Anonymous,Mystery
Start As You Mean To Go On,"I recall a time when Nicolas Cage was a really decent actor. These days he seems to be cashing in on this frankly, bygone reputation. Knowing is one of those movies that starts really rather well, but ends up sitting on the fence. A religious nut's wet dream, it goes so far off it's original course that it forgets it's own identity altogether and literally makes it up as it goes along.There are some nice pixelated effects during the film, but it isn't enough to carry it through on the strength of this. Again, while it does well at first, it is let down by someone at the studios giving carte blanche to the CGI guys, who really do push things so clearly beyond the capacity of their tools that a good deal of the effects look unreal and plastic. Less definitely would have been more here.Nicolas Cage puts in yet another lacklustre performance here, content to do 'just enough' to warrant his over-inflated pay cheque, while the other actors and actresses are frankly average or at worst, forgettable. The soundtrack does enough as do the sound effects, but the real problem here is the script and screenplay - when it works, it works well and keeps the viewer intrigued, but when it doesn't it's almost unwatchable.So, all in all, an average film that reminded me of so many mainstream movies of late. It works for a while, but when the initial intrigue has faded and deeper questions are being asked, it simply refuses to give a straight answer and reverts to type. I'm rating Knowing at 6.0 out of 10, because it genuinely does start well - just turn it off after about an hour and you wont be disappointed. Shame.",6.0,Anonymous,Mystery
Another let down from Mr.Cage,"What happened to Nicholas of moonstruck and national treasure he gave a woody performance in this average (numerological?)thriller. Oh nothing new in this flick and a complete let down to Cage fans. Actually 5 writers used in this movie, for what? It too have some good scenes and one or two thrilling moments but for that we cannot tolerate a whole movie. Its plot too similar to various movies we have seen before including his own movie Next. Screenplay also not so good including some awful scenes unnecessary to the plot. Not only Cage non of the actors given their best performances. Background score is OK but it should have been done better considering it is a thriller(not me). Don waste your precious dollars on this movie wait for DVD. And for cage better luck next time please select good movies at least for your fans like me come again with a bang. Please reply my comment is useful or not so that i can improvise.",4.0,Anonymous,Mystery
Lots of reviews...,"Given that the storyline has many elements that give an appearance of a depth that doesn't really exist in the movie (for example, the idea that everything is totally planned out - but it doesn't quite turn out that way)... However, reading a review that points out similarities with a Scientology theory I can quite easily see a parallel and possible hidden agenda.It's quite a shallow film with some imagined depths - mostly supplied by the viewer. It gets you thinking a little, and it's an enjoyable movie. It tends to fall down and frustrated me a little toward the end; but then the end is a cool ride that leaves you feeling good (even if it is trashy).It's not too hard to zone out and suspend brainpower. After trying to work things out for the first half, you're ready to watch the second which delivers a shot of endorphines and leaves you not feeling too bad about being cheated.",7.0,Anonymous,Mystery
Nostalgia de la ciencia ficción de los 1950s,"Si tienes nostalgia de las películas de ciencia ficción de los 50, esta película es para ti. Nicholas Cage, con la cara de siempre",6.0,Anonymous,Mystery
Utterly horrific,"I don't usually write reviews, but this film was so bad I want to add mine just to stop people wasting however long I spent watching this crap.Where do I start? The shocking acting? the complete lack of character development? the stupidly unrealistic accidents? the boring, hopelessly unimaginative story? I literally waited for an hour for this movie to end, and laughed openly at how bad the acting was at some points. I must admit I've never been a huge fan of Nicolas Cage, but this film simply reinforced my view of him as a generally poor actor.Another big budget movie that places special effects over everything else. Avoid at all costs.",1.0,Anonymous,Mystery
"A mindless, heartless waste of time","""Knowing"" begins quite promisingly (despite very overt and simplistic introductions to the main characters and their emotional history that already didn't bode well for the rest of the story), and the one good thing that can be said about it is it has very well crafted special effects. But it goes downhill really, really fast, with wooden acting, a flawed story, and shallow characters with unbelievable turns in their basic beliefs and premises. This movie has a lasting place in my mind as one of the most lovelessly made movies I've ever seen, and any good that it may cause by provoking deeper questions in some of its viewers, it poisons by a naive, shallow, and heartless depiction of religious mythology fit to destroy any notion of joy or happiness. This movie is the first one that made me want to log on to IMDb to post a review.",1.0,Anonymous,Mystery
"Knowing is everything, and this film knows!!","What do we really know about the end of the world? Is there a pattern to predicting the future? These are the question's that this Alex Proyas directed Sci-Fi disaster film asks, it asks whether or not we believe in destiny or fate( which ever you believe in.) is real or not, weather it is just fiction or something more. Personally I believe in both, and this film explores both of those strange and bizarre occurrences . Nicholas Cage stars as professor Johnathan "" John"" Koestler a man who's son amazingly stumbles upon a strange list of number's listing all the global disaster's for the last fifty years.Now he set's out to try and stop these last few event's from happening, but can one man really out run his fate? or the end of the world for that matter. Knowing presses a question that we all know, how will the world end? Well knowing takes it one step further and try to map out how will happen in it's own terms. This film puts a not so arch typical hero against the force of nature and puts our most frequently asked and most pondered question on the silver screen. Knowing how the world end is something we could never understand, this film brings it full center and opens us up to a world we've never know or seen before. Knowing is a definitely going to the Oscar's for visual effects and it's music and is surely going to please and shock audience's for all time.",9.0,Anonymous,Mystery
Make up your own mind,"With Knowing it is not so much a question of 'is it any good' or 'is it bad', it's a question of 'do you like Nicolas Cage'.Personally, I have no idea why this guy has starred in as many films as he has and Knowing is no different. Nicolas Cage has got to be one of the most talentless, uncharismatic and unnatural actors ever. If you don't like Nicolas Cage (and he doesn't really do this film any favours) then you've had it, basically. OK, that's Nic out of the way.Knowing is what it is, it's a film. Not only that, it's science fiction. There is your first clue. Don't try to take it seriously. Secondly, and more importantly, it's not a bad film. It's flawed, yes, but then again what film isn't? In fact, Knowing is quite well made, and it would be even better if it didn't have Cage in it (although this is one of Cage's better efforts). Despite some average performances, the film is well paced, it's atmospheric, well scripted and pretty well shot with good CGI effects, and if you like obscure science fiction then chances are you will enjoy this. That's all there is to it.Ignore the talk about Scientology propaganda and how idiotic the storyline is – it's science fiction! If you're planning a night in, and you're stuck for something to watch (and you don't mind Nicolas Cage), then you could do a lot worse than Knowing.Just watch it and make up your own mind.",7.0,Anonymous,Mystery
A rather weak mixture of everything,"This movie was disappointing, I was expecting something meaningful and smart. After having watched this movie I have only one question: why would God or the aliens (probably sent by God, according to the film at least) want to save humanity by taking a sample (a girl and a boy) to some place that resembles the garden of Eden. And, if they want to save humanity, why destroy it in the first place? It would make some sense if at least the film pointed out how humanity is deteriorating itself and living selfishly, destroying the environment we live in, but no, it is not even referred to...I don't even want to go into details other than this movie was clearly a religious propaganda and did not make any sense at all. A complete waste of money...",1.0,Anonymous,Mystery
I knew it!,"Before I saw this movie, I wasn't a big fan of Nicolas Cage... and this film didn't helped a bit.I think it starts out very good, I'm so into it after just 6 minutes. And I think they hold that standard along the whole movie, except the end! I don't see why they have to spoil all the thrilling- awesome action- touching scenes with a ending like that. I thought from the beginning that is would end this way, but i thought ""naah, they wont ruin this awesome movie like this with a ending like that""... but they sure did.But I think the movie is very good until the end, so its very watchable. however, would be much better if they would replace the self-loving bastard Nicolas Cage with some more deeper actor.",7.0,Anonymous,Mystery
Somewhat Interesting,"Most of the comments here on IMDb already make clear that which I wish to comment about the movie itself, I got more to add, i will spear you, because that would be mostly about basic mistakes in film making. What i really wish to comment upon is the subject of this movie as such, especially after having watched the special feature that came with the DVD trying to tackle the subject of the coming Apocalypse. I thought the feature would have been a hell of a lot better, or at least it promised to be so at the beginning, maybe when it spoke of what we have learned from the past, but not the future. it was way too magical, and mystical. What i wish to point out is that when the dinosaurs seized to exist, it did not mean that life on earth seized to exist. Eventually we came along, there was us, humans. however it does not mean that we are anymore important then the dinosaurs were. At some point there was an amoeba which evolved into the frog and eventually that frog, maybe to attract a mate gave out its first croak, but just like that frog had no concept that its croak would eventually evolve into all the languages of the world, with Shakespeare and Dostoevsky and what not, then neither can we possibly conceive whats to come. We might know a lot, achieved a lot, but in contrast with the universe we might be no greater then that cow that thinks it very smart to chew on some grass, we are just a crap idea. I can go on forever, I will keep it at that for now, should one wish to discuss with me, it would be my pleasure, my email is karl_consiglio@yahoo.com",6.0,Anonymous,Mystery
Hysterical nonsense,"If, like me, you have a really hard time watching this movie, fast forward to the spectacular end for a good laugh. And remember, you must follow the white rabbit. 🐇✨",1.0,Anonymous,Mystery
"Great idea, poor execution","I think this film is decent and worth a watch, however it could have been so much better. If they just had a better leading actor than Nicolas Cage, who overacted as he normally does and if Alex Proyas wasn't the director this film could be brilliant.It was really frustrating to watch a film with such a good scope but let down with poor acting and an overuse of special effects. However, I do think that the story line was pretty interesting and hope that one day a remake of this film that shows the films true potential will hit the screens. So in summary, Nicolas Cage, please do not act ever again and please give this film a go, for all of its faults I think it is worth watching.",7.0,Anonymous,Mystery
An entertaining watch,"""Knowing"" (2009) is one of those movies that grabs your attention with an intriguing concept and keeps you hooked with its mystery and suspense. The plot, while ambitious and unique, sometimes feels like it bites off more than it can chew, especially with character depth and emotional weight. The film builds tension effectively but doesn't always make you feel invested in the people involved. Nicolas Cage delivers a solid performance, carrying the film with his usual mix of intensity and brooding energy. The directing by Alex Proyas is well-executed, creating an eerie, unsettling atmosphere that keeps things engaging. Visually, the cinematography does a great job of amplifying the film's apocalyptic themes, with some standout sequences that are both haunting and well-shot. The CGI, though not perfect, holds up for the most part.The script has its strong moments, especially in its pacing and mystery elements, but it leans heavily on exposition at times, which can make certain parts feel more like a lecture than organic dialogue. The score adds to the eerie and suspenseful tone, effectively building tension in key moments. While the film might not be a masterpiece, it is still an entertaining watch with an interesting premise, good directing, and some genuinely tense moments. If you go in without expecting deep character exploration and just want a gripping mystery with a bit of a sci-fi twist, it's definitely worth a watch.",6.0,Anonymous,Mystery
A good film spoilt by the ending,"There's plenty of suspense, horror and mystery in this film. It starts so well. The special effects could be better (they don't look real even the fires). That said, what let's this film down from being great is the ending. It's as though the writers got to 90% through and thought 'oh, what do we do now for an ending'.",5.0,Anonymous,Mystery
There's no way of knowing...,"Interesting sci-fi concept, started good, the third act was a mess. Had some good special effects, particularly the plane and train crashes and the end scene. Overall average film.",6.0,Anonymous,Mystery
Very mediocre in my opinion,"I didn't like the direction or acting. I think that, although the idea could potentially make a much better movie, the particular instantiation was quite poor.However, I did like a lot the way that the strange people we see close to the end were depicted (trying not to spoil it), and this is the only reason my rating is not lower.",5.0,Anonymous,Mystery
"Very, very well written and well sequenced.","The problem with critics is you go to jail for giving them their just desert. This movie was exceptional! Most of the critics and maroons writing essays and being given a voice to implement their unholy opinions are looking for sensationalism. If that is what you seek then move on, move on. The truth is this movie, while it does not do a fantastic job of delivering the actual background to where it's plot ideas come from, is a VERY important movie. The fact is there have been many, many old religions that had been based on similar plots. Indeed Christianity's book of Genesis is no exception.Perhaps if they had elaborated more on the background, in addition to the ""number paper"" it would have been a stellar 10/10.Whatever the case, the reason I think this movie is important is because it might be a good foundation for further study on the subject. Especially, for those that believe that luck might run out one day.... Please see and do so with an open mind.",9.0,Anonymous,Mystery
Knowing was great....until the ending.,"So Nicholas Cage is back with the latest offering with a combination of a sci-fi, disaster and puzzle movie, mixing the likes of The Day After Tomorrow, The Da Vinci Code and Independence Day.This movie starts off very promising with a time capsule that is found buried, Cages son gets a piece of paper with just lots of random numbers on, but Cage works out that they show the times, dates and location of every major disaster in the last fifty years.Throughout we see Cage in a panic trying to work out when the next disaster will hit and at the same time trying to protect his son from a bunch of strange people who don't speak English, it turns out there aliens.All the way through I was on the edge of my seat with the story like what was happening? Who were these strangers hanging about Cage's son? What happens when the numbers on the paper ran out? There was plenty of excitement and tension and the acting was reasonable but then in the last twenty five minutes, the film just spiralled down here into lame superficial silliness. I was literally just sitting there and thinking ""oh right"" The ending (not to ruin for anyone who still wants to see this) just didn't make any sense. How it ended just isn't explained and it felt like a massive let down. I was originally going to give this a nine or ten out of ten but I felt so let down I had to give it less.Other people I have spoken to about this film said the same thing. This was still a good movie and I enjoyed it, but it could have been spectacular which this wasn't.If you haven't seen this yet and want to be prepared to be disappointed.",6.0,Anonymous,Mystery
what I was thinking before the shock entered my mind,"I went to see this movie because the trailer made me curious what was all the fuss about with those mysterious numbers. now I've seen the film, I can split it in two: the first half was boring as hell. Nicolas Cage acted as if he was looking in a mirror. he was the worst actor of the picture. they could easily replace him with Kevin Costner. Costner may be a diva (as I have heard), but I really really like him. but Cage? what was the last movie where he was in that was good? anyway, so here I was trying to look at my watch, because the time seemed long. this movie was even worse than Disaster Movie, which is a movie that must be appreciated by the total sum and not the parts. lucky for me, this Knowing flick had a fantastic second half, which made me forget all about the first. by that, it made the total sum correct. this movie is BEEPing great. not superb, but still good. the second part was all about these terrible things that happen (maybe the numbers have an actual reason???) and the first accident really blew me away. it shocked me. not with electricity, but just with the content (which I will not reveal for anyone who hasn't seen the movie yet). the only thing I can complain about, is the trailer. it shows us too much already. so take my advice, avoid the trailer as possible but don't miss this film!",6.0,Anonymous,Mystery
