title,content,rating,username,genres
Not Sean Penn's finest hour,"A friend of mine told me he saw Milk in the theaters and that Sean Penn's performance was overrated. ""Instead of I Am Sam, it's I Am Gay,"" my pal said. Obviously, with that kind of recommendation, I had to see it for myself. I didn't want to be, but I was disappointed with Sean Penn and the movie as a whole. I loved his acceptance speech at the Oscars, but I felt he didn't try as hard as he could have.This biopic of the first openly gay California politician is filmed in an interesting documentary style that blends real footage with scripted scenes. While the hairstyles and fashion of the cast takes you back to the late 1970s, I couldn't help but wish Sean Penn had put as much into this movie as he had I Am Sam. It felt like he was walking through the role and relying on the real Harvey Milk's emotional affect on the audience, rather than letting his talent guide the story. In the supporting cast are political activists Emile Hirsch and Alison Pill, Sean's first boyfriend James Franco, Sean's second boyfriend Diego Luna, the infamous villain Josh Brolin, and Victor Garber as the San Franciscan mayor. Among the supporting actors, there's an incredible amount of passion that the audience can revel in, but all those people pouring their hearts into the sensitive subject serves as a double-edged sword: by comparison, Sean Penn's performance seems even more watered-down.If you like the cast, or if you want to see a biopic of Harvey Milk, of course you're going to want to watch this heavy drama. If you don't end up loving it, you're not the only one.DLM Warning: If you suffer from vertigo or dizzy spells, like my mom does, this movie might not be your friend. Given the documentary style of the film, there are some unexpected zooms and handheld camera, and it will make you sick. In other words, ""Don't Look, Mom!""Kiddy Warning: Obviously, you have control over your own children. However, due to violence, I wouldn't let my kids watch it.",3.0,Anonymous,Biography
Empowering and Eye-opening.,"To be honest I knew nothing about Harvey Milk. Who he was, what he did, nothing. But I think that it made the movie all the more amazing to watch because in this process I learned.Everyone should see this movie. Not only does it educate us on San Fransisco history but it also educates us all on what is currently going on in the world and how important civil rights are to EVERYONE. I wish this film came out during the battle with No on Prop 8 because I think it would of made an impact on those who didn't understand the prop.I am so empowered by Milk. He has now become one of my heroes and I am motivated to learn more about him and those who support his movement.As far as the acting goes. I heard Matt Damon was originally casted as Milk. I am glad Matt Damon didn't do it because he has a specific image which would make it difficult for me to see him as Milk. Penn was casted perfectly as Milk. I was very impressed by his acting. He was very genuine and believable. Franco, who plays Milks lover, was also someone I was very impressed with. Franco, is now one of my favorite actors because he choose to do this film.Overall, I highly recommend Milk. I usually not a fan of biography type movies but this one is amazing. Watch it!",9.0,Anonymous,Biography
Uplifts just as much as it enlightens.,"Since the earliest counterculture movements of the 1960's, America has been a country divided on many issues, the least of which being laws and rights put in place to govern the homosexual communities throughout its states. Like those that would follow in his marches of protest, Harvey Milk is an icon of his generation- or rather the ideas that both him and his immediate crowd believed in. While set around some forty years in the past, residing within a culture that has jumped some hurdles to reach where we are now, there still remains a certain poignancy to Milk's image of personal determination for justice; in fact, he's the perfect cinematic superhero. Such is director Gus Van Sant's strongest pulling point here; rather than sell out a cheap, soulless biopic that sticks to making messages and delivering historical facts, Milk instead plays out as a compelling and at times harrowing tale of passion for equality that takes time out of its political reservations to deliver a potent biographical portrait.Harvey Milk certainly didn't think he'd make it to his fiftieth birthday, so while there's doubt that he might even have survived to the age of ninety is a matter of speculation, but there's certainly no denying his importance within today's society, forty years onward. For the most part, Van Sant stays committed to this truth; the movie starts out at the turning point of Milk's life where he turns forty and relocates to San Francisco in order to find meaning in his life. Met with a large amount of disdain and prejudice he often found in his home state, Milk is soon pushed to make a stand against the thriving bigotry residing within America's conservative states that demean him and those closest to his own lifestyle.Harvey would go on to call them the ""us's""; for Harvey, he saw himself fighting for those suffering the same injustices as himself not just for fellow homosexuals but also for the people who simply did not belong to the key suburban demographic; those left at the sidelines picking at the scraps of the majority. This key theme allows Milk to reach beyond its ostensible politics and touch the hearts of a much more general audience, thus bridging the gap between Harvey's personal afflictions and those of his listeners. It's something the real figure would implement into his speeches when talking to a broader crowd, and it works just as well here, delivering a story that stays true to its cause but not to the point where the result is polarising or esoteric.The rest of Harvey's story, as they say, is history- and Milk does well to detail that story with historical fact without leaving out firm, engaging narrative to boot. Part of what makes Milk as compelling as it is lies in Van Sant's willingness to delve beyond the message of his central character and more into the man himself. Indeed, while there have been biopics in abundant measures over the past few months, none of those can claim a character quite like Harvey himself. Sean Penn's portrayal here is in remarkable in that it warrants recognition but not because it ostensibly reeks of a pandering Academy nature. No, instead Penn becomes a persona immediately discernible from those he has done before in as much of a naturally timid manner to which one can perform as such a recognisable, larger than life figure.Both Penn, and his co-star for the first third of the movie James Franco also deliver a romance that is unfiltered -cinematically speaking- by taboo or restraint; not only does it give the film a warm core to begin Milk's story with, but it also reaffirms the themes of Milk's ideals, that homosexuality should be nothing to be lynched for- Van Sant takes this into account and delivers a series of scenes which for all intents and purposes do not draw attention to themselves in an overt manner. Sure enough, there is relatively potent shock value present within the couple's first on-screen kiss, but such moments aren't played in order to warrant strong reactions; they are soft, dignified, and most importantly, human portrayals- something which homosexuality doesn't see much of when printed onto the big screen.In the end, such moments give Milk its centrepieces and do more to reaffirm Harvey Milk's message more than his broad speeches, marches and political activism could ever achieve; here Van Sant sets out to humanise the dehumanised, and achieves his goal. Indeed, as a tribute to a man that set out on his own to change his country for the better, Milk feels potent and credible but not at the expense of telling a good story. Granted there are a few narrative issues involving the general pacing of the script, yet Milk retains, for the most part, a strong, compelling story to match alongside its ideas and characters. Of course, we've all seen the same thing done over and over again, based upon fact or not, yet this underdog swimming against the current does extremely well in sticking to basics and delivering that final punch line of personal triumph resulting in a feature that uplifts just as much as it enlightens.A review by Jamie Robert Ward (http://www.invocus.net)",,Anonymous,Biography
A Message of hope.,"Macho man Sean Penn was an interesting casting choice as a gay man, and he delivers a fantastic performance! Penn stars as the titular Harvey Milk, an openly gay man fighting for gay rights in 1970 - a time when being gay could see you being arrested. Homosexuals was not accepted in society and political activists like Anita Bryant wanted to ""rid the society of these people"".The film is narrated by Harvey Milk, the character, who recorded his life story which was to be read in the event of him being assassinated. If you're familiar with his story, you'll know he was indeed assassinated in 1978. The film chronicles his last few years from 1970 to 1978 in his fight for gay rights, and his rise to power to becoming the first openly gay man to occupy a major public office. He was an inspiration to thousands, and a message of hope.The film also shows us the loves and heartaches of his personal life during this time. James Franco stars as his lover Scott, who helped Harvey in his rise to power. The film's antagonist, as it turns out, is Dan White (wonderfully portrayed by Josh Brolin) - a family man who couldn't handle defeat.The film will no doubt divide pro-gay and anti-gay opinions. Either way, this is a fascinating story of the pioneer for gay rights, Harvey Milk.",7.0,Anonymous,Biography
"Fresh and moving, if not wholesome, Milk","Daring but not over the top, Gus Van Sant’s ode to the fallen gay-rights activist Harvey Milk is compelling, moving, and elegaic, successfully melding the hope of Milk’s drive for equal rights for homosexuals with his tragic death. Van Sant’s masterpiece, certain to be noticed around Oscar time, is poignant enough to mist even the most hardened of souls while remaining frighteningly relevant even thirty years after Milk’s murder.To be fair, writer Dustin Lance Black had wonderful source material from which to derive his screenplay, as Milk’s life was anything but placid, but he was able to tell his tale without getting sappy or maudlin, without the film’s devolution into a whitewash. But although Black’s screenplay is par excellence, this is Sean Penn’s show. Penn has grown so much as an actor, even though most film critics still note his seminal Jeff Spicoli performance from 1982’s Fast Times at Ridgemont High. Here, he disappears into the role of Harvey Milk, adapting some stereotypical - but not unheard of - mannerisms of gay men, but never going over the top, never coming close to lampooning his own subject. Penn’s grip on Milk’s inner psyche is devastatingly raw; he shows how much Milk cared about equality for all, even at the expense of life with his lover, Scott Smith (a pensive James Franco). This is a canard seen in many biopics, but here Penn’s Milk is not unaffected by how he affects others; he is not single minded, he is merely driven.Even though he has comparatively little screen time, Josh Brolin is Penn’s equal as Milk’s twisted - and also quite conflicted - fellow city supervisor, Dan White. Since this is a biographical movie, it’s not spoiling things to tell you that White is heavily involved in Milk’s murder, but at no point does Brolin make you think he’s just a hardheaded antigay jackass who’s out to bust anyone who’s not white and “normal.” But it’s not important how Milk dies, because the focus here is his life’s work and how it affected not only the gay community - in San Francisco and nationwide - but also the straights, particularly singer Anita Bryant, who got it into her pretty little head in the mid-1970s that God hates gays, and therefore gays shouldn’t get any rights at all. Her crusading begins in Florida, where she was once a popular orange-juice pitchwoman, and leads all the way to Milk’s backyard.Set against the backdrop of the turbulence that gestated in the late 1960s and grew to angry fruition in the 1970s, Milk captures the feel of the period, sans sanctimony and hand wringing. Penn’s work here should notch him his fifth Oscar nomination, perhaps even his second win; Van Sant should also get his second nomination as well. There really isn’t much negative to say about Milk, unless you’re bigot who’s ashamed of how well Milk makes the case for equal rights for everyone.",9.0,Anonymous,Biography
Milked too soon!,"Milk (2008) -What I enjoy about this film is the cleverly entwined pieces of archive footage that is blended very carefully with the newer recording using filters, appropriate camera work and of course, great wardrobe and locations.Sadly, you know that it's not going to be a great review when the costumes and props, Etc get the first bits of praise.Trust me, when you've worked your ass off onstage and then, in the bar afterwards, someone says to you ""The scenery was great!"", you know that they hated the actual performance.But to say that I hate this film would be going too far. I can absolutely see the importance of the central character's real life actions and the need to tell his story, but I don't necessarily think that they do it the justice that it deserves. Along with his disciples, Harvey paved the way to an easier life for people like me around the world and that shouldn't just be rushed together for the sake of getting a film produced.I wasn't around when the events depicted took place and my knowledge of Harvey Milk is purely based on this film, but even if some of the elements were fabricated, it's clear that he was doing a good for the community.Whether Sean Penn is any good in the role, I can't really say, but he didn't grip me. The other characters seem to be more prominent at times, considering it is his name in the title.When I watched it for the first time I remember that I enjoyed it, perhaps because it was a film showing a fight for LGBT rights, but ever since, as I construct my list of films and there ratings, I continually demote 'Milk' down the chart. It just hasn't kept my appreciation over the years and I have seen many other films that have a similar flavour, but are done a bit better in my opinion.First of all, it is a tad rushed. I think perhaps the focus should have been on the last campaign before his demise and the incident itself (His death is not a Spoiler, it's History and is shown fairly early on in the film anyway), which would have allowed more time to show the passion and the drama and given a snapshot of the man to feel sad about, when those left behind get together at the end. This element for me is lost, because too much is going on. There are so many other important people that need recognition as part of his band that he loses focus.Secondly, and I realise that it isn't meant to be one of ""Those"" types of films, full of nudity and sex, but it kind of makes a gay film boring. The relationships shown are either dull or the complete opposite, far too over the top. Once again, this may be a correct interpretation of those real people represented, but I find it hard to enjoy the romance included and wonder if the focus shouldn't have been more about his political career and less on what he actually did in the bedroom. His activism is why he got to where he was, the fact that he slept with men was why he was fighting and what lead him there, but his agenda and the legacy that followed and continues are the more important parts of his life.However, although the ending is obviously upsetting, there is also a beauty to the way that it is portrayed and here is where they get it right. The music compliments that awful moment and the use of actual photos is a great way to honour all of those involved that backed and helped Harvey Milk. A lot of whom should also be more well known and honoured in their own right.But there is just something about this film that doesn't enthuse me at all. It wouldn't however, stop me from exploring the real Harvey Milk's history or watching other films and broadcasts about him, as it has at least brought him to my attention and sparked an interest in him and his work. If nothing else, it may have done the same for others and hopefully inspired some of them to keep fighting the good fight.701.09/1000.",7.0,Anonymous,Biography
A most excellent movie,"I'm not great at writing reviews, so I'll just keep it short. This movie was great. Very engaging. Very well acted.I moved to the Bay area 3 years ago and never really heard about Harvey Milk until recently. The whole story, including Dan White's ""Twinkie Defense"" is jaw dropping. If you aren't a right wing bigot, you should thoroughly enjoy this movie. Sean Penn is a class A actor through and through.PS: If you don't know much about the subject, go to the movie first, then do some Wikipedia research on Dan White, Harvey Milk, and Anita Bryant.",9.0,Anonymous,Biography
Propaganda film?,"The thing with biopics is that they tend to focus too much on their subjects even to the point of obsession, and in the process, they often ignore the fact that there are always at least two sides to every story. Milk is no different- and perhaps, it should not be. But when you go to see a Gus Van Sant film, difference is what you have come to expect (remember his mesmerizing opus on Columbine, Elephant): there is an unmistakable hypnotic quality about them. Milk is anything but hypnotic; at times, it becomes outright jarring.And of course, it relies too much on the performance of Sean Penn: that is its principal strength but also, in my opinion, its main weakness. There is no doubt that Mr. Penn is a superb actor, the kind who quietly slips into his character's skin. In Milk, he doesn't seek to re-interpret- or worse, re-invent- his real-life subject; instead he blends himself seamlessly into his character. So yes: you can still discern traces of Mr. Penn's temperamental volatility in the determined if somewhat power-driven gay-rights crusader, Mr. Milk. This makes the film so much more interesting.And yet Milk is really about Milk, the politician, and tells us very little about his personal life. For instance, his lover (played by Josh Brolin) is at best, two-dimensional. When he leaves him, we don't really know why. The script simply doesn't allow this aspect of Mr. Milk to develop.More to the point: by focusing almost exclusively on his several failed election campaigns, what Mr. Van Sant offers us is not so much a movie as a gay-rights propaganda film.",7.0,Anonymous,Biography
Too much hype ruined this,Not a Sean Penn Fan.this has been streaming everywhere since its release. I tried many times to watch it and never made it 45 mins let alone an hour..I know of him.and the story .. I was told I'd love it it's m3ssage and it's true story..I found it boring and tedious..tried other times to rewatch it .and again bored. I'd shut it off after less than a hour.maybe different actors ? Maybe the pace ? Don't know. I just wanted it to end so I stopped watching. A remake might help move it along with better actors and editing .. I know it's history a huge one for gay history..others loved it.i didn't see what they did..,3.0,Anonymous,Biography
Powerful and effective,"Ignoring the experimental dream-like cinema that marked Elephant, Last Days, and Paranoid Park, in Milk director Gus Van Sant uses conventional biopic techniques to depict the life of Harvey Milk, the San Francisco entrepreneur who became the first openly gay man elected to public office. Employing a less-than-effective framing device that shows Milk talking into a tape recorder at the beginning and end, the film also relies on archival footage to make its point, showing police abuses against gays and Diane Feinstein announcing the assassination of Milk and Mayor Moscone outside San Francisco's City Hall in 1979.Borrowing one of Milk's frequently used introductions to his speeches, the tag line for the film might be ""I'm Gus Van Sant and I'm here to recruit you"". In the film, Van Sant wants to introduce Harvey Milk (Sean Penn) to a new generation who know him only as a footnote and, in the process, to gain mainstream adherents for the cause of gay rights. In that, he largely succeeds, though the film tends to reinforce homophobic stereotypes by allowing overly effeminate and flamboyant characters to dominate. Sean Penn's polished performance as Harvey Milk is the highlight of the film and one sure to be remembered at Oscar time.He makes the outspoken businessman a plausible and even lovable hero despite his insecurities. Also impressive is Josh Brolin as Supervisor Dan White and Emile Hirsch as street-walker turned political activist Cleve Jones. Opening in New York in 1970, Milk touches briefly on Harvey's pickup of a much younger Scott Smith (James Franco), at a subway station, and follows their relationship to their establishment of a camera store on Castro Street in San Francisco. Though Scott was Milk's live-in lover for many years and ultimately his first campaign manager, little attempt is made to show him or other peripheral characters in much depth, identifying them only by their sexuality and support of the movement that Harvey built from the bottom up.Depicting the growth of the gay community in the area that centered on Castro Street, Van Sant captures the entrepreneurial spirit of the gay businesses that flourished on the street, yet he avoids the not-so-attractive aspects of the area that became in essence a sexual ghetto  its conformity of dress and speech, the proliferation of gay bars and bath houses in the neighborhood, and its toll of alienated and depressed inhabitants. Harvey's mission from the outset of his political career was to encourage homosexuals to come out of the closet. ""The blacks"", he said, ""did not win their rights by sitting quietly in the back of the bus. They got off! Gay people, we will not win our rights by staying quietly in our closets... We are coming out! We are coming out to fight the lies, the myths, the distortions! We are coming out to tell the truth about gays!"" Milk's two losing campaigns for the San Francisco Board of Supervisors and his close defeat in his race for the State Assembly did not dim his determination or sense of purpose, however; yet it was only when districts were reapportioned to ensure neighborhood preferences that Milk was able win election as a Supervisor. He became more than a one-issue official, lending his support to unions and the urban poor, his populism reflecting the basic belief that rebuilding neighborhoods was essential to achieve the American Dream. Milk organized his constituency into an effective political force which effectively faced the challenge of fighting Proposition 6, a statewide initiative to prohibit gays from teaching in the public schools, effectively legalizing discrimination on the basis of sexual orientation.While Milk is a message movie that unabashedly promotes a point of view, it transcends didacticism to become a human statement about the struggle of all people to achieve dignity, acceptance, and basic human rights and its depiction of the torchlight parade of 30,000 people to San Francisco City Hall on the night of the assassination is a magic moment. The film begins and ends with Milk expressing his love for another human being, a statement that the success of the gay rights movement will be ensured only when people are seen as human before they are seen as gay or straight. Ironically, that may happen only when the gay and the straight identities are subsumed into a broader understanding of what it truly means to be human.",9.0,Anonymous,Biography
Van Sant and Sean Penn create a 'fabulous' look at the life of Harvey Milk,"Wow... I still have tears. ""Milk"" is very heart-breaking, yet even more inspiring to see the life of Harvey Milk portrayed (more like 'embodied') by Sean Penn and director Gus Van Sant in such an uplifting and (yet again) inspiring manner. I would have loved to have just shaken Harvey Milk's hand.The movie contains one of the best ensemble casts I've ever seen, and Sean Penn IS Harvey Milk. All of the supporting actors are FANtastic, but great ones to watch are Emile Hirsch as Cleve Jones, James Franco as Scott Smith, Josh Brolin as Dan White and Diego Luna as Jack. Sadly I think Franco and the VERY over-looked Diego Luna will be missed come next year's Oscar nods, however Oscar vet Josh Brolin and Oscar rookie Emile Hirsch are most-likely to receive a nod for their performances.Gus Van Sant's directing of this incredible cast makes a perfect blend of great film-making with great acting to make this film a perfect candidate for Best Picture and more. The cinematography by Harris Savides adds to the power of the film as well as the power of the words from Dustin Lance Black's top-notch screenplay.A MUST SEE!!!!!",10.0,Anonymous,Biography
