title,content,rating,username,genres
Great performances only strengthen an already powerful film,"There is something inherently wonderful in Gus Van Sant's Milk. Besides telling the mostly true story of openly gay San Francisco politician Harvey Milk (Sean Penn), the film acts as a gay rights, and more importantly, human rights, piece that feels all too appropriate for the times.Leaving aside the homosexual bigotry we still face in 2009, it may be all too easy to see this as just another way of the Academy reaching out after the horrendous snubbing of Brokeback Mountain three years ago. That assumption is all too wrong.Milk stands on its own as a great film. Interweaving Milk's years running for political office alongside his own recording of a final will and testament, the film employs a fairly constant narrative structure of connecting the film's footage with stock footage from the actual events. In some cases, it may even be hard to tell the difference (save for some scenes where the stock footage looks blatantly worn down and grainy). It has been done many times before, but it works especially well for this film. It brings a much needed sense of realism to the film, and an even better sense of authenticity. You would never guess that the majority of these actors were even alive in the 1970s.Van Sant expertly uses Dustin Lance Black's original screenplay to weave the tale of Milk's final years living in San Francisco. We only learn vague notions of what his life was like before he met Scott Smith (James Franco) on his fortieth birthday. And while it may have helped flesh out Milk's backstory, the film succeeds without it. We learn enough about the man and what he did for the gay rights movement in 1970s America to appreciate and know who he was. The little tidbits we find out later on only cement the obvious feeling we get.And Penn, whose work I very rarely enjoy, breathes a fascinating amount of life into Milk. Penn puts his heart into the role, and really plays this one from down deep. You can see the hurt in his eyes, and the awe-inspiring joy. His body expressions say more than enough; with a simple twitch in his mouth, he can rather easily change the character's entire construct. He makes the acting look so easy, but I would be hardset not believing the real man acted in a similar way. While I think Frank Langella will ultimately win the Oscar, this is Penn's strongest work in over a decade (especially more so than that overrated Oscar-winning turn in Mystic River). His visual transformation into this inspirational individual is nothing short of amazing.Van Sant also succeeds in his use of love in the film. There are a few steamy homosexual scenes featuring Penn (none to the point of Brokeback), but they are all filmed so passionately and delicately that they look visually beautiful. In fact, the majority of this visually laden film is captured rather beautifully. Although it seems like there is particular emphasis on reflections and juxtaposition, there are some unique angles from crowd settings that help encourage the authenticity of the film even further.Josh Brolin delivers a startling performance as Dan White. If you have read anything about Milk, then you obviously know why he is so important to the story. But Brolin downplays the character for the majority of his time on screen (albeit, his first appearance comes halfway into the film). He practically quivers under Penn's shoes. But when he finally gets his moment to start chewing scenery, Brolin delivers in spades. He practically lets loose, showing off the excellent chops put to fine use in the underrated W. and No Country for Old Men. He too, plays a lot of his performance with his facial expression, and at times, he does not even need to say a word. We can just tell exactly what is going on. The man knows exactly what buttons to push to get a reaction.Franco, Emile Hirsch (Penn's leading man in the criminally snubbed Into the Wild) and Diego Luna all give fine performances in their roles. While I think Luna could have toned himself back a bit, I think Franco could have brought himself a little further. He too is quite important to the film, but he feels a bit too downplayed. I would have liked to see him do a bit more. Hirsch gets his moments, few and far between, and does a great job. He too could have done a bit more however, but nevertheless, his is a standout performance.If there are any problems, it is the fact that the film stretches itself a little too far as it nears the final act. It was not boring to the point of aping the sleep-inducing The Curious Case of Benjamin Button, but it was not exactly being very interesting either. I realize what is being shown is important and a lot of it thought-provokingly emotional, but there was about twenty minutes that could have easily been trimmed right down. It really feels like it is going the distance, but falters on the way there.It took a while, but it was well worth seeing Milk. Van Sant has helped craft a great piece of film-making that will surely not fade away anytime soon. While it is not clear how much of Black's screenplay is original and how much is real, the man clearly has talent and can only continue to go up from here.Milk may not be the best of the year, but it is surely among the ranks. Even if you are not gay, the film still provokes an immediate reaction I doubt will leave me. This is powerful stuff, and exactly what this film-making medium should be striving for more often. I can only wish more films will follow its example.8.5/10.",8.0,Anonymous,Biography
Amazing & Important,"Milk is a Fabulous film.in every way. trough it's photography and coloring...it takes us right back to the optimistic era in the 70-ies in which we find ourselves in San Fransisco in the gay-rights-activists scene off-which Harvey Milk was the Motor. Wow the acting of Sean Penn is beyond believe ! He really becomes Harvey Milk and his every breath say's so in this movie.Gus van Sandt brings us this important film in the right time...just now f.i in m my country , Gay right are very much in decline of acceptance due to various morals , laid upon us by so called religious tendencies. a dangerous development.more and more the gay's are getting back in the closet in fear of being beaten up or whatever.., f.i.in the city of Amsterdam what used to be ' the gay Capital of the world'.a shame. so lets watch MILK and realize the struggle these people had to go trough...and realize the difference in our humanity...and realize that God (if there is one)created everyone of us Gay's heterosexuals alike. Milk is a touching and inspiring hopeful film with a very sad ending. It gives us a totally believable account of what had happened.",10.0,Anonymous,Biography
Brilliant Portrayal by Sean Penn,"And Gus Van Sant is to be commended on his remarkable direction.I'm one who saw the documentary on Harvey Milk several years ago and it has stayed with me. I didn't expect this film to enhance my experience of the documentary, but it did, much to my surprise.Penn's performance is nothing short of stunning. He literally channels Harvey, by gesture and speech but most of all by the ever present smile. Harvey, as portrayed in the original documentary had a boundless joie de vivre and an irrepressible sense of self and a conviction of his own role in making history. Sean nails this.The film uses a series of short and sharp vignettes to tell the story of Harvey's life after his 40th birthday, his attempts to get election three times and his relationships.If there was any fault to find in the film it was in the occasional continuity lapses (one involving a dog that was severe enough to jerk me out of the film) and the sometimes irritating camera angles and muffled sound quality. Another was the dearth of visible homosexual women who were quite prominent in this era of the seventies.But on the whole, I found Harvey's romantic love stories believable and his personal charm captivating.Kudos to Sean Penn particularly and to the supporting cast of Josh Brolin, as the possibly closeted and mentally ill Dan White. Diego Luna, Joseph Cross and Emile Hirsch are also great but James Franco is a knockout as the one, great, romantic love interest at the root of Harvey's life.8 out of 10. Sean well deserves his Oscar nomination.",8.0,Anonymous,Biography
"Excellent... Very well made .. in-short, about a PERFECT movie","Direction 9/10 Acting 8.5/10 (Sean Penn was excellent and other cast did well) Original Score 8.5/10 Screenplay 9/10 (An Impressive debut)Tomorrow are Oscars 2009... I really want Milk to win, it was better than Slumdog Millionaire (excellent movie but has lots of errors)(8/10), The Reader(8/10),The Curious Case of Benjamin Button (8/10) and Frost/Nixon(8/10).My review For Milk would be 4STAR review. Its Very well made movie Gus Van Sant has done his work Perfect i didn't expect such good movie from a Biography.The movie is also Emotional i liked it from every dimension. But some straight Characters could have made it more powerful.This is obviously One of the TOP 3 Films 2008.",9.0,Anonymous,Biography
Good Milk!,"Got Milk? Unfortunately, we don't got milk anymore in the form of 70's San Francisco gay rights leader/elected official Supervisor Harvey Milk. He was assassinated along with then San Francisco Mayor George Moscone in 1978 by a former S.F. Supervisor Dan White. Director Gus Van Sant's ""Milk"" biographical diary film product turns out to be one of the emotional cinematic rousers of the year. Sean Penn milked it through with his performance as Harvey Milk; it is another ""Pennmanship"" acting showstopper which should garner him a Best Actor Academy Award nomination. Josh Brolin goes from effectively playing a Bushman (Anti-Gay) White in ""W."" as President Bush to effectively playing another Bushman (Anti-Gay) White as Dan White. Brolin continues to broil it up with his recent paramount acting performances. Oh Josh! This might be your Oscar year! James Franco gives a frank and tender performance as Milk's longtime lover and campaign manager Scott Smith, and Emile Hirsh is the Emile acting ticket again by charismatically portraying an ""into the wild"" Milk campaign apprentice called Cleve Jones. Openly gay Director Gus Van Sant constructively marches to the beat of his own drum by helming a profoundly inspirational narrative of Harvey Milk, the first openly gay person ever elected to political office. Milk's mission was not just about gay rights but about civil rights. So I think the Academy should be civil enough to consider Van Sant as a Best Director Oscar nominee. Van Sant's stock package of actual footage from the Milk era was an imperative ingredient to his ""Milk"". Dustin Lance Black's rookie screenplay of ""Milk"" was a verbal juggernaut achievement in civil rights literacy. The ""Milk Chronicles"" travel from Harvey's New York underachieving life to his resilient triumph to political candidacy in San Francisco to his tragic assassination in City Hall by White, and every Milk life drop in between. My only sour milk taste for ""Milk"" was the just one too many ""rah rah"" rally scenes. Nevertheless, ""Milk"" was up to par within my cinematic taste. It is time for you to be ""Under the Milky Way"" tonight and cinematically drink up a viewing of ""Milk"". **** Good",8.0,Anonymous,Biography
Stunning Biography,"Milk is one of the best films of the year and is a safe bet to make an appearance at this year's Oscar contest with Sean Penn almost locked into the favorite role for Best Actor. The film focuses on the gay rights movement in San Francisco in the 1970's and what could have easily boiled down to tired rhetoric is actually quite uplifting and entertaining.The film's framing device (harvey Milk predicting his own death in a taped interview with himself) is actually a pretty good way to plot out the story line beginning with Milk's arrival in SF and his meeting up with his long time lover (James Franco). The relationship between them is quite accurately observed. Those with an open mind will realize that these are the pitfalls inherent in any long term relationship, gay or straight. Another great performance is delivered by Josh Brolin as Dan White, the council member who finally cracked and whose attorneys came up with the infamous ""twinkie defense"".You don't have to be a liberal activist to enjoy Milk. Penn's performance infuses such humanity in the lead that the picture transcends many of the limitations of the biopic genre and makes for quite rousing entertainment regardless of your preconceptions.",9.0,Anonymous,Biography
And the Oscar goes to.....Sean Penn.,"I've seen most of the contenders but at the moment, I am deliriously  high on the on-screen Harvey Milk -- Sean Penn. I had just deemed Frank  Langella my best actor pick until I found myself mesmerized by Penn for  the entire two plus hour film.  Milk is a fine movie in and of itself. A wonderful tapestry of  political statement woven through a sweet love story. Harvey Milk was a  force whose wits were enhanced by a little chutzpah, or maybe a lot of  chutzpah, propelling him to get things done (an understatement). Armed  with his compassionate heart he was/is a gay man's champion and an icon  to his community. In his political struggle, he sacrificed his most  cherished relationship for his bigger picture mission to dignify the  gay community and lead them in reclaiming its civil rights.  The story is hopeful. It's heroic and touching. But the hero of the two  hour masterpiece is Sean Penn. I can't remember a film where he was  this good. I've always admired him as an actor but I was never over the  moon for him until now.  Like classic chameleon, Streep, Penn disappeared into Milk. He brought  depth to the character that transcends the standard of ""great acting"".  As Slumdog Millionaire created a new movie standard category, Penn went  beyond the normally impressive bounds of acting.  Penn was Harvey Milk. Dare I say it? Is channeling too eerie a word to  use or is that actually another synonym for good acting? I don't know.  Frank Langella. I still adore your Nixon. It amazed me at how this  handsome actor morphed into a despicable Nixon. Even though his body  language was superb, his posture precise, Langella really did make  Nixon a lot prettier than he was in real life. If you see nothing else,  see Frost/Nixon and Milk just to see the tremendous competition for  best actor. Oh, of course you've already seen Slumdog, right? That  movie is so far off the charts that none of the others compare, even  the best ones.",10.0,Anonymous,Biography
Good But Not Great,"Gus Van Sant's rock-solid account of the rise of San Francisco politician Harvey Milk and his efforts to bring awareness to gay-rights issues is supremely capable and engaging, but there was something about the whole thing that just felt a bit uninspired to me.I knew absolutely nothing about Milk's story before seeing the film -- I was all of three when Milk was assassinated -- so I was very interested in it from a historical perspective. However, I just didn't connect to it on an emotional level. I'm not sure why, because I'm a chump for a good old fashioned underdog story -- which ""Milk"" certainly is. And there's almost nothing negative I can say about the film that accounts for my lukewarm reaction to it. Sometimes there's just an intangible ""something"" missing from a film that prevents me from responding much to it, and that's the case here.It does boast a tremendous performance from Sean Penn though, completely lacking in the hamminess Penn has been guilty of in his more recent film appearances. He unfussily gets down to the business of playing the character of Harvey Milk without self-concsiously reminding us that he's Sean Penn playing him. Weirdly, despite Milk being such a flamboyant character, Penn's performance is unshowy. Of the supporting cast, I was most impressed with Emile Hirsch, who plays a member of Milk's campaign committee. Hirsch contributes a great deal of energy to the film whenever he's on screen, and the scenes featuring him and Penn together are some of the movie's best.For once, I didn't like a Danny Elfman score. It's too obtrusive and is at odds with Van Sant's typically objective style. But other than that, I thought the film was extremely well done.My comment may have already made this apparent, but I'm rather puzzled at my own reaction to the film. Instead of being able to give it an enthusiastic endorsement, I rather thought that it was a good but not great 2008 offering.Grade: A",8.0,Anonymous,Biography
Sean Penn and Gus Van Sant at their finest.,"I honestly don't know where to begin.This is by far the best male ensemble cast, and one of the best ensemble casts in years. Sean Penn is outstanding as Harvey Milk, becoming the character in full, and unrelentingly motions up and down the emotional spectrum.James Franco is great supporting throughout the movie. I personally feel as though the golden globe nom should have been for this as opposed to Pineapple Express, which he also did quite well in I might add.Emile Hirsch is outstandingly entertaining, with a very feminine ""prick"" like demeanor.Diego Luna is equally funny, and manages to play slightly on edge from the first scene he's in, pretty damn well.I think this is Gus Van Sant's finest direction. Either the set design, or the way Van Sant manipulated it, was the finest I've seen in quite some time. Reflections, reflections, reflections...(and the whistle shot...god damn) Sean Penn's flawless, go see this movie.9 out of 10.",9.0,Anonymous,Biography
A very good movie carrier by a mesmerizing performance by Sean Penn,"Greetings from Lithuania.""Milk"" (2008) is a superb biopic about Harvey Milk. I have not heard about him before this movie and the whole thing which he was up to is not my kind of thing, but all aside, this movie was great. Now after seeing this movie i absolutely sure that Sean Penn deserved Oscar for this performance more then Mickey R, for ""Wrestler"", and although that movie was also very good with great central performance, Sean Penn absolutely killed it in here - now here is some powerhouse acing which you won't see every day. Directing and writing were first rate.Overall, ""Milk"" is a great movie. At running time 2 hours i was captivated to see this man's live and what he fought for. This is a very good picture.",9.0,Anonymous,Biography
"History is Beautifully Portrayed by a Superb Cast,","Milk is a great movie with a very well developed storyline and an outstanding cast. History is truly brought to life in this film, all the actors put their heart and sole in to these performances, Senn Penn truly becomes Harvey Milk, he is nothing like himself as he has completely devoted himself to this character, and he certainly deserved his second Academy Award win for this. I didn't particularly like how it showed actual footage of Harvey Milk throughout, It was up to Penn to convince the audience that he is Milk, so I didn't think it was necessary the show the real man, it simply took me away from his performance. The struggles for gay rights back in the seventies are superbly captured in this, it conveys a clear sense of how difficult this really was and how some people were strong enough to keep fighting. Stunning performances and an uplifting true story, I would recommend Milk to anyone looking for a good biography film or drama.Follows the story of Harvey Milk as he fights for the rights of gay people and soon becomes the first openly gay official in Califronia.Best Performance: Sean Penn",8.0,Anonymous,Biography
A Nutshell Review: Milk,"Biopics work for me because I'm innately curious about that aspect of a person's life which makes it compelling enough for others to want to make a film out of it. This film by Gus Van Sant tells the story of California's first openly gay elected official Harrvey Milk over the span of the last 8 and definitely more fruitful years of his life where he discovers his calling ironically after confessing to a lover that he had so far not done anything constructive with his, and then with their subsequent move to San Franscisco.Milk is one of the films this year up for a number of accolades, more notably for Sean Penn's nuanced performance as Harvey Milk. I thought he had, with the help of make up, totally disappeared into the role, and gave it his all as the soft spoken, and idealistic political rookie who had to take on the big boys, as well as deep rooted bigotry and prejudice. And not only that, he has to contend with keeping his partner Scott Smith (James Franco) emotionally satisfied, since it's no longer a private world of their own, but one which faced the tussle of precious time as he finds it his calling to take up political office. I felt that while Franco has to date played plenty of pretty boy action roles, here he ramps up his dramatic performance opposite veteran Sean Penn, and managed to hold his own too.Not only that, the ensemble cast here had been top notch, and that's not only just kudos to the make up team in having them resemble their real life counterparts to a T. Josh Brolin as Dan White always had this unpredictable edge to him, and his involvement in the inevitable finale was nothing short of chilling to witness. Emile Hirsch as Cleve Jones plays one of Harvey's key assistants, and his role here was quite endearing, despite being only in a supporting capacity.Watching this film, you can't help but to appreciate just how long the USA took to change its perception and acceptance of the GLBT community. It takes relentless, continuous effort to effect change from within the political system through a very charismatic personality supported by his own grassroots. As the saying goes, change is the only constant and is inevitable, and one of the strategies undertaken here was to come out of the closet, so that friends and family could demolish the stigma of demonizing those who are queer and come to accept them, since after all, they could be immediate friends and family. This I thought was a smart move since it almost does away with negative perception and destructive assumptions, though it calls for a very stout heart for anyone to reveal who they truly are.Gus Van Sant had wonderfully mixed the filmed narrative with real archival footages to add that sense of realism to this biopic. He doesn't paint that pitch perfect portrait of Harvey Milk, and provided a sense of balance in that it does take whatever method that works to try and drum up support for their movement. Which I thought had echoed that plenty of successful ideologies thrive, not because what persists is that charismatic representative, but that of the doctrine that people subscribe to.And collectively and persistently, change can be effected. There's nothing too fancy about the way Harvey Milk's life got presented here, but it delivered where it mattered in having a solid narrative to illustrate the life of a man who's in pursuit to eradicate negative mindsets and the deeply harboured prejudice of man. The homosexual subject matter may be central here to the cause, but put aside, the same struggles and challenges to overcome are universal conditions that everyone will go through at one point or another. A highly recommended movie.",8.0,Anonymous,Biography
"""My name is Seth Wehner and I'm here to review you""","Milk- one of Sean Penn's greatest performances ever. Everything in this movie had something everyone liked, unless you hate gay people. I find Milk interesting because it was the time after the Civil Rights Movement and people thought that everyone loved each other, but there was still an out casted group of people; homosexuals. Harvey Milk was the MLK of homosexuals and this movie addresses that greatly. Penn does a great job acting as a gay person as did a retarded person in I Am Sam, but you could really feel that he was Harvey Milk even if you never heard of Harvey Milk. Penn definitely deserved the Oscar. The entire cast did a great job helping out from James Franco, Josh Brolin, Emile Hirsch and company, but Sean Penn stole the show. If you are someone who hates gay people then you might want to see Milk just to see how gay people were living through back then and how it is applied now. Milk was great in almost all aspects in directing, writing, and acting. MIlk is definitely worth watching.",10.0,Anonymous,Biography
