title,content,rating,username,genres
Believe the hype.,"Pretty much perfect. I do have one complaint with the film though; we should have seen more Dan White. It felt like they just spaced out scenes for him where he showed up every ten minutes after his first appearance and each scene of his was a big block of character development. It did a good job of demonstrating what led him to kill Harvey Milk, but didn't give us a chance to sympathize with him or even really understand why he did it beyond the basics. I felt like there was a lot more depth to him beneath the surface and while Josh Brolin did a great job of showing the insecurities and anger of the character internally, I wanted to see his flaws fleshed out more in the actual story instead of just in Brolin's performance. Aside from that, I have no complaints with the film.I've seen a lot of people call it an unconventional biopic, and while I can't really agree with that, it's definitely the pinnacle of a biopic. I'm tempted to say that Sean Penn has never been better than he is here and I'm struggling to think of a reason why that wouldn't be true. People say it about performances all of the time, but it's really true here; Sean Penn became Harvey Milk. He embodied the life and soul of Milk and completely disappears into the character. It's one of those cases where you think he's not really doing anything impressive...but that's what makes it so impressive. He lives and breathes the character so much that it just becomes his natural persona for the duration of the film and you don't realize just how brilliant he was until it's all over and you think 'That was Sean Penn that entire time.' An impeccable performance if I ever saw one. No one can beat Sam Rockwell (in Snow Angels) for me this year, but since he's not a contender I'm throwing my hat in the 'Give Sean Penn another Oscar.' ring as of now.Gus Van Sant's direction was superb; he used the technique of bleeding real footage into the movie footage that we've seen before, but something about the way he did it made it all feel very organic which I loved. He made everything lively and fresh while not getting in the way of the actors doing their jobs and that's pretty hard to find. The screenplay incorporated all of these big, epic moments of Milk's history into the story of his personal and political life without missing a beat or making anything feel like 'Oh, this is just building up to that big speech.' which is a problem that occurs with a lot of biopics. Danny Elfman's score ranges from emotionally powerful to beautiful to quietly haunting without getting in the way of the rest of the story. It's my favorite of the year so far. The cinematography gave a very intimate feel to everything from the first love scene between Milk and James Franco's character Scott Smith to those big speeches and marches unlike most films where they make those moments seem grand and out-of-this-world. But here everything is very 'in the moment' throughout.And finally, the acting from the entire cast is brilliant. Penn leads the front with an Oscar-worthy portrayal. Josh Brolin is emotional and painfully insecure in his own body. James Franco goes from being the gorgeous, flirty young boy to a brooding man who just wants to be with the man he loves but that man is too busy focusing on much grander things. Emile Hirsch is adorable, driven and wildly charismatic. And the rest of the campaign cast did a great job of blending organically into their roles.",10.0,Anonymous,Biography
Extraordinary,"My knowledge of Harvey Milk's story prior to walking into Gus Van Sant's extraordinary drama of the life and times of the openly gay politician was vague at best. I knew he was the first elected municipal leader to be openly gay in US history and I knew he was assassinated. However, as his story unfolded, I learned just how important this man is to American history and just how much he truly was the Martin Luther King of the Gay Rights Civil movement by how much he pushed it forward by leaps and bounds.Part of me wishes this film had been released prior to the US elections as it could have had a ripple effect and helped prevent the human rights disaster that is California's Proposition 8 from ever passing. However, I believe it could still have a huge hand in changing the ideals and the thoughts of many of the ignorant masses if they actually just gave two hours of their life to watch what this man did for the people, the city of San Francisco, the state of California, if not the nation.Sean Penn in the lead role is undeniably one of the strongest performances, if not the strongest performance, of the year, if not his career. The gage of true talent is when an actor who has so much history and is so well known actually makes you forget you are watching them. Penn became Milk in all his homosexual glory. As his lover of many years, James Franco, best known as a pseudo teen heartthrob, proves he may have what it takes for longevity giving a strong supporting performance that also has been causing whispers of Oscar nomination. Admittedly, the first time you see these two manly-men-like actors kiss, it may cause you to gigglebut it's because they jump into it before you've had a chance to even settle into your seat. But soon, you forget who you're watching and the two become nothing but their characters and you feel a natural love between the two like any other on-screen couple.Emile Hirsch, highly praised for last year's Into the Wild, is almost unrecognizable as one of Milk's devout supporters, Cleve Jones, and could be invited to Oscar night as well. Even Josh Brolin's turn as obviously-closeted Dan White, one of San Francisco's other elected reps who went on to assassinate Milk and mayor George Moscone, offered up an incredibly strong, subtle performance.No doubt, this film could potentially get a lot of attention from the Academy if the film is not deemed ""to gay"" by its members. Brokeback Mountain may have gotten a lot of attention, but its heterosexual elements may have helped that. There is nothing heterosexual about Milk, the man and the film. This may be the gayest major-studio film ever made which may hurt or harm its chances come Oscar night.We can only hope this film gets the credit it deserves across the board, especially for Sean Penn. To paraphrase Alan Ball, Oscar-winning writer of American Beauty and creator and Executive Producer of HBO's ""Six Feet Under,"" a straight actor taking on a gay role is no longer an act of bravery, however a straight actor refusing to play gay is an act of cowardice. Sean Penn may not have been brave by taking on the role of Harvey Milk, but his portrayal of this man made Milk's monumental bravery crystal clear. Harvey Milk is a hero.",10.0,Anonymous,Biography
A remarkable performance in an average film,"POSITIVES:1) Sean Penn's performance is incredible. He completely transforms himself and plays his role perfectly. All the performances are great but Penn shines.
2) I usually dislike narration in films, but I actually enjoyed Penn's narration in this film
3) The direction and cinematography are both very good, lots of long takes and there is a shot of the reflection of a whistle that is masterfulNEGATIVES:1) The way Milk instantly ""picks up"" Franco and Luna's characters was quite uncomfortable
2) The film suffers from a problem most biopics do: there are frequent montages and fast forwards in order to try and cram everything into one film
3) By skipping over lots of time very quickly, the film was often quite uninteresting and not engaging for me. The protest scenes and the marching scenes are fantastic but I found the frequent scenes of Milk's personal life and partying very uninteresting",6.0,Anonymous,Biography
Wonderfully-made and inspiring,"""Milk"" is so good that immediately after it was over, I wanted to stay in the theater and watch the whole thing again. I went into the movie with high expectations, and, while it took me a little bit to get used to the movie's fast pace, I wasn't disappointed.I spent months before the film's release reading about Harvey Milk, and while ""Milk"" shifts a few facts (example: he met Scott on his forty-first birthday, not his fortieth, and by then he was already a hippie who hadn't worked in insurance for the last few years) and simplifies others (in the interest of time, his connection with the Peoples Temple is completely skipped), it's true to the essence of the man who went from being a semi-closeted New Yorker, with few accomplishments to his name, to the first openly gay man elected to public office in America. The acting is uniformly excellent and there's no sense that the filmmakers are trying to make anyone a pure hero or a pure villain, even the unbalanced-yet-pitiable Dan White.Sean Penn portrays Harvey Milk as a genuinely kind and good-humored man who sometimes lets his newfound goals and ambitions take priority over his personal relationships; James Franco is quietly devoted as Scott Smith, Harvey's boyfriend who leaves him when he grows tired of the endless campaigning but is still always there when Harvey needs him. Perhaps one of the most fun performances to watch is Emile Hirsch as Cleve Jones, who begins the film as a bratty part-time prostitute but evolves into a tireless activist who, we can tell, is going to be the one to pick up where Harvey left off. Diego Luna plays Jack Lira, Harvey's sexy yet clearly disturbed post-Scott boyfriend, and Josh Brolin is surprisingly sympathetic as Dan White, Harvey's Board of Supervisors colleague who will seek Harvey's friendship despite a personal opposition to homosexuality, feel an overwhelming sense of betrayal when Harvey votes against him on his pet project, and eventually kill him out of envy and revenge. Alison Pill, Joseph Cross, and Lucas Grabeel are among the actors who play Harvey's campaign workers; one of the things that makes this movie enjoyable is the sense of camaraderie among Harvey's friends and supporters. You wish you could go over to Castro Camera and hang out with them yourself.Harvey is so likable as a character that I spent a large portion of this movie smiling just watching him. He's charming, funny, and gives everyone a fair chance; while his friends dismiss Dan White, Harvey insists that Dan ""will be fine"" and can be educated. At the same time, he's definitely flawed, with a sometimes questionable taste in men (none of his friends can understand why he stays with Jack, who drinks too much and has temper tantrums) and a willingness at times to trample people's feelings in the name of the greater good. There's a scene where he decides that all his campaign workers have to come out immediately, including a young man named Dick Pabich, who Harvey insists has to call his father this very minute even though Dick looks as though he'd rather hide under a rock. It may be his decision to ignore Dan White's feelings that seals his fate.While the movie never excuses Dan's actions, we understand his frustration and rage. He takes a huge step out of his comfort zone to try to be Harvey's friend (there are hints that he subconsciously wishes their relationship went beyond friendship, but this is never presented as a certainty, only a possibility) and is personally hurt when the courtesy he extends to Harvey isn't reciprocated. He has no friends on the Board of Supervisors and is struggling to support a wife and baby on a tiny salary. While he can't get one single thing he wants, Harvey's becoming a media superstar.Even after they've broken up, Harvey and Scott have one of the sweetest gay relationships I've seen in any movie. The chemistry is strong from the moment a nervous-yet-charismatic Harvey picks up Scott, a cute hippie, in a subway station on his fortieth birthday, and every time they kiss, hug, make love, or even just talk as Harvey makes dinner, we can tell they're crazy about each other. When Scott leaves we want Harvey to get him back or die trying, and after they break up we keep hoping they're going to reconcile.I've spent most of this review talking about the interpersonal relationships, as opposed to the gay rights element, because they're so essential to the story, but the gay rights element is also excellently-done and inspiring. Watching the various protests and marches is exciting, and it's fun seeing Harvey debate anti-gay crusaders until their logic collapses on itself. Despite various tragedies, the final feeling the film leaves you with is one of hope - which, I think, is how Harvey would have wanted it. Definitely see this one.",10.0,Anonymous,Biography
Penn turns in a masterful performance,"One thing can for sure be said about Milk (2008), and that is that Sean Penn turns in a masterful, beyond accurate performance. He portrays gay rights advocate Harvey Milk wonderfully. And James Franco is great here too, I absolutely loved him and his character in this film. The chemistry between Penn and Franco is believable and I for one really rooted for their relationship. Josh Brolin plays murderer Dan White very accurately, and I commend him on a great performance. Dustin Lance Black wrote a great award winning script that works so well for the film. And the love/romantic scenes between Milk and his lovers are well shot and tastefully done. The movie shows the ups and downs of milk's life and how he fought tooth and nail for LGBT rights in San Francisco, California, and ultimately across the United States. I do personally feel like the movie could have been just a little stronger overall, but I still feel like this was a great representation of Harvey Milk's remarkable life. Milk (2008) receives a 7/10.",7.0,Anonymous,Biography
"A Much-Needed Biopic of Perhaps the Most Important Politician of the Last Half of the 20th Century, As Well As a Blow to the Nuts of Prop 8","After seeing Milk, a much-needed biopic of perhaps the most important politician of the last half of the 20th century, I have a renewed respect for Sean Penn. He is among the contemporary powerhouse testosterone-heads like De Niro, Pacino, Hoffman, Hopper, Nicholson, you know, swarthy New Yorkers who use heavy method acting despite today's cynicism towards it. He was at one time the prototypical Hollywood punk who punched extras and photographers, did drugs and chain-smoked. Here he faithfully and lovingly reflects one of the most honest, understanding and loyal people in history, to an extent that none of his said peers have shown the balls to.I see this film as not only a product of incredible dramatic and visual talent but also a righteous breakthrough of humanity in a most trying time for it. We never hear about the countless important gay men and women in history, but now Gus Van Sant, himself gay, has at last given us an accessible mainstream movie about one of them. To prove a significance for themselves today, when their basic rights are still being challenged, they, and we, have to relate to one of them in the past, as this film makes clear.Harvey Milk became the first openly gay American elected to public office. He made a prevailing plea to closeted gays to come out to their families, friends and co-workers, so the straight world could stop vilifying a theoretical, nonrepresentational perception. But so influential was the movement he was key in motivating that I believe his demand has now virtually been regarded, apart from some willfully primitive regions of the country.Van Sant's masterpiece begins with Milk remembering into his tape recorder about an individual passage that sparked at the ripe age of 40! At that cut-off point, he grew discontented with his life, determined he wanted to really accomplish something. A Republican stock researcher, he mingled with hippies in Greenwich and tiptoed the closet door, waving out hesitantly. He was in love with Scott Smith, played so becomingly by the underused James Franco. This is all absorbed from one scene, shot in a single, mostly stationary take. They moved to San Francisco, opened a camera shop and saw that even America's leading, most strident gay community was being methodically victimized by police.What made Milk such an effective politician was that he didn't go into politics as much as he was pressed by the motivating proof he witnessed every day. He ran for the Board of Supervisors three times before being elected. He campaigned for a gay rights ordinance. He organized. His tongue was always in his cheek yet he always helped as much as he could. He built a coalition with liberals, unions, longshoremen, teachers, Hispanics, blacks and others with shared needs for equality. He ripened his gift for public relations. He became an invigorating spokesman. By now branded the Mayor of Castro Street, he secured public office. It was an oppressive platform from which to confront firebrands like fagnostic Anita Bryant, who Milk would taunt with his wisdom and confidence by calling her always by her first name.Beautifully crafted, enveloping massive amounts of time, people and spirit without a frame of half-heartedness or drained momentum, this tenderly handled picture tells the story of its hero's ascent from disgruntled middle-aged hippie to nationwide icon. Entwined are his romances. He remained dormantly in love with Scott after they separated due to his political concentration. He is instinctively caring even of a second lover who becomes irrationally resentful of his political life, when the practical thing would be to sever the bond.His most critical rapport was with Dan White, an apparently straight fellow supervisor, a Catholic who said homosexuality was a sin and canvassed with his family in red, white and blue. A thorny pact formed between Milk and White. If I were to criticize the film at all, I would lament that the depiction of the camaraderie between Milk and Mayor George Moscone is given far too little screen time.There is no misstep in the taut, multi-faceted screenplay, the potent cast or the first-class technical film-making. There is not one shot that isn't given rich creative nuance. What's more, the film is so faithful to its period that it seamlessly uses stock shots wherever possible, opening with archives of police raiding gay bars, then Dianne Feinstein's announcement that Milk and Moscone had been assassinated. Knowing Milk's story beforehand didn't make the archival candlelight march at the end any less overwhelming. It was the effect of one man's resolution too late in his life for him to have ever expected. Milk adopts emboldened importance after the victory of the appalling Proposition 8 as an electrifying honor of a key gay figure who would be raising hell right now.",10.0,Anonymous,Biography
Well balanced film with flaws,"This film is a rather well balanced biopic. It balances the personal and the general, the factual and the emotional, and the partial and impartial. We get a good impression of Harvey Milk as both a person and an activist. The other characters and story elements are also well portrayed. However, the narrative flow becomes muddled after the halfway mark and I felt disengaged.",6.0,Anonymous,Biography
Milk: Another Van Sant great film,"Milk tells the real story of Harvey Milk, the first openly gay man to be voted into public office in America. It is an inspirational drama, directed by Gus Van Sant, that reflects the intolerance and the lack of respect to gay people on the 70's decade. It is a film full of drama with some moments of maybe involuntary humor. The locations in San Francisco and the real footage makes the movie more realistic along with the very good costume design. The cast is wonderful, Sean Penn in the leading role as Harvey Milk delivers a flawless and powerful performance, he totally earned that Oscar. Josh Brolin as supervisor Dan White is excellent, no wonder why he got an Oscar nomination for supporting role. The rest of the cast like James Franco, Emile Hirsch and Diego Luna were good and convincing. In conclusion, Milk is a fully recommendable movie the teaches us to tolerate and accept people just the way they are.",10.0,Anonymous,Biography
Amazing performance by Sean Penn,"One of the most remarkable things about Milk is how little controversy has surrounded it. Just three years ago, the release of Brokeback Mountain was met with boycotts from anti-gay activists and sparked picketing of theaters carrying the picture. By comparison, Milk has courted minimal outrage. This may change over the course of the next few weeks as it expands to a national release, and surely Fred Phelps will have more than a few kind words for it, but it's still rather remarkable that the film has managed to produce such little fervor from the public. Even a visit to its IMDb message board reveals far less heated discussions than were present for Brokeback.Is it because it's a biographical film, rather than mere fiction? Probably not, since biographical films have been boycotted in the past, too. I tend to be optimistic on this topic, and like to think that the general public is becoming more comfortable with films like Milk. After all, in the Obama age, hasn't it become positive for us to be more open-minded and tolerant of others? The current generation spent its formative years in the Bush era, watching the Daily Show become more reliable than most reputable news sources. I don't mean to sound like Keith Olbermann, but American culture has changed rather distinctly within the past decade, and it's refreshing to see a great film judged on its artistic merits, of which it has many.Harvey Milk was the first openly gay politician in American history, elected to office in San Francisco in 1977. He was assassinated by Dan White, a resigned city supervisor, in 1978. These are the textbook facts, but the movie sheds some light on Milk's personal life, painting a fair portrait of a complex man  from his relationship with a younger male, Scott Smith (James Franco), to his journey into politics, to his untimely demise.Sean Penn's performance as Milk is almost certain to earn him an Oscar nomination. He seemingly channels the spirit of Milk, completely disappearing into character. It's a great performance, but not surprisingly so  Penn has become consistent enough that even in his lesser films he manages to create brilliant work, so it's no shocker to witness what he does with Milk. It's a testament to his strengths as an actor that you find yourself acknowledging Harvey Milk not as a mere character, or as a Sean Penn impression, but as a real person; you don't, at any time, actually feel like you're watching an actor on screen. The only other lead acting performance that may come close to this one in the year-end Oscar race is Mickey Rourke's turn in The Wrestler, with both performances focusing on what are essentially tormented and misunderstood souls.The supporting cast is up to par, too. Franco, as Milk's true love, is given slightly less to do with a character who vanishes for most of the film's middle portion, but with his work here and a great comedic performance in this year's Pineapple Express, Franco is fast establishing himself as a true talent. Emile Hirsch, as real-life activist and campaign worker Cleve Jones, turns in a humorous but affecting performance that probably won't win him any supporting standalone recognition from Penn, but helps reinforce Hirsch's direction towards becoming one of the best actors of his generation. It must also be said that Josh Brolin handles the thankless task of portraying the relative ""villain"" of the film, Dan White, with all the despair of a tragic hero. We feel that White's early intentions are earnest and goodwilled  he even invites Milk to his child's baptism  but as the events progress, Milk becomes distanced from White's policies, and White falls from glory, resigning from his position after what he perceives to be a public embarrassment at the hands of Milk, and then  after pleading to have his job back  is met with dismissal. White doesn't seem ""evil"" or even all that unlikeable  just unstable, with repressed feelings (in more ways than one, as the film implies) and a fairly dark side. We don't hate him, by the end of the film, because he is given a remarkable amount of depth despite Brolin's limited screen time.One could view this film as a passion project for director Gus Van Sant, who had subsided into independent films for a few years after the mainstream successes of Good Will Hunting and Finding Forrester, but perhaps found identification with the themes of Milk. The movie arrives at an opportune time, with its focus on the Prop 6 controversy in the 1970s immediately finding relevance with the current Prop 8 vote. Some of the vintage news footage shown in the movie, featuring interviews with anti-gay activists of the time like Anita Bryant, seem amusingly dated  until you realize how they, too, are uncomfortably relevant in our day and age.Ultimately, the movie tells us that Harvey Milk wanted to bring about change, and shows us how he made quite an impact during his short-lived political career. The film serves him justice, and  thanks to a faultless cast and a great director  is one of the best of the year.",10.0,Anonymous,Biography
