title,content,rating,username,genres
Simply one of the finest movies made.,"Once in a generation a film comes along that reminds us about that special person who makes such an impact on our lives, and the lives of so many others, while remaining unaware of the effect that they have had. In the 1930's it was ""Goodbye Mr. Chips."" In the 1940's is was ""Good Morning Miss Dove."" And now comes ""Mr. Holland's Opus."" These three films have one thing in common. They cover a lifetime of teaching and the effect it has on the teacher as well as the students they have come into contact with.Richard Dreyfus creates a bravura performance as Glenn Holland, and should have won the best actor Oscar for his role, even as Robet Donat did in ""Goodbye Mr. Chips."" This film was special to me for two reasons. I had a chorus teacher in high school had affected me in such a way as Mr. Holland did his students. And years later I had the opportunity to work with and teach Drama to young people from age six up. I have seen this story from both sides, and it still affects me so very much.My only argument with the film is in the final scene. If the Governor was so dedicated to Mr. Holland why did she not do something about retaining the music program in that school? It is a small plot point, but I was curious. All in all though this is a wonderful film, and should be in everyone's film library. It earns two thumbs up from me.",9.0,Anonymous,Music
Poignant film,"Mr Holland (Richard Dreyfuss) is a frustrated musician and composer. He is frustrated at his teaching job. It was supposed to be temporary to pay the bills. But the years pass, his life passes, and he feels he has achieved nothing. But what he discovers is that his life has meaning for all those he has touched over years.This is definitely one of those feel good movies. The individual stories are memorable. The feeling of lost palpable. The moment when he finally connects with his deaf child. That was powerful. All the stories are poignant. Richard Dreyfuss is perfectly suited as the old disillusioned teacher. It's a good cry movie all the way.",8.0,Anonymous,Music
The Opus Of Life,"The first time I watched it I thought it summed up so many frustrated musicians and other creative artists who get distracted by life and miss their moment to create something brilliant. The emotionally-charged ending hits me every time. I'd like to think that there's some of Mr Holland in me.Rowena's theme is haunting, though strangely his Opus isn't what I'd imagined at the end.Nonetheless, Drefuss (and all of the supporting cast) put in a superb performance. It's amazing what a bit of hair dye and a shave can do to exaggerate the passing of time! Inspirational stuff...",10.0,Anonymous,Music
another feel-good film,"'Mr. Holland's Opus' is the classic student-teacher relationship film. (This film is similar to 'Renaissance Man'; replace a few keywords in the plot, and you basically get the same story.) Mr. Holland feels like a failure, and he has the desire to create a musical masterpiece. In order to pay the bills, he gets a job as a teacher at a school, and he teaches them how to appreciate music; this allows them to learn how to appreciate life. Simply, this film is another example of one of those feel-good films that fills you with a lot of hope. It moves a little slowly, but I think it succeeds in providing the viewer with a sense of hope. Not an excellent film, but it is not a great one either.",4.0,Anonymous,Music
This movie is my favorite in the world!,This movie is wonderful because it touched me by my heart and I am proud to be deaf. It is my all time favorite movie since I was 13 and watched this movie plus I loved it! It is the best movie in the world! That movie is showing us more respectful to us deaf people out there that makes us very happy and touched by our hearts and proud to be a deaf person signs like Cole is. ASL is the best language for us deaf people out there to communicate easily. We are proud to be deaf since birth and growing up to communicate with the hearing people to be friends and teach them how to sign. It's fun. ASL is more cool for teaching hearing people to learn how to sign from us.,10.0,Anonymous,Music
Great film that brought back a lot or memories,"I think this is probably the best thing Richard Dreyfus has done. The story was great and reminded me of a teacher I had in high school who taught me the most important lesson of my entire life, as did Mr. Holland with Gertrude.The scene of the funeral and later the death of John Lennon were very apropos to the story line. And when Holland learns that his own son loves music its just gets that much better.I have and will continue to recommend this movie to anyone who will listen. Its a wonderful story of a man trying to cope with life and ending up impacting 100's of lives along the way.",10.0,Anonymous,Music
I love this movie :),I really don't have much to tell about this movie. This movie is good. The story is good. The music is good. The actors are good. I always cry at the end.  I'm overwhelmed by so much of their kindness and respect to Mr. Holland. This movie is good.,9.0,Anonymous,Music
Captured by heart warming feelings will keep you till the end.,"The movie had just started as I was sitting at my computer playing freecell. I was unable to maintain concentration so I got up and sat down and was caught up by the flood of emotions that began to grow as I watched. The script, the actors and the performance was wonderful and the tears flowed as the time passed until the delightful ending. The loss of dedicated individuals in the teaching profession was so clearly shown and demonstrated as the story unfolded. Many  will have a Mr. Holland who helped form there approach to life. Helping someone understand the value of learning and overcoming the roadblocks to success can lead to an opus for each person in his life.",10.0,Anonymous,Music
For Music Lovers,"I've read some of the reviews here and I'm inclined to think a group of crabby, miserable no-life's got together and decided to low-rate and bash this movie on silly, ridiculous grounds. Some say they ""hate"" this movie and are ""offended"" by it. Um, really? This is among the most non-controversial movies you will ever see, lol. To ""hate"" something so light-hearted says A LOT more about you than it does this film. But I digress...I just caught this movie on television and was reminded of how much I enjoyed it back in '95 when it was released. What a delight. As Mr. Holland says in the movie, music is not something you ""know,"" it's something you appreciate, something you feel. I think this is a sentiment that especially applies to those commenters who ""hate"" the movie because it's historically inaccurate. My response: WHO CARES? The supposed inaccuracy does NOT take away from the theme or the intention of the film. The film is intended to evoke inspiration and sentimentalism and it does precisely that. It's a smart movie, but it's not at its core a ""thinking"" film--it is a FEELING person's movie. Like most great movies, its power is that it touches you on the inside. You totally miss the boat if you think about it too much or nit-pick here and there.If you love music and learning and passion and reflection, this movie is for you. Please don't be fooled by the ridiculous low-rating of 7 here. It's an absolute tear-jerker--I cried twice and I'm not a boo-hooer--and a feel-gooder. If you have a pulse and you're not an ""accuracy"" snob, you WILL enjoy this film and I recommend adding it to your DVD collection. I mean, how many more family-friendly feel-good flicks can you pop in and enjoy when you're down and enjoy with family and friends of all ages and stripes? Um, not many.This movie is all that. Loved it! 8/10",8.0,Anonymous,Music
Beautiful and touching,"Mr. Holland's Opus is a lovely and engaging film about a musician and composer forced by life to get a 'real job'. The movie skillfully takes place over many decades and is tied together by the music of each generation. Filled with all the emotions and decisions we each must deal with every day, Mr. Holland's Opus explores what it means to have your dreams conflict with your reality with results ranging from frustration to melancholy to joy. Heartfelt without pandering or being overly sappy I think this will appeal to watchers of all ages, especially those who had someone in their life who left an everlasting trace.",10.0,Anonymous,Music
Movie about life not about teaching music,"This movie - while it says a lot about the profound effect music and music teachers can have upon people - has more to do with Holland's life as it relates to those with whom he's interacted. I don't discount the need for the music profession to need a movie to stand up for it. In fact, those who haven't had experience with this area of education may find the movie enables them to relate to the meaning music has played in others' lives.However, I encourage all who read this post to investigate the possibility that a modern movie can speak to the magic of life itself, and the meaning thereof. I won't give away the story, but I think all who watch with this perspective will find the movie more deep than at first glance. As the John Lennon quote (used for a tag line) says: ""Life is what happens to you while you're busy making other plans""",10.0,Anonymous,Music
For People Who Love Music,"Mr. Holland's Opus is very entertaining movie to watch.  This movie is perfect for people who enjoy music and love to perform it.  Richard Dreyfus is perfect in the lead role as Mr. Glenn Holland (he was nominated Best Actor), a music composer who captures the hearts of all his students in a 30 year span.  Though Lengthy, a wonderful movie to watch for the whole family!!!",10.0,Anonymous,Music
"Brainless, and therefore unemotional","Our society seems to care much more about sport than about music.  Compare the relative prestige of Mr. Dreyfuss and the football coach.  Hell will freeze over before the latter will be forced to suffer the indignities of the former.  But `Mr. Holland's Opus' is just one more indignity - yet another illustration of our lack of respect towards music.Mr. Holland's opus - titled `American Symphony', as if no American had ever written a symphony before - is a bare two minutes long.  It's also twaddle. Holland has reinforced an ordinary, unchallenging tune with schlocky drum beat as if he's afraid we won't be able to tell where the bar lines fall without help.  THIS is what he's been working on all his life?  Ten minutes, MINIMUM, is what we should have had to sit through - ten minutes of GOOD music - if the film was going to be at all serious about paying music the kind of respect we pay sport.It's for this reason we're glad that Mr. Holland gives up his pipe-dream of being a professional composer and in favour of a profession where he might actually do some good; the trouble is, he's not a very good teacher, either. Yes, people are inspired by him, but that's because the script is rigged. Observe:(1)  As his music reveals he has no quality control.  His supposedly enlightened appreciation of the Beatles, for instance, carries no weight at all, since he's one of those tiresome people who like everything.(2)  He's forever having stupid ideas.  He gives a concert for the deaf - BEFORE political correctness of this kind was fashionable enough to give him some kind of an excuse.  He wastes public money on a ludicrous screen of flashing coloured light bulbs that's meant to give deaf people some idea what they're missing ... I mean, really.(3)  He confuses Stravinsky with Shostakovich.(4)  He gives absurd - nay, incomprehensible - advice to students, asking a clarinettist to imagine a sunset and then `play the sunset'.  I can imagine the composer bounding into the room and bellowing, `I wrote a SONATA, not a damned sunset.'The entire movie is just a re-statement of the old chestnut about music being an expression of emotion.  Well, that's NOT what music is.  Music is an intellectual art.  Even the `simple' delight we take in a good tune - not that the film provides us with very many of those - is an intellectual pleasure.  And here's the rub: because we are never called upon to use our brains, because the film never shows us the complicated mechanics of REAL musical instruction or music, we can't understand Mr. Holland's emotional involvement to his craft, either.",3.0,Anonymous,Music
Good movie about dreams,"Okay, I know this movie goes off the sentimentality, sappy, manipulation chart, and I should be ashamed to be a big 51 year old man fighting the tears when I watch it by myself on my big screen TV down in the basement, but -- well, sue me -- I like this movie.  As someone once said, what is happiness but your dreams?  Those of us who are a little older may reflect on the unrealized dreams of our youth, but although some of those dreams went unrealized, some of life's events still turned out to be a lot richer than we would have ever expected.  The look on Glenne Headley's Iris as she comes to grips with who ""Rowena"" is (see the movie and remember her look) gave me chills.  When Glenn Holland later says ""I love you"" and she says ""I know"" -- now that's a realized dream that beats being on stage at Carnegie Hall.  Relax, don't be too critical and enjoy.  I give it an 8.9 out of 10.",,Anonymous,Music
An excellent movie,"This is a film you can watch several times over. It covers thirty years in the life of Mr. Holland, a musician who turns to teaching in a high school in 1965, to give himself time to compose. But of course the teaching takes over.RIchard Dreyfus does a great job portraying a man who loves music, and learns that he loves teaching, as well. William H. Macy is perfect as the vice-principal we all knew and could not stand. The rest of the cast, and the music, is very enjoyable. A nice ending.The film is long, and takes its time developing the characters and the times. Impatient types may get fidgety. There are many good scenes reflecting '65, '75, '85 and '95 in high schools. Including the budget crunch in our schools and the cut of arts and music programs.",10.0,Anonymous,Music
"Riveting ""Over the top"" tear-jerking formula.","How many ""teachers save our youth"" movies can you watch? ""To Sir with Love"", Blackboard Jungle"", ""Saving Forester"", and so on and so on. Since you ask, At least one more time.Mr. Holland wants to write music and believes that teaching will give him free time to compose. Slowly he gets sucked into the teaching environment and eventually, this becomes his focus to the exclusion of his deaf son. Will he see what he is doing? Will he care? Or maybe skip town with a talented singer (Rowena)?This well-paced film does not save hooligans but enriches an otherwise droll school experience and encourages more than just the basics.A twist on the standard formula is the emphasis from the beginning of Holland more than a student or two. We see how he learns from the school environment and incorporates his life into the life of the school. Richard Dreyfuss is the main character who may overshadow good acting by Olympia Dukakis and William H. Macy among others. There are several inspiring moments and some sobering moments.In all, it is worth the time and you will want to watch it again.",10.0,Anonymous,Music
"Dreyfuss, Tried And True","I felt that this Dreyfuss film offered quite a poignant look at the responsibility of a personal sacrifice and impact a teacher can have on his students beyond any classroom. It's not like the movie 'Stand and Deliver' at all, but it does remind me of 'It's a Wonderful Life'. Richard Dreyfuss gives the performance of his lifetime, as he did in his movies 'Always' and 'The Golden Girl'. In 'Mr. Holland's Opus', Dreyfuss plays the wily Glenn Holland who often is frustrated and breathes life into the character. The film, itself, seems to play Glenn as this flawed individual, especially in regards to his inappropriate relationship with a student named Rowena (actress Jean Louisa Kelly) and this of course leads to him not paying attention to his son Cole's social development. The movie is definitely worth watching, particularly during those moments of inspiration when Holland discovers his love of teaching.",9.0,Anonymous,Music
A Baby Boomer's Opus,"Mr. Holland's life is punctuated by the overtly boomer exponent of Vietnam, and John Lennon is constantly revisited like a worn out coda. Yet the producers try to instill some musical integrity by making a reference to John Coltrane, an irrelevant figure for most boomers and especially Mr. Holland as not one Coltrane song figures in this movie. But more importantly Elvis's death goes unmentioned, who arguably influenced rock and roll far more than the over-commercialized, chocolate box, Brit-pop of the Beatles or the period pieces of the anti-war activists of the late 60s and early 70s.Why is this? First, Elvis only spoke to the very earliest of the baby boomers as he himself actually preceded the boomers. By the 60s he was largely making movies and had been replaced by the British Invasion. Second, Elvis was intensely patriotic by most boomer standards having served his draft notice instead of burning the card. And yet I have a hard time distinguishing Mr. Holland from his boomer pupils.The biggest irony is Mr. Holland's performance of Lennon's ""Beautiful Boy"" which serves as a reconciliation with Cole. Not only does it raise serious questions about Mr. Holland's inspiration since he borrows someone else's material to express his deepest emotions, but Lennon released this song on his last album before his death which he wrote for his son, Sean, not the estranged Julian. And juxtaposed to this is Julian Lennon's performance of ""Cole's Song"" which also raises more questions than it answers.Thus, it is easy to see that Mr. Holland and his students are merely archetypes for John Lennon and his boomer fans. Plain and simple. Whatever that has to do with Beethoven, music in general, or inspirational teaching for that matter, I have no idea.",5.0,Anonymous,Music
Richard Dreyfuss' Best,"Richard Dreyfuss received an Oscar nomination in 1995 as the title character, a man who decides to teach so he will have more time to write music and conduct.  Of course he learns real quick that teaching is time-consuming and that he has no extra time at all.  The plan to teach for a few years turns into a career and the audience gets to experience all of the teacher's ups (a son being born, learning to love his work, creating a top-notch music and arts department) and downs (learning his son is deaf, learning of the death of one of his former students in Vietnam, and learning that his department's funding will likely be cut, forcing him to retire before he wants to).  ""Mr. Holland's Opus"" works because of a great performance by Dreyfuss.  He makes everyone else in the film better as well (Glenne Headly, Jay Thomas, Olympia Dukakis, William H. Macy, and Louisa Kelly).  The direction is strong and the screenplay is even stronger.  A great film.  4.5 out of 5 stars.",,Anonymous,Music
A masterpiece not only for the music...,"I have heard a lot about this movie when it was aired on TV last spring. 2 months ago I finally had the chance of watching it full and, it surpassed my expectations a LOT.Glenn Holland (Richard Dreyfuss) is a frustrated composer that decides to switch to teaching. So he gets assumed in Kennedy High School (the movie begins in 1965) and the first times he wants to leave the job but is forced because of his economical situation after the birth of his son Cole. His dedication, however, will manage to earn the sympathy of his students to the point that headmaster Helen Jacobs convinces him to make the school band. All goes well until the parade: Holland's wife notices that their 3-year old son has become deaf. So Glenn works also in the summer as a driving instructor and his way of relating with students will cost him some trouble in the family. Towards the end (in 1995) he is forced to go in early retiring because of lack of school money, but all his most affectionate students will organize a concert where they play the symphony he never managed to play on stage.I loved this movie for the following reasons. The story was great and covered also 30 years of American history told by the perspective of a normal guy. The acting is phenomenal. Richard Dreyfuss has never been better than in this movie, and for me he should have won the Academy Award back then, while the others are all good. But what I loved most is the soundtrack that was more than great... it was MARVELLOUS! Especially the symphony at the end made me feel on the verge of tears it was that good.Not a biopic based on a real person, but overall a nice movie covering 30 years of a person's life with his highs and lows where you feel really concerned for the characters. Not to be missed at all.",10.0,Anonymous,Music
"Love a teacher, it will change your life forever",Dreyfuss shines as music teacher Glenn Holland who after forced retirement due school budget cuts is celebrated with a school auditorium full of former students each of which has been touched by him. We are the notes and melodies of your symphony.,8.0,Anonymous,Music
Just a good movie...,If you haven't seen this before it's well worth watching. I wasn't expecting much when I sat down to watch it and man was I surprised. Just a solid solid movie...,9.0,Anonymous,Music
Heart-warming but flawed,"This is a lovely film, designed successfully to bring tears to the eyes of everyone seeing it. The acting is superb all the way around. Dreyfuss is a wonder. But there are quite a few historical flaws (see the goof section on this film) and mistakes. The lack of synchronization between the musicians and the music is maddening. The caliber of playing is far too high for the age-level of the players in the later stages of the film. And the absolutely stunning Jean Louisa Kelly was too old and too good to be a high school student. (She had recently graduated from Columbia University.) The film is also too long. A treacly bit about a black student who lacked rhythm and then died in Vietnam could easily have been skipped. By the way, at the funeral, the parents of the young man are shown in mourning. But sitting next to them, ostensibly a relative, is a young woman who is smiling during both shots of the family. That's the kind of carelessness that marred this otherwise fine film. One more thing: teachers will know that it isn't that easy to win the hearts and minds of young people. Mr. Holland as an educator must have doing things off camera.",8.0,Anonymous,Music
"Another terrible, poorly crafted film that won the Oscar","If you like intelligent, well crafted, tightly plotted, powerfully acted dramas with sharp dialogue and a keen aesthetic sense, you'll hate this kind of half-baked mawkish pap.This film spans a period of thirty years. I kept waiting for the story to begin and develop, but it never did.  It just sort of skipped around, showing us scenes that had a forced emotional impact and never amounted to much.  Like reading a series of sentimental Hallmark cards with no substance behind them, no development that would make these moments seem real and authentic. I knew what I was ""supposed to"" feel, but the story didn't produce it.  The dialogue was weak and on the nose.  The movie got laughably improbable at times.",2.0,Anonymous,Music
Great Movie,This is one of the best movies I had ever seen. Not the usual Hollywood crap that you often get. The last scene where the character gets an ovation from the school after 30 years of service always gets to me. The music though kind of sucked. How the hell can he spend 3 decades and comes up with such a short piece of symphony? Still I will give it a 8.5/10.,,Anonymous,Music
One man's struggles with life,"This is one of my favorite movies of all times. As usual, Richard Dreyfuss is excellent in his portrayal of a gifted but frustrated musician. He gives up on his dreams for the drudgery of marriage and fatherhood. I think he would have been better off going for his dreams, rather than being pressed down by other people's little lives. Instead he became a role model for his students in the high school in which he taught, giving a few excellent guidance, which helped them out later in life. Great movie.",10.0,Anonymous,Music
Kelly steals the show!,"I did not think it was possible to steal a scene from Dreyfuss, but Jean Kelly did it! I see this film over and over for one reason: Jean Kelly""s heart rending offering of ""Someone to watch over me"". A triumph!",9.0,Anonymous,Music
"Everybody had a teacher like this, at one time.","I didn't see this movie until years after it came out. I was moved by the transformation Mr. Holland made during his time teaching, and the final realization he made of what was really important to him.I had teachers like this throughout school, and the fond memories of them came back while watching this movie. No matter how many times I watch it, I'm still touched by it.If you like this one, I'd recommend seeing ""The Emperor's club.""",9.0,Anonymous,Music
