title,content,rating,username,genres
Lots Of Harsh Reviews On MHO,"Many reviewers have blistered this movie, and I agree it contains too many cliches and is overly sentimental. But compared to the endless supply of Hollywood vapidity, this one isn't THAT bad. Mr. Holland is neither saint nor bad guy, but he clearly loves music and cares about his students. I understand that music is a very serious topic for many people including several reviewers who hated this film. But I think they miss the point; Mr. Holland is not a musical genius, he's a high school music teacher. And yes, his opus truly sucks balloons, and that's because Mr. Holland is a musical mediocrity. His dream of being a famous composer was delusional, a ridiculous pipe dream. But he Found his true calling in life as a decent teacher. That's the point of the movie.",7.0,Anonymous,Music
I can sympathize as a teacher!,"As an out-of-work teacher, I can see and understand Glenn Holland's desire to do more than just be remembered as a teacher but to create a piece of work. As an English teacher, I too aspire to break out the best novel to pull me out of my world. Teaching is hard and rewarding. It's not easy. Don't let anybody fool you otherwise. Richard Dreyfuss' performance as Glenn Holland is not only memorable but unforgettable one of his best roles. Glenne Headly is terrific as his wife. He has a fantastic supporting cast like Olympia Dukakis, William H. Macy, Jay Thomas, Alicia Witt, and others to support the film. The film is kind of a downer about a man who has spent thirty years of his life as a teacher in a small town. I was troubled by the fact that he and his wife stopped having children after Cole was born. I thought the deafness was to create friction between the musical father and his deaf son. Still, it's a good film. You'll cry a little.",7.0,Anonymous,Music
Oh for the love of crumbcake...,"So many people have complained about the Gertrude Lang character (Alicia Witt), Holland's interaction with her, and the purpose of the character, and I am simply amazed at the hostility.1) ""Playing the sunset"" was Holland's way of getting Gertrude to relax so she could play the notes fluidly. They both knew that she didn't sound professional, and wasn't going to. The idea was to get her just above the level of making a fool of herself as she did the first time he called on her in class. Then she could, and did, perform in the band without dragging down the whole ensemble.2) Her goal was not to be a professional musician. Did no one else hear her speech about ""I just wanted to be good at *something*""? She listed all the fabulous achievements of her parents and siblings, and concluded, ""I'm the only one who's..."" The missing word would have been ""useless"" or ""worthless"". Or ""a failure"". Thirty years later she's the governor (not the mayor!), because in 1966, Holland helped her gain confidence for the first time.3) She wasn't ""wasting"" Holland's efforts by going into politics. Art, music and theater education don't exist solely to create professional artists, musicians and actors. They also exist to give young people an opportunity for change and growth, even if they never use a paintbrush again.I liked that plot twist. Almost every high school has an alumnus who has achieved something in art or entertainment, but a lot of people sell one painting or appear in one film and become a hero to their home town. But there are only fifty states, and it takes an extraordinary amount of drive to become governor of one of them. It's unlikely that she would have taken that first step towards empowerment without Holland.",,Anonymous,Music
"Sweet, but boring. Disney style kind of movie, with no real drama whatsoever. Too many stereotypical characters in a row are tedious to watch after a while. Nice ish...","This movie follows music teacher Richard Dreyfuss teach music to American kids from the sixties to the nineties. Sweet story, but lacking in any kind of real drama, because of it's Disney kind of style of direction, meaning every plot turn is neatly drawn between the politically correct lines, there are no surprises, nobody gets offended and it ends up being a quite boring picture to watch, that lasts a whopping 2 and half hours. 45 minutes too long.Still a sweet picture, maybe best recommended for families with young kids who want to become a musician, because the spirit of this movie is an uplifting positive one, that anyone can find joy in playing music if their heart is in it...",6.0,Anonymous,Music
"Excellent film, with even better music","Richard Dreyfuss is outstanding (as is the whole cast) in this thoroughly enjoyable film.  I really liked it the first time, but with repeated viewings, I'd say that this film got even better.  It's a little predictable, but so what?  For me, it was impossible not to care about these characters, and the ending was the perfect heartwarming note to go out on. It was rather funny as well, but my favourite thing about this movie was the music.  It seems only fitting, considering the importance of music to this film, that it would have a great number of songs, but I was astonished by how much I LOVED the music in this movie.  All-in-all, this was a completely satisfying film, and I would call it a must-see.",10.0,Anonymous,Music
Taking a bypass from your dreams and finding your true calling,"A composer (Richard Dreyfuss) puts his lofty ambitions on hold to become a high school music teacher in Portland, Oregon, from 1965-1995. Glenne Headly plays his wife, Jay Thomas the coach, Olympia Dukakis the principal and William H. Macy the irritating vice principal.""Mr. Holland's Opus"" (1995) is a good school-oriented drama that's episodic in nature since it spans 30 years. The first 40 minutes were decent, but I was wondering if the film would be able to absorb me into its story, especially considering its considerable length. It did, particularly the episodes concerning Terrence Howard (playing Louis Russ) and angelic Jean Louisa Kelly (Rowena).The movie's kind of a meshing of ""Dead Poets Society"" (1989) crossed with ""Forrest Gump"" (1994), although not great like either of those flicks. But it's a solid drama. A 19 year-old Alicia Witt is on hand as one of the students in the first act.The film runs 2 hours, 23 minutes and was shot in Portland, Oregon, and nearby Marylhurst.GRADE: B",7.0,Anonymous,Music
Richard Dreyfuss is good in all stages of the different seasons of the life of Mr. Holland.,"The writing of this movie by Patrick Sheane Duncan (Nick of Time), nominated for an Oscar and Golden Globe Awards, is one of the best stories that Hollywood ever put on the screen. The sensitivity and perception of the Director Stephen Herek (101 Dalmatians) adds a special touch to the story.Richard Dreyfuss (The Goodbye Girl, The Competition, The American President) was  nominated for an Oscar and Golden Globe for this role, which is my view one of his best performances. He is good in all stages of the different seasons of the life of Mr. Holland.  I seldom cry while watching a movie,  but when Mr. Holland enters the school auditorium with grey hair and the entire school is applauding when he retires, it makes me cry. I cry every time I watch it,  and I can also cry every time I bring it to mind. If I ever get a part where I have to cry all I have to do is to bring back that memory back!  That moment is a combination of my mother a music teacher and my dad aging. There is no greater love than to lay your life for another... When I graduated from college I wrote a letter thanking my parents for the rainy days they had to go to work,  and for all the sacrifices they made for me and left it on top of the dining room table so they could find when I was not around.  Needless to say that the entire family cried. That is what that scene means to me. I do not see Mr. Holland as a frustrated composer, he was just frustrated because he had other commitments that did not give him the time to compose. Glenne Headly did a great job playing Iris Holland. She has appeared in ER recently. Olympia Dukakis (Steel Magnolias) plays  Principal Jacobs. It is beautiful when close to her retirement she gives Mr. Holland a gift.  Jean Louisa Kell (The Day Lincoln Was Shot) is Rowena Morgan who steals the show because she sings beautifully. William H. Macy, (Fargo) plays Vice Principal Wolters who goes insane when he listens popular music coming from Mr. Holland's classroom. Poor Gertrude Lang,  Alicia Witt (""Cybill"") is trying so hard to get the technique that she forgets about her feelings. I love when she finally gets to feel the piece and lets herself go.Then when she comes back as grown up is very touching. A music teacher having a deaf child is ironic. Mr. Holland  teaching the kids about Beethoven is marvelous!  I love when Cole (Anthony Natale (II)), comes back as an adult and participates in the celebration of his dad's retirement, and also because he himself is going to teach at the school for the deaf in Washington DC. This movie struck a cord with me because of the music and because of all the elements that were brought into movie and story. I would give it a10 + if I could. It is one of my favorite dramas! I am not much of a drama person, I prefer comedy, but this is a very special drama.",10.0,Anonymous,Music
Life is what happens while you're busy making plans,"The make-up department does a splendid job in ageing Richard Dreyfuss in Stepehen Herek's film about an aspiring composer turned music teacher who finds his vocation over thirty years. It's a good performance from Dreyfuss as well, and the movie also benefits from a reliably creepy turn from William Macy as Dreyfusss' boss. In fact, as a portrait of a life set against a changing political, and musical, landscape, showing how (in the words of a song that features in the plot), ""life is what happens while we're busy making plans"", it reminded me of the epic BBC drama series, 'Our Friends in the North'. But it lacks the deeper engagement of that series with the specifics of the times it portrays, and at times seems a little trite as a result. Dreyfuss was Oscar-nominated for his role and this is definitely the sort of film that gets considered at these awards: earnest, gently liberal, ultimately upbeat and essentially unthreatening. And you can take that as condemnation or commendation, as you will; but I enjoyed it.",7.0,Anonymous,Music
How I wish I had my own Mr. Holland,"What a wonderful movie. I just watched it and am in awe of Richard Dreyfuss' amazing acting. Only being 15 but an avid music lover myself, I sat there wishing I had a teacher like Mr. Holland that inspired me like so many of the students in the movie, that made learning fun by connecting with the students, by doing everything Mr. Holland did. The stories of the students were real and believable. I connected with the girl that played the clarinet, Gertrude Lang, because sometimes I even feel that I'm never good at anything.Every person of every age can appreciate and love this movie. At the end, when Mr. Holland's goodbye party was discovered in the gym and he took the stage, I was crying.What a wonderful movie. History-wise, music-wise, and story-wise.",10.0,Anonymous,Music
story of our lives,"Yeah yeah, I know that it is overtly sentimental and the kind of film that you feel embarrassed to admit that you liked but what the heck? I think sometimes it's good to drop your guards, just be yourself and enjoy whatever it is even if it means wetting a couple of tissues. But having said this, I think the sentiments shown in the movie are quite genuine and at least I didn't feel that I was watching a mush.I have always felt that true teachers, the ones that really inspire you, could be counted on your fingers of your left hand. Richard Dreyfuss plays one such music teacher who would not hesitate to play rock n roll in a class of classical music, if it helps his students to understand and appreciate music better. Richard Dreyfuss is absolutely convincing in this role of Mr. Holland that spans 30 years of his career.Actually Mr. Holland is a composer who has taken up teaching just to pay his bills. He wants to be rich and famous and has been working on a symphony that would help him achieve that but that's not how it turns out to be. He is not rich and not famous, certainly not outside his small community. Is he a failure? The story of our lives (at least most of us).",7.0,Anonymous,Music
"""Life is what happens when you're making other plans""","This is a line of the Beatles' song that Mr. Holland sings to his son, Cole, at a concert. I've seen this movie plenty of times, but for the first time, I noticed just how well this line resonates in this movie. In fact, this line is the basis for the movie, and could stand in for the whole movie in a pinch- except that we would be missing out on one of the most moving and inspirational films to come out of Hollywood in the past few years.Mr. Holland's Opus is the story of a man who loves music, who practically lives and breathes music. We see at the beginning of the film, and throughout the rest of it, a man who is most passionate when he is within music. When his wife informs him that she is pregnant, he likens the feeling to falling in love with John Coltrane's music. When a student complains to him that he knows everything there is to know about music, Mr. Holland responds by reminding him that the name of his class is Music Appreciation and explaining forcefully that it doesn't matter how much you know about music if you don't appreciate it.The movie takes Mr. Holland through three decades- from the '60s to the mid-'90s. In the spirit of nostalgia films like Forrest Gump, we are guided through the decades by vignettes of archive footage depicting scenes such as Nixon announcing his resignation, Gerald Ford tripping down the stairs, and even good old Frankenfurter representing the sexual revolution. As a piece of nostalgia for those times and the days of high school, Mr. Holland's Opus works great. As a chronicle of a man's life and the impact he has on others, it works even better.This film could have turned into cheap schmaltz, but through its cast and a story that reaches wonderful poignancy and honesty at times, it manages to represent something so much more than that. Richard Dreyfuss, always a natural actor, is perfectly real and moving as Glenn Holland. I can't describe his performance in words, simply because it deserves to be seen more than just written about. And even though this is basically Dreyfuss's movie, the supporting cast makes an impression as well. Glenne Headly, as Mr. Holland's wife, shows tremendous resilience and emotion as the mother of a disabled child. When she explodes at her husband because of his lack of understanding, you explode with her, because we believe every word she is saying.I don't know if movies can change lives. I think some have the potential to. I know there are movies that can inspire their audiences to be better people- It's a Wonderful Life is one; Casablanca is another. While Mr. Holland's Opus does not reach the quality that those two do (and who can blame it?), it has a similar and near equal impact, and that is definitely a compliment. And how perfect- a movie about a man who changes lives that can also change lives.",9.0,Anonymous,Music
The right formula...,"Covering 30 yrs of a person's life was always going to be hard, but this film manages it without interrupting the flow. Mr Holland, faced with everything to hold him back from completing his opus, more than impacts on his music appreciation class - from those who said they couldn't, to those who had to break free and try their hand at the city lights. I liked the subtle time changes with the cars and the aging characters. The Cole sub-plot was a little bit misplaced (although I can't see how else they could have done it) and overall the story was predictable, but it was an inspiring movie all the same.",6.0,Anonymous,Music
"Lighten Up, Folks.......","It's a MOVIE!  I'm reading comments so vastly polarized to one extreme or another so as not to be believed.Okay, I am a musician.  I've been one on a professional level for over ten years, both as a writer and performer.  And I LOVED this movie (apologies to all those pretentious 'serious' musicians out there).  I enjoyed my theatrical viewing and I have watched my DVD several times.Is MR. HOLLAND'S OPUS musically accurate?  No, of course not, no more so than STAR TREK paying attention to factual science and the laws of physics. But for the most part, nobody other than most of us ego-driven, high horse bound musician types will ever know it.Designed to have a broad appeal outside the aforementioned musically inclined crowd?  Yes, but then so is nearly every movie to come out of Hollywood.  It has to be palatable to a certain degree, and I believe that the much maligned ""Play the sunset"" scene is far more entertaining than having Mr. Holland give us lengthy exposition on the proper articulation and technique that goes into playing a given instrument.And if I hear one more poster scream about Mr. Holland's 'opus' only being ten minutes long (the ""It took him a lifetime to write THIS?"" mantra) I think I'll scream.  Did it ever occur to anybody that what we heard was only a small part of a much larger work?  Most classical and semi-classical pieces occur in (get ready) MOVEMENTS!  It's entirely possible that we only heard the prologue to a much larger piece.  Think outside the box, people.As for the quality of the piece itself, I found it to be acceptable, if not the most dynamic piece of work I've ever heard.  But seeing as how we had been hearing snippets of this piece THROUGHOUT THE MOVIE, I can't say that I was so overwhelmingly let down as some of our more 'educated and refined' musician types that have posted here.Sure, there were some flaws.  Ms. Headly is not the greatest actress in the world, and beside Dreyfuss she's downright embarrassing.  William Macy's character is so cliched that it warrants no further discussion.  The whole subplot with Rowena and her romantic interest in Mr. Holland ran about ten minutes too long.  And the ending bit where the arts funding gets cut seemed a little too political.But overall, a great film, surely one of Dreyfuss' best, and one of my favorite films.I'm a musician.  And I liked it.  So sue me....",,Anonymous,Music
The Prime of Mr. Glenn Holland!,"Mr. Holland's Opus (MHO) is yet another entry in the canon of Hollywood films that deal with a gifted and dedicated teacher who by his example of decency, inspiration and personal character substantially improves the lives of his students. While Goodbye Mr. Chips is probably the best known of these films, Cheers for Miss Bishop and Good Morning, Miss .Dove also come to mind.MHO differs from the other mentioned movies because it includes the subordinate plot element of how a man whose world encompasses the sound of music must also cope with the challenge of raising a son who is deaf. The situation is rich in irony.Richard Dreyfuss leads a splendid cast in this old fashioned sentimental tale. His journey spans several decades. In the end---Mr. Holland comes to realize that the path he chose to teach others about the wonders of great music rather than attempting to create it himself--was the best road he could have taken. In this respect, he is not unlike the James Stewart character in It's a Wonderful Life---who came to know that helping to improve the lot of others is one of life's most lofty and fulfilling achievements---far more satisfying than acquiring material success.It is not now generally known that in the 2001-2002 season, Richard Dreyfuss appeared in his first television series--The Education of Max Bickford. In it, Dreyfuss plays an inspiring college educator who also has to deal with several important personal problems. While this series was not commercially successful, it received considerable critical acclaim. Could the charismatic role of Glenn Holland have provided either the motivation or inspiration for Richard Dreyfuss to venture once more into the world of striving to lead students into a better life through educating their minds?",7.0,Anonymous,Music
Richard Dreyfuss' Opus,"I first saw this movie on video in late 1996, I was 19 years old and I thought that I would hate it.  What kind of sappy, sentimental crap was this?  Why should I like it?  Well, I'll tell you.  Its because this is the story of a man's life work and how he made a difference in the lives of those people around him.  I think that some day many years from now we would all like to look back and say that we made the difference in the life of even one person.  Dreyfuss gives us the performance of a lifetime as the titular Mr. Holland.  Watching him transform from a frustrated, half-hearted, hot-headed young teacher to a man of wisdom, compassion and caring is a wonderous sight to behold.  His battles with his hearing impaired son pull at your very heart strings.  Mr. Holland is a man we all know and love, he might not have been your music teacher but he/she was someone special in your life that made a difference in your education.  I was lucky enough to have a multitude of great teachers just like Mr. Holland that changed my life and made me appreciate the great place a teacher holds in our society today.  Mr. Holland's Opus might be silly and sentimental but I can't help but love this movie.  I'm not ashamed to say that I cry big crocodile tears everytime I watch it.  This movie hits you right where it feels good, it makes you proud to have shared this experience.  You were there to watch him grow and become the stuff of legend.  You were there for Mr. Hollands Opus, no, you were there for Richard Dreyfuss' Opus.  Because in the end the real opus is not his music but his effect on the lives of his students.  Now thats beautiful music.",10.0,Anonymous,Music
Mr. Holland's Opus,"Dreyfuss is majestic as a music teacher who gives his students a deep sense of hope in this long winded film that runs out of ways to make this character lovable. Dreyfuss keeps you in it, but the story doesn't. Dukakis gives a wonderful turn as the principal, while Headley is miscast as Dreyfuss' wife. Dreyfuss was Oscar nominated for his performance.",7.0,Anonymous,Music
One of my all time favorites,"Not only are the performances moving and compelling, but the story just grabs and won't let go. Even knowing what's coming, after seeing the movie many times, the ending still brings me to tears.Dreyfuss is so totally believable. He captures everything from the arrogance of the younger man to the frustration and fatigue of the older.This movie works on so many levels, from the messages about the educational system to the family interactions and challenges, to the romantic bits.An absolute must-see!",10.0,Anonymous,Music
"Fine, touching but predictable","I liked the movie. I liked Richard Dreyfuss as a main hero, Mr. Holland, a Music Appreciation Class teacher. The movie is very true to the point when it speaks about teacher / class relations. I am a University teacher myself, and I surely do know what it is like to get a tight connection to the students' hearts, without losing either your integrity or your authority. I felt what Holland felt, I understood what he did wrong and what he did best. All his ups and downs, all his misgivings, wrong ideas for the class, bad relations with his hearing-impaired son, tough relations with the local educational authorities - everything is shown admirably well. Also, and it should be pointed out, the movie is especially good at the scope. The 30 years of the US history are shown briefly but very vividly and really well. What is really weak is the sheer predictability. Many Hollywood films are made this way - Good/Bad, Up/Down, White/Black. I mean, I could easily foretell when in the next scene Holland will have a problem or its graceful solution. Also, the grand finale is too sweet. I understand, Hollywood dictates the rules, so the serious film must have a refreshing, sweet final. But it was all too much. Too sweetish, too bombastic. Notwithstanding all that, in general, the movie is one of the few that really shows what teaching job is.",7.0,Anonymous,Music
Inspiring,Richard Dreyfus plays a music teacher who raises a hearing impaired son in this disney production that hits all the right notes. (pun intended) very well done and sends a good message. A good family film 7 of 10,7.0,Anonymous,Music
Blissfully wonderful,"Richard Dreyfus should've won the Oscar nomination, he did a riveting job! The storytelling with everything is so good between the teaching and family. Stephen Herek directed such a charming musical delight that I should've seen sooner. Mr. Holland's Opus was much more than I expected, should've had at least 5 nominations instead of one! The sound is magical throughout, pleasant surprise of entertainment that I'd recommend to anyone.",10.0,Anonymous,Music
