title,content,rating,username,genres
stunningly vacuous,"The original wasn't much, but Soderbergh's remake makes that movie look like The Seven Samurai. 100-plus minutes of ultracool posturing, forced humor, and stylishly lazy diction (Brad Pitt can barely talk under the best of circumstances, and in this movie he chows down almost every time he's on screen). For those who enjoy watching dangerously ""aging"" sex-goddesses get put down, there's also The Protracted Humiliation of Julia Roberts thrown in for bad measure. (The character is so passive she barely exists, and the actress is lit to look like Ichabod Crane in drag.) A shameful piece of work by Soderbergh.",,Anonymous,Crime
Ocean's Eleven - Review,"Oh my, what an entertaining movie. Like, so chilled and fun, nobody's rushing anything and you just sit back and enjoy the heist, which is so complicated, yet so easy and I loved about it is that the writer has always some nice surprise for you. When you think it's over, nope, it isn't and especially the screenplay is the best part of the movie. I feel like all the actor were a bit drunk or something, because they're so chill in every goddamn situation, but that's the best thing about it, or the whole crew are only a bunch of phlegmatics, who just going to steal some things and have fun - fantastic stuff, love it. I heard that the second and third movies aren't that good so I will not watch them, because why though, by this one, oh man, this one was a ton of fun. Soderbergh is a nice director and I liked how he work with the characters, felt like some Avenger movie when we cut back and forth to these teams and see, how are they doing. A very fine movie.",8.0,Anonymous,Crime
Meh,It was alright. The main thing I remember is Don Cheadle doing the worst british accent I've ever heard.,6.0,Anonymous,Crime
Slick Movie!,Slick movie. Compelling plot and acting that makes you hold your breath as every second passes. With a killer soundtrack it makes it a must see for any spy lover.,8.0,Anonymous,Crime
"A laid-back, bait-and-switch filled fair-ride.","Clooney and company are a joy to watch, their gleeful chemistry almost oozing from the screen, and where the film takes inspiration from seminal works like 'The Sting (1973)' is in its frequent desire to bait-and-switch the audience, to keep them in the dark and gleefully surprise them at every turn. It's this aspect and this fun approach to 'Ocean's Eleven (2001)' that makes watching the film so entertaining, like an untaxing puzzle to be unravelled as it goes along, and its easy-going attitude makes for a laid-back watch with some twists to keep you on your toes and great character writing to keep a smile on your face. 7/10",7.0,Anonymous,Crime
Just as it ought to be,"Steven Soderbergh's 2001 remake of the 1960 Rat Pack pseudo-classic ""Ocean's Eleven"" spins the tale of Danny Ocean, a con man ten feet out of prison brewing his best scheme yet. He gathers up ten specifically chosen accomplices to pull off a very profitable, perfect crime that involves simultaneously ripping off three major Las Vegas casinos. George Clooney heads up a film that is busting at the seams with familiar faces. This is modern-day heist movie-making at its sharpest and most stylish, written by the screenwriter of ""Matchstick Men"" and directed by the prolific filmmaker behind the likes of ""Out of Sight"". It's one of those highly entertaining movies with so many intricate pieces flying through the air that predictably fall into place by the end. ""Ocean's Eleven"" is just great, satisfying fun!",8.0,Anonymous,Crime
"Clever, cool, and comedic.","Danny Ocean (George Clooney) is an ex-convict just released from prison, whose first order of business is to get his buddy Robert ""Rusty"" Ryan (Brad Pitt) and an assortment of other characters together to rob three Las Vegas casinos owned by Terry Benedict (Andy Garcia). These characters are great and we love seeing them talk and rob. All the actors do a great job is animating the personalities of their respective characters. Danny is the charming mastermind, Rusty is the sarcastic right hand man, and Linus Caldwell (Matt Damon) is the innocent newcomer. It's a great caper flick and it's really hard not to like it. The whole film is a load of fun. If you haven't seen it yet, go check it out.",8.0,Anonymous,Crime
Let Soderbergh entertain you,"If you want entertainment -- here's where you'll find it! I've never been much of a heist flick fan -- Ocean's Eleven, though, I like. In fact, I like it a lot. The cast is great. Clooney, Pitt, Cheadle, and Damon are all quite brilliant, but so is the rest of the cast as well. Soderbergh seems incapable of making a bad or uninteresting movie. I look forward to his next film! (7/10)",7.0,Anonymous,Crime
What a mess?,"Forget everything about the movie.. The cast, the production, the scenerio. And answer me, if you are a powerful mafia and you have a beatifull woman and 160 million $ and then one day a loser comes and takes everything from you what would you gonna do? To hire 2 idiots to follow them?... man i'm gonna kill all living creatures who is next with him. When i watched the original movie i surprised because it was much brilliant than this mess. i think all the actors and actresses did their worst job. bad jokes are another boring things. watch the ""HEAT"" movie after watching this movie, then you will understand my words. 0/5",1.0,Anonymous,Crime
Hits the jackpot!,"By C.J. CauleyThe city of Newport, Kentucky played host to the very first theater screening of the 2001 version of Ocean's Eleven.  While Frank Sinatra starred in the film's predecessor in 1960, Kentucky native, George Clooney, takes the helm this time around.  The premiere was a red carpet event with Johnny Bench, Marty Brennaman and other local Cincinnati celebrities basking in the limelight.  The highlight of the event was the hosts, George's parents, Nick and Nina Clooney.  Nick Clooney is one of the most recognizable celebrities in Cincinnati, having been a newscaster there for many years and currently hosting his own radio show.  Nina quipped ""I used to be known as Nick Clooney's wife, now I'm known as George Clooney's mom."" Not a bad gig if you can get it.  The couple were absolutely beaming about their son's latest premiere and I soon found out it was with good reason.When his elders stepped out of the theater to prepare for their trip to Los Angeles for the official premiere, the younger Clooney stepped on screen as Danny Ocean.  Recently paroled after four years in prison, Ocean sets out to gather up some old partners in crime to pull off the perfect heist: rob a vault that contains over $160 million from three different casinos. Hustlers, con men and pickpockets come together with experts in surveillance, electronics and explosives.  At the center of the conspiracy are Ocean and his best friend, Dusty Ryan, played by Brad Pitt.  All together, they add up to eleven which was about six too many.  When you have that many people in that short amount of time you don't really get a chance to know them or care about them which is unfortunate because they are quite the group of misfits.  The criminals included everyone from relative newcomers Casey Affleck and Scott Caan to phenomenal talent like Matt Damon, Don Cheadle and the legendary Carl Reiner.Andy Garcia plays Harry Benedict, also known as the bad guy.  One of the richest men in Las Vegas, he owns the three casinos in question.  To top it all off, he is dating Ocean's ex-wife, Tess, played by Julia Roberts. Clooney is out to win her back and put Benedict in his place in the process. Roberts was believable as Clooney's love interest but he was not believable as hers.  While she made goo-goo eyes at him, he stared at her more like a little sister.  It was the only part of Clooney's performance that I didn't buy.  Garcia, however, played the fuming, jealous lover to a tee.  The resident pickpocket, Linus Caldwell, played by Damon, was the newest and seemingly untrusted member of the group.  This was touched on only briefly, however, because the two hour time limit was not enough to expound on this part of the story.   I also found it odd that 37-year-old Pitt referred to 31-year-old Damon as the ""kid.""  The real kids were the Malloy twins played by Affleck and Caan.  While they also offered some comedy relief, it was the cast's two older entries who turned out to be it's best.  Elliot Gould shines as the financial backer of this band of would-be thieves and Carl Reiner is fantastic as the Saul Bloom, the grandfather of the group.Pitt gave his usual two-dimensional performance but the chemistry he had with Clooney made up for a lot of that.  They played off each other with excellent comedic timing.  Clooney gave an excellent performance even though it wasn't much of a stretch from previous roles like that in the Peacemaker or Out of Sight.  There will be no Oscar nominations for acting in the future for Ocean's Eleven but the large ensemble cast will not leave you disappointed.  Their quick quips amuse throughout.  One scene between Damon and Bernie Mac and another with cameos by TV heartthrobs including Joshua Jackson and Topher Grace are highlights of the flick.  Unfortunately, Roberts is the only female in the cast, aside from a cameo by Holly Marie Combs as herself.  But, it was great to see that the current Ocean's Eleven is lacking the disgusting misogynist tone set by Sinatra and his rat pack friends in the 60s version.  Back then the women were 'dames,' they were an annoyance and worst of all, pushovers.  No such ridiculous stereotypes rear their ugly heads in this pleasantly updated version.  Despite the time restraints that restricted the storyline, Ocean's Eleven really hits the jackpot.",,Anonymous,Crime
Stylish and highly entertaining,"Ocean's Eleven (2001) is one of the more stylish and most elegantly filmed movies from its time. This film may well be the best of the franchise, in terms of overall plot, style, substance, and entertaining factor. Although Ocean's Thirteen is quite well made. All the actors play their roles well, lead by George Clooney as the title character, as well as Brad Pitt, Matt Damon and Andy Garcia. The pacing of the film is solid as everything appears to be there, and with a large cast, we are to see them all perform. Director Steven Soderbergh seemed to have fun making this movie. He shot this film very intimately often allowing the camera to stay close on the actors a tad longer than expected which lets their personas shine through their personalities draw you into the movie as much as the caper itself. It's not often you see a movie where the direction has as much wit and cleverness as the plot itself. All together, Ocean's Eleven makes no pretense to be something other than a clever heist movie.",8.0,Anonymous,Crime
luke-warm-hand Luke kinda thing,"This film was totally flat.  The plot was there, the acting tried hard, but in the end, it was a bunch of supposedly cool people trying too hard to act cool.  And it sucked.  Another clock-watcher.  7/10 For the cinematography and the music, and pieces of well-structured dialogue, though their execution was taxing, and the jokes were void.",7.0,Anonymous,Crime
Classic,"Breathtaking plot, great cast, one of the best movies I've ever seen.",9.0,Anonymous,Crime
"Is it a good heist movie? Yes. Is it the best heist movie? Eh, no. Is it the best heist movie for the 2000s? Maybe.","The issue is, I am watching this in 2022, and now there's been a lot of great heist movies and shows and hence have a lot to compare to. I don't want to drag this review on, it doesn't deserve it. To me, this was a fun watch and not as much a thriller as I expected. Yes, it isn't predictable and neither is it like every other movie but I guess it could be a lot more fun. I found Ocean's 8 more entertaining than this, but hey, that's just me. It's got some big stars, technical jargon and since I haven't watched the original, I can't join the whole 'Why a remake' conversation.This is a Sunday watch for me, no commitment, nothing heavy, and brings on a good nap.",7.0,Anonymous,Crime
pretty fun entertaining,"This review really covers all of them. Quickly it's a quirky, kind of funny thriller and, as my dad says, ""cop and robber"" movie"", only you are rooting for the robbers. George Clooney plays the leader and the whole ""Scooby Gang"" gets together to do some big heist or something and pulls it off against all odds. The cast in all of them is stellar. It's a tour d' force of good actors. Nothing about them really stands out and I don't really run out to see them, but they are always pretty fun entertaining, never a complete waste of time. I Particularly like Seth Green's roll I them. He is a comical genius. If you haven't seen them yet, rent them all.",6.0,Anonymous,Crime
Classic Heist Movie,"Finally got around to watching this, and I enjoyed it thoroughly. It took a while to get going, but when it did , I was hooked. I enjoyed the film's many twists and smart writing. I had forgotten about things that were set up early on that ended up paying off later. There were several moments where I found myself going ""Oh no. How are they going to get out of this one?"" Much like the vault the main characters try to rob in the film, it had many twists and turns. It was just an all-around good old fashioned heist movie though a bit dated. You can definitely tell by the pop culture references, lighting, fashion/hairstyles, and cinematography that this was made in 2001. But maybe it was cool at the time. I don't know. The banter between the main characters is witty. I'm excited to see what happens in the sequels and the reboot/sequel opening this week.
Grade: A- 9/10 4/5 stars",9.0,Anonymous,Crime
Tasty Treat That Leaves You Hungry,"After having seen this movie more than eight times (not by choice), I've come to realize that the original lukewarm reviews I read were correct: this film is not much better than mediocre. That's not to say that the film is terribleit's notor that you shouldn't watch ityou shouldbut rather that it has many flaws, some of them glaring.Ask most people why they saw the movie, and they'll say something like ""It has George Clooney and Brad Pitt in it,"" or ""It has Julia Roberts in it,"" or ""Stephen Soderbergh directed it."" Ocean's Eleven is a ""People"" magazine reader's dream come true. So many celebrities in one movie: what bliss! The point is that Ocean's Eleven is not meant to be strong on character or plot; it's meant to be strong on Star Power. In fact, it's surprising that there is a plot, such as it is. It follows the new Blockbuster code: Hot Bad Guys who are actually Good Guys want to steal money from crooked, mean Big Businessman; they make elaborate plans, use fancy equipment, and ultimatelybut we all know the ending. Soderbergh may court the strange, the offbeat, the underbelly of society, but he also knows that when making an action movie one should not deviate too much from the tried-and-true. He gives us what we want, and more.George Clooney and Brad Pitt as Danny Ocean and Rusty Ryan, respectively, are the most likable of the bunch. They have a rapport that either is natural, or was rehearsed so effectively and so well that it became natural. They're like Laurel and Hardy, only with stubble and expensive suits. They eat each other's lines, insult each other, show off in front of each otherin some ways they're a more compelling couple than Clooney and Roberts.Incidentally, Julia Roberts, apparently confusing Tess Ocean with Erin Brockovich, gives an intensity to her role of The Chick that is entirely inappropriate. This is an action movie, not a chance to win another Oscar. She delivers lines like she's chopping onions: short, quick, and full of force. Of course, her dramatic skill is unquestionable, but in this case a lighter touch would have been more fitting. I can understand her desire, if she had it, of wanting to give more weight to her role as Clooney's ex-wife and Andy Garcia's new girlfriend; it must be frustrating to be a piece of meat that men fight over. But she should have been more perceptive of the movie's genre and its requirements. In action movies, chicks should look hot and be tough; not much more is (usually) required.The fact is, we hardly ever think of Roberts, or any of the other Big Names, as anything but who they are off the set. Although Garcia calls Roberts ""Tess"" several times, somehow the name always rings false. The other cast members, being less famous, have the advantage of being able to play their characters more convincingly.This movie was a remake of another all-star movie made in 1960. (I've been unable to see more than snippets, and since I currently live out of the US I'm not able to rent it.) Most reviews refer to this previously made film, but the fact is that Soderbergh's Ocean's Eleven is its own entity. We should judge it not based on its predecessor, but on its own meritsunfortunately too few.When I first saw this movie, it was dubbed in Spanish, and I thought it was well made, well acted, and generally better than most action movies. (Of course, I was on a date at the time, so I wasn't scrutinizing every detail.) Upon subsequent viewing, however, this movie's imperfections only become more glaring. It's too bad. Although you won't think you've wasted two hours if you watch it for the first time, this movie is not one that you'll return to over and over againthat kind of film where each time you see it you discover more of the director's ingenuity, or the actors' skill, or the screenwriter's craft. This movie is good for a quick laugh and a thrill, but, like cake, it's not ultimately what will satisfy your hunger.",6.0,Anonymous,Crime
Great Movie,"Great Movie, the best of all Ocean's, the movie can really hold us without be annoying, it's a smart movie and many things happen when people are not waiting for. The cast was chosen very carefully, Clooney it's great in this movie on his character, he makes very well the Confident Leader and Damon do very well the untrained freshman. The movie really gives the people what they are waiting. Probably on the list of the Best of this type of movie.",8.0,Anonymous,Crime
