title,content,rating,username,genres
Join the crew!,"Ocean's Eleven greatest strength is its emersion of the audience into the midst of a story already in motion. The pacing isn't weighed down by exposition; instead, the viewer discovers important history and surprises simultaneously as the characters on screen. The absolutely brilliant cast is effortlessly charming, whose antics and charisma fuel the movie to be a wonderful ride from start to finish. You can't help but feel welcomed into Danny Ocean's crew. With amazing acting, storytelling, clever twists, and exceptional directing, Ocean's Eleven is a must-see and my favorite movie of all time. As a young teen who stood firmly in the grunge camp of wearing ripped jeans and rock 'n' roll t-shirts, Ocean's Eleven convinced me that every now and then... suits are cool too.Overall : My favorite movie of all time! A must-see!",10.0,Anonymous,Crime
Lots of fun,"I think we all knew that this movie wasn't going to be a ""Citizen Kane"" or provide some great social commentary, but it is a lot of fun and is a great way to spend two hours at the movies.  The characters are all likable, the dialogue is snappy and clever, and it just oozes ""cool"".  The only weak point in the movie to me was Julia Roberts' character, where she has weak chemistry with George Clooney (who is as cool as he's ever been), and there's no real reason given to why George's Danny Ocean character would be so devoted to her.  This movie is never boring and is FAR better than most of the dreck that Hollywood puts out.So, are you in or out?",10.0,Anonymous,Crime
"Girls drool, while guys wish","There are two reviews here:For the women: Prepare to drool. This is raw sexiness at its best. From Clooney to Reiner, there is something for all ages. The movie moves at a fast, engaging pace (though my back did inform me of it being 15 min too long), and keeps one guessing, as to when the perfect crime will go wrong, and the perfect men made to look ridiculous. The plot is not unique. Only the charm and class are. The casinos of Las Vegas look fresh, inviting and full of energy, and Andy Garcia seems to be the perfect owner.For the men: Wish, that it was this easy to be the one drooled at, and drool yourself. Sorry, but Julia Roberts just does not match up to the rest.Of all heist movies, this kept my attention longest, and for no other reason other than the raw star power. My recommendations, if for no other reason than to see how cool these guys can look.",8.0,Anonymous,Crime
"Exciting, intricate, yet not deep","I always love the feeling of a heist movie and ocean's eleven is the quintessential stereotype of one. The star-studded class provides excellent acting and the writing was interesting enough. My one gripe with the film is that besides the twist at the end with how they got the money out, the movie is highly predictable. Nevertheless, I did enjoy it and would watch it again many times with many different people.",8.0,Anonymous,Crime
Really good movie but...,"I haven't watched this movie for a long time and it is a great heist movie don't get me wrong but.... I think this is one of those movies that is fantastic when you watch it and see the twist for the first time. I guess it's not much different than watching a murder mystery, not much point in watching one of those again, cuz it's no fun when you know who dun it.Excellent cast, great acting all around. Even though this movie came out in 2001 it could be modern day as most of it takes place in or around a casino and they all look fairly the same like the inside of casinos are decorated all the same and don't really change - probably some science there to get our money. Anyway if you HAVEN'T watched this movie I would recommend it, one of the better heist movies out there.",7.0,Anonymous,Crime
Totally unforgettable heist caper,I watched oceans 11 film on my sky q today and I found the film good with George Clooney playing Danny ocean in the movie and I like the scene were Danny ocean bumps Into his ex wife played by Julia Roberts were he trys to get back with her and she rejects him In the Vegas Casino that scene was the best and Steven Soderberg did a lot of great directing and brilliant action scenes were Danny and his mob try to go and rob a casino and then they cause blackout over the Las Vegas strip that scene had positive vibes and it had great sound effects In fact he film and the ending was good because Danny go back to prison and I enjoyed it.,10.0,Anonymous,Crime
Forty Years On,"This is not a bad film  but neither is it particularly good. On the plus side, how pleasant to have a caper movie that doesn't involve guns, violence and multifarious `things exploding'. On the down side, however, if it is a caper then it really needs a bit more tension and suspense to engage our attention. The eleven crooks of the title are all OK guys (allowing that Don Cheadle obviously learnt his accent at the Dick Van Dyke School of Cockney). Wouldn't it have been so much more enjoyable if one of the eleven had been incompetent, or even better, a potential traitor in their midst? That really would have injected some tension. But the casino owner (Garcia) is not an OK guy so the outcome can be guessed without too much difficulty.Then it's all a matter of hi-tech skulduggery as the thieves plot to make their way into the casino vaults in an attempt to help themselves to a cool $160m. The plot has as many holes as a Swiss cheese. But who cares when the whole caper nearly grinds to a halt for want of a couple of AA batteries just after they've managed to black out the whole of Las Vegas.Many will see this film for no other reason than the star cast list  just like the original version of some 40 years ago. Most of the crew seem to be enjoying themselves and Elliot Gould steals every scene he's in. Julia Roberts wanders in and out, although quite why is anyone's guess. She looks lost and confused for much of the time. But then she does appear in the credits as `Introducing Julia Roberts' so maybe she's right to look perplexed by all that's going on around her.If you've nothing to better to do on a wet Wednesday in Wigan this would be a harmless and reasonably enjoyable way of whiling away a couple of hours. But if it's real excitement or suspense you're after don't bother. It ends on a worrying note  a potential sequel seems to be lined up. Let's hope it's another 40 years before it gets made. That way I, for one, won't give a damn, by then being in the great movie (rather than casino) vault in the sky.",6.0,Anonymous,Crime
Not Very Exciting.....,"Let me start off by saying, I did not like this movie 1 bit. It never got my interest, I never believed in the characters and I definitely didn't believe in the mission that they were trying to accomplish. This movie was very slow and boring. The ladies will probably enjoy this movie just from the actors in it such as Brad Pitt but the reality is the movie its self is a waste of time. I would like to share with you the best part of the movie; the best part is the credit's at the end of the movie. From the beginning until the credits, not much was happening as they organized a team to complete a mission (real exciting right?) wrong, a few old guys get together to do the impossible - no character was particular special or interesting, there just wasn't any substance to this movie.",4.0,Anonymous,Crime
good good movie,"i was very satisfied with this movie, i just went to see it opening day and expected just what i saw. george clooney did a great job, along with all the others. you should definitely see it, it kind of reminded me of Snatch in a way, since it did have some of that cast in it. it was great, you should see it. Liz",10.0,Anonymous,Crime
"Corny, but in a good way.","Although I would never rank this at the top of my favourite films list, there's no denying it's a fun watch with a fantastic cast and chemistry.The story in general can be a bit stop- start from time to time, but the cast keep this witty and stylish comedy entertaining enough to keep you in your seats.I would say Soderbergh has made better and more meaningful films in his career, but it is a great way to ease yourself into the works of Clooney, Pitt, Damon and the rest of the crew, as it's a simple enough plot to follow with enough story to keep you laughing and dare I say wanting a sequel(s).",7.0,Anonymous,Crime
What a Line Up,"I confess that i Have only seen this today for the first time and its 17 years old and i really liked it. It was through recently going to the cinema to see Oceans 8 that i thought it a good idea to see its humble beginnings all be it with an all male version. This film is about 11 guys carrying out the impossible, robbing 3 casinos simultaneously using clever wit, skilled technical work, Brut force and charisma.Well they pulled it off, there are some mini twists and some Humour along the way. Its just short of 2 hours and its just the right length, an hour to get to know those involved and see the plans coming about and the next 50 minutes to execute it, just perfect.Overall a great film and well executed, great all star cast and not too involved nor hard to hard to understand.",8.0,Anonymous,Crime
"Clooney and Soderbergh ""Steal"" Vegas Heist Film","""Ocean's Eleven"" is a uniquely Las Vegas movie. The lights, casinos, hotels, fountains, and televised boxing matches - all shot on location along the strip - will captivatingly resonate with anyone who has spent time in the Gambling Capital of the World.Sin City is inextricable from the film's plot as well. After being released from prison, Danny Ocean (George Clooney) plans a new heist to rob Vegas' three biggest casinos in a single hit. With the help of his former partner Rusty (Brad Pitt), Ocean puts together a team of eleven to infiltrate and empty the collective vault for the Bellagio, the Mirage, and the MGM Grand.The movie is an ensemble project if there ever was one. Today, the star-power would almost seem overwhelming as Don Cheadle, Bernie Mac, Elliot Gould, Casey Affleck, Carl Reiner and others join Clooney and Pitt for the heist. Matt Damon does not even show up until the film's near-thirty minute mark, playing no more than a tertiary protagonist to complete the titular eleven.Outside of the heist team, Andy Garcia plays the cold, calculated owner of the three casinos. Non-coincidentally, his character is romancing Ocean's ex-wife, played by Julia Roberts. This dynamic feels a little forced, but it effectively adds a hefty dose of humanity to Clooney's devious character.While all of the stars deliver quality performances throughout the film, Clooney undeniably steals the show. Danny Ocean is the textbook definition of a smooth criminal, and Clooney plays the part with such confidence and charm that we both empathize with him and feel his persuasive influence, even as he leads others into perilous situations.Based off of a 1960s movie of the same title and plot, ""Ocean's Eleven"" casts Clooney as a character originally portrayed by Frank Sinatra. Such shoes appear near-impossible to fill, but Clooney manages to fit them with seeming effortlessness. He makes the character his own, but doesn't do so by deviating from Sanatra's old-school masculine suaveness. Instead, he actually manages to polish these traits with added likability, refining the archetype for modern audiences.Star power aside, though, this movie does not take gutless shelter under its rock star cast. The reason why ""Ocean's"" succeeds while other ensemble films fail is because of its smart story. Although there's not enough time to get intimate with all eleven members of the team, no character lacks an identity. Meanwhile, the narrative is complex, suspenseful, and twisty - especially towards the end.Simultaneously, whatever the plot lacks, director Steven Soderbergh makes up for it in style. He clearly gets the best out of his cast, ensuring the characters retain good humor even in the diciest of circumstances. This is in large part thanks to the clever, perfectly timed editing from Stephen Mirrione, who won an Oscar for his pervious work with Soderbergh on ""Traffic.""Under the pseudonym Peter Andrews, Soderbergh also serves as cinematographer. He captures the lavishness of Vegas with the appropriate amount of glamour, but never loses a sense of reality. Once again, it is a Vegas that anyone who's been there can recognize, and the film itself plays like a high-stakes game of chance. Until the end, the audience never really knows who has the best hand; everyone wears their poker faces with a smile and the pot only grows up through the final minute.Like most movies with a major twist, ""Ocean's Eleven"" might not be as stunning the second time around. Nevertheless, it's a bona fide classic in the heist genre, and Soderbergh and Clooney shine so brightly that a rewatch, though not as impactful, could still be quite engaging.",7.0,Anonymous,Crime
A stylish remake of a 60's classic,"After directing heavy dramas like TRAFFIC (which won him an Oscar) and ERIN BROCKOVICH, Steven Soderbergh decided to lighten up a little with this delightful remake of the 1960 rat pack classic. George Clooney steps into Frank Sinatra's shoes as Danny Ocean, the ex-con who gets together with a large crew of cronies to rob three Las Vegas Casinos owned by a Las Vegas bigwig (Andy Garcia) who is now dating Danny's ex-wife (Julia Roberts). The screenplay is a little on the complex side and sometimes it's a little hard to keep track of what Danny and his crew are doing, but the film is so great to look at and the cast appears to be having so much fun, you really just let little plotting devices slide and just go with it. Clooney has never appeared so smooth and slick on screen and is backed by a great cast including Brad Pitt, Matt Damon, Bernie Mac, Don Cheadle, Casey Affleck, Scott Caan, Elliott Gould, and in a casting stroke of genius as a veteran con man, comic legend Carl Reiner. A slick and stylish crime caper that looks great and is wonderful mindless fun for a Saturday night movie rental.",8.0,Anonymous,Crime
Caper Movie.,"Basically this was a caper movie.  A bunch of professionals go against overwhelming odds to rob a impregnable target.  It wasn't bad.  The movie managed to keep me entertained throughout.  I found the 2 lead's, Clooney and Pitt, egos distasteful and the lead female role was terribly miscast. Julia Roberts was skinny and sullen and not at all the beautiful object of desire as referred to in the movie.  I found myself repeating ""Hey Collegen Man"" whenever she appeared on screen.  Don't you think something is wrong when you have to be told through the script that the person coming on screen is supposed to be beautiful.  Shouldn't the appearance of the actress say it.  Some of the female extras were much better looking.  Many of the supporting cast were fun to watch and the plot twists were, though expected, entertaining.  The central love story was not believable, needed nor successful.  Rent it, don't waste money on a theater.",6.0,Anonymous,Crime
Boring,"This movie is in my opinion over-hyped thanks to the big-name stars in the roles. That's the only interesting part of the movie, watching the actors interact and see them doing their work. Although I like most of the lead roles, I've seen much better performances. The plot is simple enough, a robbery of a casino. The only problem is that it's not a bit exciting. Everything goes smooth, nothing fails, and they get the money. Although a bit clever, it feels like the original parts are stolen from movies I have yet to see. When all's said and done, the movie leaves you with a feeling of being cheated of something; How did you get so many stars to make this boring movie? Anyhow, it might be entertaining to some, but there are far better crime movies out there.",5.0,Anonymous,Crime
"Its not very often that a remake of a movie improves on the original, but Oscar winning director Steven Soderberghs updated version of ""Oceans Eleven"" is far more enjoyable than the 196","The twenty first century version may not feature the epitomisers of sharply dressed cool that were Frank Sinatra and his Rat Pack  Dean Martin, Sammy Davis Jr, Peter Lawford and Joey Bishop  but it does feature some of the biggest movie stars in the world today including George Clooney, Brad Pitt, Julia Roberts and Matt Damon.Clooney steps into Sinatras shoes as Danny Ocean, a brilliant con artist who decides after his release from Prison to put together a small team  the ""Oceans Eleven"" of the title  to undertake a robbery on a scale no one else has ever attempted; stealing $150M from the underground vault of three of Las Vegas biggest Casinos. The elaborate plan involves a series of clever deceptions, most of which are refreshingly not signposted to the audience in advance. Although that means that youre never quite sure what will happen next as the elaborate robbery and its many attendant scams unfold, the supreme confidence of Clooney and his team means you never really doubt that they wont succeed. However, perhaps surprisingly, this doesnt take from your enjoyment of the film. It has an eminently watchable cast, with Clooney and Pitt in particular creating an onscreen chemistry reminiscent of Paul Newman and Robert Redford in ""The Sting."" Only Don Cheadle lets the side down with a frankly awful supposedly cockney accent and terrible dialogue as an English munitions expert. The soundtrack from DJ David Holmes succeeds in combing the cool allure of Sinatra & co with the best of todays dance music, and the films fast moving, slick & confident visual style, quite simply, makes it a joy to watch.",9.0,Anonymous,Crime
Jon Monsarrat review:  solid but nothing special,"Can we talk? Really talk? I'll let you in on a secret. I'm an action movie buff all the way. I didn't care that ""Rumble in the Bronx"" had no plot, or that Arnold Schwartenegger can't act. If stuff blows up, I'm happy. And I'm not sophisticated enough to appreciate dramas.But -- I do appreciate an intelligent plot or characterization that does something original, makes me think, and when stuff blows up there had better be some good tension and great action.""Ocean's Eleven"" is a straightforward heist flick without much of the above. It's not exactly bad (like ""The Score"" which I found offensively boring compared to its promos), but just uninspiring. The all-star cast does nothing to lift this impression.Who should see this film:-- action buffs who have nothing better to do on a rainy day,and haven't formed false expectations from the all-star billing-- I can't think of anyone else. Arty types definitely stay away.he film is not a comedy, and unless you've got quite a seriouscrush on one of the stars, I would not go just to see them.I'll give Ocean's Eleven a respectable but not eye-opening 6 out of 10.",6.0,Anonymous,Crime
"Pure, Top Class Entertainment!","Wanna watch a movie which isn't particularly demanding, but not a shallow, no-brains blockbuster either? Then try Ocean's Eleven. It's a witty and stylish crime comedy whose purpose is solely to entertain for a couple of hours. And entertain it does.As the title suggests, the film has 11 protagonists: they're all con-men, and they're uniting for the biggest heist in history. The target? The Bellagio, a huge Las Vegas casino. The motive? None in particular, except perhaps the fact that the casino's owner, Terry Benedict (Andy Garcia), is dating Tess Ocean (Julia Roberts), who just happens to be team-leader Danny's (George Clooney) ex-wife. The fun can begin...The movie is a remake of a '60s Rat Pack flick, but you don't need to have seen that film, or even heard of it. Just think of the 2001 Ocean's Eleven as an ordinary action comedy, and you'll still have a great time.The screenplay has a vital role in this movie's success: the plot is expertly constructed, so that it will be captivating but not too complex, and Steven Soderbergh brings it to the screen with brilliance and elegance.But what really makes this film special is the cast: every single actor is absolutely comfortable with the various roles, and even though the focus is on some people (Clooney, Garcia, Roberts, plus Brad Pitt and Matt Damon), the other members of the ensemble (including Don Cheadle, Bernie Mac, Carl Reiner and Elliott Gould) have their chance to shine too. I was particularly impressed by Garcia's performance, which somehow reminded me of his unforgettable Godfather character (""Congratulations. You're a dead man."").Highly recommended. It won't annoy you for a second.8,5/10",9.0,Anonymous,Crime
Entertaining,"The casting coup, though not quite matching up to K3G, would still draw big crowds. Hopping onto the bandwagon is Steven Soderbergh (Traffic, Erin Brockovich), the flavour of the year 2000.The movie is a re-make of a 1960s one with same name, starring the 'Ratpack' led by Frank Sinatra. In short, the story deals with eleven men joining hands to loot three casinos in Las Vegas (where else?). The plot and cast arousing a good deal of interest, Soderbergh wouldn't need to worry about marketing.After an initial good pace, the movie slightly slows down and then picks up steam in the second half. The planning and execution of the robbery are impressive, with some surprises and subtle humour packed in. Some glaring loop-holes and cliches in the screenplay become forgivable.Clooney strides his part like a king, while Pitt is stylish. The rest are adequate in their small roles. Soderbergh maintains his trademark slick and realistic narration, aided by intelligent editing.Overall, an enjoyable movie, enhanced by the presence of big stars.",6.0,Anonymous,Crime
The best comments,This is an excellent movie! Perfectly acted by George Clooney and Andy Garcia. But also the other actors are also great. Better than the Oceans Eleven 1961 movie. Probably the years best movie. And many years yet to come.,10.0,Anonymous,Crime
"Suck on that, Inspector Morse!",I'd be lying if I said I could follow this 100%. But this was pretty admirably made as a piece of glitzy fluff adventure with a lot of rich personalities try to swindle the capitalist.It's so good to be able to root for the thieves for once with all these obnoxious cop shows on TV in which the one who holds all the aces always wins.You'll need to have a great attention span to follow it completely but if you did that you'd be Cinemasins guy. It's better to just relax the mind and just go along for this flume ride of clever underhandings and manipulation that by the end actually justifies itself in a way I didn't expect.it is Matt Damon who really shines as the neurotic rookie.,7.0,Anonymous,Crime
Fantastic,"I thought it was highly entertaining, smartly acted, razor sharp dialogue and quite possibly one of the best casted films in history.  I plan on seeing this one again.  George Clooney and Julia Roberts crackle with chemistry! They should make one or two movies together a year they were so good together!",8.0,Anonymous,Crime
Great Movie Almost Spoilt by Silly Cockney Accent,"I am sure we all remember the travesty of Dick Van Dyke's attempt at a cockney accent in Mary Poppins? It seems that Don Cheadle went to the same school of acting and continually confused an Australian accent with cockney. Why on earth bother, and why did they not employ a real Londoner (cockneys very hard to find now) who would at least be credible? I know this film is over 10 years old and maybe things have improved, but just needed to vent my spleen. The movie is however very watchable and apart from the aforementioned, there are good performances by allNeed another few lines, so only reason watching now this is that we just came back from Las Vegas and spent a happy evening at the Bellagio. Also interesting to know that George Clooney has a villa close to Bellagio on Lake Como in Italy.",7.0,Anonymous,Crime
Over-rated Big Time,"This movie is about a punk ex-con who is bitter about losing his girlfriend to someone more successful than himself.I personally didn't care for anyone of the characters.  Carl Reiner was the best of the lot.  They were way too bland and because there were so many involved in the heist they didn't have enough time to develop the characters.I expected more.  There was hardly any action or suspense.  Basically a dialogue movie.  And the only dialogue was ""are you in?""  ZZZZZZZZZ. Did any of you think for one second the plan would fail?  Personally I wished it did.  Clooney's character was a punk.  Get over it you are a loser ex-con and lost your girlfriend to someone who was more successful than you.3000 Miles to Graceland was a similar movie that didn't get the positive reviews this movie got and was far more intense and action packed.  The performances were better too.  NO ONE can say that Clooney was better than Costner.  NO ONE.  This movie got great reviews because of two things:  an excellent cast and Soderberg the director.  In my opinion go rent 3000 Miles to Graceland if you can take a lot of violence and foul language (the only reason for poor reviews).",3.0,Anonymous,Crime
