title,content,rating,username,genres
The Ultimate Popcorn Movie,"This is the biggest cast ensemble up until The Avengers when Brad Pitt and George Clooney were Hollywood's top guys. The film is subtly humorous, making for big laughs. This movie is why people made movies in the first - it is pure entertainment from start to finish with every actor getting their chance to shine. If you're looking for a entertaining film, look no further than Ocean's Eleven because it features everything great about cinema. You'll appreciate it even more on multiple viewings.",9.0,Anonymous,Crime
What Could Have Been,"This viewed like a very competent workman's like effort with almost no passion. I found myself truly bored while watching the planning and execution of the biggest heist in history.There were few surprises and little suspense. And I really didn't like the mental flashbacks, ala Spike Jones' ""Three Kings.""Yes, it's making tons of money at the box-office, but nobody claims the restaurant that's served billions has the best cuisine.",6.0,Anonymous,Crime
This Movie is AMAZING,"I watched Oceans Eleven the other day and I had seen it before and it is still as amazing as I always remembered it to be. This movie is crazy good! The actors and actresses in this movie are so iconic and amazing. Some of these amazing actors and actresses include, George Clooney, Julia Roberts, Matt Damon and Brad Pitt. I love the whole plot of this movie, it reminds me of Now You See Me. I love the mystery and how clever the whole movie is. I love every single thing about this movie, such a classic! I can watch it whenever like no matter what mood I'm in. 10/10 it's such a great movie!! I cant believe how amazing it is!",10.0,Anonymous,Crime
50% sting 50% caper 100% entertaining,Based on R1 DVD 117 minClooney and Pitt prove to be a stong combination in this intelligent if slightly confusing; perhaps deliberately so; movie. The director keeps a few tricks hidden from the view but the cast is so good; and the leads so scampish that it's impossible to work up any resentment.7/10 well worth watching,7.0,Anonymous,Crime
"great movie, but it is a one-time watch. ( C+Movie ) My Ratings 8/10","While Ocean's Eleven may not be the most memorable film, it offers a clean style and some witty humour.",8.0,Anonymous,Crime
Third rate acting in a fourth rate script.,"This is the perfect example of a film with nothing more going for it than a big-name cast. That cast apparently chose to wing it rather than study their lines, and it shows. To a person, it is third rate acting.The plot is so ridiculous as to be laughable. The holes in the story line and the action are numerous and frustrating.By the mid-point of the film, you must decide whether to ignore the problems and just let it happen, or pull the plug. I stuck with it, but without any satisfaction. It was a real disappointment!",4.0,Anonymous,Crime
Promises Loads Of Fun And Successfully Delivers It,"Smart, stylish & sophisticated, Ocean's Eleven is a sneaky delight that brims with a fun vibe & moves ahead with a carefree attitude, is jam-packed with colourful set of characters who are expertly brought to life by its charismatic cast, and is all the more strengthened by the smooth chemistry they share with each other.The story of Ocean's Eleven follows Danny Ocean who, the moment he is out of prison on parole, begins concocting his next robbery. Needing a team of skilled accomplices to carry out his highly ambitious mission, he enlists the help of an old friend and puts together a team of 11 accomplices, all of whom must work together to carry out the heist successfully.Directed by Steven Soderbergh, the film doesn't waste much time in setting up its premise and keeps adding new characters without slowing down the plot. Soderbergh directs each segment with a playful tone and keeps the lighthearted nature of the story alive at all times. The writing is sleek, witty & energetic although the central core of the narrative isn't strong enough.Las Vegas is captured in all its glory, thanks to its exotic shooting locations, well-carved set pieces, vibrant photography, swift camera-work, bright lighting, trendy costumes & numerous aspects that only help in uplifting the film's opulent look n feel. Music also carries a groovy element although it isn't anything memorable.Coming to the performances, Ocean's Eleven features a charismatic ensemble in George Clooney, Brad Pitt, Matt Damon, Andy Garcia, Julia Roberts, Don Cheadle, Casey Affleck & others, with both Clooney & Pitt impressing the most. Bringing his charming screen persona into play, Pitt delivers a show-stealing performance but Clooney isn't far behind plus the chemistry between these two is one of the film's main highlights.On an overall scale, Ocean's Eleven is an enjoyable, entertaining & sufficiently satisfying delight that promises lots of fun throughout its 117 minutes runtime and, for the most part, successfully delivers it. The lack of seriousness only takes it so far and while it's certainly missing the element that makes a good film great, Ocean's Eleven nevertheless manages to sideline its shortcomings with a thrilling climax that lives up to its expectations.",,Anonymous,Crime
"Good film, even after several years.",Even after several years this film is a good one to watch. The story-line is strong. There are several (very) good actors in it. The style of filming is good. There music is good and really supplements the film.It's just a very complete film.It's just that film that you watch again and again.,9.0,Anonymous,Crime
How cool can a movie be? Wow.,"This movie is all about style. Yet it manages to have some plot, too.From the setting (the Bellagio Hotel), right to Brad Pitt's shirts and ties, the movie screams ""classy"". It's just that. A good, very classy film, in which the villain (George Clooney) is as sharply dressed as the ""not so villain"" (Andy Garcia). Where every shot is picture perfect, where all shines and sparkles, and where everything is just picture perfect. So perfect, as a matter of fact, it's incredible (which might be the only flaw on the film).Great dialogue lines, a fantastic setting, a terrific cast, an entertaining storyline - how can you miss? Terrific movie.",7.0,Anonymous,Crime
Oceans Eleven A Slick Caper Movie With A Great Cast,"Oceans Eleven is a slick caper movie with a great all star ensemble cast who turn in terrific performances including George Clooney, Matt Damon, Andy Garcia, Brad Pitt, and Julia Roberts among many others. Director Steven Soderbergh is admirable in making this film which is definitely the better of the remakes that have been coming out lately. The rest of the talented cast including the late Bernie Mac, Scott Caan, Casey Affleck, Carl Reiner, and Elliot Guild are just as impressive as the supporting characters in their limited screen time. Ocean's Eleven is a film thats better to see without knowing too much about it because any kind of spoiler can ruin some of the surprises in store for those who watch it. Despite some flaws with the film juggling a bit too many characters and a slow pace at times, Ocean's Eleven is still a good movie. Overall I was very impressed with this one and if you give a chance I'm sure you'll enjoy it too. Ocean's Eleven has an intricate story with just enough humor, drama, excitement, surprises, and exceptional performances by the whole cast who definitely make this caper film worth the time to watch.",8.0,Anonymous,Crime
All Bets Are Off,"The promotional material inarguably reads: ""The skill of Academy Award-winning director Steven Soderbergh combines with enough starpower to light up the Las Vegas strip in this classy caper. George Clooney plays Danny, defying the odds in a split-second heist of three Vegas casinos - all owned by a magnate (Andy Garcia) who is dating Danny's ex-wife (Julia Roberts). A fixer (Brad Pitt), a pickpocket (Matt Damon), a blackjack dealer (Bernie Mac), a flimflammer (Carl Reiner) and others in well-defined roles are with Danny. Are you in or out?""You're ""in"" for smooth, star-studded entertainment. The main actor is Mr. Clooney, who has developed a great, almost Cary Grant-like persona. Highlights include Mr. Damon donning a Ripley-type manner, and his well-played ""confrontation"" with Mr. Mac. Alan Colmes is quite an unexpected boxing fan. In sum, if you think a film can be too slick, ""Ocean's Eleven"" should prove it inarguably.******* Ocean's Eleven (2001) Steven Soderbergh ~ George Clooney, Brad Pitt, Matt Damon",7.0,Anonymous,Crime
"Clever crime caper, but not quite among the best of the genre","I love crime caper flicks and this one is pretty good and made better by the all-star cast.  I haven't seen the original Oceans 11 starring the Rat Pack, so a comparison can't be made, and probably isn't fair, really.   As with any good caper movie, you have a man fresh out of the clink (Clooney) who plans the one big job that will set him for life and allow him to take the straight and narrow when its done.  We follow the recruitment of the old gang, the planning, and assorted hi-jinx along the way.  The characters are interesting enough, with a mixed bag of old-time Vega$ types as well as some young nerdlings and assorted hipsters thrown in the mix, makes for an entertaining bunch.  The plot is to rob three casinos at once and actually is quite elaborate.  One thing I dug about it was that they slowly revealed how the robbery would take place, so your are kept in the dark for much of the movie.  To complicate matters, Clooney targets one of the casinos because his ex is seeing the owner.  Normally, this would seem like a contrivance to bring in the 'chick flick' audience (Doesn't having Clooney in a movie already bring in the chicks??), but it tosses a kink into their plans, so I'll let is slide.  The movie is entertaining enough to recommend, but doesn't quite stand up against the best caper flicks.",6.0,Anonymous,Crime
Ocean's Eleven Review,"Steven Soderbergh's remake of 'Ocean's Eleven' is an action filled heist film about a criminal, Danny Ocean (George Clooney), who was just released from jail and close friend, Rusty Ryan (Brad Pitt), who gather nine other men and plan to rob 150 million dollars from three different Las Vegas casinos. It is a fast-paced, clever film that is so entertaining, it has you rooting for the thieves. It is full of a great cast including George Clooney, Brad Pitt, Matt Damon, Julia Roberts and many more. There are a lot of key characters but each ones important qualities to the job allow them all to come together nicely. It was shot very well with many of the scenes in low lit, dark rooms to show the privacy among the group and the conversations of the heist. In contrast, the casino is full of bright neon lights and gold decor to show it's extravagance and wealth. There is a constant theme of conflict and suspense that can be seen from small mistakes made throughout the heist, the relationship between Danny and Terry (casino owner), and Danny trying to win back his ex-wife. Overall, It is a good mix of comedy and suspense that always has you watching till the end.",10.0,Anonymous,Crime
Good if you dont question anything,"This movie is good but if you question anything, it completely falls apart. There are A LOT of things in this movie that they dont make any sense or that the director completely ignored. One example is that Brad Pitt's character basically knows everyone in the united states and also knows exactly where to find them anytime of day.This movie would be 10 times better if someone actually put together a coherent heist. Otherwise this movie feels like its trying to be smart but ends up being more like ""Now you see me"".I think the significance of this movie has been overhyped. It really doesnt deserve the amount of recognition it gets.",7.0,Anonymous,Crime
What Happened???,"I bought the DVD because of the cast members, but this movie was bad. it took me three attempts to actually get through the whole film. I like most movies, believe me, but this is the only DVD that I let my four year old son play frisbee with.",2.0,Anonymous,Crime
amazing movie,"this movie is great. amazing script, great directing by Soderburgh, all star cast, flawless camera angles, and interesting finish to the movie is what makes this movie a 10. the cast in this movie contains household names such as George Clooney, Brad Pitt, Julia Roberts, Elliott Gould, Bernie Mac, Andy Garcia, Eddie Jemison, Matt Damon, and many others. ocean's eleven is a blueprint for any movie. the way that the director and everybody else wrapped up this movie is mind blowing. you sit there afterward thinking, ""I had no idea. How did they think of that."" Whenever critics say that a movie is a ""roller coaster ride"" I think the movie is far from that. But this movie really is a roller coaster ride. You never know what will happen next. Watching this movie once is not enough. To really appreciate it, you need to watch this movie at least two or three times. You pick up things that you wouldn't have noticed the first time around. although it was made four years ago, ocean's eleven will be remembered for years to come.",10.0,Anonymous,Crime
Very very cool movie with great cast,"I really enjoyed this movie, it was interesting, funny, just great. Cast was amazing. I've never seen so many famous stars in one movie.Brad Pitt was gorgeous on the screen as usual. Only minus in this movie is Julia Roberts acting, because she didnt do really good job on it.I dont know how mtv award for best on screen duo went to Vin Diesel and Paul Walker next to Oceans Eleven and amazing cast. Ratings 10/10",10.0,Anonymous,Crime
See this movie!,"Have you ever watched a film where you wanted the bad guys to win? ""Ocean's Eleven"" (the remake) is a twist on that theme. Brad Pitt, George Clooney, Matt Damon, etc. are men that will soon be robbing 3 of Las Vegas' hotels and casinos in one night. Sure, you think that they're the bad guys and you still want them to win, but the owner of those casinos (Andy Garcia) can also be classified as a bad guy as well.This movie has many things in it: romance, as George Clooney and Andy Garcia fight over Julia Roberts. next, it has comedy as 11 completely different men work together on the one thing they agree on: money. Then there's action, as they pull of tricks to get the money. And finally, are you ready? drama. well, drama and suspense can be the same, right? in this case they are",7.0,Anonymous,Crime
Great crime caper flick which will have you guessing from start to finish!,"Wow! This is a great crime caper flick which will have you guessing from start to finish! That is the main thing that I can say about OCEAN'S ELEVEN. If you ask me, the best things about this film were the lights and casinos of Las Vegas. Also, in my opinion, Danny (George Clooney) was a very smooth criminal. To me, Tess (Julia Roberts) was a very beautiful woman. My favorite outfit of hers was the gold dress she wore when she and Terry (Andy Garcia) went to the boxing match. Anyway, I thought that everyone involved did a good job, the cast was perfectly chosen, and the direction was excellent. Now, in conclusion, if you like George Clooney, Julia Roberts, or any of the key players, I highly recommend this excellent crime caper flick which will have you hooked from start to finish.",10.0,Anonymous,Crime
How to knock over a Casino...,"Imagine if you will an all-star cast.  Now imagine that same cast doing what they do best--act.  Ocean's 11 is not like that.Don't get me wrong now, I didn't say they didn't know how to act--I said Ocean's 11 is different if you didn't want the hassle of figuring out what the actors were trying to get across to the audience.Having said that...Ocean's 11 is a nifty little robbery flick that is fun to watch and great for a lazy Saturday night.  In fact, the whole atmosphere has that Saturday Night draw, so it would be difficult thinking otherwise.George Clooney stars as a con just out of prison getting ready to pull another score.  Brad Pitt stars as his buddy getting the whole thing set up. It's really great watching these two guys playing against one another. They have instant chemistry on the screen and are complimented by all the other slowly introduced actors in the story--Matt Damon, Andy Garci, Julia Roberts, Carl Reiner, Elliot Gould...etc.  They are all fantastic.One thing though:  If you ever wondered what ever happened to Vincent Mancini in Godfather III--look no more--he dumped Imobolare to work in Las Vegas.  Of course I'm talking about Andy Garcia as the bad guy.  I don't think I've seen Garcia since G3 so it was a surprise to see that he was playing the same type of character which led me to believe that his career was nothing but a big type-casting event.  It wasn't until recently that I realized he did other things other than Vincent Mancini roles.  I guess that's a tidbit that's neither here or there.The sets on Ocean 11 were very well conceived.  The color, lighting and audio was the usual Hollywood splendor.  There's really nothing bad to say about this movie.  I would give it a 7/10",7.0,Anonymous,Crime
A classic for the ages,"I watched this film first probably around 2003-4, and nearly 20 years after its initial release, I'm still hugely entertained every time I watch this again (I've rewatched this probably half a dozen times over the years). It's aged tremendously well. Fun, and kinetic like this is rare today.There's very few green screen, CGI or special effects shots. This is all about good writing, characters, plot, pacing, camera work, score, and set designs. Apart from one characters laughable English accent (and I'm English, people!) there's virtually not a line or scene out of place.Hollywood today could learn a lot from noting the heartbeats of this film, and the great, great underrated screenplay that drives it. Its perhaps not a surprise that the sequels struggled to live up to it - this is mastery on the first take.",10.0,Anonymous,Crime
An Ocean of American stereotypes.,"Thief wants his girl back and plan a job to rob his rival. He gathers a team. The robbery is a success and the girl goes back with him. A rather superficial story set in the colourful and well illuminated Las Vegas. The actors play well but not all are convincing. The robbery is ingenious and is the core of the movie. But towards the end there was this feeling of unfinished business. As if a piece was missing. Or maybe a too superficial movie. The trailer was more attractive than the movie itself. Nevertheless, it is still enjoyable to watch.",6.0,Anonymous,Crime
Simply brilliant,"Ocean's Eleven sets out to be an engaging, thrilling yet fun heist movie, and it manages to accomplish just that. It's stunning, it's simple, it's brilliant. Everything about the movie, from the pacing to the acting and dialogue, is done with so much thought and so well.Ocean's Eleven has quite the typical heist film plot. A criminal, Danny Ocean (played by George Clooney) plans to pull off possibly the biggest heist in the history of the United States, planning to rob $160 million from three casinos in one night. It's no easy task, and he seeks out a team of people (eleven, to be exact), of which include great actors such as Brad Pitt, Matt Damon and Carl Reiner.I think it's easily the acting that makes this heist film such a standout from other similar films. Matt Damon is so innocent and yet so powerful, and Carl Reiner plays Saul very well, but for me the two best actors had to be George Clooney and Brad Pitt. Together their characters Danny and Rusty lead the team in real style, right from the get-go. Clooney plays his character stunningly, honestly yet with plenty of fun injected into it. Brad Pitt shines in his role, just so...amazing. The highlight of his character for me was easily when he casually got Basher out of an arrest.The dialogue in this movie couples itself perfectly with the acting. It's just such witty, fun dialogue. It's the type of dialogue many may cringe at, but if you're watching this movie you've got to remember that it's just trying to have fun. Everything from the content, the timing, the delivery of the lines, is done so well.Personally, and rather obviously, the highlight of the film had to be the heist. The movie doesn't waste time getting to the heist like other heist films (I'm looking at you Fast Five...which actually copied an awful lot from this movie), and once it gets to the heist it doesn't muck around. It just rolls with it, and it has plenty of witty fun along the way. The heist itself is clever, it's smart, it's brilliantly thought out by the characters and more importantly the writers of the movie.My two only gripes are rather minor; the ending and Basher's accent. I'm not even British but the cockney accent that Don Cheadele puts on can't possibly fool anyone; it's just so unnecessary and whoever suggested he use one should be fired. Also, I don't want to spoil the ending but I feel it could have gone just a little further. It's still great, it's just that it could have been perhaps more satisfying. Still, that's why there are sequels.Ocean's Eleven is just such a clever and yet heist film. I highly recommend it to anyone who loves a thriller or is just looking for a quick way to kill two hours. You won't regret it.",9.0,Anonymous,Crime
"when you want something, you get it...","...and if that something is your love, you do whatever it takes to have it. You even rob a well secured casino. It is a good movie, nice casting, nice plot, some funny parts too. Still, there are many unexplained things which in real life wouldn't happen...",7.0,Anonymous,Crime
Don't believe to 7.9,"How people can rate 7.9 this boring and empty movie? Action is zero. Style is very very old. Clooney acts like a dog. Script is not original at all. Just the cinematography is very good, all the rest is nothing. The rhythm is very slow like in the other Soderbergh movies. Go, if you want, at your own risk.",3.0,Anonymous,Crime
Great Movie,Probably Ocean's Eleven is the best Ocean's Trilogy movies,10.0,Anonymous,Crime
Good Vegas Fun,"Ocean's Eleven had a really cool feeling to it- a cool cast, a cool premise, and it was based in Las Vegas - what more could you ask for?  George Clooney, Brad Pitt and Matt Damon made it easy for me to keep my eyes on the screen (I would love any movie that had those three in it, no matter what the plot was).  One thing I didn't notice until the second time I watched it was that Brad Pitt is always eating something in every scene!  Casey Affleck and Scott Caan were hilarious in their roles as the brothers from Utah - they reminded me of my brothers.  I was also impressed by both Elliott Gould's and Carl Reiner's performances in their roles.  It was a nice change to see Elliott Gould in a more intelligent role than the one he has on Friends.  Even though I hate to see Andy Garcia as a villain, I think he did an excellent job - his character was easy to hate.  I always enjoy Julia Roberts, however I was a bit disappointed by her awkward performance in this movie.  It seemed like she was just there to deliver lines - I don't think she really got into the role.  Another thing - someone needs to teach her to walk like a lady!  That being said, I still thoroughly enjoyed this movie and I would give it 9.5/10",10.0,Anonymous,Crime
Comedic,It's a fun movie about a heist and some other matters. The plot isn't that much detailed but the scenes are fun and the humour is sometimes quite unexpected and cute.,7.0,Anonymous,Crime
very good film,The cast is almost all big names. It's great to see actors like Pitt and Clooney and Damon come together in a movie.The plot keeps you to the end.A lot of laugh.I highly suggest this film,8.0,Anonymous,Crime
"A ""good"" movie","A ""good"" movie in the sense that you should really just sit back and watch.  Clooney and Pitt do a fine job, as well as Damon.  Casey Affleck is really good, and Soderbergh does a good job at directing.  Some plot holes, but they didn't bother me too much.  My only complaint is the story line between Clooney and Roberts. There scenes together are good, especially their first encounter to the audience.  The story-line between the two, however, does not develop at all, and when it ends you are sitting there wondering what happened.  Other than that, good heist movie even if it has been done before.  The acting is done very well.  Although it does seem like an all-star basketball game where there are too many stars on the court.",7.0,Anonymous,Crime
What a cast,"But it's more than that! The story is great, the actors enjoy their roles. And so will you, if you watch the movie! The movie has many players, but still concentrates on one central one (George Clooney's) for your attention. But I was a little bit surprised that Don Cheadle is not listed in the credits (according to IMDb) ...It's style and funny dialogues from beginning to the end. Andy Garcia is a great villain here too. Someone you like to see fall down. But the question is, does he? You'll have to see the movie for that. Be excited, be very excited! Especially if you know the Original (with Frank Sinatra and others), because this movie is an example, that a remake can in fact not only be as good as the Original, but be even better! Watch it and you'll see! :o)",8.0,Anonymous,Crime
