title,content,rating,username,genres
End of an era,"It was actually a very nice movie. If it was called anything else then Star Wars I would have cheered the quality and the entertainment value of the movie and would probably rate it with an eight or a nine.The problem is, it is a Star Wars movie.When I am going to see a Star Wars movie, I am not going to see a movie, but I am going to check out how they have been, what they have been doing, how the empire is developing, are they gaining more power? Who is taking the place of the fallen on both sides, who is now taking a stand against the empire who is going to make an effort to crush the rebels? Or is the evil now in the run are the Jedi's now rising in numbers, are of will they ever come back if so how etc. etc. etc....At the very beginning of the movie, I was very disappointed and didn't recover form. What the flock happened with the opening?Why, why why in earth would you skip the intro? The intro was the gateway to their part of the universe. Via this gate way the viewer, (at the least me) could actually move from our part of the universe to their part...and now..during the whole movie i was not there actually experiencing what they were doing, but I was sitting in a theater watching, however nice, a movie....Whit Rogue One, they (Disney) has killed Star Wars. I assume it was a deliberate act, since they are not stupid. They will try to setup their saga...well good luck with that. If you could have, you would have about a decade and billion or so ago...",1.0,Anonymous,"Action, Adventure, Sci-Fi"
Absolutely the best since the original trilogy!,"Don't worry about what other people are saying. Go and see this for yourself! I am a die hard Star Wars fan and this movie delivers on every front. I am clueless as to why so many reviewers have been bagging it, or why it has a low MetaCritic score!The whole feel of the movie is perfect. It has excellent pacing and when the movie ended and we found out it was over 2 hours, we couldn't believe it.The nods to the original trilogy are all there and done in such a subtle way I was yelping with joy in the cinema due to how well they were used.The story though, it takes the cake. It really helps tie up a lot of things in the series including the title of the first Star Wars, A New Hope.I am going back for another viewing soon and this time in 3D.So yes, go and watch this! It will blow your mind.",10.0,Anonymous,"Action, Adventure, Sci-Fi"
Finally a Star Wars movie to put on the same shelf as the originals!!!!!?####,"Star Wars Rouge One is at last the prequel we've been waiting for. It retains Lucas's flavor and at the same time isn't afraid to be original. The action sequences rock, Darth Vader was better then ever. The only problem was the Japanese samurai warrior and his bamboo stick. However as a whole this movie had a simple plot, like a the original Star Wars movies, the characters were very well crafted and lovable. And all the criticism about the CGI is crap, rouge couldn't of done without it. The film has all the right story elements which makes it not only a great Star Wars film, but a awesome movie. The film also should've at least been nominated for Best picture, but being that it's on the surface apolitical it couldn't be nominated. Instead Moonlight and fences are nominated, two crappy films with the same agenda. Well maybe Star Wars 8 will scrape a nomination. Anyways rouge one rocked, kicked the force awakens to f***n mustard, and can be placed on the same shelf as the original trilogy.",8.0,Anonymous,"Action, Adventure, Sci-Fi"
An unworthy cash-in,"I write as a dyed-in-the-wool Star Wars fan. I hated this movie.The actual story is tissue-paper thin and could have been done much better. There is an awful lot of padding - some scenes are as painfully long as an in-game cut-scene that you can't get out of. To make up for lack of story, lots of CGI has been thrown into the mix to try to create a ""wow"" factor. It doesn't. All it does is emphasise how weak the story actually is. For me, an adult fan (I'm 50), it was pretty poor but my 6 and 13 year old nephews seemed to enjoy it. Most of the adults seemed to think it was ""OK"".This is not a worthy addition to the canon, unlike The Force Awakens, which was.",,Anonymous,"Action, Adventure, Sci-Fi"
Excellent. A Fantastically Exciting New Star Wars Adventure,"BLOWN AWAY is what comes to mind with Rogue One as yes i grew up on the Star wars franchise but this movie is a more grown up & darker in tone & actually gritty & a real sense of danger so to me it's actually as great as the classic's as it holds its own as a darker more mature installment.The group of rebels are excellent & the story is exciting & dangerous so the atmosphere is very dark & often emotional!!!A fantastic sci-fi Thriller not just a great star wars movie as this is a brilliant sci-fi film that's excellently directed & it looks amazing.Rogue One stands out as easily the best of the franchise, yes even better than the original Trilogy, here this movie feels like a War film or a mission movie which it is both & has a dark overall atmosphere. I love men-on-a-mission movies or ladies & gents-on-a-mission such as DC's Suicide Squad & Tarantino's Inglorious Basterds or Black Hawk Down or Triple Frontier among many others & Rogue One fits in perfectly to that sub-genre.The battle scenes are fast, frantic & furious with gritty impact like a battle would be like & for a fantasy sci-fi Thriller it's one exciting & at times emotional wild ride.The cast is great as is each interesting character & performances especially from Felicity Jones as Jyn Erso, a daring freedom fighter & the heart & soul of the movie & Diego Luna as Cassian Andor the rebel spy & they with the others band together to go on a desperate & danger mission to steal the plans to the Death Star, which is the prequel story to the very first ""New Hope""
Yes the other movies are of course iconic classic's but this is an new exciting piece of Star Wars art & a brilliantly crafted sci-fi adventure/Thriller with meaning & a much more urgent excitement feel to it & in my opinion a better more grown up star wars film & a perfect film in the franchise. A deadly Suicide mission & an exciting journey.",7.0,Anonymous,"Action, Adventure, Sci-Fi"
Of the best Star Wars movies,"An excellent film from start to finish, with an unparalleled variety and characterization of characters, the most serious story of the entire saga and the most consistent with its universe; a final battle scene unprecedented in the series, the most heroic sacrifice of the series and of course, spectacular cameos that did not feel like filler. One of the best of the saga without a doubt.",10.0,Anonymous,"Action, Adventure, Sci-Fi"
Proof that the Disney generation of Star Wars movies don't all suck,Rogue One is a delightful movie that actually get this..... works on character chemistry.... Very believable characters that characterizes classic Star Wars films... Jyn Erso plays a petty criminal rescued by the rebel alliance for her potential knowledge of her father Gaylen Erso a chief engineer of the infamous Death Star...,10.0,Anonymous,"Action, Adventure, Sci-Fi"
The only Star Wars that Disney did justice with!!!,"While the first half or third of the movie is a bit meh and exposition-heavy, the last act is pure Star Wars entertainment and fun. Easter eggs and callbacks/references work, the special effects/CGI are mostly on point, and the new characters that come along are likable and kick butt! The force is with this film!",9.0,Anonymous,"Action, Adventure, Sci-Fi"
Rogue One #morecash #boredom,"I find overall 2016 not so very successful about blockbuster movies that came out, but deep inside I told myself maybe Rogue One could come close to the unanticipated success of The Force Awakens. Nevertheless in the end we all asked ourselves ""Is this movie really necessary?"". After watching it, I believe the answer is a big ""No"".The story is about how the Rebels got the plan of ""Death Star"" in order to defeat the Empire and save their galaxy. The daughter of the main engineer of Death Star is Galen Erso, played by incredible Mads Mikkelsen, is put up a difficult task. His tiny little fierce daughter named Jyn Erso is given the task by the Rebels to capture his father as well as the plans to Death Star. The Rebels intend to destroy the biggest war machine through this little girl by giving her a quite impossible mission.So by taking a look at features of Felicity Jones, you might say Daisy Ridley wasn't tall or an Athlete either. However, Daisy Ridley in The Force Awakens was very convincing in her role as a scavenger and was a muscular, agile fighter. With Felicity Jones, from the beginning I had no belief or whatsoever that she could take down one Trooper with a single hand , or could fight them off with only a stick. Something with her is really off-putting, I'm sorry but she is really not meant for action roles. Even during her speech in front of a group of Rebel soldiers was far from convincing, her facial expressions and her voice sounded.. amateur.The other characters had all problems as well. I think the main problem starts with the script which was heavily loaded with clichÃ©s such as countless repetitions of ""Hope"", not getting killed during prayers (and how come is this a Jedi thing?!), slow motion deaths, Deus-Ex Machina moments and so on. The movie was so predictable that no one could really care about any deaths in the movie. You will be like ""Yeah, that was coming"".After all, I think this was a huge waste of time and a very unnecessary addition to Star Wars series which proved that Lucas wants more cash and that's all about it. By that, I don't know how much more money, I mean, they are super rich right? Just stop! And for Felicity Jones, sorry but it was very unfortunate that her lead came out after great performance of Daisy Ridley. She shouldn't be in action movies.",,Anonymous,"Action, Adventure, Sci-Fi"
"Rogue One: A Star Wars Story, fan service with terrible pacing","My favorite Star Wars movie was always The Empire Strikes Back, not only because it is the best Star Wars film but because it is a well crafted movie as a whole. Through the eyes of a fan everything can be good except maybe for George Lucas' green screens, but it's an obligation to watch and review it as a movie, not as a hype product. That's why The Empire Strikes Back is so great, it doesn't matter from what perspective you are viewing, either Star Wars fan or movie buff, it is still a masterpiece.Rogue One tells a very messy story with uncharismatic characters about something that didn't need to be explained. The movie has poor character development leading to them being boring and irrelevant to spectators, including the protagonist Jyn that lacks charisma even for a role in a meaningless spin off. Every character feels shallow and the acting doesn't help to change that, just makes it worse.The pacing of the movie is were it shines, it's so utterly bad that establishes a whole new level of terrible pacing in movies. Half of it's duration being slow paced scenes with failed character development, making it very tedious, and the other half being so chaotic with so much rushed action scenes that it also succeeds on being tedious. It's also worth noticing that this movie uses some of the most unconvincing plot devices I've ever seen, like a necklace, leading me to question if the script was lazily written or that they just couldn't think of anything better.With the two main characters being abysmally acted and uncharismatic the movie feels dragged with very few good scenes, almost none of them being in the first half. A lot of the time I didn't even care about what was being shown at the screen, this includes all of the cheesy death scenes. How can someone be emotional about a death scene of a character that meant nothing to the spectator the whole movie? Cramming almost all of these death scenes at the last 30 minutes felt rushed, mainly because none of these characters could be left alive since none of them actually existed in the Star Wars universe before this movie.Besides all of these flaws, and the force brainwashing used in at least 4 scenes, the movie presents a good photography, and great use of special effects.The whole experience could be better but it does what it was meant to be done: to give fans another Star Wars movie. Not for the sake of being an excellent movie, like The Empire Strikes Back, but for the sake of being another Star Wars movie.",6.0,Anonymous,"Action, Adventure, Sci-Fi"
Almost as bad as the prequels,"If you are a true Star Wars fan (if your benchmarks are A New Hope and Empire Strikes Back), don't even bother going to see this one in the theatre. It's basically just a bunch of explosions and fight scenes, and of course, the end is a foregone conclusion.My biggest beef with Rogue One is that it lacks the ""mystery"" that we've come to expect from the really good Star Wars movies. Part of this is due to the fact that you already know what's going to happen. But part of it is also because the scriptwriters did a lousy job of keeping us guessing and entertained throughout the whole movie.As was shown in the previews, Rogue One features the return of Darth Vader. One detail about his appearance here made me angry. Disney did not use Darth Vader's original mask design from the early episodes. As fans will remember, Vader's mask originally had sharp angles and spikes that made him look somewhat alien. When Lucas did the prequels, he decided to change the mask design to give him more ""rounded"" features. The end result was that Lord Vader's face looked decidedly smaller.After all the criticism that was directed at the prequels, the fact that Disney chose to use the new mask design just baffles me. For Star Wars to work, the audiences need to be scared when they see Lord Vader. I find he looks silly with the new face, and if Vader looks silly, then the whole premise of the movie just falls apart.It's too bad, because the acting and the directing are stellar (no pun intended) in Rogue One. But my general feeling of emptiness when I left the theatre reminded me of how I felt after watching the prequels.Hopefully the upcoming Episode VIII will bring the franchise back to its original greatness.",6.0,Anonymous,"Action, Adventure, Sci-Fi"
The Rebellion was built on THIS!,"Rogue One (2016) -I love this film! I know so many people that don't like it or don't see the point of it, but I think that it was almost as good as the original trilogy.I believe that it was a love letter to the fans. A tribute to all of the nerds that really love the franchise and know who all the characters are, the ones that have read every book and even all of the comics, as well as the volumes that contain specs for each of the vehicles and backstory's for all of the characters. I'm not quite that obsessed, although I probably would be if I could, but it was so great to see so many fantastic nods to the other films/TV series in this one and some moments that were worth watching the film just to see, things that made me gasp and my jaw drop upon the first viewing. It was clearly made by fans of the franchise, was exactly what it needed and held true to the style of George Lucas.With all of that said, I'm not actually a fan of Jyn Erso (Felicity Jones) or Cassian (Diego Luna) and having seen 'Andor' (2023-) I didn't feel that series had added anything to his character or explained the chip on his shoulder, that was still obvious, watching this film afterwards. Although it did set up some great character arcs for Mon Mothma (Genevieve O'Reilly) and Saw Gerrera (Forest Whitaker), key characters in this film.I also don't like Ben Mendelsohn as an actor either, but I suppose that helped to make him a decent bad guy in the role of Director Krennic. I certainly wanted him to get his comeuppance.None of that made a difference to how much I enjoyed this film though, because everything else was so spot on - the soundtrack, the filming, the action and the lighting and all of the supporting artists.K-2S0 (Alan Tudyk) was brilliant for comic relief and Chirrut (Donnie Yen) and Baze (Wen Jiang) were awesome additions to the Star Wars Universe.There was a great use of well known and existing characters too, either in full or as cameos, including some surprises due to CGI and other special effects.And actually the CGI was absolutely brilliant as well as the use of older footage from 1977, polished up and recycled. The care and thought that had gone in to every detail, including costume, props and locations was glaringly obvious. Nothing about this film was half arsed.The finale was absolutely awesome, so unexpected the first time around and it still gives me goosebumps when I rewatch it.Overall it managed to maintain the ideals and values of the original trilogy, whilst also managing to bring it up to date, although the franchise has never really been known for being backwards.It also tied in with the extended universe
following on perfectly from 'Revenge Of The Sith' (2005) and incorporating elements of 'The Clone Wars' (2008-20).To the nay sayers I reply that you are wrong. This was a superb and very valid part of the larger story, possibly more connected than some of the others in 'The Skywalker Saga'.959.09/1000.",10.0,Anonymous,"Action, Adventure, Sci-Fi"
"Un pour tous, tous pour un","As you are reading this, you are quite probably: 1) a likely viewer of this movie, 2) a recent viewer of this movie. Falling in the category 2) myself, I understand you are probably browsing reviews in order to take comfort you are not alone in thinking that most of the more acclaimed critical reviews are wrong, as what you just watched was a pretentious and unentertaining film. If you are in category 1) I reassure you I will not reveal any plot elements and I wish that my review will at least encourage you towards a critical viewing.Rogue 1* is pretentious because the authors tried very hard to make the characters appear interesting and nuanced, instead they just come out as ambiguous, confusing and -worst of all- fake. An example can be found in the character of the spy/assassin of the Alliance, a character whose moral changes over the course of the movie according to...plot convenience; fortunately I have watched at least once all the previous SW installments, otherwise I wouldn't have known for half the movie who was I supposed to side for. Pretentious (and annoyingly so) is also the John Williamesque musical score, which is booming in almost every scene of the movie to remind us we are watching SW. And it's really too bad that when the imperial march comes on, it only succeeds to provide evidence that we are watching a parody of the original SW.The back story of the main character is unoriginal and heartless, her words and rhetorics having such an uninspiring effect that she reminds me of a recent female candidate for the US presidency, who likewise was talking to an imaginative audience which had no correspondence to the real one. I do not think a female lead is, as such, a bad choice - I recall f.e. the empowering performance of Sigourney Weaver in the Alien franchise - but I am convinced, simply out of common sense, that although we might have unisex shirts, jackets and trousers there is no such thing as a unisex character/role. And even though I wouldn't ascribe myself in their ranks I believe that an heroine who behaves exactly as a hero is an insult to the true liberals and the true feminists that Disney is trying so hard to please. I am not going to argument further on this topic as I think I stated my point clearly enough. Quoting a common phrase in Italian: ""chi c'Ã¨ c'Ã¨, chi non c'Ã¨ non c'Ã¨"", who is here is here, who is not here is not here.Rogue 1* is unentertaining because it is too complex and it has no heart. The plot in each of the original SW trilogy movies was linear and simple, the dialogues edging often to a ridiculous level of naivety, overall it was a script that could have been written by a kid in junior high. And yet it talked so deeply to our hearts, it possessed such powerful mythology that it became - and understandably so - an object of cult by many. That this movie has lost that naivety and simplicity can be observed already from the absence of a substantial opening crawl, which was fundamental in creating that bonfire-tale effect and in establishing a framework for the plot. Instead the viewer is thrown directly into the plot, a plot so contrived and badly narrated it becomes a pain-staking effort for the viewer to figure out who exactly the characters are and what are the reasons of their actions. In fact, as usual these days, we are served with minimal character development and maximal...Armageddon. How many cathartic scenes can there be in a good movie? 1 or 2, right? At which point of the movie are we supposed to expect such scenes? Towards the end, right? Well it seems that recently most authors (and/or most producers) for the big screen think they should cram as many cathartic moments as the length of the movie allows. And once this path is taken not even a Diane Keaton or an Al Pacino (let alone this new generation of actors, who are to older generations what production line workers are to experienced artisans) could help keeping character consistency from flying out the window. The result is that I found myself laughing sarcastically at scenes that could otherwise have kept me at the edge of my seat, simply because the empathy stakes were non-existent.In conclusion I would like to add that this is my first and only review on IMDb, which I decided to write as I consider Rogue 1 to be a perfect example of what is wrong with Hollywood blockbuster movies nowadays, thus the title ""One for all, all for one"".",1.0,Anonymous,"Action, Adventure, Sci-Fi"
Much Needed New Blood And A Masterful Stand Alone Story,"Being a ""Star Wars"" fan since 1977, I was reluctant and not quite sure what to expect from this film. Was this movie created just to be a cash cow? No! The new "" A Star Wars Story"" saga is a return to glory for ""Star Wars"" fans. It's the best film since ""The Empire Strikes Back"". The new blood pumped into this series was much needed. Especially with the film being helmed by Gareth Edwards. This film has excellent direction, cinematography, special effects, screenplay, editing, score and acting. It's an action packed thrilling ride. All the actors portray interesting, captivating and remarkable characters. The plot revolves around the origins of the Evil Empire's most feared and devastating weapon, the Death Star, and tells the journey that is taken to destroy it's completion. It provides an outstanding backstory to the, ""Star Wars"" saga. ""A Star Wars Story"" is an ingenious stand alone series however in the end we find out it is the prequel to Episode 4 which was never quite delivered by the inferior Episodes 1, 2, and 3.",8.0,Anonymous,"Action, Adventure, Sci-Fi"
Move Over J.J.,"I would have given this 8.5, but they won't let you do that, so I gave it a 9. Why not?I was very pleased with Rogue One, especially after walking out of the theater feeling a little disappointed last year. If nothing else, Rogue One tries some new things, which The Force Awakens didn't do much of at all. It also features an arguably better balance of old and new characters, and one of the best scenes in Star Wars history near the end. The special effects (both CGI and practical) are also amazing, some of the best I've ever seen in fact, and one particular aspect of them may change the way movies (especially sequels/prequels) are made FOREVER. I'll be shocked if Rogue One doesn't win Best Visual Effects at the Oscars this year, because it totally deserves it, even though Doctor Strange is a worthy contender.As for negatives, there aren't many. Some may argue that the new characters are largely flat, but I would point out that this is a standalone story, not part of the main series. These characters will not be featured in any other movies in the foreseeable future, so not focusing on them as much left some time for the old characters, as well as what we all came for, the epic battle scenes, which are much better than those in TFA. And I actually grew to like several of the new characters more than I thought I would. The first act is a bit hectic, jumping around all over the place very quickly. There are also a couple scenes that are quite strange, even for Star Wars standards, but these are all fairly minor complaints.Rogue One is a new hope for Star Wars fans that were disappointed with The Force Awakens. It's definitely not perfect, but it's a heck of a lot better than it had any right to be, especially considering that any fan of Star Wars knows exactly what's going to happen. It stays grounded in what we know and love while branching into just enough new territory simultaneously. I will eagerly be awaiting the next Star Wars story!",9.0,Anonymous,"Action, Adventure, Sci-Fi"
Gritty. Logical. Fills in the gap....,"This movie tells the tale of how the Death Star plans, ""......were acquired at great cost!"". Now we know what a handful of individuals paid for those plans. I also believe this is a movie for everyone, Star Wars fan or not. The CGI is really good, the acting is convincing and it's all in all just a good story. Absolutely the best of the modern Era SW.",10.0,Anonymous,"Action, Adventure, Sci-Fi"
