title,content,rating,username,genres
This is the Star Wars film I've always wanted,"After seeing Empire Strikes Back in the early 1980's I wanted more of that moodier, sobering atmosphere. Return Of The Jedi went in the feel-good, comedic direction. I didn't care for it. Episodes 1, 2 and 3 were focused too much on technical and political things, so I never liked them. The Force Awakens I felt was okay, but my hope for another dark Star Wars film was all but squashed. Out of seven films, I only cared for ESB, so I stood in line to watch Rogue One with my expectations set to the lowest levels. I was pleasantly surprised! Rogue One is dark, serious, and has a sobering conclusion that I found utterly satisfying. This is now my all-time favorite Star Wars film. The lack of many of the familiar Star Wars elements such as the opening Star Wars logo with accompanying text scrawl, or even John William's familiar movie scoring (he does the music in Rogue but it's nothing familiar) made me feel I was watching a fresh, new and improved Star Wars. I loved the movie immensely from start to finish.",10.0,Anonymous,"Action, Adventure, Sci-Fi"
An excellent Star Wars film,"I just got home from seeing Rogue One, and I must say, it was excellent. I grew up watching the original trilogy and was pleasantly surprised at just how well this fit into the Star Wars saga. The acting was superb, the costumes were outstanding, and there were several moments where I was taken back to my childhood by memories of Episode IV in theaters. This was a bit grittier than the rest of the series, but it also had more to do with the actual rebellion/empire war than with the Skywalker family. There was a real human element to it, with some of the backstory that gets revealed as the plot moves forward, as in, not everyone in the Empire is evil, and not everyone in the Rebel Alliance has pure motives. That being said, the characters have real flaws and real virtues, just like any normal person. If you have not seen it yet, I highly recommend it, if you have I would say it is worth repeated viewings. All in all, it exceeded my expectations and was thoroughly enjoyable.",10.0,Anonymous,"Action, Adventure, Sci-Fi"
Bored One. Let down... too many dark (low-light) scenes.,"Once you've seen the special effects of the other Star Wars films, this film was no big deal. We went to see it this afternoon, and both of us were ready to walk out after about 45 minutes. Way too many scenes in the dark. On this line I'll say that it's OK if you've not seen any other Star Wars films. On this line I'll say that I wish I didn't have to write a minimum of 10 lines. On this line I'll say that we rented the latest Jason Bourne film and watched it when we got home and really liked the excitement... really liked THAT film better than Bored One. (Preview my reviewing...) Oh, come on! I have to include more lines? Well here goes. I recognized the beach and palm trees scenes, partly because the palm trees were perfectly set in nice rows. I had heard that the battle of the last hour was fantastic, terrific, and really great, but, ho-hum. It was the same old stuff.",6.0,Anonymous,"Action, Adventure, Sci-Fi"
Well directed with lovable characters.,"The positives-Lovable and memorable characters. The sass of K2S0 and the smart ass remarks by the blind warrior along with the witty banter between the characters were treat to watch. You understand and relate to the characters and don't question their motives. Something lacking in most modern action movies.-Good direction with camera work, pacing, tonal focus-Comprehensible plot that is somewhat interestingAnswers some questions related to the franchise in a satisfactory way-Don't try to soften the blow when it comes to the necessary sad parts of the movie-Decent dialogue with some quotable lines-No silly forced romances.-The right amount of screen time for original characters and references to the other movies. Ie very minimal, unlike the heavy reliance on nostalgia by Force Awakens. Darth Vader is on screen briefly but is a bad assThe negatives-The action is nothing that you haven't seen before. It's good but not much in the way of new or original action scenes that will impresses you-It's a well-made, enjoyable movie. But nothing unique or groundbreaking about the movie to make it special.Overall: 7/10For comparison sake, I would give Force Awakens 5/10, the prequels 2/10 and the original trilogy 9-10/10. In a decade filled with countless movies centered on super-human heroes that are sub-par, it's nice to see one that's well made. In comparison to others this year, I would put this above Dr. Strange, Civil War, Suicide Squad and Startrek but below Deadpool.",7.0,Anonymous,"Action, Adventure, Sci-Fi"
FINALLY So much better than Force Awakens!,"I left the cinema after Force Awakens feeling gutted, the trailer had promised a more gritty Star Wars universe, and the film did not deliver.Rogue One finally delivered a grittier more brutal war film that star wars fans have been waiting for.I am my friends worst enemy after cinema visits, always finding the plot holes, and pointing out mistakes. But after Rogue One I left with my jaw dropped.Absolutely brilliant film, and I finally got to see the vader scene I wanted.Very impressed, now episode 8 has a lot to live up to!",10.0,Anonymous,"Action, Adventure, Sci-Fi"
Good Star Wars film!,"Star Wars Rogue One is a prequel to A New Hope. The plot revolves around Jyn Erso, the daughter of scientist Galen Erso, who is forcefully hired by the Empire to develop the Death Star. Galen was working for the Empire before and decided to hide with his family, but he knew eventually they would find him, so he prepared a contingency plan to have Jyn free. Jyn eventually meets the rebels and realising they are not so united as they seem, she seizes this one opportunity to get her hands in the plans of the Death Star on her own, which results in the name of her team: Rogue One.I can't say more without lots of spoilers. This film is similar to the prequels in the sense that we know more or less how it will end. And probably that is precisely what many people think is wrong with it. But I don't see a problem because I didn't watch the film for its conclusion, I was interested in what was Jyn all about. And I was pleasantly surprised: Jyn's story is an original one, not the same old boring Star Wars receipt of ""silly stormtroopers vs typical hero friends"" kind of story. It can sound cheesy, but it is about.. hope. Disney will make sure you know it: they say several times the rebellion exists because of hope, and yet they really delivered the message in this film.I will try to explain: Jyn finds herself in a really oppressive regime. Here we don't see much in the sense of comic relief moments and outrageous luck. Here we watch how creepy the imperial army can be, parading with a tank to intimidate people, enforcing ""law and order"" and how rebels can be easily put in the position of terrorists. Of course most of these messages are not tossed at your face, but they are implied.Rogue One is different because it is a sad story. Don't expect happy endings. If you are a great fan of the original Star Wars, you are in for a treat: here you will see what princess Leia means by ""this is our most desperate hour"", and you will understand how Darth Vader knows she carries indeed the plans to the Death Star and has to dodge bureaucracy to have her arrested her crew killed. You will understand why the Death Star has such convenient weaknesses and you will see the last of Senator Bail Organa. All of that respecting some Star Wars cannon most people don't even know.I must also point out the fact that some characters are brought back to life with CGI, most notably Grand Moff Tarkin (this is hardly a spoiler since he appears early in the film). It looks somewhat fake though, I guess the jaw doesn't move as it should, or perhaps the skin around the lips is not convincing enough. Maybe we still don't have technology for that, but I respect their effort. Apart from this weird impression, it was otherwise very well done. When Tarkin walks about and is not speaking, it looks like Peter Cushing is alive and well. Even his voice is convincing.All that said, I don't understand why people are so annoyed about recreating the original Star Wars universe. Some people say that liking these films is like clinging to the past and refusing to change, to move forward, to create new stuff. But hey, what's so bad in reliving the old Star Wars experience? If you don't want to, feel free to not watch the films and carry on. Sure, some things in life are meant to change and move forward, but this is cinema, don't take it too seriously. Also, character reconstruction like Grand Moff Tarkin to me seems like a very new initiative. That's called experimenting. I see no problems in attempting some new tricks with good old stories and watch the results. So, it is an old-fashioned look at Star Wars? Yes, I suppose. Is it a new approach? Yes, I think it is also a new approach. The story is good, give it a look.About the other characters.. admittedly there's isn't much there I suppose. Probably because there isn't enough time. But Jyn is the focus of that story (all others serve the purpose of giving her a team), and I think her story is well done, so I'm happy with it. I am giving this film an 8 out of 10, because it lacks some character development and the CGI is not mature enough for a 10. I'd risk saying this is probably the best Star Wars after Empire. Fascinating.",10.0,Anonymous,"Action, Adventure, Sci-Fi"
A lack of meaningful characterization drags this film down,"""Rogue One"" is a simple movie: A group of rebels have to fight against the Empire, and steal the Death Star plans in order to deliver a fatal blow to Vader's evil regime. You've heard about this in ""A New Hope,"" and in ""Rogue One,"" you get to see the group of rebels responsible for pulling off this daring act. But is it actually worth watching?""Rogue One"" in an interesting flick. The first hour of the film is relentlessly mediocre and forgettable, filled with practically zero interesting scenes except for one or two cool action sequences. The character building, except for Donnie Yen's character, is practically nonexistent, with almost zero substance being given to our main protagonist Jyn Erso, played by Felicity Jones. Truth be told, all of the characters in this movie are not very well fleshed out, and are pretty boring to watch, except for K-2SO, who is absolutely hilarious and entertaining every time he is on screen.That said, the movie moves along at a steady pace for its first hour, mostly because of how gorgeous it is to look at. The special effects are top notch, and are stunning to see. The movie looks so immaculate that you can almost forgive the boring first hour... almost.When the second hour comes into play, ""Rogue One"" picks up exponentially. The last act of the film is full of explosive action and riveting set pieces. ""Rogue One"" has been described as a war film set in space, and that's what it feels like. People engaged in combat play dirty and use guerilla tactics, and the violence feels more real than you'd expect in a science fiction film. The movie has a dark edge to it that sets it apart from other films in this franchise. However, because of the lack of meaningful characterization, I found it hard to care about what was happening, because frankly, I didn't care about any of the characters.Also, the movie ends with a very obvious scene of fan service, but it's fantastic fan service. The final few minutes of this movie are truly jaw dropping, and contain a scene so intense that you'll find yourself overwhelmed. I applaud them for including this scene in the film, but I couldn't help but feel like it was tacked on, as the film ends shortly after, and rather abruptly. However, the movie does end on a remarkably high note, which is always a plus.""Rogue One"" is a good Star Wars film, but it isn't great. It has a disappointing lack of characterization, and as such, is not very engaging throughout. However, if you want to see a cool action film set in the Star Wars universe, you can't go wrong with this.",6.0,Anonymous,"Action, Adventure, Sci-Fi"
Meh,"It was OK, but I thought the story was very simple and she cannot act at all. A lot of moments like> Where's the switch? And then they showed a big switch in the middle of a beach. It felt a little bit like ""The Naked Gun"". Darth Vader forgot his high hills, as he looked quite short. I'm a fan of the first 6 movies... Not so much of The Force Awakens, but at least that one felt a little bit more like the originals. Rogue One is good for the Star Wars fans who want to watch one more movie, and whatever it is, if it's under the Star Wars name, will do. I must admit that the during the first half an hour I felt quite lost... Anyway the movie was OK, that's why I give it a 6.",6.0,Anonymous,"Action, Adventure, Sci-Fi"
"Where it isn't excruciatingly boring, it's pathetically unbelievable!","This franchise may be dead altogether. Where the movie isn't boring, it's completely unbelievable. Overuse of split second timing made it worse. The main star is miserably unconvincing and not even good looking. The first hour is a bunch of meaningless dribble and no excitement whatsoever. I'm all for backstory and character development, but I had to shift around in my seat to stay awake. It lacked the magic that Star Wars used to have when George Lucas was making the films (the 1st 3 releases; before the singing teddy bears and the politically correct nonsense). The main character does not possess start potential and the rest of the cast just didn't carry the movie. This is supposed to be the future, but they were retrieving data with clumsy mechanical arms. Please.Other than that, I loved it.",3.0,Anonymous,"Action, Adventure, Sci-Fi"
Decent effort,"Quite how ""The Force Awakens"" can poll 8.1 while this only achieves 7.9 is beyond me. I'd award Episode VII at best 6/10. This one is significantly better - perhaps on a par with Episodes II and III - weaker than the original trilogy though.So what did it get right, and what did it get wrong? Well, the original movies succeeded so well because there were only a small band of characters to get to know - e.g. in the first film: Hans, Luke, Leia and Ben. This one introduces so many characters it's hard to know who's going to be important - then even when we work out who the main characters are, the interplay between them leaves a lot to be desired - there simply isn't enough TIME for them to properly build the characters and their relationships - everything feels a little rushed.Because of the nature of the plot, it's considerably darker than any of the other SW movies - there's very little for kids. It feels a bit like the later Harry Potter movies did - same material, but a more serious and sometimes disturbing presentation. Definitely more Terminator than Wizard of Oz.The cinematography and soundtrack are excellent - it doesn't come across as a SFX showpiece - everything feels just right - in this respect it is by far the highest quality SW movie to date.If you're a SW fan, you'll really enjoy this movie - it's almost good enough to make you forget how bad the last one was. Just not perfect. Next time, please can we focus more on a small group of characters and their interactions please!",8.0,Anonymous,"Action, Adventure, Sci-Fi"
The one Star Wars film I really like,"Dark. Bold. Divergence from the usual, and appreciated.",,Anonymous,"Action, Adventure, Sci-Fi"
"Good, even very good....but not great","This is definitely a very spectacular movie, some scenes are breathtaking, the photography and special effects are superb. I liked the dark atmosphere, slightly different from the typical StarWars one, You can find all along the movie several references to other cult movies of the past, on top of some nice cameos from the previous StarWars: Apocalypse Now, Blade Runner to mention only a few. Yet, the movie has some downs, the action gets somewhat confused at times and some scenes are definitely overlong (especially the final battle...). So I enjoyed it a lot, though I was expecting a great movie I ""just"" found a very good one...",7.0,Anonymous,"Action, Adventure, Sci-Fi"
Well its says Star Wars in the title.........,"*****Spoiler Alert..........First Rogue One is a good movie....... but is it really part of the Stars Wars franchise? Well its says Star Wars in the title.........In short the first 30 minutes of the movie is really slow and had little to do with the Star Wars, the next hour is a little better and the last 20 minutes, the movie kinda of remembered it was a Star Wars movie and it was great through to the end.The comedy elements are there with a good performance from Donnie Yen and K-2SO was funny. The scene with Darth Vader at the end of the movie was great.As I say Rogue One IS a good movie ...... but a classic Star Wars movie - it is not",6.0,Anonymous,"Action, Adventure, Sci-Fi"
The best Star Wars movie since Empire Strikes Back,"Title really says it all. Rogue One captures what made Star Wars so incredibly successful.Great actors, great characters, great script, great story. The director deserves his own trilogy.",10.0,Anonymous,"Action, Adventure, Sci-Fi"
A triumphant prequel worthy of the Star Wars name,"The hype has once again awakened with the next Star Wars film in Disney's latest entry. Rogue One, the backstory of how a brave group of rebels transmitted the evil Empire's Death Star plans aboard the rebel ship in what we know from the opening of Star Wars (aka Episode IV). I want to start off by saying I really enjoyed Episode VII last year, I thought it was a good spring board for Disney to find their footing in reinvigorating this franchise that was considered dead by the majority of fans. I can understand why they wanted it to feel similar beat wise to Episode 4. To really introduce us to that familiarity of Star Wars we remember. One of my biggest problems however with the film was knowing that the First Order, will never be like the Empire, Kylo Ren will never be like Darth Vader. It just didn't give me that feeling of a new threat, but rather a less interesting impersonator. My first positive about Rogue One is that there's a sense of warmth and familiarity seeing the original Empire again with their variations of armor like the classic white, or the scout troopers from Endor. Whether you enjoy this movie or not, you gotta give props to the people who designed the sets, the costumes, and whoever cast the old characters from the original trilogy because wow. All these factors felt like it just never left the 80's and it makes the world feel timeless and authentic, Garreth Edwards already gets a gold star for doing that. The performances are another strong point, the obvious standouts were Donnie Yen as Imwe along with his partner and Alan Tudyk as K2SO( holy cow was he fun to watch). However I have to say both the film's leads I feel like aren't getting enough positive feedback, Felicity Jones plays a relatable scoundrel in Jynn Erso who understandably has depth with the amount of weight on her shoulders. I don't want to spoil it here but it just goes to show how Disney isn't just giving us perfect female characters with no strings attached, Jynn has a lot of blood on her hands and understandably so. Diego Luna as Cassian Andor was a surprise for me because he brought an interesting spin on someone you expect to be this daring hero of the rebel alliance. There's a moment in the film that genuinely made me question if the rebels were always in the right, the Empire ruined the lives of many people and this movie did a good job of showing how much the alliance was willing to put on the line no matter what it took. It gave me a sense of truth that maybe these guys weren't always perfect and that they made decisions they weren't always proud of, especially through a character like Andor. My last major positive of the movie was indeed as everyone is saying, the third act. It puts the War in Star Wars and contains some of the best action in the series to date. It's explosive, it's exciting, it feels urgent even though you know what's going to happen. And the finale is just so well done it's almost alone worth the price of admission. Now unfortunately as the movie has a lot of good, the film is flawed but then again so is the original Trilogy no movie is without sin. The absence of John Williams is really noticeable here and I can tell Michael Giachino tried his best emulating the Williams sounds and beats, but it most of the time just lost it's way and didn't provide any really unique pieces like Episode VII did. The film's plot got a little muddy in the beginning because I was really lost in the first act with all the character introductions. We jumped from one planet to the next in a guardians of the galaxy like montage with a small title telling us what planet it was. This was just super distracting to me because not only was it moving too fast for the first act build up, the montage just didn't feel Star Wars like at all. They already got rid of the opening crawl and just gave us the opening title which was fine, but there was something off by introducing the planets through subtitles that seemed unfitting for me. Like ""Yavin 4, headquarters of the Rebel Alliance."" Like really? How could someone not know what that is if they've seen episode 4? Anyway, so where does this movie stand for me compared to the others? Well I would say it's fantastic and enjoyable enough to be in my top 3, better then 1-3, and I will say I liked it better than 6-7, but not better than 4-5. I think the hype might be getting to much to people, I'm looking at you Kevin Smith. Overall though Rogue One was one hell of a ride and the important thing is I felt the Star Wars, it had this emotional punch that made me want to go right back in and see it again the third act was unfreaking believable. Even with the absence of a Jedi hero, the Force was strong with this one. It just goes to show me Disney is continuing to give the fan base the good stuff, hopefully this movie will open doors for them to explore more characters and potential stories that go beyond the Skywalker family because it's such a magical world that always sucks you in no matter what movie it is. It's not a perfect movie, but it deserves that 10/10.",7.0,Anonymous,"Action, Adventure, Sci-Fi"
Prequel In Disguise,"At first glance Rogue One looks the part. However the great cinematography, interesting locations, and classic Star Wars aesthetic are merely a veneer, a carefully crafted charade that hide the superficiality underneath.The film is not devoid of value. The action sequences are good and certain elements of the story are interesting.Possibly its best but least explored dynamic is the class divisions within the Rebellion itself. At the top are upper-class elites who are timid about getting their hands dirty and on the other side are hardened extremists like Saw Gerrera (Forest Whitaker) who is an inverted Darth Vader, kept alive by a mechanical apparatus.However, despite a few genuinely fun moments, the film does not stand up to hard scrutiny upon second viewing, nor does it actually add anything of significance to the franchise.The dialogue is clunky and repetitive.The characters are two dimensional and none are really given enough time to develop.The plot is generic and doesn't take any stylistic risks, sticking to a very familiar Star Wars structure.The pacing is too fast, constantly moving from location to location.The music lacks the subtlety, sophistication, and acoustic quality, of A New Hope's.The cameos are buoyed by unconvincing performances that, for a film so obsessed with banking on nostalgia, should have looked and sounded exactly as they do in the following film.Rogue One could have been an interesting experiment into fusing different genres into the Star Wars franchise, but it ended up as a generic filler film that fills a gap in the narrative no one needed to have filled.As a mindless action film that puts you in the space of the Star Wars Universe it's effective, but as a story that adds any value to the Star Wars lore it isn't.",5.0,Anonymous,"Action, Adventure, Sci-Fi"
Loved it!!,"Non spoiler Rogue One review: I LOVE, LOVE, LOVE Rogue One. It's simply amazing movie. Battle scenes are most amazing battle scenes in any STAR WARS movie, because you feel for characters and even for soldiers you don't even know. Characters are very unique and lovable, also, not every character is good or bad, characters have their flaws, and they are not perfect, and that's what it's so amazing about them. Last 10-15 minutes are my favorite minutes of STAR WARS movies, space battle is best space battle in any STAR WARS movie, and Vader is simply amazing. I couldn't even dream to see what he did in last 5 minutes, even he has only 5 minutes of screen time, You won't be disappointed by Vader. Score is not so great, and especially one character feels weird to look at (You will know why) but after all, after first viewing yesterday, For me it is better than The Force Awakens, because they gave us something new, and they are not afraid to risk, while TFA played on nostalgic a lot, even I liked it a lot. There are some cameos I loved, some Rebels vehicles and characters appear or they are at least mentioned, humor is great for the most part, and nothing felt forced. You can literally watch Rogue one, skip A new hope opening crawl, and watch A new hope, cause it ties perfectly together. I would give Rogue One 9/10. Going to watch it today and tomorrow again, so we shell see if I like it even more.",10.0,Anonymous,"Action, Adventure, Sci-Fi"
