title,content,rating,username,genres
Closer to the Original than Awakens...,"I am an original Star Wars Fan, I was 11 when I saw the original in 1977. I rode my bike to the theater, 17 times that summer, where I paid the matinÃ©e price of $0.99. I audio recorded the movie on a portable cassette deck and played it under my pillow for almost a year. I could recite the movie verbatim for most of my adult life!So, when I say that this is the best Star Wars since Empire, and you are over 40, You will not be disappointed!The film makers duplicated many camera angles, lighting and mode of the original Star Wars, including many CGI and look alike minor (and a major) characters. This is a great feeling to be connected with some of the original excitement a movie goer had in the late 70's early 80's releases.Yes, there is no Light saber duel. Because all the Jedi, excluding Yoda and Obiwan, are dead remember?The boring objections are there because there is actually a story here and ADD movie goers are going to be disappointed...",10.0,Anonymous,"Action, Adventure, Sci-Fi"
A Real Review of Rogue One- A Star Wars Story,"First off I will like to give praise and thanks to director Gareth Edwards.Finally someone has brought a movie that ADDS something to the Star Wars universe not diminish it. That being said Rogue One is easily the best movie of 2016.The millons of Star wars fans who waited in lines,spent crazy money,and had high hopes for The Force Awakens, your memory of that trash has been Erased. From the characters,storyline, and the fantastic visuals, this movie is grade A. Rogue One is long lost- Real- Star Wars Movie that fans have waited over 20,25 ,30, well any year to be released . This move was done right and this I cant say was done for the garbage that was Force Awakens. JJ Abrams should be embarrassed the trash he put on screen last year. Rogue One gives me hope Disney will do something good with the Star Wars name.",9.0,Anonymous,"Action, Adventure, Sci-Fi"
"A welcome addition to the universe, but misses the greatness of the better Star Wars movies...","After the resounding success of ""Star Wars: The Force Awakens"" Lucasarts Studios has rewarded the loyal Star Wars fans with a film that would introduce us to the story about how the rebel alliance exactly got to the plans of the ' Death Star' in the beginning of the movie where it all started. In this way, the film builds on the success that Star Wars with her first 3 films has amassed, which is a very smart choice. We can't exactly say the same about the prequels sadlyÂ…Say what you want but the pre- quels were now not really a bull's eye. The story focuses around Jyn Erso (Felicity Jones), who from an early age since losing her parents, took on a rebellious path which has proved quite troublesome for The Empire apparently. When she meets Cassian Andor (Diego Luna), a member of the Rebel Alliance, she unwittingly lands into a plot against The Empire. Gradually the two in contact with various individuals who all have reason enough to join the group. The most notable of which are the duo of Chirrut ÃŽmwe a blind (force wielding) ninja-like fighter, his best buddy Baze Malbus and K-2SO ( a hilarious re-programmed Empire-droid, with a great use of sarcasm). The mission sounds simpler than it seems: getting a hold of the plans of the Death Star to prevent the whole Galaxy being under the power of The Empire.The 'Star Wars '-label on this film is both a curse as a blessing: on the one hand it brings the return to this ""Galaxy far far away"" nostalgia back. The grim post-apocalyptic atmosphere that the original trilogy had as well,finds its roots deep into this movie as well, the visual effects, the costumes and the overall atmosphere throughout this movies is a joy to watch and something you don't really find in a lot of movies nowadays.On the other hand, the fact that this film was clearly as a story 'leading up to' (although is already 40 years old) A New Hope, makes the film also firmly limited in its freedoms: While this movie has created so many things you want to know more about, the movie simply doesn't have enough time to go into much dept about them. The characters suffer the most here. Outside the main character, Jyn Erso, none of the Rogue-One group members get a lot of time to develop their backstory, their motives of really much of an arc. So you feel little to no involvement when they are in danger during the suspenseful scÃ¨nes. You just know too little about these characters to experience a real commitment. When u have already seen the original trilogy (as I suspect you did), you also kind of know where this whole story is going. While this is not fully deal-breaking, it does take away a bit of it stakes throughout the movie. The film is also rather slow start during the first part and it really takes a while to get the movie going. The first half of the movie does need quite a long time to orient the events in the universe and sometimes this feels orchestrated. I had a feeling that throughout the movie the paths of the characters were already pretty much set and this gave me a a bit of a compromising experience. However, the biggest problem that this movie will probable face is the fact that it made bad use of its. By putting our most favorite bad guy in the Galaxy in the trailers a lot of Star Wars fans had high expectations for the screen time that Darth Vader would receive during the movie. Unfortunately Darth Vader only appears 2 scenes. Although one of the scenes was absolutely amazing to watch (you will know it when you see it), I can't deny that I was a bit bummed out by only seeing him this much. That being said, Rogue One does contain at his core something where every Star Wars fan instantly falls in love with. The fact that Rogue One also answers some questions where a lot of fans have been waiting for 40 years for, does make this movie relevant. There are also some very nice treats for the very attentive fans amongst us, who will be rewarded for knowing and remembering all of their Star Wars-trivia (bonus geek points!) Last but certainly not least the movie is also surprisingly funny, much credit here for goes to the sarcastic droid K-2SO (voiced by Alan Tudyk). All in all this movie is a welcome addition to the Star Wars universe. Star Wars fans that don't get their expectations too high will undoubtedly enjoy this movie. If you previously, however, weren't Star Wars fan was, this movie will not suddenly win you over.Conscensus: don't go with too many expectations to this movie (not sure if you have a lot of Darth Vader expected). The film comes when slow start but once the action starts, both action-fans as Star-wars lovers really enjoy this movie. You also want to watch' A New Hope ' again right away!",7.0,Anonymous,"Action, Adventure, Sci-Fi"
Outstanding!,"Without doubt, the best addition to the franchise since 'Empire strikes back'I was skeptical about this film because the amount of hype and following disappointment of 'The force awakens' left me with no hope at all for any upcoming star wars films... but Rogue One, you've given me a New Hope!The whole structure for the film was thoroughly constructed, nothing dragged on, and each scene played and important part. I was constantly on the edge of my seat that my partner had to tell me to calm down every so often! If you're a huge fan of the franchise, you will notice a lot of great nods to the original 3, but ill let you discover those.The acting was superb, I didn't cringe once from any line given, but out of every character, K-2SO won my heart!You don't want to miss this one in the cinemas, so grab a ticket before it's too late! You'll be blown away.",10.0,Anonymous,"Action, Adventure, Sci-Fi"
absolutely perfect,"Came into this sceptical given how hollywood likes to push political narratives and plot armor, but this was a refreshing surprise and loved every minute of ita well done prequel building up towards the first movie, explaining how events unfolded to get to where things all began for us all back in the original trilogyi especially liked that the movie actually allowed the heroes to die off, showing their sacrifice for the greater cause, the last 3 star wars movies made the heroes far too invincible to be believable or likeable, rogue one conveyed more depth by actually allowing characters to risk and lose everything as long as they contributed to the alliance itself winningthis really captured the essence of star wars.",10.0,Anonymous,"Action, Adventure, Sci-Fi"
Will surely please hardened fans and newcomers in equal measure,"Following their procurement of Lucasfilm and the Star Wars franchise with it, it didn't take long for Disney to announce an all-new trilogy, continuing the legacy that was somewhat tarnished by George Lucas' terrible prequel trilogy beginning back in 1999. J.J. Abrams' The Force Awakens, aka Episode VII, predictably made a ton of money in 2015, despite being a thinly-disguised re-hash of Episode IV with a few new characters thrown into the mix, and soon enough announcements were being made of spin-offs and origin stories aplenty. Many rolled their eyes at what appeared to be an easy money-spinner, but many more were excited to see this vast universe - which had been explored to no end in books, video games and comic- books - come to life on the big screen, and Gareth Edwards' Rogue One is by far the finest Star Wars movie since The Empire Strikes Back.Set some time after The Revenge of the Sith but just before the events of A New Hope, the universe lives in terror as the Imperial Empire, led by the feared Darth Vader, seeks to crush the Rebellion and rule the galaxy. Galen Erso (Mads Mikkelsen) is forced by Imperial weapons researcher Orson Krennic (Ben Mendelsohn) to complete his work on the Death Star, a device the size of a moon capable of destroying entire planets. Galen's young daughter escapes the Stormtroopers and is raised by Rebel extremist Saw Gerrera (Forest Whitaker). Years later and now a young woman, Jyn Erso (Felicity Jones) is freed from a labour camp by Cassian Andor (Diego Luna) and is taken to Rebel leader Mon Mothma, who convinces her to help persuade her father to defect so they may learn more about the weapon he is building. Joined by a rag-tag gang of fighters and criminals, Jyn unwittingly finds herself at the centre of an impossible mission to steal plans to the Death Star, and playing her part in rescuing the universe from oppressive rule.Continuing the series' line of strong female leads after Carrie Fisher and Daisy Ridley, Jones' Jyn Erso stands out by not being a princess or a 'Chosen One' character, but a tough orphan without any stand-out skills other than sheer will and determination. She doesn't get any special treatment due to royal connections or suddenly start wielding the Force, but must shack up with an equally gruff and battered gang of unlikely heroes to stand any chance of survival. Her companions are as equally memorable and played by strong actors, without ever being defined for a unique attribute. With C-3PO off elsewhere, the comedy robot is K-2SO, a re-programmed Imperial droid voiced by Alan Tudyk who offers the movie such much- needed comic relief. There's also blind spiritual warrior Chirrut Imwe (Donnie Yen, who really looks like he's enjoying himself), his gun-wielding mercenary pal Baze Malbus (Wen Jiang), and defected pilot Bodhi Rook (Riz Ahmed).Any fans who adored the Easter eggs barely hidden in The Force Awakens will be pleased to know that there's no change here. As the timeline inevitably crosses over with A New Hope, many faces and events will be familiar. Even Peter Cushing is brought back via some impressive CGI work as Grand Moff Tarkin. Edwards ensures that these crowd-pleasing moments of nostalgia don't distract too much from the central plot, and he really goes all-out with the action scenes. Apparently, futuristic helmets were placed upon the heads of real soldiers in old war photographs by Edwards as an idea of how he felt the aesthetic of the battles should be. They pulled it off, as there's a real immediacy and grit to the fighting. and a clarity in the way it is captured. Donnie Yen going to town on some Imperial soldiers with a staff provided, for me at least, the film's highlight. While the film does move too fast for its own good on occasion, this is a thrilling experience, with characters far more interesting than those involving in the main story. It will surely delight hardened fans and newcomers in equal measure.",7.0,Anonymous,"Action, Adventure, Sci-Fi"
Possibly The Worse Movie Ever made,"I am a huge Star Wars fan. Rogue One is totally lame. This is the worst movie I have ever seen, forget Star Wars for a second, even as a stand alone movie it was utter rubbish. The acting in general was good except for Forest Whitaker who was way over the top and cringe worthy as was Donnie Yen. The CGI was good and gave the movie the Star Wars feel but the script was criminal and weak.If you are a fan of Aliens and the movie Predator, as I am, and somehow found yourself watching AVP and being hugely let down then Rogue One will have the same effect on you.It was so boring, i felt like going home and opening YouTube and watching a fan made Star Wars movie instead, they are no worse than this garbage.We all know that Star Wars movies have got worse over the years but to make a film as bad as this takes skill! I cannot believe movies like this are allowed to be made. It was a monotone attempt. Do not bother watching this, you will only ruin your childhood memories of Star Wars.The reviews on this site claiming the movie was good probably worked on the movie or are bought reviews. This was sooooo bad. It should have never been made.",1.0,Anonymous,"Action, Adventure, Sci-Fi"
The Prequel That Should Have Been,"""Rogue One"" is somewhat an anomaly; it's the first non-Episode Star Wars film, set before the events of the original 1977 film, that is meant to show what led up to those events occurring, portraying the mission to retrieve the Death Star plans. The question is, does it live up to what it sets out to accomplish? In my opinion, yes, with a few issues along the way.One of the things this movie gets right is how much it ties into the Star Wars Universe. You have characters from both the prequel and original trilogy showing up here in the form of cameos or even as main plot devices. While some of these additions can feel forced at times, I would not have taken any of them away, and it reminds how connected this film is to the others.I also enjoyed, for the most part, the new characters. Felicity Jones does a good job as Jyn Erso and carries the movie well. We get to know a great deal about her backstory and the connection with her father (played by the always awesome Mads Mikkelson), which plays a huge role in the film. Diego Luna does a good job in the supporting character role, and his characters shows you a different side to the rebellion that we haven't seen before. Alan Tudyk is great as the comic-relief robot K-2SO, and Donnie Yen is great as Chirrut Imwe, who was a cool, almost Jedi-like character (he's not, in case anyone is wondering).The action is intense and fast paced, particularly in the film's final act, which is outstanding. You feel the intensity of every moment and the grittiness of the war that is going on. I'm not sure I would go with those who are saying that is a totally dark movie, but the film does end on a very bittersweet note that actually packed a lot of emotion within it. Visually, the film is also stunning, with most of the visual effects exceeding. Again, I love that they are using both practical and visual effects, something I look forward to see more of in the future.The film also does something that most prequels (including the Star Wars ones) fail to accomplish: it adds to the original. It fixes plot holes that were found in the original, but it also adds weight to the events found in A New Hope. You understand the gravity of this situation, how important it was and how much sacrifice went into it. It's nice to see this film accomplish that.And then of course we have to talk about Darth Vader, who plays a small but significant role in the film. This is the first time in the history of Star Wars that I was truly afraid of what Darth Vader could do. He's not in the film much, but nonetheless this is some of the best we've ever seen from the character, making you forget about the whiny Anakin from the prequels.Of course with any movie, there are flaws, and Rogue One's problems mainly have to do with its story, the character development in particular. There are some characters who were fleshed out fine (Jyn, Cassian, etc.), but then there were others where you didn't really get to learn the motivation behind their actions. I would have liked to have learned more about some of them. I also felt like the story, while overall consistent and well-written, was edited together very oddly. In the beginning of the film, we jumped from several different moments within the span of a couple of minutes. This may be due to the re-shoots that occurred a few months before this film's release, but still, it did feel like it could have been done better.Also, as good as the visual effects were in this film, there was a case of motion capture that I felt didn't work. I won't reveal which character they recreate, but anytime that character was on screen, it took me out of the movie. Sometimes it looked fine, mostly when the character was standing still, but whenever we saw their mouth move or their facial features, it reminded me of a video game. Another time it was used for a different character and it looked really good, but still, I think the motion capture could have been worked on a bit better.However, despite my problems with the movie, ""Rogue One"" is a phenomenal addition to the Star Wars universe and is, in many ways, the prequel that should have been. This is what many people, including myself, wish the Star Wars prequels had been, because not only does it connect the dots between films, it also adds weight and importance to the events of the original Star Wars. It may not be perfect, but with this film, Lucasfilm continues to prove that Star Wars is back and better than it has been in a while.",8.0,Anonymous,"Action, Adventure, Sci-Fi"
Rogue One: A Star Wars Story. And What a Story.,"Rogue One is a Star Wars film wholeheartedly, but it does make its own through showing a story that is an entertaining and necessary entry in the classic saga. This is a Star Wars movie unlike the ones, in that there is no opening crawl; instead we have a prologue developing some backstory on what's to follow. That may throw some audiences off for a bit, but what follows is a ride and a real experience and mandatory big screen viewing.I loved this film. Rogue One surprised me; and I'm sure it will surprise many others after the majority of audiences have seen it and finally give their thoughts on the movie. Despite the reports of reshoots covering a reported 20-40% of the story, Rogue One overcame all of those problems and gives a thoroughly entertaining experience that doesn't feel at all like boring or by-the-numbers canon; and for that I congratulate Gareth Edwards. If only I could actually shake his hand with him in person.Is Rogue One flawless? No. Does it need to be? No. Does it provide genuine entertainment and escapism for your hard-earned cash? Yes; absolutely. And don't worry. It doesn't bog down into unnecessary exposition or anything like Episodes I & II suffered from. Rogue One gets right down to the action and shows a story of war and the devastation it leaves in its wake. But never forget that there's always hope.'Rebellions are built on hope'- Jyn Erso.And yes; The Force is strong with this one.",10.0,Anonymous,"Action, Adventure, Sci-Fi"
Had a Blast!,"I usually don't like war movies, they're something my dad and younger brother like very much, but for me, they are too loud and the camwera never stays steady and there's little to no romance or cuteness. Not in the Star Wars universe! Especially under the watchfuil, talented eye of Kathereen Kennedy. This smoothly moviing epic tale involves a love story, family matters, cute aliens, mean villains and lot's of heart. The excellent lead character , Jyn Arso is a heroine I could get behind, as a girl she reminded me of me and I was instantly involved in her sweeping story, filled with adventure and excitement as soon as she is freed from her *spoiler* prison and asked to join the rebellion team in which she bravely and bodly accepts! You won't be let down by this blockbuster, as good as the best of Star Wars, especially The Force Awakens! The supporting cast was fun too, especially the robot guy. I hightly recommend this film to all my girl friends!",10.0,Anonymous,"Action, Adventure, Sci-Fi"
The only Star Wars series I like since the original or first one of the trilogy's!,"It's not always the plot or the story that makes the movie. It takes a special kind of personality like Felicity Jones ! Being Italian gave her looks. Growing up in the industry got her step in the door industry. She married Charles Guard in June 2018, In December 2019. Their son was born in April 2020 Careers was establish from the time of a teenager. Being she was born in October she's a hard worker. She's determined to succeed from humble beginnings she has excelled.Her looks also derive not from genealogy necessarily but the fact that October is one of those months in which beauty is bestowed on women anyway.Being my mother was born also on October 18 she has passed as do all of us in our time is up.If she keeps her self she might live to be 95 but if she divorces the that will dissipate to less years if she remarry it will even go down more.Your future Felicity Jones,""From everyone who has been given much, much will be demanded; and from the one who has been entrusted with much, much more will be asked"" (Luke 12:48).Jesus had just told a parable about being ready for His return. His disciple Peter asked if the parable was for just them or for everyone. Jesus replied with another parable in which He defines the ""faithful and wise manager"" as one who gives out food and other allowances ""at the proper time."" When the master returns and finds the faithful servant managing his resources well, he ""put him in charge of all his possessions"" (Luke 12:42-44). We have been entrusted with certain things, and faithfulness requires that we manage those things wisely and unselfishly.God gives us resources such as finances and time, talents such as culinary skills or musical ability, and spiritual gifts such as encouragement or teaching. We should ask God for wisdom on how to use those resources and commit ourselves to expending them according to His will so that He may be glorified. In regards to spiritual gifts, Paul said, ""We have different gifts, according to the grace given to each of us. If your gift is prophesying, then prophesy in accordance with your faith; if it is serving, then serve; if it is teaching, then teach; if it is to encourage, then give encouragement; if it is giving, then give generously; if it is to lead, do it diligently; if it is to show mercy, do it cheerfully"" (Romans 12:6-8). This is simply responsible stewardship.",7.0,Anonymous,"Action, Adventure, Sci-Fi"
Not bad way to begin the saga,"Upon a second viewing of this movie I got a better understanding of the saga's backstory. Of course, it like all Star Wars movies has too much fighting. I again was surprised by the ending.",7.0,Anonymous,"Action, Adventure, Sci-Fi"
Why so serious?,"Rogue One is a quality movie. However I have a hard time seeing it as a star wars movie. It's very dark and depressing throughout the movie, Even the prequels, which were absolutely horrible movies, were more fun then Rogue One. Also in the begging of the movie the movies cuts to like 3 locations in 5 minutes. I know they want to build the setting, but its too much. I still find this movie quite enjoyable and it deserves most of the praise it gets, however it will never be a true Stars Wars.",7.0,Anonymous,"Action, Adventure, Sci-Fi"
Mind blown. I thought I'd never experience Star Wars this way again since 1977,"...when I was 3 years old.This movie had me literally at the edge of my seat, hands sweaty. I couldn't stop staring at the screen. I felt I was, once again, piloting an X-Wing. I felt the excitement I thought I'd never feel again. I felt fear when the most famous bad**s of all time was back. I was exhilarated. I cried. I cheered. I had a new hope at the end of it all.This is what the prequels should have been, instead of the garbage Lucas dumped on us. This is what we deserved all along. This is Star Wars, all grown up. And it's better than it ever was.I'd consider this as good as Star Wars; better than every other movie, and quite frankly, far better than I could have ever expected.Thanks Disney. You have definitely saved the franchise.",10.0,Anonymous,"Action, Adventure, Sci-Fi"
Blows the water out of the water!,"After I was let down by The Force Awakens, I was unsure if Disney could handle Star Wars properly, this film blows the water out of the water! Everything is just perfect, and the plot was original, the characters were likable and nothing was forced at all!If you said ""I'm done with star wars"" after seeing TFA you are missing out on a film which truly feels like the other 6, no silly modern rubbish involved, just dedicated story and no Michael Bay style explosive plots!So there you have it, a true film of epic proportions that ties in so well with the star wars saga, Gareth Edwards has a bright future ahead of him and I hope to see him create some more truly splendid works!",10.0,Anonymous,"Action, Adventure, Sci-Fi"
