title,content,rating,username,genres
Not quiet a 10 but Rassell Crowe makes a good effort here.,"From the very moment I started watching this movie, I could see parts of Crowes former characters bleeding through his performance. A little bit gladiator (The Gladiator), a bit of the gun slinger (3:10 To Yuma), and even a bit of the wine maker (A Good Year). But by the end of the film you see him as the character he plays in this film. His portrayal of an Australian dad in search of his sons does come shining through by the end.As the films director, Crowe shows the influences of Ridley Scott's mentoring. And that is a good thing because Russell has played the lead character in several of Scotts movies, and they were all good films. So, I would have to give Crowe a big thumbs up on his direction. I do get the feeling a lot of this movie wound up on the floor of the editing room.As far as the story goes, it is well written but does get slow a few times and seems to wonder off track a few times. But this should not keep you from watching this film. The ending is a little twisty but the final payoff is worth the sluggish plot line.Not a true war story, not a love story and not even an action movie but a little bit of all of these. Definitely worth a watch!",8.0,Anonymous,History
Full of emotion,"Remarkable point is the reality.Exactly, this movie is expressing the truth about Aussie and Turkish people's sufferings of The WW-1.If you are keen on history. you ought to watch this movie.Also this movie is not about politics.Movie's songs are lovely and full of emotional, particularly the song that name is 'Love was my alibi' by Kris Fogelmark is incredibly emotional.If you really understand spirit of the movie, you may cry.",10.0,Anonymous,History
A favorite movie,"This is one of those movies that you just can't forget. Russell Crowe is excellent as the grieving father of three sons thought to be killed on the battlefield. I'm not going to quibble about the politics of the war; but the aftermath shown in this movie was so moving. A lovely romance, a lost son found, and a warm friendship develops with his erstwhile enemy. Who could ask for more?",10.0,Anonymous,History
Russell Crowe's love letter to the Turks,"THE WATER DIVINER is a family drama set in the years following Australia's disastrous foray into WW1, the Gallipoli campaign. Russell Crowe plays a grieving father whose three sons all vanished, presumed dead, in the battle. Spurred by an old battle diary he decides to travel to Turkey to find out the fate of his offspring for himself.This is a film that seems to have been devised as an ill-conceived history lesson for Australian viewers. Certainly as a movie it's not very interesting, lacking life and vision. There are a handful of flashback battle sequences in the film which play out all the clichés, and the present day material involving Crowe's character isn't very good. His romance with Olga Kurylenko (utterly out of her depth in her attempt to play a Turk), clumsily shoehorned into the story, is quite laughable.Elsewhere this veers between maudlin introspection and old-fashioned jingoism. What's most surprising is the blatant way this film whitewashes history, with each country being stereotyped to basic levels. The British are humourless, dour, and unfriendly; the Greeks are evil; the Aussies are gentle and heroic; the Turks are misunderstood. It's basic stuff indeed and portrays certain events in surprising ways given the complexity of the real-life historical situation. The climax is as predictable as they come, and although Crowe employs decent cinematography in his directorial debut, he just doesn't have the power to bring a lacklustre script to life.",4.0,Anonymous,History
A Beautiful Fairy-Tale About a Devastating Subject,"Mention Gallipoli to Anyone Not Directly Tied to it and Anyone with a Historical Deficit and You're Likely to Get a Blank Stare.But to Anyone with Ancestors Involved in WWI or Certainly Australians, the English, Turks, and Greeks, will Undoubtedly Have a Strong Emotional Opinion About Gallipoli. So This Directorial Effort from Russell Crowe has Become Quite Controversial Cinema.It has been Attacked for its Propagandizing Certain Aspects of the Events Surrounding Gallipoli and Geopolitical Situations Both Then and Now. This Review Is Not and Will Not be Critical of the Historical Inaccuracies or the Political Motivations Behind the Movie.This is a Beautiful Looking Exploration of a Very Ugly Time When a World was at War and the Horror and Slaughter and Genuine Display of ""Man's Inhumanity to Man"" was Present.Behind the Scenes the Manipulation and Propaganda of the Masses was Evil and Intentional or Otherwise was as Devastating and Destructive as the War Machinery, Chemicals, and Disease.This Film is a Fantasy. A Dream. A Fairy-Tale Told from the Perspective of an Australian Father Suffering the Loss of His Three Sons and His Wife to the War. He Embarks on a Vision Quest to Divine the Whereabouts of His Sons After the War.But the War Hasn't Ceased and He Finds Himself in a Foreign Land and His Magic Carpet Ride is Just Beginning. The Movie Romanticized His Post Traumatic Story and is Entertaining and its Concern Seems to be Story Telling of the Fictional Kind Set Amongst a History that To This Day Can Evoke Strong Emotional Blowback and Various Visceral Reactions.This, Like the ""Arabian Nights"" is Fantasy, Fiction, and Mystical Storytelling.",8.0,Anonymous,History
Watch it!,"Even though there are some clichés, it's a quality movie. You won't get disappointed.",10.0,Anonymous,History
Brilliant film with perfect cast,"It always a pleasant surprise when a famous actor turns out to be a great director - particularly since it happens so rarely! Russel Crowe definitely belongs to those rare few.
He has made essentially the perfect movie, keeping the delicate balance between a family drama, love story and historical war depiction.
Very well cast, beautifully filmed and with a skillful use of music.
This film leaves you with a good, hopeful feeling and a conviction that there are people out there who understand the humanity in all cultures and that every battle has two sides.",10.0,Anonymous,History
STILL ONE OF THE BEST MOVIES,"Feelings and emotions are so palpable in this movie, this level of emotions is beyond acting, great work",10.0,Anonymous,History
Never give up. Focus!,"Too often we find ourselves wrapped up in yesterday struggling to make today. The hope for what could happen tomorrow can become obscure if we lose our perspective. This is a movie that brings that determination to the forefront in a way the pulls you along with the sights, sounds and raw emotions of a pure love, a dreadful war and an inspiring dream. Russell Crowe leads us from yesterday into the future without missing second along the way. See this film with friends, family or immerse yourself in it. The journey is harsh and real but one that refreshes the spirit and encourages you to never give up on anything you love.",10.0,Anonymous,History
Very boring movie,"Turned this movie of after one hour because absolutely nothing interesting at all had happened. The first hour could have been done in five minutes. I am not an historian Greek, turk or Australian. If you want to see an entertaining movie try something else. The story is not interesting at all what so ever. I am just writing not to fill up the minimum ten lines because there is absolutely nothing to say about this movie. After one hour of this movie you will just hope he find three corpses so the movie would end. Total wast of time. I guess this film was made for turks or Greeks or what ever, not for entertainment at least.",1.0,Anonymous,History
What a great Russell Crowe movie,"I have never seen Russell Crowe in a bad movie. But this one is one of his best, maybe it is his best. The story, the script, the action, the cinematography, the way it grabs you by the heart. Whoever picked Olga Kurylenko is definitely a genius. She is absolutely radiant, her acting is very good too. She must be the most beautiful actress of the 21st century.Really all of the acting is extraordinary. Too many names to mention. The subject matter is very important as this seems to be like a footnote in world history but it was a very significant battle followed by more and more killing. It shows just how senseless war can be. It also has a lot to ponder in the actions people will do out of love for their family.",10.0,Anonymous,History
it was a successful movie but...,Turkey has been portrayed as a middle eastern country in this movie but this is definitely not in real. This is really disturbing for us!,8.0,Anonymous,History
The Father who went Looking,"Greetings again from the darkness. The lure of the director's chair is sometimes too much for A-list actors to avoid. We have watched Mel Gibson, Angelina Jolie and Kevin Costner have success behind the camera, and now we get Russell Crowe with a story tied to his roots in Australia. The film is scheduled to open in conjunction with the 100th Anniversary of ANZAC Day (Australia and New Zealand Army Corps), a day of national pride and remembrance.Mr. Crowe also stars as Connor, an Australian farmer with a gift for finding water sources in the outback – hence the title. Connor and his grieving wife lost all three of their sons in the Battle of Gallipoli, when Britain and Allies invaded Turkey, resulting in the death of more than 100,000. Four years after the battle, Connor is forced to try and fulfill the promise he made his wife  travel to Turkey, find the bodies of their sons, and bring them home for proper burial.Director Crowe, working with Oscar-winning cinematographer Andrew Lesnie (The Lord of the Rings: The Fellowship of the Ring), delivers a film that looks exceptional  both in its widescreen vastness and beauty, as well as its more intimate moments (though the heavy dose of amber glow is a bit too much early on). Flashbacks play a key role and the battle scenes are brutal and realistic, as is a monstrous sandstorm that engulfs the young sons in a moment designed to convince us that Connor was a protective father, and carries the guilt of allowing them to fight the war.Connor's trip into Turkey allows for the clash of cultures, as he is truly an unwelcome guest and a proverbial fish out of water. If not for the enterprising young boy that guides him through some tough spots, Mr. Connor's trip may have been short-lived. Instead he struggles through clashes with the British, the Greeks and especially Turkish Major Hasan (an excellent Yilmaz Erdogan).While the cultural and personality clashes are entertaining, the stereotypes and simplifications are somewhat tougher to accept. A romantic interlude with the hotel owner (Olga Kurylenko) is maybe the most out-of-place segment of a dramatic movie we have seen in awhile. Crowe and Kurylenko are both fine actors, but this makes little sense and distracts from Connor's mission. We can only assume the Producers demanded a little romance to offset the downbeat war segments and cash in on Crowe.Crowe shows promise as a director, and if the film has any box office success, we can hope he will have a bit more input into what stays and what goes in his next project.",5.0,Anonymous,History
That was awesome,"If you like drama and history, this is the kind of movie you should watch.",9.0,Anonymous,History
Great piece of art,"AmazinG acting and scenery and a very well told story about love, friendship, respect, hope and family.And no, this is not a documentary nor does it pretend to be.The real message of the movie is the stupidity and absurdities of these young men and boys getting killed on all sides just because some politicians think that they have to solve their arguments with a war.",9.0,Anonymous,History
Crowe about a great epic,"This is an epic. It certainly borrows from Legend Of The Falls and a nod towards A Farewell To Arms as narratives.The cinematography is accomplished and the scoring excellent - Forever Blowing Bubbles adds a strange pastiche of emerging Western resonance in a land lurching from imperial servitude to an independent republic.Perhaps most poignantly- and there's a lot of poignant material on offer - we see the turmoil and chaos of humanity counter mining the inhumanity of the ethnic cleansing that is told bravely against hitherto accepted doctrines
There's plenty of love both lost and found and deep sentiment
This is an epic by any definition - lush and unique. Like Bertolucci's 1900 you may not appreciate all the subtlety and nuances at first sight but revisit this masterpiece and it's a masterpiece.",10.0,Anonymous,History
Mediocre,"I really tried to like this film, but in the end, I was left with a flat, empty feeling. The characters failed to engage me, emotionally, and this film was littered with clichés. There were moments of good cinematography, but the scenes seemed to flit about more randomly than a bat on ecstasy. The love interest felt very out of place & forced. I was left with a feeling that the producers were trying to cache in on Russell Crowe's sex appeal. In general, this was a poorly directed film, and even more badly edited. However, it should be noted that this was Crowe's directorial debut, so I guess there is potential for improvement.",3.0,Anonymous,History
Beautiful film that explores wisps of hope found through countless tragedies,"I try to watch as many movies as I can about war, so I added The Water Diviner to my watchlist as soon as it hit Netflix. A movie set after the action admittedly sounded like it risked being boring; however, this was anything but.Russell Crowe plays a stoic, even docile father whose soft-spoken manner doesn't get in the way of his ambition to risk inconvenience, travel, and even injury and death to find the bodies of his sons lost in the Battle of Gallipoli. He knows their date of death and that they died together--nothing else. He travels to Turkey, meeting various characters who either help or hinder his efforts. Jai Courtney (an actor I've been seeing a lot lately who excels in historical roles) is interesting and demanding of attention here in the short time he's on screen. Olga Kurylenko gives a noteworthy performance as Ayshe, and Yilmaz Erdogan's character of Major Hasan was both layered and respectful.The Water Diviner avoids over-dramatizing for the sake of Hollywood drama (save for the last shot of the film, though its inclusion was understandable after the gut-wrenching affair the rest of the film puts its audience through). One must give credit to the film for showing the nuance and various layers to all sides of the war and its participants. Major Hasan (at one point in the movie blamed for the deaths of the brothers) is a complex and interesting character that, in any other movie, could be portrayed as the simple ""enemy"". Instead, The Water Diviner strives to remain unbiased in terms of war and politics and remains focused on the human condition.Action scenes are not scarce in the film, either. The movie actually opens up with one, though more are sprinkled throughout the film as both flashbacks of the Battle of Gallipoli and as new struggles Crowe has to get through as a foreigner in Turkey during a time of unrest. It's not as action-packed as some war movies given its subject matter, but regardless, The Water Diviner never bored me. It did make me tear up during one phenomenal scene showing the aftermath of a charge (men bleeding out, missing pieces of themselves, crying and groaning), and that's usually hard to do. I applaud this film for tearing through my heart like a meat grinder; the brutal realities of war are explored in full here, as is the devastating aftermath on the people the dead leave behind.Overall, I loved The Water Diviner. Full of tragedy and the exploration of the human condition in two cultures on either side of a bloody divide, this was one hell of a movie. I recommend it to anyone even remotely interested in history or war and who can stomach its brutal realities.",9.0,Anonymous,History
Peace at home Peace in the world,"""Those heroes that shed their blood and lost their lives... You are now lying in the soil of a friendly country. Therefore rest in peace. There is no difference between the Johnnies and the Mehmets to us where they lie side by side now here in this country of ours... you, the mothers, who sent their sons from faraway countries wipe away your tears; your sons are now lying in our bosom and are in peace. After having lost their lives on this land they have become our sons as well.""~ Mustafa Kemal Pasha - Ottoman Commander, Gallipoli.",10.0,Anonymous,History
Immediacy in long-distance thoroughfare,"Chasing focus on reality as continuance of existentiality of changes proferred in geo-politics as preferred alternative to high-brow conservativeness in work recorded against no one's credentials is chasing high focus on short sights preceding worldview of social advance in retention of worldviews of self-preservation advanced post warfare only by as much was lost in the untenability of self-preservation as preservation of silos intact in groups of preservation as opposed to groups proselytising preservation for the benefit of mankind, flora, fauna, and the overall expansive shunning of warfare in the making of larger groups of preservation preserved by equivalent rearrangement of losses of geo-politics thereby.",8.0,Anonymous,History
Learn Nothing of that Conflict,"The film, in part, tells that part of WWI, around 1915, involving U.K. forces storming the beach at Anzac Cove; part of the Gallipoli Campaign to fight Ottoman forces. U.K. forces were militarily superior with about equal numbers with the Turks, but they might have been a bit apathetic as they end up losing. Story centers on the Australian contribution as represented by the three sons of an Aussie farmer. Today, still a significant Australian remembrance.Negatives: 1. Although a small attempt was made to show that there is always another side in a war, what we get of the Turks is just movie stuff. The real history of this conflict with hundreds of thousands of dead and wounded is poorly treated. 2. A good part of the film is filled with the usual romantic encounter and discord and distrust. The female part in the movie is unrealistically attractive for the role, thus not too believable. Tossed in is the customary plot hook of her engaging young son to reel in the Aussie who, of course, had lost his wife. 3. More obstacles are placed in our hero's search for his lost sons with unusually cold bureaucratic barriers being placed in his way - to be overcome, of course. Again, not believable. 4. Dialogue was inane. Directing was disjointed in that the film used excessive numbers of flashbacks to explain what could have been given at the beginning and resulted in better continuity to the story. Acting was too predictable and a bit stereotyped. Ending also became too predictable.",3.0,Anonymous,History
Stunning,"I'm trying to think of a reason to give this film less than 10/10, and I can't find one. It's that rarity, a film that succeeds at everything it attempts, that's as insightful and powerful as it is surprising and entertaining.Don't be fooled by the seemingly downbeat premise. And don't expect some kind of hocus pocus about water divining - that turns out to be just a metaphor for something much more interesting. This is a thoughtful film that manages to be exciting, a sad story that's ultimately uplifting. A sweeping epic that's extremely personal.Russell Crowe does a beautiful job as both star and director, clearly supported by a great cast and behind-the-scenes crew.So many movies fail to live up to their promise. This one surpasses all expectations. Don't pass up a chance to see it.",10.0,Anonymous,History
Excellent. Moving story,"An excellent fictional narrative wrapped around the essence of a true story. Something of an Australian Saving Private Ryan
Gripping and well acted. Russel Crowe directs for the first time to great credit. A story that transcends mere sovereignty You don't have to be Turkish or Australian Its anti war.",10.0,Anonymous,History
Movie with some substance,"Generally, I find modern day cinema is a barren landscape of predictable plots, senseless violence, sex and an endless parade of cardboard super heroes. For me, The Water Diviner was an unexpected gem. It may not be a masterpiece, but there is enough here to keep the viewer engaged and moving with the characters. The backdrop of Gallipoli post WWI is presented very believably and the scenery is beautiful. I enjoyed the journey of the main characters and the performance put in by the Turkish woman across from Crowe was unexpectedly spirited. There were many 'delicate' scenes between Crowe and this woman and her son, plus Crowe crossing cultural barriers. I really enjoyed the clumsy honesty of Crowe's performance as he continued to step on toes moving through situations with an aura of Aussie-ness in a culture that was foreign to him. A particularly pleasing aspect of the story was his journey with the Turkish army officers throughout the movie.On the whole, left the film feeling moved and challenged and entertained. Nice work.",8.0,Anonymous,History
Pretty bad and historically disrespectful,"The water diviner with his sixth sense and his superior martial skills make this movie pretty bad. Historical inaccuracies and distortions make it plainly disturbing.
The time this movie takes place is very special for the Ottoman Empire. Before WWI the empire was probably the most multicultural country of that time. Gallipoli is the greek name of the city, at least this is shown in the movie, Turks use a different name. After the war, Turkish nationalism and religious fanaticism rose significantly. Hate and crimes towards Greek, Armenian and Assyrian citizens started during the war and reached the point of genocide. All we see in this movie is how the Turkish suffered from the Greek invasion which started in 1919. 6-7 years after the Turks had set in motion their ethnic cleansing. Yes, of course this bred too much hate from Greeks towards Turks. Greeks are shown as a pile of dirty and purely evil criminals attacking ""all innocent"" Turks, no comment, no context.
A couple years later Turks achieved their ethnic cleansing and the Ottoman Empire became Turkey. Turkey still doesn't recognise these genocides, although many countries do, such as Germany and Netherlands.
Movie ending: ""This film is dedicated to all those who remain lost and nameless and who live on in the hearts and memories of their families"" is just too disrespectful considering these.",2.0,Anonymous,History
The Best WW1 Film Ever,"Objective and realistic. The story brings you into WW1 years, and you can see the situation from all sides point of view. Acting was also amazing, Russell as you know. I liked the Turkish military officers too.If you are interested in history or WW1, must-see.",10.0,Anonymous,History
OVERCOMING JINGOISM IS IDEAL AND ALTRUISTIC,"I""m using my 10 for a must-see message. Crowe, et. Al., convey the uselessness of killing 45 million ""victims"" on a sentimental, personal level. The death of a 61 year old artist by Covid-19 watched through a window by wife and teenage daughter still did *not* move them to get vaccinated. What will it take to end war if the moaning wounded across the fields on that peninsula doesn't move you... we have more work to do and I thank this movie for helping. All my friends will know of my experience here, thank you, sincerely. Lawson di Ransom Canyon, 2021.PS. Short reviews are like dancing to architecture. Our words here are just to let you know that some of us think the time to write about the message and the time to see the message will not be in vain. Please pay this forward. Everyone has the right NOT to be killed and the declaration of human rights is improving, racism is in decline, child hunger is less, knowledge advances and if this still is too short.... I'm at a loss to verbalize how affected this movie is.",10.0,Anonymous,History
Exactly how I imagined it would be...,"I went to see this based upon my feeling that somehow a Russell Crowe- directed film would lift the typical Australian melodrama out of the boring, ocker-centric, shallow-universe drudgery it's so famous for.Well, it didn't do that, sadly, and appears to be a very transparent attempt to appeal to a wide swath of vacant minded yahoos--easily-entertained action junkies and weepy romantics using all the cheap tricks you can think of to get there. . Sorry--no dice, but, I did find some of the Turkish acting to be genuine and uniquely refreshing--but not enough to pull the movie up to any quality standard. No way is this a ""10""--far from it.Kudos for giving some film crews a salary though. A very generous ""4"".",4.0,Anonymous,History
Another great film of Mr. Russell Crowe,"I was really surprised when I realized I was watching a film played and directed by Mr. Crowe. I first came to Father And Daughter(2015) of him, which made me cry a lot in my heart, and when i came to this film, it's still that impression about a family loss man who always loves their kid. But this time, it had a bit romance and love in it. Crowe and Kurylenko did so well about these romance and love scenes in the film, it's not strong, hurry but slow and light. I love the smile of two people in the ending which made me replay it many times, love the ending soundtrack ""Love was my alibi"". I saw some comments saying that some scenes are not true about the war in the past, but with me, that's enough for a film. You did it so well again, Mr. Crowe!",8.0,Anonymous,History
