title,content,rating,username,genres
A Biblical journey across Route 66,"""The grapes of wrath"" plays during the great depression. The ""dust bowl"" causes farmers to lose their farm and sending them on a journey West to California, hoping to find work as a day laborer.John Ford has made many films about men moving West, but most of the time these were adventurous frontier men moving out of their own free will. In ""The grapes of wrath"" men are driven out of necessity.""The grapes of wrath"" is the adaptation of a novel of a liberal writer (John Steinbeck) by a conservative director (John Ford). The result is a film that is fairly critical about capitalism and capitalists.Look at the way the capitalist bosses are portrayed. They pay low wages, oblige their workers to shop in the expensive camp shop and call everybody who stands up for their rights a troublemaker and communist. If necessary they remain order with the help of their own private gangs. It is if you look at a Russian movie in which Sergeij Eisenstein portrays the boyars.In contrast, the government is portrayed as just and decent. A very curious combination in an American movie! Maybe John Ford is not so conservative after all. A year after ""The grapes of wrath"" he would make ""How green was my valley"" about workers in a Welsh mining village.The journey to California is portrayed in a Biblical way, including the crossing of a desert. On the other hand the journey is typical American, the family Joad getting their kicks on route 66.The value of ""The grapes of wrath"" is enhanced in no small part by the cinematography of Gregg Toland. For his work in ""The Godfather"" (1972, Francis Ford Coppola) cinematographer Gordon Willis earned the honorary name of ""Prince of darkness"". In my opinion Gregg Toland earned this title more than 30 years earlier for ""The grapes of wrath"" in which many scenes are very dark and sparsely lit. Gregg Toland went on to become very famous for his use of deep focus photography in ""Citizen Kane"" (1941, Orson Welles).",9.0,Anonymous,History
Review for ART1145- A Highlight of Human Spirit,"""The Grapes of Wrath"" is an all-time classic of American Cinema. It is a movie that still stands the test of time, and in many people's eyes is a masterpiece. The things that really stood out to my untrained eye were the attention to detail in the sets, the great use of lighting, and the passion of the actors.""The Grapes of Wrath"" was directed by John Ford in 1940 and based on the novel of the same name by John Steinbeck. The film was produced by Darryl Zanuck. The story was based on a family from Oklahoma being displaced from their farmland during the great depression. The film depicts the trials and tribulations the family goes through during their relocation to California.Tom Joad, newly released from prison, is the main character and ultimate leader of the Joad family. His character is played by Henry Fonda. While initially coming off as selfish, Tom develops into a caring, compassionate, and strong leader. Ma Joad is the matriarch of the family. She was played by Jane Darwell and she did her best to hold the family together. Jim Casey is another important character. He was a former preacher who Tom Joad brought along for the journey with the family. In turn, Jim did his best helping to turn Tom into a better person. In the end, Tom ended up putting his life on the line for avenging Jim's demise.While the movie was great in many aspects, there are certainly some aspects that perhaps leave something to be desired. It is quite crude with many aspects of the film that are not appropriate for young people. Also, some of language and actions would not be accepted in society these days.In conclusion, all the acclaim of the movie is absolutely warranted. It is a story with compelling characters, a great story line, unexpected outcomes, and does a great job highlighting the challenges of this era and human spirit. It is a must see for anyone interested in American history, and enjoys a film that brings to life the struggles, hopes, and dreams of people.",9.0,Anonymous,History
"Great movie, a travel to the past ....unhappy as it may be.","Like all things we watch, in someway part of us is different afterward, we grow or change in some small way, movies truly make us who...we are. We watch as if we are going threw there story with them .Only protected and safe ...the viewer ...but we see what they see, hear what they hear....but we have no touch or taste...so we get half of a true being there...reaction, if we identity with just one of the characters..the story moves even better for us. You can live someones life in just a few hours, from life to death, ...then walk away...with those experiences, we are now different, changed. Like in this movie, you come away feeling, life can truly suck, and get even more sucky -er, lol but things can get better, and do over time. But mostly, you feel hell my life is great...next to grapes of wrath. :)",10.0,Anonymous,History
A Must-See Film For So Many Reasons - And One of The Very Best,"If this isn't the finest and most moving depiction of the human tragedies that occurred during the Dust Bowl era, I don't know what is. Yet it is much more than that - it is simply one of the finest movies ever made. Better acting you will never see - and while it's arguably (a very young) Henry Fonda's very best film, Jane Darwell puts in a performance you will never forget (and you won't soon forget her final line - one of the most historic, moving and memorable final lines in all of movie history). You can't get a better story than one written by John Steinbeck, of course, and the stark cinematography blazes new territory and remains fresh to this day. Even the ""lesser"" character actors shine brightly here. Who will forget John Qualen's performance as Muley or John Carradine's performance as Casey? ...And that's just scratching the surface. Who doesn't fall in love with and care about the main characters, as they desperately try to survive the rigors of the Depression (and whom among us could withstand the horrors they went through)? This is a real story - one that every American needs to know; there is no exaggeration here. The inhumanity heaped upon the most defenseless during the Depression - as brought out in this film - is something few movies have brought out. This is the quintessential Dust Bowl and Depression film. The realism is incredible. The music helps move you to tears, too. The heroism so many of the characters display is not just moving - it speaks of a time when more people were truly noble. What a cast! What a story! What a film!",10.0,Anonymous,History
Highway 66,"The Grapes of Wrath violates the majority ideology with the unhappy ending. The right of being a criminal. No hope in the American dream. No romantic interest. The crude look at law and businessmen. Poor working class, the struggle for a utopia. The anarchy of capitalism. Communism, union, moving out west, socialistic worlds are all discussed in the film. In the end, no one is to blame for the issues of authority, land, jobs, etc. In the end, the working class (under class) are seen as the people. We are the people! It is a proud ending but far from a Hollywood happy ending.",8.0,Anonymous,History
Famous but boring,"""Wherever there's a fight, I'll be there. Wherever there's a cop, I'll be there."" If you actually make it to the point in the movie where Henry Fonda rattles off his big speech, congratulations. The movie is so dismal, and his voice is so irritating, it's hard to make it through the entire movie all at once.The only redeeming parts of this classic John Ford drama are the supporting characters. Jane Darwell (rewarded with an Oscar statuette and a Hot Toasty Rag nomination) plays the long-suffering mom. She's tough and hardened, and has sacrificed her whole life for her family and the farm. I can never make it past her famous packing scene without crying.Charley Grapewin also gives an impressive, but brief, performance. He plays the grandfather, without his teeth and with a constant palsy. It's very sad to hear his wobbly voice, but it's shades of things to come. To see more of a great thing, rent Tobacco Road to see his Rag-winning performance. John Carradine and John Qualen are familiar faces, even though the box office draw is Henry Fonda. Had he spent the entire movie in his little cap just enjoying some close-ups, it would have been much better. But, we all know his voice is annoying, and to hear him speak line after line of John Steinbeck drama... Well, it takes a very alert audience member.If you haven't seen this classic yet, you'll probably feel compelled to watch it. But don't worry if you don't like it. You're in good company. Try a different Steinbeck; there are many, many movies to choose from.",3.0,Anonymous,History
The Grapes Of Wrath,The Grapes of Wrath I believed that the picture was flat because of how the content was choreographed by John Ford. The negative element was that most of the sequences didn't have a strong substance. The black and white footage aggravated the situation; the reason was that the storyline was crumbling like breadcrumbs. As a consequence I lost fascination in the plot. Because of the terrible director the landscapes were matt with the colour. If it was Hitchcock motion picture the Black and White and the directing wouldn't of been an issue. In my opinion the soundtrack was rushing to the drains because of the instruments that were playing worthless chords. But on the other hand some of the camera angles captured quality moments for an example; far distance and sky view. The phycological element in the content was underneath the surface as John Ford's purpose. A few scenes of cinematography were impressive. I give John Ford's motion picture a 2 ½ /10,,Anonymous,History
John Steinbeck's masterpiece of a book turns out to be equally good as a movie.,"John Ford's ""The Grapes of Wrath,"" adapted from John Steinbeck's novel, is a powerful depiction of the Great Depression. It follows the Joad family, led by Tom Joad (Henry Fonda), as they travel from Oklahoma to California seeking a better life. Ford's direction captures the harsh realities of poverty and the resilience of the human spirit.Henry Fonda delivers a standout performance as Tom, while Jane Darwell, as Ma Joad, provides the emotional core, earning her an Academy Award. Gregg Toland's cinematography uses stark black-and-white imagery to reflect the bleak yet hopeful journey. Alfred Newman's score enhances the film's emotional depth.Tackling themes of poverty, injustice, and human dignity, ""The Grapes of Wrath"" remains a significant and relevant American classic. Its compelling performances and striking visuals make it a timeless reflection on social justice and the human spirit.",8.0,Anonymous,History
great film  from the  golden age,"This is just a terrific film that will touch anyone who has suffered injustice in their life. Amazing how Hollywood has continued to not get the awards correct as Henry Fonda really was the best actor winner for his magnificent performance but the award was given to his best friend jimmy Stewart for Philly Story. Jimmy of course should have won for MR Smith goes to washington the year before! Now John ford made some huge and glorious pics, but he was a despicable human as testified by the great maureen Ohara in her auto biography. Fate deals a cruel hand and Ford deserved what he git in later years for the acts he displayed in his little weasely life. But he could put together a picture as demonstrated by this great film",8.0,Anonymous,History
Realistic and relatable!,"I've always heard of ""The Grapes of Wrath"" but I had never known anything about it. So it was nice to get the chance to view it and see what it was about.I enjoyed how ""simple"" it was. Sometimes I get lost in story lines when there's talk of financial matters and law. It just looses me. This was simple in that were wasn't too much babble about things like that. The characters carried on with life and had real experiences that I could emotionally follow.I did seem to miss out on characters leaving the original party, besides the one that was pointed out by the characters. I did sit here wondering why certain faces weren't around anymore. I was paying attention, but I think it's because black and white movies are hard for me to follow, since I grew up with color. If a character isn't distinct enough, I'll forget who they are and mix them up with others. That would happen in such a story as this, with so many people in it and moving around such a large group.Those are the only two discrepancies I had with it. Other than that I did enjoy it!",8.0,Anonymous,History
Steinbeck at his best,"Born into wealth, it is hard to imagine how Steinbeck could portray poverty in such a personal way. If it is true that great writers write from what they know, it is astounding. Somewhere he possessed an old soul and a feel for real people and real times. East of Eden is another wonderful example of his understanding of pain and , most of all, of love. Henry Fonda was born to play this role. Why he did not win an Oscar for it is amazing. Attempts in later years to remake this epic movie, a waste. Leave perfection alone. Ma Joad, also, cannot, among today's actresses be redone. Perhaps Meryl Streep in another hundred pounds and 30 years. When choosing entertainment for young readers, this movie is one they should be required to see. Sadly, many English classes no longer have required reading. Watching this adaption of Steinbeck is the next best thing.",10.0,Anonymous,History
ok.,"I rated this movie a five out of ten. I rated the grapes of wrath a five out of ten because it was not one of my favorites. Even though the movie is highly rated and people seem to like it I do not think it was the one for me. First off it was black and white and I tried to see past it but it just seemed to throw off the whole movie and just board me. Yes, not all parts of the movie were boring and I liked the plot the whole released from prison and on parole but I just think it could have been much better if it was in color and not black and white. Color just helps me really see the movie and better understand.",5.0,Anonymous,History
Excruciating and beautiful.,"Grapes of Wrath is a really difficult movie to watch. For nearly two hours, you watch a family lose their home, get bullied by the police, starve, and lose half their family members to death. And the despair and helplessness is all captured and presented beautifully. GOW is an extraordinarily directed movie, with a fantastic use of camera and lighting. The cloudy country shots are beautiful. As are the dark, enclosed shots(in a different way), with their contrasting sense of lost confinement. It's a simple thing to mention, but the way Muley lit up when Tom was searching through is home was really awesome. The movie is bitchin.",10.0,Anonymous,History
Love the immiegrantion story,"America was still changing from an agricultural to an industrial society back then. That causes a lot of trouble for people unskilled in any industrial job training. As a country we're going through something similar today in many areas. We're moving from an industrial to an information based economy. Industry jobs are being lost to other nations and older and poorer workers are suffering for it. It's progress I guess, but it takes its toll.Some factory worker who has lost his job for any number of reasons can identify to some degree with the Joads, especially if they've lost a home they owned. For the Joads it was worse because they made their living off the land for many generations, identifying with it in a way that industrial workers could not.Henry Fonda got his first Oscar nomination for Tom Joad. To get the part which he knew he was so right for, he signed a studio contract with 20th Century Fox. That caused him many problems later on, but those are stories for another film review.Tom Joad is a midwest country kid, a whole lot like Fonda himself. Part of the story of The Grapes of Wrath is Tom himself trying to figure out why these economic forces are crushing him and his family and the way of life he's known. In the end when he leaves the Joad family and hits the open road, he's not got all the answers, but he's asking the questions. Tom hasn't figured it out, but a lot of people with many letters after their names haven't either. He only knows that he's got to get in the fight for economic justice.Jane Darwell was in films from the earliest silent films to Mary Poppins in 1965. This became her career part and the mother role of all time. She's what holds the Joad family together in good times and bad. That's what moms do and get little recognition for it. Except in this case by the Motion Picture Academy.John Carradine has his career part in this also. Another John Ford favorite, Carradine plays Casy the defrocked preacher who as he tells it disgraced himself with a female parishioner. After that preaching the gospel didn't seem quite right. When Fonda meets Carradine after Fonda's been released from prison, Carradine is asking a lot of questions about what is man's place in the metaphysical scheme of things. He's developing what we would now call situational ethics. Carradine's questions are on a higher plane, but he certainly inspires Fonda to ask for some answers himself.",9.0,Anonymous,History
A Stark Reminder,"The Grapes of Wrath (1940), directed by John Ford is a dramatic film about the depression; and is based off of John Steinbeck's novel. The Joad family are in search for a better life, and head towards California. This film is very dramatic, and showcases the Great Depression and its many struggles. It shows people living in deplorable conditions and the set pieces are great. The film does a good job at showing the environment, which was the Midwestern United States. The camera shots by John Ford are amazing and capture the scope and the feel of the scenes. This story is such a good one, that when presented with the opportunity, you should watch it if you haven't already. Overall, I give The Grapes of Wrath(1940) an 8 out of 10.",8.0,Anonymous,History
It was ok,"This movie wasn't for me but it wasn't terrible. The acting was good and the overall plot was great but I had a hard time keeping up with the movie. It wasn't really that interesting, I may have been struggling to stay awake during this movie but I didn't hate it. I think it might just be me because this isn't my type of movie but I have to be considerate because it did come out in 1940. I like the story a lot though because of the time period, it is very interesting seeing how the family was affected by the Depression. I think if the movie was recreated today the movie would be so much better, not just because it wouldn't be in black and white.",3.0,Anonymous,History
Work for living or living for work?,"My favorite actor, Henry Fonda!A story which never gets old, and could happen anytime and anywhere in any societies.It's really touching and though-provoking. How life seems so difficult and challenging. But make sure, we can through it.",,Anonymous,History
"A stupendous, powerful, essential classic","While there are certainly exceptions, one doesn't typically look to the 40s for high quality cinema, especially not as censors' production codes neutered much storytelling and film-making. Not all pictures were so heavily subject to the whims of reactionaries, however - some distinctly scraped by in some manner - and it doesn't take long after this one begins that we recognize the enduring strength of its narrative, the infuriating, despairing relevance that it continues to have eighty years later, and the fact that it surely falls into the latter category. 'The grapes of wrath' is a story of the wealthy, powerful, and amoral exploiting hardship and desperation to set people against one another, and to selfishly reap gain wherever possible, and moreover of forsaking humanity to destroy lives instead of coming together to lift up the unfortunate and disadvantaged to mutual benefit. Of course it is also, more specifically, the story of one family persevering despite these conditions and trying to abide and survive, but it is through the lens of that particular set of characters, and their friends and acquaintances, that we see laid bare the lasting iniquity, dismissive indifference, oppressive abuse, and murderous callousness of the powers that be. Here, perhaps, is where the cinematic sensibilities of the 40s have a proverbial leg up on modern fare, for despite the dour subject matter, the feature endeavors mightily to carry itself with a warmth and hopeful optimism that maybe, just maybe, the Joad clan might make it through these dark years and come out stronger on the other side. Even as that endeavor struggles through brutality and grief, there is shrewd wisdom and and tact in the construction that helps the flick to continue to shine brightly, and to duck the ax of regressive cultural forces.By virtue of that tale alone, Nunnally Johnson's adaptation of John Steinbeck's novel, this title is immediately grabbing, captivating, and absorbing, with both a soulful richness and an urgent message that we don't always find in the medium. Among other frames of reference, in the case of the latter I am obliquely reminded of King Vidor's 'Our daily bread,' and in the brightest instances of the former, Kurosawa Akira's 'Red Beard'; in the most grim moments, well, those comparisons are harder to come by except in daily real-life headlines. The sum total speaks resolutely to a conflict between the needy and the cruel; unthinking complicit state agents, migrants, labor movements, and individuals on all sides who leap to action for good and for ill; and those who try to help as they can: all operating within a titanic, unjust, inhumane sociopolitical and economic system that would require truly unprecedented unity and pressure to change. Vibrant scene writing, alongside the narrative at large, offers a portrait of humanity both heartfelt and dire - and as tragically, devastatingly, maddeningly relevant to the world of 2024 as to that of 1940 - and even the characters and dialogue are incredibly smart and flavorful. As 'The grapes of wrath' speaks directly to the malice of wealth and power, the value of community and collective action, and the unswerving determination of all, there can be no disputing that as much as this is a fictional drama for our consumption, it is also a call to action with a strident, welcome aim to radicalize.This is to say nothing of the otherwise craftsmanship of the movie. It's not that any facet is singularly revelatory, but from top to bottom this is shaped with fantastic skill, intelligence, and vision that does just as much as the writing to breathe life both terrific and terrible into the saga. The production design, art direction, costume design, hair, and makeup realize The Great Depression with stark, unfailing clarity and severity, not to mention utmost detail; those stunts and effects that are employed arguably hit harder for the measure of restraint present in contemporary film-making compared to subsequent decades. Gregg Toland's cinematography isn't outwardly striking, but at all times is stupendously keen and focused, centering the drama in a steadfast manner that makes it ring out all the clearer; the very use of light and shadow in this black and white presentation lends magnificently to the gravity of the story, proving that sometimes even with all its advantages modern cinema can't match the unyielding purity and ardor of the classics. The cast is simply a treasure, from one to the next all bearing wholehearted vitality in their performances that lets their characters pop out. In Johnson's adaptation the family is given different treatment than in Steinbeck's novel, but that in no way diminishes Jane Darwell's portrayal of Ma Joad, a proto-feminist anchor of familial and community bonds; Henry Fonda and John Carradine's acting as Tom Joad and Jim Casy, both driven and resolute in their dawning recognition of social conditions; nor the efforts of their co-stars, all just as crucial to the tableau.And all this is definitely a fine credit to filmmaker John Ford, sagely guiding each element into the exact right direction to tell a compelling story, and to make a picture that would stand as a testament to the times, while bearing great purpose. Ford is not a filmmaker I'm especially familiar with, but of any of his works I've seen to date, this is unquestionably the best. I assumed I would like 'The grapes of wrath,' but it is absolutely far more impactful and rewarding than I ever could have guessed. In all the past 130 or so years there are a relative scant few titles that might be heralded as some of the best ever made; I don't know that this would specifically make my personal shortlist, but for the level on which the film operates in every capacity, the distinction is a matter of semantics more than substance. It's dreary, yes, and not always easy to watch; words like ""enjoyable"" or even ""satisfying"" carry too positive a connotation for the ways in which the story plainly mirrors real life, past and present. Yet even at that, and for the contributions of all involved, and for the thought-provoking, inspirational messaging that ultimately sits at the core, the end result is so outstanding that it altogether demands viewership, an essential classic that feels genuinely important and educational. Some features exist beyond questions of personal preference, and in my opinion this is one of them: 'The grapes of wrath' is superb, and I must give it only my very highest and heartiest recommendation!",10.0,Anonymous,History
