title,content,rating,username,genres
I am not a big Russell Crowe fan at all but there was just something about this movie that I really enjoyed and liked.,"""I promised their mother I'd find them and bring them home."" Connor (Crowe) spends his days looking for water in the Australian wastelands and waiting for his sons to return from war. After thinking something is wrong his wife begs him to go get them. Connor decides to travel to Turkey after the Battle of Gallipoli ends to find them and bring them home but he finds much more than he expected to. There are some movies that you watch and instantly know you like it. There are some that you watch and instantly know you hate it. Then there are movies like this one. Movies that keep you watching and interested and you like them but aren't exactly sure why. I am not a big Russell Crowe fan at all but there was just something about this movie that I really enjoyed and liked. It is not fast moving or full of action but it was a very good movie that I liked. Coming from a non Russell Crowe fan that is saying something. Overall, a movie that I really liked but cannot really explain why. I give this a B+.",7.0,Anonymous,History
Self Indulgenges rubbish and and insult to our Gallipolli hero's,"Just another of Russell Crowe's self indulgent movies. The Ottoman Empire picked the wrong Allie during WW1 (Germany) and we are expected to feel that we Australians were the aggressors. From 1915 to 1921 the Ottoman Empire eliminated 1,000,000 of their neighbor's namely Assyrians and Greeks yet in Crowe's movie the Greeks are type cast as the bad guys. What a load of crap! The final escape by Crowe and his last surviving son was ludicrous with the invading Greeks mortaring the hillside just to blow up two non military and non Turkish individuals. Prior to that, in the train scene, Crowe managed to escape his Greek captives by hitting them with a cricket bat despite the fact that he had numerous weapons at his disposal. It is disappointing that in the 100th year anniversary of the Gallipolli campaign this over rated New Zealander can muddy the water and try to change the facts for the sake of making a few cheap bucks.",3.0,Anonymous,History
The Water Diviner,"Russell Crowe made his directorial debut in this heartfelt drama.Crowe plays Joshua Connor, a farmer and water diviner. A father grieving the loss of his three sons in the battlefield of Gallipoli in World War One, he also subsequently loses his wife.Connor goes off to Turkey to locate his son's bodies and bring them back to Australia. The British soldiers will not allow Connor to visit the battlefield. However Major Hasan who commanded the Turkish troops and now aiding the locating of missing soldiers helps Connor.It is a story of a damaged man rediscovering his humanity and something more. Hasan is the former enemy who is more helpful than he needs to be. Turkey is a country at a crossroad in its history facing a post war nationalist uprising led by Ataturk.Connor also befriends a boy and starts a relationship with his widowed mother Ayshe (Olga Kurylenko) who operates the hotel at Istanbul he is staying in. Ayshe's brother in law is eyeing up marriage but Connor upsets his plans.Crowe has directed a sensitive poignant drama with a touch of magical realism. It could easily been an overblown ridiculous melodrama which early on it shows signs off. Crowe pulls back and gives it some heart.",6.0,Anonymous,History
"A technically good film, but fell flat for me","Russell Crowe is great in this film about personal loss, the horror and futility of war and about friendship that transcends borders and sides. Everything was spot on: acting, directing, sets, editing, soundtrack. Yet it all felt artificial and heavy handed, akin to The Hundred- Foot Journey, if you saw it, albeit with a completely different subject.There was some interesting commentary about why people fight in wars and what they feel and do when the wars are seemingly over. Also one can learn more about an almost forgotten part of history, when Turkey was still the Ottoman Empire and was fighting Australians and New Zealanders, then Greeks while the British were lording around. But the rest... I felt like someone was taking feelings in bulk and throwing them at me, containers and all, like so many brick in one's face.Suffering? We haz it! Stoic hopefulness? Tons of it! Cardboard villains? One for each occasion. Love story that made little sense in the plot, especially at the end? Yup. And so on and so on. If it weren't for Crowe, who acted brilliantly, I would have considered this film a failure. As such, I would have to give it an average rating, although I personally didn't like it.Bottom line: it felt like a movie made by an accountant.",7.0,Anonymous,History
Kept promises (?),"Russell Crowe has been directed by many good and qualified directors, so by now he must have picked up on many of things. Which I reckon can be seen in his directorial debut. Would it have been better if he had just concentrated on one thing though? Tough to say, especially because it does not seem to affect his acting in the movie at least. The direction on he other hand ... that's up for discussion, unless you argue it was the script that needed improvements.Having said all that, the movie is emotional and it does take you on a (literal) journey. It also seems very strong on making a point in showing gray areas in war and laying out blame. To a certain degree that is, because you do get some ""bad people"" to, which is a shame and not consistent to what the message should be about. Not to mention an overly dramatic ending, that really was unnecessary. Other than that, this was more than a decent film debut",6.0,Anonymous,History
A 'Must See' on the Big Screen!,"I've just come back from the cinema after seeing this movie and will now be emailing everyone on my contact list that it is a 'must see' on the big screen. Not just for Australians, but for everyone, as it deals with universal themes. The cinematography is stunningly beautiful, the casting and acting is superb and the story is fascinating and never lags. A great blend of emotion and action, and the occasional bit of humour. Last August marked the 100th anniversary of the beginning of WW1, which influenced all our lives. It is so important for people everywhere, and especially young people to learn about what has happened in the past and to gain an understanding of history from the point of view of others, and to learn about their cultures too. This movie, set mainly in Turkey, about 4 years after the end of the war, is one small story of one man's search, set within a much larger story of the meaning and consequences of war. Superb acting and direction by Russel Crowe. Don't miss it !",9.0,Anonymous,History
"Meh, rather forgettable film.**** Mild spoilers.","First off I'll say that I don't understand why there are so many positive reviews of this film (9's and 10's). This movie was quite predictable, and seemed it lacked serious drama and emotion. I did like the feel of the movie as far as how it looked and felt like early 1900s era, world war 1 turkey. It also has some nice shots of the Hagia Sophia and some beautiful scenes in both Istanbul/Constantinople as well as elsewhere in Turkey and in Australia. Russell Crowe was OK in it but I really don't understand how he was able to find his sons bodies, I mean I realize he can find water with dowsing rods but he wasn't using any to find the bones of his sons and it never really explained that very well. Another minor thing is Olga Kurylanko is almost to beautiful, she is already a knockout but when she looks so flawless it takes some of the believability away from a film in my opinion. I don't mind looking at her as she is stunning but she's almost a distraction from the authenticity of the film. The biggest problem I have with this film is the character development, most notably the sons that went to war. I never felt any emotion or connection with their characters as they are not given much screen time but mostly just some flashback scenes and some minor clips of them at war. It was enough to let us viewers know what happened to them but not nearly enough time to make us care about them and what they go thru. Overall This is an OK film but I wasn't moved by it and it seemed very predictable. Although it tried to make u feel certain emotions or importance in many of it's scenes it didn't seem very organic, it felt forced. Like I said it's OK but I can't really say much more then that, it wasn't awful but it's nothing I'd recommend and I think it's rather forgettable as a film.",6.0,Anonymous,History
Almost Perfect,"This movie managed to satisfy my thirst for a genuine war film. As a historian and a cinephile, I must say it even exceeded my expectations. Standing ovation for Mr Crowe!Water Diviner contained a gripping story, brilliant cues and amazing scenes as well as a fresh approach to the events of WWI, all of which will stay embroidered in my memory for the rest of my days. Acting was pretty solid. Especially the performance of the local comedy star Cem Yilmaz was impressive and some hilarious moments he offered stood as a fine contrast to the general melancholia of the scenes.Some of the user reviews here on IMDb accused the production as falsely depicting historical events. Most of these strange reviews contained the same copy/pasted lines that had nothing to do with facts. I've done my finishing thesis on the World Wars and I know enough to say there has never been a genocide of minorities in Turkey. These minorities wouldn't be ""minorities"" if (as claimed by a few users here) their numbers could be measured by millions. If you add the numbers up, the total ""death toll"" would be almost higher than the entire Ottoman population :) And the assertion that the Greek were sent to Western Anatolia just to protect the Christian population there... utter nonsense! The Greek troops were merely tongs of the British army who were too wise to handle the fire themselves. They were there to occupy those lands and they committed lots of atrocities, burning down Turkish villages even as they retreated from the battlefield. The movie depicts them as what they really are.All in all, a definite recommend to any war movie fan out there. This was one journey to remember!",10.0,Anonymous,History
Pure Beauty!,"Loosely based on the book of the same name, written by Andrew Anastasios and Dr Meaghan Wilson-Anastasios, 'The Water Diviner' which marks the Directorial Debut of Russell Crowe, is a beautiful film, that tells a tale that's saddening & yet moving. Crowe calls the shots with conviction & his performance in the central role, is beyond amazing!'The Water Diviner' Synopsis: An Australian man travels to Turkey after the Battle of Gallipoli to try and locate his three missing sons.'The Water Diviner' is a story of pure beauty & depth. I was moved & engrossed by the people I saw in this film. Especially the protagonist, played by Crowe. Its a character thats entirely tragic & yet engaging. I wanted him to find his missing sons & also get some redemption.'The Water Diviner' has one minus point though, and that's its pace. The slow-pacing in the first-hour acts a bit as a deterrent. But that's not much, since its a very superior tale otherwise.Andrew Knight's Adapted Screenplay is emotionally charged & takes a look back at the tragedy that happened in the battle of Gallipoli. Crowe's Direction is very well-done. He has handled the film with conviction & that's commendable by all measures. Cinematography is lavishly done. Editing is sharp, more-so towards the second-hour. Art & Costume Design are perfect. War-Scenes are graphically shot. David Hirschfelder's Score is good.Performance-Wise: Crowe commands the screen with a solid central performance. He enacts a complex part with amazing understanding. Its a winning performance by the master actor, yet again! Olga Kurylenko is wonderfully restrained. Yılmaz Erdoğan is alright. Jai Courtney leaves a mark.On the whole, 'The Water Diviner' is a tale well told! Recommended!",7.0,Anonymous,History
A poor TV movie at best,Having read some of the recent reviews praising this film I thought I was onto a sure fire winner when walking into the movie theatre.Seeing as this was Crowe's directorial debut I was hoping that he was going to pull it off and provide a real cinematic belter.However I was sorely mistaken..The first 10 minutes didn't disappoint and I'm including the credits. But as Mr Crowe travels to Istanbul on his little adventure it drastically takes a turn for the worse. The acting from then on in from all parties is woeful and the supposed love story is completely pathetic and unbelievable.I'm not going to go on and on but someone seriously needs to tell Crowe that being in every scene of the film doesn't really help people to warm to him.But please people save your hard earned cash and waiting till it comes out on telly. There are far far far better films out in the cinema at the moment.,2.0,Anonymous,History
"A solid directing debut from Russell Crowe, and an effective antiwar statement","Often I'm skeptical when a prominent actor tries to transition into the director's chair, but luckily Russell Crowe does a decent job in his first motion picture behind the camera (as well as in front of).What I liked about 'The Water Diviner' was its mostly successful balancing of both the perspectives of the citizens of Australia and Turkey. As opposed to merely painting the Turks as the anonymous ""enemies-in-the- distance"" that appear frequently in many Gallipoli-centered war films, the Turks are portrayed predominantly in a positive light, with Crowe's character forming many close relationships with them. Many vital Turkish cities and landmarks such as the Gallipoli peninsula and Istanbul are utilised well in order to both highlight and give respect to Turkish culture and history.Russell Crowe plays basically the same role he does in every other film he's in, a stoic, blokish man's man who relentlessly searches for his sons who went missing in combat in this foreign land. The film is also helped by an impressive supporting cast, with Cem Yilmaz being a highlight as a compassionate Turkish sergeant. However, you can't help but be surprised at certain points why certain Australian and international actors were cast as Turkish characters, though these roles were still executed quite well.Like many war/postwar/anti-war films, 'The Water Diviner' can occasionally dip into some overly sentimental, melodramatic territory, however these are overshadowed by some truly hard-hitting, harrowing scenes. One in particular, during the last act of the film, really packs a punch (you'll know it when you see it).Now nearly at the 100-year anniversary of the failed Gallipoli campaign, it seems fitting that 'The Water Diviner' contains a much more retrospective, melancholy depiction of the conflict. There aren't really any winners in war. On either side fathers and sons disappear off the face of the earth, leaving gaping holes in the lives of those that remain. With careful, considerate storytelling and directing, 'The Water Diviner' is able to convey this message.",7.0,Anonymous,History
Film Review: The Water Diviner,"In June of 2015 one of my favourite HBO shows of all time will make its debut on the silver screen. While Entourage may not be the greatest television show ever created, it sure does succeed in allowing its main demographic to fantasize about fame and fortune. It is true that the Entourage film has very little to almost zero relevance to The Water Diviner, but its subject matter (a very eager Hollywood star, in this case, the fictional Vincent Chase making his directorial film debut) does. Now you may be asking, what is the point here?What many won't know is that The Water Diviner marks the directorial debut of famed New Zealand born, Australian loving actor Russell Crowe. Sharing in his immense adoration for the land down under with fellow famed Hollywood actors Hugh Jackman and Hugo Weaving, Crowe directs this film centred around the Gallipoli Campaign, also known as The Battle of Gallipoli, and Australian farmer/water diviner, Joshua Connor (Russell Crowe).Years after the initial battles, Joshua and his wife Eliza (Jacqueline McKenzie) have done the best they can grieving with the reality of losing all three sons to the war. Essentially, The Water Diviner becomes a great cinematic tale about hope, survival, and determination, soaked with an immense amount of inexperience by its very trying but lacking director.Hope is a big theme within the film, and going back to the analogy mentioned in the first paragraph, the same could be said for many upcoming actors turned directors. While the trend of acting-to-directing is nothing new (Clint Eastwood, Ron Howard, and of course, Ben Affleck), it is something that many actors try, gaining knowledge and great aspiration from their confident directing leaders, but fail miserably. Just ask Ryan Gosling and his 2014 Cannes flop Lost River.While The Water Diviner may be considered anything but a flop, the film does seem quite familiar very quickly. Taking cues from very popular and hailed contemporary war dramas in the last few decades, Saving Private Ryan and Flags of Our Fathers most notably, Crowe's directorial debut is a beautifully shot, but poorly guided historical picture.High handed melodrama, non-conspicuous zooms during very pivotal narrative scenes and monologues, as well as the oh-so painful use of unnecessary slow-motion, The Water Diviner is ever so slightly taken away from a compelling story of patriarch and redemption. Against all odds Joshua makes his way to Gallipoli, a land labelled as a stretch of Earth saturated with ""blood and ghosts"", where he is greeted by Major Hasan (Yilmaz Erdogan), a military official who is tasked with helping Lt./Col Cyril Hughes (Jai Courtney in his second straight historical war epic following Unbroken) adequately bury fellow countrymen. While most of the film is driven by blind and unexplainable intuition, Joshua finds two of his sons, Henry and Edward Connor (Ben O'Toole and James Fraser), who remain together. Not knowing the whereabouts of the remains of his eldest Arthur (Ryan Corr), who had been tasked with guarding his two youngest brothers, Joshua never loses faith in the chance of seeing his first-born.While much of the film narrative is driven by prospect, Major Hasan informs Joshua that he remembers his son in a chance encounter and gives him hope that he may still be alive, leading Joshua to Istanbul where divinely, he finds himself in the care of a recently widowed Ayshe's (Olga Kurylenko) hotel. It is there that Joshua slowly sheds his Commonwealth patriotism of Queen and Country beginning to open his eyes to the customs and lifestyle of the Turkish people, including that of Ayshe and her son Orhan (Dylan Georgides).While romance never plays a strong influence on the film between Joshua and Ayshe, some of the best scenes are undoubtedly between Crowe and Kurylenko as well as Crowe and Turkish acting gem Erdogan. Many won't be astonished by Crowe's direction but he can rest assured, after the atrocities that were Noah, Winter's Tale and Broken City, that his acting is in top form in The Water Diviner, proving scene and scene again that his talents as an actor are far from finished. Luckily, the casting and acting of the film is undoubtedly its strong point, including former Bond girl Kurylenko who is almost unrecognizable as Ayshe.Russell Crowe may not be the next Orson Welles, Rob Reiner, or Kenneth Branagh – men whose directorial debuts and first feature films Citizen Kane, This is Spinal Tap! and Henry V respectfully established their talents behind the lens as well as in front of the camera – but there is definitely hope for a very talented and ambitious man who is willing to shed light to some very obscure historical events. Crowe will surely be given a slew of elements in the fight to get his film seen and appreciated. While I won't be one to truly drown The Water Diviner, here's hoping that Crowe's first feature will have greater hope of keeping afloat than sinking quickly, despite its lack of any real cinematic divine intervention.",7.0,Anonymous,History
New Release from FEAR of GOD Films,"The new film from Russell Crowe's new production company ""FEAR of GOD Films"" is remarkable. Truly the BEST film Russell has ever made.In The Water Diviner the characters were real, with a depth of emotion and feeling not seen in many films today. The choice of actors was spot on and I could not find fault with any of their acting, from the young boy to the love interest. The parts of the Turkish sergeant and commander were played by men who gave their all and it showed.The roles played by the English and Australian officers was also commendable and their portrayed anxiety for the man wanting to visit Gallipoli, was done with a true sense of feeling and concern, even though this concern was misguided in this case.The locations for Gallipoli (near Pt. Lincoln)and other areas (Burra) were well chosen and apart from some scenes, were filmed at the South Australian Film Corporation on Greenhill Road, Adelaide, South Australia.The story is wonderful and who ever wrote the script is to be commended.If Russell and others in the cast are not recommended for the Academy and other Awards I will be most surprised. The film should be nominated for best film 2014 and best director. Many of the cast should be nominated for Awards in each of the relative roles.A Great film, a very commendable film, Russell's best and to date Greatest film. My belief is, that ""The Water Diviner"" is in the category of being one of the very best films made since WW2.A great film, made and directed by an Aussie too! The love interest between the farmer and the girl was tender and Russell's treatment of this was brilliant, whereby even a look between a man and a woman conveys all that is needed.4.5 stars out of 5",9.0,Anonymous,History
"A bit of a slow pace at times, but generally a well made and affecting war drama","STAR RATING: ***** Saturday Night **** Friday Night *** Friday Morning ** Sunday Night * Monday MorningIn 1915, after the end of the Battle of Galipoli, World War One is drawing to a close. Connor (Russell Crowe), a simple farmer who lives in the out backs of Victoria, Australia, is missing two sons who went off to fight in the war. Following his wife's suicide, he travels to Turkey to begin the search for his missing boys, and finds lodgings with the beautiful Ayshe (Olga Kurylenko) and her son. He also finds himself scouring the fields with Major Hasan (Yilmaz Erdogan), the army commander who lead the army Connor's sons were fighting against, who's now trying to build diplomatic relations with the opposing forces. As he draws nearer to the truth, Connor must brace himself for a devastating reality.In the year the world observed the hundredth anniversary of the outbreak of the First World War, Russell Crowe picked a timely moment to unveil his directing debut to the world. He'd spoken about it for many years, and there'd been hints it would be coming here and there, but finally this drama set against the backdrop of the war is finally here. Rather than set it on the battlefront, Crowe has chosen to highlight the raw human drama that unfolded behind the scenes and was comparatively ignored, that of all the soldiers in the various regiments, companies and divisions who were unaccounted for and in many cases, never found.It seems to incorporate many tones as it goes along, mixing together a lot of haunting atmosphere, light humour, raw human drama and historical narrative pretty much all at the same time. While all of this is very affecting, a lot of the time the pace is a little too slow and has a bit too much of a Sunday afternoon vibe to it, creating a bit of a dull feel. A shame, since the themes it's exploring couldn't be any less toned down, including heartbreak, forgiveness, redemption and hope. It beats with the heart of a lion, but flows with the blood of a sheep, a film with solid themes but the execution of a telly drama, but which still manages to stir and engage.If you only get one chance to make a first impression, Crowe has demonstrated a generally firm and adept approach to film-making, with a stirring story and tonnes of ambition, but one which maybe just needs to move with a little more fire and flare in it's heart. ***",7.0,Anonymous,History
Mr Crowe - just wow,"Every now and the Russell Crowe likes to remind us all about what a powerhouse of an actor he is. This film has left me feeling like I have been beaten with a cricket bat, but in a good way.In this stunning directorial debut Crowe tells a story of fatherly love and devotion. Add a dusting of the horror and futility of war and let the emotions simmer.The acting is of a very high standard throughout, the direction and writing is great, the cinema and production is perfect.9.9 out of 10.why the missing 0.1? It might improve on a second viewing.Many thanks Mr Crowe",9.0,Anonymous,History
