title,content,rating,username,genres
Interesting way or directing,"""The Grapes of Wrath,"" is a very well known film based upon the conditions and hardships of the Great Depression. I found it to be very interesting that I could actually tell that some scenes were filmed on a sound stage. The sound gave it away. I noticed that in a scene where Tom and the former preacher were walking ""outside"" that when they talked, I could hear their voices echoing. I never have been able to really distinguish between on-scene location and on stage. But, in this movie, surprisingly I was able to because of the echoing. But, the lighting in that scene is awesome! It really captures that its later in the day, going on evening, and there is a storm coming. The camera work is pretty basic. The natural lighting of the candle as Tom, the preacher and Yulie are talking emphasizes the conversation they are all having. Good plot, basic filming, interesting light and the sound in some scenes is not synchronized or recorded right in relation to the location/set.",,Anonymous,History
A classic of the human condition,"I think it is most ironic that independent filmmakers claim to despise ""the Hollywood"" film in favor of making ""personal cinema"" when one looks at the films of perhaps the most Hollywood sytem ingrained and yet stunningly personal films of John Ford.His films hold up because they display his personal love of character, land, place (there is a difference), time, honor, tradition and ritual. The Grapes of Wrath is one of his finest pictures. His obsessions and political leanings come to life in Steinbeck's haunting and searing narrative.I agree with many of the other IMDB reviewers, there is much in this film that is pure leftist propaganda and that Reifenstahl and Eisenstien's influence can be seen.  This is certainly true in the masked stormtrooper bulldozer montage. But propaganda, like the very medium of film itself, operates on pure emotion. This film is loaded with one emotional image after another. The photography of Gregg Toland matches the best of Life magazine in its immediacy and realism, while at the same time dramatically recapturing the best of German Expressionism. There are so many frames that could stand as works of photographic art. The look of the film stands proudly next to the work of Benton, Hopper, O'Keefe, Capa, and Bourke-White as examples of American visual art.The cast is uniformly honest, sincere and utterly real in thier inhabitation of character. John Carradine, Russell Simpson, Jane Darwell, John Qualen and the great Charley Grapewin all give performances that are on the level with anything ever produced from a Actor's Studio graduate.Enough can not be possibly said about Henry Fonda's performance as Tom Joad. Simply put it is one of the finest characterizations ever captured on film. He was not just an American pop culture icon, he was a fine dramatic artist.The script captures much of the best of Steinbeck's novel with fantastically illuminating and human quotes. It preaches to be sure, but never at the expense of the narrative. This is a lesson so many ""serious"" film makers have yet to learn.The film has not dated in terms of its impact on the heart. Grapes of Wrath is about a specific time and place in American History yes, but it is also about what it means to be a human being. In that sense, it transcends nationalism and is fine work of World Literature. It is on equal with Citizen Kane as one of the finest films ever made. A 10 out of 10.",10.0,Anonymous,History
John Ford's Classic,"This is a good movie.  Although I find it really depressing, the actors make up for it.  Henry Fonda is incredible as Tom...he breaks my heart with his soft speech and gentle looks.Like I said, the movie is very, very depressing, but you really should see it.  It's a classic, and you shouldn't miss Henry Fonda's greatest acting, which makes my vote a 10!",9.0,Anonymous,History
The Grapes of Wrath,"The movie ""The Grapes of Wrath"" was a very real film to me. The Joad family was kicked off their land and had no place to go. The characters all showed their emotions very well and their actions were so believable. You could really understand how the people of that era felt since it was happening to many families. The lighting of the film was very good, when it was dark in the house and the camera was just on his face in the beginning was very realistic.For me, as I was watching this film all I could think about was the fact that this actually was happening back then to many land owners. This film was very dramatic and I felt bad for their family. They left everything they had in Oklahoma and had a difficult ride to California where there was suppose to be work. When they found work and earned very a little a day you could see the disappointment in their eyes. Every scene was so believable and really captured your attention for what it was like in that era.",7.0,Anonymous,History
Starkly realistic...,"...Well, as starkly realistic as Hollywood could get in the 1940's.Ford's adaptation of Steinbeck's amazing social novel is terrific. The atmosphere of the source material is brilliantly maintained. The thing that impressed me most was that the film wasn't glossed over in the Hollywood studio-style. Yes, there are some omissions in the plot to comply with the Hayes Code, but it's still very dark and realistic. The hungry children rummaging through the waste piles for a sliver of food is shockingly compelling, as are the machines sent out to destroy the farmer's houses, crushing them easily as the onlookers watch in disbelief. It feels authentic.Henry Fonda is perfectly cast as Tom Joad, the hero of the tale. Fonda's underplaying and sense of the 'everyman' suit his character perfectly. The supporting cast are terrific, and they are not glossed-over, either. Jane Darwell appears to have just jumped off the pages of Steinbeck's epic as Ma Joad. So many families made the journey from the Mid-West to California, the land of supposed 'milk and honey' (which the Joad's find out is not true), but the Joad's struggle feels very personal to us.Very depressing in content- I had to watch this film in portions simply because it overwhelmed my emotions so completely. But the Great Depression was an awful event in America's history, and it's portrayed so accurately here. Students should watch this at school to realize how lucky they've got it now, and how dangerous it would be to fall into a recession once again (it would be different now, but still have the same effect on morale). This is draining to watch, but ultimately uplifting. Ford's direction is always convincing; Steinbeck's great work is in fine hands. The black-and-white photography emphasises the bleakness and realism.10/10.",10.0,Anonymous,History
Big-Government LOVES you and would never oppress you! Muh media said so!,"The manufactured Hegelian-dialectic of communism/Marxism AND corporate-capitalism always steers toward the desired, predetermined synthesis - ENDLESS wars and a government boot on your neck.We all need to deprogram ourselves from the decades (weaponized language is ancient but ""black mirrors"" are insidious) of ubiquitous propaganda in MSM and its owners.",3.0,Anonymous,History
good movie as an okie i understand it,"growing up in oklahoma in the 1930s just rt 66 i saw a lot of cars and trucks just like movie. we had a farm so we had food to eat, the joads were a good  subject of the problems of the 1930s. it should be required viewing for todays i want it all world.",,Anonymous,History
A work of art,"Yes, it's a book I think we all had to read in a High school English class, but that doesn't mean it's bad.This movie was used in a sociology class I took in college, and I instantly fell in love with it. It's a great story, with a great cast. It's a bit dated in it's style, but it really overcomes it's shortcomings. Check it out!",9.0,Anonymous,History
Wonderful Classic,"This is my favorite John Ford movie. I've seen it many times and still love it. I feel so happy when the Joad family finally pulls into the government camp and are treated to kindness and decency. After traveling all that way with them, seeing them suffer, humiliated, spat on, you feel so much compassion for them. And the scene where Tom and his mother are dancing, and Tom is singing to her, that is pure joy. I don't know what Ford's politics were, but I remember reading somewhere where he is very conservative, and many of his film's deal with the frontier, rugged individualism and all, it's interesting that this movie deals so much with local corruption, exploitation and sides with the federal government and its programs protecting worker's rights. I think he also dealt with this issue abit in HOW GREEN WAS MY VALLEY with the miner's.",9.0,Anonymous,History
My brief review of the film,"A historically important and extremely accurate portrayal of the times and experiences of those disadvantaged by the Depression. It shows how some Californians were inviting and the cruelty of others, and the film manages to expose exactly what the book aimed to expose in terms of the dehumanising effect of the Depression. The degree of accuracy of the film makes it at times painstakingly uneasy, but nonetheless the subject matter is given appropriate treatment. In terms of lighting, acting and direction it nears perfection too. The title refers to how some Californian farmers would spray kerosene on their leftover, rotting produce to stop new migrants from eating it, and that idea in itself haunts the whole film.",10.0,Anonymous,History
ehh alright,"I found this movie to be quite dry in many parts and also very repetitive. The acting on the other hand was superb and it made me want to keep watching the movie instead of changing to something else. I have viewed two other John Ford films with this being my least favorite with ""The Man who Shot Liberty Valence"" taking the cake. The acting by Tommy was outstanding and really was intriguing the entire film. To me the character that stood out the most was the mama. She portrayed the lady of the house very well with all the cooking and the cleaning and caring for the family. It was only right that she got rewarded at the end. This film was an alright film but I don't think I would watch it again for fun. In my opinion not one of Ford's best films.",7.0,Anonymous,History
We are the people!,"Released when we were just coming out of the Depression, ""The Grapes of Wrath"" showed conditions during that wretched period in our country's history. Tom Joad (Henry Fonda) and his family abandon their Oklahoma farm to move out to California, seeing the misery and despair wrought by the Depression. When they finally arrive in the Golden State, they find that even it isn't so golden.At a time when Hollywood was mostly making happy-go-lucky musicals, this must have been a pretty bold movie. Not only did it deal with unionization, but it openly indicted capitalism and big business. Now in George W. Bush's America, it remains ever significant. As they remind us in one scene: ""We are the people!""",10.0,Anonymous,History
good film,"The Grapes of Wrath was a good film. I had started reading the novel by John Steinbeck back in high school and never finished it. But what I remember from it, it seemed as though i would find the movie interesting which i did.I was really captivated by the opening scene of the paved road in Oklahoma. Just with the telephone poles and everything it was a great opening scene to draw in viewers.the story itself of a man, Tom Joad, is one to grab anyones attention. The concept of Tom Joad(an ex convict) breaking his parole to move out west to California with his family was outstanding to me because it was sort of a bad-to-the-bone thing to do and thats definitely enough to get one like myself to watch any film.i definitely recommend this to everyone. It's just a classic and a need to see movie by everyone. i would watch it again if i got the chance!",7.0,Anonymous,History
"The Touching Saga of the No-Land and Homeless Joad Family, Searching for a Job to Survive in a Place and a Time Ruled by Violence and Prejudice","In Oklahoma, Tom Joad (Henry Fonda) and his family are expelled from their lands by a huge company, owner of those lands. Having no other honest option other than finding a job to survive, the Joad family is attracted by a pamphlet, offering work in California. They join their savings, buy an old US$ 75,00 truck for transportation and moves to the promised place. There, the job does not exist, and they find indeed violence and prejudice, among other desperate very poor and starving persons. This movie is very sad and touching, with an outstanding direction of John Ford. Henry Fonda, as well as all the cast, has a magnificent performance. This film has not been released on VHS or DVD in Brazil, and yesterday I had the chance of watching this masterpiece on cable television for the first time. A very recommended film, taking place when USA looked like (or was) a Third Country World.Title (Brazil): `Vinhas da Ira'  (`Grapes of Wrath')",10.0,Anonymous,History
"A valiant effort, ruined by socialist exaggerations.","I hesitate to write a bad review of The Grapes of Wrath because I know that to many people who view it apolitically, it is simply a very well made drama. To such people my criticism may seem merely like muckraking. If, however, you are observing the misinformation that the premise of this film is built upon, then I believe it legitimately fails. I understand the poetic license that artists take to make a good story, and I am willing to grant that license. However, I feel that, when tallied, this film's erroneous statements go far beyond the pale of poetry and cross into the realm of propaganda and silliness. It's the difference between ""The Battle Hymn of the Republic"" vs. Charlie Daniels ""In America"". The former inspires me, the latter is a joke.Another aspect of the movie that bothered me was its disconcerting take on morals. It begins, fittingly, with someone being mocked for obeying a rule. Henry Fonda, a murderer just out on parole, berates a truck driver for obeying a rule that prohibits him from giving rides. What if Fonda had hijacked him, would the truck driver be a prude or an idiot? In the next scene, God gets the ax. Fonda comes across a disillusioned vagabond, the family's ex-parson. He brags that his sermons were emotional hype and confesses that he liked to sleep with the women that got caught up in ""the spirit"" at his meetings. Now, he says, he has lost hope. He does not state this as a fault, so much as it is confusing to him why ""the spirit"" has left him. Strangely, this later state of the preacher is looked upon by Fonda as being clairvoyant. Everything that happens in The Grapes of Wrath happens within the context of morality being a relative thing, certainly one devoid of divine appointment. Everything from lying to murder is excusable if done by the right people or for the right reasons. A few examples:Upon seeing Fonda out of prison, most of his family is hoping he broke out. His parole comes as a disappointment.The murder he was sentenced to seems irrelevant.The sharecroppers are willing to kill the owners of the land to stop them from evicting them (they don't because it ""won't do no good"" not because it would be morally reprehensible).(slight spoiler) Fonda murders another man for murdering his friend, and Fonda's mother not only excuses the murder without knowing what her son's motive was, but offers to cover it up by hiding her son.I, personally, have a hard time rooting for such protagonists. I also found Fonda's character to be too abusive and insolent many times.Overall, I find the authors socialist overtones cliché and cockeyed:Its opinion of authority is comical. All cops are evil thugs, all employed towns people are absentee cowards, all successful businessmen are thoughtless criminals, and essentially everybody in the film that has employment are only out for themselves and their first impulse is always to be rude and uncaring.The film's opinion of how people treated each other in the '30's is askew. No doubt, some people where cold and heartless, that is a given at any time, but where are the good people? There is not a single group or individual (with any means, that is) helping any of these people, esp. children? Where are the soup kitchens, churches, etc..? The premise of the script is built upon this nonsense. Quick research into the Great Depression will reveal a contrary reality. People where mostly very kind and helpful to each other. It's how we survived as a country. Many other countries turned to anarchy.Its opinion of progress is very cockeyed. The tractors are pictured as giant evil job gobblers. In reality, modernization made it so poor people could get better paying jobs and live a much higher quality of life.Its opinion of what role religion plays in American life is cockeyed.Its opinion of land ownership is cockeyed. If I rent land, and the owner wants to take it back, that is part of my contractural agreement. Oddly, it appears the farm owners were actually doing them a favor by getting rid of them. If they were not successful, their grandparents should have thrown in the towel decades before. But I am expected to sympathize with this.Its opinion of how the government helps people is not only cockeyed, it's backwards. If anyone is guilty of screwing people and taking away their rights, it's government. Reality is so much different that this issue becomes a farce. In one scene, the only thing missing from the government run workers camp were angles playing harps. You may argue that Roosevelt's WPA helped people, but many scholars argue that it actually prolonged the depression.The entire premise of the ""Okie migration"" is not factual as presented here, Google the topic to find out. For example; the migration of the Midwest was transpiring since the teens. The bulk of it occurred in the 40's, not the thirties, as employment became abundant in California due to WWII. There are a plethora of other non-truths in this script. So much so that the movie was protested by many people in California. Steinbeck grossly misrepresents the facts.I could go on much longer, but I am limited to 1000 words. All of this is not to say The Grapes of Wrath does not have good and valid points about how we should help people and think of them before profits. I just think they are lost in an ocean of deception and lies. As a movie making effort: 9.5 out of 10. As a whole: 3 out of 10.",,Anonymous,History
The greatest and most humanitarian film to come out of Hollywood (or anywhere else),"I saw this film when it was first released in the UK. Like every other boy at that age I was a regular picturegoer and enjoyed the solid entertainment provided. My country was at war and we needed entertainment. But this film had a profound effect on me. It told me more about why we had to fight for democracy so that our society could be held to account for the way it treated its members than any of the propaganda films of the war. The humanity of the Joads, the way in which Ma fought to keep her family together, the way in which greed and corruption could ruin society and make us all losers was subtly and artistically portrayed. This is a film which should make Hollywood proud.",10.0,Anonymous,History
Greatly depressing,"The Grapes of Wrath shows the story that many Americans had to go through during the Dust Bowl and Great Depression. Returning from prison, Tom Joad finds that his former life is gone - the land has been appropriated, the preacher and his family reduced to penniless migrants. Along the way to California, they meet other migrants who are faring no better and are desperate for work no matter how low paying. Heartbreaking scenes include the sudden deaths, haggling for very small amounts of food and the children's surprise the first time they see a flushing toilet. Near the end, Tom takes breaks from bare survival mode to reflect on the unequal system perpetuating his poverty, taking up the cause of worker agitation but not getting far enough for the film to be truly subversive. It's a bleak portrayal of the time, but with perhaps too many characters coming in and out of the plot to keep track of.",8.0,Anonymous,History
Wrath indeed,"IMDb Top 250: 156I can't think of too many films that show the hardships of the Depression off the top of my head, but surely The Grapes of Wrath (what an intriguing title) weighs equally to the entirety of all others. Based on a novel I haven't read, 'Grapes' follows the Joad family leaving to find work in California with their recently returned son and finding misery. This is a heavy film, a depression in a Depression.I was excited by the prospect of seeing a John Ford film, because I associate him with two major things: beautiful cinematography and 'full' films, filled with themes and symbolism. I got the first one: dark, black and white photography, with breathtaking long shots and silhouettes, and faces appearing in darkness. The second was still there, but not as plentifully as his later films. However this is an adaptation, and thus Ford's leeway was quite constricted, plot and theme wise.A film this bleak, with such a feeling of desperation (the wind sounds are chilling) needs desperate performances, and 'Grapes' delivers. Fantastic acting. Henry Fonda is just- wow. I recently saw The Philadelphia Story, and I can say Fonda's performance is far more deserving than Stewart's Oscar winning role. Tom Joad is hot-tempered yet caring: walking the fine line between cool and volatile. Fonda perfects the role and elevates the entire film with his honest performance. He is backed up by solid support, like Ma Joad and Casy. The Joad family is large, and we don't get to really meet most of them. I'm sure the book fleshes the characters out more, but I can only remember the names of Tom, Ma, Pa, and Roseasharon (?) Joad.Like All Quiet on the Western Front, 'Grapes' teaches a solid history lesson. We see the 'Okies' plight in the Dustbowl, their trip across the country with everything in one truck, and their subsequent hardships faced in California by people who don't want them stealing jobs they need too. This story is told with good flow and a strong pace- no scene feels rushed, and no scene feels overdone.Mood is another of The Grapes of Wrath's strength. There's a very post- apocalyptic feeling about it- the scramble to ensure their families survival against everyone else. We see a form of society breakdown, where people can only fend for themselves. The major conflict is hard to describe, as everything goes wrong for the Joads. Nature, other people (but no singular antagonist) and it would even seem God wants the Joads to fail. So when the dance scene comes, it's one of the biggest sighs of relief I've experienced watching films.The Grapes of Wrath is a really bleak film with a really strong lead. It's a remarkably important film, in league with Gone With the Wind, and should be seen for that reason alone- something numbers cannot tell you. It's a story about the injustices done by the rich fat cats at the expense of the poor, and more personally a story of human resilience: that we can overcome lots, but not everything. It's certainly humbling- things can get better but they can also get worse. 8.3/10",8.0,Anonymous,History
Good Film,"The Grapes of wrath is a good film that goes well beyond expressing the grimness of the great depression and dust bowl. Sometimes I felt like some of the Joad family members characters could have been more developed instead of spending so much time on showing how sad and depressing and hard the times were. I also thought the film got too political. It wouldn't have been so bad the politics not been so uneducated or naive, but I can't really expect anything different.The cinematography and visuals in the film alone are enough reason to watch the film. Truly brilliant work from Gregg Toland. It is undoubtedly a good film, but The Grapes of Wrath could have been better.",6.0,Anonymous,History
Sad and Inspirational at the same time,"Rating: 8 out of 10. Directed by John Ford. ""The Grapes of Wrath"" is based on John Steinbeck's novel, takes place in the Great Depression, and effectively portrays the grief and hopelessness of what many people went through during this time.Henry Fonda plays the lead character as the eldest Joad family son returning home from serving time in jail for manslaughter. Expecting to work on the family farm, he finds the farm deserted and run-down. His family has been kicked off the land. After reuniting with his family, they begin a long difficult trip to California in search of work.Nominated for seven academy awards, winner of two, including John Ford's second of four best director awards.",8.0,Anonymous,History
PROPAGANDA!!!!!!!!! >:(((,"It was not as terrible as people are making it seem. Don't get me wrong this movie is old and at times hard to follow but it's not because the story is bad. In 1940, they didn't have the capabilities to satisfy your 5 second attention span. If you can focus for a little bit, maybe you can notice the good things about this movie. The cinematography and camera work was very advanced for a movie of this time and Henry Fonda did great as Tom Jode. Jane Darwell won the award for best supporting role for this movie as Ma. The story of the Oakies having to leave their homes for work and opportunities and the losses they went through is tragic and very interesting. There was a ""propaganda!"" review that wasn't completely wrong for once! Anyway, maybe before you dawg on an old movie you can actually pay attention to it.",6.0,Anonymous,History
