title,content,rating,username,genres
Very well done!,"This movie depicts the last year and a half or so of Colonel Von Stauffenberg's life concerning his involvement in ridding Germany of Hitler. It is NOT, however, a movie about the Nazi resistance. Enjoy this movie for what it is; World War II history and one of the attempts on Hitler's life. There were Nazis who understood the evil of Hitler and knew he had to be taken out. As far as the complaints about the accents of the characters, those complainers must have missed the opening five minutes of the film (and that's all I'll say about that because it was a very creative intro). I'm a huge fan of the MI series as well as his recent comedy piece in Tropic Thunder). Tom continues to visually age like a fine wine and does a great job acting.Don't listen to the negative reviews, ignore the interviews by Tom Cruise and just go see this film. It is riveting.",10.0,Anonymous,History
Not as gripping as I thought....,"There's no doubting the fact that not all Germans serving in the German army during the war were Nazis, but the quality of noble righteousness with which the character of von Stauffenberg and his co-conspirators are painted tends to rankle a little.For the movie, had they attempted to kill their fuehrer in the late 30s, when Hitler began his policy of invading neighbouring countries for liebensraum (living room) for the German people, or even in the early years of the 40s when victory in the war looked like a real possibility, I might be more inclined to believe these men were working for a noble cause.Since the attempt on Hitler's life took place in the summer of 1944, when most strategists were already agreed that it was only a question of when - not if - Germany capitulated, I can't help wondering whether self-preservation wasn't more of a factor when it came to going through with the plot.",6.0,Anonymous,History
"Better off as a ""Made for TV"" movie","First off, I agree with those critics who found Tom Cruise utilizing an American accent while the other actors are all speaking in polished British accents, a big mistake. The film's verisimilitude is compromised quite a bit by Cruise's inability to convince us that he's truly Klaus von Stauffenberg, a sophisticated Army officer from an aristocratic German family.That said, Valkyrie wasn't as bad as I expected it to be. It's basically a by-the-numbers recreation of the last plot to kill Hitler. While it lacks suspense (since the film's climax is a forgone conclusion) it does ably depict who the players were and how they concocted and carried out the failed assassination plot.Valkyrie fails in the area of character development. We never get to know any of these characters as multi-dimensional human beings. Director Bryan Singer chose to tell his story purely as an action-adventure movie. On the plus side, the movie looks like it was filmed at some of the actual locations especially the scenes shot at the ""Wolf's Lair"" which looked pretty realistic.The most objectionable aspect of 'Valkyrie' is elevating von Stauffenberg to hero status. While certainly he was courageous, he was no hero. Had Germany been winning the war, it's not likely there would have been as many assassination attempts as there were. I find it difficult to believe that most of the conspirators were primarily motivated by a moral imperative.Daniel Goldhagen, in his brilliant book ""Hitler's Willing Executioneers--Ordinary Germans and the Holocaust"", informs that von Stauffenberg's own brother admitted that in the sphere of internal politics, ""we had welcomed the basic tenets of National Socialism for the most part...The concept of race seemed sound and very promising."" Their objection was merely that its ""implementation was exaggerated and carried too far"". Stauffenberg's uncle, Count Uxkull, stated ""We should hold on to the concept of race as far as possible.""According to Goldhagen, one of the central documents of the resistance to Hitler, prepared at the beginning of 1943 by leading Protestant theologians and university professors, explicitly condemned genocide but still argued that Jews caused trouble for Germany, that a ""Jewish Problem"" existed, that the Jews had harmed Germany and that a ""solution"" was necessary that would prevent future harm to Germans.Valkyrie might have been better as a 'Made for TV' special. Instead of spending all that money about a minor footnote in the history of the Third Reich, wouldn't it have been better to focus on the complicity of the overwhelming majority of the German people who either enthusiastically embraced Hitler or looked the other way as he successfully carried out his nefarious plan of genocide and attempt at world domination?",5.0,Anonymous,History
Swap the name Hitler with Lex Luthor and you have yourself a thrilling ride.,"When it comes to World War II, there are undoubtedly a myriad of different stories to be told, whether from the front-lines of the war itself or from those left back home. It goes without saying then that such an entertainment industry which thrives upon compelling situations thriving with drama and action would be foolish not to capitalise on such a historical, iconic and memorable piece of history which was, regrettably, brimming with such qualities. Such has been Hollywood's claim for many a year now, throwing out broad examples of tales from the front-lines of war, some which do justice to the horrors of those years, some of which only seem to belittle.Valkyrie then, with its stars and creators rooted in popcorn fodder action movies at first comes off more aligned to the latter. It's sophomoric in its historical significance; facile, kitsch and watered down for the sake of telling a thrilling story and yet if taken strictly on a fictional base, at least does so formidably. On this ground I feel somewhat divided; on the one hand Valkyrie uses it's ""true story"" to evoke feelings from the audience that a film dealing with fabricated events (although, one could argue McQuarrie & Alexander's script to be more a work of fairytale than fact) would have to establish from the ground up; and yet there's also the undeniable truth that Singer and co do a brilliant job of telling a compelling and well constructed story full of high tension action and suspense. In the end, I had to let go my reservations for Valyrie's attempt at providing a historical account set to enlighten and instead imagine I was watching Mission Impossible set in 1940's Germany.Whether or not this evokes any reaction from audiences is a matter of speculation only on the part of myself, but I really can't see it irking much more viewers any more than it did myself. Granted, during the first act of the feature I was troubled with Tom Cruise and his über-Americano stature- which in turn negates any sense of engrossment within the story's supposed deep rooted truth- yet as the movie goes on and things begin to be put in place, Valkyrie moves on from caricature impressionism into an engaging form of entertainment; the historical backing in turn becomes redundant, and sure, this spoils the aforementioned pre-connection to the story itself, but swap the name Hitler with Lex Luthor and you have yourself a thrilling ride regardless of all the uniforms and salutes.So who then is our Superman- our Ethan Hunt perhaps? Well of course that comes in form of Tom Cruise under the guise of Claus von Stauffenberg, a colonel disillusioned by Hitler's war. Opening the feature with perhaps its only reel of German dialogue, Stauffenberg ridicules Hitler's war and demeans it to the point of embarrassment; there's no denying that this colonel isn't alone, and that's exactly what Valkyrie sets out to explore. From here the movie attempts to convey the idea that not all Germans were saluting national socialists bending to the whim of their Führer; indeed, there were many who directly opposed his reign and wanted him stripped of control- to free Germany of Hitler would mean freeing his people of absolute disaster in the eyes of their opposed forces. It's no surprise then that much of Valkyrie dabbles in and out of the building cascade of rebellion from those initiating the now infamous ""Valkyrie"" operation, detailing the intrinsic planning and implementation required to pull such an attempt to assassinate and cut off the head of Germany's war machine.For the most part, particularly throughout the movie's latter acts, Valkyrie tells a compelling and rigorous story of espionage and political plotting; the tension riding high during the movie's biggest scenes- some of which providing excellent visuals complementing the bubbling suspense underneath. Granted, there are many instances which only work to belittle both Singer's movie and the facts it is based upon themselves, but such moments are far and few between the greater, more viscerally adoptive ones. Cruise, who admittedly feels out of place within the feature's opening sequences, does well to transform as he does in his greatest roles, disappearing completely behind his persona to great effect. The same unfortunately cannot be said for a few supporting cast members, yet with such a large ensemble, this doesn't prove too much to put up with.Conclusively, despite a few reservations about the movie's willingness for you to submit to the script's supposed foothold in fact, Valkyrie at the very least provides a decently paced and constructed story that will disgruntle historians but please those looking for a good story. Of course there are a myriad of problems, most of which occur during the film's opening, stultifying act, but if taken with a grain of forgiveness, Cruise, Singer and co do well to keep you firmly in your seat to see where it all goes wrong for Stauffenberg and his ever hopeful rebels with a cause. More Mission Impossible than Der Untergang or Saving Private Ryan, Valkyrie is a fine and riveting effort plagued by the very historical setting to which it subscribes to; World War II it seems is a playground for film-makers with ideas of grandeur and yet Singer here constantly feels like he should stick to the pages of comic books rather than those of solidified history.A review by Jamie Robert Ward (http://www.invocus.net)",,Anonymous,History
Superb,"It's a great cast and a well made film that keeps you interested, because the story is so good that it's hard to believe that it's true.I think Tom's latest work really shows his abilities as an actor far more than his performances in 'Top Gun' (1986) or 'Cocktail' (1988), etc ever did. He's really grown on me with 'Oblivion' (2013) and 'Edge Of Tomorrow' (2014).Kenneth Branagh however is far too British to play a German or perhaps it would be fairer to say he's too Shakespearean or too much of a Luvvy. My preference would always be that actors have the right accents, if not language, for the part they're playing in any film for authenticity anyway, but Ken manages to stick out like a saw thumb amongst a large cast of Brits who generally don't draw your attention to their accent at all.The film appears to be very true to the time and the feel of the Second World War as far as I can see, as well as being excellently filmed with great heart and importance. An interesting historical film with a blockbuster budget and delivery.It also shows you why you should buy a handbag that stands out from everyone else's.704.15/1000.",7.0,Anonymous,History
Respectable and rather tense Second World War thriller which manifests suspense and danger around a group of men looking to make a grandeur change.,"The camera slowly, tantalisingly zooms in on a spinning record whilst bombs are falling all around the building the contraption is in; our lead and his family helplessly cowering in a basement as the loud and proud emoting of Wagner's 'The Ride of the Valkyries' booms out of the gramophone when the rumble from another explosion pushes the needle back onto the track. It's an important sequence, the scene in which whilst down there in that basement taking cover from the very bombs designed to injury him as he figures out a way to aid those they belong to, our lead hits upon the idea of enforcing an operation; a plan that might bring about the ending of World War Two, thus saving hundreds of thousands of lives, but at the risk of his own. It's a powerful moment, one that gives our lead an idea, impetus and strength within an individual happening designed to maim and destroy. Such is the nature of the lead, showing strength through adversity; like all of those that were members of whichever resistance movement in whatever nation at that time.And from whence the thriller Valkyrie gets its name is revealed, a 2009 Bryan Singer film about the true story revolving around a certain man named Claus von Stauffenberg, a German colonel in the upper throngs of the Nazi party during World War Two, who took it upon himself to wipe out Adolf Hitler in a bid to have the German political hierarchy thrust into chaos as The War chugged into a fifth year. The film sees Singer return to material of a Nazi orientated nature for the first time since 1998's Apt Pupil, another rather terrifying drama, that time about a young boy becoming gradually more and more obsessed with a specific text in The Holocaust as themes of blackmail and the exploiting of power one supposedly possesses over another person, the likes of which the young boy had been reading of, became more frighteningly apparent.In Valkyrie, another look at the dangers or misuse of power is observed; the determination of Tom Cruise's von Stauffenberg in achieving what it is he wants so dear by way of knowing he can be in such close proximity to an individual of such infamous nature is played out, an advantage he utilises so as to put a plan of action into motion. Others are connected, a flurry of British actors curiously both hovering and revolving around American Cruise's whim, all of whom playing true to life German officials that want an end to the madness and murder as Hitler prolongs the deaths of the innocent and those serving on the various fronts of The War. They know the risks; they know their mission and they're aware of what it'll take of them when the scene in a church sees von Stauffenberg talk to Bill Nighy's general, a certain Friedrich Olbricht, for the first time about the idea of trying to initiate operation Valkyrie plus ideas about how setting out in eliminating a man is still a mere act of murder. Indeed, later on Olbricht observes that while they're doing their best to save lives and end suffering: ""only God can judge us""; the theological elements of following through with this mission made aware.Cruise's von Stauffenberg is a battle scarred man, weary of the war and an individual with experience of the front line when an attack on his desert troops in Tunisia by an American Flying Tiger fighter plane leaves him without a right hand and a left eye. His wife is Nina (van Houten), her and their children those whose lives we feel are in greatest danger when he is away and indulging in his plans; here Singer using the innocent lives of von Stauffenberg's family to act as representatives for those of the greater nature of who'll be saved if the plan succeeds. One scene sees von Stauffenberg attempt to call home by way of the telephone, but recent bombing has made communication difficult as von Stauffenberg's situation becomes increasingly precarious. He places the phone down and it hangs ominously on the receiver, teetering as if on a cliff edge; rocking back and forth as a photograph of his family stare back at us with the phone in the foreground: the outcome of their situation remains unanswered and certain fates of the von Stauffenberg family remain in the balance as the phone continues to rock as if to dramatically become unhooked at any moment.The film covers his gradual infiltration of Hitler's Nazi party higher members, and his consequent invitation to the heavily fortified Wolf's Lair, located deep in rural Germany, in which the strike will eventually occur; an idea met with some disdain from certain people early on, particularly Tom Wilkinson's Friedrich Fromm, when Singer applies a number of profile shots of men facing each other in a showing of anger, disagreement and confrontation. His direction is taut and punchy, taking a true story of which few will have heard of but mostly all will know the result of within seconds of it being detailed, the film's expositional tidbits from fully grown men explaining plans and complicated political procedures and agendas to one another harmlessly inter-cutting with the pot-boiling and execution of this plan to leave an awry suitcase in a dangerous place. The key to the drama is not knowing the outcome of von Stauffenberg and several of his cohorts, nor how it was they went about dealing with the situations they created. Singer's treatment of the material in that punchy, rapid fashion renders it accessible for more mainstream audiences without ever really degrading it or exploiting it for cheap entertainment's worth. The film is a tight and focused effort, involving in its own right and efficient in retelling a story of failure that needs not be forgotten.",7.0,Anonymous,History
the plot actually made sense.,"I remember when this movie was in theaters and it was getting a lot of bad reviews. I just figured it was another role in which Tom Cruise is totally unbelievable. And the story would be hard to follow. Well, Cruise was OK, and the story was easy to follow. It is about a group of Germans that want to assassinate Hitler and take over Germany to sign a truce with the Allies. They don't want to see Europe destroyed.Cruise plays Colonel Claus von Stauffenberg whom is leading the attempt on Hitler's life. He's got a lot of convincing to do in order to get other officers to go with the plan because they know if it fails, it will be considered treason. Even when the plan seems to go as planned, the other accomplices are still hesitant to go forward with the plan.FINAL VERDICT: It's a little too long but I thought it was easy enough to follow. If you find World War II interesting, I'd recommend it.",7.0,Anonymous,History
"A great, well-researched movie","(This is one of the best-researched movie on WWII. Superb, accurate details. I especially liked the faithful reproduction of Hitler's mountain retreat Bergof. The outside and interior were exactly like the real thing.) The German people had made a pact with the devil, even though they did not know it at the time. Belatedly they realized what they had done, by which time it was too late. In retrospect, even if they succeeded in killing Hitler, I doubt that it would have been the end of the story: Goering, Himler,Goebels and other Nazi henchmen almost certainly would have put down the coup, with or without Hitler. The Nazi apparatus was too much entrenched to be dismantled simply on account of Hitler's death.....",9.0,Anonymous,History
Valkyrie flies high,"It is no small feat on the part of director Bryan Singer and screenwriter Christopher McQuarrie that 'Valkyrie' manages to keep increasing the tension as it goes despite the fact that the audience already know the outcome.'Valkyrie' is artfully directed and beautifully shot. The costumes look authentic, and it eschews CGI cheats in favor of the real thing. Planes are real. Buildings are real. As a result, you become immersed in this place and time.The cast is uniformly excellent. Cruise and the bulk of the non-German actors wisely avoid attempting accents. The anachronistic result takes some getting used to, but ultimately I believe it allows them to concentrate solely on their performance.If you're looking for a taught thriller, and a bit of a history lesson, 'Valkyrie' is a film you must watch.",7.0,Anonymous,History
Very good,"Great production values, historical accuracy, and fine acting can be found in ""Valkyrie,"" a 2008 film starring Tom Cruise, Terrance Stamp, Tom Wilkinson, Kenneth Branagh, and Eddie Izzard. Tom Cruise played Claus von Stauffenberg, and one of the actors in a small role is actually von Stauffenberg's grandson. In the movie, Claus' wife Nina (Carice von Houten) is pregnant with the actor's mother.There's no point in going through the story - it was one of something like 15 plots to assassinate Hitler, and the third try for von Stauffenberg,a man from a well-known family and a strict Catholic who never became a member of the Nazi party.Two points, both referenced in a review on this site. The reviewer who wrote that kids walked out of the movie saying they were surprised by it because they thought Hitler was going to die - shame on their teachers. It reminds me of the review of ""13 Days"" on this site that said the Kenny O'Donnell character, one of Kennedy's most important advisors, played by Kevin Costner, was fictional. Right, and they used White House transcripts and just stuck him in there. It is awful, I agree.The second point, referenced by the same reviewer and undoubtedly by others, was about the accents. I'm going to disagree on that point, though I get what he was saying - everyone should have been British or American, not some of both.The acting rule is, when people are in their native country, such as Germans in Germany, it's assumed they're speaking their own language, not English with an accent. Therefore, one doesn't need an accent. As far as having both Brits and Americans in the cast, I refer you to ""Das Boot"" which was in German, but some of the actors were from Austria, some of them were from varying parts of Germany - in short, lots of dialects. So to have people speaking English in a movie where there are different accents is really quite realistic.Though, if you know anything at all about history, you know how this movie ends, it's still very suspenseful. I'm not a fan of Tom Cruise - I find his acting very external most of the time - but he does okay, he isn't afraid to surround himself with excellent people, and his makeup is perfect. I thought the film looked authentic (though black and white is always better for films set in the '40s), and, from what I've read, historically right on, including the big scene where von Stauffenberg puts his plan in motion.Someone else commented that Americans can't understand the enormity of what von Stauffenberg was planning, and therefore, the film doesn't work, but again, I disagree. As a viewer, I certainly felt the terror and the enormity of the plan. One had to be really desperate to agree to it. And plenty of Germans were.",8.0,Anonymous,History
An end already written,"Dramatic movie especially because from the beginning you know that they will fail and that all the efforts of the protagonists are destined to go up in smoke. Despite this, you continue to hope that they will make it even if little by little everything collapses miserably.",7.0,Anonymous,History
No cruise for Tom,"This is certainly a tale worth telling - the 1944 unsuccessful attempt on the life of Nazi leader Adolf Hitler by a group of dissident army officers centring on the aristocratic Colonel Claus von Stauffenberg. Furthermore the director Bryan Singer has an exciting record with work including the first two X-men movies. And visually it looks good, being made at Germany's Babelberg studios (which I have visited) with much of the action centred on the Nazi Army Ministry (which again I have visited - it is now a Museum of the Resistance to the Nazis).The film opens well and, after a dullish section, finishes strongly but that ""Valkyrie"" fails is primarily down to the poor casting. There are some fine British actors on show, including Kenneth Branagh, Bill Nighy, Tom Wilkinson and Terence Stamp (although it's hard to take comedian Eddie Izzard too seriously), but the short scientologist and American Tom Cruise as the tall, cultured German von Stauffenberg does not work at all.",,Anonymous,History
Tom Cruise Plays One Hotsy-Totsy Nazi,"Had a better actor than Tom Cruise been cast in the lead role, ""Valkyrie"" might have gone in some interesting directions. But it's Tom Cruise we get, and so ""Valkyrie"" ends up being a modestly exciting action film that staunchly resists the impulse to be anything special.Cruise plays a German officer with anti-Hitler sentiments, who leads a covert operation to assassinate the dictator and stage a coup in the last days of WWII. The film is based on a true story, but take that for whatever it's worth. Director Bryan Singer, of ""The Usual Suspects"" fame, keeps things moving along at a clip, but all of the period detail and pretensions to historical accuracy can't obscure the fact that this is just routine Hollywood action fare. Any potential the screenplay might have afforded to draw parallels between the ruthless Fuhrer and Cruise's single-minded idealist are tossed aside, and the film decides instead to treat Cruise unambiguously as a fallen hero. Makes the film go down smoother perhaps, but also makes it much less interesting.The supporting cast is a who's who of British actors that includes Bill Nighy, Kenneth Branagh and Tom Wilkinson.Grade: B",7.0,Anonymous,History
A Spine Tingling epic achievement,"This movie was a true blockbuster that has great performances from great actors such as Tom Cruise, Bill Nighy, Terence Stamp, Kenneth Branagh, and Tom Wilkinson. And featuring a great direction from director Bryan Singer, and great writing by Christopher McQuarrie and Nathan Alexander. Also this movie is on my list for the best movies of 2008, in which the movie has a vengeful plot to attempt to assassinate the German president at the time Adolf Hitler. The movie is also 100% accurate for a history picture. Valkyrie is a total must for those of you who haven't seen this critically acclaimed movie achievement in all of movie history.",10.0,Anonymous,History
