title,content,rating,username,genres
A story of true heroes willing to risk everything,"As I'm constructing this review I'm actually finding tears welling up in my eyes. Everything came together in this movie: compelling acting, solid characters, great visuals, nicely paced... But connecting all these components into a modern masterpiece is the true story of the men and women who were willing to stand up to evil in the face of the gravest of consequences. A must see for anyone interested in history or human courage.",10.0,Anonymous,History
Bearable,"I find it difficult to review this movie. It appears neither faction nor drama.The creators obviously debated whether to use natural English or ""'Allo 'Allo"" German accents, and on balance I think they made the wrong decision. For an English speaking audience, English spoken with a German accent is far more believable than a ragbag of differing English / American speech.Casting is one of the most important aspects of any film, and here again I don't think it has been well done. Cruise, of course, is Cruise. Nighty is Nighty. And so on. ""Downfall"" was such a brilliant success because of the utterly believable casting (as well as the brilliance of the Fuhrer's portrayal). But in Valkyrie, none of the characters is developed: they are actors . The tensions that arose because of the doubt that the plot might succeed are shown - but not developed sufficiently to make you care.The flashbacks and flashforwards don't do anything for the structure of the film, and if anything make it a little confusing.The dialogue wasn't helped by rather poor sound mixing: I found some of it quite difficult to follow - but then the picture quality wasn't very good either so it may have been a digital projection problem.I usually rate a movie personally as to whether I will buy the DVD so that I can watch it every year or two. On balance I might - but only when the price comes down to the rental value.Not a real clunker, but - frustratingly - missing just too many critical ingredients.",5.0,Anonymous,History
Another Movie in Bryan Singer's Line of Masterpieces,"The movie starts off with an introduction speech by Stauffenberg (Cruise) in perfect German. It is then slowly phased into English. Then, after the attack that cost Stauffenberg his fingers, right hand and eye, we were headed for a crash course of who's whom and what's what in Hitler's Germany, all the way until the closing execution scene.Most people, I'm sure, had already known the ending to this based-on-history movie. But the question to ask while watching Valkyrie is not ""What happened in the end?"" but instead, ""What went wrong?"" The movie shows us what was the flaw of Operation Valkyrie and why no one killed Hitler but himself.Bryan Singer got everything spot on. The tension and intensity of the film is there. You will feel the suspense even if you had already memorized the WWII history. One thing that I found peculiar was how Singer depicts Hitler, not as a mad man with murderous intention and hatred, but as pure evil. Whenever he is on screen, everything felt dead silent, sombre and dark. Starting from the first scene he's in all the way to the last phone call scene, in which we do not even see his face but just hear his voice.This is the kind of mood that I'm sure we'd feel if we were in that era. And this is the way a good director interpret a scene.But, what went wrong with Valkyrie as in, the movie? Well, the cast. Everyone did their job well, I can give you that. But it seems that everyone could have top it up a notch. The accent was all over the place and it looks like no one was living as their characters.Other than that, Valkyrie is a well made movie. The directing and editing was well played, and the script and tone of the movie was anything a well-made movie should have.Valkyrie shall forever remain in director Bryan Singer's unbroken line of masterpieces.",8.0,Anonymous,History
"The critics were so, so wrong","It's like every so many moons, when Jupiter aligns ... all the critics get together and decide who they don't like. Then, they wait for that person to make a film so they can PAN it as the next Gigli, and write fancy quips to completely annihilate someone's career. Unfortunately, they picked Tom Cruise - and he's most likely not going anywhere, folks.Even more unfortunate, they did all this to Valkyrie. This film doesn't aim at ANY in depth Freudian psycho-babble because it shouldn't. In fact, in case you didn't know, it is a WAR film. It reminds me of the war films of yesterday - so sorry it's not Saving Private Ryan, you crying emoto-bots. For what it's worth, I found this story *more* compelling because it doesn't attempt to squeeze the drama out of every film second.Oh, and the film shouldn't be required to discuss other subject matters. It is such a powerful performance by Mr. Cruise, and the supporting cast was simply incredible too, that I just can't see why anyone would want to butcher it by going completely off topic. There was a bunch of stuff going on during WWII, and most of it was horrible. This is like a facet, not an overview.But overall, please do see this film in spite of the critics. I almost didn't see it - and opted for another film at the theater - because of what the critics were saying. My lesson is learned, and I am passing my wisdom on to you.",8.0,Anonymous,History
Great movie - only if you know the historical background though,"This is a great movie, well acted and executed. Tom Cruise plays well in his role and the supporting actors do a great job too. I enjoyed watching the movie, however, if you don't know who those people were (Stauffenberg, Keitel, Goebels...) and if you don't know much about the 3rd Reich, this movie will not give you as much as those who are familiar with this era. A movie worth watching!!! It focuses on one event only (the assassination) and it does not spend too much time on the political part of it. Not sure if that person who plays Hitler was a good choice, I don't think Hitler was portrayed correctly in this movie. I think he would have beem more charismatic.",9.0,Anonymous,History
The unusual Cruise misfire,"A plot to overthrow Hitler is one hell of a piece of history; and a big Hollywood production with a formidable high concept, name director and movie star, is bound to be a sure thing. Well, maybe in the future, but not this movie. So many scenes of hushed conversations and hand-wringing; it's no wonder ""Valkyrie"" is such a chore to sit through.Tom Cruise movies don't usually thud like this, at least not for me. And I gotta be honest, it's baffling. But he leads a cast of unconvincing Germans and (I dunno how this is even possible) it's left to the sets and wardrobe to remind us that this is the Third Reich. No accents, no spoken deutsch, nothing? It just pulled me right out of the movie and I could never get back in.",5.0,Anonymous,History
What do they want?  The folks who gave this 1 star?,"I'm a voracious reader of history and list WWII as among my favorite grounds for research. This movie is hopefully one of the most persuasive mediums to those who know nothing about the great event. A great number of Germans knew that Hitler was a disaster for the empire. These people (no make that patriots) took an enormous risk to rid Germany of Hitler and the story needs to be told. So why the bickering over some time-lines? The scenery, uniforms, technology were faithfully exact and the sheer audacity of the whole plot was rendered in a true and believable manner. What do the 1 stars want? A stifled PBS document with a suitably dull narrator? I give Cruise and his cast a loud cheer to bring this moment of valor of the Germans to the large screen. I hope more like this come out but with the 1 star naysayers I doubt if we will see a big budget movie come out any time soon. I hope they are proud of themselves.",9.0,Anonymous,History
A Nutshell Review: Valkyrie,"Since it's based on a true event, unless you have your head buried in the sand, you'll know the outcome, or at least the end result, of Operation Valkyrie, an ambitious plan put into the hands of Colonel Claus von Stauffenberg (Tom Cruise) together with his entourage of high ranking officers and political officials in a coup-de-tat to bring down the Fuhrer, disrupt his chain of command, and assume control of Berlin, thanks to quite a contingency strategy that Hitler had. If it had been successful, history would turn out rather different, but we are where we are now. So what makes it still a compelling story to sit through?The pace at which Bryan Singer puts this film through that's what, at breakneck speed rarely slowing down to take a breather. And that's quite the winning formula actually, keeping things tight and moving with clockwork military precision. For those who may want to take this as a loose reference for research into unsuccessful attempts at Adolf Hitler's life (this one being the last before the Allies came knocking), it compacted in two hours the entire recruitment to execution stage, where treason is the order of the day, not knowing who to trust, and to what degree.As explained, with any military operation, nothing goes according to plan. Recruiting is a dangerous exercise, because in a regime where everyone swears an oath of loyalty to one person, it perhaps provided the magical formula on defining loyalties, which is strangely curious yet effective. Decisions on who to believe and who to side, especially when facts become muddled and with the lack of information, it left many wondering and questioning their personal beliefs, whether to stick to the status quo, or jump on the bandwagon in the hopes of effecting change, while putting your neck on the chopping block.Providence too played a huge role in the film, with changing of key locations and the ease with which certain key elements of the plan get arranged and completed. However, any plans which involve large underground group members each having their own say, or if pass the point of no return they waiver and are not resolute in seeing things through, it puts everything up for grabs. Improvisation without hesitation in execution, especially without thorough, objective and robust planning devoid of emotion, becomes an Achilles heel, with wanting to strike fast an overbearing condition in the plan proving to add complexity for everyone. As with the adage of too many cooks spoiling the broth, plans that rely on inch perfect precision execution, given too many variables on the table, are formulas for disaster.And what's this about the accent you say? Kate Winslet did a German-accented character to perfection in The Reader, and hence the awards she garnered for that. Bryan Singer may have opted for the cast to not need to put on a fake front (given after all quite a method employed to transition from German to common English), and I felt that given the strong performances all round, it was whether to invest the time to instill that kind of discipline to speak with an accent, which may result in only marginal incremental in authenticity, or choose to forgo it since it's not going to drastically affect the narrative. So accent or not, it's a small issue really.The cast is a mouth watering one, which could also account for the appeal I suppose. Tom Cruise leads the ensemble cast, even if I found his physical defect of the lack of a hand and missing fingers somewhat distracting, because I always tend to stare at it, in wicked anticipation that the sleeve was cut too short, or if the CG guys left a tell-tale mark. And as mentioned, the cast is nothing but spectacular on paper - Bill Nighy, Tom Wilkinson, Terence Stamp (who seems to be in almost every supporting role these days), Eddie Izzard, Jamie Parker who played excellently the loyal Lieutenant under Cruise's von Stauffenberg, and with what I deem as cameos by Kenneth Branagh, as well as the grossly underused Carice van Houten who was also in another WWII-set film in Paul Verhoeven's Black Book.I suppose fans of Downfall would probably be interested to take a look at a key even that took place within Hitler's chain of command, that likely had sowed additional seeds of suspicion to the dictator leading to the final days of WWII. Save for the initial one-sided battle at the African front in the first few minutes of the film, the rest became a battle of the minds and resolve of its participants in a fierce power struggle. Definitely recommended for WWII buffs.",9.0,Anonymous,History
"Mediocre movie, and Cruise is hopelessly miscast as a Germanic aristocrat.  He simply cannot pull it off.","The review by Michael Malak in which he tells us how much this movie helps his 9 year old recognize ""Good Guys and Bad Guys"" is as unhelpful to us as seeing the movie is for his son. The Germanic peoples were not accidentally ""roped in"" to doing something against their will during World War II. And von Stauffenberg, though admittedly brave--as were all the plotters--was not a hero. (People who undertake extremely dangerous and risky schemes have to have courage, but that is different from heroism.)You have to remember that Germany started the war on September 1, 1939. The plot in this film came about after almost five years of atrocities and aggression. The whole idea popped into Stauffenberg's head not for ""humanitarian"" concerns or ""moral"" consciousness, but because the war was going very badly for the Germans. If Germany had been winning the war hands down, he never would have contemplated this. I worry that the Germans today, what with their monument to him and other plotters and such, are not inventing ""heroes"" so as to avoid the real lessons of history. The movie is also mediocre at best. 2 - 2½ stars.",5.0,Anonymous,History
A few editing errors!,"In at least one scene, when Colonel Stauffenberg is shaving, he suddenly has four fingers. I believe the same editing error occurs in two other places: toward the end, after being shot his hand is shown dripping blood. Apparently his wounds healed in this case as well. And possibly another time in a scene where he was carrying a weapon. Since when did German officers carry what looked to me to be Barettas? Everybody knows that the standard officer sidearm was a Luger. There was no mention of the role that Field Marshall Irwin Rommel played in the assassination attempt. It was an important part of history as I recall, and he did commit suicide after the attempt failure.Otherwise, I liked the movie a good deal, and consider it a must see, especially for WW II history buffs. My reaction toward Tom Cruise' performance was very favorable, and I believe he deserves some order of special recognition for it. Hence a very favorable rating.",8.0,Anonymous,History
"""Operation Valkyrie Is In Affect""","This movie was entertaining, to say the least. What I've noticed about IMDb, is that people are either very harsh, or very easy0going. Its either a vote of ten, or one. So I'm going to try and tell it as I saw it.The movie's scenes are very pleasing to watch, the Africa scene is pure eye candy, and helps explain Tom Cruises's injuries. Of course, Cruise plays Claus Von Stauffenberg, a com miter of high traitor. The good thing about the movie is that, despite the fact you know the ending, your attention is kept, and the suspension is always high!The other night, I was watching a German production called ""Operation Walkury"". Valkyrie seems to have taken whole chunks of script and scenes from this German production. This was disappointing to see that Hollywood is running out of ideas!All in all, a good movie, suspenseful, and very well acted. Highly recommended!",8.0,Anonymous,History
Interesting and recommendable,"Valkyrie a film based on real facts about a German Colonel Claus von Stauffenberg is a loyal officer who serves his country but that doesn't agree wit Adolf Hitler's ideologies. and along with other military men conceive a plan to kill him. It is a very good thriller with lots of drama and suspense. The story is very interesting and the plot is well developed. It is perfectly set on the 40's era, the costume design and the locations are excellent. Directed by Bryan Singer, he left behind the movies based on comics and manage a movie with a very high tension that make you stay on the edge of your seat. The cast is formidable, Tom Cruise delivers a very powerful and convincing performance as Colonel Stauffenberg, Tom Wilkinson as General Fromm is excellent, Terrence Stamp as Ludwig Beck although his role is a bit short, it is also very important and with a decent acting job. Kenneth Branagh, Eddie Izzard, and Bill Nighy were also very good in their respectively supporting roles. In conclusion, Valkyrie is a impressing movie that will keep you interested for two hours",8.0,Anonymous,History
Valkyrie,"A very bog standard war film, in which a better than average cast manage to elevate quite standard material.Bill Nighy shines, he always does, but other than that this just feels like Tom Cruise wanted to make a war film, and got his buddies around to do just that.Passable, and yet easy to pass over.",3.0,Anonymous,History
One of the best on WWII,"If you have a chance of seeing this movie, don't hesitate, I assure you this is a must see one, one of the best on WWII, could be the second after Downfall (2004). Everything in this movie is really good, starting from the story which is absolutely accurate to the second, moving on to the cast, where all the main & supporting cast made a really good job on this, although I don't like Tom Cruise a lot, but in this one, he did a real good job, along with all the others; which I believe cannot be listed as supporting cast! The motion picture soundtrack is really amazing and it sometimes makes you feel you're really at the events, especially the scene in ""Wolf's Lair"", my heart was beating so hard as if it was about to jump off my chest (it's not frightening at all by the way, just intense!) Many thanks to the sound composers! Also, the production was great & the costumes was accurate to the very last detail. Many thanks to each & every person involved in this masterpiece!I can't find words to describe this but all I can say that I was totally amazed that I kept talking about this movie for one whole week after seeing it!My vote 9/10",9.0,Anonymous,History
A nice film but an unachieved goal,"Satisfying general historical ambiance, all actor's crew- acting, shooting, photography, but main thing, the historical details were not clearly exposed - thus the foggy and undocumented historical evaluation of some 3rd Reich's officers resistance, against Hitler's murderer regime - clearly set it though, to the last year of Hitler's end... thing to say that is the least surprising from their part.The direction needed many more elements, we only saw Hitler's house to the Bavarian Alps (wolf's nest), some conspiring offices discussing about shooting Hitler and Valkyrie plan to proceed after, the Army Headquarters, some Ministery buildings -very well shot was that of Press, with all the telexes passing through. As for the military plan so called ""Valkyrie"" - the main story of film's plot, that scenario was very weak, so called vague and general...The all atmosphere of the film was very satisfying, but it produced only a taste - a very good indeed! of the really happened so discussed resistance of Hitler's generals - also known from Hitler's own words at his last moments when he was trying to be informed, and be conscious about the inevitable fall, ""I was surrounded by traitors"".",8.0,Anonymous,History
Extremely Enjoyable Movie,"I've been reading these comments complaining that Tom Cruise was emotionless - THAT'S HIS CHARACTER IN THE FILM!! The Germans INVENTED stoic emotionlessness.All the performances were fantastic, and as far as Cruise being a fish out of water, ANY high profile actor will look like that actor playing a part. Cruise is a guy who worked his way up to success and now that he's there, all the naysayers start yapping. These are the same people who don't want their friends to succeed and if they do, these people try and bring them down.And as far as Scientology, in a country that was founded on freedom of religion, WHO CARES!!! OK, so Cruise is too enthusiastic about life. Awwwwww, what a horrible trait. Maybe if we can beat him down a little (which is what these comments I read are trying to do) and maybe get him hooked on drugs or arrested you guys might like him more. Pathetic!",9.0,Anonymous,History
A decent work,"Though it's a sort of remake of the one released in 2004, its a fine remake.First of all, the directing and editing of the film is very good. I personally appreciate how the director managed every scene and how hard they tried to make the script as faithful as the history. They developed the plot carefully and avoided bored the audience.Second, The acting is good. As we know Tom Cruise is not an ideal actor for this important character, however, the rest of the others save the film. It's a please to watch so many talented actors working together.Third, the sound track is fantastic. Every piece suits the plot.The fatal fault of this film is the language(and multi-accents). However, thanks to this movie, many people get to know about the history.To conclude, I would recommend people to watch this movie and also take a look at the German edition. Though it's not an excellent remake, it's a watchable one.",8.0,Anonymous,History
Excellence,"I thoroughly enjoyed this film. But I must say, that I kept comparing the film to the 1989 made-for-TV film, with the late Brad Davis. The plot is minimal, and everyone knows how it will end. The conspirators failed, and Hitler survived the bomb.But there will never be enough credit given to the brave men and women who stood up to Hitler. And there needs to be more examination of the fact that the Allied governments in WW2, all recognized 'governments-in-exile"" of the occupied nations, but no Allied government recognized a 'government-in-exile' for Germany.The performance of Tom Cruise, is not one of his best, but the character of a decent man, comes through.",9.0,Anonymous,History
Complete rubbish,"Tom Cruise playing a German with a Hollywood accent, no attempt at historical accuracy or language - just more Hollywood nonsense and lies. Complete waste of time and money.",1.0,Anonymous,History
"Refreshing, exciting, old fashioned caper movie","If you're tired of Hollywood explosions, self conscious dialogue, weak attempts to please all audiences etc then you'll find Valkyrie a breath of fresh air. Its a relief to know that people like Bryan Singer are in the system, still daring (and having the power) to make great films in the tradition of those before.Valkyrie was immediately interesting and watchable due to its tight plotting, efficient script, and restraint. Its one of those films that you can actually enjoy whilst watching it, which I find rare these days. It doesn't rely on a big gimmick, climax or 'twist' to reward the viewer, it does it throughout with excellent performances and suspense.",9.0,Anonymous,History
After the initial shock of discovering that I was watching a film about German history with so many non-German speaking actors,"After the initial shock of discovering that I was watching a film about German history with so many non-German speaking actors, in English and directed by an American, I enjoyed the rather well-known plot of this assassination attempt and started to hope that, following the creative idea of Inglourious Basterds (2009), it would not lead to this poignant ending.",8.0,Anonymous,History
Suspenseful,"I dove into this movie without knowing what to expect (except for the fact that this was a WWII movie with Tom Cruise, he-he). We weren't taught in detail about the assassination attempts on Hitler, so I was curious to see what made this particular attempt a box office movie.Coming from a German background, it was a bit odd hearing the incorporated English accents in German history. But I tossed that aside and focused on the entire plot. With all honestly, I've seen Tom Cruise in better roles but he did put an ample amount of effort into Colonel Stauffenberg. I absolutely loved the ensemble cast. The entire story was gripping and I got extreme chills during the actual attempt scene.Overall, I think Valkyrie was quite enjoyable. The authentic feel of Nazi Germany and the officials were well executed, no pun intended.",8.0,Anonymous,History
