title,content,rating,username,genres
Valkyrie dramatically plotted to assassinate Hitler through a monotonously solid scheme.,"Operation Walküre was the last known attempt to overthrow the Nazi party, immediately stop National Socialism and assassinate the Third Reich himself, Adolf Hitler. An emergency continuity of government operations that planned to roll out Germany's Reserve Army to implement order in case of chaos ensuing the nation. Various German military officers however, were able to acquire the original plan and make certain amendments. These alterations would assist the attached conspirators in regaining control of German cities, the disarmament of the Schutzstaffel and the arrest of Nazi leadership. Yet these could only be actioned dependant on the successful assassination of Hitler.Suffice to say, as history would indicate to us, the plan was unsuccessful. However, that does not prevent Singer from re-telling the implementation of Walküre and highlighting the significance of painting various Nazi officials as morally conflicted humans. Colonel von Stauffenberg, having been severely injured during an air raid of P-40 fighter-bombers, rapidly became disillusioned with the future of a country he was once proud of. Him and various other military officials, including General Beck, General Olbricht and Dr. Goerdeler, questioned the tyranny that Hitler envenomated Europe with. And so, the proposition to utilise Operation Walküre in an attempt to overthrow the Nazi party was swiftly commissioned. This included the infamous July 20 plot, von Stauffenberg's assassination attempt by planting a detonation device within Hitler's Eastern Front military headquarters, ""The Wolf's Lair"".Valkyrie can simply be surmised in one word: solid. Much like the concrete foundations that the Nazi party believed their ideologies were constructed upon, Valkyrie's cold and meticulous approach works both in its favour and detriment. For the uninitiated, Valkyrie provides an important history lesson in World War II politics. War depictions, especially those manufactured in Hollywood, tend to bend the truth to insert some level of overburdening national patriotism. Singer, along with McQuarrie's conscientious screenplay, avoids that by embracing the history of Walküre, despite a few historical inaccuracies littered throughout. Audiences should know the outcome of Valkyrie even before deciding to watch the feature or not. It's history, and everyone should know the climactic events of the Second World War. McQuarrie precariously utilises the inevitability of Walküre's failure to embody a sympathetic motive within these characters. Culminating in a solemn third act that embellishes Stauffenberg's final cry. ""Long live sacred Germany!"".The preceding conversations of proposed political manipulation and operation planning, whilst succinctly entertaining, were monotonous throughout. The narrative's pace had no peaks or troughs. The re-enactment of the July 20 plot failed to conjure up any tension, as did the initial battalion attack. The story's inevitability could assign itself as the culprit, however it's more adorned to McQuarrie's minimal characterisation of von Stauffenberg that plagued its potential. The stellar British supporting cast, including Nighy, Wilkinson and Branagh, were able to fluctuate with their emotions. Nighy in particular was able to transition from professional stability to overwhelming frustration, all in a matter of seconds. Cruise (regardless of the Scientology protests...) was somewhat miscast, despite his profile resemblance to the real individual he was portraying. The stoic yet vigorous persona he opted for unfortunately weakened the gentile moments with his family, often exuding unconvincing emotional output. Again, the resonant third act redeems all these qualms, it just takes two thirds of a feature to connect with von Stauffenberg as a human. Honourable, albeit paper-thin. Also Hitler's portrayal, with Singer implementing low camera angles and a multitude of shadows, likened him to a Bond villain. Unusual to say the least.As mentioned before, Valkyrie is solid. Its slick production design, wholesome historical accuracy and competent supporting cast made this operation a successful depiction of rebellious Nazis. Frustratingly the central performance, one-note narrative tone and thinly detailed characterisation failed to explore the conflicting morality of military officials. The inner debate between right and wrong. Surmounting to the consequential question of ""what if...?"".",6.0,Anonymous,History
Solid WW II movie,There was a lot of suspense throughout the movie. The plot was solid though if you know a bit about history you already know how the movie is going to end. Really the only thing that bothered me about the whole movie was the fact that the main character Mr. Tom Cruise did not talk with any sort of German accent. This made it slightly less believable. I mean you would think that with almost everyone else in the movie having a German accent (almost not everyone did) that he would maybe extend his acting abilities and try to enhance his character by playing it with a German accent. Oh well you can't have it all...It is also a very educational film that encompasses many aspects of life that a soldier serving in the German army during WWII may have.Overall a good movie that I would recommend to anyone who likes a good movie even the non history buff types. (A few of my friends who know nothing about history said that they liked it after it was over). In fact those that are not aware of the ending may find this movie even more exciting then those that do.,8.0,Anonymous,History
"Certainly intense at times, but I wasn't fully satisfied like I should have been.","Let me just state for the record, that I find the Hitler era to be fascinating. I disliked Hitler's methods, I thought he was a ruthless human being, I didn't agree with his leading style, but the man was fascinating. Tom Cruise wasn't an issue for me, the man almost always delivers, the only thing I didn't like was he didn't put on an accent. This is not an action thriller, it's a carefully plotted suspense thriller, that moves slowly but surely with a great buildup to it, well some of the time anyway. My big gripe with Valkyre was I didn't get enough information as to why Stauffenberg was so intent on destroying Hitler. I mean I knew why, but I was really hoping for more emphasis on that, that's why I was so disappointed, even though I enjoyed many bits of it. The ending is not a fun one, in fact it's very powerful and saddening, it will hit you that's for sure.Bottom line. Valkyire is interesting and engaging at points, slow moving and disappointing at others. I craved more then what I got, and in the end I became only half full. It's well worth a look though.6 1/2 /10",6.0,Anonymous,History
The worst casting for a Nazi movie I have ever seen in my life. A cascade of British accents utterly destroys this movie's credibility.,"What in the name of all that is holy were these complete and utter fools thinking when they were doing the casting and the speech training for this movie? This is without a doubt the most laughable pile of crap I have ever seen, men dressed up as Nazis, speaking in British accents throughout the movie.. it's simply RIDICULOUS, unwatchable trash.There is no suspension of disbelief here to make you feel like you are watching Germans.. the majority of all the characters in the movie have thick British accents, it's simply the most stupid casting ever. Really, really, really bad. It's like watching a bad car crash.. you keep watching it to see how terrible it is.PLOT: Tom Cruise with no German accent plots with men with very heavy British accents who are supposed to be playing Germans to kill Hitler and take control of Germany. Unfortunately these men are apparently in Britain and retarded, as their accents show us repeatedly, in every single scene.This movie is an unintentional JOKE. Pathetic.",1.0,Anonymous,History
True heroes of the reich,"Well that's the phrase you'd rarely find in a sentence post 1945 but this movie is exactly about those people. Bryan Singer's accurate account of the events that led to Hitler's last known assassination attempt and beyond deserves all the credit in the film community there is to give. Fantastic performances, masterful cinematography, outstanding music score as well as the story that makes a difference - these are only the icing on the multilayered delicious cake called Valkyrie. There were, there are and there always will be people who are opposed to the present regime of the country; the word ""regime"" itself is a reason enough for people to rebel against and those few brave ones who stood out, went in and tried to overthrow the inhuman ones need to be known because true heroes have sadly no fame whatsoever and Valkyrie does its best to change that. Not a big fan of war movies but this I could watch over and over again; it reminds us that anything could be achieved if we're persistent, faithful, willing to change, and willing to wait too because all big dreams take time to come into reality.",10.0,Anonymous,History
What happend to German,It's great that there is American movie that shows the different side of Germany. I think Tom Cruise was solid but what bothers me is that there isn't a single one German actor and they all talk in English unlike Inglorious Basterds in which they speak 4 languages.,7.0,Anonymous,History
Operation Walkyrie,"""This motion picture is based on actual historical events and public records. Certain dialogue, events, and characters were created or combined for dramatization. Similarly, the chronology of some events has been compressed and/or edited for clarity.""The scene of the German 10th Panzer Division was shot in Victorville California, in the high desert near the U. S. NTC (National Training Center.) I was a tank mechanic there for a while in the Reserves.We all know that Tom Cruise is in the film but it is interesting to see how many other actors you recognize. See if you can spot Halina Reijn when she is all buttoned up. You will also notice that the music plays a character in the film. Occasionally the sound drowned out the dialog (a common movie mistake.)Lots of colors and no lame ersatz German accents.The basic story is this is the last of a series of attempts on Hitler by Germans. Each character has a different reason and idea about why. However, the bottom line is this is a suspenseful action movie with the results of dispatching Hitler.Adolf Hitler, ""The Valkyrie; handmaidens of the gods, choosing who will live and who will die, sparing the most heroic from an agonizing death. One cannot understand National Socialism if one does not understand Wagner.""I only saw this on Blu-ray so I cannot compare it to other presentations.Next read Homemade C-4: A Recipe for Survival by Ragnar Benson, just incase the situation should arise.",9.0,Anonymous,History
"Not a bad film, but a disappointment","It is no secret to anyone with a passing knowledge of 20th century history that Hitler did not die on the 20th July 1944, and so the suspense of Bryan Singer's new thriller about the assassination plot which failed on that date seems to be irreversibly compromised.It is strange therefore to report that there is some tension through the film, even though the ending is never in doubt. However, it is still a failure. There is a feeling with this film, much like Ed Zwick's ""Defiance"", that it should be better than it is  that this story merits a better film than the one it has ended up with.That is not to say that this is a bad film. The quality of the film-making is excellent throughout and there is little to complain about. It looks good, sounds good and is generally well put together. A lot has been made of the lack of continuity with the accents but, despite the fact there are occasional slips into German twangs from some, there is no distraction in the diversity and it is far less irritating than the thick accents which have become the norm in many films.The acting is very good. A number of liberties have been taken with the characters to make them heroic (von Stauffenberg, for instance, was in fact a raging anti-Semite), but there are still interesting figures here. Cruise's von Stauffenberg quickly becomes a fairly dull, generic hero (the fault of the writing and not the acting), but the outstanding supporting cast, which includes Ken Branagh, Tom Wilkinson, Terence Stamp, Christian Berkel and Thomas Kretschmann, always make the film watchable. There is a particularly impressive performance from Bill Nighy, whose General Olbricht is probably the most interesting character in the film.But the film never rises above the realms of simple, solid entertainment. It is by no means a dull two hours. In fact, the time flies by, but this never becomes truly thrilling. Perhaps it would have been better to have created more interest in the peripheral characters rather than the dull von Stauffenberg. One feels that there would have been more tension if you cared a bit more about the characters.3 Stars out of 5",7.0,Anonymous,History
classic movie,"When I sat down and watched this movie I found that it was an electrifying salute to Stauffenberg ,The German resistance and especially Germany . Stauffenberg was a phenomenal man one of my heroes , For his stand for Freedom standing up to Hitler and his evil Third Reich . This movie was also a great see for Lovers of Suspense and action you might even learn something . This movie had you following our heroes ,the Resistance for the whole thing and it had you on the edge of your seat . And when it was over at the heart-breaking end where they were executed I almost cried . This movie crafted great things movies could relate to History ,Action ,Suspense and a twist of drama and it's a true story . So that's it definitely a instant - classic May Germany grow and prosper and freedom thrive .(P.S Tom Cruise was great)",10.0,Anonymous,History
Great film-making and actors make this a tribute,"This film is a tribute to a group of unlikely heroes determined to end the tyranny of Adolph Hitlers Nazi regime at all cost, and in the end they paid the ultimate price. This is a story that 90% of the world knows little to nothing about but is a story of such great importance to the eventual outcome of World War II that to forget it would be akin to forgetting the events of Iwo Jima or D-Day. From that point on, Hitler was a paranoid wreck and the already shaky foundation of his psyche had been dealt a crushing blow when several of his most trusted allies plotted to end his life. This led to a decline in the strategic efficiency of the Nazi military and to a sense of distrust amongst the ranks of the Nazi hierarchy.The movie itself is presented beautifully with strong direction by Bryan Singer. Tom Cruise pulls off the role of Colonel Von Stauffennberg marvelously and much to my surprise he played the character off with much feeling and emotion.This is a definite must see for not just WWII buffs but for the everyday moviegoer as well.",8.0,Anonymous,History
"Historically interesting, but bad casting","I found Valkyrie to be historically interesting and well-told, but there were problems with the casting. Most of the people in the cast were fine actors, but the problem is that they picked some of the most English of the English actors -- people whose Englishness is central to their presence like Tom Wilkinson, Terence Stamp, and Bill Nighy, which makes for a strange contrast when we're asked to believe that they're German.My complaint isn't to do with accents: I'd much rather actors act in their native accent when playing foreign characters than speak English with a German accent, which is rather insulting to the audience. It's that the actors they chose are so quintessentially English.Tom Cruise did an OK job, I think. But I was frequently reminded of his character in ""The Firm"". It was a very similar role when you look at what's really going on in both movies.",7.0,Anonymous,History
There is a much better dramatisation of this subject,"If I compare and analyse the 2008 Valküre with the 2004 Stauffenberg then I think Cruise and Co. lost their time and what is even worse my time. In my eyes, they created a worser film than existed before, which means they went back instead of making progress, which one can expect.In the 2004 Stauffenberg, the leading actor Sebastian Koch portrays the character much more convincing for me than the self proclaimed scientologist. This 2008 specimen lacks depth and is too simplistic. I mean Americans get one year of history in high school, so most of the viewers will indeed be satisfied for what they ""learn"". If of course one is educated, one will be finding this film too Hollywoodean. This is why I think it is a waste of one's money to expect much from this piece.",1.0,Anonymous,History
Flawed but Interesting,"Valkyrie (2008)*** (out of 4)Highly flawed but entertaining drama centered around Colonel Claus von Stauffenberg (Tom Cruise) and other high ranked German officials who try to hatch a plot to kill Hitler. This is a rather strange movie to get into because for the first hour I was rolling my eyes at a lot of the stuff going on but once the day of the assassination attempt went into effect the movie picked up a lot of steam and for that final hour I found myself caught up in the story and entertained. I think a better movie could be made of the subject but in the end I think the producers were just trying to capture a popcorn movie and on that level they succeeded. I think one of the biggest flaws are the English and British accents being used for the German characters. I understand they couldn't have the actors speaking in German as that would have killed the box office returns here but there's really no excuse to not having German accents. This is especially true for Hitler who just comes off rather nerdy here instead of the terrifying figure he really is. I couldn't help but roll my eyes a few times when he was speaking because it just didn't have that flair that comes from what we're use to seeing from him. The message of the film, and those doing the mission, was to inform people that not every German was a follower of Hitler. That's loud and clear but I must admit that the plot seems to have been watered down or sugar coated because the film plays the assassination plot rather simple because there's never a problem getting close to the main and everyone involved speaks openly about their mission. With all of that said, the final hour contains some nice suspense considering we know how the film ends. It also pays nice respect to the men risking their lives to try and end the tortures being brought by Hitler. The look of the film is very realistic but I will say the English accents sometimes take away from the authenticity. The performances are all decent with the exception of Cruise who just doesn't fit this role. Cruise is one of my favorite actors but I had a very hard time believing him in this role even though it was clear he was giving it his all. Kenneth Branagh and Tom Wilkinson offer up good performances in their few scenes. In the end I think it's best not to take this film overly serious and instead just sit back, have some popcorn and enjoy the story. There are a lot of flaws with the film but I guess that should have been expected considering what the producers were aiming for.",,Anonymous,History
A common film based upon a real story,"There are too many World War II films in the cinema history. But it should be differed from the others by the story. Because, most of them are shaped around war tactics, strategies and struggle scenes with blood and gun. Any other facts from this direction are common for me. Directory, Directory of photography, music etc. don't become felt strongly. Characters excluding Tom Cruise don't shine as deserving to Cast's powerful elements. Such an interesting story would be reflected to cinematography according to me. I think, the director and the writer didn't show an amazing effort and they had a simple way to create a film. One important reason to watch it, may be how great organizations contain such great ambitions,fights for the sake of leadership or willing to have decision mechanism.",7.0,Anonymous,History
very well done and meticulous re-creation of events,"I just came out of watching this movie five minutes ago, and wanted to jot down some quick notes on my immediate impression of the film.This is an excellent portrayal of the events leading up to an including the attempted assassination of Hitler in the summer of 1944.For those viewers who are interested in the history of WWII, they will find that this has been a meticulous re-creation of events. Too often, these types of movies--for the sake of ""dramatization""--obscure, ignore, or outright distort the historical record. There is very little, if any, of that here.I suspect the screenwriters closely followed the history of this as depicted by William Shirer in his excellent ""Rise and Fall of the Third Reich"".Too often this event has been relegated to a footnote of history. One of the things the movie tries to impress on the viewer is the incredible courage of the conspiracy members. I have read some reviews where the reviewers whine about the ""darkness"" of the movie. But it must be remembered that the conspirators knew that this was a desperate attempt to save Germany and stop World War II, and that there was only a slight chance of success. It is to the credit of the German Resistance Movement---too often dismissed by historians and even FDR himself--that they realized the evil of Hitler and tried to do something about it.Cruise is quite good as Stauffenberg, and the British actors do an excellent job depicting the German co-conspirators.I would urge others to see this movie, and especially young people. The movie has not only a historical lesson to teach, but a lesson in morality and courage in the face of tyranny. It is a lesson still pertinent today.We also need to show Hollywood that there is a demand for good weighty movies such as this, and not only for the escapist mind-candy that so often appears at your local cinemaplex.",9.0,Anonymous,History
An okay political spy historical thriller.,"""Valkyrie"" sure isn't the greatest film you will ever see, yet it's not the worst as it has plenty of drama and suspense and the plot is filled with intrigue and intense feelings to make any film fan and history buff interested. Star Tom Cruise who isn't the star he used to be still is very adequate here in this role of Col. Claus Von Stauffenberg who during his command time of WWII decides to plot an assassination attempt of the ruthless and evil German ruler Hitler. As you watch the film if your looking for lots of action you will be disappointed, as it's focus and most scenes deal with behind the scenes workings and overthrowing of a secret plan to disguise a government with the end plans leading them to Hitler. Yet any history buff of those times of WWII and those who know German times along with Hitler history will understand the film well. That said I don't want to give away to much info. Overall this is nothing great yet the plot and planning of the film's story is interesting and keeps enough intrigue and drama to make it a view for most history buffs.",7.0,Anonymous,History
Highly suspenseful and worth the movie ticket,"I saw this movie yesterday and thought it was one of the best movies I have seen in a very long time. The story was good and the acting, by all, was superb. Even tho you knew the outcome, it was still was suspenseful and sometimes put you on the edge of your seat. The theater was crowded and kudos to Tom Cruise. He and all involved in making this movie, deserve a good turn out. It made me get by book, The Bunker, out and am now reading it again. It also reminds us that many, many Germans were not like the SS and the Nazis that were involved in the holocaust. The plot moves right along and you are never bored; sometimes found my heart racing! The information listed, just before the credits, was very helpful in letting the audience know what the final outcome was for those that participated in the attempt to assassinate Hitler. Spooky how the actor looked like Hitler! Highly recommend this movie!",10.0,Anonymous,History
